date,user,comment
08-08-2019T00:19:53,Mikemkke034,Lol
08-08-2019T00:19:57,Mikemkke034,That was a nice stream
08-08-2019T00:20:07,Mikemkke034,"Anyways, g'night!"
08-08-2019T00:20:58,SpazztasticKiwi,and they finally finité
08-08-2019T00:21:46,SpazztasticKiwi,"lord if you talk to anyone else normally, it’s like you drop off the face of the earth for a nice 5 hours when they’re going"
08-08-2019T01:07:12,SpazztasticKiwi,I just saw someone call kissing “lip guitar”
08-08-2019T03:40:09,SniperJackal,@CrimsonQuill I kinda got a bit addicted to watching RvB
08-08-2019T03:40:30,SniperJackal,the jokes keep getting better
08-08-2019T03:43:15,SpazztasticKiwi,🛌
08-08-2019T03:56:10,SpazztasticKiwi,nite Tom
08-08-2019T04:10:10,CrimsonQuill,Good morning all
08-08-2019T04:36:21,SniperJackal,morning quill
08-08-2019T04:36:46,CrimsonQuill,@SniperJackal just read through the chat...what season are you on?
08-08-2019T04:37:26,SniperJackal,right now watching episode 100
08-08-2019T04:37:34,CrimsonQuill,Ah...
08-08-2019T04:37:42,CrimsonQuill,The end of the Blood Gulch Chronicles.
08-08-2019T04:37:54,SniperJackal,I havent finished yet but it is interesting
08-08-2019T04:37:56,SniperJackal,anyways
08-08-2019T04:38:02,CrimsonQuill,"After that, you'd best go for 'Out of Mind' and 'Recovery One' Mini-series."
08-08-2019T04:38:19,CrimsonQuill,Because otherwise the start of season 6 might not make so much sense.
08-08-2019T04:38:22,CrimsonQuill,It happened to me.
08-08-2019T04:38:24,SniperJackal,I was dying at the part where Doc 'examined' grif s sister
08-08-2019T04:38:31,CrimsonQuill,Oh God....
08-08-2019T04:38:39,CrimsonQuill,And Tucker kept trying to get in....
08-08-2019T04:38:51,CrimsonQuill,I think Doc genuinly WAS examining her...and was just oblivious.
08-08-2019T04:38:58,SniperJackal,doc is too pure
08-08-2019T04:39:01,CrimsonQuill,The armour on the floor sells it.
08-08-2019T04:39:03,SniperJackal,just like caboose
08-08-2019T04:39:05,CrimsonQuill,XD
08-08-2019T04:39:23,CrimsonQuill,And of course...Before that...well...
08-08-2019T04:39:30,SniperJackal,bow chicka wow wo
08-08-2019T04:39:31,CrimsonQuill,Pelican squash.
08-08-2019T04:39:31,SniperJackal,w
08-08-2019T04:39:37,SniperJackal,yep poor donut
08-08-2019T04:39:49,CrimsonQuill,Down into the hole.
08-08-2019T04:41:13,SniperJackal,I should take more inspiration from caboose
08-08-2019T04:41:28,SniperJackal,just be in my own world hahah
08-08-2019T04:42:21,CrimsonQuill,'So it is a sword. It just happens to function like a key in very specific situations.'
08-08-2019T04:42:56,CrimsonQuill,'Ooooor....Maybe...it's a key all the time...and when you stick it in people...it unlocks their death.'
08-08-2019T04:44:28,SniperJackal,ah Caboose
08-08-2019T04:44:58,CrimsonQuill,My boy
08-08-2019T04:47:09,SniperJackal,Caboose s mindscape is the best thing ever
08-08-2019T04:47:43,CrimsonQuill,"Oh, you ain't seen nothin' yet."
08-08-2019T04:49:58,SniperJackal,Just hang em high
08-08-2019T04:50:02,SniperJackal,you know
08-08-2019T04:50:10,SniperJackal,big and empty
08-08-2019T04:50:23,js199456,Hey guys
08-08-2019T04:50:32,CrimsonQuill,Hullo
08-08-2019T04:51:13,js199456,no new pages for a while :(
08-08-2019T04:51:21,js199456,has something happened?
08-08-2019T04:51:51,SniperJackal,yeah
08-08-2019T04:51:54,SniperJackal,not really
08-08-2019T04:51:57,CrimsonQuill,I don't know
08-08-2019T04:52:01,SniperJackal,I think tom is just a bit tired
08-08-2019T04:52:14,SniperJackal,and not in the mood
08-08-2019T04:52:33,SniperJackal,thats my guess
08-08-2019T04:53:04,js199456,shrugs
08-08-2019T04:54:20,Bgrmystr2,or maybe he had a bunch of conventions this month
08-08-2019T04:54:31,CrimsonQuill,Hullo Bgr
08-08-2019T04:54:35,Bgrmystr2,"or, last month rather"
08-08-2019T04:54:40,Bgrmystr2,and he's been catching up since then
08-08-2019T04:54:45,CrimsonQuill,That would take it out of one.
08-08-2019T04:54:47,Bgrmystr2,and we all knew this would happen
08-08-2019T04:54:52,Bgrmystr2,so it's not a surprise
08-08-2019T04:55:02,Bgrmystr2,and hello quill
08-08-2019T04:56:52,CrimsonQuill,:ptv-victory:
08-08-2019T05:07:38,SniperJackal,ok finished episode 100
08-08-2019T05:07:58,CrimsonQuill,Your are powering through it.
08-08-2019T05:08:07,CrimsonQuill,It's a heavy message isn't it?
08-08-2019T05:08:15,SniperJackal,Yep
08-08-2019T05:08:29,SniperJackal,I just watch it when im bored
08-08-2019T05:08:42,SniperJackal,and thats almost all the time hahah
08-08-2019T05:09:58,SniperJackal,welp time to watch the mini series now I guess
08-08-2019T05:11:01,CrimsonQuill,Yes indeed.
08-08-2019T05:11:09,CrimsonQuill,"Dammit, I missed showing my brother season 3 last night"
08-08-2019T05:11:23,CrimsonQuill,I might just put seasons 3 and 4 on together for him
08-08-2019T05:11:28,CrimsonQuill,While I draw my Halo OCs
08-08-2019T05:13:30,SniperJackal,good luck
08-08-2019T05:13:43,CrimsonQuill,:)
08-08-2019T05:13:50,CrimsonQuill,I finished my OC Bailey's armour
08-08-2019T05:13:54,CrimsonQuill,Now I have to colour it in
08-08-2019T05:14:02,SniperJackal,watching RvB reminds me of last year when I first read twokinds
08-08-2019T05:14:12,SniperJackal,pretty much binging it
08-08-2019T05:14:14,CrimsonQuill,"It has a modified design of Fred's chestpiece, an EOD Helmet, and MK VI Arms and Legs"
08-08-2019T05:14:23,CrimsonQuill,@SniperJackal I'm fairly new too
08-08-2019T05:14:24,SniperJackal,and then being depressed when I finished it
08-08-2019T05:14:30,CrimsonQuill,I only read it December 2017
08-08-2019T05:14:44,SniperJackal,I did it in september last year I think
08-08-2019T05:14:47,CrimsonQuill,And binged chapters 11-19 on a thursday afternoon
08-08-2019T05:14:55,CrimsonQuill,I became a patron June last year
08-08-2019T05:15:04,CrimsonQuill,ANd started trying for crossover stuff
08-08-2019T05:15:08,SniperJackal,Im considering doing that to at somepoint
08-08-2019T05:15:09,CrimsonQuill,Before settling on Halo Raine
08-08-2019T05:15:16,SniperJackal,oh yeah that would be nice
08-08-2019T05:15:30,CrimsonQuill,She became a reality in December last year
08-08-2019T05:15:40,CrimsonQuill,And that's how my Halo fanon started
08-08-2019T05:15:57,SniperJackal,anyways at least watching RvB isnt as emotionally exhausting as Twokinds was
08-08-2019T05:16:10,SniperJackal,thats why I dont reread twokinds as much
08-08-2019T05:16:21,CrimsonQuill,Mate...you haven't seen half of it...
08-08-2019T05:16:36,CrimsonQuill,And let me tell you...it becomes heavy later on...
08-08-2019T05:16:54,CrimsonQuill,I don't know how many times I've reread Twokinds.
08-08-2019T05:17:03,CrimsonQuill,It's the fourth time this year.
08-08-2019T05:17:13,CrimsonQuill,'Stranded' chapter.
08-08-2019T05:17:19,CrimsonQuill,One of my favourites.
08-08-2019T05:18:19,CrimsonQuill,'I'm the bait.' It has to be one of the most brilliant moments in the comic.
08-08-2019T05:18:32,SniperJackal,oh yeah I remember that
08-08-2019T05:18:39,SniperJackal,when red smacked zen with a rock
08-08-2019T05:19:13,CrimsonQuill,Just brilliant for how they managed to plan it right under his nose.
08-08-2019T05:19:32,CrimsonQuill,"And of course, it has my favourite character in prominence..."
08-08-2019T05:19:41,CrimsonQuill,Plus any scene with Nat and Keith.
08-08-2019T05:20:02,CrimsonQuill,He just has a modified version of my accent in my head...I can pack in so much. It's a laugh!
08-08-2019T05:20:25,CrimsonQuill,What's your favourite moment in the comic?
08-08-2019T05:20:32,CrimsonQuill,@SniperJackal
08-08-2019T05:21:26,SniperJackal,oh thats a tough question
08-08-2019T05:21:40,CrimsonQuill,I asked it because I can't pin one down myself
08-08-2019T05:21:45,CrimsonQuill,Not at present anyhow
08-08-2019T05:21:50,SniperJackal,Oh I never thought about how my voice sounds in my head
08-08-2019T05:22:06,CrimsonQuill,Keith for me always has a British Accent.
08-08-2019T05:22:11,CrimsonQuill,As do all the Basitin.
08-08-2019T05:22:20,SniperJackal,Yeah
08-08-2019T05:22:23,CrimsonQuill,My accent is British with a very slight Irish twang.
08-08-2019T05:22:29,CrimsonQuill,So I just...went with it.
08-08-2019T05:22:36,SniperJackal,I mean the king s surname adelaide
08-08-2019T05:22:40,SniperJackal,is adelaide
08-08-2019T05:22:50,SniperJackal,and her daughter is madelyn
08-08-2019T05:22:51,CrimsonQuill,"I remember thinking at the start, 'He looks like he'd have a British accent-I'll give him one'."
08-08-2019T05:22:55,CrimsonQuill,And it went from there.
08-08-2019T05:23:04,CrimsonQuill,Best decision for the comic.
08-08-2019T05:23:15,CrimsonQuill,Besides a hundred other decisions
08-08-2019T05:23:18,SniperJackal,I never thought about the voices
08-08-2019T05:24:25,SniperJackal,"but as for my favourite moment, probably trace revealing himself at edinmire"
08-08-2019T05:24:55,CrimsonQuill,Chilling...Ominous...Magestic...and Determined.
08-08-2019T05:25:05,CrimsonQuill,The expressions are...beautiful.
08-08-2019T05:25:16,SniperJackal,it was badass
08-08-2019T05:25:56,SniperJackal,Im kind of a sucker for any trace related stuff
08-08-2019T05:27:20,CrimsonQuill,"An earlier (put to the side till I get the RaineXRed one up) suggestion I had in mind is Trace as a Jedi, fighting his dark side as a sith-Templar! Trace."
08-08-2019T05:27:48,CrimsonQuill,"Because in his head at the moment, he must have been fighting himself every step of the way to maintain control."
08-08-2019T05:46:45,TerraTheWizard,:ctwokinds-kingtea:
08-08-2019T06:03:48,CrimsonQuill,:]
08-08-2019T06:15:12,SniperJackal,"random fact that I learned, Adelaide is a place in Australia"
08-08-2019T06:16:22,CrimsonQuill,Oh cool.
08-08-2019T06:16:55,SniperJackal,so I guess her accent would be australian /s
08-08-2019T06:22:21,TerraTheWizard,i've said this for a good while
08-08-2019T06:22:37,TerraTheWizard,that i can't read maddie's full name not in an aussie accent
08-08-2019T06:23:28,SniperJackal,hahah
08-08-2019T07:16:09,CrimsonQuill,Umm...King Adelaide sounds like a Margret-Thatcher type accent to me.
08-08-2019T07:16:27,CrimsonQuill,With a bit of something else thrown in.
08-08-2019T08:13:02,SniperJackal,"Yeah I agree, I was just kidding"
08-08-2019T08:13:13,SniperJackal,I cant imagine adelaide with an australian accent
08-08-2019T08:14:10,RimaDraws,hiii
08-08-2019T08:14:25,SniperJackal,hullo
08-08-2019T08:15:49,CrimsonQuill,Hi Rima
08-08-2019T08:22:41,RimaDraws,how is all
08-08-2019T08:34:29,SniperJackal,bored
08-08-2019T08:37:22,SniperJackal,and editing
08-08-2019T08:52:51,Mikemkke034,Hey
08-08-2019T09:13:07,IronHorseComics,*lurks in the distance*
08-08-2019T09:52:55,AspiringNoodle,"Remember kids, always turn your smartphone off every once in a while, or screwy things can happen"
08-08-2019T09:53:16,AspiringNoodle,Just spent the past 5 minutes trying to get into my phone because it didn't want to show the lock screen xD
08-08-2019T09:57:18,AspiringNoodle,"Also, I was right about my one parts delivrey"
08-08-2019T09:57:22,AspiringNoodle,delivery*
08-08-2019T09:58:00,AspiringNoodle,"Estimated delivery is still monday, but the latest update is ""Out For Delivery Today"""
08-08-2019T10:00:19,AspiringNoodle,"And RIP that poor delivery person. All 3 orders got the same update at 7:16.  That poor person is going to have to move a total 57.3 lbs for my delivery, and the one package is 37.6 lbs"
08-08-2019T10:03:32,Mikemkke034,Oof
08-08-2019T10:03:46,Mikemkke034,All I have is a shirt coming Monday. That's it
08-08-2019T10:03:58,Mikemkke034,A simple lb or two
08-08-2019T10:04:22,AspiringNoodle,Yeeeeeeaaaaaaaaah
08-08-2019T10:04:32,AspiringNoodle,That case is legit 30 lbs or so itself
08-08-2019T10:04:39,Mikemkke034,Damn
08-08-2019T10:04:46,AspiringNoodle,Not too surprising considering it's damn near a full tower
08-08-2019T10:05:03,Mikemkke034,Fair enough. What kind of case?
08-08-2019T10:05:19,AspiringNoodle,https://pcpartpicker.com/list/xGtDpG
08-08-2019T10:05:24,AspiringNoodle,Everything is listed :D
08-08-2019T10:06:03,Mikemkke034,Nice!
08-08-2019T10:06:20,AspiringNoodle,So right now is fun
08-08-2019T10:06:26,Mikemkke034,"Just a tad out of my price range, but I actually understand it all"
08-08-2019T10:06:35,AspiringNoodle,I'm waiting on a response from my boss about coming in today
08-08-2019T10:06:46,Mikemkke034,I have to go in at 12
08-08-2019T10:06:47,AspiringNoodle,I don't want to turn off my phone just in case it doesn't want to come back to life
08-08-2019T10:06:58,AspiringNoodle,And I want to help the delivery person when they arrive because jesus
08-08-2019T10:08:16,Mikemkke034,I feel ya
08-08-2019T10:08:22,AspiringNoodle,"I wanted to finish playing Omikron before the new computer arrived too, just so I didn't have to do the funny stuff to get it to work again"
08-08-2019T10:08:33,AspiringNoodle,But I haven't touched it because of this rpgmaker game xD
08-08-2019T10:08:39,Mikemkke034,Lol
08-08-2019T10:08:53,AspiringNoodle,"Btw, apparently I'd be a fan of the old-school final fantasy / Chrono Trigger games"
08-08-2019T10:09:06,Mikemkke034,Hmm
08-08-2019T10:19:42,AspiringNoodle,"Alright, no work today"
08-08-2019T10:19:55,AspiringNoodle,"I can help that poor delivery person, assuming I'm on point when they arrive :D"
08-08-2019T10:23:01,Mikemkke034,Good luck with that!
08-08-2019T10:23:32,AspiringNoodle,Holy shit.  Epic Games just pulled the most good guy move possible since they've started pissing off the gaming community
08-08-2019T10:24:17,Mikemkke034,That being?
08-08-2019T10:24:23,AspiringNoodle,No loot boxes on their store
08-08-2019T10:24:32,Mikemkke034,Go EG
08-08-2019T10:24:47,Mikemkke034,One step in the right direction
08-08-2019T10:25:07,AspiringNoodle,Gonna watch a video covering the news to get all the details
08-08-2019T10:25:18,AspiringNoodle,Also fuck activision ;D
08-08-2019T10:25:25,Mikemkke034,Agreed
08-08-2019T10:25:39,Mikemkke034,Though I do like CoD
08-08-2019T10:25:52,AspiringNoodle,"Apparently to pair with the good news, Activision proved how scummy they are yet again"
08-08-2019T10:26:08,Mikemkke034,How so
08-08-2019T10:26:14,Mikemkke034,This time
08-08-2019T10:26:18,AspiringNoodle,"The video suggests a new pay-to-win element in BO4 and a new, more expensive, anti-dupe loot crate"
08-08-2019T10:26:31,AspiringNoodle,"Like, Bobby Kotick, plz fucking die in a plane crash"
08-08-2019T10:26:43,AspiringNoodle,I'll throw a giant party convention to celebrate.  All gamers are welcome to attend
08-08-2019T10:27:15,Mikemkke034,I'll attend
08-08-2019T10:27:54,AspiringNoodle,"No joke, back in the 2000's he said that he was bringing in people to explicitly take the fun out of game development"
08-08-2019T10:28:07,Mikemkke034,Seriously
08-08-2019T10:28:16,AspiringNoodle,"Not sure if the statement was intentional or a slip, but given how Activision [Blizzard] has gone under his command, I'm not surprised"
08-08-2019T10:28:56,Mikemkke034,Lol
08-08-2019T10:29:04,AspiringNoodle,From a Kotaku Article:
08-08-2019T10:29:14,AspiringNoodle,"Most notorious was a late 2009 comment he made that seemed to cement his position as more Vader thank Luke. No, he said today, he didn't mean to sound like, his words, ""a dick."""""
08-08-2019T10:29:22,AspiringNoodle,"In September he had told a group of investors: ""The goal that I had in bringing a lot of the packaged goods folks into Activision about 10 years ago was to take all the fun out of making video games."""
08-08-2019T10:29:55,Mikemkke034,Damn
08-08-2019T10:31:19,AspiringNoodle,"""I don't know how this happened, but all my life I was the rebel flying the Millennium Falcon or the X-Wing fighter and suddenly I wake up and I'm on board the Death Star."""
08-08-2019T10:31:32,Mikemkke034,"Well, gtg. Off to work"
08-08-2019T10:31:46,AspiringNoodle,Reality called.  You were never a rebel.  You were always a damn Storm Trooper working to climb the ranks.
08-08-2019T10:32:02,AspiringNoodle,These CEO's are so damn delusional
08-08-2019T10:32:18,AspiringNoodle,And have fun makin' that bacon
08-08-2019T10:38:57,Mikemkke034,Will do
08-08-2019T11:18:49,AspiringNoodle,My stuff has arrived
08-08-2019T11:18:57,AspiringNoodle,"And now I got like 20 youtube videos to watch, lol"
08-08-2019T11:37:21,AspiringNoodle,"Haven't even started building yet, and the anxiety is already mounting xD"
08-08-2019T11:56:26,TeapotOfDoom,Hi there
08-08-2019T11:57:03,TeapotOfDoom,Go noodle :ctwokinds-rainehappy:
08-08-2019T11:57:30,TeapotOfDoom,Has everything arrived or are you still missing stuff?
08-08-2019T12:02:30,AspiringNoodle,Everything here
08-08-2019T12:02:57,AspiringNoodle,More or less I'm trying to finish up this youtube backlog before I start
08-08-2019T12:03:13,AspiringNoodle,And move save data for games over to a thumb drive before I move over to the new system
08-08-2019T12:03:38,SomeNiceUser,Good idea.
08-08-2019T12:03:52,SomeNiceUser,"Also, hi guys!"
08-08-2019T12:04:41,AspiringNoodle,"Oh yeah, forgot to mention"
08-08-2019T12:04:48,AspiringNoodle,No Aorus 2070 super available
08-08-2019T12:04:54,AspiringNoodle,So I guess that's good xD
08-08-2019T12:05:04,SomeNiceUser,That sucks.
08-08-2019T12:06:02,SomeNiceUser,I’m just looking through Tom’s sketches. Brutus fluffy boi
08-08-2019T12:06:34,SomeNiceUser,lol
08-08-2019T12:07:13,AspiringNoodle,He is fluffiest of bois
08-08-2019T12:09:17,SomeNiceUser,Indeed.
08-08-2019T12:10:40,TeapotOfDoom,So which one did you go with?
08-08-2019T12:11:15,AspiringNoodle,"gigabyte's gaming OC, one of the only cards available for MSRP, lol"
08-08-2019T12:11:22,AspiringNoodle,I'm surprised nobody wants it
08-08-2019T12:20:15,TeapotOfDoom,Interesting
08-08-2019T12:20:35,TeapotOfDoom,Well maybe it's not a premium enough card for people do go for it
08-08-2019T13:54:36,Mikemkke034,It's so hot
08-08-2019T13:55:26,Mikemkke034,34 C
08-08-2019T15:07:07,RimaDraws,back for now
08-08-2019T15:08:38,AspiringNoodle,*yawn* that was a nice nap
08-08-2019T15:08:48,AspiringNoodle,"I wonder when I'm actually going to get around to building the PC, lol"
08-08-2019T15:18:47,Mikemkke034,Lol
08-08-2019T15:20:03,AspiringNoodle,I didn't expect two of the parts to come until monday
08-08-2019T15:20:13,AspiringNoodle,Do you know how big my youtube backlog is because of that rpg?!?
08-08-2019T15:20:25,tehbear,you ordered them all from different shops?
08-08-2019T15:21:32,tehbear,rpg?
08-08-2019T15:21:33,AspiringNoodle,"Nope.  But two of the shipments came from NJ, and the one was from the other side of the country in CA"
08-08-2019T15:21:55,AspiringNoodle,The one I've been playing for a bit.  There's this program called RPGmaker
08-08-2019T15:22:54,AspiringNoodle,I've more or less learned that I'd like older titles like Chrono Trigger and Final Fantasy :3
08-08-2019T15:23:01,tehbear,are you making games with it? iirc its for jrpg style games.
08-08-2019T15:25:31,AspiringNoodle,"Nope, playing games made with it"
08-08-2019T15:25:42,AspiringNoodle,Which is why I said I'd like those titles xD
08-08-2019T15:27:50,tehbear,Chrono Trigger is great. Played it on snes emulator back in 2003
08-08-2019T15:38:45,CrRAR,:ctwokinds-nibsbounce:
08-08-2019T15:47:36,TerraTheWizard,:ctwokinds-nibsbounce:
08-08-2019T15:47:54,tehbear,:ctwokinds-nibrun:
08-08-2019T15:48:16,CrimsonQuill,Night all
08-08-2019T15:48:24,CrimsonQuill,:ptv-victory::ptv-sleepy::ptv-sleepy:
08-08-2019T15:55:01,AspiringNoodle,My caster is pretty isolated.  The Magihound in particular has PDef debuffs and ATK buffs
08-08-2019T15:55:05,AspiringNoodle,RIP
08-08-2019T15:55:47,IronHorseComics,*returns with chickens to consume*
08-08-2019T16:00:31,RimaDraws,o.o
08-08-2019T16:00:46,AspiringNoodle,You gots a problem with chicken?
08-08-2019T16:04:59,IronHorseComics,"no, that's why i'm eating them"
08-08-2019T16:05:27,tehbear,:ctwokinds-natsducky:
08-08-2019T16:05:36,IronHorseComics,with french fries
08-08-2019T16:05:53,IronHorseComics,and a cookie
08-08-2019T16:08:21,tehbear,as long as theyre not chickens from Traces mansion it should be ok
08-08-2019T16:09:26,IronHorseComics,of course
08-08-2019T16:23:51,TeapotOfDoom,mmm yes
08-08-2019T16:23:57,TeapotOfDoom,enslaved chicken
08-08-2019T16:24:08,AspiringNoodle,Tonight's dinner
08-08-2019T16:24:15,AspiringNoodle,Caesar salad and BBQ wings :D
08-08-2019T16:24:33,TeapotOfDoom,i just consumed some members of that species as well
08-08-2019T16:24:41,AspiringNoodle,"I would get hot wings, but from what I remember, this place does their sauce differently"
08-08-2019T16:24:48,TeapotOfDoom,kfc never lets you dow
08-08-2019T16:25:08,TeapotOfDoom,also had some freshly made mini doughnuts
08-08-2019T16:25:30,TeapotOfDoom,now i'm listening to queen in my hotel room and thinking about what i might do
08-08-2019T16:26:20,AspiringNoodle,"The wings clearly have sauce on them, but it doesn't seem to stick :ptv-wondering:"
08-08-2019T16:27:32,AspiringNoodle,Good god
08-08-2019T16:27:44,TeapotOfDoom,what up?
08-08-2019T16:27:55,AspiringNoodle,"At this rate, I'm going to need to mark all these youtube videos as ""watch later"""
08-08-2019T16:28:10,AspiringNoodle,It's gonna take me hours to get through everything
08-08-2019T16:28:17,AspiringNoodle,And I want to build a computer now ._.
08-08-2019T16:28:35,TeapotOfDoom,getting videos faster then you can watch em?
08-08-2019T16:28:45,TeapotOfDoom,do it
08-08-2019T16:28:59,TeapotOfDoom,*channels inner palpatine*
08-08-2019T16:29:26,TeapotOfDoom,execute instruction 0x66
08-08-2019T16:30:58,AspiringNoodle,I've been sucked into an RPG for the last week or so
08-08-2019T16:31:11,AspiringNoodle,So I've been queueing up more videos than I've been watching xD
08-08-2019T16:31:46,AspiringNoodle,"I want to say I also need to reevaluate the channels I watch, and whether I need to watch all these videos or not, but I can't really answer that because it's not my routine"
08-08-2019T16:33:39,TeapotOfDoom,why not build the new pc and watch it on that?
08-08-2019T16:37:50,AspiringNoodle,"That's what I'm thinking of doing, lol"
08-08-2019T16:37:59,AspiringNoodle,"First I need to eat, and then I have no idea how long this will take"
08-08-2019T16:45:11,TeapotOfDoom,you don't have watercooling right?
08-08-2019T16:45:27,TeapotOfDoom,and i guess it's your first time doing this
08-08-2019T16:45:46,TeapotOfDoom,so i would guess between two or three hours should do it
08-08-2019T16:47:38,AspiringNoodle,"2nd time, actually"
08-08-2019T16:47:47,AspiringNoodle,"The first time with this case took me all day, lol"
08-08-2019T16:47:54,AspiringNoodle,In part because this case is not a good case xD
08-08-2019T16:48:13,AspiringNoodle,And also because I didn't do research on assembly :P
08-08-2019T16:51:50,TeapotOfDoom,ok then the time should be about the same
08-08-2019T17:39:05,TeapotOfDoom,I'm tired. Have a nice stream everyone! Night! :ctwokinds-RainezZz:
08-08-2019T17:57:39,NibblyBot,New Patreon Post: Kat and Nora - Love Talk https://www.patreon.com/posts/kat-and-nora-29049700
08-08-2019T18:12:08,Bgrmystr2,"Damn, that's real talk / 10"
08-08-2019T18:25:21,Mihari,"Nora just needs to wait a decade or so, drop in the bucket for a dragon. Kat tho... that sucks."
08-08-2019T18:26:57,Azumachan,That's dark.
08-08-2019T18:28:10,CrRAR,"Also Nora can fly. Places to go, people to... see."
08-08-2019T18:28:14,CrRAR,:ctwokinds-NoraEyebrows:
08-08-2019T18:29:06,CrRAR,:ctwokinds-reniembarrassed:
08-08-2019T18:29:23,Mihari,"Dark, but true."
08-08-2019T18:31:55,SageSaga,"Nora - ""So, Flora dead yet?"" Flora ""GET OFF MY LAWN YA DARN HUSBAND STEAL'N DRAGON!"""
08-08-2019T18:33:47,Mihari,"I'd be like ""Extend my life and I'll share!"""
08-08-2019T18:34:27,IronHorseComics,*that moment when you have a boat load of stuff on your minecraft but have no idea where your house was*
08-08-2019T18:42:50,CrRAR,"""I can extend your life but it will have to live the remainder as a squirrel."""
08-08-2019T18:43:39,IronHorseComics,"that would be douchey, even for Nora"
08-08-2019T18:44:15,Bgrmystr2,"To be fair, I don't even know if nora could do that."
08-08-2019T18:44:30,Bgrmystr2,She's the one that stopped trace from trying to find a way to extend flora's life
08-08-2019T18:45:35,CrRAR,"yeah, that's too easy an ability."
08-08-2019T18:46:07,Mihari,"It's not that she stopped it, it's that she stopped him from waisting what little time he had with her."
08-08-2019T18:46:22,Mihari,That's not to say it's outside of the scope of what she can do.
08-08-2019T18:46:27,Azumachan,^
08-08-2019T18:46:44,Bgrmystr2,"While that's true, it could be interpreted either way"
08-08-2019T18:47:21,Bgrmystr2,:thinking: I guess that's why it was a good scene. It was open to interpretation
08-08-2019T18:48:18,Mihari,I guess... I mean if you really think that Nora would that big of a dick with the other side of that interpretation.
08-08-2019T18:48:51,Bgrmystr2,I'm not sure how any interpretation makes nora out to be a dick xD
08-08-2019T18:49:18,Mihari,"Oh wait, I forgot who I was talking too :P"
08-08-2019T18:50:04,Bgrmystr2,"yeah, it's me. Everyone needs to make sure they have their unjust bias at the door :)"
08-08-2019T18:50:09,Bgrmystr2,it's a requirement
08-08-2019T18:51:44,Bgrmystr2,"jokes aside, it just seems to me like nora doesn't want to pull a repeat of what happened when saria died"
08-08-2019T18:52:34,Bgrmystr2,nearly killed himself trying to find a way to ressurect her
08-08-2019T18:52:35,Mihari,There is a big difference on someone passing normally of old age and consoling and being there and partnering up with them after the fact than oh say your spouse is flat out murdered.
08-08-2019T18:52:47,SpazztasticKiwi,guy asked me if I liked rock and roll
08-08-2019T18:53:03,CrRAR,Do you?
08-08-2019T18:53:12,AspiringNoodle,DO YOU?!
