date,user,comment
08-05-2019T01:09:56,SpazztasticKiwi,"Tom, you got a idea for the Flora sketch now?"
08-05-2019T01:10:44,Bgrmystr2,"I hope so by now, but he should be sleeping by now xD"
08-05-2019T01:10:55,Bgrmystr2,"or, would be, I presume.. since it's past 2am"
08-05-2019T01:28:19,SpazztasticKiwi,I wonder if he has a limit where he actually goes to sleep anymore. Seen him up at odd hours before
08-05-2019T01:29:01,Bgrmystr2,yeah same
08-05-2019T01:29:09,SpazztasticKiwi,I’m often up till 4 anyway sleep is for the weak
08-05-2019T02:34:04,SpazztasticKiwi,Best family feud answers is a thing I’m happy to see
08-05-2019T02:59:46,SpazztasticKiwi,🛌
08-05-2019T03:26:39,TerraTheWizard,:ctwokinds-natsducky:
08-05-2019T03:42:09,SpazztasticKiwi,You’re too late. Can’t possibly stay any longer. I totally must go to bed now
08-05-2019T03:43:03,SpazztasticKiwi,But I now have a chance to say night to you since this rare moment lines us up at the right time ✌🏻
08-05-2019T03:43:25,Bgrmystr2,gnight :D
08-05-2019T11:00:13,NibblyBot,New Patreon Post: Love Zap https://www.patreon.com/posts/love-zap-26719927
08-05-2019T11:10:04,TerraTheWizard,:ctwokinds-NataniHAHA:
08-05-2019T11:14:08,Azumachan,zappy zap zap
08-05-2019T11:14:41,Xexanoth,Love is in the Air...and so is electricity!
08-05-2019T11:15:08,Orthonox,"I'm reminded of scene in Ed, Edd, n Eddy where Ed did this to Edd."
08-05-2019T11:20:42,Azumachan,Bonus fluffy tigress.
08-05-2019T12:57:58,SpazztasticKiwi,finally got a title
08-05-2019T13:22:59,SpazztasticKiwi,surprised Maren didn’t slap Sythe when he basically asked for her to flash a leg and see how far the fur leggings were
08-05-2019T14:49:04,TerraTheWizard,>fur leggings
08-05-2019T14:49:07,TerraTheWizard,:ctwokinds-NataniHAHA:
08-05-2019T14:59:50,SpazztasticKiwi,It’s how I see em
08-05-2019T15:25:58,CrimsonQuill,Good evening everyone. :ptv-greetings::ptv-greetings::ptv-greetings:
08-05-2019T16:01:38,SpazztasticKiwi,anyone got Scyther’s evolution tale - I can’t find anything reliable on it
08-05-2019T16:01:52,CrimsonQuill,I love the picture.
08-05-2019T16:02:00,CrimsonQuill,Nice suggestion Spazztastic!
08-05-2019T16:11:43,NibblyBot,New Patreon Post: Submit Sketch Ideas! https://www.patreon.com/posts/submit-sketch-26741331
08-05-2019T16:11:58,CrimsonQuill,"Well, time to put mine in the bowl."
08-05-2019T16:33:08,TerraTheWizard,and there's mine in
08-05-2019T16:33:15,TerraTheWizard,a fun adelaide on this week
08-05-2019T16:33:20,TerraTheWizard,*one
08-05-2019T16:33:24,CrimsonQuill,Interesting Terra.
08-05-2019T16:33:42,TerraTheWizard,not gonna tell you what it is
08-05-2019T16:33:51,TerraTheWizard,but i'll give you a hint to keep you thinking
08-05-2019T16:33:53,TerraTheWizard,Scotland
08-05-2019T16:34:04,CrimsonQuill,Freedom!
08-05-2019T16:34:18,TerraTheWizard,it's not braveheart :P
08-05-2019T16:34:32,CrimsonQuill,"No, it's two Scots in a voice activated Lift,."
08-05-2019T16:34:41,CrimsonQuill,I'll whisper you a link
08-05-2019T16:34:59,TerraTheWizard,"no need, i know the reference"
08-05-2019T16:35:12,CrimsonQuill,Someone made a Hetalia version
08-05-2019T16:35:34,CrimsonQuill,It was the first version I saw.
08-05-2019T16:35:41,CrimsonQuill,I laughed my arse off.
08-05-2019T16:35:47,CrimsonQuill,:ptv-laugh::ptv-laugh::ptv-laugh:
08-05-2019T16:41:54,Bgrmystr2,":ptv-shock::ptv-excited::ptv-laugh:  Man, that flora is amazing"
08-05-2019T16:43:53,TerraTheWizard,:zap:
08-05-2019T16:44:06,CrimsonQuill,"Isn't she? Tigers are experts on stealth, and being a tiger, she's ensured that Trace doesn't know what's happening till it's too late! :ptv-condescending:"
08-05-2019T16:47:09,SpazztasticKiwi,I realize he got that title from my suggestion itself
08-05-2019T16:47:50,SpazztasticKiwi,Which fits. I find “the spark never dies” funnier
08-05-2019T16:48:23,SpazztasticKiwi,but ah. I was still working when he swung in for ideas
08-05-2019T16:49:05,Bgrmystr2,"yeah, unfortunate"
08-05-2019T16:49:11,SpazztasticKiwi,"If Trace is coming out of the shower at that moment, though, I’d say Flora is about to shock dry him"
08-05-2019T16:49:27,Bgrmystr2,:zap::zap::zap: Bzzt
08-05-2019T16:49:29,SpazztasticKiwi,"BOOM, no water"
08-05-2019T16:49:48,Bgrmystr2,"it won't make him not-try, just channel the electricity easier into him lol"
08-05-2019T16:49:54,SpazztasticKiwi,"Half your hairs on fire, but you’re dry"
08-05-2019T16:50:06,Bgrmystr2,"if it actually made him dry, they have very different physics than we do"
08-05-2019T16:50:19,SpazztasticKiwi,Scare the water off him
08-05-2019T16:50:59,SpazztasticKiwi,Like the Tom and jerry cartoons when Tom would loose his fur after his tail got slammed in the door
08-05-2019T16:51:37,Bgrmystr2,haha
08-05-2019T16:51:40,Bgrmystr2,maybe
08-05-2019T16:52:45,SpazztasticKiwi,Trace puffs out a lil smoke ring at the end
08-05-2019T16:57:09,SpazztasticKiwi,Oh you know at the carnival those days ago I saw two guys get in the scrambler and then spend the whole ride trying not to touch
08-05-2019T16:57:34,SpazztasticKiwi,How close are you two? You’re about to be closer
08-05-2019T16:59:53,Bgrmystr2,"lol, trying so hard not to be gay"
08-05-2019T17:00:03,Bgrmystr2,when touching doesn't equal gay xD
08-05-2019T17:01:18,CrimsonQuill,"Wait, what's a scrambler?"
08-05-2019T17:01:43,CrimsonQuill,Is it some sort of Ferris wheel?
08-05-2019T17:01:49,CrimsonQuill,Or a roundabout?
08-05-2019T17:04:24,TerraTheWizard,:ctwokinds-floraquestion:
08-05-2019T17:12:50,Bgrmystr2,"It's one of these, Quill http://ptreport.thrillnetwork.net/images/hw2/scrambler.jpg"
08-05-2019T17:13:17,CrimsonQuill,"Oh, my Mum's been on one of those."
08-05-2019T17:13:28,CrimsonQuill,I heard screaming. :ptv-laugh:
08-05-2019T17:13:53,Bgrmystr2,it's mostly cuz the arms spin and the set of seats that are on each arm all spin too]
08-05-2019T17:14:02,CrimsonQuill,I see
08-05-2019T17:14:04,Bgrmystr2,cuz they're on the same structure
08-05-2019T17:14:38,Bgrmystr2,it's kind of like how the moon rotates on it's axis while spinning around the earth
08-05-2019T17:15:01,Bgrmystr2,only there's a bunch of seats instead of standing on the moon lol
08-05-2019T17:15:17,Bgrmystr2,it's not that bad
08-05-2019T17:15:41,CrimsonQuill,My mum doesn't like spinny rides and rollercoadsters.
08-05-2019T17:15:43,Bgrmystr2,"the crazy ones can actually lift the main structure vertical off the ground, or partially off"
08-05-2019T17:16:07,Bgrmystr2,"and the seats end up being open rotation, so they can spin upsidedown and stuff"
08-05-2019T17:16:15,Bgrmystr2,"I've seen it like.. once, nope.jpg"
08-05-2019T17:16:37,CrimsonQuill,That was the one my mum was on.
08-05-2019T17:16:41,CrimsonQuill,In Parc Asterix
08-05-2019T17:16:44,Bgrmystr2,your mom probably has motion sickness of some type
08-05-2019T17:16:58,CrimsonQuill,"No, she just is terrified of them."
08-05-2019T17:17:00,CrimsonQuill,That's all.
08-05-2019T17:17:28,Bgrmystr2,yeah that's kind of what causes being terrified of them :P
08-05-2019T17:17:58,CrimsonQuill,I've never been on one of them or a rollercoaster...
08-05-2019T17:18:18,CrimsonQuill,But I have been 75 m underground to see the 3rd biggest stalactite in the world.
08-05-2019T17:18:29,CrimsonQuill,And 350m underground to see a mining survey in action.
08-05-2019T17:19:13,Bgrmystr2,"I've gone on a couple of coasters before, my favorite was still the Mega Zeph that used to be in the Six Flags park near Orleans"
08-05-2019T17:19:30,Bgrmystr2,it was a wooden coaster but with metal supports
08-05-2019T17:19:56,CrimsonQuill,Have you ever seen a 3d laser scanner in action/
08-05-2019T17:19:58,CrimsonQuill,?
08-05-2019T17:20:09,CrimsonQuill,"As in a surveying one, not the printer."
08-05-2019T17:20:21,Bgrmystr2,I wouldn't know?
08-05-2019T17:21:06,CrimsonQuill,I saw one in action...
08-05-2019T17:21:19,CrimsonQuill,The stuff that can be extracted is really cool.
08-05-2019T17:21:44,CrimsonQuill,"On the other hand, actually sorting through the point cloud data is a pain in the arse."
08-05-2019T17:22:05,SpazztasticKiwi,I only get on rides that stay on the ground
08-05-2019T17:22:07,CrimsonQuill,"Oh, and I only have tomorrow to finish that project thing...which I am barely at the start at."
08-05-2019T17:22:18,SpazztasticKiwi,No farris wheels
08-05-2019T17:22:47,Bgrmystr2,"those are cool, Kiwi, but only if the view is actually worth going up to see"
08-05-2019T17:22:53,SpazztasticKiwi,And I missed everything 16:57-17:01
08-05-2019T17:22:59,CrimsonQuill,"The Spinnaker tower in Portsmout has a glass floor on it's lowest ""deck"", aboyt 80-100 m above."
08-05-2019T17:23:43,Bgrmystr2,"oh, lol kiwi I said ppl trying not to touch, and touching doesn't equal gay"
08-05-2019T17:24:02,SpazztasticKiwi,pharaohs fury is ok. But I don’t much like that one anymore
08-05-2019T17:24:27,SpazztasticKiwi,I know. It was like theyd never rode before and didn’t know they’d potentially crush each other
08-05-2019T17:24:38,Bgrmystr2,haha
08-05-2019T17:24:41,SpazztasticKiwi,It’s what I’ve noticed a few people don’t get warned about
08-05-2019T17:24:51,Bgrmystr2,that's the fun of rides tho
08-05-2019T17:24:59,Bgrmystr2,tis the whole point
08-05-2019T17:25:58,SpazztasticKiwi,"They order you smallest on the outside, biggest on the inside so the momentum won’t put boyfriend where he’s smothering the girlfriend but when just a group of friends gets on.."
08-05-2019T17:26:32,SpazztasticKiwi,They don’t necessarily know they’re going to be pressed against the outer side of the pod
08-05-2019T17:26:56,Bgrmystr2,yeah lol
08-05-2019T17:27:16,Bgrmystr2,but that's also part of the experience.
08-05-2019T17:27:21,Bgrmystr2,actually WATCHING the damn ride
08-05-2019T17:27:24,Bgrmystr2,to see what it does
08-05-2019T17:27:26,SpazztasticKiwi,I like riding the thing alone. Mainly because that and I don’t have someone to go with half the time cause schedules
08-05-2019T17:28:10,SpazztasticKiwi,Getting in is easier than getting out cause it’s ~just~ high enough that my feet don’t touch the ground when climbing out
08-05-2019T17:28:34,Bgrmystr2,"I'd go, but I have some kind of severe allergic reaction to theme parks since 80% (not exaggerating) of the time I've ended up in the hospital"
08-05-2019T17:28:54,SpazztasticKiwi,prejudice towards short people
08-05-2019T17:28:57,Bgrmystr2,"like, legit 8/10 odds"
08-05-2019T17:29:04,CrimsonQuill,Campaign for Equal Heights
08-05-2019T17:29:26,SpazztasticKiwi,"“Oh no, a farris wheel!” *breaks out in rash*"
08-05-2019T17:29:31,Bgrmystr2,haha
08-05-2019T17:29:43,Bgrmystr2,that would actually be nice
08-05-2019T17:29:50,CrimsonQuill,"It's like a Temmie getting ""HOIVS!"""
08-05-2019T17:30:14,Bgrmystr2,my problem is my body doesn't make enough electrolites naturally to keep up with being in a theme park or convention or whatnot
08-05-2019T17:30:42,CrimsonQuill,My problem is I keep staying up till after midnight when I should be sleeping.
08-05-2019T17:30:47,CrimsonQuill,It's 11:20pm...
08-05-2019T17:30:51,CrimsonQuill,Dammit I am stupid.
08-05-2019T17:30:53,Bgrmystr2,so I've had so many moments in the hospital with severe dehydration because drinking water isn't actually enough
08-05-2019T17:30:55,SpazztasticKiwi,what’s generally the difference between theme parks carnivals and fairs besides the “can’t be picked up and moved” thing
08-05-2019T17:31:19,SpazztasticKiwi,ever heard of gateraide
08-05-2019T17:31:27,Bgrmystr2,"yes, I know of that"
08-05-2019T17:32:04,Bgrmystr2,"that's what the hospitals recommended to me, any kind of gaterade, powerade, etc, anything that gives you more electrolites than normal water would, but is otherwise unchanged"
08-05-2019T17:32:50,Bgrmystr2,"I knew of it before they did, but yknow"
08-05-2019T17:32:56,SpazztasticKiwi,try it. And you’re not supposed to guzzle it. Sip. And often times they recommend watering it down for more liquid
08-05-2019T17:33:15,Bgrmystr2,you say that as if I don't drink it regularly when going to conventions and parks and stuff lol :P
08-05-2019T17:33:35,SpazztasticKiwi,I notice I get points where my potassium and iron starts telling me “low fuel”
08-05-2019T17:33:57,SpazztasticKiwi,body cramps when there’s no logical reason are bull
08-05-2019T17:34:24,SpazztasticKiwi,gateraide and I’m ok a bit later
08-05-2019T17:35:11,Bgrmystr2,"I don't, usually. Which is the problem. I get tired like everyone else, but it just ends up getting worse and worse, I don't feel better as the day goes on"
08-05-2019T17:35:20,SpazztasticKiwi,Though I’m more for poweraide
08-05-2019T17:35:22,Bgrmystr2,"while everyone else gets enough energy from resting, I get none."
08-05-2019T17:35:46,Bgrmystr2,"by the time I notice something is wrong, it's already too late."
08-05-2019T17:39:40,SpazztasticKiwi,"On a completely unrelated note, I’ve been thinking about the house more. How it comes with all the furniture, and that includes the family pictures from the family it was foreclosed on"
08-05-2019T17:41:20,Bgrmystr2,can sell it all and make some dosh
08-05-2019T17:41:58,Bgrmystr2,foreclosed houses are good
08-05-2019T17:42:12,Bgrmystr2,"they can be, aren't always"
08-05-2019T17:42:46,SpazztasticKiwi,Who’s gonna want the pictures of a family no one knows
08-05-2019T17:42:52,SpazztasticKiwi,The frames maybe
08-05-2019T17:43:00,Bgrmystr2,yeah that's not what I'm talkin about
08-05-2019T17:43:25,SpazztasticKiwi,Yes I know the point
08-05-2019T17:43:48,SpazztasticKiwi,We aim to sell junk anyway. Especially the ceramic cake centerpiece for the dining table
08-05-2019T17:51:46,CrimsonQuill,Goodnight everyone!
08-05-2019T17:51:52,CrimsonQuill,:ptv-sleepy::ptv-sleepy::ptv-sleepy:
08-05-2019T17:59:50,TerraTheWizard,:ctwokinds-RainezZz:
08-05-2019T18:54:52,Ordithus,:ctwokinds-nibsbounce:
08-05-2019T19:07:05,SpazztasticKiwi,A NIBBLY
08-05-2019T19:10:21,Ordithus,"[What, where?!]*:ctwokinds-nataniAAAAshake:"
08-05-2019T19:21:38,SpazztasticKiwi,She bounce away
08-05-2019T19:27:57,SpazztasticKiwi,"I will say if it’s someone else’s stuff or you’re gonna be ok with the result, just throwing two random different colors in a sprayer and doing a car is.."
08-05-2019T19:28:39,SpazztasticKiwi,ok I guess . Or at least it’ll be interesting. But this turned out pretty
08-05-2019T19:29:35,SpazztasticKiwi,Green/blue pearl shift with orange (red hue undertone) pearl ends up looking like a jungle snake skin
08-05-2019T19:49:10,Ordithus,"Cool, pics?"
08-05-2019T19:59:24,SpazztasticKiwi,Let me slap some cooperation into discord
08-05-2019T20:00:22,SpazztasticKiwi,https://media.discordapp.net/attachments/524825976597643265/576211797716107284/image0.png
08-05-2019T20:00:36,Bgrmystr2,:ptv-excited: ooOOOoo
08-05-2019T20:00:50,Bgrmystr2,the pearl always looks fuckin good
08-05-2019T20:03:57,SpazztasticKiwi,I got a side angle too
08-05-2019T20:05:09,SpazztasticKiwi,https://media.discordapp.net/attachments/524825976597643265/576212953267961896/image0.png the white bar line thing at the bottom is my home button
08-05-2019T20:05:13,SpazztasticKiwi,ignore it
08-05-2019T20:07:32,Bgrmystr2,widest home button ever
08-05-2019T20:07:55,Bgrmystr2,"car is super pretty though, love pearl paintjob stuff"
08-05-2019T20:08:16,Bgrmystr2,it doesn't look like it's got any shine or reflection or anything
08-05-2019T20:08:25,Bgrmystr2,"it kinda looks matte which makes it look bad to me, usually"
08-05-2019T20:08:41,Bgrmystr2,but it's not too bad honestly
08-05-2019T20:13:03,SpazztasticKiwi,That views in landscape. It’s not terribly big in person
08-05-2019T20:13:39,SpazztasticKiwi,XR has no physical home. You swipe up
08-05-2019T20:31:35,Ordithus,Coooooooooool
08-05-2019T20:36:00,FloofyCat,"I was wondering why no stream, I'm a day early, derp."
08-05-2019T20:46:49,Bgrmystr2,"stream's on friday, silly. Not thursday. :P"
08-05-2019T21:39:45,SpazztasticKiwi,Toms sleeping till then
08-05-2019T21:39:53,SpazztasticKiwi,Gotta store energy
08-05-2019T21:50:32,Ordithus,Aaaaah one more day til vacation :ctwokinds-floAAA:
08-05-2019T21:52:21,SpazztasticKiwi,Where u goin
08-05-2019T21:52:28,SpazztasticKiwi,You just got a house
08-05-2019T21:52:33,CrRAR,:ctwokinds-sleepoverA::ctwokinds-sleepoverB:
08-05-2019T21:52:40,Ordithus,Arizooooooona
08-05-2019T21:53:07,CrRAR,Grand canyooooonnnneroooo?
08-05-2019T21:53:16,Ordithus,Londoooooon Bridge
08-05-2019T21:53:24,Ordithus,Havasu City
08-05-2019T21:53:33,CrRAR,"Careful, might fall down"
08-05-2019T21:54:25,CrRAR,This is quite an ambitious itinerary.
08-05-2019T21:55:04,Ordithus,They moved the bridge
08-05-2019T21:55:13,CrRAR,oh... good
08-05-2019T21:55:19,SpazztasticKiwi,I don’t know what bit me but apparently I’m delicious
08-05-2019T21:55:46,CrRAR,careful it might come back for seconds. :eyes:
08-05-2019T21:55:58,SpazztasticKiwi,Dots on my arm ankle and shoulder
08-05-2019T21:56:02,Ordithus,:csagesaga-nynasmirk::fork_and_knife:
08-05-2019T21:56:25,CrRAR,maybe just a very nervous mosquito.
08-05-2019T21:56:44,Dadrobit,Lake Havasu City. Can't say I've been.
08-05-2019T21:57:17,CrRAR,"""G-gonna get squashed. *bzrrrt* Gonna GET squashed... *bzzz* Gonna get SQUASHED!"""
08-05-2019T21:57:38,CrRAR,*gets squashed*
08-05-2019T21:59:44,CrRAR,That is quite a pretty bridge.
08-05-2019T21:59:50,SpazztasticKiwi,I feel Bagheera’s gettin fat
08-05-2019T22:00:02,CrRAR,I can't believe they moved it to Arizona. xD
08-05-2019T22:00:23,CrRAR,tubby... tiger?
08-05-2019T22:00:25,Ordithus,Yeah!  It's crazy.  I'm looking forward to seeing it
08-05-2019T22:00:31,Dadrobit,"Yeah, because AZ is s known for its bodies of water."
08-05-2019T22:01:11,SpazztasticKiwi,As water bound as Japan
08-05-2019T22:01:40,Dadrobit,"For real though, it does kinda put an asterisk on the old ""I have a bridge to sell you"" gag."
08-05-2019T22:03:16,CrRAR,^
08-05-2019T22:03:49,Ordithus,:ctwokinds-adiracoin:
08-05-2019T22:04:37,CrRAR,*dramatic movie announcer voice*
08-05-2019T22:04:39,CrRAR,One guy with a dream set out... to prove THEM wrong.
08-05-2019T22:05:05,Dadrobit,"Also, I've starterd working again... Not TECHNICALLY a security officer, right now I'm an ""acting security supervisor""."
08-05-2019T22:05:21,Ordithus,Congrats?
08-05-2019T22:05:25,CrRAR,employment \o/
08-05-2019T22:05:43,Dadrobit,"Since DPS hasn't yet gotten me my liscense, but my old post wanted me back asap."
08-05-2019T22:06:06,Dadrobit,"So I look like a duck, I quack like a duck, but I'm actually a supervisor."
08-05-2019T22:06:22,Ordithus,"Duck, duck, fully operational battle station"
08-05-2019T22:07:31,Dadrobit,Working in a different gate house right now just next to my old one. S'pretty nice. Has super tall cielings and a chandelier in the foyer.
08-05-2019T22:07:46,Dadrobit,ceilings
08-05-2019T22:08:09,Dadrobit,These folks got money to burn for sure.
08-05-2019T22:10:22,Dadrobit,"Alas, T Mobile sucks balls and I get next to zero service up there. Ten bucks says even the ""Emergency Calls Only"" service I get doesn't even work either."
08-05-2019T22:23:44,CrRAR,"Yeah I have Google's Fi service which mixes a few carriers, including TMobile. Data strength is pretty good in general but call quality is spotty. They did just put up a tower right next to my work so it's been great there since. xD"
08-05-2019T22:25:27,Dadrobit,I'm thinking some of my earliest paychecks are going to be invested into getting back into Verizon.
08-05-2019T22:26:01,Dadrobit,I'm paying for unlimited everything with T Mobile and I feel lucky when I get even two bars at home. That's just not okay
08-05-2019T22:27:22,CrRAR,Yeah I'm surprised at how far the smaller carriers have come that they still pale in compassion to the big ones.
08-05-2019T22:28:23,CrRAR,Kinda shows it does take a TON of investment and time to build a reliable/quality network.
08-05-2019T22:29:01,CrRAR,...all to send receive our precious emoji pictures.
08-05-2019T22:29:07,CrRAR,:ctwokinds-daydreamingkat:
08-05-2019T22:29:19,CrRAR,:ctwokinds-NataniHAHA:
08-05-2019T22:29:43,Ordithus,:ctwokinds-natanispincycle:
08-05-2019T22:30:21,Dadrobit,"Had Verizon. Brother is military and T Mobile promised ""The exact same experience for half the price!"" with a family military discount plan."
08-05-2019T22:30:50,Dadrobit,More like 75% the price and 10% of the exeperience.
08-05-2019T22:30:58,Dadrobit,experience
08-05-2019T22:31:31,Dadrobit,"Ah well, time for me to get quacking."
08-05-2019T22:31:47,CrRAR,Alrighty
08-05-2019T22:31:52,Dadrobit,I'll just bring my 3DS for some funsies while I'm there instead.
08-05-2019T22:32:01,Dadrobit,Have a good one y'all.
08-05-2019T22:32:04,CrRAR,Solid plan
08-05-2019T22:32:09,SpazztasticKiwi,So you’re literally a goose. Look like duck. Quack like duck. Act like goose
08-05-2019T22:32:17,CrRAR,Have a good one~
08-05-2019T22:32:18,Ordithus,bye robit
08-05-2019T22:33:08,Dadrobit,"I can confirm that occasionally I've gotten goosed by a few folks while I'm there, but that's all I'll say on that matter."
08-05-2019T22:33:09,Dadrobit,o7
08-05-2019T22:33:26,SpazztasticKiwi,How is security work
08-05-2019T22:33:45,SpazztasticKiwi,There’s an option for me around here for prison security
08-05-2019T22:33:58,SpazztasticKiwi,Watching cameras pointing in another room
08-05-2019T22:34:05,Dadrobit,"For me, easy as shit."
08-05-2019T22:34:07,SpazztasticKiwi,I’m slightly tempted
08-05-2019T22:34:49,SpazztasticKiwi,But. There’s the thing of maybe eventually going nuts just doing basically nothing
08-05-2019T22:35:03,Dadrobit,I wouldn't touch a prison though myself. Aunt had a bad experience working at Rikers where she got her jaw broken by an inmate like 15 years ago and she's still fighting legal for compensation.
08-05-2019T22:35:42,SpazztasticKiwi,I’m to be in a separate room. Locked behind a gate with a panic button for the actual muscle if need be
08-05-2019T22:35:52,SpazztasticKiwi,From what I got from it anyway
08-05-2019T22:35:56,Dadrobit,"Anywho, this is me leaving for real now."
08-05-2019T22:36:08,SpazztasticKiwi,K. Knock yourself out
08-05-2019T22:36:12,Dadrobit,Be back in 10-ish
08-05-2019T22:47:30,SpazztasticKiwi,Have fun at school
08-05-2019T23:51:22,SpazztasticKiwi,I shouldn’t be laughing at a gymnastics fail compilation but the commentary has me in pain
