date,user,comment
17-05-2019T00:01:48,SageSaga,i have a joke for that but it might be too harsh
17-05-2019T00:02:03,AspiringNoodle,Go for it
17-05-2019T00:02:58,SageSaga,"how do you know if its too soon, what if your life is not that long?"
17-05-2019T00:03:07,AspiringNoodle,"LMAO, you're awful!"
17-05-2019T00:03:17,SageSaga,you asked for it!
17-05-2019T00:03:40,AspiringNoodle,So I did! :ptv-laugh:
17-05-2019T00:04:36,sunblaze,good morning
17-05-2019T00:04:44,SageSaga,yo Sunblaze!
17-05-2019T00:04:49,PurpleLemons,Hello :wave:
17-05-2019T00:04:50,MarvTheHugPharaoh,Hi Sun
17-05-2019T00:04:55,MarvTheHugPharaoh,Hi Purp
17-05-2019T00:05:00,SonGojin,hey guys. Damn I am super late.
17-05-2019T00:05:09,MarvTheHugPharaoh,Hi Gojin
17-05-2019T00:05:10,SageSaga,it's ok
17-05-2019T00:05:16,AspiringNoodle,Morning?  Literally 1 A.M. where I live!
17-05-2019T00:05:17,SageSaga,i dont even know who you are
17-05-2019T00:05:45,AspiringNoodle,"I'm trying to be a reformed night owl, but these streams are making me slink back to my old ways :p"
17-05-2019T00:07:02,SageSaga,be who you were meant to be
17-05-2019T00:11:06,AspiringNoodle,I wonder when CSP will go on sale again...
17-05-2019T00:11:26,SageSaga,soon
17-05-2019T00:11:34,AspiringNoodle,They do it like every 3 months or something?
17-05-2019T00:11:36,SageSaga,it always goes on sale every few months
17-05-2019T00:11:41,AspiringNoodle,Sweet! :D
17-05-2019T00:12:03,AspiringNoodle,"I feel like art is my mid-life crisis.  If I don't take it up, I'll regret it."
17-05-2019T00:18:40,AspiringNoodle,How many people are in here?
17-05-2019T00:18:40,DNMZ,"Ok time for me to go, take care all.  And great work tonight @Chalodraws and @SageSaga"
17-05-2019T00:18:47,Chalodraws,bye bye
17-05-2019T00:18:48,SageSaga,take care
17-05-2019T00:19:14,AspiringNoodle,Good night
17-05-2019T00:19:18,SageSaga,"Noodle - I had a friend who felt that way- so he went to art school- ended up in graphic design, then ended up in glass blowing, then he ended up working with 3D then 3d printing and guess what he does now?"
17-05-2019T00:19:59,AspiringNoodle,What?
17-05-2019T00:20:07,KarametraChat,sup
17-05-2019T00:20:22,SageSaga,Carpentry - as a hobby- he's a manager at a restaurant
17-05-2019T00:20:29,AspiringNoodle,Interesting.
17-05-2019T00:21:24,JeremyCanine,yo
17-05-2019T00:21:42,Strawbetch,Time for me OBE into the void.
17-05-2019T00:21:51,SageSaga,"plus side though- he was able to design the menus and logo for the store, meeting someone who makes nice glasses from the glass blowing classes, and with his carpentry he was able to build the bar"
17-05-2019T00:22:39,SageSaga,XD Jack of all trades
17-05-2019T00:22:59,Strawbetch,"bye, ye expanded dongs"
17-05-2019T00:23:09,SpazztasticKiwi,uh what
17-05-2019T00:23:20,AspiringNoodle,"Plus side, already kinda got some formal art education.  Got a minor in art since my major already completed about 40% of the credits."
17-05-2019T00:24:09,SpazztasticKiwi,I’d consider being a nurse if it wasn’t for working with people
17-05-2019T00:24:37,SageSaga,i'd like a job as a specter of death
17-05-2019T00:24:59,SpazztasticKiwi,Isn’t “grim reaper” too old for you
17-05-2019T00:25:12,SpazztasticKiwi,You’re gonna need a few more centuries on your belt
17-05-2019T00:25:23,SageSaga,i dont want to kill people- i just want to float around making people uncomfortable
17-05-2019T00:25:30,AspiringNoodle,Ha
17-05-2019T00:25:39,SpazztasticKiwi,You can technically do that now
17-05-2019T00:25:51,SageSaga,yeah but i wanna be paid to do it
17-05-2019T00:25:51,SpazztasticKiwi,Not calling you creepy or anything but anyone can do it
17-05-2019T00:26:04,SpazztasticKiwi,Ever thought of being a debt collector
17-05-2019T00:26:15,SageSaga,Robots took that job
17-05-2019T00:26:35,SpazztasticKiwi,Politician?
17-05-2019T00:26:51,SageSaga,im not stupid enough
17-05-2019T00:27:05,AspiringNoodle,"I wonder how many people wish life were more like fantasy anime.  Yeah, lots of death and conflict, but you could become an adventurer and wear armor or cast spells :p"
17-05-2019T00:27:21,SpazztasticKiwi,I hear you’re doodles are pretty good. Maybe try artist
17-05-2019T00:27:28,AspiringNoodle,^
17-05-2019T00:27:28,SpazztasticKiwi,y o u r
17-05-2019T00:27:34,SageSaga,i dont know why wearing armor is a thing you think of as something people want to do
17-05-2019T00:27:47,AspiringNoodle,;)
17-05-2019T00:28:17,SpazztasticKiwi,I’d rather not walk around in fantasy armor. too many boob hugging tops
17-05-2019T00:28:23,Mihari,"Likely they are thinking about game and anime rules for armor, less is more on females."
17-05-2019T00:28:25,SageSaga,"""Man! if you lived in a fantasy world- you could wear armor!"""
17-05-2019T00:28:44,AspiringNoodle,"Regular armor is boring, enchanted armor is fun!"
17-05-2019T00:28:52,AspiringNoodle,Assuming it's the non-gropey type
17-05-2019T00:29:05,SpazztasticKiwi,I want to meet the guy who can create breastplates more conformed than any bra fitter at Victoria’s Secret
17-05-2019T00:29:37,SpazztasticKiwi,"“Tis I Smitty, the titty smithy”"
17-05-2019T00:30:11,AspiringNoodle,I just remembered this one-page comic.  Lady wearing game-logic armor:  all arrows hit the breastplate and groin covering.
17-05-2019T00:30:27,AspiringNoodle,Guy wearing full body armor: arrow goes through the eye-slit and takes out his eye
17-05-2019T00:30:41,AspiringNoodle,100% legit
17-05-2019T00:31:27,Bgrmystr2,hahahaha kiwi I think there's an anime about that
17-05-2019T00:31:30,SageSaga,"point is- that should probably be ""Being in a fantasy world with- "" -Catgirls, Magic, Elves, amazing food- all of those are things i can be like ""Sure!"" but ""Armor!"""
17-05-2019T00:32:06,AspiringNoodle,"Tbf, I was thinking more along the lines of RPG armor.  You know, the stuff that's imbued with magic and enhances attributes xD"
17-05-2019T00:32:43,SpazztasticKiwi,I’ll take one chest enhancement plate plz
17-05-2019T00:33:22,SpazztasticKiwi,One that’s not vacuum sealed. Boob sweat means rust
17-05-2019T00:33:56,SageSaga,"""What's special about this full plate?"" ""Well it's climate controlled"" ""I'll take it!"""
17-05-2019T00:34:31,AspiringNoodle,"And for the *ahem* endowed ladies, spatial manipulation."
17-05-2019T00:34:34,SpazztasticKiwi,“Why’s this hat 6 different colors and 4 different patterns?”
17-05-2019T00:34:36,Bgrmystr2,"or just get an inner metal that doesn't rust, Kiwi"
17-05-2019T00:34:37,Bgrmystr2,easy
17-05-2019T00:34:56,SpazztasticKiwi,“It regulates body temperature”
17-05-2019T00:35:01,SpazztasticKiwi,“Sold”
17-05-2019T00:35:48,SpazztasticKiwi,"Later, you’re seen walking down the street that would make even a blind man nauseous"
17-05-2019T00:35:57,AspiringNoodle,"Man, if you were an enchanter who could enchant armor / clothing to be comfortable in any weather... you'd make a killing."
17-05-2019T00:36:12,SpazztasticKiwi,~with a hat~
17-05-2019T00:36:25,Strawbetch,"nothin', just an old meme i know"
17-05-2019T00:36:30,SageSaga,"""Arent you hot in that thing?"" *Cold mist pours from the opened visor* ""Nope"" *Closes visor*"
17-05-2019T00:36:35,AspiringNoodle,"Oh man... any time I hear that music, I want to rewatch Ghost in the Shell..."
17-05-2019T00:36:52,SpazztasticKiwi,Sweat windshield wiper hat
17-05-2019T00:36:55,Strawbetch,that one donkey kong one
17-05-2019T00:37:24,SpazztasticKiwi,Imagine talking to someone and their hat starts wiping their face
17-05-2019T00:37:35,Chalodraws,Okaaay. I think I will continue this page tomorrow
17-05-2019T00:37:37,AspiringNoodle,"Oh man, there's an idea.  Warrior in full platemail walking through a snowbank.  Huge billows of steam rising up."
17-05-2019T00:37:49,Mihari,"If I was an enchanter I'd forget the armor buisness, I'd make a bra that auto sizes and fully supports any size / woman. That would make me a fortune."
17-05-2019T00:37:58,Chalodraws,Thanks for having me. See ya all laters!
17-05-2019T00:38:01,SpazztasticKiwi,Tru
17-05-2019T00:38:03,AspiringNoodle,See ya!
17-05-2019T00:38:14,SageSaga,take care Chalo rest well!
17-05-2019T00:38:24,Bgrmystr2,ahh seeya chalo
17-05-2019T00:38:32,Mihari,Take care Chalo
17-05-2019T00:38:47,SageSaga,and yes Mihari- in a fantasy world with fantasy boobs that would be epic
17-05-2019T00:38:49,SpazztasticKiwi,How about a magic bra that helps reduce/grow boobage so the woman is comfortable
17-05-2019T00:39:06,Mihari,I think if you just had support it wouldn't matter.
17-05-2019T00:39:06,AspiringNoodle,That would also get you stupidly rich
17-05-2019T00:39:24,AspiringNoodle,magical plastic surgeons...
17-05-2019T00:39:27,Mihari,"But I guess that would be good too, lord knows I wish mine were smaller."
17-05-2019T00:39:29,AspiringNoodle,Could make you look any way you want...
17-05-2019T00:39:35,SpazztasticKiwi,I got support. There’s just not alot to support
17-05-2019T00:41:14,AspiringNoodle,The animu is strong tonight
17-05-2019T00:43:42,AspiringNoodle,Everyone see Detective Pikachu yet? :p
17-05-2019T00:44:40,Mihari,No.
17-05-2019T00:44:51,AspiringNoodle,Do it.  It's sooooooooo good <3
17-05-2019T00:44:54,Bgrmystr2,"you make the assumption that some of us can pay for that? And if we even had the money, that we would go see it?"
17-05-2019T00:45:08,AspiringNoodle,That's a fair point.
17-05-2019T00:45:24,SageSaga,it is a good movie though
17-05-2019T00:45:40,SpazztasticKiwi,eh. I’ll get to it eventually
17-05-2019T00:46:56,SonGojin,I hope to go see it with my little bro.
17-05-2019T00:47:14,AspiringNoodle,I still remember when they were tossing out potential celebrities to voice DP.
17-05-2019T00:47:21,AspiringNoodle,I'm glad they got the voice of DP to voice DP :p
17-05-2019T00:48:50,SageSaga,"XD when i mentioned that i was going to see it- my mother was like ""Oh are you going to take your little nephews to go see it?"" i said ""Heck no, they'd ruin it for me!"""
17-05-2019T00:48:51,SonGojin,I feel like Danny Devito would have had me laughing my ass of though. Course that might just be the little boy that watched disney's Hercules over and over again.
17-05-2019T00:49:16,SonGojin,inside me
17-05-2019T00:49:48,AspiringNoodle,"Personally, I think the cognitive dissonance of Ryan Reynolds makes it better"
17-05-2019T00:50:37,SonGojin,oh I know. I'm just saying because Danny has experience playing short not human characters.
17-05-2019T00:51:05,SageSaga,ok please change the subject
17-05-2019T00:51:29,SonGojin,oh sorry.
17-05-2019T00:51:39,SageSaga,i can just see someone joining and seeing the conversation and spoiling something
17-05-2019T00:51:43,AspiringNoodle,^
17-05-2019T00:51:46,AspiringNoodle,That's what I figured
17-05-2019T00:52:09,LannAF,*hops in*
17-05-2019T00:52:11,LannAF,HEY
17-05-2019T00:52:18,MarvTheHugPharaoh,Hi Lann
17-05-2019T00:52:21,LannAF,I got something to talk about
17-05-2019T00:52:24,AspiringNoodle,"Correct me if I'm wrong, but is this Jack Black singing?"
17-05-2019T00:52:25,LannAF,and it involves
17-05-2019T00:52:26,SonGojin,NO
17-05-2019T00:52:31,LannAF,how tired I am
17-05-2019T00:52:36,SonGojin,oh....
17-05-2019T00:52:36,LannAF,hi Marv :D
17-05-2019T00:52:37,AspiringNoodle,How tired are you?
17-05-2019T00:52:40,Mihari,"Somehow I even heard Lann saying that ""Heeeeyyy"" and being overly loud in my headphones."
17-05-2019T00:52:44,SageSaga,this is Jack Black's Wonder Boy
17-05-2019T00:52:47,LannAF,"on a scale of 1-10, an 8"
17-05-2019T00:53:05,AspiringNoodle,I'm floating between 6 and 9.
17-05-2019T00:53:10,LannAF,I'm at one of those points where I feel like I accomplished nothing
17-05-2019T00:53:15,LannAF,so I don't want to sleep
17-05-2019T00:53:29,LannAF,yet I'm sitting here talking to other people who feel and are doing the same
17-05-2019T00:53:34,LannAF,instead of sleeping
17-05-2019T00:53:37,LannAF,I love that feeling
17-05-2019T00:53:44,AspiringNoodle,I've been doing research recently
17-05-2019T00:54:08,AspiringNoodle,My brain is more or less tired from assimilating all this [partially useless] knowledge
17-05-2019T00:54:42,SageSaga,im accomplishing a lot
17-05-2019T00:55:07,LannAF,and that is why I am not talking to you
17-05-2019T00:55:12,SageSaga,ouch
17-05-2019T00:55:13,AspiringNoodle,haha
17-05-2019T00:55:14,LannAF,That was a joke
17-05-2019T00:55:18,LannAF,If anyone didn't catch that.
17-05-2019T00:55:24,LannAF,hahaha
17-05-2019T00:55:32,AspiringNoodle,"Well, at least you're not stressed to the point of being inable to sleep."
17-05-2019T00:55:34,LannAF,sorry sage
17-05-2019T00:55:35,SageSaga,go bed lann- you're tired
17-05-2019T00:55:43,LannAF,yeah you know I'm tired when I say rude stuff
17-05-2019T00:56:00,LannAF,"Aspiring, only certain types of stress do that to me"
17-05-2019T00:56:12,LannAF,"You have a good point sage, and I think it's a grand idea that I should follow"
17-05-2019T00:56:24,LannAF,I will follow up on it soon:tm:
17-05-2019T00:56:36,LannAF,Otherwise I sleep almost instantly all the time
17-05-2019T00:56:39,AspiringNoodle,What kinds of stress keep you up at night?
17-05-2019T00:56:52,LannAF,"Stress of not knowing if someone is okay, mostly."
17-05-2019T00:56:59,SageSaga,you're starting to look like the super drunk guy that just walked into the wrong place
17-05-2019T00:57:11,LannAF,I'm not at that point
17-05-2019T00:57:18,AspiringNoodle,Most stresses make me tired.
17-05-2019T00:57:25,AspiringNoodle,Life decision stresses keep me up :p
17-05-2019T00:57:49,LannAF,"Stresses exhaust me but I can usually sleep a lot of them off, unless I have work"
17-05-2019T00:57:56,LannAF,in which case I wake up stressed.
17-05-2019T00:58:33,LannAF,I'm honestly extremely thankful for my ability to sleep. I chalk it up to highschool and my shitty sleep habits but it's never left me.
17-05-2019T00:59:06,LannAF,Most of my family has insomnia so it's...Good luck I guess
17-05-2019T00:59:25,SageSaga,well ya better sleep well and have fun at D&D tomorrow
17-05-2019T00:59:31,AspiringNoodle,"I'm sure I'll experience more types of stress later in life.  But for now it's either been the ""make me tired"" or ""I'm having a panic attack"" kind."
17-05-2019T00:59:47,AspiringNoodle,The latter I am not a fan of.
17-05-2019T01:00:15,LannAF,man I am SO looking forward to it
17-05-2019T01:00:29,LannAF,"oof, panic attack stress is definitely the shittiest"
17-05-2019T01:00:46,MarvTheHugPharaoh,"oooh more ERP, Lann?"
17-05-2019T01:00:55,LannAF,Thankfully DnD is at night so I have plenty of rest and relaxation time
17-05-2019T01:01:02,LannAF,Marv there was and WILL BE NO ERP
17-05-2019T01:01:09,MarvTheHugPharaoh,XD
17-05-2019T01:01:54,LannAF,"oh shoot, I forgot to save the VOD and upload it"
17-05-2019T01:02:04,LannAF,thanks for reminding me of something I'll do tomorrow probably
17-05-2019T01:02:14,MarvTheHugPharaoh,:thumbsup::cmarvthehugpharaoh-ezgifcom-crop:
17-05-2019T01:04:12,LannAF,Well I'm going to take Sage's advice and head to bed
17-05-2019T01:04:23,LannAF,I hope you all have a fantastic night
17-05-2019T01:04:25,MarvTheHugPharaoh,nighty night Lann
17-05-2019T01:04:27,SageSaga,sleep well man
17-05-2019T01:04:34,LannAF,thanks buddies
17-05-2019T01:04:36,AspiringNoodle,Sleep well :D
17-05-2019T01:04:42,LannAF,oh I will
17-05-2019T01:04:52,LannAF,I'm close to falling asleep in my chair
17-05-2019T01:04:52,AspiringNoodle,Don't stress on us >:3
17-05-2019T01:09:53,SpazztasticKiwi,Anxiety: “worry” me: “why? The days free - everything’s caught up”
17-05-2019T01:10:05,SpazztasticKiwi,Anxiety “because fuck you that’s why”
17-05-2019T01:10:12,AspiringNoodle,Pretty much!
17-05-2019T01:10:50,SpazztasticKiwi,That good ol feeling of constantly feeling buzzy. If only it burned calories
17-05-2019T01:11:23,AspiringNoodle,"If metabolism scaled with anxiety, I'd be a healthy weight, haha"
17-05-2019T01:11:56,SpazztasticKiwi,I’d actually look like a super model
17-05-2019T01:12:07,SageSaga,alright looks like im done for tonight- i'll be streaming again in 12 hours and 48 minutes
17-05-2019T01:12:08,AspiringNoodle,Pre or post-Photoshop? xD
17-05-2019T01:12:18,MarvTheHugPharaoh,Thanks for the streamy Sage
17-05-2019T01:12:23,SpazztasticKiwi,Bye Sage
17-05-2019T01:12:30,SpazztasticKiwi,Night
17-05-2019T01:12:37,AspiringNoodle,Was a joy watching you work.
17-05-2019T01:13:09,SpazztasticKiwi,and night for everyone else
17-05-2019T01:13:12,SpazztasticKiwi,unfortunately it looks like Tom already slipped off so no nite nite for him
17-05-2019T01:15:04,sunblaze,bye
17-05-2019T01:15:09,Bgrmystr2,thanks for strem sage :ptv-excited:
17-05-2019T01:15:11,SageSaga,take care Sunblaze
17-05-2019T01:15:17,SpazztasticKiwi,"pre photoshop duh. That much weight loss, I’d have to eat huge meals not to look like a stick"
17-05-2019T01:17:08,AspiringNoodle,I wonder how long before Photoshop loses its top spot.
17-05-2019T01:17:37,SageSaga,unlikely to happen any time soon because of industry use
17-05-2019T01:18:23,AspiringNoodle,It's not that I hate the software.  It's just Adobe is a less than likable company.
17-05-2019T01:19:22,AspiringNoodle,"Ah well, time will tell.  Good night!"
17-05-2019T01:23:30,SpazztasticKiwi,Kitty is being cute
17-05-2019T01:23:38,SpazztasticKiwi,I suspect he wants treats
17-05-2019T02:16:12,SpazztasticKiwi,Anyone want to see a funny guy version of all about that bass
17-05-2019T02:59:33,SpazztasticKiwi,🛌
17-05-2019T04:17:55,CommanderTrace,Hello ;D
17-05-2019T06:17:09,TerraTheWizard,:ctwokinds-natsducky:
17-05-2019T07:29:28,aldaceles,:(
17-05-2019T08:23:25,CrimsonQuill,Hullo
17-05-2019T09:54:41,LiveCookie12,Hi
17-05-2019T11:12:24,aldaceles,Hi
17-05-2019T12:18:31,Orthonox,Hi.
17-05-2019T12:18:54,Orthonox,Is there a reason why Tom did not stream yesterday? Busy with life?
17-05-2019T12:19:21,TerraTheWizard,i think someone mentioned mark showing up
17-05-2019T12:21:45,NibblyBot,New Patreon Post: Sister Jealousy https://www.patreon.com/posts/sister-jealousy-26955396
17-05-2019T12:25:51,TerraTheWizard,:ctwokinds-nataniAAAAshake:
17-05-2019T12:26:54,TerraTheWizard,one more sketch to 666 :ctwokinds-clovisgirl_shake:
17-05-2019T12:28:08,Azumachan,:ctwokinds-floraquestion:
17-05-2019T12:28:08,Azumachan,:ctwokinds-florajiggle:
17-05-2019T12:33:35,SpazztasticKiwi,"If Tom tries a stream today, I’m not out till 10"
17-05-2019T12:40:35,SpazztasticKiwi,Though maybe Mark invited him to that amusement park game event thing
17-05-2019T13:10:25,NibblyBot,New Patreon Post: Sketch Suggestions Poll! https://www.patreon.com/posts/sketch-poll-26956140
17-05-2019T13:12:59,CrimsonQuill,Oh...this?
17-05-2019T13:17:03,CrimsonQuill,The results will be...interesting...
17-05-2019T13:17:06,Mippy,Tom ref sheet Lol 😂
17-05-2019T13:18:31,CrimsonQuill,This probably means there won't be a poll on the day...
17-05-2019T13:27:22,Orthonox,Suggestions poll? Okay. I do not have a problem with voting only going to $5+ patrons if it has good turnout.
17-05-2019T13:30:59,TerraTheWizard,:ctwokinds-floraquestion:
17-05-2019T13:34:55,BluePhantom90,hope mine make it. I know a lot of people like Fluffkevlar's work
17-05-2019T13:36:22,CrimsonQuill,"I'm hoping mine'll get some votes too...if not, well, I'll just have to try again. There are sone good ones there though."
17-05-2019T13:36:33,CrimsonQuill,Be right back-need dinner-Spaghetti Bolognese
17-05-2019T13:37:09,TerraTheWizard,:clap: highland games :clap: scottish adelaide :clap:
17-05-2019T13:42:48,TerraTheWizard,k i l t s
17-05-2019T13:42:53,TerraTheWizard,:ctwokinds-keith8D:
17-05-2019T13:59:12,SageSaga,hmm
17-05-2019T14:08:06,AspiringNoodle,"Woo, stream!"
17-05-2019T14:08:50,SageSaga,yo
17-05-2019T14:09:08,AspiringNoodle,"Just waiting for CSP to go on sale, hehe."
17-05-2019T14:13:40,CrimsonQuill,Back
17-05-2019T14:13:43,CrimsonQuill,Hi Sage
17-05-2019T14:14:25,AspiringNoodle,"Welcome back to the party, Quill :D"
17-05-2019T14:14:28,SageSaga,yo Crim wb
17-05-2019T14:17:07,sunblaze,hiya
17-05-2019T14:17:56,SageSaga,yo Sunblaze!
17-05-2019T14:20:04,FloofyCat,Hey all
17-05-2019T14:20:24,CrimsonQuill,hullo Floofy
17-05-2019T14:20:35,FloofyCat,Oh hi Sage this is a nice surprise
17-05-2019T14:20:46,SageSaga,how is it a surprise?
17-05-2019T14:21:38,FloofyCat,"Had no idea you were streaming, I just woke up and clicked on the tab and bam a stream"
17-05-2019T14:21:59,SageSaga,ah- well i always stream at this time on this day :P
17-05-2019T14:22:13,AspiringNoodle,Oh really?  *adds note to calender*
17-05-2019T14:22:17,SageSaga,"3pm EDT Saturday, 9pm EDT Friday"
17-05-2019T14:22:52,FloofyCat,"I got yet another junk mail from the local council saying I've registered to vote, I know council, you sent me two letters before this saying I have registered to vote. I don't have dementia."
17-05-2019T14:23:17,AspiringNoodle,They just *REALLY* want to make sure you didn't forget! :3
17-05-2019T14:24:02,FloofyCat,"And then I got a ad from the Brexit Party in there, with Farage's ugly mug that is badly printed."
17-05-2019T14:24:18,SageSaga,my gifs got messed up somehow
17-05-2019T14:24:30,FloofyCat,"Which screams ""cut me out and hide me somewhere"""
17-05-2019T14:24:47,FloofyCat,The bouncy one and Rem look okay on this end
17-05-2019T14:25:36,SageSaga,yeah i just re-added it- i saw it was off and went to turn it on - and it was on
17-05-2019T14:26:05,SageSaga,or right- i cleaned up some files and moved stuff around- i must have moved the wrong copy of it
17-05-2019T14:26:51,CrimsonQuill,I'm multitasking here
17-05-2019T14:27:04,CrimsonQuill,I'm watching the stream while playing Undertale
17-05-2019T14:27:20,AspiringNoodle,dual monitors?
17-05-2019T14:27:24,AspiringNoodle,Or windowed Undertale? :P
17-05-2019T14:27:28,CrimsonQuill,"No, tabbing"
17-05-2019T14:27:32,SageSaga,triple monitor
17-05-2019T14:27:58,CrimsonQuill,Just pressing the windows button to see the stream then switching back to the game
17-05-2019T14:28:35,Twokinds,:ctwokinds-kingtea:
17-05-2019T14:28:43,CrimsonQuill,Hello Tom!
17-05-2019T14:28:49,SageSaga,yo Tom
17-05-2019T14:28:51,CrimsonQuill,How's the tea/coffee?
17-05-2019T14:28:54,AspiringNoodle,48:9 will come someday
17-05-2019T14:29:04,NibblyBot,:ctwokinds-nibsbounce::ctwokinds-nibsbounce::ctwokinds-nibsbounce:
17-05-2019T14:29:05,AspiringNoodle,And then triple monitor will be ded :p
17-05-2019T14:31:46,FloofyCat,"Hi Tom, I realised I left the tab open for sketch suggestions but forgot to press submit. I am a huge derp."
17-05-2019T14:32:02,FloofyCat,I need whatever caffeine Keith is having
17-05-2019T14:32:13,CrimsonQuill,"That's not Keith, Floofy"
17-05-2019T14:32:19,CrimsonQuill,It's King Adelaide.
17-05-2019T14:32:20,FloofyCat,Wait
17-05-2019T14:32:28,FloofyCat,No it isn't I definitely need the caffeine
17-05-2019T14:32:30,CrimsonQuill,That's who is drinking the tea.
17-05-2019T14:32:56,FloofyCat,Quill I think it just speaks more to the need for caffeine
17-05-2019T14:33:14,FloofyCat,aaahhhhhhh
17-05-2019T14:34:19,CrimsonQuill,"That's a bit like Doc from ""The Whiteboard"" when he doesn't have coffee or mountian dew...."
17-05-2019T14:34:35,AspiringNoodle,Mountain Dew sounds so good right now
17-05-2019T14:37:06,CrimsonQuill,I never touch the stuff.
17-05-2019T14:37:24,CrimsonQuill,I prefer apple-blackcurrant squash or tea or water or orange juice.
17-05-2019T14:37:41,AspiringNoodle,Ever try 5HE?
17-05-2019T14:38:48,CrimsonQuill,No
17-05-2019T14:38:51,CrimsonQuill,What is it?
17-05-2019T14:39:00,AspiringNoodle,5 hour energy :p
17-05-2019T14:39:27,CrimsonQuill,Thanks but no thanks. I'll stick to Porridge.
17-05-2019T14:40:57,FloofyCat,That sounds like 5 kilograms of sugar
17-05-2019T14:42:15,AspiringNoodle,"I think it has sugar.  It also has a bit of caffeine, but no worse than a cup of coffee.  They more or less load the thing with vitamins that make you feel alert."
17-05-2019T14:43:22,Twokinds,Mother made curry this morning. Took a lot of willpower not to have any. ;-;
17-05-2019T14:43:38,Twokinds,Curry is my favorite food.
17-05-2019T14:43:51,CrimsonQuill,"Oh, I love curry"
17-05-2019T14:44:02,SageSaga,Tom is now cliche asian
17-05-2019T14:44:13,CrimsonQuill,And I heard your mum's cooking is really good according to your brothers videos and twitter feeds
17-05-2019T14:44:20,CrimsonQuill,I'd have curry
17-05-2019T14:44:30,CrimsonQuill,"Especially spicy curry,."
17-05-2019T14:44:32,CrimsonQuill,:)
17-05-2019T14:44:44,TerraTheWizard,someone mentioned curry :eyes:
17-05-2019T14:45:34,SageSaga,https://www.youtube.com/watch?v=bSjvrq1wk9Q
17-05-2019T14:45:48,Twokinds,Curry is so good
17-05-2019T14:45:59,SageSaga,there ya go Tom
17-05-2019T14:46:10,CrimsonQuill,XD
17-05-2019T14:46:42,Twokinds,:ctwokinds-LauraCry:
17-05-2019T14:46:46,Twokinds,It's all carbs though
17-05-2019T14:47:09,Twokinds,"Well, a lot of carbs."
17-05-2019T14:47:25,CrimsonQuill,"Emily: ""You eat carbs, for Christ's sake! Carbs!"""
17-05-2019T14:47:28,SageSaga,there is Keto curry- but i dont know if its any good XD
17-05-2019T14:47:31,CrimsonQuill,(Devil wears Prada)
17-05-2019T14:47:36,Twokinds,Eeeegh
17-05-2019T14:47:43,Twokinds,How can you have curry without rice?
17-05-2019T14:47:47,Twokinds,It makes no sense.
17-05-2019T14:47:51,CrimsonQuill,Ever tried Schezuan beef Tom?
17-05-2019T14:47:55,CrimsonQuill,It's really nice.
17-05-2019T14:48:02,Twokinds,I don't know.
17-05-2019T14:48:04,CrimsonQuill,I think it's a curry...maybe a stir fry thing?
17-05-2019T14:48:09,CrimsonQuill,It's a Vietnamese dish.
17-05-2019T14:48:20,CrimsonQuill,I'll link a picture if I am allowed.
17-05-2019T14:48:37,SageSaga,i do really miss Rice
17-05-2019T14:48:54,CrimsonQuill,My dad cooks it all the time because it's tasty but doesn't put n too much weight carbwise.
