date,user,comment
23-07-2019T19:40:44,IronHorseComics,I'm so glad the executive's plan to sabotage the show failed and it ran to its completion
23-07-2019T19:41:19,IronHorseComics,"apparantly the execs hated it so they would put it in awful showing times, worked so well with Symbionic Titan"
23-07-2019T19:42:03,IronHorseComics,but Gravity Falls was too good and too funny for the plans to work
23-07-2019T19:42:31,AspiringNoodle,"Awww, I liked that show"
23-07-2019T19:42:36,SomeNiceUser,It was a masterpiece.
23-07-2019T19:43:06,IronHorseComics,"I did too, and it was cancelled on a stupid cliffhanger AAAARRRG!"
23-07-2019T19:44:07,AspiringNoodle,Let's not forget
23-07-2019T19:44:14,AspiringNoodle,The twerking scene :ptv-sneakysmirk:
23-07-2019T19:45:24,IronHorseComics,and the street race
23-07-2019T19:45:54,IronHorseComics,would have been better with eurobeats but oh well
23-07-2019T19:48:06,AspiringNoodle,*sigh*
23-07-2019T19:48:30,AspiringNoodle,"In the future, I'm plan on purchasing new hardware only 2 months after it launches -_-"
23-07-2019T19:48:41,Bgrmystr2,I looked for it but saw no results. Sorry Iron.
23-07-2019T19:49:22,IronHorseComics,https://static.tvtropes.org/pmwiki/pub/images/Sym-Bionic_Titan_6568.jpg
23-07-2019T19:49:58,AspiringNoodle,"I love Lance, lol"
23-07-2019T19:50:05,AspiringNoodle,He's such a broody teen archtype
23-07-2019T19:50:34,IronHorseComics,and yet it was understandable
23-07-2019T19:51:47,IronHorseComics,"growing up without his parents, being bullied in military training by other cadets, being framed for a crimes he was trying to stop"
23-07-2019T19:51:58,IronHorseComics,kinda hard for the guy to be upbeat
23-07-2019T19:54:57,TeapotOfDoom,Gravity falls was bullied out of existance?
23-07-2019T19:55:18,IronHorseComics,"no, it completed it's main story"
23-07-2019T19:55:22,TeapotOfDoom,I didn't even know... it was such a brilliant show
23-07-2019T19:55:39,SomeNiceUser,At least the story reached its
23-07-2019T19:55:45,TeapotOfDoom,Yes but i didn't know that they tried
23-07-2019T19:55:46,Sclimshady,I think Gravity falls came to a logical conclusion.  They didn't want it to lose quality
23-07-2019T19:55:48,SomeNiceUser,Conclusion
23-07-2019T19:55:56,AspiringNoodle,Mabel is a horrible person. Fite me
23-07-2019T19:56:19,IronHorseComics,"of course she is, she's a pre-teen"
23-07-2019T19:56:19,TeapotOfDoom,G L I T T E R
23-07-2019T19:57:06,TeapotOfDoom,Who would have wanted to miss the season finaly of Duck-tective
23-07-2019T19:58:01,SomeNiceUser,I found my old 3DS.
23-07-2019T19:58:07,IronHorseComics,[terrified quack]
23-07-2019T19:58:25,Sclimshady,I had a gameboy color :cw0lfmare-PaperemberClose:
23-07-2019T19:58:35,TeapotOfDoom,Still got ma dsi
23-07-2019T19:58:44,TeapotOfDoom,Good times
23-07-2019T19:59:00,Sclimshady,And that was after my og gameboy
23-07-2019T19:59:34,SomeNiceUser,"My younger brother had a broken 3DS, he wanted to sell it for 5$."
23-07-2019T19:59:53,SomeNiceUser,So I bought it.
23-07-2019T20:00:01,TeapotOfDoom,Did you fix it?
23-07-2019T20:00:36,SomeNiceUser,Turns out that the battery was defective.
23-07-2019T20:01:07,SomeNiceUser,So now I have two 3DS!
23-07-2019T20:01:14,AspiringNoodle,"Oh yeah, did you guys hear about Big O?"
23-07-2019T20:01:41,TeapotOfDoom,Big o?
23-07-2019T20:01:49,IronHorseComics,nope
23-07-2019T20:01:54,SomeNiceUser,What’s that?
23-07-2019T20:02:19,Sclimshady,Ovorce?
23-07-2019T20:02:52,TeapotOfDoom,Overpriced?
23-07-2019T20:03:00,AspiringNoodle,"Ofc, I'm not referring to the classic animated series, The Big O."
23-07-2019T20:03:15,AspiringNoodle,"I'm referring, instead, to Origin PC's new custom monster, Big O."
23-07-2019T20:03:24,AspiringNoodle,An all-in-one system in every sense
23-07-2019T20:03:24,TeapotOfDoom,O
23-07-2019T20:03:30,AspiringNoodle,"One computer, EVERY gaming platform."
23-07-2019T20:03:37,AspiringNoodle,"PC, Switch, Xbox One, PS4."
23-07-2019T20:03:48,TeapotOfDoom,In one system?
23-07-2019T20:03:53,AspiringNoodle,In
23-07-2019T20:03:54,AspiringNoodle,One
23-07-2019T20:03:56,AspiringNoodle,System
23-07-2019T20:03:59,TeapotOfDoom,Why
23-07-2019T20:04:06,Bgrmystr2,why not?
23-07-2019T20:04:19,Sclimshady,Why not just release all titles on PC?
23-07-2019T20:04:25,TeapotOfDoom,Switch is a nvidia tegra = arm based
23-07-2019T20:04:27,AspiringNoodle,"""Fuck you, because we can!"""
23-07-2019T20:04:29,Bgrmystr2,because consoles are shit and won't always release on PC?
23-07-2019T20:04:39,AspiringNoodle,I imagine that's their reasoning xD
23-07-2019T20:04:41,Bgrmystr2,There isn't always a PC release.
23-07-2019T20:04:53,Bgrmystr2,which is sad cuz that only guarantees the console's survival.
23-07-2019T20:05:00,AspiringNoodle,Microsoft is starting to push towards PC inclusivity
23-07-2019T20:05:05,TeapotOfDoom,Everything else is x86 as far as i know
23-07-2019T20:05:36,Bgrmystr2,"anycase, the new tower for all the systems is damn good, water cooled, meaning you can probably get overclocking potentially on the consoles"
23-07-2019T20:05:44,Bgrmystr2,"so it'd be better than any individual console is, period."
23-07-2019T20:06:16,TeapotOfDoom,Fun fact you can buy tegra dev kits which is essentially a switch
23-07-2019T20:06:19,Bgrmystr2,"granted overclocking is just a possibility, not guaranteed."
23-07-2019T20:06:42,TeapotOfDoom,I wonder if anyone made that happen
23-07-2019T20:07:11,SomeNiceUser,They’ll find a way.
23-07-2019T20:09:03,TeapotOfDoom,Doesn't look like anyone pulled that one of... i had faith in the hacking community
23-07-2019T20:11:21,SomeNiceUser,My 3DS still works like a charm.
23-07-2019T20:11:58,TeapotOfDoom,Yo bgr ar  you really always on?
23-07-2019T20:12:34,SomeNiceUser,"And I still have my DS games. Heartgold, good times."
23-07-2019T20:12:46,AspiringNoodle,"Idk about him, but I always keep chat open because since quitting WoW I lost my chatting community ._."
23-07-2019T20:13:08,AspiringNoodle,"And I'm slow to adopt new tech, so Discord is still rather foreign to me"
23-07-2019T20:14:53,SomeNiceUser,"When it comes to adapting to new things, I’m pretty fast at it. Mastering it, it takes far longer for me to rise up the curb."
23-07-2019T20:15:44,SomeNiceUser,Like new video games!
23-07-2019T20:16:30,AspiringNoodle,I should use discord more :3
23-07-2019T20:16:45,AspiringNoodle,Find a nice community with a general chat
23-07-2019T20:16:58,SomeNiceUser,I use discord pretty often.
23-07-2019T20:18:44,TeapotOfDoom,Tk community seems to use the stream chat pretty heavily. I have to admit i'd much rather use this then dc
23-07-2019T20:19:13,SomeNiceUser,"I bought a wolf link amiibo from a Walmart a few months ago, lucky find"
23-07-2019T20:19:28,TeapotOfDoom,I'm here when i'm off work but i'd never keep it open all the time ^^
23-07-2019T20:20:10,TeapotOfDoom,Super mario odyssey just started pushing amiibos in my face
23-07-2019T20:21:11,SomeNiceUser,That’s just sad.
23-07-2019T20:21:21,TeapotOfDoom,Anyway it's unbelievably late. I'm heading to bed. Night peeps :ctwokinds-RainezZz:
23-07-2019T20:21:36,SomeNiceUser,Night Teapot.
23-07-2019T20:23:51,SomeNiceUser,"So, who likes ice cream?"
23-07-2019T20:24:16,AspiringNoodle,I SCREAM
23-07-2019T20:24:18,AspiringNoodle,YOU SCREAM
23-07-2019T20:24:20,AspiringNoodle,WE ALL SCREAM
23-07-2019T20:24:25,AspiringNoodle,BECAUSE F*** ICE CEAM
23-07-2019T20:24:29,AspiringNoodle,;D
23-07-2019T20:24:49,SomeNiceUser,:ptv-shipit:
23-07-2019T20:24:57,AspiringNoodle,:ptv-ohmy::ptv-ohmy::ptv-ohmy:
23-07-2019T20:25:48,Bgrmystr2,aw
23-07-2019T20:25:55,Bgrmystr2,I was gonna answer to teapot that yes I am always on.
23-07-2019T20:25:58,Bgrmystr2,xD
23-07-2019T20:26:05,Bgrmystr2,I guess I can tell him next time.
23-07-2019T20:26:27,Bgrmystr2,Was watchin a video at the time
23-07-2019T20:26:44,SomeNiceUser,"Oh well, maybe next time."
23-07-2019T20:27:05,Bgrmystr2,by 4 minutes.. eee. :(
23-07-2019T20:29:56,SomeNiceUser,"I’m just looking through all of my ds games, good nostalgia."
23-07-2019T20:32:48,SomeNiceUser,"Also, the comic..."
23-07-2019T20:33:15,SomeNiceUser,Twokinds I mean.
23-07-2019T20:34:16,SomeNiceUser,I’m still trying to figure out why is Raine’s eyes are glowing.
23-07-2019T20:37:41,SomeNiceUser,Maybe something lit up in her.
23-07-2019T20:40:45,SomeNiceUser,I think I’m just gonna read some fanfics.
23-07-2019T20:53:10,Sclimshady,Its cause Raine is best girl :ctwokinds-rainehappy:
23-07-2019T20:53:23,Sclimshady,"Also, fanfics are dangerous"
23-07-2019T20:54:25,IronHorseComics,they're often heretical
23-07-2019T20:55:45,SomeNiceUser,"I too, love to live dangerously."
23-07-2019T20:56:32,Sclimshady,"Ill just take the original, thank you kindly."
23-07-2019T20:56:53,SomeNiceUser,Original?
23-07-2019T20:57:16,Sclimshady,Just the regular comic
23-07-2019T20:57:45,SomeNiceUser,:ptv-condescending:
23-07-2019T20:58:36,SomeNiceUser,"Although, I was bored recently and people are, creative."
23-07-2019T20:59:27,Sclimshady,:ctwokinds-sadtrace2:*[I don't like their creativity]
23-07-2019T21:02:51,SomeNiceUser,"Nora herself is very creative with her punishments, and gifts..."
23-07-2019T21:02:58,Sclimshady,:ctwokinds-NoraEyebrows:
23-07-2019T21:03:22,BadFoMo,//troll I have a fanfic...
23-07-2019T21:04:17,Sclimshady,As long as you aren't lewding Raine you are forgiven
23-07-2019T21:04:27,SpazztasticKiwi,Bagheera just literally scared himself
23-07-2019T21:04:39,Sclimshady,The mighty hunter
23-07-2019T21:05:02,SpazztasticKiwi,from what I can guess he saw his own tail and flipped
23-07-2019T21:06:15,SomeNiceUser,I would love to read all the fanfics.
23-07-2019T21:09:58,SomeNiceUser,"Big question, can dragons mind lewd other dragons?"
23-07-2019T21:11:13,Sclimshady,"I don't really know what you mean by that, but Nora most likely can."
23-07-2019T21:12:17,Bgrmystr2,still dunno why Raine is any more special than anyone else.
23-07-2019T21:12:41,SomeNiceUser,Rains must be special in a way.
23-07-2019T21:12:47,Sclimshady,Because Raine is best girl. :ctwokinds-rainehappy:
23-07-2019T21:13:03,SomeNiceUser,Yes shady.
23-07-2019T21:13:29,Bgrmystr2,"One opinion does not a fact make, and nonetheless, that doesn't give any reason at all."
23-07-2019T21:14:16,Sclimshady,Oh im well aware its only an opinion.  But as a flawed human being i believe mine to be the most right
23-07-2019T21:14:48,Bgrmystr2,huhu
23-07-2019T21:15:21,Sclimshady,"Also she's just so kind and trusting after constantly being tossed away, so she must be protected"
23-07-2019T21:15:30,Bgrmystr2,Eh.
23-07-2019T21:15:41,Bgrmystr2,All are equal.
23-07-2019T21:17:00,Sclimshady,But some are more equal than others. :ctwokinds-keith8D:
23-07-2019T21:17:24,Bgrmystr2,"that's not how equal works, and in fact only distorts it so there is no equality."
23-07-2019T21:17:31,Bgrmystr2,which is the very problem to begin with.
23-07-2019T21:18:04,Sclimshady,Thats the point of the statement.  It's entirely nonsensical
23-07-2019T21:18:17,Ordithus,:ctwokinds-natsducky:
23-07-2019T21:18:32,Sclimshady,Hi Ord :ctwokinds-natsducky:
23-07-2019T21:18:47,Ordithus,evenin
23-07-2019T21:19:04,Bgrmystr2,"yes, but people in this fandom use it as an actual excuse and try to get away with it, Sclim."
23-07-2019T21:19:12,Bgrmystr2,So I'm here to make sure you are not one of them. :)
23-07-2019T21:19:20,Bgrmystr2,Hello Ord
23-07-2019T21:19:21,Sclimshady,"Aye, it is evening Ord"
23-07-2019T21:20:06,Sclimshady,Almost everything I say is satirical. I am not a serious person
23-07-2019T21:21:18,unsteddyphoenix,EVERYONE KNOWS KAT IS BEST GIRL ANYWAY
23-07-2019T21:21:25,Ordithus,It's already Wednesday night :ctwokinds-keithdotdotdot:
23-07-2019T21:21:40,Bgrmystr2,"speaking of one of them, Hello Phoenix."
23-07-2019T21:21:41,Sclimshady,I was expectin Teddy at anytime
23-07-2019T21:21:43,Ordithus,:ctwokinds-daydreamingkat:*[MAREN! <3 ]
23-07-2019T21:22:02,Sclimshady,I have jury tomorrow morning!
23-07-2019T21:22:23,Sclimshady,If they want me to come in on my birthday i will be livid
23-07-2019T21:30:30,SomeNiceUser,"Raine might have unstable magic after being magically suppressed for years. Which is why she has trouble shifting, and has trouble with her emotions."
23-07-2019T21:32:01,SomeNiceUser,Which means spontaneous floof.
23-07-2019T21:32:16,SpazztasticKiwi,🛌
23-07-2019T21:32:30,Ordithus,Kiwi!  Goodnight
23-07-2019T21:33:08,Sclimshady,Night Kiwi o/
23-07-2019T21:33:28,Sclimshady,Spontaneous floof is the best floof
23-07-2019T21:34:29,SomeNiceUser,I cherish every moment of spontaneous floof.
23-07-2019T21:34:48,Bgrmystr2,Her magic is unlikely to be unstable due to it being supressed
23-07-2019T21:34:54,Bgrmystr2,"that's not how it works, far as I understand"
23-07-2019T21:35:06,Sclimshady,It is lack of training
23-07-2019T21:35:17,Bgrmystr2,"She, herself, has unstable control over it due to lack of education"
23-07-2019T21:35:26,Sclimshady,^ aye
23-07-2019T21:35:41,Ordithus,Or she's just bad at magic
23-07-2019T21:35:44,SomeNiceUser,Which means she need to learn the art of magic.
23-07-2019T21:35:49,Bgrmystr2,Which is what I said ord XD
23-07-2019T21:35:55,SomeNiceUser,Yes ord
23-07-2019T21:35:57,Sclimshady,:ctwokinds-RaineEep:*[am not!]
23-07-2019T21:36:03,Bgrmystr2,Are too ^
23-07-2019T21:36:16,Ordithus,:ctwokinds-redrose:*[Truly awful]
23-07-2019T21:36:29,Bgrmystr2,I'd fix it.
23-07-2019T21:36:38,Sclimshady,:ctwokinds-LauraCry: (imagine this is Raine)
23-07-2019T21:36:59,Bgrmystr2,Everyone has to learn magic from some point
23-07-2019T21:37:08,Bgrmystr2,Just because She's at the starting point does not mean it's a bad thing.
23-07-2019T21:37:41,Ordithus,Maybe she's been practicing for years.  And has no talent!
23-07-2019T21:37:53,Bgrmystr2,"With that amulet, and then the shackle?"
23-07-2019T21:37:56,Bgrmystr2,yeah not buyin it
23-07-2019T21:37:58,Sclimshady,She's the Ember of TK?
23-07-2019T21:38:00,Ordithus,Excuses
23-07-2019T21:38:08,SomeNiceUser,"She is very interested in magic though, make me wonder why Raine did not learn any real magic."
23-07-2019T21:38:21,Bgrmystr2,that was explained in the story
23-07-2019T21:38:22,Sclimshady,She wasn't allowed
23-07-2019T21:38:39,Bgrmystr2,her mom hid her and prevented it by using supression magic
23-07-2019T21:38:44,Bgrmystr2,never told her about it
23-07-2019T21:39:28,SomeNiceUser,You are right about that.
23-07-2019T21:40:05,Bgrmystr2,Her introduction and subsequent travels with Team B are what allowed her to experience and experiment
23-07-2019T21:40:19,Bgrmystr2,"for the first time, probably"
23-07-2019T21:40:48,Sclimshady,She ran into them literally right after she was freed as a slave
23-07-2019T21:40:55,Bgrmystr2,yeah
23-07-2019T21:41:49,Sclimshady,"Honestly that freed then meet timeline had me confused for a bit, I originally thought it was a few months after."
23-07-2019T21:41:55,SomeNiceUser,Although she got released at a young age with her mother.
23-07-2019T21:42:11,Sclimshady,At 18
23-07-2019T21:44:26,SomeNiceUser,Then how did she get to Lynknoll?
23-07-2019T21:45:26,Sclimshady,"Before she was sold into slavery, oh wait, thats on me for misreading that"
23-07-2019T21:45:55,Bgrmystr2,"Her mother was originally Grand Templar, but I don't recall if she said she's been there or know it exists."
23-07-2019T21:46:44,Ordithus,Raine hasn't always told the whole story in one go... she mentioned Lyn'knoll well after the story of her slavery http://twokinds.keenspot.com/comic/602/
23-07-2019T21:46:45,Sclimshady,"I believe her and Mary lived there for a bit, I don't know why they left though"
23-07-2019T21:47:19,Bgrmystr2,Ah there it is then
23-07-2019T21:47:26,Bgrmystr2,yeah probably during Trace's reign
23-07-2019T21:47:55,Ordithus,She relayed her escape from slavery after she was first woofified in front of the others
23-07-2019T21:48:06,SomeNiceUser,She has probably left for personal reasons I suppose.
23-07-2019T21:48:40,Sclimshady,Her mom still never liked Keidren even after being one for a bit so that might be why
23-07-2019T21:49:01,SomeNiceUser,She left for revenge?
23-07-2019T21:49:17,Ordithus,My theory is that's when Neutral approached her
23-07-2019T21:50:06,Bgrmystr2,possibly
23-07-2019T21:50:13,Bgrmystr2,that would make sense
23-07-2019T21:50:29,SomeNiceUser,https://www.patreon.com/posts/deal-with-devil-26297768
23-07-2019T21:50:37,SomeNiceUser,Like this
23-07-2019T21:51:57,SomeNiceUser,"Although these sketches are small, they provide insights in the comic itself."
23-07-2019T21:51:57,Bgrmystr2,Yeah like that.
23-07-2019T21:52:14,Ordithus,At least in the sketches Raine was quite a bit younger when Euchre rescued her and Mary https://www.deviantart.com/twokinds/art/The-Breakout-790161779
23-07-2019T21:52:51,Bgrmystr2,"Ignoring the ""Nothing / Everything is canon"" running joke, the requests that are specifically about events that happened in the past of the comic you can probably take as canon."
23-07-2019T21:52:56,SomeNiceUser,I’d give it 6-8 years before meeting group b
23-07-2019T21:53:35,Bgrmystr2,suddenly deviantart is pitch black instead of it's nice cool forest green
23-07-2019T21:53:37,Bgrmystr2,well then.
23-07-2019T21:53:38,Ordithus,It does fit with the comic http://twokinds.keenspot.com/comic/729/
23-07-2019T21:53:56,SomeNiceUser,"Yes, it does."
23-07-2019T21:53:57,Ordithus,Huh?  DA is as green as ever for me
23-07-2019T21:55:48,Bgrmystr2,https://cdn.discordapp.com/attachments/353368103582826499/603782360940412938/firefox_2019-07-24_21-54-58.png Not logged in of course
23-07-2019T21:56:25,Bgrmystr2,obligatory aaaalink etc
23-07-2019T21:56:32,Ordithus,:ctwokinds-floAAA:
23-07-2019T21:56:53,Bgrmystr2,":ok_hand: perfect, cheers"
23-07-2019T21:57:33,SomeNiceUser,What operation system are you using..?
23-07-2019T21:57:46,Bgrmystr2,Windows 7
23-07-2019T21:58:00,Ordithus,Might be a glitch. Could be that ancient FireFox you are running
23-07-2019T21:58:24,SomeNiceUser,That is certainly a good reason.
23-07-2019T21:58:26,Ordithus,Is that pre v3?
23-07-2019T21:58:27,Bgrmystr2,52.9.0 ESR
23-07-2019T21:58:39,Bgrmystr2,before they removed the ability for people to make actual good addons
23-07-2019T21:58:42,Bgrmystr2,so I said fuckem
23-07-2019T21:58:46,Bgrmystr2,and stopped updating
23-07-2019T21:58:52,Ordithus,That'd explain the look
23-07-2019T21:59:04,Ordithus,Not nearly as old as I thought tho
23-07-2019T21:59:12,Bgrmystr2,I use Waterfox now because they actually value the users unlike Firefox who is now just trying to be Chromefox.
23-07-2019T21:59:27,Bgrmystr2,Both browsers have uses though
23-07-2019T21:59:28,Ordithus,Shiney vulpine
23-07-2019T22:00:17,Bgrmystr2,"anycase, Deviantart has the natural forest green look I am accustomed to on Waterfox"
23-07-2019T22:00:23,Bgrmystr2,which is always up-to-date.
23-07-2019T22:01:06,Bgrmystr2,My firefox is the very last version before 60+
23-07-2019T22:01:37,Bgrmystr2,so I can't make it update any longer without losing 100% of the user-friendly interface.
23-07-2019T22:01:48,Bgrmystr2,Such a pity.
23-07-2019T22:04:04,Ordithus,But anyways.  Raine is a nerd <3 :ctwokinds-rainehappy:
23-07-2019T22:04:16,Sclimshady,:heart:
23-07-2019T22:04:41,Bgrmystr2,Hmm.. I guess as much of a nerd as you can be in a world such as theirs.
23-07-2019T22:04:47,Bgrmystr2,Reni is much more of one imo.
23-07-2019T22:04:48,SomeNiceUser,A very friendly awkward cute nerd.
23-07-2019T22:04:55,Bgrmystr2,Raine has a lot of catching up to do.
23-07-2019T22:05:11,Sclimshady,Rain + Reni= best nerd buds
23-07-2019T22:05:24,Sclimshady,Raine*
23-07-2019T22:05:24,Ordithus,:ctwokinds-reniderp::ctwokinds-RaineEep::ctwokinds-reniderp_flip:
23-07-2019T22:06:19,SomeNiceUser,Spontaneous floof
23-07-2019T22:06:25,SomeNiceUser,yes
23-07-2019T22:07:06,SomeNiceUser,I enjoy all sudden floof.
23-07-2019T22:08:34,Bgrmystr2,"Hmm, guess it's time I got around to deleting my SPV3 install so I can install the new version. :u"
23-07-2019T22:10:25,SomeNiceUser,I love to annoy my little brother with Ferret.
23-07-2019T22:13:18,SomeNiceUser,I really should focus on making a script for my future webcomic.
23-07-2019T22:14:53,SomeNiceUser,"Well, I’m off to sleep. See y’all guys!"
23-07-2019T22:16:17,Bgrmystr2,gnight then
23-07-2019T22:16:19,Sclimshady,Night SNU
23-07-2019T22:48:04,Ordithus,:ctwokinds-RainezZz:
23-07-2019T22:49:15,Sclimshady,Night Ord :ctwokinds-natsducky:
23-07-2019T23:23:52,Bgrmystr2,🤔
23-07-2019T23:25:02,Bgrmystr2,"Almost 1 hr 20 mins into it, computer threw three and a half bitch fits and I'm on my second restart."
