date,user,comment
24-07-2019T22:08:19,SpazztasticKiwi,with
24-07-2019T22:08:26,AspiringNoodle,lol
24-07-2019T22:08:47,AspiringNoodle,Funny story... there are some people who are so attuned to academia that it is literally their career
24-07-2019T22:08:58,SpazztasticKiwi,I can feel the sarcasm though. Mood
24-07-2019T22:09:18,AspiringNoodle,Literally a guy out there with 6+ masters degrees.  He's smart enough that he can get a full ride whenever he decides to pursue a new degree
24-07-2019T22:09:31,SpazztasticKiwi,I can’t be seen with a male of my species around my age without ONE PERSON asking
24-07-2019T22:09:36,AspiringNoodle,But the problem is that he never goes for a PhD or pursue a career with one of those degrees
24-07-2019T22:09:39,SpazztasticKiwi,“so...you datin?”
24-07-2019T22:09:49,AspiringNoodle,Sounds like you perty ;D
24-07-2019T22:10:04,SpazztasticKiwi,God I doubt it
24-07-2019T22:10:13,SpazztasticKiwi,More like people be too damn nosy
24-07-2019T22:35:10,Ordithus,:ctwokinds-FloDance:
24-07-2019T22:36:03,AspiringNoodle,"Hey Ord, you missed quite a week with me :P"
24-07-2019T22:36:10,AspiringNoodle,"Or not, who knows, you might have been lurking"
24-07-2019T23:12:51,SpazztasticKiwi,can’t find my pink matte and 🔥
24-07-2019T23:13:11,SpazztasticKiwi,it specifically goes with my dress and it’s missing
24-07-2019T23:13:52,Sclimshady,Carrying fire sounds a little hazardous
24-07-2019T23:14:23,SpazztasticKiwi,oh I remember I’m off tomorrow
24-07-2019T23:14:34,SpazztasticKiwi,but that don’t bring my matte back
24-07-2019T23:15:44,SpazztasticKiwi,though if I’m being honest I have so many pinks ranging from peach to raspberries maybe I can find something else
24-07-2019T23:19:14,SpazztasticKiwi,and fire can’t hurt a dragon
24-07-2019T23:27:51,AspiringNoodle,Maybe not on the outside c:
24-07-2019T23:28:47,Bgrmystr2,":thinking: ""not so fireproof on the inside, are ya?"""
24-07-2019T23:33:37,SpazztasticKiwi,dragon or demon I might add
24-07-2019T23:33:46,SpazztasticKiwi,either one
24-07-2019T23:40:35,SpazztasticKiwi,hold everything
24-07-2019T23:40:54,Sclimshady,:ctwokinds-natsducky:
24-07-2019T23:40:57,SpazztasticKiwi,in China there’s a 50 lane highway that merges into 4
24-07-2019T23:41:47,Sclimshady,Noping away from that area
24-07-2019T23:44:02,SomeNiceUser,peaks in the seemingly empty room.
24-07-2019T23:44:15,AspiringNoodle,Just... woooooooooooow.  That is poor planning at its finest
24-07-2019T23:44:29,Sclimshady,*record scratch*
24-07-2019T23:44:44,SomeNiceUser,Oh hey guys!
24-07-2019T23:45:12,Sclimshady,"Oh, y'all know Tom is on Lann's twitch rn right"
24-07-2019T23:45:38,SomeNiceUser,He is?
24-07-2019T23:45:48,SomeNiceUser,That’s interesting.
24-07-2019T23:46:24,Sclimshady,"Yee, https://www.twitch.tv/lannsf"
24-07-2019T23:48:53,Sclimshady,They're eating cannibals
24-07-2019T23:49:05,SomeNiceUser,I see Unsteady.
24-07-2019T23:49:18,Bgrmystr2,yeah Tom is on Lann's stream on Thursday seemingly pretty regularly.
24-07-2019T23:49:37,AspiringNoodle,Lann just... chainsawed a bird :ptv-shock:
24-07-2019T23:49:47,Sclimshady,Dragon squad thursdays
24-07-2019T23:52:56,SpazztasticKiwi,aaaaahhhhhhhh
24-07-2019T23:53:06,SpazztasticKiwi,whydidntyousaysomethingearlier
24-07-2019T23:53:12,Sclimshady,:ctwokinds-floAAA:
24-07-2019T23:53:14,AspiringNoodle,"Oh man, that was funny"
24-07-2019T23:53:19,Sclimshady,I forgot
24-07-2019T23:53:35,Sclimshady,Even though i've been watching
24-07-2019T23:56:53,SomeNiceUser,"Well, I just followed Lann because it’s pretty funny seeing them breaking the laws of physics constantly."
24-07-2019T23:57:19,Sclimshady,Thats a pretty common thing in his streams
24-07-2019T23:57:40,SomeNiceUser,Thank you Shady for showing this gem.
24-07-2019T23:58:19,SomeNiceUser,Now I have a favourite.
24-07-2019T23:58:41,SomeNiceUser,:ptv-excited:
24-07-2019T23:58:44,AspiringNoodle,Some of the best video games are the ones with whacky physics
24-07-2019T23:58:52,AspiringNoodle,I lost my shit when Jacksepticeye played Gorn
24-07-2019T23:59:02,AspiringNoodle,"""GIMME DEM WOBBLY KNEES!"" :ptv-laugh:"
24-07-2019T23:59:05,SomeNiceUser,You are right about that Noodle.
24-07-2019T23:59:41,Sclimshady,Did you see Mark play the furry dating sim/time killer  he is in
