date,user,comment
24-07-2019T17:25:34,IronHorseComics,so that this mean the Russian guy's the 6?
24-07-2019T17:25:42,IronHorseComics,*so does
24-07-2019T17:25:50,Bgrmystr2,Probably. Kids in russia could have eaten that phone.
24-07-2019T17:25:56,Bgrmystr2,and here you are dropping it on the ground :v
24-07-2019T17:26:14,IronHorseComics,"""I'm distributing your points comrade"""
24-07-2019T17:26:32,Bgrmystr2,haha
24-07-2019T17:27:24,SomeNiceUser,Should have bought the Nokia phone.
24-07-2019T17:28:09,IronHorseComics,"""Oh no, not Finnish phones! They're my comrades' one weaknes!"""
24-07-2019T17:28:21,SomeNiceUser,:ptv-condescending:
24-07-2019T17:30:48,SomeNiceUser,"When I get bored, I take a long walk sometimes to the nearest convenience store."
24-07-2019T17:31:07,SomeNiceUser,But I’m always bored...
24-07-2019T17:31:30,SomeNiceUser,So I’m a regular there.
24-07-2019T17:31:39,SomeNiceUser,Lol
24-07-2019T17:47:44,Orthonox,I'm doing well SomeNiceUser. May I call you SNC for short?
24-07-2019T17:48:23,Bgrmystr2,where does the C come from?
24-07-2019T17:48:55,Orthonox,Darn it. I meant SNU.
24-07-2019T18:04:17,SpazztasticKiwi,anyone see the dick appointment challenge on twitter
24-07-2019T18:08:22,SpazztasticKiwi,when you think they can’t do anything different it happens
24-07-2019T18:10:00,Bgrmystr2,that's par for the course
24-07-2019T18:10:21,Bgrmystr2,who's got it stuck in the fan due to unclear instructions this time?
24-07-2019T18:11:21,SpazztasticKiwi,as entertaining and unsurprising that kind of thing is it was a challenge where ladies were texting their men for a dick appointment and screenshoting the responses
24-07-2019T18:12:03,SpazztasticKiwi,one lady said she hit send and her husband was in the room with her before the door even managed closed behind him
24-07-2019T18:12:09,SomeNiceUser,You can call me snu ort
24-07-2019T18:12:52,IronHorseComics,"hmmmm, make the Futurama joke, or NOT make the Futurama joke?"
24-07-2019T18:13:52,SomeNiceUser,Snu snu?
24-07-2019T18:14:29,IronHorseComics,if you murder someone does this mean they died by Snu Snu?
24-07-2019T18:14:49,SomeNiceUser,:ptv-kippi:
24-07-2019T18:16:10,SomeNiceUser,Death by snu snu
24-07-2019T18:16:19,BluePhantom90,yeah that was funny
24-07-2019T18:21:10,SpazztasticKiwi,if you’re talking death by nookie that’s happened before
24-07-2019T18:21:27,SpazztasticKiwi,1000 ways to die
24-07-2019T18:21:53,SomeNiceUser,Crushed?
24-07-2019T18:22:50,SpazztasticKiwi,no they hit the big o and their heart gave out
24-07-2019T18:23:25,Bgrmystr2,:ptv-ohmy: I heard lood
24-07-2019T18:23:42,SpazztasticKiwi,there’s a reason for the disclaimer “make sure your heart is healthy enough for sex”
24-07-2019T18:23:47,SpazztasticKiwi,some people ain’t
24-07-2019T18:23:48,SomeNiceUser,:ptv-wondering: lood?
24-07-2019T18:24:39,Bgrmystr2,you
24-07-2019T18:24:45,SomeNiceUser,"Spaz, that’s a good life tip."
24-07-2019T18:25:03,SomeNiceUser,For unhealthy people.
24-07-2019T18:25:44,SpazztasticKiwi,“I’m fit as a fiddle!”
24-07-2019T18:25:44,SomeNiceUser,"If you can’t do the sex, you’re not healthy."
24-07-2019T18:25:56,SpazztasticKiwi,“Yeah with a couple strings missing”
24-07-2019T18:26:20,SomeNiceUser,Lol
24-07-2019T18:26:28,SpazztasticKiwi,there’s a few healthy people that should sex because they don’t know what their doing
24-07-2019T18:26:37,SpazztasticKiwi,shouldn’t
24-07-2019T18:27:03,SpazztasticKiwi,plus there’s the healthy ones that just don’t need to so they don’t risk reproducing
24-07-2019T18:27:30,Bgrmystr2,haha the 2nd one is truth
24-07-2019T18:28:38,SpazztasticKiwi,something I saw that made my crotch catch fire: the other day we tried food in the bedroom
24-07-2019T18:28:59,SpazztasticKiwi,and by food I mean he tried whiskey”
24-07-2019T18:29:09,SpazztasticKiwi,bless her heart
24-07-2019T18:29:14,IronHorseComics,you ate breakfast in bed *sees the next text* dog gone it
24-07-2019T18:29:36,IronHorseComics,honestly having breakfast in bed's kinda overrated
24-07-2019T18:29:41,SomeNiceUser,:ptv-RainbowThrowup:
24-07-2019T18:30:09,SpazztasticKiwi,I mean that depends on the meal
24-07-2019T18:30:19,SomeNiceUser,Ima go to the store real quick brb
24-07-2019T18:32:04,AspiringNoodle,I'm back
24-07-2019T18:32:15,AspiringNoodle,And Bgr isn't being completely fair to aRGB builds
24-07-2019T18:32:25,AspiringNoodle,You're SUPPOSED to have some kind of control software to coordinate everything.
24-07-2019T18:32:43,Bgrmystr2,supposed to.
24-07-2019T18:32:49,Bgrmystr2,but since everyone has their own software
24-07-2019T18:32:51,Bgrmystr2,you really can't.
24-07-2019T18:32:54,Bgrmystr2,:V
24-07-2019T18:33:21,AspiringNoodle,"It's annoying because it is possible to lock yourself into a single ecosystem, but it limits your options"
24-07-2019T18:33:24,Bgrmystr2,"also, most people who buy RGB builds just go for the obligatory rainbow vomit inside the case."
24-07-2019T18:33:49,SpazztasticKiwi,wonder if Tom’s got anything for his birthday
24-07-2019T18:33:53,Bgrmystr2,there's a reason why the whole rainbow filter is popular.
24-07-2019T18:35:18,IronHorseComics,it's pretty?
24-07-2019T18:38:16,SpazztasticKiwi,humans are featherless birds
24-07-2019T18:44:08,CrRAR,:scream:
24-07-2019T19:09:02,Bgrmystr2,:thinking:
24-07-2019T19:10:27,CrRAR,My bones don't FEEL optimized for flight.
24-07-2019T19:11:20,SpazztasticKiwi,So you guys want to guess what my cousin’s husband got in a fight with
24-07-2019T19:11:34,IronHorseComics,a spider?
24-07-2019T19:11:36,CrRAR,Armadillo?
24-07-2019T19:11:55,CrRAR,Is it bigger or smaller than him?
24-07-2019T19:12:10,SpazztasticKiwi,smaller
24-07-2019T19:12:15,SpazztasticKiwi,and
24-07-2019T19:12:25,SpazztasticKiwi,inanimate
24-07-2019T19:12:31,IronHorseComics,a toaster?
24-07-2019T19:12:41,CrRAR,A mop?
24-07-2019T19:12:55,CrRAR,Those are scary when they fall out the closet.
24-07-2019T19:12:59,SpazztasticKiwi,You’re getting closer with the kitchen appliances
24-07-2019T19:13:20,CrRAR,How bad were his injuries?
24-07-2019T19:13:24,CrRAR,Waffle iron?
24-07-2019T19:13:34,CrRAR,Panini PRESS!
24-07-2019T19:13:42,SpazztasticKiwi,Food processor. They had to stitch his finger back together
24-07-2019T19:13:51,CrRAR,oh god
24-07-2019T19:14:00,CrRAR,I was going to say blender
24-07-2019T19:14:07,IronHorseComics,why? why would you gt into a fight with a food processor?
24-07-2019T19:14:09,CrRAR,I was hoping it was not that tragic.
24-07-2019T19:14:40,CrRAR,He REALLY wanted that one unchopped strawberry swirling about.
24-07-2019T19:14:48,Bgrmystr2,BZZZZZZT prettymuch
24-07-2019T19:15:47,SpazztasticKiwi,actually he was washing the parts and that’s how it got him
24-07-2019T19:15:58,CrRAR,damnnit
24-07-2019T19:16:08,SpazztasticKiwi,kinda like when I cut my toe open - gashed open the side
24-07-2019T19:16:27,IronHorseComics,ouch
24-07-2019T19:16:44,CrRAR,Who turned it on? Was a Chucky doll nearby?
24-07-2019T19:16:53,SpazztasticKiwi,wanna know how to make it a little worse
24-07-2019T19:17:00,SpazztasticKiwi,it got part of his nail too
24-07-2019T19:17:23,CrRAR,damn
24-07-2019T19:17:56,SpazztasticKiwi,he was washing the blade - it wasn’t attached to anything turned on or even plugged in any way
24-07-2019T19:18:00,IronHorseComics,"I remember that happening to my toenail, accidentally hit the vaccume head as I walked past it"
24-07-2019T19:18:19,CrRAR,Scary
24-07-2019T19:18:42,CrRAR,"I smell a lawsuit,"
24-07-2019T19:19:03,IronHorseComics,it's one of those wall vaccumes where you hook a hose to the wall and the head was detachable. Always hated that thing
24-07-2019T19:19:07,CrRAR,Wait did he just squeeze the blade too hard?
24-07-2019T19:19:29,SpazztasticKiwi,it’s probably soapy
24-07-2019T19:19:42,SpazztasticKiwi,slippy + sharp don’t mix
24-07-2019T19:19:45,CrRAR,Like a central vac attachment iron?
24-07-2019T19:19:58,CrRAR,yeah no bueno spazz.
24-07-2019T19:20:32,IronHorseComics,yeah except it was bulky
24-07-2019T19:21:09,IronHorseComics,much more so than the ones of today
24-07-2019T19:24:06,CrRAR,I know some of those are fancy with metal heads
24-07-2019T19:24:21,CrRAR,sucks
24-07-2019T19:24:29,CrRAR,i know
24-07-2019T19:24:34,CrRAR,:ctwokinds-keith8D:
24-07-2019T19:25:15,IronHorseComics,sucks more than a regular vaccume that's for sure
24-07-2019T19:25:50,SpazztasticKiwi,oh and dude from work proposed Netflix and chill
24-07-2019T19:26:10,SpazztasticKiwi,only 10% sure he was joking
24-07-2019T19:26:19,SpazztasticKiwi,still said no
24-07-2019T19:26:45,CrRAR,jeez lol
24-07-2019T19:27:00,SomeNiceUser,comes back with ice cream.
24-07-2019T19:27:25,AspiringNoodle,I had ice cream. Just finished it :D
24-07-2019T19:27:47,CrRAR,amazing
24-07-2019T19:27:53,SomeNiceUser,I gave some to my dog.
24-07-2019T19:28:06,SomeNiceUser,He licked the bowl cl an.
24-07-2019T19:28:27,SomeNiceUser,It seems that the e has been stolen.
24-07-2019T19:28:32,SpazztasticKiwi,dogs aren’t supposed to have dairy
24-07-2019T19:28:51,SomeNiceUser,Only small portions are ok.
24-07-2019T19:29:07,IronHorseComics,"you know, I bet I know what Tom got for his birthday... the ability to give his Mike poster to Danny from Game Grumps"
24-07-2019T19:29:12,SpazztasticKiwi,it builds up just make sure there’s no chocolate
24-07-2019T19:29:14,IronHorseComics,off topic I know
24-07-2019T19:29:31,SpazztasticKiwi,Tom watches Danny
24-07-2019T19:29:39,SpazztasticKiwi,since when
24-07-2019T19:29:44,CrRAR,lol
24-07-2019T19:29:56,SomeNiceUser,Chocolate is very bad for dogs.
24-07-2019T19:30:08,CrRAR,They're pretty unavoidable if you even game the TINIEST bit.
24-07-2019T19:30:26,CrRAR,I think Tom mentioned he met one of them once.
24-07-2019T19:30:36,IronHorseComics,plus there's a joke that Danny's a furry
24-07-2019T19:30:40,Bgrmystr2,Wish doggos could eat chocolate
24-07-2019T19:30:44,SpazztasticKiwi,and I’d say giving a Mike poster to Danny might be weird but he has called himself Danny Sexbang so
24-07-2019T19:30:47,Bgrmystr2,it's so good
24-07-2019T19:30:51,CrRAR,lol
24-07-2019T19:30:56,SpazztasticKiwi,there’s jokes Seáns a furry
24-07-2019T19:31:15,SomeNiceUser,Furry jokes are furry.
24-07-2019T19:31:26,Bgrmystr2,does it matter if he is..?
24-07-2019T19:31:31,IronHorseComics,eeehhh I never saw that from Jacksepticeye
24-07-2019T19:31:32,CrRAR,I love the wide-eyed excited look dogs get when they get sweet treats.
24-07-2019T19:31:55,SomeNiceUser,I do too!
24-07-2019T19:32:06,SpazztasticKiwi,if you mean met one of the grumps it’d be either Danny or Aron
24-07-2019T19:32:16,SomeNiceUser,It’s heart warming...
24-07-2019T19:32:38,CrRAR,yis
24-07-2019T19:32:56,SpazztasticKiwi,though here’s been a livestream where Mark showed Tom to Bob and Wade
24-07-2019T19:33:08,SpazztasticKiwi,maybe that’s who he meant he met
24-07-2019T19:33:32,AspiringNoodle,If you give sweets to a Samoyed
24-07-2019T19:33:45,AspiringNoodle,Do they turn into a literal marshmallow? :ptv-wondering:
24-07-2019T19:34:00,SomeNiceUser,Question of the century.
24-07-2019T19:35:18,SpazztasticKiwi,if you’ve seen Lucy you’d know they’re already marshmallows
24-07-2019T19:36:25,CrRAR,Marshmallow 2: Marshmalloier
24-07-2019T19:37:45,CrRAR,Someone get Bill Nye on it. He's got plenty of free time.
24-07-2019T19:37:51,Sclimshady,What if you made Rice krispie treats out of lucky charms marshmallows?
24-07-2019T19:38:10,CrRAR,Like mixed in?
24-07-2019T19:38:24,CrRAR,OR ALL lucky charms?
24-07-2019T19:38:44,IronHorseComics,they already have
24-07-2019T19:38:57,Sclimshady,WHAT!?
24-07-2019T19:39:05,Sclimshady,Where do I buy?
24-07-2019T19:39:14,CrRAR,"You wouldn't just TASTE the rainbow, you BECOME the rainbow."
24-07-2019T19:39:18,IronHorseComics,well I thought they officially made one
24-07-2019T19:39:31,IronHorseComics,but there are recipes online for it
24-07-2019T19:40:09,IronHorseComics,"which is odd, I could have sworn I've seen them at Walmart in the past"
24-07-2019T19:40:21,CrRAR,Maybe a special edition
24-07-2019T19:40:47,Sclimshady,I could probably do it if i mixed the melted marsh goo into the lucky charms off the burner so they wouldnt dissolve
24-07-2019T19:41:47,SpazztasticKiwi,“Bagheera don’t do that you’re gonna fall. Bagheera don-“ Bagheera: *falls*
24-07-2019T19:41:54,CrRAR,lol
24-07-2019T19:42:06,CrRAR,It's just his routine
24-07-2019T19:42:10,SpazztasticKiwi,and he’s got the nerve to look at me like it’s my fault
24-07-2019T19:42:26,CrRAR,haha
24-07-2019T19:42:49,CrRAR,"""You... you didn't try to SAVE me"""
24-07-2019T19:42:52,CrRAR,:ctwokinds-LauraCry:
24-07-2019T19:43:07,SpazztasticKiwi,I was three feet away at the microwave
24-07-2019T19:43:22,CrRAR,haha
24-07-2019T19:43:40,CrRAR,Did he slide off something per the usual?
24-07-2019T19:44:07,SpazztasticKiwi,the chair arm
24-07-2019T19:44:35,CrRAR,Maybe the delicious food smells interfere with his mental abilities.
24-07-2019T19:44:52,SpazztasticKiwi,it was a pasta cup
24-07-2019T19:44:59,SpazztasticKiwi,boiling noodles
24-07-2019T19:45:14,CrRAR,That could smell trippy to a cat
24-07-2019T19:45:23,CrRAR,you never really KNOW
24-07-2019T19:45:27,CrRAR,lol
24-07-2019T19:45:44,SpazztasticKiwi,I’m pretty sure he’s just trippy on his own
24-07-2019T19:45:51,CrRAR,hahaha
24-07-2019T19:46:26,SpazztasticKiwi,for example I clean the bathroom and his litterbox
24-07-2019T19:46:43,SpazztasticKiwi,and now he wants to lay in the litterbox
24-07-2019T19:46:55,SpazztasticKiwi,so I guess I cleaned it too good
24-07-2019T19:47:17,CrRAR,lol
24-07-2019T19:47:29,CrRAR,but also ew
24-07-2019T19:59:37,AspiringNoodle,hmmm
24-07-2019T19:59:54,AspiringNoodle,Trying to decide if I want to do this case: https://www.newegg.com/iron-grey-cooler-master-mastercase-h500m-atx-mid-tower/p/N82E16811119349?Item=N82E16811119349
24-07-2019T20:00:00,AspiringNoodle,And which one of these coolers
24-07-2019T20:00:16,AspiringNoodle,H115i: https://www.newegg.com/p/N82E16835181152
24-07-2019T20:00:28,AspiringNoodle,H150i: https://www.newegg.com/p/N82E16835181139
24-07-2019T20:04:37,SpazztasticKiwi,how come dispite how bad it hurts guys will laugh at each other cracking themselves in the crotch
24-07-2019T20:06:06,AspiringNoodle,"Comedy, at its heart, is about laughing at other people's misfortunes :)"
24-07-2019T20:06:31,IronHorseComics,and often we know that pain
24-07-2019T20:06:51,IronHorseComics,or at least a small piece of it
24-07-2019T20:09:09,SpazztasticKiwi,half of me is like can I laugh should I laugh and are you ok
24-07-2019T20:09:17,SpazztasticKiwi,as ridiculous as that question is
24-07-2019T20:09:50,SpazztasticKiwi,cause most of em are laying on the floor in pain like they’ve had their intestines pulled out
24-07-2019T20:10:27,AspiringNoodle,"Oh, believe us, it hurts like hell"
24-07-2019T20:10:31,AspiringNoodle,But it's still funny ;D
24-07-2019T20:10:32,Bgrmystr2,"the one with 3 fans will have more sheer airflow, noodle"
24-07-2019T20:10:44,Bgrmystr2,whether that translates into better cooling is debatable
24-07-2019T20:10:47,CrRAR,It's how bros console each other.
24-07-2019T20:11:00,CrRAR,With cacophonous laughter.
24-07-2019T20:11:04,AspiringNoodle,"Bgr, if that's the case, I might have one that could make it easier to choose"
24-07-2019T20:11:04,SpazztasticKiwi,“you’re in pain allow me to laugh”
24-07-2019T20:11:09,SpazztasticKiwi,solid logic
24-07-2019T20:11:46,CrRAR,Sometimes it even makes the sufferer laugh too!
24-07-2019T20:11:47,IronHorseComics,"""laugh the pain off bro"""
24-07-2019T20:11:52,CrRAR,(and cry)
24-07-2019T20:12:14,CrRAR,(very deep and sobby cries)
24-07-2019T20:12:19,AspiringNoodle,Extra points if their voice goes up a few octaves
24-07-2019T20:12:23,AspiringNoodle,:ptv-laugh:
24-07-2019T20:12:25,CrRAR,lol
24-07-2019T20:13:38,CrRAR,If you happen to pass out from the pain you'll most likely wake up sharpied on.
24-07-2019T20:13:44,CrRAR,So don't do that.
24-07-2019T20:13:56,SpazztasticKiwi,suddenly soprano
24-07-2019T20:13:57,CrRAR,It's like modern-day natural selection.
24-07-2019T20:14:12,AspiringNoodle,Like that guy who went for the world record
24-07-2019T20:14:15,SpazztasticKiwi,how do you honestly hit yourself hard enough to pass out
24-07-2019T20:14:17,AspiringNoodle,"""Most times kicked in the nuts in a row"""
24-07-2019T20:14:29,AspiringNoodle,Don't think they should be allowed to breed
24-07-2019T20:14:38,CrRAR,"""You sir... are NOT a winner"""
24-07-2019T20:14:40,SpazztasticKiwi,oh wasn’t there a guy that paid people to do that for a “prank” video
24-07-2019T20:14:56,Bgrmystr2,"I don't exactly have experience with water cooling, but I do know it's not TOO different when it comes to the radiator itself. The amount of air you can push through the radiator going to help drop the temperature."
24-07-2019T20:15:22,SpazztasticKiwi,well theoretically if he doesn’t lose his breeding ability he’ll be too sore to copulate for awhile
24-07-2019T20:15:22,CrRAR,Yeah the 3 fan layout is niiice
24-07-2019T20:15:36,AspiringNoodle,https://www.newegg.com/satin-black-phanteks-evolv-x-atx-mid-tower/p/N82E16811854078
24-07-2019T20:15:53,AspiringNoodle,"I'm thinking I could move the exhaust fan to the front, fill out the 420mm intake"
24-07-2019T20:15:53,Bgrmystr2,and three fans at 1600 is more than two fans at 2000. 4800 > 4000
24-07-2019T20:16:00,CrRAR,"""The spirit is willing, but the flesh is spongey and bruised"""
24-07-2019T20:16:20,AspiringNoodle,And then I could get another ML120 fan for the exhaust :D
24-07-2019T20:16:21,Bgrmystr2,"but if airflow was all it is, you'd just be looking at an air cooler"
24-07-2019T20:16:31,Bgrmystr2,there's a lot more to it to the liquid cooling systems
24-07-2019T20:16:53,AspiringNoodle,Cons of air coolers: They're big.
24-07-2019T20:17:01,Bgrmystr2,"what liquids, the build quality, the connections, etc"
24-07-2019T20:17:17,Bgrmystr2,all the stuff in between the block and the radiator matter too
24-07-2019T20:17:34,SpazztasticKiwi,one of the few moments that she wants to but he’s not in the mood
24-07-2019T20:17:43,SpazztasticKiwi,oh how the tables turn
24-07-2019T20:18:14,CrRAR,curses
24-07-2019T20:19:04,Bgrmystr2,"Kiwi, watching people do dumb things is usually silly and comedy"
24-07-2019T20:19:09,AspiringNoodle,"If you go liquid cooler, EVGA and Corsair are immediate winners."
24-07-2019T20:19:25,Bgrmystr2,"but watching that, specifically usually just makes you go ""ow, I felt that and it didn't even happen to me"""
24-07-2019T20:19:58,Bgrmystr2,"some people just don't care about the misfortune of others, so they laugh without bothering to care, but that just makes them bad people"
24-07-2019T20:20:01,Bgrmystr2,so we don't speak of them :)
24-07-2019T20:27:47,SpazztasticKiwi,then there’s the oh that had to hurt cringe
24-07-2019T20:28:01,SpazztasticKiwi,like your body’s trying to cave in from the horror
24-07-2019T20:28:46,SpazztasticKiwi,which makes me think of the “brilliant” idea of a video I watched yesterday about first kisses in slow motion
24-07-2019T20:29:08,SpazztasticKiwi,3 couples. Their first kiss. Slow motion. And no they’ve never met before that
24-07-2019T20:38:09,ZahnHolley,Hello did I miss the stream again?
24-07-2019T20:38:23,Bgrmystr2,no
24-07-2019T20:38:27,Bgrmystr2,there was no stream
24-07-2019T20:38:37,Bgrmystr2,people are always here
24-07-2019T20:39:36,ZahnHolley,usually Tom shows up when people are active.
24-07-2019T20:39:43,Bgrmystr2,not really
24-07-2019T20:39:47,Bgrmystr2,he shows up regardless lol
24-07-2019T20:42:36,ZahnHolley,that figures... I’m happy that I didn’t miss out on his stream.
24-07-2019T20:43:30,SpazztasticKiwi,Toms been off for days now
24-07-2019T20:44:08,SpazztasticKiwi,with those conventions back to back he may have taken a rest
24-07-2019T20:44:21,Bgrmystr2,it's not likely for him to have streamed anyway since he just came back from a convention.
24-07-2019T20:44:31,ZahnHolley,He must be very busy this summer.
24-07-2019T20:44:50,Bgrmystr2,"this month, maybe"
24-07-2019T20:47:40,Orthonox,I think the guy deserves some rest. He's done a lot.
24-07-2019T20:47:43,SpazztasticKiwi,he always busy
24-07-2019T20:49:51,ZahnHolley,Did you guys commission him at comic con?
24-07-2019T20:50:28,Bgrmystr2,"I didn't go, who the fuck has enough money for that lol"
24-07-2019T20:51:48,ZahnHolley,Idk know... I was just guessing if he was open for commission?
24-07-2019T20:51:51,IronHorseComics,and why would I want to go to San Diego when Atlanta is just two hours drive south of me?
24-07-2019T20:51:51,Bgrmystr2,"long ass drive, expensive hotel, long stay, expensive convention tickets.. if they aren't already sold out within 4 mins."
24-07-2019T20:52:12,SpazztasticKiwi,oh you know I wonder how it’s gonna go for him since Mark said he’s going with their mom to Korea September
24-07-2019T20:52:20,Bgrmystr2,"Tom doesn't go to to Atlanta so I'm pretty sure that point is moot,  Iron"
24-07-2019T20:52:32,SpazztasticKiwi,Toms gonna have the dogs and work to himself
24-07-2019T20:52:33,Bgrmystr2,the convention he goes to is in San Diego.
24-07-2019T20:52:49,SpazztasticKiwi,I wish he’d go to Atlanta
24-07-2019T20:52:53,SpazztasticKiwi,Or PAX
24-07-2019T20:53:03,Bgrmystr2,it'd be closer to me in Atlanta for sure
24-07-2019T20:53:10,Bgrmystr2,but still quite a drive.
24-07-2019T20:53:15,SpazztasticKiwi,only 3 hours here
24-07-2019T20:53:33,IronHorseComics,"2 hours, same would be if he went to Nashville"
24-07-2019T20:53:40,IronHorseComics,or Knoxville (ew)
24-07-2019T20:53:55,Ordithus,"All these places, it would be faster for me to just crash his house"
24-07-2019T20:53:55,ZahnHolley,That’s a long ass drive.
24-07-2019T20:54:12,Bgrmystr2,"Probably a good 10 or 12 hours from here I think, according to a friend of mine who evacuated there during Katrina"
24-07-2019T20:54:21,Ordithus,But then he'd call the po-po :ctwokinds-keifacepalm:
24-07-2019T20:54:31,SpazztasticKiwi,If he lived
24-07-2019T20:54:33,Bgrmystr2,haha
24-07-2019T20:54:46,SpazztasticKiwi,you know provided you didn’t run him over
24-07-2019T20:55:01,Ordithus,"As in party crash, not literal, car crash"
24-07-2019T20:55:06,Ordithus,Jeez
24-07-2019T20:55:06,IronHorseComics,little known fact is that Tom has a dragon mount
24-07-2019T20:55:28,SpazztasticKiwi,what proces your a fan more than to literally drive through their house
24-07-2019T20:55:32,SpazztasticKiwi,proves
24-07-2019T20:56:15,Ordithus,:ctwokinds-reniderp:*[I'm your biggest fan!]
24-07-2019T20:56:18,Ordithus,SMASH
24-07-2019T20:57:43,SpazztasticKiwi,LOVEME
24-07-2019T20:58:36,SpazztasticKiwi,oh I got another cat picture
24-07-2019T20:59:05,IronHorseComics,*throws hands up* CAAAAT!
24-07-2019T20:59:14,SpazztasticKiwi,this guy was finding he was waking up in the middle of the night not able to breathe so he set up a camera and
24-07-2019T20:59:18,SpazztasticKiwi,https://media.discordapp.net/attachments/524825976597643265/604130358296051712/image0.jpg
24-07-2019T20:59:41,IronHorseComics,"""Target acquired"""
24-07-2019T20:59:42,Ordithus,"""To kill, or not to kill, that is the question"""
24-07-2019T20:59:49,SpazztasticKiwi,"first off, who sleeps soundly like Dracula"
24-07-2019T20:59:55,AspiringNoodle,"""hooman, I am hungry"""
24-07-2019T21:00:02,AspiringNoodle,"""AH, HOOMAN WAKING UP!"""
24-07-2019T21:00:03,ZahnHolley,Even thou we don’t post links.
24-07-2019T21:00:29,SpazztasticKiwi,“awaken slave I hunger”
24-07-2019T21:00:42,Bgrmystr2,Sometimes we post links though.
24-07-2019T21:01:11,Bgrmystr2,"Also, Ord is here so he can delete something if it's bad or whatever"
24-07-2019T21:01:32,Ordithus,":ctwokinds-kingtea:*[Sorry, I'm off duty]"
24-07-2019T21:01:35,Bgrmystr2,Noone really comes here when there isn't a stream anyway.
24-07-2019T21:01:44,Bgrmystr2,yeah but you'd still delet if it were bad. :P
24-07-2019T21:01:48,ZahnHolley,Good point
24-07-2019T21:01:54,Ordithus,True
24-07-2019T21:03:20,IronHorseComics,"anyway, I'm off for bed, I'll see y'all later"
24-07-2019T21:03:24,ZahnHolley,I don’t post links anymore. I respect people rules in terms
24-07-2019T21:03:33,IronHorseComics,RULEZ!
24-07-2019T21:03:44,Ordithus,Night Iron
24-07-2019T21:04:00,SpazztasticKiwi,how dare you think I would even be capable of so much as referencing something inappropriate
24-07-2019T21:04:08,SpazztasticKiwi,I’m always proper
24-07-2019T21:04:42,SpazztasticKiwi,I don’t slur my swears I enunciate like a fukin lady
24-07-2019T21:05:28,ZahnHolley,I see your point there dude.
24-07-2019T21:06:46,Bgrmystr2,xD Kiwi
24-07-2019T21:25:58,AspiringNoodle,"Yup, I've officially reached ""fuck it"""
24-07-2019T21:26:12,AspiringNoodle,"I'm just gonna order parts for my computer.  If I plan to pretty everything up later, I will :/"
24-07-2019T22:02:15,SpazztasticKiwi,“are you gonna ask your father if he approves of your boyfriend before you marry him?”
24-07-2019T22:02:43,SpazztasticKiwi,“sure - we’ll even travel and ask the pope since we’re getting everyone’s opinions”
24-07-2019T22:02:51,SpazztasticKiwi,I can taste the sarcasm
24-07-2019T22:02:56,Bgrmystr2,Haha
24-07-2019T22:03:03,Bgrmystr2,deserved sarcasm is deserved.
24-07-2019T22:05:31,AspiringNoodle,"I mean, I can understand wanting approval from your family"
24-07-2019T22:05:43,AspiringNoodle,"But in the end, it's your decision, so fuck everyone else :3"
24-07-2019T22:07:21,SpazztasticKiwi,buddy there’s not a man in the world that would’ve ever met my dads approval
24-07-2019T22:07:50,SpazztasticKiwi,my moms picky in that he needs to have a job and future and manners
24-07-2019T22:08:15,SpazztasticKiwi,but my dad was against anyone who wasn’t white without 6 degrees
