date,user,comment
29-07-2019T12:09:16,AspiringNoodle,"However, I wouldn't recommend buying 3600 CL16 unless you REALLY want to squeeze out every last drop of performance and don't care about the cost"
29-07-2019T12:09:33,AspiringNoodle,"After 3000 CL16, there seems to be serious diminishing returns"
29-07-2019T12:11:27,Orthonox,I would imagine diminishing returns would exist but thank you for the info. Crazy how computer hardware changes after a few years.
29-07-2019T12:11:57,AspiringNoodle,"I think Intel also sees gains with higher ram performance, but we're talking single digit percentages in improvement"
29-07-2019T12:12:27,AspiringNoodle,"However, if they're forced to go with chiplet design like AMD to improve yields, that might change super quick"
29-07-2019T12:13:35,Orthonox,I'm just happy there is competition now with AMD going from the underdog to the king. Shows that Intel really has not been innovating for the past many years.
29-07-2019T12:14:00,AspiringNoodle,"I looked into that, there are 3 reasons they are struggling atm"
29-07-2019T12:14:40,AspiringNoodle,1) Their monolith chip design is biting them in the ass.  Turns out that the I/O section of processors really doesn't like die shrinkage
29-07-2019T12:14:56,AspiringNoodle,"It's why AMD's processors have a 14 nm I/O die, and the actual processors are 7nm"
29-07-2019T12:15:27,AspiringNoodle,2) In-house fabrication.  They are able to pack more transistors into their processors than any other manufacturer.
29-07-2019T12:16:07,AspiringNoodle,That's part of the reason they perform so well in single-thread workloads at 14nm
29-07-2019T12:16:20,AspiringNoodle,3) Both of the above.
29-07-2019T12:16:54,AspiringNoodle,"Specifically, the monolith design reduces yields, because they design the whole processor and produce it all at once"
29-07-2019T12:17:17,AspiringNoodle,"By breaking the chip up into smaller, separate dies, AMD can easily bin multiple parts to create a single processor"
29-07-2019T12:17:56,AspiringNoodle,And the transistor count is a case of Intel being a victim of their own success
29-07-2019T12:18:24,AspiringNoodle,"They've refined their 14nm processors so much, that it might take 2 generations of 10nm processors to match the performance"
29-07-2019T12:19:35,AspiringNoodle,We don't know when they'll finally release their 10nm processors for desktop.  But at this point Intel needs to put out something that's even more powerful than their 14nm++[+] processors
29-07-2019T12:20:11,AspiringNoodle,"And if [when] Intel is forced to go to a chiplet design, there's no telling how that will affect the performance of their processors."
29-07-2019T12:20:22,AspiringNoodle,"They could be just as powerful, or they could take serious performance hits."
29-07-2019T12:20:27,AspiringNoodle,#EndLesson
29-07-2019T12:24:51,Orthonox,Are you saying is that Intel needs a new CPU architecture to compete with AMD?
29-07-2019T12:25:13,AspiringNoodle,Yes
29-07-2019T12:25:29,AspiringNoodle,They've been working on 10nm for YEARS.  It's why they're still putting out 14nm++++++++++++++++++++++++ processors
29-07-2019T12:26:09,AspiringNoodle,"If they don't bite the bullet and do something, by the time they finally release 10nm desktop processors, AMD could be on Zen 3 or 4"
29-07-2019T12:26:35,AspiringNoodle,"At which point that ""amazing performance"" will become moot :|"
29-07-2019T12:27:07,Orthonox,Okay because that is what AMD did when the Bulldozer-based architecture wasn't working for them.
29-07-2019T12:27:58,AspiringNoodle,"Except when AMD was working on Ryzen, they kinda went silent"
29-07-2019T12:28:07,AspiringNoodle,Intel won't shut the hell up about their 10nm
29-07-2019T12:28:40,AspiringNoodle,"So the moment Intel either stops talking about that, or starts talking about something else, THEN they might finally be innovating :3"
29-07-2019T12:31:43,AspiringNoodle,You looking to build a new computer?
29-07-2019T12:31:46,Orthonox,You still gotta act like you are the top dog when you have the highest market share.
29-07-2019T12:31:50,Orthonox,Not yet.
29-07-2019T12:32:09,Orthonox,My PC is still going strong.
29-07-2019T12:32:28,Orthonox,I'll upgrade when the new consoles come out.
29-07-2019T12:33:07,AspiringNoodle,I wonder if they'll actually be able to compete with higher end PC hardware ;P
29-07-2019T12:33:34,AspiringNoodle,Someone actually posted a graph somewhere showing console power relative to PC power.  There was roughly one one point in time where a console was more powerful
29-07-2019T12:34:20,AspiringNoodle,"Correction, two points"
29-07-2019T12:34:37,AspiringNoodle,Graph of console vs pc compute power: http://i.imgur.com/49wLXFP.jpg
29-07-2019T12:34:51,Orthonox,"Before this generation, it used to be that when a new console comes out, it would perform just as well if not better than high-end PCs at launch."
29-07-2019T12:37:38,Orthonox,There is some problems with this graph you linked. First question: Who made this graph?
29-07-2019T12:38:14,AspiringNoodle,Let me see if I can find it
29-07-2019T12:40:09,AspiringNoodle,There's a better one
29-07-2019T12:40:14,AspiringNoodle,It shows console teraflops over time
29-07-2019T12:42:44,AspiringNoodle,Which console claimed its performance would be better than a 1080?
29-07-2019T12:43:45,Orthonox,That's a much better graph than the previous one.
29-07-2019T12:45:56,AspiringNoodle,"Alright, so the 1080 is at about 8.9 TFLOPs of performance"
29-07-2019T12:47:33,AspiringNoodle,2060 Super: 7.18
29-07-2019T12:47:55,AspiringNoodle,2070 Super: 9.06
29-07-2019T12:48:22,AspiringNoodle,2080 Super: 11.15
29-07-2019T12:48:48,TeapotOfDoom,Tflops is a horrible metric
29-07-2019T12:48:49,AspiringNoodle,I'll be interested to see where the new consoles land :D
29-07-2019T12:49:07,AspiringNoodle,And it's the only way we can compare the power in consoles :/
29-07-2019T12:49:14,TeapotOfDoom,Nobody in their right mind does compute stuff at home
29-07-2019T12:49:40,TeapotOfDoom,Except people who do neuronal networks for fun
29-07-2019T12:49:42,AspiringNoodle,"Again, it's the only way we can realistically measure the horsepower in consoles over time"
29-07-2019T12:49:55,TeapotOfDoom,Who still do not count as in their right mind imo xD
29-07-2019T12:50:26,TeapotOfDoom,I would not call it realistic but i get where you're going
29-07-2019T12:50:53,TeapotOfDoom,Is there really no geekbench or something? I mean there is one for phones
29-07-2019T12:51:10,AspiringNoodle,Just gotta deal with it
29-07-2019T12:51:32,AspiringNoodle,"I've put the numbers out there, now it's a case of wait and see"
29-07-2019T12:51:57,Orthonox,I was going to tell him that. There are many other factors that go into the overall gaming performance. I understand it is relative but not something I would depend on.
29-07-2019T12:52:27,AspiringNoodle,"Well, it's not like you're going to get a fair comparison any other way"
29-07-2019T12:52:28,TeapotOfDoom,Explaination why i said that for anyone who is not is computer science: you can have two systems with the same tflops who do completely different in another task
29-07-2019T12:52:41,AspiringNoodle,PC games have editable graphics settings
29-07-2019T12:53:49,TeapotOfDoom,"Also console versions are mastered with the hardware in mind. So ""maxing out"" means something different than on pcs. Depending on the game you can clearly see a difference"
29-07-2019T12:54:18,TeapotOfDoom,Do consoles have graphic settings?
29-07-2019T12:54:20,AspiringNoodle,"Yup, the comparison is so apples to oranges, that tflops is the only real way we can measure differences"
29-07-2019T12:54:22,AspiringNoodle,HELL no
29-07-2019T12:54:39,AspiringNoodle,"Graphics will depend on platform, and they're preset by the developers"
29-07-2019T12:54:59,TeapotOfDoom,Even then it's like comparing apples to oranges using their color
29-07-2019T12:55:18,AspiringNoodle,Gflops is the ONLY standard measurement we can really get
29-07-2019T12:55:45,AspiringNoodle,Because a playstation game will be optimized differently than an xbox game than a pc game
29-07-2019T12:56:11,AspiringNoodle,Games are optimized to hit a certain FPS range at a given resolution
29-07-2019T12:56:39,TeapotOfDoom,Yep
29-07-2019T12:57:10,TeapotOfDoom,Which would kinda make it more useful again thinking about it
29-07-2019T12:57:20,AspiringNoodle,"So when next gen consoles claim to be ""more powerful than a 1080"", the only real way we can feasibly check that is, ""How many tflops are the new consoles pulling?"""
29-07-2019T12:57:35,Orthonox,I rather compare the performance of a PC and Console by the games tested.
29-07-2019T12:57:37,TeapotOfDoom,More tflops would mean better quality instead of more performance
29-07-2019T12:58:21,TeapotOfDoom,You would be right but just comparing the fps will not yield any useful result
29-07-2019T12:58:22,AspiringNoodle,Long story short: I don't really buy into the marketing hype bs
29-07-2019T12:59:05,TeapotOfDoom,"As noodle said, they are optimised to run a target fps. What suffers is quality"
29-07-2019T12:59:31,AspiringNoodle,And quality is super subjective
29-07-2019T12:59:49,TeapotOfDoom,Would not say that
29-07-2019T13:00:03,TeapotOfDoom,It's mostly graphics quality
29-07-2019T13:00:14,AspiringNoodle,"Unless you can get a console running a pc version or a pc running a console version, you won't get a good comparison of performance"
29-07-2019T13:00:18,TeapotOfDoom,So it's just practically impossible to measure
29-07-2019T13:00:34,AspiringNoodle,"Again, graphics quality is mostly subjective"
29-07-2019T13:01:12,AspiringNoodle,Rainbow Six Siege has a nice comparison of AA / postprocessing combos on a website with slider images
29-07-2019T13:01:48,TeapotOfDoom,"I'm talkin more about a ""just crank everything and see what fps it still reaches scenario"""
29-07-2019T13:01:50,AspiringNoodle,And one could argue that some of the less intensive combinations look as good as the most expensive combo
29-07-2019T13:01:57,Orthonox,"Tangent note: When the PS4/Xbox One came out in 2013, their performance was comparable to that of an underclocked GTX 580, a GPU from 2010."
29-07-2019T13:02:25,AspiringNoodle,"Key word being underclocked, lmao"
29-07-2019T13:02:42,TeapotOfDoom,They use integrated amd solutions. What did you expect at the time
29-07-2019T13:05:09,Orthonox,I wasn't expecting much. Some people who don't understand computer hardware thought differently. Most PS4/Xbox One games were somewhat more prettier versions of old games. The jump between the generations wasn't big whatsoever.
29-07-2019T13:05:53,Orthonox,The point is that the consoles that came were not even close to mid-high range PCs at the time.
29-07-2019T13:07:47,TeapotOfDoom,I  dont think they neccessarily should or will be
29-07-2019T13:08:04,TeapotOfDoom,Compare the price of a console to a mid range pc
29-07-2019T13:10:14,TeapotOfDoom,It's about 300€ so you kinda get what you can expect
29-07-2019T13:12:15,Orthonox,"I remember around that time I saw many ""Kill Your Console"" PC builds that had similar prices to the consoles but performed better."
29-07-2019T13:12:15,Orthonox,"Anyway, I'm about to bounce and do some work."
29-07-2019T13:12:32,AspiringNoodle,Oh boy
29-07-2019T13:12:40,AspiringNoodle,ROG STRIX 2080 supers are available now
29-07-2019T13:12:47,AspiringNoodle,"Will I have the willpower to wait for the aorus, lol"
29-07-2019T13:13:27,TeapotOfDoom,Strix is a well binned card
29-07-2019T13:13:42,AspiringNoodle,ASUS has been a giant douchenozzle recently
29-07-2019T13:13:55,TeapotOfDoom,To wait or not to wait that's the question
29-07-2019T13:14:05,AspiringNoodle,"And I want to pair the GPU with the motherboard for aesthetic reasons, and apparently ASUS might not be doing QC on their mobos :/"
29-07-2019T13:14:06,TeapotOfDoom,Man i love this word so much xD
29-07-2019T13:14:13,TeapotOfDoom,Why so?
29-07-2019T13:14:30,AspiringNoodle,https://www.newegg.com/asus-rog-crosshair-viii-hero/p/N82E16813119110
29-07-2019T13:14:30,TeapotOfDoom,Really?
29-07-2019T13:14:37,AspiringNoodle,Read the bad reviews
29-07-2019T13:15:30,AspiringNoodle,And compare the number of reviews / rating with this: https://www.newegg.com/p/N82E16813145155?Description=x570&cm_re=x570-_-13-145-155-_-Product
29-07-2019T13:15:56,TeapotOfDoom,Lol wut
29-07-2019T13:17:30,TeapotOfDoom,Asus has been the most reliable mobo choice yet
29-07-2019T13:17:47,AspiringNoodle,I've also heard their RMA is hell :P
29-07-2019T13:17:47,TeapotOfDoom,Weird
29-07-2019T13:18:10,TeapotOfDoom,I only know someone who worked at gigabyte
29-07-2019T13:18:23,TeapotOfDoom,So i can't confirm nor deny
29-07-2019T13:19:11,AspiringNoodle,And I know ASUS is the golden standard for GPUs
29-07-2019T13:19:16,TeapotOfDoom,Also just noticed i signed of about five minutes before the stream began yesterday... damn
29-07-2019T13:19:21,AspiringNoodle,"Best performance, quiet, super cool"
29-07-2019T13:19:29,AspiringNoodle,I know how you feel xD
29-07-2019T13:19:34,TeapotOfDoom,Strix is a ziest of a card
29-07-2019T13:19:35,AspiringNoodle,It started like 15 minutes after I left for the movie
29-07-2019T13:19:38,TeapotOfDoom,*biest
29-07-2019T13:19:52,AspiringNoodle,"cyka blyat, fingers!"
29-07-2019T13:19:54,AspiringNoodle,beast*
29-07-2019T13:19:55,AspiringNoodle,:P
29-07-2019T13:20:01,TeapotOfDoom,That's some bad timing for both of us lol
29-07-2019T13:20:17,AspiringNoodle,"AT least I got to catch the last 2, and saw the finished Adira / Maeve picture"
29-07-2019T13:20:25,TeapotOfDoom,Oh i used the german spelling fail
29-07-2019T13:20:31,AspiringNoodle,"Wish I was there, though.  I always wanted to see Tom do a forest background"
29-07-2019T13:21:00,AspiringNoodle,"And nvm, looked it up xD"
29-07-2019T13:21:16,TeapotOfDoom,You still saw THE END of the adira one? How much time did he spend on that wow
29-07-2019T13:22:05,TeapotOfDoom,Strix ist ein Biest von einer Karte
29-07-2019T13:22:22,TeapotOfDoom,Translating the rest to german works as well lol
29-07-2019T13:30:40,AspiringNoodle,"Man... if Trident Z Neo was available, this would be perfect..."
29-07-2019T14:00:24,SpazztasticKiwi,isn’t it a think now that critics don’t know what they’re doin even though it’s their job
29-07-2019T14:00:28,SpazztasticKiwi,thing
29-07-2019T14:01:50,SpazztasticKiwi,"I’ve seen many people cover especially with movie critics now, that don’t end up lining at all with what the real world audience ends up saying"
29-07-2019T14:04:52,AspiringNoodle,There's a huge disparity between audiences and critics
29-07-2019T14:04:59,AspiringNoodle,Audiences more or less care if they were entertained
29-07-2019T14:05:36,AspiringNoodle,"Although, it does seem like critics are starting to do reviews with political ends in mind :\"
29-07-2019T14:11:27,AspiringNoodle,Okay... it seems like I might as well just pick a brand and buy it xD
29-07-2019T14:11:41,AspiringNoodle,"You go online, and you can literally play a game of ""Who had the worst RMA experience with what company."""
29-07-2019T14:35:10,AspiringNoodle,Holy.  Didn't take long for the ASUS card to sell out
29-07-2019T14:42:38,CrimsonQuill,hiya there
29-07-2019T14:42:43,CrimsonQuill,:ctwokinds-rainehappy::ctwokinds-kingtea:
29-07-2019T14:46:02,AspiringNoodle,Hi :D
29-07-2019T14:46:17,AspiringNoodle,I've learned that the internet makes things meaningless
29-07-2019T14:46:21,CrimsonQuill,How so?
29-07-2019T14:46:39,AspiringNoodle,"So, I've read that ASUS has notoriously horrible customer service"
29-07-2019T14:46:51,CrimsonQuill,ok...
29-07-2019T14:46:53,AspiringNoodle,And then I find threads with just as many horrible stories about other companies
29-07-2019T14:47:08,CrimsonQuill,Oh.
29-07-2019T14:47:09,AspiringNoodle,"And it's like... everything is relative, nothing is meaningful"
29-07-2019T14:47:21,CrimsonQuill,"So, all the same experiences."
29-07-2019T14:47:22,AspiringNoodle,Might as well just pick a company because you're rolling the dice anyways
29-07-2019T14:47:33,CrimsonQuill,Depressing.
29-07-2019T14:47:36,AspiringNoodle,Yup
29-07-2019T14:47:49,AspiringNoodle,"You'll find glowing, speedy RMA stories"
29-07-2019T14:48:12,AspiringNoodle,"You'll find month-long headaches, broken replacements, receiving defective hardware back, and just about any other non-pleasant thing you can think of."
29-07-2019T14:50:05,TeapotOfDoom,Hi \o/
29-07-2019T14:50:09,AspiringNoodle,Herro :3
29-07-2019T14:50:14,CrimsonQuill,Hi again Teapit
29-07-2019T14:50:17,CrimsonQuill,Teapot
29-07-2019T14:51:24,TeapotOfDoom,Have you seen secret shopper noodle?
29-07-2019T14:51:47,TeapotOfDoom,Also hows everybody doin?
29-07-2019T14:52:12,CrimsonQuill,Ok thanks
29-07-2019T14:52:20,AspiringNoodle,No I have not
29-07-2019T14:53:06,TeapotOfDoom,I recommend. Sums it up pretty well
29-07-2019T14:53:16,AspiringNoodle,Sums what up?
29-07-2019T14:53:36,TeapotOfDoom,Rma experiance with big tech companies
29-07-2019T14:54:00,TeapotOfDoom,Secret shopper on the linus tech tips channel
29-07-2019T14:54:14,TeapotOfDoom,How was studying quill?
29-07-2019T14:54:49,CrimsonQuill,Torture.
29-07-2019T14:54:56,CrimsonQuill,:ctwokinds-NataniHAHA:
29-07-2019T14:55:18,TeapotOfDoom,So you're through for today?
29-07-2019T14:55:30,CrimsonQuill,Finished in the morning
29-07-2019T14:55:47,CrimsonQuill,I study in the morning
29-07-2019T14:55:54,TeapotOfDoom,Like free for the day? Nice
29-07-2019T14:55:58,CrimsonQuill,And afternoon I had to clean the fish tank
29-07-2019T14:56:23,CrimsonQuill,"Now it's 8:56pm and I look forward to more Twokinds,"
29-07-2019T14:56:27,TeapotOfDoom,Yuo got fish?
29-07-2019T14:56:52,CrimsonQuill,Nope.
29-07-2019T14:56:55,CrimsonQuill,No fish.
29-07-2019T14:56:59,CrimsonQuill,Oh wait!
29-07-2019T14:57:02,CrimsonQuill,"Yes, fish"
29-07-2019T14:57:04,TeapotOfDoom,Be honest how many times have you read the comic by now? ^^
29-07-2019T14:57:05,CrimsonQuill,We have a few
29-07-2019T14:57:14,SpazztasticKiwi,I have found you can get far quick with sounding like you’re talking with a kid
29-07-2019T14:57:15,CrimsonQuill,@TeapotOfDoom I lost count.
29-07-2019T14:57:26,CrimsonQuill,@SpazztasticKiwi how so?
29-07-2019T14:58:02,TeapotOfDoom,Lol
29-07-2019T14:58:18,SpazztasticKiwi,customer service is just about always willing to help if you sound sweet and small
29-07-2019T14:58:18,TeapotOfDoom,What do you mean spazz?
29-07-2019T14:58:34,TeapotOfDoom,Oooohh that old trick yeah
29-07-2019T14:58:34,CrimsonQuill,Oh I see.
29-07-2019T14:58:53,TeapotOfDoom,My grandma is about the biggest pro at that
29-07-2019T14:59:05,SpazztasticKiwi,it’s my natural voice but the amount of times I’m called wonderful on the phone is something else
29-07-2019T14:59:23,TeapotOfDoom,Lol nice
29-07-2019T15:00:00,SpazztasticKiwi,I’ve found I can talk my way in most things
29-07-2019T15:00:17,TeapotOfDoom,You're breathtaking ^^
29-07-2019T15:00:29,SpazztasticKiwi,"and if need be, sway my voice to work better"
29-07-2019T15:00:31,CrimsonQuill,"Well, time to say goodnight."
29-07-2019T15:00:36,TeapotOfDoom,What have you managed to accomplish?
29-07-2019T15:00:38,CrimsonQuill,Sleep well everyone!
29-07-2019T15:00:46,CrimsonQuill,:ctwokinds-nibsdance::ctwokinds-RainezZz::ctwokinds-RainezZz::ctwokinds-RainezZz:
29-07-2019T15:00:51,TeapotOfDoom,Night quill! You too
29-07-2019T15:00:52,SpazztasticKiwi,most of the time I just get free stuff occasionally
29-07-2019T15:01:22,TeapotOfDoom,Really? Nice ^^
29-07-2019T15:01:29,SpazztasticKiwi,but I’d say 99% of it is because I ask if it’s possible and have this rare thing called manners
29-07-2019T15:02:07,TeapotOfDoom,Seems to be quite rare these days yes
29-07-2019T15:02:16,SpazztasticKiwi,it’s astounding how much they don’t care to give you something if you just ask
29-07-2019T15:02:50,TeapotOfDoom,Worst case they say no
29-07-2019T15:03:22,SpazztasticKiwi,it’s why I say I’m not particularly charming or have fairy magic
29-07-2019T15:04:14,TeapotOfDoom,What if you have and don't know about it?
29-07-2019T15:04:31,TeapotOfDoom,But seriously i know what you are talking about
29-07-2019T15:04:32,SpazztasticKiwi,well then where tf are my wings
29-07-2019T15:04:37,TeapotOfDoom,Lol
29-07-2019T15:04:59,SpazztasticKiwi,and fairy dust - I wanna blind som mfs
29-07-2019T15:05:55,TeapotOfDoom,I'm always amazed at what chances people are willing to give up because they are to embarresed to ask
29-07-2019T15:06:27,TeapotOfDoom,Remints me of the part in gravity falls lol
29-07-2019T15:07:24,TeapotOfDoom,But why would fairy dust blind people?
29-07-2019T15:07:46,SpazztasticKiwi,dust is right in the name
29-07-2019T15:09:57,TeapotOfDoom,Lol if the fairy thing doesn't pan out you could try and use sand
29-07-2019T15:13:13,AspiringNoodle,"Dale Gribble: ""Pocket sand is a reliable means of defense."""
29-07-2019T15:13:14,AspiringNoodle,;)
29-07-2019T15:36:18,TeapotOfDoom,Pocket sand
29-07-2019T15:36:29,TeapotOfDoom,Sounds like a valid product lol
29-07-2019T15:42:21,TeapotOfDoom,wow i got used to my phone screen
29-07-2019T15:42:37,TeapotOfDoom,i just fired up my laptop the monitor is freaking big wow
29-07-2019T15:48:30,SpazztasticKiwi,I’m not walking anywhere near dirt yet you get dirt on your ankles walking the track
29-07-2019T15:48:47,SpazztasticKiwi,yo maybe that’s my fairy dust
29-07-2019T15:50:49,SpazztasticKiwi,hey Tom hows that birthday cake ghost treating you today
29-07-2019T15:55:14,TeapotOfDoom,lol spazz maybe
29-07-2019T15:55:46,TeapotOfDoom,i think mark is slowly but steady losing his mind
29-07-2019T15:56:10,TeapotOfDoom,he did a cereal review and now we have a video with a great ammount of pores in it
29-07-2019T15:57:06,AspiringNoodle,If you do a gaming channel... you gotta be willing to work VERY hard to get millions of subs these days
29-07-2019T15:57:24,AspiringNoodle,"On the bright side, if you love playing video games, best job ever~"
29-07-2019T16:10:53,TeapotOfDoom,have you seen the blade and sourcery video from yesterday? the hell mark what have you been eating?
29-07-2019T16:10:58,SpazztasticKiwi,Mark can’t lose what he never had
29-07-2019T16:11:03,TeapotOfDoom,lol
29-07-2019T16:11:10,SpazztasticKiwi,he lost it in the first years of yt
29-07-2019T16:11:44,TeapotOfDoom,There was a prompt the whole time saying press f3 for help. i found that very fitting
29-07-2019T16:11:47,SpazztasticKiwi,dudes an engineless train
29-07-2019T16:11:54,SpazztasticKiwi,plain loco and no motive
29-07-2019T16:12:02,TeapotOfDoom,lol
29-07-2019T16:12:07,AspiringNoodle,Mark sounds like the victim of the let's play curse
29-07-2019T16:12:10,TeapotOfDoom,thats a good onw
29-07-2019T16:12:23,AspiringNoodle,"Developers: *puts in the most obvious hints and clues as to what you are supposed to do"""
29-07-2019T16:12:31,TeapotOfDoom,i think there as something else in that cereal
29-07-2019T16:12:37,AspiringNoodle,"Let's players: ""WHAT THE FUCK AM I SUPPOSED TO DO? THIS GAME IS SHIT!"""
29-07-2019T16:13:09,SpazztasticKiwi,Mark has his moments for sure but he gets most puzzles
29-07-2019T16:13:22,TeapotOfDoom,Audience: ARE YOU FUCKING BLIND??? A R E   Y O U   K I D D I N G   M E
29-07-2019T16:13:22,SpazztasticKiwi,it’s the obvious stuff that stumps him half the time
29-07-2019T16:14:00,TeapotOfDoom,jack' s the best example. he doesn't get shit sometimes
29-07-2019T16:14:27,AspiringNoodle,"Omfg, do you guy's watch Polaris Select on Disney XD?"
29-07-2019T16:14:37,SpazztasticKiwi,Seán’s a special kind of clueless
29-07-2019T16:15:02,AspiringNoodle,"They had footage of Jack playing Ashiwashi, and when he was searching for the last thing he needed [and missed], the editors had fun poking fun at the obvious thing that he needed xD"
29-07-2019T16:15:17,SpazztasticKiwi,though some of his problems with puzzles is the colorblindness
29-07-2019T16:15:38,AspiringNoodle,"I understand the special nature of their affliction, though"
29-07-2019T16:15:46,AspiringNoodle,"As let's players, they need to be entertaining"
29-07-2019T16:15:57,AspiringNoodle,"As a result, they are more or less multitasking constantly"
29-07-2019T16:16:05,SpazztasticKiwi,Robin & lyxian have the sass only year long editors do
29-07-2019T16:16:07,AspiringNoodle,Makes it much easier to miss what they need to do :/
29-07-2019T16:16:22,SpazztasticKiwi,"“wave, robin” *wave goes across the screen*"
29-07-2019T16:16:25,AspiringNoodle,"That said, if they blow through the tutorial and then complain, I'm just gonna be pissed"
29-07-2019T16:17:50,SpazztasticKiwi,neither seem to like hand holding
29-07-2019T16:17:58,TeapotOfDoom,the wave one i saw
29-07-2019T16:18:31,SpazztasticKiwi,Lixian likes to poke at Mark with sound effects
29-07-2019T16:18:36,TeapotOfDoom,it was so obvious and stupid yet still funny
29-07-2019T16:18:43,SpazztasticKiwi,like the dial up noise when he’s thinking
29-07-2019T16:18:47,TeapotOfDoom,lol
29-07-2019T16:19:07,SpazztasticKiwi,it’s even funnier cause it matches right up with his age
29-07-2019T16:19:17,TeapotOfDoom,the BIRDS! video was so incredably stupid fun
29-07-2019T16:20:00,TeapotOfDoom,iiieeeeiiieeieeeezzzzzzztskkrrrrrrrrrr
29-07-2019T16:20:30,TeapotOfDoom,reaches 50Kbit
29-07-2019T16:21:45,SpazztasticKiwi,my favorite is lyx put in the end of blush blush for us
29-07-2019T16:21:56,SpazztasticKiwi,this squirrel just stole a piece of bread
29-07-2019T16:22:10,TeapotOfDoom,from you?
29-07-2019T16:22:15,SpazztasticKiwi,“it’s mine and you’ll never catch me”
29-07-2019T16:22:22,TeapotOfDoom,lol nice
29-07-2019T16:22:32,SpazztasticKiwi,I don’t have food
29-07-2019T16:23:01,TeapotOfDoom,wait it stole the entire bread?
29-07-2019T16:23:13,TeapotOfDoom,or are you reffering to a mark vid?
29-07-2019T16:23:42,SpazztasticKiwi,the park
