date,user,comment
29-07-2019T16:26:12,SpazztasticKiwi,you remember the pretzel video where Ethan thought Amy was gonna kill mark
29-07-2019T16:26:25,Dadrobit,"See, this is why I don't watch almost any youtube gamers at all. The only one I do consume is Day9. Dude is super intelligent and still maintains an amazing personality."
29-07-2019T16:27:26,SpazztasticKiwi,they’re both plenty intelligent
29-07-2019T16:27:30,IronHorseComics,TheMightyJingles is the only regular for me
29-07-2019T16:28:03,SpazztasticKiwi,try Mark’s polybridge
29-07-2019T16:28:16,SpazztasticKiwi,dude made me nauseous on physics
29-07-2019T16:28:59,AspiringNoodle,I've been watching 8-bit Ryan recently
29-07-2019T16:29:05,AspiringNoodle,I find him amusing :P
29-07-2019T16:29:07,SpazztasticKiwi,meanwhile Seán’s video be like “triangles everywhere”
29-07-2019T16:29:35,AspiringNoodle,There's a horror game at teh beginning where the game got revenge for all other games where let's players talk over in-game dialogue
29-07-2019T16:30:01,TeapotOfDoom,i know some mechanical engineers
29-07-2019T16:30:02,AspiringNoodle,It had dialogue that was too loud to talk over :3
29-07-2019T16:31:07,TeapotOfDoom,they torture you with that stuff at uni until you can't think of anything else in real life other then mechanice
29-07-2019T16:34:26,AspiringNoodle,"I found a valid excuse to NOT buy an ASUS motherboard, lol"
29-07-2019T16:34:42,AspiringNoodle,Potentially valid*
29-07-2019T16:35:00,AspiringNoodle,There's a cover for the chipset fan that potentially intrudes upon an m.2 slot
29-07-2019T16:35:18,AspiringNoodle,And I'm not sure if integrated heatspreaders on motherboards are gonna be enough to cool the new gen 4 stuff :c
29-07-2019T16:36:02,AspiringNoodle,https://www.newegg.com/asus-rog-crosshair-viii-hero/p/N82E16813119109?Item=N82E16813119109
29-07-2019T16:36:09,AspiringNoodle,"Teapot, check out the top m.2 slot"
29-07-2019T16:36:21,AspiringNoodle,I don't think you'd be able to put a gen 4 drive with a heatsink there
29-07-2019T16:36:28,AspiringNoodle,Engineering fail?
29-07-2019T16:41:49,SpazztasticKiwi,group of guys her playing
29-07-2019T16:41:55,SpazztasticKiwi,frisbee
29-07-2019T16:41:57,SpazztasticKiwi,?
29-07-2019T16:42:39,SpazztasticKiwi,and some other poor dudes trying to do a one man golf game
29-07-2019T16:42:55,SpazztasticKiwi,someone’s gonna get hit
29-07-2019T16:44:56,AspiringNoodle,RIP everyone involved
29-07-2019T16:45:30,SpazztasticKiwi,if you hear “duck”...
29-07-2019T16:45:42,SpazztasticKiwi,become one with the floor
29-07-2019T16:46:58,TeapotOfDoom,lol
29-07-2019T16:47:11,TeapotOfDoom,get down quick in that case
29-07-2019T16:48:34,TeapotOfDoom,right above the top pci slot noodle?
29-07-2019T16:48:41,SpazztasticKiwi,all these two for ones foods and only one me
29-07-2019T16:48:42,AspiringNoodle,Yup
29-07-2019T16:49:19,TeapotOfDoom,i'm pretty sure that headspreader is a) removable and b) used to cool the drive as well
29-07-2019T16:49:43,AspiringNoodle,"In that case: https://www.guru3d.com/articles_pages/corsair_mp600_pcie_4_nvme_ssd_review,6.html"
29-07-2019T16:50:00,AspiringNoodle,Looks like the included heatspreaders on x570 boards might be enough
29-07-2019T16:50:08,AspiringNoodle,The one they tested peaked at 55c
29-07-2019T16:51:24,TeapotOfDoom,i'm still impressed that we reached the point where you have enough data throuput on the controller to cook it
29-07-2019T16:52:08,TeapotOfDoom,you're workday already over spazz?
29-07-2019T16:52:25,AspiringNoodle,Huh... neat.  Looks like the reviewers were using an ASUS board
29-07-2019T16:52:37,AspiringNoodle,Shame they used the bottom (larger) m.2 slot
29-07-2019T16:52:44,AspiringNoodle,I'm curious as to what the temperatures would be in the top slot.
29-07-2019T16:56:03,TeapotOfDoom,well something else to think about: does the top slot infringe on the bandwidth of the pci slot right below it
29-07-2019T16:56:29,AspiringNoodle,I'm more concerned about ASUS's design choices :P
29-07-2019T16:56:52,AspiringNoodle,"For example, it seems like the cover for the top slot requires you to remove the fan cover as well"
29-07-2019T16:56:54,SpazztasticKiwi,you know those double tired trucks with the wide wells
29-07-2019T16:57:05,AspiringNoodle,I hate those.  They look stupid af
29-07-2019T16:57:14,SpazztasticKiwi,dude I been chatting with said it made the trucks look like they got hips
29-07-2019T16:57:24,AspiringNoodle,...:ptv-snicker:
29-07-2019T16:57:35,SpazztasticKiwi,did...did he give a truck a booty
29-07-2019T16:57:51,Bgrmystr2,:ptv-condescending: do I hear jealousy of dem curves? :V
29-07-2019T16:58:03,SpazztasticKiwi,please
29-07-2019T16:58:09,Bgrmystr2,haha
29-07-2019T16:58:12,SpazztasticKiwi,I got better curses than some truck
29-07-2019T16:58:16,SpazztasticKiwi,curves
29-07-2019T16:58:35,TeapotOfDoom,lol
29-07-2019T16:58:48,TeapotOfDoom,truck's got the booty
29-07-2019T16:58:54,SpazztasticKiwi,besides half the things that come out of his mouth makes me wonder if he thinks before he talks
29-07-2019T16:59:05,Bgrmystr2,"in their defense, the extra tire is supposed to lead to extra weight it can hold in the bed"
29-07-2019T16:59:15,TeapotOfDoom,he's basically scarlet
29-07-2019T16:59:16,Bgrmystr2,from what I know
29-07-2019T16:59:41,SpazztasticKiwi,all I know it makes me look fat
29-07-2019T16:59:43,SpazztasticKiwi,em
29-07-2019T17:00:47,AspiringNoodle,"Look at the time, I gotta head out for dinner"
29-07-2019T17:00:56,TeapotOfDoom,i have never seen trucks even remotely that size somewhere else then america
29-07-2019T17:01:13,TeapotOfDoom,look at the time i should be fast asleep
29-07-2019T17:01:21,TeapotOfDoom,yet we both are not ^^
29-07-2019T17:01:52,Bgrmystr2,"America has wide roads and is designed for much larger vehicles. we also have a much larger road structure than other countries, the lanes are wider and vehicles are larger."
29-07-2019T17:02:15,SpazztasticKiwi,I’ll say I’ve gathered he’s a leg guy if that’s what he sees in a vehicle
29-07-2019T17:02:53,AspiringNoodle,Be back later :3
29-07-2019T17:03:41,TeapotOfDoom,later noodle!
29-07-2019T17:04:05,TeapotOfDoom,i was over there more then once by now. last time i went there a few years ago a friend of mine (who is not particullary big) was with me and first thing she sees when she gets out of the car is a huge truck
29-07-2019T17:04:24,TeapotOfDoom,the hight of the hood was about her size
29-07-2019T17:04:51,Bgrmystr2,was it a semi or something...?
29-07-2019T17:05:22,TeapotOfDoom,and she's like what the hell is this?? the car dwarfed her lol
29-07-2019T17:05:31,TeapotOfDoom,nope just a really big pickup truck
29-07-2019T17:05:46,TeapotOfDoom,i knew that cars like this existed by then
29-07-2019T17:05:54,SpazztasticKiwi,I’m wanting a coffe
29-07-2019T17:06:09,TeapotOfDoom,i think it was a gmc or ford i dunno. was a few years back
29-07-2019T17:06:29,Bgrmystr2,those definitely do exist. Most the time the really big ones seem big because they have massive tires and the suspension system is designed for rough terrain
29-07-2019T17:06:30,TeapotOfDoom,sounds nice.... i need water atm
29-07-2019T17:06:37,SpazztasticKiwi,you know a semi when you see it
29-07-2019T17:07:06,Bgrmystr2,"if the cab itself is big, usually that's due to more room in the interior or whatnot"
29-07-2019T17:07:21,Bgrmystr2,usually you have big beds in the back as well designed to haul heavy loads
29-07-2019T17:08:04,Bgrmystr2,"good for cross-state stuff, since that's comparably far compared to most other countries."
29-07-2019T17:08:36,TeapotOfDoom,funny thing is your trucks have snoots yet ours have not
29-07-2019T17:08:39,Bgrmystr2,good for pulling weight too if needbe :thinking:
29-07-2019T17:09:55,Bgrmystr2,gonna head out to the store
29-07-2019T17:09:58,Bgrmystr2,be back later :i
29-07-2019T17:10:09,Bgrmystr2,:U* sometimes my fingers can't keyboard
29-07-2019T17:10:11,TeapotOfDoom,bye bgr
29-07-2019T17:10:38,TeapotOfDoom,if i succeeded in my latest experiment i will head to bed too. lets see
29-07-2019T17:15:10,TeapotOfDoom,i did. time for me to head off too. night y'all!
29-07-2019T17:15:25,TeapotOfDoom,:ctwokinds-RainezZz:
29-07-2019T17:25:32,SpazztasticKiwi,“five cups of green tea a day can help you lose weight” I’m sure it can but I can drink 5 packets with only 1-4 cups of water
29-07-2019T17:25:57,SpazztasticKiwi,"so what do you consider a cup, article"
29-07-2019T17:30:07,SpazztasticKiwi,I waved when I left McDonald’s with my drink and half of em looked confused but they waved back
29-07-2019T17:45:11,FloofyCat,"Kiwi, websites that say ""five cups of green tea a day can help you lose weight"" and stuff are only saying that because it is technically correct only if you drink that and on the side starve yourself"
29-07-2019T17:46:14,FloofyCat,Usually newspapers will do this stuff as clickbait because people think there's some wonder miracle to lose weight without being constantly hungry and nope its just starving
29-07-2019T17:46:49,SpazztasticKiwi,I know tea changes the appetite
29-07-2019T17:46:54,SpazztasticKiwi,it fills you
29-07-2019T17:47:12,FloofyCat,Well technically if you just down a ton of water you'll feel satiated for a while
29-07-2019T17:49:12,SpazztasticKiwi,you know how scatterbrained I am keep that in mind
29-07-2019T17:49:16,SpazztasticKiwi,here’s a question
29-07-2019T17:49:37,SpazztasticKiwi,how many people you think are working at a food place at one time
29-07-2019T17:49:49,FloofyCat,Like a McDonald's or something?
29-07-2019T17:50:00,SpazztasticKiwi,sure ya
29-07-2019T17:50:56,FloofyCat,Urh well McDonald's has lots of customers so probably 16-20 in peak times and maybe around 8-12 during night shifts?
29-07-2019T17:51:04,FloofyCat,In a normal weekday
29-07-2019T17:51:42,SpazztasticKiwi,I’d consider getting my local one some doughnuts
29-07-2019T17:52:16,SpazztasticKiwi,angry person came in threatened some of the back people
29-07-2019T17:52:24,FloofyCat,"If its lets say a Pizza Hut/Dominoes etc pizza takeaway then probably under ten, pizza is really easy to make and having 20 different menu items at lets say McDonald's is harder than having like 50 different pizza options because all you do is put passata"
29-07-2019T17:52:44,FloofyCat,"or purée on a piece of flat unbaked bread, chuck on some topping that are in tubs and then cheese and shove it in an oven"
29-07-2019T17:53:15,SpazztasticKiwi,they don’t carry my green tea anymore
29-07-2019T17:53:21,SpazztasticKiwi,this is an outrage
29-07-2019T17:53:56,FloofyCat,I just drink an unhealthy amount of cola
29-07-2019T17:54:14,FloofyCat,I shouldn't because all the sugar but it tastes nice and its the only thing I got going for me right now
29-07-2019T17:54:59,SpazztasticKiwi,I used to drink an unholy amount of green tea straight just about every day
29-07-2019T17:55:19,SpazztasticKiwi,I didn’t eat too much it was so much and that became a problem
29-07-2019T17:56:49,SpazztasticKiwi,I still drink now obviously but I keep my 5 packets in one sitting to just that instead of drinking half a box in less than two days
29-07-2019T17:57:17,SpazztasticKiwi,and by box I’ll say it was a box of 48 or something bags
29-07-2019T17:57:50,SpazztasticKiwi,I’m surprised I have taste buds drinking it that strong with nothing in it
29-07-2019T18:00:19,SpazztasticKiwi,ok so next to the tea they’re selling whole honeycomb
29-07-2019T19:40:15,AspiringNoodle,Wish me luck
29-07-2019T19:40:22,AspiringNoodle,Ordering 2 dual channel kits of G.skill
29-07-2019T19:40:39,AspiringNoodle,Gigabyte's QVL says that the particular stick I'm looking at is supported for all 4 RAM slots
29-07-2019T19:50:03,AspiringNoodle,"Nvm, tried to buy 2, Newegg only has 1 in stock :ptv-laugh:"
29-07-2019T20:22:49,Bgrmystr2,I return from shopping
29-07-2019T20:23:49,Bgrmystr2,"got some face towels, shampoo, a dressy-ish shirt for the funeral this friday, and some things to make my room smell good"
29-07-2019T20:23:58,AspiringNoodle,I haf left u messages
29-07-2019T20:23:59,AspiringNoodle,:3
29-07-2019T20:24:25,Bgrmystr2,yes I seendered them
29-07-2019T20:25:08,Bgrmystr2,I sawnt it with mah own ears!
29-07-2019T20:27:37,Twokinds,:ctwokinds-nibsbdaydance:
29-07-2019T20:31:43,Bgrmystr2,"hello tom, hope you had a good day"
29-07-2019T20:34:55,Ordithus,:ctwokinds-maevecute:
29-07-2019T21:48:54,SpazztasticKiwi,ok so it seems my two cents didn’t go through
29-07-2019T21:50:42,SpazztasticKiwi,Tom when did those button pins you got get made
29-07-2019T22:29:33,RimaDraws,hii
29-07-2019T22:38:20,Sclimshady,Hi Rima o/
29-07-2019T22:40:08,RimaDraws,hey how is?
29-07-2019T22:41:07,Sclimshady,"Good, just ate some in n out, you?"
29-07-2019T22:42:07,AspiringNoodle,:ptv-greetings:
29-07-2019T22:42:12,Twokinds,Lann offered to make the buttons for me
29-07-2019T22:42:17,Twokinds,So they were made just before AC
29-07-2019T22:42:40,AspiringNoodle,Buttons?!? :ptv-excited:
29-07-2019T22:42:45,Sclimshady,"Hi Tom, Noodle o/"
29-07-2019T22:43:04,Sclimshady,I'm assuming none are left
29-07-2019T22:44:04,RimaDraws,i loved the ones bluephantom got me at AC
29-07-2019T22:44:15,RimaDraws,i am a sucker for buttons
29-07-2019T22:44:55,Sclimshady,My personal favorite is keychains
29-07-2019T22:48:13,SomeNiceUser,Hi everyone!
29-07-2019T22:48:22,RimaDraws,hii
29-07-2019T22:48:39,SomeNiceUser,What up Rima?
29-07-2019T22:49:18,RimaDraws,not much drawing. waiting on my giveaway to end on twitter so i can announce winners
29-07-2019T22:50:08,SomeNiceUser,"Ah, well I hope they have fun with their prize."
29-07-2019T22:50:41,SomeNiceUser,"Damn, this heat wave sucks. Plus these allergies..."
29-07-2019T22:51:21,RimaDraws,i hear you. its been killing me today
29-07-2019T22:51:23,Sclimshady,Hi SNU
29-07-2019T22:51:37,SomeNiceUser,Hi Shady!
29-07-2019T22:52:35,SpazztasticKiwi,oh so there’s not gonna be others then
29-07-2019T22:52:50,SpazztasticKiwi,it was cool today
29-07-2019T22:52:58,SomeNiceUser,Hey Kiwi!
29-07-2019T22:53:00,SpazztasticKiwi,unless you payed yourself in the sun
29-07-2019T22:53:12,SpazztasticKiwi,layed
29-07-2019T22:53:52,SpazztasticKiwi,I gotta 🥑 to try
29-07-2019T22:54:11,SomeNiceUser,Oh.
29-07-2019T22:54:13,SpazztasticKiwi,wasn’t impressed
29-07-2019T22:55:36,SpazztasticKiwi,I’m tempted to make my own Nib keychain but I need a bauble and eyelet chain
29-07-2019T22:56:10,SomeNiceUser,That seems like a very cool idea.
29-07-2019T22:57:14,SpazztasticKiwi,I e found I’m better and hands stuff that’s necessarily drawing though I do supposedly have “pretty handwriting”
29-07-2019T22:57:43,SpazztasticKiwi,*not necessarily
29-07-2019T22:59:36,SomeNiceUser,"For me, my handwriting is terrible."
29-07-2019T23:07:49,SomeNiceUser,"Here’s some good news, my doggo gets to eat ice cream once everyday! (In very small quantities)"
29-07-2019T23:27:46,RimaDraws,pup cones
29-07-2019T23:29:25,RimaDraws,night guys!
29-07-2019T23:52:24,SpazztasticKiwi,I found smiling doggo
29-07-2019T23:53:52,SpazztasticKiwi,https://media.discordapp.net/attachments/524825976597643265/605986033959567360/image0.png
