date,user,comment
29-07-2019T00:00:52,SpazztasticKiwi,now you got me steamed
29-07-2019T00:01:43,Sclimshady,Like broccoli?
29-07-2019T00:03:40,Dadrobit,No broccoli here unfortunately. Just a chef salad.
29-07-2019T00:04:22,Sclimshady,I like mine with lots of dressing to disguise the health
29-07-2019T00:05:03,SpazztasticKiwi,chef salad with bacon bits and parmesan dressing
29-07-2019T00:05:13,SpazztasticKiwi,and don’t forget the little corns
29-07-2019T00:05:31,SpazztasticKiwi,and lil sunflower seeds
29-07-2019T00:05:33,Sclimshady,Those little corns are naysty
29-07-2019T00:05:40,SpazztasticKiwi,no
29-07-2019T00:05:42,SpazztasticKiwi,Bad
29-07-2019T00:05:47,SpazztasticKiwi,go sit in the corner
29-07-2019T00:05:56,Dadrobit,"Chunks of ham, but no bacon here, and only a little dressing."
29-07-2019T00:06:01,SpazztasticKiwi,preferably with a dictionary
29-07-2019T00:06:07,Dadrobit,I wish I had some corn.
29-07-2019T00:06:14,SpazztasticKiwi,how dare you turn down the bacon
29-07-2019T00:06:28,Dadrobit,Pre made version.
29-07-2019T00:06:30,Twokinds,:bacon:
29-07-2019T00:06:37,Dadrobit,"Also, health...."
29-07-2019T00:06:37,Sclimshady,"I will take my full sized corn, theyre great in a glass with no ice"
29-07-2019T00:06:46,SpazztasticKiwi,I knew he’d been here the whole time
29-07-2019T00:06:47,Sclimshady,and alcoholic
29-07-2019T00:06:51,Twokinds,Bacon is good for you!
29-07-2019T00:06:56,Sclimshady,and its whisky
29-07-2019T00:06:58,SpazztasticKiwi,Tom’s got the right idea
29-07-2019T00:07:06,Twokinds,I eat nothing but bacon
29-07-2019T00:07:07,Dadrobit,Still holding out that I'll see sub 180 on the scale again one day.
29-07-2019T00:07:17,SpazztasticKiwi,you’re still on keto
29-07-2019T00:07:23,Dadrobit,"Bacon, the Parton saint of keto"
29-07-2019T00:07:31,Twokinds,Nah I had birthday cake
29-07-2019T00:07:31,Sclimshady,"Bacon is pig skin, pig skin is football, sports is healthy"
29-07-2019T00:07:40,SpazztasticKiwi,when you giving that up? when you top out at 100lbs?
29-07-2019T00:07:40,unsteddyphoenix,bacon cake
29-07-2019T00:07:45,Sclimshady,So bacon is healthy
29-07-2019T00:07:59,SpazztasticKiwi,cake cake cake cake cake
29-07-2019T00:08:05,Sclimshady,:cake:
29-07-2019T00:08:12,SpazztasticKiwi,haven’t they made breakfast cake by now
29-07-2019T00:08:15,Twokinds,I've gained 5 lbs back so I think I'll probably go back on it though XD
29-07-2019T00:08:39,Dadrobit,Me? At 175. That's the optimal weight for my body type.
29-07-2019T00:08:40,SpazztasticKiwi,I’d like to see where you see these pounds besides the scale
29-07-2019T00:09:01,SpazztasticKiwi,then again I’m not exactly studying
29-07-2019T00:10:01,SpazztasticKiwi,I’d try keto if I knew myself better than to forget I was on it
29-07-2019T00:10:51,SpazztasticKiwi,all things considered I want to say I’m “ok” with now - but I’m still walking
29-07-2019T00:13:21,Dadrobit,:( stopped riding my stationary a few months back for lazy reasons and my stamina has officially gone to shit.
29-07-2019T00:13:42,unsteddyphoenix,riding your stationary...
29-07-2019T00:14:13,SpazztasticKiwi,you not the only one that imagined some guy playing horsie on a sheet of paper?
29-07-2019T00:14:17,Dadrobit,Bought a PSVR for my bday last week and some dancing rhythm games. After 3 hours of that I was fuckin beat...
29-07-2019T00:14:31,Dadrobit,Stationary bike*
29-07-2019T00:14:32,unsteddyphoenix,i imagined a pencil case
29-07-2019T00:14:41,Sclimshady,Vr is actually really good exercise
29-07-2019T00:14:47,SpazztasticKiwi,"hi ho silver, awaaaaaay"
29-07-2019T00:14:51,unsteddyphoenix,did you get beatsaber?
29-07-2019T00:14:53,SpazztasticKiwi,I do have a nice pretty tan now - no longer look like a pale slice of human
29-07-2019T00:15:00,unsteddyphoenix,Nice!
29-07-2019T00:15:04,Dadrobit,Beat saber is my fuckin jam!
29-07-2019T00:15:13,unsteddyphoenix,Duuude its so much fun
29-07-2019T00:15:20,SpazztasticKiwi,I’d play that game if I had the stuff
29-07-2019T00:15:23,Sclimshady,Im sooooo bad at that game
29-07-2019T00:15:23,unsteddyphoenix,Big same
29-07-2019T00:15:29,SpazztasticKiwi,and knew I wouldn’t smack into shit
29-07-2019T00:15:54,SpazztasticKiwi,watching Seán play he regularly walks into his own wall
29-07-2019T00:16:02,Dadrobit,"Working on kda on Expert, still can't beat that one..."
29-07-2019T00:16:21,unsteddyphoenix,runrunrunrun~
29-07-2019T00:16:24,SpazztasticKiwi,“do I look like a complete tit? Yes”
29-07-2019T00:16:32,Sclimshady,I fail miserably in the intermediate ones
29-07-2019T00:16:44,SpazztasticKiwi,“do I particularly care? I’m sweating too much to care”
29-07-2019T00:18:27,SpazztasticKiwi,you still got me thinking of that kid. You know it’s been 3 years and I’m still stupefied by the stupid?
29-07-2019T00:18:44,Sclimshady,:csagesaga-philhuh:
29-07-2019T00:19:04,Dadrobit,"Had a bit of experience before playing on my brother's rig, now I can embarrass myself in the comfort of my own home."
29-07-2019T00:19:18,SpazztasticKiwi,"I will say on my tan, it’s not terribly complete since there’s an x on my back from my shirt"
29-07-2019T00:19:47,SpazztasticKiwi,"“dance like no ones watching....or like you’ve had a few drinks, whichever works”"
29-07-2019T00:20:58,Dadrobit,It is helping further my dream of one day becoming a kpop idol!
29-07-2019T00:21:02,Sclimshady,No amount of drinks can make me dance except for 2 step
29-07-2019T00:21:09,SpazztasticKiwi,you have to have talent for that
29-07-2019T00:21:42,Sclimshady,I want rice balls with your face on or its not real
29-07-2019T00:21:57,SpazztasticKiwi,that reminds me they played the cupid shuffle in walmart today
29-07-2019T00:22:09,SpazztasticKiwi,and called it the “walmart shuffle”
29-07-2019T00:22:17,SpazztasticKiwi,like they’re fooling anyone
29-07-2019T00:22:18,Sclimshady,Crringe
29-07-2019T00:23:01,SpazztasticKiwi,never in all my life has it hit me to suddenly dance while doing my stuff at work or even in walmart in general
29-07-2019T00:23:38,SpazztasticKiwi,"I hum, but that’s to drown out the radio and keep myself semi sane"
29-07-2019T00:24:12,Sclimshady,"Don't get me wrong, i'll go hard in my car. but thats a private place"
29-07-2019T00:24:38,SpazztasticKiwi,there’s only so many times you can hear the songs on loop before you’re ready to beat a dj
29-07-2019T00:24:59,Sclimshady,Thats the music isle in target come December
29-07-2019T00:25:04,SpazztasticKiwi,“get. a. better. playlist”
29-07-2019T00:25:20,SpazztasticKiwi,God December is the worst
29-07-2019T00:25:27,Dadrobit,"Ha, I'm the exact opposite. I look for a reason. The clients' stereo is pumping? Guess it's time to dance! They love it. Makes my job easy."
29-07-2019T00:25:27,Sclimshady,Our employee door was right next to it and I wanted to smash the speakers
29-07-2019T00:25:38,SpazztasticKiwi,They’ll pick like three or five songs and do nothing but play covers of it
29-07-2019T00:25:53,SpazztasticKiwi,"there’s only so many holy nights, people"
29-07-2019T00:26:13,SpazztasticKiwi,only so long until I’m ready to deck my own halls
29-07-2019T00:32:37,Dadrobit,Work beckons
29-07-2019T00:32:41,Dadrobit,Brb
29-07-2019T00:33:08,Sclimshady,Not the work!!
29-07-2019T00:37:46,SpazztasticKiwi,you wanna see what I found crawling on my hood going down the road today
29-07-2019T00:38:02,Sclimshady,Is it a snek?
29-07-2019T00:38:27,SpazztasticKiwi,a heckin lizard
29-07-2019T00:38:31,SpazztasticKiwi,https://media.discordapp.net/attachments/524825976597643265/605635198939299850/image0.jpg
29-07-2019T00:39:06,SpazztasticKiwi,only thing I can read on his face is “good job - you caught me”
29-07-2019T00:39:08,Sclimshady,T h e  f o r b i d d e n  s n e k
29-07-2019T00:40:07,SpazztasticKiwi,it was either get him off or let him fall off goin 50 down the road to work
29-07-2019T00:40:25,SpazztasticKiwi,or wait for him to crawl under in the engine
29-07-2019T00:41:54,AspiringNoodle,Aw
29-07-2019T00:41:57,AspiringNoodle,Cute lizard~
29-07-2019T00:42:56,SpazztasticKiwi,he’s now a ways from home but he’s alive
29-07-2019T00:43:38,SpazztasticKiwi,free to monch bugs in another part of the woods
29-07-2019T00:47:19,qwe304,RIP: stream recording
29-07-2019T01:47:35,DarthRexKing,Night! :V
29-07-2019T02:01:15,SpazztasticKiwi,I found some more weird shoes
29-07-2019T02:44:02,SpazztasticKiwi,nite Tom
29-07-2019T02:44:19,SpazztasticKiwi,two hours late
29-07-2019T02:44:25,SpazztasticKiwi,🛌
29-07-2019T03:04:43,TerraTheWizard,:ctwokinds-kingtea:
29-07-2019T03:21:59,TerraTheWizard,"heckin,"
29-07-2019T03:22:08,TerraTheWizard,looks like the vod server went down last night
29-07-2019T03:22:16,TerraTheWizard,last stream vod is only 32 minutes long
29-07-2019T03:37:37,TeapotOfDoom,Nooo
29-07-2019T03:38:00,TeapotOfDoom,Wait what
29-07-2019T03:38:04,TeapotOfDoom,:ctwokinds-nibsbdaydance:
29-07-2019T03:38:24,Bgrmystr2,"It had nothing to do with the vod server, Terra"
29-07-2019T03:38:32,Bgrmystr2,Tom's stream broke in the middle
29-07-2019T03:38:46,Bgrmystr2,"and the picarto servers thought he stopped, but it was just a temporary disconnect"
29-07-2019T03:38:56,TeapotOfDoom,Fail
29-07-2019T03:39:14,Bgrmystr2,"so when it reconnected, it didn't have a catch on recording again"
29-07-2019T03:39:24,TeapotOfDoom,Yo bgr are my emotes working or do only i see them?
29-07-2019T03:39:29,Bgrmystr2,"it happens sometimes, it's probably a bug in the coding"
29-07-2019T03:39:31,TerraTheWizard,heck
29-07-2019T03:39:39,Bgrmystr2,I saw the nibbly you posted teapot
29-07-2019T03:39:57,CrimsonQuill,Morning
29-07-2019T03:40:03,TeapotOfDoom,Ok weird there's no symbol in front of my name for me
29-07-2019T03:40:10,TeapotOfDoom,Morning quill
29-07-2019T03:40:27,CrimsonQuill,Statistics and Probability study....
29-07-2019T03:40:32,CrimsonQuill,sighs
29-07-2019T03:40:37,TeapotOfDoom,Sounds fun
29-07-2019T03:40:43,CrimsonQuill,It isn't/
29-07-2019T03:40:47,CrimsonQuill,Believe me
29-07-2019T03:40:55,TeapotOfDoom,May the knowlege be with you
29-07-2019T03:41:00,CrimsonQuill,Thanks
29-07-2019T03:41:08,CrimsonQuill,"How are you Teapot, Bgrmystr?"
29-07-2019T03:41:14,CrimsonQuill,And Terra?
29-07-2019T03:41:43,TerraTheWizard,./shrug
29-07-2019T03:41:47,TeapotOfDoom,I know the feels. When i come home i have to study for signal theory and basic mechenics/thermodynamics
29-07-2019T03:42:12,CrimsonQuill,Geographic science has a lot of maths and technical jargon.
29-07-2019T03:42:25,TeapotOfDoom,But other than that just woke up quite refreshed
29-07-2019T03:42:35,CrimsonQuill,"Oh, that's ok."
29-07-2019T03:42:47,CrimsonQuill,"So you're a subscriber now, Teapot."
29-07-2019T03:42:49,CrimsonQuill,Nice.
29-07-2019T03:42:59,TeapotOfDoom,For quite some time now
29-07-2019T03:43:05,CrimsonQuill,Oh
29-07-2019T03:43:08,CrimsonQuill,I never noticedd
29-07-2019T03:43:13,TeapotOfDoom,Lol
29-07-2019T03:43:15,CrimsonQuill,digs themself deeper
29-07-2019T03:43:21,CrimsonQuill,:ctwokinds-keifacepalm:
29-07-2019T03:43:23,TeapotOfDoom,No problem
29-07-2019T03:43:29,Bgrmystr2,"Well, I talked to my dad and he seems like he's doing okayish.. but it's gonna hit him hard when we go to the funeral. I'm not sure how well I'll do honestly."
29-07-2019T03:43:39,Bgrmystr2,So I'm just kinda hangin on :/
29-07-2019T03:43:41,TeapotOfDoom,Did my excessive use of emotes not give it away
29-07-2019T03:44:12,CrimsonQuill,"@Bgrmystr2 Wait, what happened? I haven't been around during some of the chats, you'll have to fill me in."
29-07-2019T03:44:34,Bgrmystr2,My grandfather died in his sleep last night
29-07-2019T03:44:51,Bgrmystr2,a lot of people are taking it really hard
29-07-2019T03:45:00,CrimsonQuill,Oh. I...know how that feel.
29-07-2019T03:45:04,CrimsonQuill,feels
29-07-2019T03:45:27,CrimsonQuill,Both my grandparents on my mother's side passed away in their sleep when I was 11-12...
29-07-2019T03:45:35,Bgrmystr2,yeah I found out earlier when I was woken up before tom streamed
29-07-2019T03:45:43,CrimsonQuill,"My condolences, Bgrmystr."
29-07-2019T03:46:04,Bgrmystr2,"thanks, such is life, man. :ptv-sad:"
29-07-2019T03:46:22,CrimsonQuill,"D'you know, my Granddad's funeral was also my birthday..."
29-07-2019T03:46:36,TeapotOfDoom,Oh
29-07-2019T03:46:41,CrimsonQuill,And they played 'Bells of the Angelus' at the beginning.
29-07-2019T03:47:26,CrimsonQuill,"So, when my aunt took me to mass in Venice last October, and the congregation started singing that hymn...I broke down."
29-07-2019T03:47:35,CrimsonQuill,That hymn always gets me.
29-07-2019T03:47:45,CrimsonQuill,"So, yeah...I understand how it feels..."
29-07-2019T03:48:55,TeapotOfDoom,It seems you both could use a hug...
29-07-2019T03:49:12,CrimsonQuill,Give one to Bgr first. They need it more.
29-07-2019T03:49:59,TeapotOfDoom,My best wishes again in any case. To you and your family
29-07-2019T03:51:59,CrimsonQuill,@Bgrmystr2 From both of us. Best wishes to you.
29-07-2019T03:52:07,CrimsonQuill,And the family.
29-07-2019T03:52:13,Bgrmystr2,"yeah thanks, I'm sure I'll hold up better than they will."
29-07-2019T03:52:34,Bgrmystr2,yknow it's hard.. when someone dies.. that alone is bad enough
29-07-2019T03:52:42,Bgrmystr2,but they were married for 57 years
29-07-2019T03:53:04,Bgrmystr2,and one day she woke up next to him and he's gone.
29-07-2019T03:53:11,Bgrmystr2,I can't fucking imagine.
29-07-2019T03:53:21,CrimsonQuill,...
29-07-2019T03:53:36,Bgrmystr2,"Even my dad couldn't do that, he's not even that old yet."
29-07-2019T03:54:17,Bgrmystr2,"Life's a bitch, man. :worried:"
29-07-2019T03:54:22,TeapotOfDoom,True
29-07-2019T03:57:52,CrimsonQuill,But we still go on...
29-07-2019T04:01:38,TeapotOfDoom,Hug a lot
29-07-2019T04:05:54,TeapotOfDoom,I'm off now for the day. Bye everyone! I may drop in in the evening again
29-07-2019T04:18:49,CrimsonQuill,Cheerio Teapot.
29-07-2019T08:00:15,NibblyBot,New Deviantart Post: Exploring Tiger Lands https://www.deviantart.com/twokinds/art/Exploring-Tiger-Lands-807657929
29-07-2019T09:55:33,CrimsonQuill,:ctwokinds-floraquestion: Tigers
29-07-2019T10:01:43,SniperJackal,Floras
29-07-2019T10:01:49,SniperJackal,Floras everywhere
29-07-2019T10:01:51,CrimsonQuill,Floras everywhere
29-07-2019T10:01:54,SniperJackal,hahah
29-07-2019T10:01:58,CrimsonQuill,XD
29-07-2019T10:02:12,CrimsonQuill,*Halo Announcer voice* DOUBLE KILL!
29-07-2019T10:02:23,SniperJackal,:D
29-07-2019T10:02:44,CrimsonQuill,I'm watching Mark's FFPS Secret stream.
29-07-2019T10:02:45,SniperJackal,ngl this has got to be one of my favourite sketches/colourings so far
29-07-2019T10:02:54,CrimsonQuill,And favouriting that picturee
29-07-2019T10:02:58,CrimsonQuill,I love it so much
29-07-2019T10:03:09,SniperJackal,didnt markiplier play a furry dating game for like 1 or 2 hours
29-07-2019T10:03:24,SniperJackal,just to find himself
29-07-2019T10:03:34,CrimsonQuill,"Apparently....I didn't want to watch it, because it seems cringy."
29-07-2019T10:03:44,SniperJackal,true
29-07-2019T10:04:00,Mazzis,It was... interesting
29-07-2019T10:04:17,CrimsonQuill,@Mazzis I will take your word for it.
29-07-2019T10:04:53,SniperJackal,"anyways, I always like when somebody suggests a sketch about something thats extra lore"
29-07-2019T10:05:12,CrimsonQuill,Lore sketches really flesh out the world around.
29-07-2019T10:05:18,SniperJackal,yup
29-07-2019T10:05:32,BadFoMo,Same.
29-07-2019T10:05:56,CrimsonQuill,Hullo BadFoMo.
29-07-2019T10:06:02,SniperJackal,I like how the main human characters look childish compared to the ones in the recent sketch
29-07-2019T10:06:26,BadFoMo,I think I'll take lore over pinups anyday.
29-07-2019T10:06:29,CrimsonQuill,In the picture?
29-07-2019T10:06:33,SniperJackal,yep
29-07-2019T10:06:35,CrimsonQuill,The Exploration one?
29-07-2019T10:06:38,SniperJackal,yes
29-07-2019T10:06:53,CrimsonQuill,"They do seem like curious children...But then again, it's a new world."
29-07-2019T10:06:57,CrimsonQuill,A new land.
29-07-2019T10:07:44,SniperJackal,Sometimes I feel like im the only one wanting too se more human characters in sketches hahah
29-07-2019T10:07:48,SniperJackal,because variety
29-07-2019T10:08:43,CrimsonQuill,"It would be fun to see more human culture, how it contrasts with that of the Keidran and the Basitins."
29-07-2019T10:09:03,CrimsonQuill,"For example, the heirarchies and governments."
29-07-2019T10:09:15,SniperJackal,agreed
29-07-2019T10:09:28,CrimsonQuill,Militaries and Services....Clothing....
29-07-2019T10:09:39,CrimsonQuill,Housing and settlements.
29-07-2019T10:09:42,CrimsonQuill,All these things.
29-07-2019T10:10:23,SniperJackal,yep but its probably better for these things to be in sketches
29-07-2019T10:10:35,SniperJackal,the main story line should stay as it is
29-07-2019T10:11:39,CrimsonQuill,I personally hope that the story still has a lot ahead....
29-07-2019T10:11:51,SniperJackal,same
29-07-2019T10:11:52,CrimsonQuill,"Because I'm only recently in it, and I love it so much."
29-07-2019T10:12:10,SniperJackal,I read the story about a year ago for the first time
29-07-2019T10:12:14,SniperJackal,read it in 2 days
29-07-2019T10:12:21,SniperJackal,I was an emotional wreck
29-07-2019T10:12:33,SniperJackal,never gonna do that again
29-07-2019T10:12:36,CrimsonQuill,I'm reading it again for the third or fourth time this year.
29-07-2019T10:12:59,SniperJackal,gawd
29-07-2019T10:13:08,SniperJackal,I tried rereading it but I just cant
29-07-2019T10:13:13,CrimsonQuill,The first time I ever read it I read a few chapters a day...until Chapter 10. Then I couldn't leave it and read chapters 10-19 in an afternoon.
29-07-2019T10:13:22,SniperJackal,usually I just reread the chapters that I want
29-07-2019T10:13:24,CrimsonQuill,I admit though...the old chapters are a bit to go through.
29-07-2019T10:13:29,SniperJackal,yep
29-07-2019T10:13:30,CrimsonQuill,What with the art evolution.
29-07-2019T10:13:32,SniperJackal,*blarg*
29-07-2019T10:13:36,CrimsonQuill,And the dialogue.
29-07-2019T10:13:39,CrimsonQuill,But it's worth it.
29-07-2019T10:13:58,SniperJackal,when I first read it the Laura death actually legit made me sad
29-07-2019T10:14:17,CrimsonQuill,I think the hardest thing is the voicing in my head...because it can be harder to think of them in the head when the appearences aren't finalized.
29-07-2019T10:14:34,SniperJackal,yeah
29-07-2019T10:14:51,CrimsonQuill,"The moment when Flora tells Trace she's pregnant, and when Red almost killed Raine really got me."
29-07-2019T10:15:05,CrimsonQuill,And Keith's illusion thing...
29-07-2019T10:15:10,SniperJackal,oh yeah
29-07-2019T10:15:18,SniperJackal,when Laura possesed the ghost
29-07-2019T10:15:24,SniperJackal,that hit hard
29-07-2019T10:15:57,CrimsonQuill,Laura never possessed the ghost-it was just the work of the illusion.
29-07-2019T10:16:17,SniperJackal,but at the end you can see its actually her
29-07-2019T10:16:29,CrimsonQuill,Not quite
29-07-2019T10:16:33,SniperJackal,its confusing
29-07-2019T10:16:43,CrimsonQuill,As much as the illusion could feel...she hoped he'd be alright.
29-07-2019T10:16:58,SniperJackal,"anyways so far I ve reread chapter 17,18,19 the most"
29-07-2019T10:16:58,CrimsonQuill,It tugged the heart.
29-07-2019T10:17:30,CrimsonQuill,But especially hard is when Evil Black Smoke Hallucination tries the 'corruption' of the mind...
29-07-2019T10:17:38,CrimsonQuill,And it hits that verbal last straw...
29-07-2019T10:17:44,SniperJackal,oh yeah when he yells at flora
29-07-2019T10:18:07,CrimsonQuill,That moment truly marks the point where he actively fights his darknes...
29-07-2019T10:18:11,CrimsonQuill,darkness
29-07-2019T10:18:36,SniperJackal,the funniest moment has got to be when maddie slept under trace and flora s bed
29-07-2019T10:18:46,SniperJackal,that got a giggle out of me
29-07-2019T10:18:50,CrimsonQuill,But I see a lot of similarities between both Trace and Keith...and a certain Director from Red vs Blue...
29-07-2019T10:19:13,CrimsonQuill,"If you haven't watched RvB I won't elaborate, but the parallels struck me."
29-07-2019T10:19:30,SniperJackal,too many patterns
29-07-2019T10:19:43,SniperJackal,but trace and keith are so different tho
29-07-2019T10:19:46,CrimsonQuill,So...have you watched RvB?
29-07-2019T10:19:51,SniperJackal,uhm
29-07-2019T10:19:58,CrimsonQuill,I'll take that as a no.
29-07-2019T10:20:10,SniperJackal,Look Il do it sometime
29-07-2019T10:20:14,CrimsonQuill,I can't explain the parallels without heavy spoilers...
29-07-2019T10:20:21,CrimsonQuill,But it's worth a watch.
29-07-2019T10:20:32,CrimsonQuill,Seasons 6-10 and 11-13 are the best.
29-07-2019T10:20:41,CrimsonQuill,But Seasons 1-5 are hilarious...
29-07-2019T10:20:48,SniperJackal,the halo 1 days
29-07-2019T10:20:55,SniperJackal,why are we here
29-07-2019T10:21:08,CrimsonQuill,"One of life's great mysteries, isn't it?"
29-07-2019T10:21:21,SniperJackal,I do remember that tho
29-07-2019T10:22:20,CrimsonQuill,Good times...
29-07-2019T10:30:42,SniperJackal,"anyways just like with twokinds, its the same with the halo universe. The main story line is great, and everything extra is just a bonus"
29-07-2019T10:33:17,CrimsonQuill,True that
29-07-2019T10:33:20,CrimsonQuill,Welll....
29-07-2019T10:33:30,CrimsonQuill,'Always'....Halo 5 was not so good.
29-07-2019T10:33:41,CrimsonQuill,I think we can agree that it was a dark chapter
29-07-2019T10:33:47,SniperJackal,100%
29-07-2019T10:33:52,SniperJackal,halo 5 was shallow
29-07-2019T10:35:35,SniperJackal,they shouldnt have brought cortana back
29-07-2019T10:35:48,SniperJackal,it should have been over on halo 4
29-07-2019T10:36:08,SniperJackal,sometimes you gotta let certain things go
29-07-2019T10:44:30,CrimsonQuill,Indeed.
29-07-2019T10:44:40,CrimsonQuill,I'm going to head off for a while.
29-07-2019T10:44:43,CrimsonQuill,I might be back.
29-07-2019T10:44:46,CrimsonQuill,Cheerio.
29-07-2019T10:47:41,AspiringNoodle,"I've watched the first few seasons of RvB, I can confirm that they are indeed hilarious"
29-07-2019T10:48:02,SniperJackal,ok bye
29-07-2019T10:48:11,AspiringNoodle,"That said, as the series progresses, it gets more heavily involved with storytelling and then eventually custom animations"
29-07-2019T10:48:20,AspiringNoodle,Also bye~
29-07-2019T11:02:33,NibblyBot,New Patreon Post: Nighttime Swim https://www.patreon.com/posts/nighttime-swim-28758513
29-07-2019T11:03:05,NibblyBot,New Deviantart Post: Nighttime Swim https://www.deviantart.com/twokinds/art/Nighttime-Swim-807659092
29-07-2019T11:04:13,TerraTheWizard,:ctwokinds-KatDance:
29-07-2019T11:19:17,AspiringNoodle,"Another day, another case of ""Where the f*ck are these parts?!?"""
29-07-2019T11:19:45,AspiringNoodle,Building a computer + hardware launch = Wow... these people are damn thirsty
29-07-2019T11:20:06,TerraTheWizard,:ctwokinds-kingtea:
29-07-2019T11:20:29,AspiringNoodle,"Terra, don't you lie to me"
29-07-2019T11:20:33,AspiringNoodle,You ain't thirsty :p
29-07-2019T11:23:44,TerraTheWizard,sip sip
29-07-2019T11:24:00,TerraTheWizard,:ctwokinds-smug:
29-07-2019T11:32:40,AspiringNoodle,"So this ram I'm waiting for, they said it should be up for sale by the end of the mont"
29-07-2019T11:32:46,AspiringNoodle,And that's from company representatives
29-07-2019T11:33:27,AspiringNoodle,"Would be nice if it went up for sale today, seeing how the RAM market is basically wiped out"
29-07-2019T11:54:23,Orthonox,Is RAM still stupid expensive?
29-07-2019T11:59:38,Orthonox,Checked: It is not anymore.
29-07-2019T12:00:04,AspiringNoodle,The premium stuff is
29-07-2019T12:01:04,Orthonox,Premium is always going to be expensive. How much is the RAM you are trying to get?
29-07-2019T12:01:56,AspiringNoodle,The ram I'm looking at runs $340 - $420 per 32GB total
29-07-2019T12:02:20,AspiringNoodle,And 1/3 - 1/2 the entires are sometimes $300 or more for just 16GB
29-07-2019T12:02:59,Orthonox,What are you going to do that requires expensive RAM?
29-07-2019T12:03:10,AspiringNoodle,Use a Ryzen processor :P
29-07-2019T12:04:01,Orthonox,"I'm not familiar with everything on Ryzen. I'm assuming the RAM you are buying is at a very high speed and probably low CAS latency, right?"
29-07-2019T12:04:08,AspiringNoodle,Yup
29-07-2019T12:04:14,AspiringNoodle,I'm trying to get my hands on 3600 CL16
29-07-2019T12:04:19,Orthonox,How does that benefit Ryzen?
29-07-2019T12:04:50,AspiringNoodle,Ryzen has always benefitted from higher performance ram since the first gen
29-07-2019T12:05:09,AspiringNoodle,The infinity fabric interconnect really likes ram that hauls ass :3
29-07-2019T12:06:07,AspiringNoodle,Bumping up from the most basic of 2133 ram kits to the highest end is the equivalent performance boost of a modest overclock
29-07-2019T12:06:34,AspiringNoodle,I'm gonna pull some numbers out of my ass from a benchmark video I watched a day or two ago
29-07-2019T12:07:01,AspiringNoodle,"A Ryzen 3900x running on the cheapest, entry level 2133 ram, would achieve 98 fps in a given title"
29-07-2019T12:07:05,Orthonox,"Aw cool. I remember before Ryzen came to be, RAM Speed wasn't important unless you have an APU or want to overclock for fun."
29-07-2019T12:07:13,AspiringNoodle,"Bump that up to 3600 CL16, and the FPS jumps up to 117"
29-07-2019T12:07:50,Orthonox,Alright AMD. I see you. First making cores important and now RAM speed.
29-07-2019T12:07:51,AspiringNoodle,"And when it comes to 1% lows, even comparing 3600 CL16 to 3200 CL14, the difference an be as high as 20 fps"
29-07-2019T12:08:20,AspiringNoodle,"Also, if you like playing large open-world games, you'll want better ram"
29-07-2019T12:08:34,AspiringNoodle,"Fallout 4 is a good example, with your ram quality having a noticeable effect on framerate"
