date,user,comment
03-04-2020T00:00:26,SageSaga,i think we mostly have barn owls and great horned owls
03-04-2020T00:01:25,FoxxTrotter,"Haven't seen a barn owl IRL yet. I've seen great horned owls at zoos, but not in the wild yet."
03-04-2020T00:02:04,ZRO4825,"Only time I think I've actually *seen* owls was at zoos, and when there was a Snowy Owl that was hanging out around here for some reason"
03-04-2020T00:02:11,SageSaga,i think we sometimes have saw-whet owls but not often
03-04-2020T00:02:38,SageSaga,saw-whet owls are adorable looking
03-04-2020T00:05:51,Almighty404,Owls are always a hoot.
03-04-2020T00:05:59,SageSaga,boooo
03-04-2020T00:06:01,SageSaga,bad pun
03-04-2020T00:06:30,FoxxTrotter,"""Give a hoot. Don't pollute."""
03-04-2020T00:06:36,FoxxTrotter,(old commercial)
03-04-2020T00:07:00,BlackjackSec99,"but the worse a pun is, the better it is."
03-04-2020T00:07:06,FoxxTrotter,About 25-30 years ago if I remember correctly.
03-04-2020T00:07:07,BlackjackSec99,pun's paradox
03-04-2020T00:08:52,SageSaga,no- a pun has to be reeeeeeeeally bad to be good- otherwise if it isnt a good clever pun - it's a waste of breath/typing
03-04-2020T00:09:04,FoxxTrotter,Yeah...Woodsy Owl. Back in the 1970's-1980's.
03-04-2020T00:14:00,Almighty404,She is the bone of her pillows
03-04-2020T00:15:20,Ordithus,can't say she didn't have it coming
03-04-2020T00:15:44,eric190,heyo!
03-04-2020T00:15:44,Ordithus,can only tease your friends so much
03-04-2020T00:15:53,FoxxTrotter,"Hi, Eric."
03-04-2020T00:15:59,eric190,i is now a robot lizard.
03-04-2020T00:22:09,eric190,how's everyone doing tonight?
03-04-2020T00:22:42,Ordithus,sleepsy
03-04-2020T00:22:47,CrimsonHelsing,"Pretty good, tired tho"
03-04-2020T00:25:03,AspiringNoodle,"Trying not to fall asleep early, haha"
03-04-2020T00:27:02,AspiringNoodle,"One more day of work, then 3 days off, woo~"
03-04-2020T00:28:28,CrimsonHelsing,Woot woot!
03-04-2020T00:29:47,AspiringNoodle,"Very woot, especially since the job is grinding on EVERYONE'S nerves now more than ever"
03-04-2020T00:30:19,Ordithus,cannot stay awake any longer
03-04-2020T00:30:20,AspiringNoodle,"I'm worried that we may lose some of our full time employees.  Or that some of hour newer ones may say, ""Naw, I'm out"""
03-04-2020T00:30:24,Ordithus,:ctwokinds-RainezZz: night
03-04-2020T00:30:26,AspiringNoodle,Ord
03-04-2020T00:30:30,FoxxTrotter,"I'm off to bed. G'night, everyone. :0)"
03-04-2020T00:30:31,AspiringNoodle,*heavy metal starts playing*
03-04-2020T00:30:34,FoxxTrotter,"G'night, Ord."
03-04-2020T00:30:38,Ordithus,night foxx
03-04-2020T00:30:50,AspiringNoodle,RIP
03-04-2020T00:31:49,CrimsonHelsing,"You're telling me xP I got comments from the boss today on a lackluster job the other day, which was only because they told me they'd take care of the rest after I got all the grease squuegee'd to a particular spot xP"
03-04-2020T00:32:27,AspiringNoodle,Our store was already tight on hours
03-04-2020T00:32:48,AspiringNoodle,But then they add this rather comprehensive cleaning regiment that we're *supposed* (key word: supposed) to do every 2 hours
03-04-2020T00:32:58,CrimsonHelsing,"These are the kind of bosses that if you try to explain, they drown you out/talk over you so they don't have to listen to you"
03-04-2020T00:33:18,AspiringNoodle,So we barely had the manpower to get things done to begin with.  And now they've reduced hours further
03-04-2020T00:33:25,AspiringNoodle,I hate corporate :ptv-unimpressed:
03-04-2020T00:33:52,AspiringNoodle,What makes it extra stupid is that it seems that morning shift is now solely managers and supervisors
03-04-2020T00:34:09,AspiringNoodle,"It was stupid to begin with, now it's extra stupid :upside_down:"
03-04-2020T00:34:35,AspiringNoodle,"Sage, how much would it cost so hire Nyna to dig up some dirt on the parent company?"
03-04-2020T00:34:44,SageSaga,now would be the time for whoever is making robots to introduce them as replacements for everyone
03-04-2020T00:34:57,AspiringNoodle,UBI while we're at it? :ptv-excited:
03-04-2020T00:35:04,CrimsonHelsing,Pfeh xD
03-04-2020T00:35:20,SageSaga,well before we get a UBI we first need people to realize they arent needed anymore
03-04-2020T00:35:40,SageSaga,and then the government will realize it needs people to be happy or else government stops working
03-04-2020T00:35:48,CrimsonHelsing,"Yeah, when robots are cheaper than human labor, that'd be the day lol"
03-04-2020T00:35:59,AspiringNoodle,Correction: Government will realize it needs people to LIVE or else it stops working
03-04-2020T00:35:59,SageSaga,they- they already are
03-04-2020T00:36:03,AspiringNoodle,^
03-04-2020T00:36:16,AspiringNoodle,"Cheaper, far more productive, more efficient"
03-04-2020T00:36:22,CrimsonHelsing,O.o;
03-04-2020T00:36:30,AspiringNoodle,The only thing holding it back is the fact that automation has a huge upfront cost
03-04-2020T00:36:43,AspiringNoodle,"And it's easier for businesses to eat the more expensive, but also way more spread out, cost of human labor"
03-04-2020T00:36:48,CrimsonHelsing,What about maintenance?
03-04-2020T00:36:50,SageSaga,they have a higher upfront cost but once bought they cost much less on maintenance and make less mistakes
03-04-2020T00:36:54,AspiringNoodle,^
03-04-2020T00:37:03,AspiringNoodle,Maintenance is a pittance compared to human costs
03-04-2020T00:37:16,AspiringNoodle,"Pay (salary or hourly), insurance, benefits, retirement"
03-04-2020T00:37:31,SageSaga,instead of paying someone 7 dollars per hour the cost to maintain the robots is like a dollar a week
03-04-2020T00:37:41,AspiringNoodle,"Machine: Can work without rest, only costs extra money when it breaks down or schedule maintenance.  Only retirement cost is a newer, better machine"
03-04-2020T00:37:57,CrimsonHelsing,Yow
03-04-2020T00:38:14,AspiringNoodle,"For most of human history, machines worked as productivity multipliers"
03-04-2020T00:38:28,AspiringNoodle,They worked WITH humans to increase the productivity of the average worker by untold amounts
03-04-2020T00:38:44,AspiringNoodle,"But with the advent of automation, and now AI making smart machines, they can completely replace the worker"
03-04-2020T00:39:20,CrimsonHelsing,In most aspects a bad idea
03-04-2020T00:39:33,AspiringNoodle,I've used self-order kiosks at McDonald's.  They're SUPER convenient.  I can browse the entire menu at my own leisure
03-04-2020T00:39:36,SageSaga,and all the economists think we'll just come up with all new jobs- while others are saying this is a horse vs car situation- human workers are horses- cars are automation
03-04-2020T00:39:40,AspiringNoodle,I can make edits to my order
03-04-2020T00:40:00,Dadrobit,Automation is the global warming of the job market.
03-04-2020T00:40:05,SageSaga,how many horses do you see every day?
03-04-2020T00:40:16,AspiringNoodle,"I can see things at a moments notice that might not be on the menu, or are on those stupid animated screens"
03-04-2020T00:41:00,Dadrobit,"""New Technology always creates more jobs! Look at Uber and Lyft"" is like saying ""Look! We just had a really cold winter! Global warming is a myth."""
03-04-2020T00:41:04,AspiringNoodle,"Horses of the past: Primary driver of the economy.  Commuting, moving of goods."
03-04-2020T00:41:28,AspiringNoodle,Horses of today: Primarily a luxury or for entertainment.
03-04-2020T00:41:29,SageSaga,i totally believe new jobs will be created- i just dont think enough of them will be XD
03-04-2020T00:41:55,AspiringNoodle,I have a different idea
03-04-2020T00:42:03,SageSaga,XD Humans working a front desk will become a sign of wealth?
03-04-2020T00:42:13,AspiringNoodle,"New jobs will be created.  But lower skilled and low paying, or extremely high skilled and limited in supply :)"
03-04-2020T00:42:23,Dadrobit,Sage. Completely unironically. Yes. That is exactly it.
03-04-2020T00:42:40,AspiringNoodle,"A good example of the threat of automation, the trucking industry"
03-04-2020T00:42:46,SageSaga,rich people will treat him/her like a rare treat for their amusement
03-04-2020T00:43:15,Dadrobit,That's my job secuirty. Mobile robot security is already a thing. But my clients would never agree to that.
03-04-2020T00:43:15,AspiringNoodle,The trucking industry employs 8.7 million people
03-04-2020T00:43:24,CrimsonHelsing,"Gotta admit tho, you can never really phase out human employment ;P"
03-04-2020T00:43:43,SageSaga,"it's like John Henry vs the Steam machine! Such a great story of man beating machine! ""Uhhhhh- you do know how it ends- right?"""
03-04-2020T00:43:48,AspiringNoodle,"If self-driving trucks become a HUGE improvement in terms of cost-benefit for the industry, say goodbye to millions of well-paying jobs"
03-04-2020T00:43:50,CrimsonHelsing,Not as much as corporate America would want anyway
03-04-2020T00:43:53,Dadrobit,They just want a concierge with a badge. So they pay me and my cohorts. A robot isn't a substitute for my position. (at the moment)
03-04-2020T00:44:14,SageSaga,spoiler- John Henry dies from exhaustion and they make a newer faster machine
03-04-2020T00:44:56,Dadrobit,"More realistically. Self driving trucks will not be piloted ""100%"" by AI. More like planes with pilots where 99% of their job is automated."
03-04-2020T00:45:03,AspiringNoodle,"UBI probably could be funded, but we'd need to close down all these tax loopholes"
03-04-2020T00:45:19,Dadrobit,But the new drivers are gonna be paid trash and they'll undercut all the currently employed truckers.
03-04-2020T00:45:36,CrimsonHelsing,Looks like business is always gonna have to figure it out the hard way; they'll always need people to get the job done
03-04-2020T00:45:38,AspiringNoodle,"As well as stop being lenient on corporations, who have TIME AND TIME AGAIN shown that when they get tax breaks, they use the newly available funds to either enrich themselves further, or lobby politicians to maintain or increase their goodies"
03-04-2020T00:45:57,Dadrobit,"Having a human driver is great for liability. If there's an accident, just blame it on the minimum wage human, fire them, and get new fodder."
03-04-2020T00:46:09,AspiringNoodle,We should also probably start tracking down offshore accounts in tax havens
03-04-2020T00:46:28,AspiringNoodle,Nothing says trickle-down economics like wealthy people smuggling their wealth out of their home countries and hiding it from the world :P
03-04-2020T00:46:44,SageSaga,there is a point where capitalism stops being a benefit to everyone and becomes a benefit only to those at the top- but people dont want to admit it
03-04-2020T00:46:49,Dadrobit,"They're tracked perfectly. The problem is the ones in power tracking them, are the ones who set them up."
03-04-2020T00:47:12,eric190,"and that all starts by getting people to vote, and removing the people who benefit from this stuff from office."
03-04-2020T00:47:26,AspiringNoodle,I want to wake people up to the fact that the last round of tax cuts corporations got resulted in them benefiting only the people at the top
03-04-2020T00:47:37,AspiringNoodle,There was a company that went from owing billions to have an effective tax rate of 0
03-04-2020T00:47:53,SageSaga,amazon?
03-04-2020T00:47:56,AspiringNoodle,"Instead of investing back into the company like they promised, they used all the freed-up ex-tax money to buy back stocks"
03-04-2020T00:48:13,SageSaga,sounds like amazon
03-04-2020T00:48:18,AspiringNoodle,"Thus increasing stock value and enriching the investors, stockholders, and people at the top of the company"
03-04-2020T00:48:29,AspiringNoodle,Literally just leeching off the company to enrich themselves further
03-04-2020T00:49:06,AspiringNoodle,"We've also seen investment from companies trend downward after the tax breaks, showing that when they don't have to work hard for their money, they'll take the easy route"
03-04-2020T00:50:26,AspiringNoodle,"Politically, I'm moderate, but the more I read about modern economics, the more I'm like, ""Tax the rich to hell and back.  They'll work harder to keep making their money :)"""
03-04-2020T00:50:27,SageSaga,"i actually think CEOs and such should make tons of money on their success- i just think there's a limit - a point where you go ""Do i really need 100 Million every year? I only spend like 5 million in a year- if i cut it to 50 million id' be fine and could"
03-04-2020T00:50:36,SageSaga,"put that money towards more workers and buildings-"""
03-04-2020T00:50:49,AspiringNoodle,"Good point, sage!"
03-04-2020T00:51:06,AspiringNoodle,I actually have a GREAT example of how American CEO's are pretty effing greedy in this regard :D
03-04-2020T00:51:20,eric190,"nonono, you gotta think like them ""i make 100 million a year. i want more money. what can i do to make 150?"""
03-04-2020T00:51:41,SageSaga,Meanwhile Bezos is making 1.5 billion dollars a week
03-04-2020T00:52:06,eric190,still not enough money. gotta get all the money until you're the only one that has any.
03-04-2020T00:52:40,AspiringNoodle,"Tbf, if I remember correctly, most of Bezos' money comes from stock value"
03-04-2020T00:52:57,AspiringNoodle,His actual salary is pretty modest
03-04-2020T00:53:16,BadFoMo,How/what is Bezo?
03-04-2020T00:53:26,AspiringNoodle,"Jeff Bezos, founder / CEO of Amazon"
03-04-2020T00:53:33,BadFoMo,Thanks.
03-04-2020T00:53:47,AspiringNoodle,"And I just did a quick double check.  His salary went up from the last time I checked, but his yearly compensation is only $81,840"
03-04-2020T00:54:03,AspiringNoodle,The rest of his money is from the 16% share he owns
03-04-2020T00:54:19,SageSaga,yeah but he can leverage that at almost any time
03-04-2020T00:54:44,AspiringNoodle,"True!  But if he ever sells off his stock, that's subject to capital gains tax"
03-04-2020T00:54:59,SageSaga,oh no!
03-04-2020T00:55:04,SageSaga,not capital gains tax!
03-04-2020T00:55:46,AspiringNoodle,But Bezos is an easy target.  I got a greedier a-hole I want to villify
03-04-2020T00:56:05,SageSaga,he's have to pay 20% on tax! How - reasonable?
03-04-2020T00:56:07,AspiringNoodle,Bobby Kotick.  CEO of Activision-Blizzard.  I have a personal hard-on for wanting to see this man fail.
03-04-2020T00:56:11,BadFoMo,EA?
03-04-2020T00:56:26,BadFoMo,"Meh, close enough."
03-04-2020T00:56:51,AspiringNoodle,Activision makes 6.5 - 7.5 billion in revenue a year.  With about .5 - 1.5 billion in profit
03-04-2020T00:57:16,AspiringNoodle,"Bobby recieves an annual salary of almost $29,000,000.  With other benefits / bonuses, that goes above $32,000,000"
03-04-2020T00:57:29,AspiringNoodle,Let's compare him to the CEO of Sony
03-04-2020T00:57:52,AspiringNoodle,Kenichiro Yoshida.
03-04-2020T00:58:00,SageSaga,i dont think bezos is a bad person - i just think hes got more money than he'll ever need and he doesnt seem to put it towards a lot of good things
03-04-2020T00:58:15,SageSaga,when he gives a cause 100k- that's like giving them a penny to him
03-04-2020T00:58:18,AspiringNoodle,"This man makes $4,900,000 a year.  In the recent past, it was only $3,000,000"
03-04-2020T00:58:35,AspiringNoodle,The difference?  SONY'S REVENUE IS ALMOST 10X HIGHER THAN ACTI-BLIZZ
03-04-2020T00:58:58,AspiringNoodle,"$75,000,000,000 +/- several billion"
03-04-2020T00:59:17,AspiringNoodle,Kotick makes 6 - 10x more money than the CEO of effing Sony
03-04-2020T00:59:24,AspiringNoodle,When his company makes 10x less
03-04-2020T00:59:45,AspiringNoodle,How 'bout them apples?
03-04-2020T01:00:34,SageSaga,is bill gates like the only decent rich person?
03-04-2020T01:00:47,AspiringNoodle,Probably!
03-04-2020T01:00:52,SageSaga,sorry- Super rich
03-04-2020T01:01:01,SageSaga,"there are plenty of great ""rich"" people-"
03-04-2020T01:01:35,SageSaga,"Bezos is just like ""ive got so much money the only way to waste it is to spend it on space travel"""
03-04-2020T01:01:43,SageSaga,so he does-
03-04-2020T01:02:51,AspiringNoodle,"Personally, I can't see myself ever wanting to keep that much money if it ever came into my possession"
03-04-2020T01:03:30,AspiringNoodle,"I'm a gamer, straight up.  And while you can go nuts with a computer build, you'd have to try REALLY hard to spend over $100k.  Even on a workstation"
03-04-2020T01:04:27,SageSaga,its like- do you count the building of a house for the system?
03-04-2020T01:04:41,AspiringNoodle,"If I tried to do that, please shoot me"
03-04-2020T01:04:59,SageSaga,i would totally build a house to be PC friendly
03-04-2020T01:05:11,SageSaga,easy routing of 10GB networking and better power
03-04-2020T01:05:27,AspiringNoodle,"That might be a bit different, lol"
03-04-2020T01:05:39,AspiringNoodle,"If you're building a super tech-friendly house, that seems like a reasonable 1-time investment"
03-04-2020T01:05:50,SageSaga,heck yeah
03-04-2020T01:05:58,AspiringNoodle,Especially since you probably wouldn't go through the headache of doing it multiple times ;P
03-04-2020T01:06:24,SageSaga,you could build a server with multiple connections and have Virtual pcs set up all around the house for people to use for whatever- and still have a gaming rig
03-04-2020T01:06:52,SageSaga,actually- Linus from Linus tech tips did that at his house
03-04-2020T01:07:45,AspiringNoodle,"I think the splurgiest I'd ever get beyond that would be an arcade room, a home theater (like, a dedicated theater room meant to replicate the cinema experience), and / or game-themed rooms"
03-04-2020T01:08:02,AspiringNoodle,You should see that couple that modeled their basement after Skyrim as the dedicated game lounge
03-04-2020T01:08:06,AspiringNoodle,I want it :ptv-excited:
03-04-2020T01:08:40,SageSaga,my dream home is a wizard tower
03-04-2020T01:09:37,AspiringNoodle,"Sage, want link? :3"
03-04-2020T01:09:48,SageSaga,sure
03-04-2020T01:09:51,AspiringNoodle,https://imgur.com/gallery/x6CHN
03-04-2020T01:09:56,AspiringNoodle,"Is thing of beauty, it is~"
03-04-2020T01:11:01,SageSaga,sweet
03-04-2020T01:11:34,BadFoMo,"A little to much for me, but I like it."
03-04-2020T01:12:15,SageSaga,for my wizard tower though- glass elevator in the center- ground floor is a welcoming floor with themed seating area- elevator goes to second floor with Kitchen/bar and gaming area + bathroom- top floor has master bedroom and office + bathroom- and roof
03-04-2020T01:12:18,SageSaga,access
03-04-2020T01:13:10,AspiringNoodle,"Rich business person: Wants more money, multiple mansions, expensive sports / super / hyper cars, yachts, personal jets,"
03-04-2020T01:13:17,BadFoMo,Like the Lucky 38 from Fallout New Vegas?
03-04-2020T01:13:27,SageSaga,the glass elevator would have RGB to make it looked like it glows with magical energy
03-04-2020T01:13:28,AspiringNoodle,"Rich gamers: Baller pc, all the games, nerd-fantasy homes"
03-04-2020T01:13:44,AspiringNoodle,"Gamers are so low maintenance, lol"
03-04-2020T01:14:22,SageSaga,im just saying- Bezos could have a cool wizard tower- but he doesnt- hes wasting his money
03-04-2020T01:14:42,Twokinds,I saw a neat looking modern house built like a tower on reddit today
03-04-2020T01:14:56,SageSaga,find link
03-04-2020T01:14:57,BadFoMo,Cool.
03-04-2020T01:16:10,AspiringNoodle,TOM :ptv-excited:
03-04-2020T01:16:14,AspiringNoodle,"Super lurk mode, I see"
03-04-2020T01:16:48,Twokinds,https://i.imgur.com/BEMhBc4.jpg
03-04-2020T01:17:00,AspiringNoodle,YES.
03-04-2020T01:17:01,AspiringNoodle,WANT.
03-04-2020T01:17:03,AspiringNoodle,GIMME.
03-04-2020T01:17:10,AspiringNoodle,...GIVE PHIL.
03-04-2020T01:17:10,BadFoMo,Sweet.
03-04-2020T01:18:02,SageSaga,i would want it bigger both taller and wider- but that looks sweet
03-04-2020T01:21:44,JojoF2415,Hi
03-04-2020T01:21:58,SageSaga,yo
03-04-2020T01:22:03,BadFoMo,Yo.
03-04-2020T01:22:21,jirka,Hi Tom What time are you going to have streaming? PLS
03-04-2020T01:22:58,BadFoMo,I think it's been cancled.
03-04-2020T01:24:00,JojoF2415,I was going to beat deadlocked but got a 82% fail :ptv-sad:
03-04-2020T01:24:17,BadFoMo,Hmm?
03-04-2020T01:26:04,Dadrobit,:( Now I wanna look at homes for myself. Even though I still am working on saving up
03-04-2020T01:26:58,BadFoMo,You can still look; you just can't buy.
03-04-2020T01:28:17,AspiringNoodle,"Museums: ""No touch, only look."""
03-04-2020T01:28:24,AspiringNoodle,"House market 2050: ""No touch, only look."""
03-04-2020T01:32:42,SageSaga,isnt the housing market suspected to go down due to this?
03-04-2020T01:32:50,SageSaga,or is it already?
03-04-2020T01:33:49,BadFoMo,Due to what?
03-04-2020T01:34:00,ZRO4825,"No clue, personally. I have paid NO attention to the housing market thus far."
03-04-2020T01:34:04,AspiringNoodle,I'm curious to see if the market made the same exact mistakes as the 2008 bubble burst
03-04-2020T01:34:13,SageSaga,the virus crashing almost everything
03-04-2020T01:34:13,ZRO4825,"It basically lies in the realm of ""Out of my reach"" no matter what it does, lol"
03-04-2020T01:34:19,BadFoMo,Thanks.
03-04-2020T01:34:22,Dadrobit,"Our economy is in the shitter, lots of folks losing their homes. Cheap forclosures everywhere, the rest of the market will dip to match for a while"
03-04-2020T01:34:38,BadFoMo,What happened in 08?
03-04-2020T01:34:40,AspiringNoodle,Did you guys know that they made a movie about the 2008 housing market crash?
03-04-2020T01:35:08,SageSaga,the housing market bubble burst and a ton of money was lost
03-04-2020T01:35:15,AspiringNoodle,It's called The Big Short.  It explains EXACTLY what happened
03-04-2020T01:35:34,AspiringNoodle,"As well as detailed an investing savant who was able to predict what happened, and came up with a new kind of insurance policy"
03-04-2020T01:35:51,Dadrobit,Housing bubble. Bad loans were given to everybody without telling the investors. Eventually loans started falling through. Caused a chain reaction of everyone pulling out. Everyone pulls out and the 401k's go in the shitter.
03-04-2020T01:35:55,Twokinds,jirka: I'd like to stream but I can't tonight
03-04-2020T01:36:16,AspiringNoodle,Banks more or less gave out ludicrous amounts of sub-prime loans
03-04-2020T01:36:26,AspiringNoodle,"Loans that have a high chance of defaulting (aka, not being paid)"
03-04-2020T01:36:46,AspiringNoodle,And then they bundled things together to reduce the overall risk and sold them
03-04-2020T01:37:09,Twokinds,"I haven't seen the big short, but I've watched several documentories about 2008. It's very interesting."
03-04-2020T01:37:22,Dadrobit,"^^^^ So when part of the system fell through, everyone fell through."
03-04-2020T01:37:43,AspiringNoodle,The worst part?  the taxpayers bailed out the dipwads who ruined the economy on purpose
03-04-2020T01:38:02,AspiringNoodle,The people at the top of the financial systems who caused the whole mess to happen honestly should have been jailed
03-04-2020T01:38:39,Dadrobit,"Parents were able to capitalize on it themselves. Bought half a dozen forclosed fixer-uppers. Renovated them over a couple years, now they've almost finished paying them all off."
03-04-2020T01:38:40,SageSaga,economics is complicated- it seems like it should be simple since its mostly math- until you realize a person can say something wrong and make everyone think somethings going to happen and they over react to it and it causes a massive human error that
03-04-2020T01:38:45,SageSaga,cascades forever
03-04-2020T01:39:30,SageSaga,yeah but a lot of those had to be bailed out
03-04-2020T01:39:33,JojoF2415,I can’t believe I haven’t beaten deadlocked after 10 months
03-04-2020T01:39:49,AspiringNoodle,I'm not so mad that we bailed them out
03-04-2020T01:40:08,AspiringNoodle,I'm mad that the people responsible got off scot free
03-04-2020T01:40:10,SageSaga,"it kinda works like this ""If we dont bail them out- its going to destroy hundreds of thousands of peoples lives that had nothing to do with it"
03-04-2020T01:40:15,Dadrobit,":Too big to fail"""
03-04-2020T01:40:42,AspiringNoodle,Privatized gains; socialized losses.  My favorite phrase of modern year ;)
03-04-2020T01:41:12,SageSaga,"""Im sorry Wells Fargo- but you screwed up and now have to pay the price-"" ""Ok- no one gets their money from us till we settle this-"" ""Wait - what? No! I have my money here!"""
03-04-2020T01:41:44,Dadrobit,"Still sucks. The corporate assholse were able to put all the blame on the government for their failure. ""If the government doesn't bail us out, then that means the government WANTS the people to suffer."""
03-04-2020T01:42:02,Dadrobit,So the govt. is put inbetween a rock and a hard place.
03-04-2020T01:42:14,SageSaga,however-
03-04-2020T01:42:25,SageSaga,the banks for the most part did end up paying it all back
03-04-2020T01:42:38,Dadrobit,"Yeah, and the auto industry did as well."
03-04-2020T01:42:45,SageSaga,just not with as much intrest as they charged people <_<
03-04-2020T01:42:47,AspiringNoodle,"Yeah, but how much you want to bet the people who milked these messes didn't pay a single dime?"
03-04-2020T01:43:23,Dadrobit,Unlike the current farm bailout bullshit happening. That money  is ~gone~~~
03-04-2020T01:43:26,SageSaga,oh im sure they did- but they can lose a 100 billion dimes and be fine
03-04-2020T01:44:10,AspiringNoodle,I wonder what it will take to stop this race to the bottom capitalism seems obsessed with
03-04-2020T01:44:19,SageSaga,im not familiar with that - what is that about Robit?
03-04-2020T01:44:52,BadFoMo,@AspiringNoodle ...Zombie Outbreak?
03-04-2020T01:45:03,SageSaga,also - just to be clear- im capitalist to a point- we are just seeing some of those points now XD
03-04-2020T01:45:29,AspiringNoodle,"Oh yeah, no Capitalism is great.  It's just that we've let it run amok for far too long"
03-04-2020T01:46:03,SageSaga,"i think there's a point where you can legit have ""enough money"" and should be required to use it for a cause the benefits society or raises up the lower class"
