date,user,comment
03-04-2020T01:46:21,AspiringNoodle,"Some years ago, I realized that pure ideological systems are bound to fail"
03-04-2020T01:47:04,AspiringNoodle,"And it's always for the same reason. Humans.  Humans can be greedy, corrupt, selfish."
03-04-2020T01:47:24,AspiringNoodle,They will twist and bend and manipulate anything to their advantage
03-04-2020T01:47:52,AspiringNoodle,Soviet Russia is a prime example.  They were OBSESSED with efficiency.  Only one company per product.
03-04-2020T01:47:53,Dadrobit,"Tarrifs with China fucked our agriculture industry. $8.4billion dollars went into agriculture to try and keep it afloat. It isn't working. But more importantly, that money was 100% a gift."
03-04-2020T01:47:59,Dadrobit,Never being paid back
03-04-2020T01:48:23,SageSaga,ah you said now so i assumed it was something new- but thats not new
03-04-2020T01:48:38,AspiringNoodle,A huge part of communism was you'd only get one choice.  But guess who got an extra choice?  Officials of the government.
03-04-2020T01:48:47,Dadrobit,"Well, I mean, it's still going on."
03-04-2020T01:48:58,SageSaga,yeah that money isnt getting paid back- but i do think it is mostly worth keeping them around because we do rely on their food
03-04-2020T01:49:16,AspiringNoodle,"Soviet Russia had TWO vehicles you could actually *choose* from.  But I say *choose* because regular people got one version, and government officials got the objectively better car."
03-04-2020T01:49:30,SageSaga,they could cut back on production but then it will cost a lot to ramp back up production once they stop to cut back
03-04-2020T01:50:21,SageSaga,"""you can have one of these two apples!"" ""Well - I have a gun- so i take both apples!"" ""Enjoy your apples!"""
03-04-2020T01:51:30,AspiringNoodle,"Sage, that's clearly not how that goes"
03-04-2020T01:51:38,AspiringNoodle,"""You can have one of these two apples!"""
03-04-2020T01:51:42,AspiringNoodle,*pulls gun*
03-04-2020T01:51:53,AspiringNoodle,"""Nah, I think I'll take your entire orchard.  Also you work for me now."""
03-04-2020T01:51:56,AspiringNoodle,"""You got it, boss!"""
03-04-2020T01:52:25,SageSaga,"""What happened dear?"" ""I got hired!"""
03-04-2020T01:52:35,AspiringNoodle,"""What's the pay?"" ""I get to live!"""
03-04-2020T01:52:42,AspiringNoodle,:ptv-laugh:
03-04-2020T01:53:19,Dadrobit,"Sorry, it's up to 22 billion now. Also, like everything else, the lion's share is going to the wealthiest farms while smaller ones are left to foreclose and be bought out."
03-04-2020T01:54:36,SageSaga,ah- the law of the jungle- big cat waits for little cats to die and then they take their stuff... wait
03-04-2020T01:55:12,Dadrobit,"As of August of last year, the bottom 80% of all farms only received $5000. The wealthy top 1% each took in $180,000."
03-04-2020T01:55:51,SageSaga,well that would make sense if their costs are that much higher
03-04-2020T01:56:18,AspiringNoodle,Part of the problem is that food is so cheap
03-04-2020T01:56:33,SageSaga,that's a good thing though-
03-04-2020T01:56:36,AspiringNoodle,"And so in order to make enough money to actually make a living, you need super expensive farm equipment"
03-04-2020T01:56:59,AspiringNoodle,But the farm may not be large enough to support that kind of equipment AND making a living
03-04-2020T01:57:17,AspiringNoodle,"But because it's the only way the small farm can compete with the large farm, they have to buy it anyways"
03-04-2020T01:57:25,Dadrobit,The delta between the top 1% should not be 36+ to 1 against everything below 80%.
03-04-2020T01:57:47,SageSaga,doesnt that depend on how much the cost for those all to run?
03-04-2020T01:58:00,AspiringNoodle,"Farms are businesses plain, and simple"
03-04-2020T01:58:28,SageSaga,basically- everyone should be given enough to keep them going- it makes sense for the biggest to get the most and to get it first because they support the most workers and produce the most product
03-04-2020T01:59:07,Dadrobit,These are the mega ag businesses that are already well established and can take the tariff cuts. It's the small farms that were already running on empty trying to compete with the large industries that needs the help more than ever.
03-04-2020T01:59:15,SageSaga,my guess though is the bigger ones arent cutting back where they can to reduce cost and are getting more than they need and not leaving it for the smaller ones that arent getting enough
03-04-2020T02:00:28,Dadrobit,The 1% saw a cut to their profit margins. The 80% saw the family farm disappear.
03-04-2020T02:00:57,Dadrobit,We shouldn't be using disproportionate amounts of taxpayer dollars to fund profit margins
03-04-2020T02:01:01,SageSaga,why is farmer approval up so high though?
03-04-2020T02:01:28,Dadrobit,Because they're all red states that have been slashing education funding for decades now?
03-04-2020T02:01:35,SageSaga,XD
03-04-2020T02:01:45,SageSaga,"""They  are stupid"" is not the best answer-"
03-04-2020T02:01:58,SageSaga,cant argue with it much though
03-04-2020T02:02:09,Dadrobit,It's not inaccurate though....
03-04-2020T02:02:37,SageSaga,i dont know how well we could prove it though
03-04-2020T02:02:52,SageSaga,is their polling data on the education of most people who run farms?
03-04-2020T02:03:29,Dadrobit,Smaller farms are getting fucked though. Bankruptcy claims are up 40% from 2016.
03-04-2020T02:04:01,SageSaga,i guess you would have to poll them on who they blame to get an idea
03-04-2020T02:04:32,SageSaga,"if they blame China then they dont know how Tariffs work so  you could make them as ""stupid"" XD"
03-04-2020T02:05:02,SageSaga,if you are in a business being hurt by tariffs you need to learn what tariffs are
03-04-2020T02:06:21,SageSaga,ah... found it
03-04-2020T02:06:40,SageSaga,majority of farmers support tariffs
03-04-2020T02:06:45,Dadrobit,"S'pose their reaction likely depends on whether they got $5,000, or $50,000."
03-04-2020T02:07:31,SageSaga,"this is mostly smaller farmers- they think its in their best interest - that they are going to bring in more profits once they 'win"""
03-04-2020T02:07:31,Dadrobit,"I know one farmer who got burned is now running for Governor in Ohio I believe to try and ""Fix"" things."
03-04-2020T02:09:09,SageSaga,does he seem legit or does he seem like a joke?
03-04-2020T02:09:28,Dadrobit,"""Gibbs, 61, voted for Trump in 2016 as a member of the Republican Party and served as chair of the local GOP. But he stepped down after becoming dismayed at Trump’s agricultural and trade policies and disillusioned at the direction his party was heading"""
03-04-2020T02:10:44,SageSaga,"we did just say most farmers are ""stupid"" (in some areas they seem to be misinformed is a nicer way of putting it) but that doesnt also mean they are all stupid- ive seen plenty and met very intelligent farmers"
03-04-2020T02:11:19,Dadrobit,"""my life’s mission from here on out is to ensure that agriculture is never, ever put front and center in a geopolitical war again, like we’ve seen now.”"
03-04-2020T02:11:23,SageSaga,so if a farmer wants to go into politics and knows what they are talking about- and will be representing a big farming population that would be a good thing imo
03-04-2020T02:11:57,SageSaga,i think representatives should represent their people
03-04-2020T02:12:10,Dadrobit,Currently running as an independent
03-04-2020T02:12:26,SageSaga,well hes not going anywhere
03-04-2020T02:12:59,AspiringNoodle,"Tbh, I wish we'd stop delegating manufacturing of everything to China c:"
03-04-2020T02:13:01,SageSaga,XD - i dont know the make up of the political parties there
03-04-2020T02:13:21,SageSaga,why? they do it so cheap and effectively!
03-04-2020T02:13:50,Dadrobit,"Sorry, not governor, Representative."
03-04-2020T02:14:00,AspiringNoodle,"Sage, do I really need to spell it out? lol"
03-04-2020T02:14:07,SageSaga,yes
03-04-2020T02:14:09,Dadrobit,Jim Jordan (R) is the guy he's trying to unseat.
03-04-2020T02:15:00,AspiringNoodle,*gears turning*
03-04-2020T02:15:04,AspiringNoodle,"Sage, are you trolling me? xD"
03-04-2020T02:15:42,SageSaga,nope- we are not setup for manufacturing and creating it all would take a ton of money and time and tech for making it green
03-04-2020T02:15:56,SageSaga,and that means it would produce expensive things
03-04-2020T02:16:08,AspiringNoodle,Well then!  I point to the current pandemic as to why letting China make the majority of our medical products was a bad decision
03-04-2020T02:16:22,Dadrobit,"Yeah, manufacturing is not coming back to  America en mass anytime in the even remotely close future."
03-04-2020T02:16:36,SageSaga,then i will point out that that doesnt have anything to do with the pandemic
03-04-2020T02:17:06,SageSaga,if 3D printing tech continues to grow i can see manufacturing moving more
03-04-2020T02:17:43,AspiringNoodle,"I wnat to get into this conversation, but it's late"
03-04-2020T02:17:55,AspiringNoodle,And it would take way too long to get my point across
03-04-2020T02:17:58,Dadrobit,"Eh, even still, the nature of it means that it can be employed most anywhere I think so long as the initial investment is reasonable."
03-04-2020T02:18:09,SageSaga,you can probably sum it up
03-04-2020T02:18:26,Dadrobit,America isn't gonna have a monopoly in it is what I'm meaning in that sense.
03-04-2020T02:18:28,AspiringNoodle,"So I'll sum it up as such, China's government is EXTREMELY authoritarian.  They actively suppress information from their own citizens, and try to suppress information from other countries"
03-04-2020T02:18:55,AspiringNoodle,"In addition, they've started flexing access to their market as a way for foreign companies to play ball with their way of doing things"
03-04-2020T02:19:33,AspiringNoodle,"Essentially, using the global market to subtly spread their influence.  Remember the hearthstone controversy?"
03-04-2020T02:20:37,SageSaga,and NBA stuff yeah
03-04-2020T02:20:45,AspiringNoodle,Basically that
03-04-2020T02:20:55,AspiringNoodle,"So, I must pose the question"
03-04-2020T02:20:57,Dadrobit,And... Ya know.... Tienanmen Square....
03-04-2020T02:21:05,SageSaga,however the production of materials using the world market has massive benefits for the world
03-04-2020T02:21:27,AspiringNoodle,"yes, but counterpoint"
03-04-2020T02:21:29,SageSaga,we can use other countries to enrich ourselves- while also playing the political games
03-04-2020T02:21:45,AspiringNoodle,Think about those controversies
03-04-2020T02:22:11,AspiringNoodle,"Where China didn't like what certain people said, and threatened to outright ban certain businesses from their market?"
03-04-2020T02:22:24,SageSaga,yeah and we threatened them back
03-04-2020T02:22:47,AspiringNoodle,Imagine if they gained a monopoly on the production of certain goods?
03-04-2020T02:22:59,AspiringNoodle,"And then suddenly decided, ""We don't like you, we won't sell you this stuff."""
03-04-2020T02:23:26,SageSaga,"then the UN would say ""then you lose our business too because we have trade agreements"""
03-04-2020T02:24:02,AspiringNoodle,Never forget that was is ALWAYS a possibility
03-04-2020T02:24:02,SageSaga,there are balances in place- when someone throws their weight around we use allies to throw it back
03-04-2020T02:24:09,AspiringNoodle,war*
03-04-2020T02:24:27,SageSaga,war is far less profitable now
03-04-2020T02:24:53,AspiringNoodle,"True, but war is generally the result of irreconcilable differences in ideology"
03-04-2020T02:25:14,AspiringNoodle,That or profit.  Humans tend to like either.
03-04-2020T02:25:18,SageSaga,what we should do is strengthen our over seas alliances rather than trying to be self sufficient and isolated
03-04-2020T02:25:37,AspiringNoodle,"Tbh, why not both?"
03-04-2020T02:25:47,AspiringNoodle,Why not bolster them while also being capable of competing?
03-04-2020T02:26:01,SageSaga,because isolationist brews supremacy
03-04-2020T02:26:08,AspiringNoodle,Not the isolationist stuff
03-04-2020T02:26:27,SageSaga,what do you mean by both?
03-04-2020T02:26:45,SageSaga,because self sufficiency creates isolationism
03-04-2020T02:27:02,SageSaga,"you start saying ""Well if you arent going to give us what we want we will make it ourselves"""
03-04-2020T02:27:09,SageSaga,and you isolate yourself
03-04-2020T02:27:18,SageSaga,its 2 sides of the same coin
03-04-2020T02:27:40,AspiringNoodle,"But at the same time, if everyone relies on one source of something, it becomes prone to disruption"
03-04-2020T02:27:54,SageSaga,yeah but we dont
03-04-2020T02:28:13,SageSaga,"we do some manufacturing here- Mexico does a lot, Taiwan, Korea"
03-04-2020T02:28:13,AspiringNoodle,We more or less rely on china for our medicines
03-04-2020T02:28:17,Dadrobit,Isolatinoism is another form of relying on one source.
03-04-2020T02:29:00,SageSaga,we get a lot of medicine from China but because they are cheaper- other places can and do make medicine too
03-04-2020T02:29:37,SageSaga,heck the us has medicine manufacturing and they could expand for emergencies but the cost is an issue in a place that has some of the worse healthcare in the modern world
03-04-2020T02:30:18,Dadrobit,"S'why the tariffs with China hurt us more than China. They just said, ""Oh, you're trying to disrupt this source of food? Okay, we'll just pay slightly more to get it elsewhere."""
03-04-2020T02:31:03,Dadrobit,Suddenly American farmers lost their biggest client completely.
03-04-2020T02:31:35,SageSaga,"oh and also - if China said ""US doesnt get medicine anymore"" canada might be like ""Eh- thats a 50 billion dollar deal right there- eh? Lets start making meds for our friends down south eh?"""
03-04-2020T02:32:17,Dadrobit,"In a worldwide market, monopolies only last as long as it takes for greed to undercut itself."
03-04-2020T02:32:32,Dadrobit,Greed and shitty decisions
03-04-2020T02:33:02,AspiringNoodle,"That said, even if these new deals pop up, they would take time to get moving"
03-04-2020T02:33:43,AspiringNoodle,"Also, I will agree that the tariff war with china was stupid :/"
03-04-2020T02:33:45,SageSaga,"US to Canada - ""We cant pay you more-"" Canada - ""Oh that ok! Just pay the same in shipping even though its cheaper!"""
03-04-2020T02:34:41,SageSaga,i hope you all read that in a terrible canadian accent btw
03-04-2020T02:35:21,AspiringNoodle,"""Sounds like a great deal, eh?"""
03-04-2020T02:35:26,Dadrobit,French Canadian. The most terrible of Canadian accents.
03-04-2020T02:35:51,AspiringNoodle,"Oh god, just had flashbacks to my first trip to canada xD"
03-04-2020T02:35:59,SageSaga,"it would be more likely Mexico would produce em though- then ""Eh man, now you want are drugs, eh?"""
03-04-2020T02:36:06,SageSaga,our* not are
03-04-2020T02:36:21,AspiringNoodle,"First sentence from the first Canadian I ever interacted with, question ended with "", eh?"""
03-04-2020T02:37:01,ZRO4825,"Depends which mexican you talk to, it very well might be are instead of our. :P"
03-04-2020T02:37:17,SageSaga,i have a Canadian friend and whenever he says Eh i giggle
03-04-2020T02:37:56,AspiringNoodle,Hmmm.... I worry about China's citizens in all honesty...
03-04-2020T02:38:10,SageSaga,yeah that stuff is messed up
03-04-2020T02:38:17,AspiringNoodle,"Politics, yes, but also their economic situation"
03-04-2020T02:38:32,SageSaga,and something should be done- but that something shouldnt hurt my supply of GPUs and CPUs
03-04-2020T02:38:33,Dadrobit,The Chinese who live in lockstep with the government will be fine.
03-04-2020T02:38:49,Dadrobit,Everyone else? Notsomuch
03-04-2020T02:38:53,AspiringNoodle,"Recent story (past 1 - 2 years), people in China with STEM degrees not getting jobs because without the government assistance on housing, they couldn't afford where they live"
03-04-2020T02:39:21,AspiringNoodle,"part of how things from China are so cheap,  their people are paid just so"
03-04-2020T02:39:54,SageSaga,actually a lot of their jobs in manufacturing have been automated
03-04-2020T02:39:55,AspiringNoodle,Which is ironic since China can assemble teams of STEM professionals in amounts of time unheard of everywhere else in the world
03-04-2020T02:40:44,DarthRexKing,Going to sleep now. o3o
03-04-2020T02:40:58,AspiringNoodle,"Awww, but we're having such a fun talk about politics!"
03-04-2020T02:41:23,SageSaga,gnight Dath
03-04-2020T02:41:25,SageSaga,Darth*
03-04-2020T02:41:31,Dadrobit,This recent pandemic is helping automation accelerate in general as well. Manufacturers realizing that humans getting sick en mass is bad for production. Machines are far less susceptible to Covid.
03-04-2020T02:41:39,Dadrobit,o/ Darth
03-04-2020T02:41:54,SageSaga,far less is an understatement XD
03-04-2020T02:42:05,AspiringNoodle,"Arguably, mass automation means that manufacturing could pop everywhere"
03-04-2020T02:42:29,AspiringNoodle,Just need the initial investment and then you start making bank
03-04-2020T02:43:11,Dadrobit,"Depends, you need to lease the rights to whatever you're manufacturing."
03-04-2020T02:43:24,SageSaga,"""alright- your resume looks good- but how susceptible are you to illness?"" ""Being a robot- I am one hundred percent immune to any biological virus"" ""Good- the last guy was very susceptible"""
03-04-2020T02:43:36,DarthRexKing,\o
03-04-2020T02:44:00,DarthRexKing,I'll hear more poli-DICKS later! X'D
03-04-2020T02:44:01,DarthRexKing,XP
03-04-2020T02:44:05,AspiringNoodle,True.  But it could also potentially reduce greenhouse emissions by reducing the shipping needed
03-04-2020T02:44:08,Dadrobit,"""I also work for pennies on the hour, work 24 hours of the day, and don't ask for time off."""
03-04-2020T02:44:40,AspiringNoodle,"""And I am approximately 100x more productive than the last guy."""
03-04-2020T02:44:53,SageSaga,"""Could you do my job?"" ""Yes"" ""you answered that very quickly."" ""YES"" ""o_o"""
03-04-2020T02:45:08,AspiringNoodle,"""W-"" ""Yes."""
03-04-2020T02:45:15,AspiringNoodle,"""..."" ""Yes."""
03-04-2020T02:45:44,Dadrobit,"""The crew is expendable"""
03-04-2020T02:45:44,SageSaga,"""I shall now predict and answer your next 3 questions and answer them - No, yes and doing your wife"
03-04-2020T02:45:45,AspiringNoodle,"""Well I guess S-"" ""AHAHAHAHAHA."""
03-04-2020T02:46:07,Dadrobit,10 points to whoever gets the ref
03-04-2020T02:48:06,Dadrobit,"Damn, ain't none of ya Alien fans?"
03-04-2020T02:48:29,Dadrobit,RIP
03-04-2020T02:48:33,SageSaga,i am- ive just heard that in a lot of things and havent seen alien in like 8 years
03-04-2020T02:48:53,ZRO4825,I think I saw it once many many MANY years ago. :x
03-04-2020T02:49:00,SageSaga,ive heard that line used in anime too
03-04-2020T02:49:12,AspiringNoodle,"Dadro, I've watched so many anime I can't even remember all their names, lol"
03-04-2020T02:49:17,AspiringNoodle,Same goes for movies
03-04-2020T02:49:20,AspiringNoodle,And video games
03-04-2020T02:49:25,AspiringNoodle,And cartoons...
03-04-2020T02:49:41,SageSaga,i dont think that was all that memorable of a line really
03-04-2020T02:49:49,Dadrobit,Ya. It's the moment Ripley accesses Mother's database and finds the directive ordering Ashe to bring the organism back alive above all else.
03-04-2020T02:50:00,DarthRexKing,I got the reference. >W> Anyway ni ni.
03-04-2020T02:50:01,SageSaga,"its no- ""Get away from her you -female dog-!"""
03-04-2020T02:50:07,DarthRexKing,XD
03-04-2020T02:50:08,Dadrobit,"It's like, the moment of true horror in the film."
03-04-2020T02:50:20,Dadrobit,That's Aliens though.
03-04-2020T02:50:33,SageSaga,i know
03-04-2020T02:50:42,SageSaga,do you not like the series?
03-04-2020T02:50:54,SageSaga,i mean Alien was my favorite but 2 was great as well
03-04-2020T02:51:08,Dadrobit,Me? I love em. Saw em in theaters two years ago. Great experience.
03-04-2020T02:51:32,SageSaga,i never got to see them in theaters- but i own em
03-04-2020T02:51:41,Dadrobit,2001: A Space Odyssey is still my #1 though.
03-04-2020T02:51:55,Dadrobit,But Alien and Aliens is up there
03-04-2020T02:53:42,Dadrobit,Same theater that did/does the showings of animes that I mentioned earlier has a thing called Tuesday Night Classics. Older classics get shown for $7 every Tuesday.
03-04-2020T02:53:57,Dadrobit,Like Die Hard on Christmas Eve.
03-04-2020T02:54:08,Dadrobit,(Or whatever Tuesday is closest)
03-04-2020T02:54:34,SageSaga,i liked 2001 but- its not something i want to go back and watch- i do remember so much of it though
03-04-2020T02:56:34,Dadrobit,They had a showing in 2018 I got to see. They brought the original negatives from the filming out from storage and made new 70mm reels for the 50 year anniversary. It was so good.
03-04-2020T02:56:37,SageSaga,i did go to some shows at a theater that was doing stuff like that
03-04-2020T02:56:50,AspiringNoodle,Goin' to bed now
03-04-2020T02:56:54,Dadrobit,o/ Noodle
03-04-2020T02:56:56,SageSaga,"watched Back to the Future, Raiders of the Lost Ark-"
03-04-2020T02:56:58,AspiringNoodle,"Really enjoyed the chat, Dadro and Sage ;)"
03-04-2020T02:57:07,SageSaga,take care! sleep well!
03-04-2020T02:57:10,Dadrobit,"Yeah, exactly those fils"
03-04-2020T02:57:13,Dadrobit,films*
03-04-2020T02:57:36,AspiringNoodle,I must bolster my arguments for next time!
03-04-2020T02:58:08,AspiringNoodle,"Maybe if I sleep using an economics book as a pillow, I'll absorb the knowledge through osmosis :ptv-laugh:"
03-04-2020T02:58:08,SageSaga,good luck but you'll never win me over with isolationism XD
03-04-2020T02:58:14,Dadrobit,Unfortunately everything is closed down. They're not even bothering to advertise on the website anything for the foreseeable future.
03-04-2020T02:58:21,AspiringNoodle,"Also, eff isolationism"
03-04-2020T02:58:29,Dadrobit,Ooooorrrrr you'll just end up with a neck cramp?
03-04-2020T02:58:43,AspiringNoodle,"I want legitimate competition, but the ability to be self-sufficient in extreme circumstances"
03-04-2020T02:59:13,SageSaga,it almost always leads to isolationism if you do that
03-04-2020T02:59:49,SageSaga,but i do think as 3D printing tech gets better manufacturing is going to be kinda - a thing done in house XD
03-04-2020T03:00:06,AspiringNoodle,Pro-tip
03-04-2020T03:00:17,AspiringNoodle,Become the guy who makes the tools used to make other tools
03-04-2020T03:00:29,AspiringNoodle,Can't be replaced if you're the guy who makes machines that makes the machines ;P
03-04-2020T03:00:35,AspiringNoodle,:ptv-sleepy:
03-04-2020T03:00:58,SageSaga,a free internet is going to make all the difference there
03-04-2020T03:01:36,SageSaga,freely being able to share new improvements to 3D printing tech and new modifications is going to make the tech grow faster than an isolated network of people
03-04-2020T03:03:40,SageSaga,the last movie i watched was- the Tom Hanks movie about Mr Rodgers- a Beautiful day in the neigborhood
03-04-2020T03:05:21,Dadrobit,Obviously my last movie was Violet Evergarden from earlier today. Can't rightly recall what came before that though...
03-04-2020T03:06:37,MarvTheHugPharaoh,"Arachnophobia for me, still oddly fun."
03-04-2020T03:08:08,ZRO4825,I started to watch Detective Pikachu earlier.
03-04-2020T03:08:17,ZRO4825,That's about all the further I made it with that.
03-04-2020T03:08:33,ZRO4825,I think that's the most movie I've watched in the last year though. :joy:
03-04-2020T03:10:59,Dadrobit,I almost wanna say it was John Wick 3 was my last movie
03-04-2020T03:11:00,SageSaga,i think when im done here im gonna watch the Konosuba movie\
03-04-2020T03:11:34,Dadrobit,"But that was so long ago, there had to be something inbetween"
03-04-2020T03:11:50,MarvTheHugPharaoh,"Thanks for the streams Sage, nice work today"
03-04-2020T03:12:20,SageSaga,going to bed Marv?
03-04-2020T03:12:32,Dadrobit,Ohhhhhhh! Cats!
03-04-2020T03:12:49,Dadrobit,Phenomenal movie.
03-04-2020T03:13:00,SageSaga,wut
03-04-2020T03:13:18,MarvTheHugPharaoh,Already in bed.  I think I just mentally shut off there for a minute.  Thought you were done streaming.
03-04-2020T03:13:33,Dadrobit,I unironically quite liked it.
03-04-2020T03:13:34,SageSaga,nope- XD ive still got a few panels left
03-04-2020T03:14:42,Dadrobit,They did Rum Tum Tugger and Mr Mistoffelees dirty though
03-04-2020T03:15:26,Dadrobit,And Jennyanydots
03-04-2020T03:15:33,Dadrobit,didn't like her casting
03-04-2020T03:16:06,Dadrobit,"Rebel Wilson has one character for every movie, and she just doesn't fit there."
03-04-2020T03:16:53,SageSaga,hmm before Beautiful Day in the Neighborhood -- the last thing i watched was- Frozen 2
03-04-2020T03:18:02,Dadrobit,Huh. I remember a little hype for that movie. But it came and went with seemingly little affair?
03-04-2020T03:18:25,SageSaga,it was actually really good- but... The musical numbers were... weird
03-04-2020T03:18:43,Dadrobit,"I mean, it's kinda hard to live up to a song like ""Let It Go' getting played fucking everywhere for months on end. But I at least expected... something?"
03-04-2020T03:19:00,SageSaga,a lot of the music was great
03-04-2020T03:19:30,SageSaga,"but the visuals with it was- weird- and it was kinda like - for the most part not all ""Ok now its my turn to sing a song - everyone pay attention now!"""
03-04-2020T03:19:52,Dadrobit,"Ohhhhh, Aladdin remake had that syndrome in a bad way."
03-04-2020T03:20:20,SageSaga,i didnt see the remake- but the music in the original Aladdin seems to flow into it so naturally
03-04-2020T03:20:54,SageSaga,"it was like ""omg amazing magical or whimsical stuff is happening! Time for music!"""
03-04-2020T03:21:13,SageSaga,"but here its like ""STOP THE STORY! I must SING!"""
03-04-2020T03:21:35,Dadrobit,"It did well in some parts. Prince Ali entering the city was great. But then they went and gave Jasmine a song that literally jut stopped time and was like ""I'm gonna do a musical number now by myself!"""
