date,user,comment
03-04-2020T17:55:31,SageSaga,let me see if i can show any of the other ones though-
03-04-2020T17:55:50,Ordithus,"don't take too much time, I know you're working"
03-04-2020T17:58:01,SageSaga,here's one
03-04-2020T17:58:11,JojoF2415,I’ve been getting pretty good runs on deadlocked
03-04-2020T17:58:25,Ordithus,there's a story behind that one
03-04-2020T17:58:55,SageSaga,this is for a guy who is a writer- has a ton of books
03-04-2020T17:59:03,SageSaga,hes an amazing person
03-04-2020T17:59:06,sunblaze,thats a cool cover yeah
03-04-2020T17:59:18,SageSaga,he was the one that sent me all the money to buy the books for AI book 1
03-04-2020T17:59:30,Ordithus,woah
03-04-2020T17:59:39,SageSaga,when the kickstarter failed he sent me 4k
03-04-2020T17:59:46,sunblaze,:ptv-ohmy:
03-04-2020T18:00:12,SageSaga,and hes been commissioning me pretty much every month since- hes been a life saver
03-04-2020T18:00:42,SageSaga,i wont post any of his stuff though
03-04-2020T18:01:03,SageSaga,i think some of it is on his Patreon and stuff- and might be used in or on his books at some point
03-04-2020T18:02:42,Ordithus,:ctwokinds-adiracoin: business partners
03-04-2020T18:03:40,SageSaga,https://www.paypal.me/sage25 :P
03-04-2020T18:03:53,sunblaze,^so many missed donations :D
03-04-2020T18:04:21,SageSaga,i need to link that on my website
03-04-2020T18:04:40,Ordithus,:csagesaga-c4: how much to fully fund buttstream
03-04-2020T18:04:41,SageSaga,I think I'll ask Mihari to do that today
03-04-2020T18:05:24,SageSaga,i think I said 200 dollars for butt stream? XD - it wouldnt be long and it would mostly be kaylin and Nyna butts
03-04-2020T18:05:42,sunblaze,hmmm tempting
03-04-2020T18:06:03,SageSaga,it would be more fun to do with Maty though
03-04-2020T18:06:03,Grip,Would love Blue's and Nami's.
03-04-2020T18:06:35,SageSaga,well Nami's is on the Daki XD
03-04-2020T18:06:46,Grip,Ah! How about Blue?
03-04-2020T18:06:55,Ordithus,so are Nyna's and Kaylin's
03-04-2020T18:06:58,SageSaga,i could probably draw Blue's
03-04-2020T18:07:05,sunblaze,hugs kaylin daki :ptv-excited:
03-04-2020T18:07:23,Grip,Kitty butt is good butt.
03-04-2020T18:07:25,SageSaga,Nyna and Kaylin are just more adult/mature oriented characters
03-04-2020T18:07:44,Ordithus,"Yeah, but Blue is the biggest perv"
03-04-2020T18:07:56,sunblaze,indeed beefy elven abbs and kittybutts :D
03-04-2020T18:08:02,Ordithus,Call it fair play
03-04-2020T18:09:40,SageSaga,blue has her reasons for being a perv
03-04-2020T18:09:51,sunblaze,she needed reasons?
03-04-2020T18:10:32,SageSaga,"she's extremely open as a person from her history of being confined, its her way of showing the world she exists, and so shes just honest about her feelings and passions"
03-04-2020T18:11:00,sunblaze,interesting cool
03-04-2020T18:11:47,SageSaga,so she doesnt hide the fact that she wants to grope titties and smack butts
03-04-2020T18:12:09,Ordithus,she's just affectionate is all
03-04-2020T18:12:55,Grip,"Mhm, would love her own groped and smacked I bet, and her tail played with."
03-04-2020T18:13:21,Grip,Getting her ears nibbled on I bet would turn her to mush.
03-04-2020T18:14:09,SageSaga,of course- shes a bit of a nympho XD - but shes not into doing things that are unwanted. She teases Kate because she knows kate likes it but tries to never take it too far
03-04-2020T18:14:44,SageSaga,its why occasionally blue and Kate will go in sync with each other
03-04-2020T18:14:44,Grip,"Right, just enough to be playful."
03-04-2020T18:15:26,SageSaga,Kate's even admitted to being bi
03-04-2020T18:16:57,SageSaga,actually she did that pretty recently didnt she?
03-04-2020T18:17:14,Ordithus,within the past year or so I think
03-04-2020T18:17:22,Grip,"Can have some fun with Phil and Blue at the same time, if she does want to do that."
03-04-2020T18:17:53,SageSaga,but she also knows Blue's history so shes exceedingly forgiving with her and sometimes very strict with her
03-04-2020T18:18:25,SageSaga,hmmm- not so much Grip XD
03-04-2020T18:19:21,Ordithus,They've got their Phil and Nami
03-04-2020T18:19:53,Grip,Right.
03-04-2020T18:20:41,SageSaga,if yosh were a porn i wouldnt have a problem with them being poly- but it's not- so they arent XD
03-04-2020T18:21:21,Grip,"Yep, is fun when Blue plays with Kate and possibly Nami when she gets her tail and ears on."
03-04-2020T18:22:06,SageSaga,comic is done!
03-04-2020T18:22:19,MarvTheHugPharaoh,Very well done Sage \o/
03-04-2020T18:22:20,Ordithus,Nice work!
03-04-2020T18:22:23,Grip,Sweet
03-04-2020T18:22:26,SageSaga,ty- ty all
03-04-2020T18:22:38,FoxxTrotter,:0)
03-04-2020T18:22:52,sunblaze,nice take care
03-04-2020T18:23:30,SageSaga,also- ty for those who sent donations- i really appreciate it!
03-04-2020T18:25:03,SageSaga,have a great day folks!
03-04-2020T18:25:09,Ordithus,Bye!
03-04-2020T18:25:18,FoxxTrotter,"C-ya, Sage. Thanks for the stream."
03-04-2020T18:25:18,MarvTheHugPharaoh,Thanks for the stream Sage o/
03-04-2020T18:31:31,sunblaze,bye
03-04-2020T18:46:43,RimaDraws,sage needs donations??
03-04-2020T18:47:00,RimaDraws,i'm sorry i kept dozing off but if you need some i will try
03-04-2020T19:20:59,JojoF2415,GG Deadlocked 100% 3 coins
03-04-2020T19:23:05,JojoF2415,9 months with 10 days worth of practice
03-04-2020T19:24:35,JojoF2415,5088 attempts lots of 70+ fails. Probably over 25 fails
03-04-2020T19:30:07,JojoF2415,Im so glad it’s over
03-04-2020T19:35:31,JojoF2415,:ptv-victory:
03-04-2020T19:46:29,CrRAR,nice
03-04-2020T19:49:52,RimaDraws,hi CrRAR
03-04-2020T20:22:14,SpazztasticKiwi,I’m free
03-04-2020T20:22:18,SpazztasticKiwi,and hungry
03-04-2020T20:34:04,Ordithus,then eat
03-04-2020T20:37:42,SpazztasticKiwi,well now that you said so I wont
03-04-2020T20:38:43,Ordithus,:ctwokinds-RaineEep: don't put that on me
03-04-2020T20:39:35,SpazztasticKiwi,I will and there’s nothing you can do about it
03-04-2020T20:39:48,SpazztasticKiwi,there was a tiny grey kitten at mcdonalds
03-04-2020T20:40:07,Ordithus,cutest fry cook
03-04-2020T20:49:13,SpazztasticKiwi,didn’t want anything to do with me
03-04-2020T20:54:22,SpazztasticKiwi,Bagheera has been a bad bad boi
03-04-2020T21:00:12,Ordithus,wut he do
03-04-2020T21:02:26,SpazztasticKiwi,he’s harassing the other cats
03-04-2020T21:46:30,SpazztasticKiwi,I can’t believe mark has a 5.48 of 5 on wikifeet & Ethan needs bondage restraints to stop touching his face
03-04-2020T21:54:16,BlackjackSec99,...wut?
03-04-2020T22:12:18,AspiringNoodle,"Welp, I might be handing in my 2 weeks soon"
03-04-2020T22:12:29,AspiringNoodle,Today was absolute [censored] :upside_down:
03-04-2020T22:26:11,JojoF2415,Finally i finished making a video
03-04-2020T22:29:38,JojoF2415,Had to make a watermark because videos of beating deadlocked has cases of little kids stealing it
03-04-2020T22:31:00,SpazztasticKiwi,unus annus is a wild beast
03-04-2020T22:31:30,SpazztasticKiwi,"but hey, how was that 40 minutes of sleep yesterday"
03-04-2020T22:41:23,AspiringNoodle,[*angry hiss*]*:snake:
03-04-2020T22:43:49,AspiringNoodle,:owl:*[Do you see the cosmos?]
03-04-2020T22:43:57,AspiringNoodle,"oh no, that was meant to be private"
03-04-2020T22:44:09,AspiringNoodle,I'll never be sneaky noodle now :ptv-whiny:
03-04-2020T22:46:42,SonOfGoku,Are you out of smoke bombs?
03-04-2020T23:04:32,AspiringNoodle,beetchb0i
03-04-2020T23:04:37,AspiringNoodle,:ptv-shock:
03-04-2020T23:04:42,AspiringNoodle,SMOKE BOMB!
03-04-2020T23:05:00,AspiringNoodle,:dash:
03-04-2020T23:05:29,BlackjackSec99,OH! Unus annus!  lol I havent been keeping up
03-04-2020T23:08:08,SpazztasticKiwi,yep
03-04-2020T23:08:18,SpazztasticKiwi,new brand of chaos each day
03-04-2020T23:09:36,SpazztasticKiwi,the amount of clotheless or bare minimum covered days make me wonder if they’re allergic to clothes
03-04-2020T23:09:55,SpazztasticKiwi,I’ve seen more of them than I care to of anyone I’m not interested in
03-04-2020T23:12:18,JojoF2415,How many smoke bombs do u have noodle
03-04-2020T23:12:42,SonOfGoku,"According to him, he has a factory"
03-04-2020T23:12:47,AspiringNoodle,@w@
03-04-2020T23:13:32,JojoF2415,Oh my
03-04-2020T23:23:21,JojoF2415,It feels good beating a demon in geometry dash
03-04-2020T23:24:13,JojoF2415,You just feel a big relief but your heart is pounding
03-04-2020T23:26:23,BlackjackSec99,"Spazz, its a possibility... I would too if I knew that my shirtlessness wouldnt make the general populous think Cthulu has descended upon them..."
03-04-2020T23:27:35,tobygranger,hey jojo what are you uploading your video to
03-04-2020T23:30:21,JojoF2415,YouTube
03-04-2020T23:31:52,tobygranger,what's your channel
03-04-2020T23:33:23,SpazztasticKiwi,aw now it can’t be that bad
03-04-2020T23:33:52,SpazztasticKiwi,surely you dont have tentacles coming out of your sides
03-04-2020T23:35:00,SpazztasticKiwi,"besides, everyones inside walking laps around the coffee table to stave off cabin fever anyway so there’s some I’m sure happy just to see another human"
03-04-2020T23:35:15,SpazztasticKiwi,besides us “”essential”” people
03-04-2020T23:36:10,AspiringNoodle,Latest pet peeve from work
03-04-2020T23:36:14,AspiringNoodle,"""I appreciate it"""
03-04-2020T23:36:37,AspiringNoodle,"Spazz, let's make a pact"
03-04-2020T23:36:51,AspiringNoodle,"See how long it takes after the pandemic ends for people to go back to belittling ""starter"" jobs"
03-04-2020T23:38:36,JojoF2415,I felt uncomfortable wearing a face mask
03-04-2020T23:38:51,JojoF2415,I could hardly breathe wearing one
03-04-2020T23:38:55,AspiringNoodle,That reminds me!
03-04-2020T23:39:08,AspiringNoodle,"Work doesn't have face masks yet, and no word on when, and if, we'll be getting any :D"
03-04-2020T23:39:33,SonOfGoku,That's how I feel when I use them for work
03-04-2020T23:40:41,AspiringNoodle,"As a person with glasses, masks make it nearly impossible for me to see unless they can direct my breathing away from the glass"
03-04-2020T23:46:21,JojoF2415,I wear glasses too
03-04-2020T23:46:38,JojoF2415,I just saw my total attempts
03-04-2020T23:47:04,JojoF2415,Just guess how many I have
03-04-2020T23:51:18,AspiringNoodle,69?
03-04-2020T23:56:37,JojoF2415,"119,597"
03-04-2020T23:59:53,JojoF2415,Speed racer isn’t that hard
