date,user,comment
07-06-2020T00:01:47,Demianartist,pleu
07-06-2020T00:03:05,SpazztasticKiwi,guy was giving $500 or something for child support
07-06-2020T00:03:18,Ordithus,:ctwokinds-RainezZz:
07-06-2020T00:03:24,SpazztasticKiwi,took him to court to try & get more
07-06-2020T00:03:49,SpazztasticKiwi,judge ruled he should be giving $250
07-06-2020T00:03:58,SpazztasticKiwi,so now that’s all he gives her
07-06-2020T00:04:22,Demianartist,vaya
07-06-2020T00:05:49,AspiringNoodle,Oof
07-06-2020T00:05:57,AspiringNoodle,"Let me guess, she had a decent job or something at that point?"
07-06-2020T00:07:19,SpazztasticKiwi,no clue
07-06-2020T00:07:32,SpazztasticKiwi,who knows if it’s even true or not either
07-06-2020T00:08:22,SpazztasticKiwi,it’s a possibility but there’s always stories to be had on the internet
07-06-2020T00:08:57,AspiringNoodle,Stories like this aren't that uncommon.  The family court system historically screws men
07-06-2020T00:09:25,AspiringNoodle,"I would need to find it, but iirc, there was a case where a guy was paying a ludicrous amount of money to his ex-wife per month"
07-06-2020T00:09:49,AspiringNoodle,But eventually got the payments cancelled because she was at a new job making a six figure salary
07-06-2020T00:10:19,SpazztasticKiwi,as fascinating as a tirade would be I’ll pass
07-06-2020T00:11:29,SpazztasticKiwi,anyone have the new galaxy
07-06-2020T00:11:53,BlackjackSec99,I was paying $642 a month for my kids when I had them 50% of the time. My ex took me to court to get more money and more custody of them. walked out with 50-50 and I dont have to pay her a dime.
07-06-2020T00:12:39,AspiringNoodle,Naisu
07-06-2020T00:12:46,BlackjackSec99,I have the note 10 + Spazz
07-06-2020T00:13:05,AspiringNoodle,I need to watch the LTT video.  Apparently there are some pretty big problems with the S20
07-06-2020T00:13:20,AspiringNoodle,"Enough for LTT to give a big fat ""DO NOT BUY"" recommendation"
07-06-2020T00:13:29,BlackjackSec99,like the S7 battery problems?
07-06-2020T00:13:48,AspiringNoodle,No idea
07-06-2020T00:14:03,SpazztasticKiwi,I was wondering cause what’s the thing on the back of the phone
07-06-2020T00:14:09,SpazztasticKiwi,besides the camera
07-06-2020T00:14:28,AspiringNoodle,"WHen it comes to engineered products like laptops and smart phones, there are 2 kinds of mistakes"
07-06-2020T00:14:39,BlackjackSec99,"on the note 10 theres 2 cameras, a range finder, a flashlight and something else"
07-06-2020T00:14:41,AspiringNoodle,"1) ""Are you effing stupid or something?"""
07-06-2020T00:14:53,SpazztasticKiwi,"looking at this “upgrade program” from at&t, it’s showing the new galaxy and the thing looks like an alien phone"
07-06-2020T00:15:00,AspiringNoodle,2) Unforeseen problems / oversights that should be handled gracefully
07-06-2020T00:15:11,BlackjackSec99,alien phone
07-06-2020T00:15:12,BlackjackSec99,?
07-06-2020T00:15:21,AspiringNoodle,"Apple tends to do both, lol, but fails the 2nd one miserably"
07-06-2020T00:15:30,SpazztasticKiwi,wrong phone to be showing me to upgrade to because I have the iphone upgrade plan but
07-06-2020T00:15:36,SpazztasticKiwi,that’s what it showed me
07-06-2020T00:15:39,AspiringNoodle,https://www.youtube.com/watch?v=K37gF3xqAs0
07-06-2020T00:15:49,SpazztasticKiwi,and the range finder does what
07-06-2020T00:15:49,AspiringNoodle,Please don't buy a Galaxy S20 Ultra.
07-06-2020T00:15:59,AspiringNoodle,Gonna watch this right now
07-06-2020T00:16:55,SpazztasticKiwi,it’s that little cube at the corner on the back that I was looking at
07-06-2020T00:17:21,SpazztasticKiwi,"it’s the flashlight, camera, camera, camera as something else from what I can tell"
07-06-2020T00:17:51,SpazztasticKiwi,why does it have 4 cameras
07-06-2020T00:18:11,SpazztasticKiwi,I’m used to the iphone round camera spots on phone backs
07-06-2020T00:18:49,SpazztasticKiwi,"but yea, trouble in paradise must be fun"
07-06-2020T00:19:18,SpazztasticKiwi,I got a cousin whose husband has I believe just one other kid with another lady - daughter
07-06-2020T00:19:47,SpazztasticKiwi,"she never had anything to do with him, never wanted or really let him if she could prevent it see her"
07-06-2020T00:20:24,SpazztasticKiwi,"all because he’d gotten married to my cousin and moved on, starting a family with my said cousin"
07-06-2020T00:20:50,AspiringNoodle,I would love to know of any stories out there where the opposite is true
07-06-2020T00:21:02,AspiringNoodle,"But I find that when it comes to divorce proceedings, time with the kids, payments, etc"
07-06-2020T00:21:12,AspiringNoodle,The wife tends to be the greedy / spiteful one
07-06-2020T00:21:35,AspiringNoodle,More often than not because the court is positioned to automatically support the lady
07-06-2020T00:21:42,SpazztasticKiwi,"and now just a small while back, she went to court to try getting child support from him - court ruled that her current boyfriend/husband counted as a guardian and legally, the kid had two legal parents & didn’t need his child support"
07-06-2020T00:21:54,AspiringNoodle,OH SNAP
07-06-2020T00:22:01,SpazztasticKiwi,"from what I know, she’s still trying"
07-06-2020T00:22:19,AspiringNoodle,"And in turn, confirming my perceived stereotype yet again"
07-06-2020T00:22:21,SpazztasticKiwi,there are stories that have the opposite
07-06-2020T00:22:30,AspiringNoodle,Links plz :D
07-06-2020T00:22:34,SpazztasticKiwi,why
07-06-2020T00:22:39,SpazztasticKiwi,so you can ignore them
07-06-2020T00:22:53,AspiringNoodle,Because I want to read them and not live in a world where it's only the women screwing the men in family court
07-06-2020T00:23:07,AspiringNoodle,Would LOVE to know about the other side
07-06-2020T00:23:17,SpazztasticKiwi,because I have a feeling you will based on “confirming my perceived stereotype”
07-06-2020T00:23:38,AspiringNoodle,"Wait, you said stories about the men screwing the women in family court, yeh?"
07-06-2020T00:23:41,SpazztasticKiwi,I’m sure you could find some yourself if you did a google search
07-06-2020T00:23:49,SpazztasticKiwi,not at all
07-06-2020T00:23:56,AspiringNoodle,Awww
07-06-2020T00:24:24,SpazztasticKiwi,reread chat if you want to see what I said because none of that was a part of my messages
07-06-2020T00:24:35,SpazztasticKiwi,it may be what you understood but I didn’t say it
07-06-2020T00:24:47,SpazztasticKiwi,it goes both ways is the problem
07-06-2020T00:25:05,SpazztasticKiwi,you can hear more from one half than the other based on where you live
07-06-2020T00:25:46,AspiringNoodle,It's nice to know that the courts can work like they're intended to :ptv-hearts:
07-06-2020T00:26:03,SpazztasticKiwi,"while my cousin is an example of one, she lives away from me, where you can hear of the opposite happening"
07-06-2020T00:26:15,AspiringNoodle,"Men screwing over the women, yeh?"
07-06-2020T00:26:41,SpazztasticKiwi,I’d say being irresponsible
07-06-2020T00:26:53,SpazztasticKiwi,"but in a sense, screwing them over too"
07-06-2020T00:27:22,SpazztasticKiwi,good handful of they’re all about being with her until that night the condom broke
07-06-2020T00:27:29,SpazztasticKiwi,suddenly he didn’t know her
07-06-2020T00:27:51,SpazztasticKiwi,"wanted a relationship, not a kid so he packs up and 💨"
07-06-2020T00:28:24,SpazztasticKiwi,"though I will say, no that’s not court failure"
07-06-2020T00:29:58,SpazztasticKiwi,"either way, the kid ain’t the problem - if you can only stand the person until one happens, you weren’t a good match"
07-06-2020T00:30:26,AspiringNoodle,"Reading this article, it's just, oof"
07-06-2020T00:30:36,SpazztasticKiwi,adding a kid can make someone a different person
07-06-2020T00:31:46,AspiringNoodle,Indeed
07-06-2020T00:32:03,AspiringNoodle,My one coworker had to deal with someone like that
07-06-2020T00:32:18,AspiringNoodle,She was in a relationship with a dude who turned out to be a total dickbag
07-06-2020T00:32:34,AspiringNoodle,"convinced her to make some poor choices, was in the military, ended up having a kid with her"
07-06-2020T00:32:44,AspiringNoodle,But dude went AWOL and just ghosted
07-06-2020T00:32:55,SpazztasticKiwi,see
07-06-2020T00:33:05,SpazztasticKiwi,it’s not just the wome
07-06-2020T00:33:10,AspiringNoodle,"At least she gets the last laugh, they caught his ass :upside_down:"
07-06-2020T00:33:46,SpazztasticKiwi,it’s just never good to generalize
07-06-2020T00:34:14,SpazztasticKiwi,especially custody and split couples and kids and child support
07-06-2020T00:35:39,SpazztasticKiwi,I’ve seen more men skip out than petty women but I still know it’s there just as bad
07-06-2020T00:37:46,SpazztasticKiwi,important to always listen to the whole situation story by story - people have tried to sway my opinions in the past before I started deciding for myself
07-06-2020T00:39:57,SpazztasticKiwi,& yeah I mean I sent a hi on messenger awhile back - may be a request too but it doesn’t show anymore to me so 🤷🏻‍♀️
07-06-2020T00:40:32,SpazztasticKiwi,"I’m on here alot but since my discord crashed to a halt, I don’t use it for friends as much as fb anymore"
07-06-2020T00:40:53,SpazztasticKiwi,and memes - discord is for my memes
07-06-2020T00:42:01,BlackjackSec99,"wait, did you send ME a message on fb?"
07-06-2020T00:44:55,SpazztasticKiwi,....did you not see me say that earlier
07-06-2020T00:45:05,BlackjackSec99,i didnt... lol
07-06-2020T00:45:23,SpazztasticKiwi,"oh yeah back on the phone, all the things on the back are the cameras & flashlight"
07-06-2020T00:45:33,Demianartist,i really dosent know what you mean guys
07-06-2020T00:45:57,SpazztasticKiwi,the weird looking thing was the telephoto camera
07-06-2020T00:46:09,BlackjackSec99,"send me a message again on fb if you can, cause I think i got one from someone who I had no clue who it was and thought it might have been spam"
07-06-2020T00:46:25,SpazztasticKiwi,I said who I was
07-06-2020T00:46:30,SpazztasticKiwi,Kiwi
07-06-2020T00:46:50,SpazztasticKiwi,but what’s a telephoto camera
07-06-2020T00:47:00,SpazztasticKiwi,or rather I might google that
07-06-2020T00:47:07,BlackjackSec99,telephoto is fancy for zoom
07-06-2020T00:47:47,BlackjackSec99,"instead of digitally zooming, it uses lenses and whatnot to optically zoom in. you get a better resolution that way"
07-06-2020T00:48:12,BlackjackSec99,you sent the message to a M.Z. ?
07-06-2020T00:49:46,Demianartist,bueno bueno bueno
07-06-2020T00:50:51,BlackjackSec99,whats good?
07-06-2020T00:52:04,Demianartist,que ya termine un diseño más de Hanki.
07-06-2020T00:52:43,BlackjackSec99,"ok, I know what Que and mas is"
07-06-2020T00:52:51,BlackjackSec99,but im lost on the rest
07-06-2020T00:53:04,SpazztasticKiwi,“so what’s this do”
07-06-2020T00:53:14,SpazztasticKiwi,“fancy zoomies”
07-06-2020T00:53:31,Demianartist,o Claudio mean i finished a other design of my character Hanki.
07-06-2020T00:54:05,SpazztasticKiwi,"while one or two of us can read Spanish, most here cannot"
07-06-2020T00:54:15,SpazztasticKiwi,best to stick to English
07-06-2020T00:54:37,Demianartist,what you mean?
07-06-2020T00:54:37,BlackjackSec99,"I know a few terms that are common to hardware store ""I broke this and need to fix it"" but thats about it...."
07-06-2020T00:55:07,SpazztasticKiwi,I can understand conversation enough to know what’s being said
07-06-2020T00:55:24,Demianartist,oh okey
07-06-2020T00:55:33,SpazztasticKiwi,favorite day was a Spanish family came up to the food counter and was talking to each other
07-06-2020T00:56:01,SpazztasticKiwi,was fine - I was scooping out what they’d ordered not paying attention until one of them said I was pretty to the other
07-06-2020T00:56:06,SpazztasticKiwi,"that, I caught"
07-06-2020T00:56:34,BlackjackSec99,"lol my mom has a similar story, but a little more rare."
07-06-2020T00:56:51,Demianartist,i am Peruvian
07-06-2020T00:57:39,BlackjackSec99,"Two ladies were talking in line in front of her in finnish. conversation lasted for like 5 or 6 minutes and then mom interjected, in finnish, and they suddenly looked horrified. like ""what have we been talking about?!?!?"""
07-06-2020T00:59:58,Demianartist,jajajaja
07-06-2020T01:03:15,AspiringNoodle,"Well, I think Ima go to bed an hour early tonight"
07-06-2020T01:03:36,AspiringNoodle,"Good day so far.  Watched strem, cut into my youtube backlog a bit, finally unsubbed from a channel"
07-06-2020T01:03:50,BlackjackSec99,night noodle
07-06-2020T01:03:52,AspiringNoodle,"And maybe I finally quit Apex for good, we'll see :ptv-laugh:"
07-06-2020T01:06:42,AspiringNoodle,"Also, I grow closer to shaving my head, we'll see if I finally snap on that front!"
07-06-2020T01:06:51,AspiringNoodle,:ptv-sleepy:
07-06-2020T01:08:45,BlackjackSec99,"I did, I regret it"
07-06-2020T01:08:56,BlackjackSec99,used to have hair to my shoulder blades
07-06-2020T01:25:24,SpazztasticKiwi,my hairs technically at my shoulder blades without the culrs
07-06-2020T02:21:16,SpazztasticKiwi,night Tom
07-06-2020T02:30:44,Twokinds,:ctwokinds-RainezZz:
07-06-2020T02:31:06,Dadrobit,"Have a good one, Tom."
07-06-2020T02:33:39,Dadrobit,"Huh, it would appear Phoenix is on fire"
07-06-2020T02:33:49,Dadrobit,Which is.... fitting I s'pose....
07-06-2020T02:36:22,Dadrobit,https://i.imgur.com/QzRa9f0.jpg
07-06-2020T02:39:49,SpazztasticKiwi,that seems nicely casual
07-06-2020T02:40:03,SpazztasticKiwi,“huh. city’s on fire...........how bout that”
07-06-2020T02:48:21,Dadrobit,"I mean, it's 2020. It's barely a spot on the 2020 apocalypse Bingo card for me."
07-06-2020T02:54:52,SpazztasticKiwi,waking up each morning to find out what chapter of Revelations we’re in today
07-06-2020T02:55:44,SpazztasticKiwi,"hornets, fires, protests, looting, floods, landslides"
07-06-2020T02:56:09,SpazztasticKiwi,waiting for a voice in the sky to yell “jumanji!”
07-06-2020T05:34:15,TerraTheWizard,:ctwokinds-natsducky:
07-06-2020T08:28:28,TheBeginnerArtisst,hai!
07-06-2020T08:28:42,TheBeginnerArtisst,wusup?
07-06-2020T10:12:59,CrRAR,:wave::ccrrar-rocky:
07-06-2020T10:25:56,CrRAR,:heart::fire:
07-06-2020T10:26:14,CrRAR,"Heart’s on fire, world’s on fire, how bout dat"
07-06-2020T12:25:47,AspiringNoodle,"Huzzah, one task done today, scheduled an inspection for my vehicle <3"
07-06-2020T12:38:10,TerraTheWizard,vroom
07-06-2020T13:01:00,CrRAR,"nice, mine's due too. Probably should do that this week."
07-06-2020T13:44:03,AspiringNoodle,I has ford focus
07-06-2020T13:44:06,AspiringNoodle,So very vroom~
07-06-2020T14:50:11,CrRAR,Grasshopper so tiny
07-06-2020T14:50:15,CrRAR,https://i.imgur.com/KdNW71W.jpg
07-06-2020T14:50:39,TerraTheWizard,smol
07-06-2020T14:51:39,CrRAR,Still capable of big hops
07-06-2020T15:22:27,TerraTheWizard,:ctwokinds-RainezZz:
07-06-2020T15:24:21,SpazztasticKiwi,HE SO ITTY BITTY
07-06-2020T15:39:09,TheBeginnerArtisst,Hey yo?
07-06-2020T15:39:14,TheBeginnerArtisst,Wussup?
07-06-2020T15:57:44,AspiringNoodle,Everything
07-06-2020T15:57:46,AspiringNoodle,All the time
07-06-2020T15:57:49,AspiringNoodle,Every day
07-06-2020T16:01:54,NibblyBot,New Patreon Post: Maid Outfit Kat https://www.patreon.com/posts/maid-outfit-kat-38031948
07-06-2020T16:44:51,SpazztasticKiwi,it hot
07-06-2020T16:47:38,AspiringNoodle,I just pruned the tree outside my house a bit
07-06-2020T16:47:43,AspiringNoodle,That was a fun hour of work~
07-06-2020T16:48:00,AspiringNoodle,Now I shouldn't be walking into leaves while hunched over at half my height~
07-06-2020T17:09:27,AspiringNoodle,"Wow... I feel bad for the Stadia fanboys, lol"
07-06-2020T18:54:08,Xexanoth,there are stadia fanboys?
07-06-2020T19:10:55,CrRAR,Found ya some bunnies spazz
07-06-2020T19:10:58,CrRAR,https://i.imgur.com/NH2gktO.jpg
07-06-2020T19:23:07,AspiringNoodle,"Oh boy, Xexanoth, you have NO idea, lol"
07-06-2020T19:23:47,AspiringNoodle,Stadia's #1 Fanboy: https://twitter.com/BSilvaPortugal/status/1266809654052601857?s=20
07-06-2020T19:23:58,AspiringNoodle,Boy is he gonna feel like an ass when they finally kill off Stadia
07-06-2020T19:24:08,AspiringNoodle,"And the entire internet goes: ""Told you so."""
07-06-2020T19:24:50,AspiringNoodle,"Well, as the saying goes"
07-06-2020T19:25:14,AspiringNoodle,A fool and his money are soon parted
07-06-2020T19:39:51,Ordithus,[wabbit season]*:duck:
07-06-2020T19:41:02,AspiringNoodle,I have seen wild baby bunnies
07-06-2020T19:41:08,AspiringNoodle,They are lethally cute
07-06-2020T19:52:51,Ordithus,i took a picture ya https://imgur.com/a/Os7wfRd
07-06-2020T19:55:32,CrRAR,Nice lilacs
07-06-2020T19:55:49,CrRAR,So many flower
07-06-2020T19:55:53,CrRAR,Very aromatic
07-06-2020T19:55:59,CrRAR,wow
07-06-2020T19:56:23,Ordithus,:ctwokinds-rainehappy:
07-06-2020T19:58:15,SpazztasticKiwi,when did I need bunnies
07-06-2020T19:58:47,SpazztasticKiwi,"you know, I got a friend with something around 10 pet bunnies"
07-06-2020T19:58:57,SpazztasticKiwi,and goats
07-06-2020T19:59:11,SpazztasticKiwi,and pigs - one tiny one big
07-06-2020T19:59:34,Ordithus,sounds like a petting zoo
07-06-2020T20:00:02,SpazztasticKiwi,they’re getting there
07-06-2020T20:00:14,SpazztasticKiwi,the horses are too big to keep on property
07-06-2020T20:00:45,SpazztasticKiwi,they’re at a different site  - because pasture..and barn
07-06-2020T20:10:47,Ordithus,kiwi now amazon is trying to sell me blinker fluid
07-06-2020T20:12:24,SpazztasticKiwi,good
07-06-2020T20:12:29,SpazztasticKiwi,it’s quite the essential
07-06-2020T20:13:09,SpazztasticKiwi,but if you want to swap I got father’s day ads
07-06-2020T20:19:13,AspiringNoodle,"Alright, 2/3 things for the day down"
07-06-2020T20:19:16,AspiringNoodle,Now for the big one
07-06-2020T20:19:38,AspiringNoodle,Ordering a barrel of lu-
07-06-2020T20:19:45,AspiringNoodle,"I mean, writing my resignation notice"
07-06-2020T20:19:50,AspiringNoodle,"Yeah, let's go with the second one"
07-06-2020T20:21:59,AspiringNoodle,I *just* remembered
07-06-2020T20:22:18,AspiringNoodle,I saw a Blue Jay earlier today while driving :ptv-excited:
07-06-2020T20:23:16,Ordithus,:bird:
07-06-2020T20:44:24,SpazztasticKiwi,birbs
07-06-2020T20:52:54,AspiringNoodle,"Hey, anyone remember the barrel of slippery stuff meme from Prime Day a few years ago?"
07-06-2020T21:03:49,AspiringNoodle,Apparently they're going for god status
07-06-2020T21:03:56,AspiringNoodle,They've increased the size by 5x
07-06-2020T22:13:45,SpazztasticKiwi,🦉
07-06-2020T22:31:30,CrRAR,:owl:
07-06-2020T22:50:12,SpazztasticKiwi,ah the summoning worked
07-06-2020T23:03:23,AspiringNoodle,:snake:
07-06-2020T23:03:32,AspiringNoodle,[nope]*:snake:
07-06-2020T23:03:35,AspiringNoodle,*slithers away*
07-06-2020T23:04:40,Ordithus,:octopus:
07-06-2020T23:22:24,AspiringNoodle,I'm beginning to wonder if I've spent so long playing multiplayer games that I forgot the joy of singleplayer
07-06-2020T23:22:38,AspiringNoodle,"Like, holy heck"
07-06-2020T23:22:45,AspiringNoodle,Me: *uninstalls MP game*
07-06-2020T23:22:57,AspiringNoodle,"Also me: ""AAAAAAAAAAAAAAAAHMUSTINSTALLNEWONEASAP"""
07-06-2020T23:33:30,NotNuhteneye,:ptv-uneasy:
07-06-2020T23:43:32,SpazztasticKiwi,Tom! waddap!
07-06-2020T23:47:54,AspiringNoodle,"Tom: ""The ceiling."""
