date,user,comment
07-07-2020T01:51:47,AspiringNoodle,"Mmmmm, freshly-cleaned chat~"
07-07-2020T04:03:14,madgamer7014,lets get it all filthy
07-07-2020T04:11:04,AspiringNoodle,:ptv-shock:
07-07-2020T04:13:00,TerraTheWizard,:ctwokinds-kingtea:
07-07-2020T04:23:39,AspiringNoodle,Hoi terra
07-07-2020T04:23:43,AspiringNoodle,Have a good slep?
07-07-2020T04:32:04,AspiringNoodle,"Oi, why's the room getting so-"
07-07-2020T04:32:07,AspiringNoodle,:ptv-sleepy:
07-07-2020T08:28:16,CrRAR,:ctwokinds-kingtea:
07-07-2020T08:28:33,CrRAR,*noms bagel*
07-07-2020T10:07:01,CrRAR,made an omelette
07-07-2020T10:07:08,CrRAR,:ctwokinds-smug:
07-07-2020T10:07:30,CrRAR,"an omnomn-omelette, if you will"
07-07-2020T10:08:15,CrRAR,"also, I’ve been mixing my orange juice with creme of coconut. :ok_hand:"
07-07-2020T10:09:25,CrRAR,Ever since the mango/orange disappeared a few months ago I had to figure something out.
07-07-2020T10:15:17,Xexanoth,so an alcohol free version of malibu-o?
07-07-2020T10:16:26,CrRAR,"Pretty much, it would probably mix pretty well with something haha"
07-07-2020T10:17:50,CrRAR,It’s just a couple ingrediants away from being a pina colada
07-07-2020T10:24:35,Xexanoth,then you know what to make next time :ptv-dealwithit:
07-07-2020T10:48:28,CrRAR,Humidity’s moved in here
07-07-2020T10:48:31,CrRAR,:ctwokinds-reniembarrassed::sweat_drops:
07-07-2020T13:34:08,NibblyBot,New Patreon Post: Awoo Fine https://www.patreon.com/posts/awoo-fine-39111431
07-07-2020T13:34:45,TerraTheWizard,:ctwokinds-adiracoin:
07-07-2020T13:40:59,CrRAR,[What about kitty noises?]*:ctwokinds-floraquestion:
07-07-2020T13:41:59,CrRAR,:ctwokinds-laura:*[or what the fox say?]
07-07-2020T13:47:12,Azumachan,Kon kon ?
07-07-2020T13:54:13,CrRAR,Sounds accurate
07-07-2020T13:54:26,CrRAR,"Also, dragon noises."
07-07-2020T13:54:30,CrRAR,:ctwokinds-reniderp:
07-07-2020T13:59:09,CrRAR,Would make for quite a wildlife symphony.
07-07-2020T13:59:14,CrRAR,“mew”
07-07-2020T13:59:21,CrRAR,“Nyaaaa~”
07-07-2020T13:59:28,CrRAR,“Mreheheheeee”
07-07-2020T13:59:43,CrRAR,“CRLOARARARARAAR”
07-07-2020T13:59:56,CrRAR,:ctwokinds-zenshocked:
07-07-2020T14:00:24,CrRAR,“IN THE NAME OF MEANINGLESS BATTLE!”
07-07-2020T14:08:16,CrRAR,Would be a fun rendition of In The Jungle~
07-07-2020T14:16:12,TerraTheWizard,:ctwokinds-RainezZz:
07-07-2020T14:54:18,AspiringNoodle,Debating whether or not to continue playing Dark Souls 3 for pvp lol
07-07-2020T14:54:39,AspiringNoodle,That game has some stupidly broken weapons and From Software hasn't touched the game in years
07-07-2020T15:08:57,AspiringNoodle,"That reminds me, anyone seen Quill recently?"
07-07-2020T15:09:09,AspiringNoodle,"I wanted to help him with his DS3 playthrough, but I never see him anymore :c"
07-07-2020T18:14:27,CrRAR,:ctwokinds-rainehappy::pancakes:
07-07-2020T18:14:32,CrRAR,gun make pancakes
07-07-2020T18:39:25,Ordithus,:ctwokinds-sleepoverA::pancakes:
07-07-2020T19:07:11,AspiringNoodle,I made a chicken dinner
07-07-2020T19:07:17,AspiringNoodle,"#1 Apex Legend, babeh >:3"
07-07-2020T19:15:05,NibblyBot,New Patreon Post: Submit Sketch Suggestion! https://www.patreon.com/posts/submit-sketch-39122726
07-07-2020T19:15:29,Ordithus,:ctwokinds-nibsbounce:
07-07-2020T19:39:56,CrRAR,:ctwokinds-nibsbounce:
07-07-2020T20:23:36,SpazztasticKiwi,goodiegoodiegoodiegoodiegoodie
07-07-2020T20:25:04,CrRAR,that's the spirit!
07-07-2020T20:29:24,Twokinds,Allergies killing me
07-07-2020T20:30:30,RimaDraws,sorry to hear that
07-07-2020T20:31:42,RimaDraws,the bradford pear trees make my throat close up
07-07-2020T20:32:49,CrRAR,dang
07-07-2020T20:32:51,Ordithus,aren't allergies fun
07-07-2020T20:32:58,RimaDraws,loads
07-07-2020T20:33:22,RimaDraws,but yea i swear outside of the building at work we have some and wearing that mask plus those made me have a hard time breathing today
07-07-2020T20:34:32,Ordithus,:thunder_cloud_rain::ctwokinds-nataniAAAAshake::thunder_cloud_rain:
07-07-2020T20:34:46,RimaDraws,plus it is humid as hell out here
07-07-2020T20:35:37,CrRAR,yeah the air is very moist here too
07-07-2020T20:35:44,RimaDraws,moist lol
07-07-2020T20:36:14,Ordithus,today it's been humid followed by storms followed by humid and now storms again
07-07-2020T20:36:21,CrRAR,Speaking of thunderstorms we had a lightning strike that felt like and sounded like it was right on top of us
07-07-2020T20:36:46,RimaDraws,its been sunny rain sunny more rain
07-07-2020T20:36:56,CrRAR,"I looked it up on the lightning strike maps, one was recorded under a half mile from here"
07-07-2020T20:37:28,CrRAR,Wondered if maybe ir began above us but like traveled sideways a bit
07-07-2020T20:38:11,CrRAR,flash and crazy boom happened like simultaneously
07-07-2020T20:38:57,johnnytho,"I envy you people. Nothing but boring, hot, depressing sun here."
07-07-2020T20:39:14,johnnytho,I need a storm to spice up my life
07-07-2020T20:39:15,CrRAR,:sun_with_face:
07-07-2020T20:40:16,johnnytho,LA weather is too perfect. It's infuriating
07-07-2020T20:40:31,johnnytho,:rage:
07-07-2020T20:45:15,CrRAR,just a big happy sun with lots of happy rays
07-07-2020T20:45:29,CrRAR,grows happy grass to feed the happy cows
07-07-2020T20:45:35,CrRAR,from california
07-07-2020T20:47:22,SpazztasticKiwi,the air is moist should never be a statement of truth
07-07-2020T20:49:17,johnnytho,Florida
07-07-2020T20:49:44,CrRAR,the ambient atmospheric layer contains abundant water particles
07-07-2020T20:49:50,CrRAR,:ctwokinds-keith8D:
07-07-2020T20:54:27,SpazztasticKiwi,the copperhead is back
07-07-2020T20:55:17,CrRAR,You know what they say
07-07-2020T20:55:33,CrRAR,Home is where the herpetology is
07-07-2020T20:55:41,CrRAR,:snake:
07-07-2020T20:56:14,SpazztasticKiwi,copperheads are venomous
07-07-2020T20:56:37,SpazztasticKiwi,and this one was on the front steps
07-07-2020T20:56:43,CrRAR,Have you tried any deterrents?
07-07-2020T20:56:57,CrRAR,Maybe adopt a mongoose?
07-07-2020T20:57:00,SpazztasticKiwi,no not at all totally never crossed our minds
07-07-2020T20:57:11,SpazztasticKiwi,you realize I’m not joking
07-07-2020T20:57:18,CrRAR,oh I know
07-07-2020T20:57:27,CrRAR,Is there anything you can do?
07-07-2020T20:57:52,SpazztasticKiwi,I am damn well ready to move state because my mother and sister can’t be bothered to get off their asses and clean
07-07-2020T20:58:38,SpazztasticKiwi,"the first time I came across the first one, I said “clean. the. burn. pile”"
07-07-2020T20:59:08,SpazztasticKiwi,"but no, they’re not concerned"
07-07-2020T20:59:12,CrRAR,"Yeah, you mentioned that they been hiding out in there"
07-07-2020T20:59:39,SpazztasticKiwi,mother always aches or has a migraine yet she’s often more than ready if the family goes shopping out of town
07-07-2020T21:00:08,SpazztasticKiwi,my sister has been allowed to do whatever she wants until here recently since I’ve put my foot down in the matter
07-07-2020T21:00:36,SpazztasticKiwi,you know my mother actually told me I should look for another place to live because I’ve been so “disagreeable”
07-07-2020T21:01:20,CrRAR,Well a dangerous snake skulking around is kind of a reason to be.
07-07-2020T21:01:51,SpazztasticKiwi,"and why don’t I clean the pile? because every time I get something done, they’re right behind me to mess it right back up"
07-07-2020T21:02:35,SpazztasticKiwi,and I don’t have the interest in picking at a venom infested leaf & trash heap
07-07-2020T21:02:58,SpazztasticKiwi,not without a backhoe....or thick ass pants
07-07-2020T21:04:09,CrRAR,"if it was to be pants, have to be like gaiters or something rubbery"
07-07-2020T21:06:59,CrRAR,Are there services to take care of venomous snakes?
07-07-2020T21:07:33,SpazztasticKiwi,hahahahahahahahahahahabahahahahahaha
07-07-2020T21:07:59,SpazztasticKiwi,you mean the snake removers I tried contacting over three months ago when this started?
07-07-2020T21:08:33,CrRAR,"well, sounds like that didn't work out"
07-07-2020T21:08:33,SpazztasticKiwi,they won’t be troubled to come down unless the snake stays visible for their 45 minute drive down here
07-07-2020T21:09:14,SpazztasticKiwi,"and at the time, I’d spotted two"
07-07-2020T21:09:26,SpazztasticKiwi,they can legitimately kiss my ass
07-07-2020T21:09:51,CrRAR,"That's silly, how would anyone ensure a snake stays still that long?"
07-07-2020T21:10:04,CrRAR,FREEZE... SNAKE!
07-07-2020T21:10:12,CrRAR,I'm calling the snake police
07-07-2020T21:11:12,CrRAR,"maybe if the snake was indoors, like those news stories you see about people who find them in the strangest places."
07-07-2020T21:12:06,SpazztasticKiwi,they generally catch snakes that wander in houses
07-07-2020T21:12:32,SpazztasticKiwi,but these are on the steps
07-07-2020T21:12:39,SpazztasticKiwi,close enough
07-07-2020T21:15:01,Ordithus,"you should have seen it, the strangest thing"
07-07-2020T21:15:20,Ordithus,"pouring rain, soaked me head to toe"
07-07-2020T21:15:33,Ordithus,"and the oddest part is, it was confined entirely to my bathroom"
07-07-2020T21:15:38,Ordithus,:ctwokinds-katwet:
07-07-2020T21:16:02,CrRAR,uhh
07-07-2020T21:17:57,CrRAR,ord I think that's called a shower
07-07-2020T21:18:08,CrRAR,Is this some kind of riddle?
07-07-2020T21:18:17,Ordithus,oh so that's what happened
07-07-2020T21:18:34,CrRAR,hehehe
07-07-2020T21:23:38,Ordithus,OK now it is pouring out wow
07-07-2020T21:31:41,CrRAR,ord making all the discoveries tonight
07-07-2020T21:31:54,CrRAR,so much WONDER
07-07-2020T21:31:58,CrRAR,so little time
07-07-2020T21:32:01,CrRAR,:ctwokinds-maddiessparkles:
07-07-2020T21:32:03,Ordithus,:ctwokinds-maddiessparkles:
07-07-2020T21:32:09,CrRAR,eyyy
07-07-2020T21:32:11,CrRAR,lol
07-07-2020T21:32:37,Ordithus,kiwi sorry to hear about the nonsense
07-07-2020T21:35:41,AspiringNoodle,I'm still just playing with balls :ptv-uneasy:
07-07-2020T21:35:48,AspiringNoodle,I'm behind the development curve
07-07-2020T21:36:36,CrRAR,"noodle, that's perfectly natural"
07-07-2020T21:36:46,CrRAR,and a normal part of growing
07-07-2020T21:36:52,CrRAR,...your artistic skill
07-07-2020T21:37:54,SpazztasticKiwi,nonsense is an understatement
07-07-2020T21:38:05,SpazztasticKiwi,I’m perpetually annoyed since my dad died
07-07-2020T21:39:49,CrRAR,"my dad moved away, though present, he was kind of a not good role model ;_;"
07-07-2020T21:40:07,CrRAR,he's in florida now
07-07-2020T21:40:17,CrRAR,"Was that super long ago, spazz?"
07-07-2020T21:40:59,SpazztasticKiwi,12 years
07-07-2020T21:41:55,SpazztasticKiwi,28 days after my 12th birthday so 11 years and I don’t care to count the months ago if you wanna split hairs
07-07-2020T21:42:48,SpazztasticKiwi,"mine wasn’t the role model either but while it’s better he’s gone, my sister started walking on water shortly after so"
07-07-2020T21:45:45,Ordithus,where would you move to if you could?
07-07-2020T21:46:27,SpazztasticKiwi,if cash wasn’t an issue my ass would be in California
07-07-2020T21:46:31,SpazztasticKiwi,as far as possible
07-07-2020T21:46:56,SpazztasticKiwi,as much as I’d hate the city
07-07-2020T21:46:59,Ordithus,Alaska or Hawaii are further!  Real hermit places.
07-07-2020T21:47:05,CrRAR,haha
07-07-2020T21:47:47,SpazztasticKiwi,I’ve had eyes at Cincinnati
07-07-2020T21:48:09,SpazztasticKiwi,california has family but so does cinci & Georgia
07-07-2020T21:48:55,CrRAR,Travelling is a good way to gain perspective.
07-07-2020T21:49:01,SpazztasticKiwi,tolerable family
07-07-2020T21:49:19,SpazztasticKiwi,I was in Cincinnati in 2014 to see the zoo
07-07-2020T21:49:28,Dadrobit,"""Undercover Western Maddie has successfully infiltrated the gala! But now that she's in, maintaining her cover proves difficult when everything is so... Scandalous!"""
07-07-2020T21:49:30,SpazztasticKiwi,that’s all I’ve seen
07-07-2020T21:49:32,CrRAR,nice
07-07-2020T21:50:03,Dadrobit,#QualitySuggestion?
07-07-2020T21:50:14,SpazztasticKiwi,"as for anywhere else I’ve been to Boston, Tennessee, Georgia, Mississippi & Kentucky"
07-07-2020T21:50:38,SpazztasticKiwi,all southern places besides Boston & it was for just PAX
07-07-2020T21:51:14,SpazztasticKiwi,sounds fine I guess
07-07-2020T21:51:39,Ordithus,:ctwokinds-maddiessparkles:*[L-lewd!]
07-07-2020T21:59:04,CrRAR,"When you've traveled a bit to different places it makes all of your past seem less in focus and gives perspective to what matters. It's just YOU that stays the same in the new place. You can change your attitude and yourself anywhere, some places easier"
07-07-2020T21:59:24,CrRAR,"than others, you just have to remember to keep accomplishing things to make yourself proud and keep making progess. Parents may be our early cheerleaders in life but eventually we have to be our own anyway."
07-07-2020T22:00:23,CrRAR,It's one of those growing up things
07-07-2020T22:00:27,SpazztasticKiwi,I’ve taken care of my own for close to ten years
07-07-2020T22:00:36,CrRAR,yeah!
07-07-2020T22:01:10,SpazztasticKiwi,"like I said, my mother prefers to sit around and do nothing like my sister if she’s not at work"
07-07-2020T22:01:37,SpazztasticKiwi,for her credit she’s disabled since she spent 20 years “helping” my dad
07-07-2020T22:02:25,SpazztasticKiwi,"but after I got her off my back by turning 18 and no longer controllable, more than plenty has fallen to me"
07-07-2020T22:02:56,SpazztasticKiwi,"if sister says she doesn’t want to do it, I get bagered until it happens"
07-07-2020T22:03:48,SpazztasticKiwi,oh but she doesn’t play favorites
07-07-2020T22:04:24,CrRAR,"yeah, too much of unchanging sameness can be irritating"
07-07-2020T22:08:02,AspiringNoodle,Parents who burden their children willfully are the worst -_-
07-07-2020T22:11:27,CrRAR,"Yeah, one thing I believe is that there are redeeming qualities to be found in anyone. Many people are flawed in some way, just try and learn from the good sides of people/parents."
07-07-2020T22:15:51,SpazztasticKiwi,bullshit
07-07-2020T22:16:09,SpazztasticKiwi,my mother has had chances before in the past
07-07-2020T22:16:29,SpazztasticKiwi,she doesn’t and has never seen herself as wrong
07-07-2020T22:25:15,CrRAR,people can get stuck in certain ways of thinking especially if it works for them
07-07-2020T22:25:33,SpazztasticKiwi,still not an excuse
07-07-2020T22:25:41,CrRAR,nope
07-07-2020T22:32:31,CrRAR,"yeah, trust me, the ability of someone to keep up an irrational train of thought is astounding"
07-07-2020T22:34:06,CrRAR,sometimes that train is to florida
07-07-2020T22:34:31,CrRAR,and that my friends is how a Floridaman:tm: is born cD
07-07-2020T22:34:35,CrRAR,xD
07-07-2020T22:34:47,Ordithus,I know a Floridaman
07-07-2020T22:34:54,Ordithus,Just waiting for the news one day
07-07-2020T22:35:01,CrRAR,lol
07-07-2020T22:47:29,AspiringNoodle,While I will admit there is a merit to looking at the best parts of people
07-07-2020T22:47:43,AspiringNoodle,Sometimes you just have to acknowledge that they're such pieces of shit in every other regard that the good doesn't matter
07-07-2020T22:47:53,AspiringNoodle,Just my 2 cents
07-07-2020T22:48:14,AspiringNoodle,"Also, apologies for my swears ._."
07-07-2020T22:49:01,CrRAR,true
07-07-2020T22:51:18,Ordithus,I can think of a few examples
07-07-2020T22:55:01,CrRAR,"that's why ""it takes a village to raise a child"" is important"
07-07-2020T22:55:10,CrRAR,much socialization
07-07-2020T22:55:16,CrRAR,many connections
07-07-2020T22:55:25,CrRAR,very informative
07-07-2020T22:55:27,CrRAR,wow
07-07-2020T22:55:40,Ordithus,:poodle:
07-07-2020T22:55:55,CrRAR,hehe
07-07-2020T22:56:43,CrRAR,:poodle:*[I'm LIGHTISH RED!]
07-07-2020T22:56:57,CrRAR,[JEEZ]*:poodle:
07-07-2020T22:58:12,CrRAR,that lil guy just looks like a pink lion at first glance.
07-07-2020T22:58:27,CrRAR,[LIGHTISH. RED.]*:poodle:
07-07-2020T22:58:45,CrRAR,all about
07-07-2020T22:58:48,CrRAR,P E R C E P T I O N~
07-07-2020T22:59:25,Ordithus,"pugs and pink poodles, they define dogs"
07-07-2020T22:59:33,Ordithus,- Picarto 2020
07-07-2020T23:00:18,CrRAR,yes quite a representative selection
07-07-2020T23:04:53,CrRAR,spazz did you submit the other Maeve idea you had for sketch suggestions or something different?
07-07-2020T23:12:35,SpazztasticKiwi,I haven’t bothered to pop over to that side of life at the moment
07-07-2020T23:13:00,CrRAR,I feel ya
07-07-2020T23:13:44,CrRAR,Now I'm wondering what the goodiegoodiegoodie thing was about haha
07-07-2020T23:13:57,CrRAR,I thought it was about the suggestions thing being posted
07-07-2020T23:14:08,SpazztasticKiwi,there’s not even any telling when Tom flaked off
07-07-2020T23:15:01,CrRAR,I think it was a while ago
07-07-2020T23:15:16,SpazztasticKiwi,"I have 3 ideas I’m tied on but since two that I’ve spitballed here have been submitted by other people, I’ll decide on my own"
07-07-2020T23:15:39,CrRAR,coolcool
07-07-2020T23:16:20,SpazztasticKiwi,it was shortly after I started bombing chat
07-07-2020T23:17:11,SpazztasticKiwi,something about his allergies getting him real bad then I’d gotten off work so I was free to see the suggestion box was open
07-07-2020T23:17:24,SpazztasticKiwi,this the goodiegoodiegoodiegoodie
07-07-2020T23:17:28,SpazztasticKiwi,thus
07-07-2020T23:17:30,CrRAR,"ah, nice"
07-07-2020T23:18:02,CrRAR,freedom and opportunity~ :ptv-excited:
07-07-2020T23:18:04,SpazztasticKiwi,then I got home & the snakes
07-07-2020T23:18:36,CrRAR,yeah that's a buzzkill
07-07-2020T23:19:09,SpazztasticKiwi,which became my opening for the closet to air out
07-07-2020T23:19:21,Ordithus,"venom, ew.  give me a bear.  at least it seems right."
07-07-2020T23:19:34,SpazztasticKiwi,and then he peaced out
07-07-2020T23:20:21,SpazztasticKiwi,might actually be dying tho
07-07-2020T23:20:43,SpazztasticKiwi,cinci is showing stop start rain and then sun
07-07-2020T23:21:11,SpazztasticKiwi,back & forth most definitely has to have the pollon counts confused
07-07-2020T23:21:18,CrRAR,sun at night? It is truly the endtimes
07-07-2020T23:21:23,CrRAR,D:
07-07-2020T23:21:43,Ordithus,or Alaska
07-07-2020T23:21:57,SpazztasticKiwi,plants be like “do we dust or do we not? we sick of the sun saying yes only to have hard work washed by rain”
07-07-2020T23:22:03,Ordithus,the sun is probably still up in Anchorage
07-07-2020T23:22:10,CrRAR,true
07-07-2020T23:22:20,SpazztasticKiwi,"teeeeechnically, the sun is always up"
07-07-2020T23:22:25,SpazztasticKiwi,we’re just spinning
07-07-2020T23:22:41,CrRAR,That reminds me of the xkcd's where it has the parody weather forecasts for the apocalypse or whatever
07-07-2020T23:23:00,SpazztasticKiwi,"not to be confused with spiraling, because that’s 2020’s job"
07-07-2020T23:23:14,Ordithus,down and down and around but down
07-07-2020T23:23:41,CrRAR,https://xkcd.com/1245/
07-07-2020T23:23:55,CrRAR,I personally can't wait for Tuesdays forever
07-07-2020T23:24:01,SpazztasticKiwi,sounds about right
07-07-2020T23:24:14,SpazztasticKiwi,you know they found an undiscovered cave sealed up
07-07-2020T23:24:31,SpazztasticKiwi,they think it’s been untouched for “thousands” of years
07-07-2020T23:24:51,Ordithus,cool!  where at?
07-07-2020T23:24:59,SpazztasticKiwi,"personally, I suggest we seal it tf back up and leave it"
07-07-2020T23:25:06,SpazztasticKiwi,it’s not the year
07-07-2020T23:25:50,SpazztasticKiwi,Romania
07-07-2020T23:25:55,CrRAR,...but what if that's where the unicorns are hidden?
07-07-2020T23:26:01,SpazztasticKiwi,don’t care
07-07-2020T23:26:19,SpazztasticKiwi,"we don’t need it - whatever it has, we don’t need it"
07-07-2020T23:26:29,Dadrobit,Back! At work and nothing is functional! Work is cancelled! \o/
07-07-2020T23:26:39,CrRAR,oh no
07-07-2020T23:26:44,CrRAR,like the feeds are out?
07-07-2020T23:26:57,CrRAR,That's when the ninjas attack
07-07-2020T23:27:05,SpazztasticKiwi,there’s a literal movie called the Cave that’s the exact same premise and We Don’t Need It
07-07-2020T23:27:06,Ordithus,watch out for Adam Jensen
07-07-2020T23:27:23,Dadrobit,"Yep, guy before me tried updating Windows without IT support and it ruined everything forever."
07-07-2020T23:27:30,Ordithus,oh no
07-07-2020T23:27:36,CrRAR,dangit
07-07-2020T23:27:43,Ordithus,but... how do you even screw that up?
07-07-2020T23:27:47,SpazztasticKiwi,👏🏻 👏🏻 👏🏻 round of applause
07-07-2020T23:27:52,Ordithus,you just... let it do the thing
07-07-2020T23:28:08,SpazztasticKiwi,employee of the month
07-07-2020T23:28:16,CrRAR,"""Welp I tried *ding* oh hey, shift's over"""
07-07-2020T23:28:26,CrRAR,*skedaddling noises*
07-07-2020T23:28:35,Dadrobit,It doesn't jive with the central security servers since they're now on different versions.
07-07-2020T23:28:37,SpazztasticKiwi,must start his brain with matches
07-07-2020T23:29:06,SpazztasticKiwi,computer: “I’m sorry. I do not recognize this system”
07-07-2020T23:29:12,Ordithus,security so secure it secures itself out of security
07-07-2020T23:29:18,SpazztasticKiwi,“ 💀 “
07-07-2020T23:29:18,Ordithus,what
07-07-2020T23:29:22,CrRAR,sounds advanced
07-07-2020T23:30:15,SpazztasticKiwi,was...was he new
07-07-2020T23:30:16,Dadrobit,It's recursive. Like when a movie is so bad it's good.
07-07-2020T23:30:27,CrRAR,lol spazz that reminds me of the Independence Day movie virus
07-07-2020T23:30:49,Dadrobit,Except this is a movie that's so good it's bad.... Like 2001: A Space Odyssey or something.
07-07-2020T23:30:55,CrRAR,true
07-07-2020T23:30:55,Ordithus,"the only virus to ever hit an apple machine, crrar"
07-07-2020T23:31:00,CrRAR,^
07-07-2020T23:31:27,Dadrobit,"Nah, the guy has been here for nearly two years."
07-07-2020T23:31:40,SpazztasticKiwi,well there goes his lifeline
07-07-2020T23:31:45,CrRAR,"Dad should live in that universe, a world where Mac is compatible with alien technology is probably where his Windows would be compatible with anything"
07-07-2020T23:32:03,CrRAR,Plus ALIENS!
07-07-2020T23:32:08,CrRAR,:ctwokinds-keith8D:
07-07-2020T23:32:23,CrRAR,and spaceships
07-07-2020T23:32:56,Dadrobit,"Nah, shit got fucked in that movie. I'd rather not."
07-07-2020T23:33:31,CrRAR,"Yeah, we only have one Randy Quaid to lose. ;_;"
07-07-2020T23:34:16,Dadrobit,"Oh, and I left for work right after I posted my #QualitySuggestion? Caught Spazz saying it wasn't terrible. Any other opinion?"
07-07-2020T23:34:19,Ordithus,:ctwokinds-RaineEep:*[Goodnight!]
07-07-2020T23:34:22,Ordithus,:ctwokinds-RainezZz:
07-07-2020T23:34:28,Dadrobit,o/ Ord!
07-07-2020T23:34:37,SpazztasticKiwi,there’s a article for the cave
07-07-2020T23:35:12,CrRAR,:v: ord
07-07-2020T23:35:33,SpazztasticKiwi,I can picture naked ankles everywhere & Maddie with a scarf wrapped around her face like “nope”
07-07-2020T23:36:00,SpazztasticKiwi,then she starts bumping into everyone....touching bare..uh skin?
07-07-2020T23:36:04,CrRAR,"Yeah, ankle-high dresses... everywhere"
07-07-2020T23:36:17,SpazztasticKiwi,them sexy ankles
07-07-2020T23:36:52,Dadrobit,Literally just Maddie surrounded by a censor mosaic.
07-07-2020T23:37:16,CrRAR,"""...and the high heels..."""
07-07-2020T23:37:22,CrRAR,*Maddie shudders*
07-07-2020T23:37:28,SpazztasticKiwi,I still wonder why Maeve stealing Maddie’s line art never did well
07-07-2020T23:38:37,CrRAR,like leaving a her borderless?
07-07-2020T23:38:57,CrRAR,accidentally 'a'
07-07-2020T23:39:14,Dadrobit,Just wasn't sure if Maddie being flustered was on brand or not. She hasn't really shown herself to be flusterable by things outside of how her superiors treated her.
07-07-2020T23:40:10,Dadrobit,"The incentive even showed her trying to go ankle commando, so I dunno if the suggest really worked"
07-07-2020T23:40:11,CrRAR,What about when Karen was inquiring about ear etiquette?
07-07-2020T23:40:33,CrRAR,yeah bold moment
07-07-2020T23:40:57,Dadrobit,"I mean, physical contact is kinda next level over general nutity no?"
07-07-2020T23:41:02,CrRAR,Would have gotten away with it too if it wasn't for that meddling Keith
07-07-2020T23:41:07,Dadrobit,Nudity*
07-07-2020T23:41:29,Dadrobit,Darn you meddling Keith's!
07-07-2020T23:41:38,SpazztasticKiwi,"Maddie’s all for the ankles being covered & after the swimsuit scene, Maeve going another step and making her look more naked ..."
07-07-2020T23:42:15,Dadrobit,The other option was Maddie begrudgingly enjoying herself a bit at the gala. But that's not quite as funny imho.
07-07-2020T23:42:19,SpazztasticKiwi,art with no lines is just....nude art
07-07-2020T23:42:38,CrRAR,harharhar
07-07-2020T23:42:39,SpazztasticKiwi,how’d Maddie look at a hot tub
07-07-2020T23:42:51,SpazztasticKiwi,bubbly water with strangers in swimsuits
07-07-2020T23:44:04,SpazztasticKiwi,https://www.asviral.com/movile-cave-romania/
07-07-2020T23:44:16,CrRAR,at least the ankles would be submerged
07-07-2020T23:44:43,Dadrobit,"Ohhhh, that was one I wanted to do! Lynn and Sealeen reenacting the ""This isn't a beach lady!"" Porno opening."
07-07-2020T23:44:52,SpazztasticKiwi,"2020 cave, let’s see: toxic air? ✅ unknown alien creatures? ✅ millions of years old? ✅"
07-07-2020T23:45:24,SpazztasticKiwi,so lEtS gO eXpLoRe It
07-07-2020T23:45:29,CrRAR,maybe they'll find something in there that eats viruses
07-07-2020T23:45:42,Dadrobit,https://youtu.be/5mAhCp1fkO4
07-07-2020T23:46:54,SpazztasticKiwi,I hate it
07-07-2020T23:47:00,SpazztasticKiwi,put it back
07-07-2020T23:48:15,Dadrobit,"Oh c'mon, Lynn would kill it there."
07-07-2020T23:48:59,SpazztasticKiwi,I don’t see Tom doing a hint at a porn opening
07-07-2020T23:49:23,SpazztasticKiwi,"besides, why is the guy not concerned about the unknown lady in his house"
07-07-2020T23:49:28,SpazztasticKiwi,or his bathroom
07-07-2020T23:49:31,Dadrobit,"Yeah, I think that's why I put in on the back burner a while ago."
