date,user,comment
30-08-2020T00:14:40,CrRAR,:ctwokinds-kingtea::cake:
30-08-2020T00:24:59,SpazztasticKiwi,I had chocolate cake
30-08-2020T00:26:45,CrRAR,nice :ok_hand:
30-08-2020T00:27:07,CrRAR,I had a hankerin for chocolate cupcakes the other day
30-08-2020T00:28:52,CrRAR,I might get the marble cake w/ choc chips the cinnamon cake people make next time
30-08-2020T00:29:15,CrRAR,it's a local place but they distribute to supermarkets
30-08-2020T00:38:53,SpazztasticKiwi,idunno
30-08-2020T00:39:03,SpazztasticKiwi,I’m trying to cut what I eat period
30-08-2020T00:39:14,SpazztasticKiwi,eat what I want sure but don’t eat alot
30-08-2020T00:39:52,CrRAR,moderate what you moder-eat
30-08-2020T00:40:29,CrRAR,"like, eat a vegetable to earn cake later or something"
30-08-2020T00:41:29,CrRAR,it's all a balance I guess
30-08-2020T00:42:31,CrRAR,"that's basically my diet, equally bad things balanced by equally goodthings"
30-08-2020T00:43:08,CrRAR,"also, I may or may not could use an entire extra meal a day"
30-08-2020T00:43:24,CrRAR,I tend to just skip things like that
30-08-2020T00:43:31,CrRAR,Esp if I'm busy
30-08-2020T00:43:38,CrRAR,:ptv-uneasy:
30-08-2020T00:44:09,CrRAR,"""The hunger... it sustains me"""
30-08-2020T00:44:33,CrRAR,"conscience: ""no it doesn't, eat something you idiot"""
30-08-2020T00:48:13,CrRAR,"I've recently bought a bunch of natural food health bars, finding the good flavors is fun, they have a chocolate coconut one that's kind of like a almond joy flavor."
30-08-2020T00:48:22,CrRAR,and I liked the blueberry
30-08-2020T00:48:53,CrRAR,like 200+ calories and a bunch of protein is a good boost
30-08-2020T01:05:37,Dadrobit,"Can confirm, brother escalation is a real thing."
30-08-2020T01:06:22,Dadrobit,"Brother once got me a blow-up sex doll for my birthday and we've been retaliating, upping the ante every birthday since."
30-08-2020T01:06:41,CrRAR,"""Childhood home, oh that burned down in the brother-war"""
30-08-2020T01:07:00,CrRAR,"what age did that happen"" xD"
30-08-2020T01:07:09,CrRAR,""" = ?"
30-08-2020T01:07:57,Dadrobit,I think I was 22 or so?
30-08-2020T01:08:34,Dadrobit,Bad Dragon has been an incredible (if expensive) source of shock and awe for me in this fight.
30-08-2020T01:08:47,CrRAR,oh dear
30-08-2020T01:09:00,Dadrobit,Deed*
30-08-2020T01:09:03,Dadrobit,Deer*
30-08-2020T01:09:18,Dadrobit,"Actually, I have no idea if that's a thing. Probably."
30-08-2020T01:09:41,CrRAR,mount one to a plaque and place it in the least used room in their house secretly
30-08-2020T01:10:38,CrRAR,bonus if they do have a surprised looking deer head mount
30-08-2020T01:11:26,AspiringNoodle,Active chat tonight
30-08-2020T01:11:50,CrRAR,losing steam here gradually
30-08-2020T01:11:58,AspiringNoodle,"Also, lol @ Bad Dragon revenge gifts"
30-08-2020T01:12:34,AspiringNoodle,Please tell me you've purchased the largest horse dong possible from them lol
30-08-2020T01:13:07,Dadrobit,I know he at least still has the dragon head one.
30-08-2020T01:13:24,Dadrobit,He has it sitting proudly on his bookshelf.
30-08-2020T01:13:41,Dadrobit,"And no, fuck that, Noodle. Do you know how much money that would be"
30-08-2020T01:13:46,CrRAR,^
30-08-2020T01:14:02,AspiringNoodle,lmao
30-08-2020T01:14:08,AspiringNoodle,"It would be ""worth it"" dollars"
30-08-2020T01:14:30,Dadrobit,That's like $200 my dude. Not fucking worth it.
30-08-2020T01:14:40,CrRAR,"go broke for a prank, and probably get put on their MVP holiday greeting card list FOREVER xD"
30-08-2020T01:14:44,SpazztasticKiwi,alrighty so picarto cut off immediately after my last 2 cents
30-08-2020T01:14:54,CrRAR,aww
30-08-2020T01:15:23,SpazztasticKiwi,"so if moderate what you moder-eat isn’t immediately after that, it’s lost to the void"
30-08-2020T01:16:27,CrRAR,"eh, I just went on a thing saying my diet is basically just a balance of good things and bad things and such"
30-08-2020T01:16:57,CrRAR,"I often undereat, when busy etc etc"
30-08-2020T01:17:10,Dadrobit,"Fuck, looking at my invoices now. I need to find a cheaper brand for this year...."
30-08-2020T01:17:29,Dadrobit,Spent $400 over the years. Really creeps up on ya
30-08-2020T01:18:05,SpazztasticKiwi,yeah I caught that
30-08-2020T01:18:26,SpazztasticKiwi,it cuts off after my comment - no continuation till yours
30-08-2020T01:18:36,SpazztasticKiwi,anything between 💀
30-08-2020T01:18:45,Dadrobit,Probably for the best
30-08-2020T01:18:59,CrRAR,Everyones' key budgetary Achilles heel: mythical creature unspeakable objects
30-08-2020T01:19:59,Dadrobit,"I mean, I'm kinda still set since I got some of their teenie weenies left over, so I can just throw two or three at him this time and call it a day."
30-08-2020T01:20:27,CrRAR,lol stocking stuffers
30-08-2020T01:20:54,CrRAR,"""Are these batterie- oh, oh mah gawd"""
30-08-2020T01:21:03,CrRAR,"Boy, financial advisors of the future are really going to have to expand their horizons."
30-08-2020T01:21:13,Dadrobit,The future is now
30-08-2020T01:21:30,AspiringNoodle,I think the dragon head one is still pretty funny xD
30-08-2020T01:21:32,Dadrobit,"Also, this is the first time with his new wife, I dunno if she knows about our ploys"
30-08-2020T01:21:41,AspiringNoodle,"TBH... you could probably explain it away, haha"
30-08-2020T01:21:55,Dadrobit,"Probably does, cuz yeah, the dragon head is pretty front and center in their home."
30-08-2020T01:23:24,CrRAR,"I'm pretty sure nothing can top that, has he had a good retaliation?"
30-08-2020T01:23:50,CrRAR,"""Dude if I go any further, I'm gonna go on some sort of list"""
30-08-2020T01:25:17,Dadrobit,https://www.twokinds.net/forum/viewtopic.php?p=833221#p833221 Probably my favorite interaction
30-08-2020T01:26:09,CrRAR,lol
30-08-2020T01:27:00,CrRAR,wow
30-08-2020T01:27:06,SpazztasticKiwi,don’t you mean “mythical ~creatures’~ unspeakable objects”
30-08-2020T01:28:09,CrRAR,"that would be more grammatically eloquent, yes"
30-08-2020T01:29:13,SpazztasticKiwi,not gonna lie I’m not far from being on her side
30-08-2020T01:30:33,AspiringNoodle,"omg, lol"
30-08-2020T01:31:02,SpazztasticKiwi,there’s pranks between siblings and fun but some stuff is just no go
30-08-2020T01:31:37,SpazztasticKiwi,in the case that I’d rather not care to hear about that either
30-08-2020T01:32:04,SpazztasticKiwi,I know of it & stuff like it unfortunately but I don’t care about others’ personal business
30-08-2020T01:33:14,CrRAR,indeed
30-08-2020T01:33:49,SpazztasticKiwi,more of a bad feeling with things like that - it’s not against you and your fun of course
30-08-2020T01:37:27,SpazztasticKiwi,I remember I made an account on that forums thing but I don’t have a real interest in it - no clue how or where to start really and there’s a ton of junk there
30-08-2020T01:38:14,CrRAR,It has its moments
30-08-2020T01:38:59,SpazztasticKiwi,but uh I do got a question/point of interest
30-08-2020T01:39:03,CrRAR,there were parts of it that were more active in the past
30-08-2020T01:39:06,CrRAR,oh?
30-08-2020T01:40:03,SpazztasticKiwi,"when you two pass at however old and it’s time to go through the belongings, depending on which of you has kids if either and how many there are"
30-08-2020T01:40:40,SpazztasticKiwi,there’s an elephant that’ll be in the room on the what how why who and general “????????” of dad/uncle Insert Name Here
30-08-2020T01:41:04,Dadrobit,"Back, sorry, in the middle of cooking."
30-08-2020T01:41:07,SpazztasticKiwi,has a bunch of dildos and toys in their special storage box in the basement
30-08-2020T01:41:13,Dadrobit,"But yeah, I defo get it."
30-08-2020T01:41:25,SpazztasticKiwi,cause like
30-08-2020T01:41:33,Dadrobit,Throwing dildos at your siblings at their birthday isn't for everyone.
30-08-2020T01:41:57,SpazztasticKiwi,do you two keep everything you send each other? sell the extreme ones? destroy them? try to return them?
30-08-2020T01:42:06,Dadrobit,Keep most of em.
30-08-2020T01:42:23,Dadrobit,They have a special place deep in my closet.
30-08-2020T01:42:25,SpazztasticKiwi,oh the subject isn’t what made me itchy it was the conversation for shock factor in from of the gf
30-08-2020T01:42:41,Dadrobit,"Yeah, she's no longer in the picture."
30-08-2020T01:43:09,CrRAR,lol
30-08-2020T01:43:19,SpazztasticKiwi,I don’t know y’alls relationships so I’ll leave that be cause I’m sure you had an understanding of what would be too far between yourselves and her/in front of her
30-08-2020T01:43:44,SpazztasticKiwi,"but if I had a fresh boyfriends brother do something like that, I’d be outie"
30-08-2020T01:43:46,SpazztasticKiwi,that’s all
30-08-2020T01:44:35,SpazztasticKiwi,noooooot my cup of tea when dating someone.....at least not in the first yearish
30-08-2020T01:45:19,SpazztasticKiwi,but ya so... y’all just keep em in your closet with one or two on display? how do you plan to handle that if/when kids happen
30-08-2020T01:45:42,Dadrobit,"Whole family is shock factor based. Grandad still does the ""rip off my shirt"" thing at restaurants."
30-08-2020T01:45:54,SpazztasticKiwi,.......are they gonna be in the will (specified as never used for more than props)
30-08-2020T01:46:24,Dadrobit,"""Lightly used, excellent condition, lube included"""
30-08-2020T01:46:31,CrRAR,haha
30-08-2020T01:46:31,SpazztasticKiwi,do kids and grandkids to....pass around/ burn along with their claim to the family
30-08-2020T01:46:41,SpazztasticKiwi,"for, not “do”"
30-08-2020T01:46:50,CrRAR,Two boxes in the basement
30-08-2020T01:46:56,CrRAR,"One: ""Unused"""
30-08-2020T01:47:02,CrRAR,"Other: ""???"""
30-08-2020T01:47:16,CrRAR,or blank just to stoke the imaginations
30-08-2020T01:47:21,SpazztasticKiwi,nah the other ones labeled “you feeling lucky punk?”
30-08-2020T01:47:31,CrRAR,haha
30-08-2020T01:47:53,Dadrobit,"Just label it ""Pandora's"""
30-08-2020T01:48:05,Dadrobit,That which has been opened can never be closed
30-08-2020T01:48:07,CrRAR,"if there's on old safe down there, prime thing to load it up with"
30-08-2020T01:48:53,SpazztasticKiwi,"“granddad said his most prized treasure and fortune was in this safe....now that he’s gone, we have access to the combination”"
30-08-2020T01:49:16,CrRAR,haha yes
30-08-2020T01:49:23,CrRAR,it will keep your descendants or whoever inherits the house in awe  for generations
30-08-2020T01:49:25,SpazztasticKiwi,🏠 ➡️ 💥
30-08-2020T01:49:44,SpazztasticKiwi,and keep them sucking up to you/nice till you die
30-08-2020T01:49:53,CrRAR,haha
30-08-2020T01:50:02,SpazztasticKiwi,add pictures of you giving the finger for extra measure
30-08-2020T01:50:10,CrRAR,"""He's got a safe, got to be somethin gud"""
30-08-2020T01:50:27,SpazztasticKiwi,I can be evil too
30-08-2020T01:50:38,Dadrobit,"Back, fucked up dinner. RIP"
30-08-2020T01:50:42,SpazztasticKiwi,shock humor is most of me in real life too
30-08-2020T01:50:49,CrRAR,:crown:
30-08-2020T01:50:51,SpazztasticKiwi,oh noes what way it
30-08-2020T01:50:58,SpazztasticKiwi,was
30-08-2020T01:51:05,Dadrobit,Ramen and tilapia.
30-08-2020T01:51:07,SpazztasticKiwi,what are the casualties
30-08-2020T01:51:16,CrRAR,is the ramen or tilapia the loss?
30-08-2020T01:51:23,Dadrobit,I cook the ramen as a pho for the tilapia
30-08-2020T01:51:30,CrRAR,something tells me the more delicate thing
30-08-2020T01:51:30,Dadrobit,So both
30-08-2020T01:51:39,CrRAR,damnnit
30-08-2020T01:51:53,Dadrobit,Risked coming back to chat and the water evaporated in that minute or two
30-08-2020T01:52:01,Dadrobit,burnt the bottom of the pot.
30-08-2020T01:52:04,CrRAR,:fish:
30-08-2020T01:52:09,CrRAR,*salty fish sobs*
30-08-2020T01:52:18,Dadrobit,"Added some water to try and salvage, just made the ramaining noodles mushy"
30-08-2020T01:52:30,CrRAR,dangit
30-08-2020T01:52:55,CrRAR,What's plan B?
30-08-2020T01:52:58,SpazztasticKiwi,is this one better https://m.youtube.com/watch?v=cdEQmpVIE4A
30-08-2020T01:53:01,Dadrobit,eat it
30-08-2020T01:53:17,SpazztasticKiwi,or this https://m.youtube.com/watch?v=_O1hM-k3aUY
30-08-2020T01:53:57,SpazztasticKiwi,just eat it
30-08-2020T01:53:57,Dadrobit,I am yes
30-08-2020T01:54:00,CrRAR,wow
30-08-2020T01:54:05,CrRAR,really sold it though
30-08-2020T01:54:13,Dadrobit,I actually might not be able to eat this.
30-08-2020T01:54:18,Dadrobit,noodles too mush
30-08-2020T01:54:49,SpazztasticKiwi,https://m.youtube.com/watch?v=ZcJjMnHoIBI
30-08-2020T01:55:10,CrRAR,blend it
30-08-2020T01:55:36,SpazztasticKiwi,I call bs
30-08-2020T01:55:46,SpazztasticKiwi,everyone knows a watched pot never boils
30-08-2020T01:55:58,CrRAR,johnny earlier nearly destroyed his eggs
30-08-2020T01:56:05,CrRAR,so it's a bad night for food
30-08-2020T01:56:07,SpazztasticKiwi,wat
30-08-2020T01:56:16,SpazztasticKiwi,oh chat person
30-08-2020T01:56:33,SpazztasticKiwi,it was about to be like one of those math problems
30-08-2020T01:56:40,CrRAR,johnnytho was making an omlette but messed it up somehow and settled on just eggs
30-08-2020T01:56:43,SpazztasticKiwi,“Jonny has 14 bottles of soap”
30-08-2020T01:56:49,SpazztasticKiwi,who’s Jonny
30-08-2020T01:56:57,CrRAR,yeah caht person
30-08-2020T01:56:59,SpazztasticKiwi,why’s he got so many soaps
30-08-2020T01:57:00,CrRAR,chat
30-08-2020T01:57:05,CrRAR,lol
30-08-2020T01:57:11,CrRAR,uhh
30-08-2020T01:57:19,CrRAR,He's one of those extreme couponers?
30-08-2020T01:57:23,SpazztasticKiwi,“mind you business David”
30-08-2020T01:57:29,SpazztasticKiwi,it’s a vine
30-08-2020T01:57:40,SpazztasticKiwi,I’m referencing a vine
30-08-2020T01:58:06,CrRAR,"I knew someone that was an extreme couponer, they'd fill whole romms of their house with basically free stuff"
30-08-2020T01:58:38,CrRAR,All like cases of dish soaps and other cleaning products mostly
30-08-2020T01:59:00,SpazztasticKiwi,https://m.youtube.com/watch?v=FHpQFHjcP_k
30-08-2020T01:59:00,CrRAR,it's like a sport
30-08-2020T01:59:06,CrRAR,pretty cool actually
30-08-2020T01:59:19,CrRAR,oh lol
30-08-2020T01:59:25,SpazztasticKiwi,accepted hoarding
30-08-2020T02:00:13,CrRAR,I like that johnny has a name label
30-08-2020T02:00:26,CrRAR,just to be ~perfectly~ clear
30-08-2020T02:00:29,CrRAR,haha
30-08-2020T02:01:24,SpazztasticKiwi,chat or the vine Johnny
30-08-2020T02:02:13,SpazztasticKiwi,my favorite vines will always be Thomas Sanders & Daz Black but there’s also the “go back to sleep and starve” girl
30-08-2020T02:03:47,CrRAR,the vine johnny
30-08-2020T02:04:21,CrRAR,lol
30-08-2020T02:05:58,SpazztasticKiwi,we used to have good entertainment
30-08-2020T02:06:03,SpazztasticKiwi,we used to have vine
30-08-2020T02:06:05,SpazztasticKiwi,https://m.youtube.com/watch?v=5PoyHNLwyxY
30-08-2020T02:06:16,SpazztasticKiwi,but now we got tik tok
30-08-2020T02:07:27,CrRAR,Can’t possibly make sandwich
30-08-2020T02:07:30,CrRAR,https://gfycat.com/corruptfocusedamericanquarterhorse
30-08-2020T02:07:38,CrRAR,mouse has knife
30-08-2020T02:08:12,SpazztasticKiwi,Daz Black https://m.youtube.com/watch?v=4NVOKhsy4Kk
30-08-2020T02:08:36,SpazztasticKiwi,oooooh yeah I’ve seen knife mouse
30-08-2020T02:08:49,CrRAR,oh jeez it's tea party guy
30-08-2020T02:09:07,SpazztasticKiwi,also that’s a hamster
30-08-2020T02:09:23,CrRAR,even worse
30-08-2020T02:09:34,CrRAR,that means it's potentially TRAINED
30-08-2020T02:09:39,CrRAR,:ctwokinds-zenshocked:
30-08-2020T02:10:21,AspiringNoodle,Give the mouse some cheese
30-08-2020T02:10:24,AspiringNoodle,AND NOBODY GETS GOT
30-08-2020T02:10:38,SpazztasticKiwi,Thomas still makes stuff and one of my favorites from him now is Strange Measurements to Take
30-08-2020T02:10:52,CrRAR,[en guarde]*:ctwokinds-smug::crossed_swords::mouse2:
30-08-2020T02:11:27,SpazztasticKiwi,"but his good vine stuff is calling shotgun, what’s the matter are you in a hurry, the ocd one at the gas station"
30-08-2020T02:12:03,SpazztasticKiwi,"and one I shared awhile ago, “ I’ll get it done todaaaaaaaaaaaaaa-tomorrow”"
30-08-2020T02:12:20,CrRAR,this one karate dude used a tape measure to puzzle and assault another karate dude under the pretense of a measurement
30-08-2020T02:12:41,SpazztasticKiwi,I’m pretty sure I know what you’re talking about
30-08-2020T02:12:50,CrRAR,yay
30-08-2020T02:14:07,Dadrobit,Was it a swinging nutshot measurement?
30-08-2020T02:14:11,SpazztasticKiwi,you measure the guy from his head to his crotch (going down so the tip is held on his hair) then lift the tape
30-08-2020T02:14:23,Dadrobit,Cuz that one's as old as construction workers themselves.
30-08-2020T02:14:31,SpazztasticKiwi,measure to make a right angle and release
30-08-2020T02:14:41,SpazztasticKiwi,cracks em right in the nuts
30-08-2020T02:15:03,CrRAR,yup that was it lol
30-08-2020T02:15:14,SpazztasticKiwi,"I’m not surprised it has a name, just that I didn’t know it yet"
30-08-2020T02:15:20,Dadrobit,"Yup, every new guy in every construction contract everywhere has gone through that."
30-08-2020T02:15:41,SpazztasticKiwi,it’s so mean but I want to find a sucker to pull it on
30-08-2020T02:15:50,SpazztasticKiwi,you feel?
30-08-2020T02:16:00,CrRAR,t e m p t i n g
30-08-2020T02:16:06,CrRAR,cruel
30-08-2020T02:16:15,CrRAR,but t e m p t i n g
30-08-2020T02:16:35,SpazztasticKiwi,"but no boyfriend, no brother, not even a close male cousin - all my immediate cousins are female unless you count the two male stepcousins"
30-08-2020T02:16:56,SpazztasticKiwi,and I don’t see survival in trying it on a stranger of someone I don’t know well
30-08-2020T02:17:02,SpazztasticKiwi,or not of
30-08-2020T02:17:03,Dadrobit,Do that to a boyoand you no longer have a boyfriend.
30-08-2020T02:17:11,Dadrobit,Boyfriend and*
30-08-2020T02:17:25,CrRAR,trust :boom:
30-08-2020T02:17:38,Dadrobit,Nutshot pranks are reserved for the dudes.
30-08-2020T02:17:40,SpazztasticKiwi,nah I’m not serious on the boyfriend front
30-08-2020T02:17:44,CrRAR,also boyfriend-hood :boom:
30-08-2020T02:18:05,SpazztasticKiwi,I’d try it more seriously on a friend cause we all did shot like that to each other in school all the time
30-08-2020T02:18:21,CrRAR,I can see that
30-08-2020T02:18:27,SpazztasticKiwi,there’s one thing I want to test with a boyfriend tho if anyone wants to see what inspired it
30-08-2020T02:18:31,Dadrobit,"Guys can get away with it because we understand, there 100% is going to be revenge for it."
30-08-2020T02:18:56,CrRAR,hoodlum humor
30-08-2020T02:19:06,CrRAR,shoving friends in pools
30-08-2020T02:19:18,CrRAR,"tape measure ""tricks"""
30-08-2020T02:19:20,Dadrobit,"Girls do it to a guy? You can't get revenge on a girl, so instead you just ostracize them."
30-08-2020T02:19:21,CrRAR,etc
30-08-2020T02:21:13,SpazztasticKiwi,we were a mixed breed in hs
30-08-2020T02:21:28,SpazztasticKiwi,not a whole lot was forbidden
30-08-2020T02:22:01,SpazztasticKiwi,but still I did things with and to friends I never crossed with my bf of the time
30-08-2020T02:22:10,CrRAR,what a beautiful experiment adolescence is
30-08-2020T02:22:35,SpazztasticKiwi,"in reality, I have different couples goals"
30-08-2020T02:22:38,SpazztasticKiwi,https://media.discordapp.net/attachments/524825976597643265/749891334692929546/image0.jpg
30-08-2020T02:22:50,CrRAR,"it's actually more like mad science, but still"
30-08-2020T02:22:57,Dadrobit,Literally never thought that.
30-08-2020T02:23:02,SpazztasticKiwi,"“honey, come her a second I got a quest”"
30-08-2020T02:23:05,SpazztasticKiwi,here
30-08-2020T02:23:12,Dadrobit,Made jokes about sailors making doughnuts like that.
30-08-2020T02:23:17,Dadrobit,But never for myself.
30-08-2020T02:23:29,SpazztasticKiwi,couples horseshoe
30-08-2020T02:23:42,Dadrobit,"Also, ngl, saying ""mixed breed"" in a furry chat, you play a sly game"
30-08-2020T02:24:06,SpazztasticKiwi,I mean it literally in a sense but ay I’ll take it
30-08-2020T02:24:59,SpazztasticKiwi,legit made me want to get on the boyfriend train to at least ask if it was a thing and if he could/how many he could
30-08-2020T02:25:08,SpazztasticKiwi,the curiosity train like 🚂
30-08-2020T02:25:13,CrRAR,that's cruel and unusual punishment for donuts
30-08-2020T02:25:22,SpazztasticKiwi,or foreplay
30-08-2020T02:25:49,SpazztasticKiwi,(you have no idea how fast that popped out of me - I couldn’t control my typing fingers)
30-08-2020T02:27:24,SpazztasticKiwi,"Thomas Sanders, “Strange Measures to Take”: https://www.instagram.com/p/B7mQyeXJIZn/?igshid=wa3bv88tg25o"
30-08-2020T02:28:08,CrRAR,lol
30-08-2020T02:28:17,SpazztasticKiwi,“I like feet”
30-08-2020T02:28:39,SpazztasticKiwi,the context and content for the usa
30-08-2020T02:28:39,CrRAR,:ctwokinds-keithdotdotdot:
30-08-2020T02:28:42,SpazztasticKiwi,spot on
30-08-2020T02:29:06,CrRAR,"I have heard that the US tried metric at one point, however people rejected it"
30-08-2020T02:29:19,CrRAR,that does sound like a thing America would do
30-08-2020T02:29:30,SpazztasticKiwi,they tried the switch when I was in school but I can’t for the life of me tell you which grade
30-08-2020T02:29:44,SpazztasticKiwi,Thomas is golden and I love him
30-08-2020T02:32:00,SpazztasticKiwi,"if I ever reference “story time”, it’s thomas Sanders"
30-08-2020T02:32:14,SpazztasticKiwi,ok why didn’t you capitalize his first name that time
30-08-2020T02:32:32,CrRAR,not the beginning of a sentence?
30-08-2020T02:33:36,SpazztasticKiwi,autocorrect has learned Thomas from the many times I’ve typed his name
30-08-2020T02:33:53,SpazztasticKiwi,"also, some names are autocapitalized for being common"
30-08-2020T02:34:03,SpazztasticKiwi,Thomas’s is one of those
30-08-2020T02:34:10,CrRAR,autocorrect elves must be on break
30-08-2020T02:34:15,SpazztasticKiwi,like Joe
30-08-2020T02:34:19,SpazztasticKiwi,and John
30-08-2020T02:34:27,CrRAR,ye
30-08-2020T02:34:29,CrRAR,yes
30-08-2020T02:34:34,CrRAR,biblical
30-08-2020T02:34:43,SpazztasticKiwi,unfortunately that does nothing to help you
30-08-2020T02:34:44,CrRAR,wait
30-08-2020T02:34:50,CrRAR,maybe not Joe
30-08-2020T02:34:55,CrRAR,but Joseph
30-08-2020T02:35:06,SpazztasticKiwi,... and Johnny
30-08-2020T02:35:13,SpazztasticKiwi,full circle
30-08-2020T02:35:28,CrRAR,ahh yes
30-08-2020T02:36:02,TerraTheWizard,:ctwokinds-renirar:
30-08-2020T02:36:17,CrRAR,:cw0lfmare-ReniRawr:
30-08-2020T02:47:10,SpazztasticKiwi,🐉 nomnomnomnomnom
30-08-2020T02:50:16,CrRAR,Ferdy got eats?
30-08-2020T02:54:34,TerraTheWizard,just had a peek at the vod
30-08-2020T02:54:40,TerraTheWizard,i see i maintain my winlose streak
30-08-2020T02:55:07,TerraTheWizard,:ctwokinds-FloDance:
30-08-2020T02:56:54,TerraTheWizard,"16 sketches, 0 coloured"
30-08-2020T02:57:21,TerraTheWizard,"well, except for the two fan colourings by ironhorse and darthkeidran"
30-08-2020T02:57:51,TerraTheWizard,:ctwokinds-katwet:
30-08-2020T02:59:51,CrRAR,"haha, valient effort, someday"
30-08-2020T03:04:51,SpazztasticKiwi,yeah he got his mice hours ago
30-08-2020T03:04:54,SpazztasticKiwi,yet to eat
30-08-2020T03:05:22,SpazztasticKiwi,did dadro leave to try the doughnutdick experiment or somethin
30-08-2020T03:05:26,Dadrobit,"o ya, I need to watch the vod for the results."
30-08-2020T03:05:28,SpazztasticKiwi,he poofed
30-08-2020T03:05:34,SpazztasticKiwi,or nah
30-08-2020T03:05:35,Dadrobit,Guessing vixen mike made it 100%
30-08-2020T03:06:01,SpazztasticKiwi,"snek, I’m guessing, no like being watched when he eats"
30-08-2020T03:06:10,SpazztasticKiwi,so he’s waiting for the lights to go out
30-08-2020T03:06:23,SpazztasticKiwi,if they’re still there tomorrow I’ll take em out
30-08-2020T03:06:33,SpazztasticKiwi,he might be close to shedding or something
30-08-2020T03:08:24,AspiringNoodle,Dadro
30-08-2020T03:08:38,AspiringNoodle,There is a 0 - 100% chance that 0 or more vixen mikes made it into color
30-08-2020T03:08:50,AspiringNoodle,:snake:
30-08-2020T03:09:07,AspiringNoodle,"I see u lurkin' there, kame"
30-08-2020T03:09:48,Kameloh,:ckameloh-naokieyes:
30-08-2020T03:10:45,Dadrobit,"Damn, twin vixen Mikes. Rough week."
30-08-2020T03:11:01,Dadrobit,"I mean, I figured it'd be like that, but still."
30-08-2020T03:11:23,Dadrobit,Least Brutus Poker made it in
30-08-2020T03:11:59,CrRAR,"Yeah, snakes, they feel vulnerable when eating esp larger things, so gotta feel safe."
30-08-2020T03:17:56,SpazztasticKiwi,kame what you doin here
30-08-2020T03:18:01,SpazztasticKiwi,it’s 3 am
30-08-2020T03:18:20,SpazztasticKiwi,poker Brutus has blep
30-08-2020T03:18:28,Kameloh,I'm uhh
30-08-2020T03:18:49,Kameloh,:ckameloh-naokieyes:
30-08-2020T03:19:05,Kameloh,playing with AI :snail:
30-08-2020T03:19:10,Dadrobit,"Poker Brutus was me my first game. I dunno why I have all these chips, but I guess I'll just take more of em."
30-08-2020T03:19:30,SpazztasticKiwi,playing with ai
30-08-2020T03:19:33,SpazztasticKiwi,or al
30-08-2020T03:19:41,SpazztasticKiwi,I know two ai’s
30-08-2020T03:20:02,Dadrobit,Dragon AI Kame?
30-08-2020T03:20:10,Kameloh,:ckameloh-naokicool:
30-08-2020T03:20:11,SpazztasticKiwi,and generally I don’t really know what you’re talking about
30-08-2020T03:20:31,SpazztasticKiwi,I honestly could and should use the slepp
30-08-2020T03:20:38,Kameloh,sleep is good!
30-08-2020T03:20:42,Dadrobit,I gotchu fam
30-08-2020T03:20:51,Dadrobit,"Have a good night, Spazz"
30-08-2020T03:21:10,SpazztasticKiwi,but internet
30-08-2020T03:26:28,AspiringNoodle,"Well, kame does know how to code"
30-08-2020T03:26:36,AspiringNoodle,So... story accepted
30-08-2020T03:26:49,AspiringNoodle,What the AI gunna do? :snail:
30-08-2020T03:31:34,CrRAR,:zzz:
30-08-2020T03:31:37,CrRAR,:chipmunk:
30-08-2020T03:37:13,SpazztasticKiwi,thaaaaat ai
30-08-2020T03:37:17,SpazztasticKiwi,got it
30-08-2020T03:37:25,SpazztasticKiwi,"also, what do you got for me dadro"
30-08-2020T03:51:48,Dadrobit,I was actually saying it to Kame.
