date,user,comment
05-05-2018T00:00:07,Vatruvius,"I know, that is what I am hoping for."
05-05-2018T00:55:50,Vatruvius,"Oh look, Tom is here! Hey Tom! :ptv-greetings:"
05-05-2018T01:29:45,unsteddyphoenix,Tom I noticed that anime reference you made last stream
05-05-2018T01:29:56,unsteddyphoenix,You thought you got away with it~
05-05-2018T01:30:42,Bgrmystr2,:thinking:
05-05-2018T01:34:44,Vatruvius,Anime reference?
05-05-2018T01:37:49,SpazztasticKiwi,What are we still doing up
05-05-2018T01:38:13,Bgrmystr2,:ptv-wondering: The question is.. what are YOU guys still doing up?
05-05-2018T01:38:23,Bgrmystr2,You probably have stuff to do tomorrow.
05-05-2018T01:38:45,SpazztasticKiwi,My cat’s sick and I’m don’t have work tomorrow
05-05-2018T01:38:55,SpazztasticKiwi,* I don’t
05-05-2018T01:41:12,Vatruvius,"It is the weekend, I am just sitting at home getting stuff done when I want to."
05-05-2018T01:44:46,Bgrmystr2,"lol, meh"
05-05-2018T01:45:12,Bgrmystr2,weekends are no different to me than weekdays atm
05-05-2018T02:57:57,Twokinds,Cats are so greedy for attention.
05-05-2018T03:00:52,unsteddyphoenix,:ctwokinds-katdryer: Shes drawn to your suffering
05-05-2018T03:01:23,unsteddyphoenix,More affectionate when your allergies are kicking in
05-05-2018T03:01:44,Twokinds,I need to buy a spray bottle
05-05-2018T03:02:02,unsteddyphoenix,Absolutely not!
05-05-2018T03:02:21,unsteddyphoenix,Just be affectionate back and she'll leave you alone
05-05-2018T03:02:51,unsteddyphoenix,Im pretty sure thats how cats work
05-05-2018T03:06:06,iliar,"All cats are different. For example, my friends have two cats. I know that they have it. I see that the cat's food is somewhere and then there are shit in the cat's toilet. I even saw the cats themselves ... once or twice."
05-05-2018T03:06:11,iliar,But most of the time they hide like real ninjas.
05-05-2018T03:06:43,Bgrmystr2,"be affectionate once, and they'll never leave you the fuck alone"
05-05-2018T03:06:54,Bgrmystr2,"otherwise, they would have avoided you from the beginning."
05-05-2018T03:07:10,Bgrmystr2,literally every single cat I've encountered is one or the other.
05-05-2018T03:07:17,Bgrmystr2,and I've met a lot
05-05-2018T03:09:52,SpazztasticKiwi,Mine are pretty affectionate. Bagheera will literally yell at you for ignoring him though
05-05-2018T03:11:25,Twokinds,"My cat, if I ignore her she ignores me."
05-05-2018T03:11:39,Twokinds,"But if I pet her, she wants pets. Pets. Pets. More pets. Pay attention!"
05-05-2018T03:11:59,SpazztasticKiwi,Well you offered first.
05-05-2018T03:12:06,SpazztasticKiwi,“Pet time? Ok”
05-05-2018T03:12:14,Twokinds,yeah but it's like... I can't pet you all day I've got work!
05-05-2018T03:12:27,Twokinds,@_@
05-05-2018T03:12:37,zolstarym,Mine makes the saddest most pathetic meows at me when she is hungry
05-05-2018T03:12:39,Bgrmystr2,TOO LATE! Pet time :kissing_cat:
05-05-2018T03:12:46,zolstarym,she knows my weakness
05-05-2018T03:12:55,SpazztasticKiwi,Too bad. Cats run on affection and kibble
05-05-2018T03:12:58,iliar,No. They are not afraid of me or anyone else. Sometimes (very rarely) they may seem. Will receive a portion of attention and then just dissolve.
05-05-2018T03:12:58,unsteddyphoenix,Ehhh
05-05-2018T03:13:03,SpazztasticKiwi,And some run on spite
05-05-2018T03:13:05,unsteddyphoenix,less work more peat
05-05-2018T03:13:15,Bgrmystr2,xD ^
05-05-2018T03:13:27,Bgrmystr2,'peat'
05-05-2018T03:14:10,SpazztasticKiwi,"The advantages of having a get out of the house job is I do get breaks from getting pestered, but Bagheera and Kiwi both are also often content to sit in my lap"
05-05-2018T03:14:42,SpazztasticKiwi,I can’t pet? They sit and let me know they’re there
05-05-2018T03:15:14,SpazztasticKiwi,Unless I’m on YouTube. Both have mixed feelings about certain YouTubers
05-05-2018T03:17:28,SpazztasticKiwi,Holly could be telling you you work too much too. Petting her may not be the best for your comfort but neither is working constantly
05-05-2018T03:26:10,unsteddyphoenix,Lol
05-05-2018T03:27:18,unsteddyphoenix,Thats pretty optmistic
05-05-2018T03:28:07,unsteddyphoenix,Shes probably confused about why Toms doing other things that arent related to her.
05-05-2018T03:38:54,SpazztasticKiwi,“What you you doing? Looks fun. Can I help? Pet me.”
05-05-2018T03:54:43,SpazztasticKiwi,In other news I got Bagheera to eat some more
05-05-2018T04:02:04,SpazztasticKiwi,"And with him seeming to be more stable, I’m going on to bed"
05-05-2018T04:32:30,NickTheName,Good Morning!
05-05-2018T07:54:41,NightMeaty22,Good morning everyone
05-05-2018T10:56:10,Vatruvius,Morning everyone! :ptv-greetings:
05-05-2018T10:56:26,Vatruvius,Hey Tom! Sifting through all the suggestion?
05-05-2018T11:19:34,Twokinds,Sorta
05-05-2018T11:21:18,Vatruvius,Just doing some between other things?
05-05-2018T11:38:52,Twokinds,"Comic, actually."
05-05-2018T11:39:25,Vatruvius,Ah...the speech/thought bubbles.
05-05-2018T11:40:17,Twokinds,"Yeah, it's a pain in the butt sometimes."
05-05-2018T11:40:32,Twokinds,"Especially when my cat keeps going ""hey, hey, what are you talking about? Hey!"""
05-05-2018T11:41:55,Xexanoth,"if your cat is talking to you, you probably should see a doctor"
05-05-2018T11:41:59,Vatruvius,lol
05-05-2018T11:42:04,Xexanoth,:ptv-shock:
05-05-2018T11:42:30,Vatruvius,The speech bubbles are getting to him.
05-05-2018T11:42:48,Xexanoth,or he just has a magic cat
05-05-2018T11:43:18,Vatruvius,It was Nora the whole time! :ptv-laugh:
05-05-2018T11:43:42,NickTheName,"if you see a doctor, you probably should  talk to your cat."
05-05-2018T11:44:19,Vatruvius,:thinking:
05-05-2018T11:45:01,iliar,"Technically, it's a lot like Tom talking to his cat. Tom talking and in the room is no one else in the room except the cat and Tom."
05-05-2018T11:46:57,Vatruvius,Let me know if my sketch suggestion does not work Tom.
05-05-2018T11:47:05,Vatruvius,If you get to it.
05-05-2018T11:57:21,iliar,New page http://twokinds.keenspot.com/comic/1026/
05-05-2018T11:57:41,NickTheName,Thank you
05-05-2018T11:58:37,Vatruvius,"One sec, gotta read."
05-05-2018T12:00:43,Vatruvius,Very cool! Totally forgot that Zen would know everything Natani went through.
05-05-2018T12:04:56,Vatruvius,Now I am looking forward to the face to face Zen and Keith confrontation.
05-05-2018T12:05:00,Vatruvius,:ptv-ohmy:
05-05-2018T12:20:46,SpazztasticKiwi,Maybe that’s why she hovers around him so much. Wondering why he’s sitting at that glowing window muttering to himself
05-05-2018T12:21:19,SpazztasticKiwi,“Must check my human to make sure he is not going crazy”
05-05-2018T12:29:53,MidnightBlue78,Hi guys
05-05-2018T12:29:59,MidnightBlue78,:ptv-greetings:
05-05-2018T12:30:28,NickTheName,good evening
05-05-2018T12:31:35,Vatruvius,Hello!
05-05-2018T12:32:33,NickTheName,Oh wait... different time zone... Good afternoon? :D
05-05-2018T12:33:11,Vatruvius,"Still morning for me, 10:30."
05-05-2018T12:35:05,NickTheName,"As you might guess, it is evening here (19:34)"
05-05-2018T12:35:20,NickTheName,¯\_(ツ)_/¯
05-05-2018T13:15:05,Vatruvius,"Why are my Z, X, and CTRL keys working now! They were not working for weeks and not even this morning and now they are responding as if nothing has been going on!?"
05-05-2018T13:15:10,Vatruvius,Z
05-05-2018T13:15:11,Vatruvius,X
05-05-2018T13:15:15,Vatruvius,Agh!
05-05-2018T13:17:17,PhilTheIdle,@Nick We have the same time zone. Yay!
05-05-2018T13:18:48,NickTheName,"How can you survive weeks without Z, X and CTRL?"
05-05-2018T13:19:04,NickTheName,@Phil MESZ Masterrace!
05-05-2018T13:19:13,Vatruvius,"It has been rough, let me tell you."
05-05-2018T13:19:55,NickTheName,CEST*
05-05-2018T13:20:43,Vatruvius,"I can't play 95% of the games I own because of thr controls that are bound to Z, X, or CTRL."
05-05-2018T13:20:51,Vatruvius,the*
05-05-2018T13:21:12,PhilTheIdle,@Vatruvius You can change controls.
05-05-2018T13:21:23,PhilTheIdle,@Nick I know my time zone.
05-05-2018T13:21:59,Vatruvius,I know I can. Just muscle memory and some games have too many controls.
05-05-2018T13:22:18,NickTheName,Why didn't you buy a new keyboard?
05-05-2018T13:22:23,PhilTheIdle,"Ok, that's a thing."
05-05-2018T13:24:15,NickTheName,@Phill where are you from?
05-05-2018T13:24:22,PhilTheIdle,Germany
05-05-2018T13:24:33,PhilTheIdle,"Oh, it's one ""l"""
05-05-2018T13:24:50,PhilTheIdle,What about you?
05-05-2018T13:26:06,NickTheName,Also Germany (near luxemburg border)
05-05-2018T13:26:56,Vatruvius,It is a laptop keyboard.
05-05-2018T13:27:29,PhilTheIdle,"I'm from Fulda, in the east of hessia."
05-05-2018T13:33:17,NickTheName,@Vatruvius That sucks
05-05-2018T13:34:10,Vatruvius,"Got it repaired and it happened again, now it works fine."
05-05-2018T13:34:28,Vatruvius,I am skeptical.
05-05-2018T13:34:48,PhilTheIdle,for good reason i suppose
05-05-2018T13:35:16,NickTheName,"@Phill with one ""l"" I Hate the west Hessian ""Autobahn""...  construction sites everywhere"
05-05-2018T13:36:21,PhilTheIdle,I didn't even notice one.
05-05-2018T13:38:52,SiliconCarbide,huh more germans? look at that
05-05-2018T13:38:58,NickTheName,"1-2 years ago I was once visiting there and every few kilometers greeted me with a sign saying  ""Oh Je eine Baustelle"""
05-05-2018T13:39:13,PhilTheIdle,You too? @SiliconCarbrde
05-05-2018T13:39:16,SiliconCarbide,yep
05-05-2018T13:40:04,NickTheName,The GThe Germans will take over the world (again)!ermans Too
05-05-2018T13:40:16,PhilTheIdle,@Nick Well if you say so. I never leave my house so I don't really notive anything.
05-05-2018T13:40:25,NickTheName,xD
05-05-2018T13:40:47,SiliconCarbide,gotte get the austrians on board first
05-05-2018T13:41:21,NickTheName,But this time without italy!
05-05-2018T13:41:27,PhilTheIdle,"You mean, like Hindenburg did?"
05-05-2018T14:00:32,PhilTheIdle,Shouldn't the stream start right now?
05-05-2018T14:02:24,SiliconCarbide,na 1h still
05-05-2018T14:03:17,PhilTheIdle,Oh...ok
05-05-2018T14:04:18,Vatruvius,"Yeah, another hour."
05-05-2018T14:26:18,Twokinds,Suggestions need to be reasonable...
05-05-2018T14:26:34,Twokinds,"They can't have a lot of characters, or require multiple panels to work."
05-05-2018T14:30:16,BluePhantom90,so that short comic idea wont do?
05-05-2018T14:31:57,BadFoMo,Two (2) simple panels would be the max. ...I think.
05-05-2018T14:32:04,Vatruvius,Whoops more paragraphs this week? Was mine okay?
05-05-2018T14:32:21,BadFoMo,"...Also, is my request ok?"
05-05-2018T14:33:19,BluePhantom90,"I put (sort comic) about )King Adelaid's Mid life crisis, the desire for another child!"
05-05-2018T14:33:36,FenceEqualizer,B-but my novels! (Jk)
05-05-2018T14:35:05,Mippy,Did not think I would make it but the train decided to back up
05-05-2018T14:36:34,Twokinds,Uh...
05-05-2018T14:36:53,Twokinds,I don't care for the theme.
05-05-2018T14:36:57,Twokinds,To be honest.
05-05-2018T14:38:52,Twokinds,"Man, a lot of these suggestions I need to message the suggestor about. I just can't draw something inolving... 8 characters."
05-05-2018T14:39:10,Twokinds,"Also one's a spoiler for a movie I haven't seen yet, so... sigh... lol"
05-05-2018T14:39:27,BadFoMo,"So, I need to change mine?"
05-05-2018T14:39:27,Xexanoth,ouch
05-05-2018T14:39:27,CrRAR,tsk tsk
05-05-2018T14:39:31,BluePhantom90,I take the Avengers?
05-05-2018T14:39:34,InTheLionsDen,Veto and move on.
05-05-2018T14:39:34,CrRAR,that's diabolical XD
05-05-2018T14:39:35,Twokinds,Yeah.
05-05-2018T14:40:12,qwe304,"maybe just put them all on one screen after the last vote, next to an explination as to why they werent acceptable, that way people dont suggest somthing similar"
05-05-2018T14:40:30,BadFoMo,Would ‘Maeve buries Keith and Natani at the beach and fashion Merfolk tails for them while Maddie and Karen build Sandcastle forts.’ be ok?
05-05-2018T14:40:45,CrRAR,hehe
05-05-2018T14:41:02,BadFoMo,No second panel.
05-05-2018T14:41:17,CrRAR,I feel like that's a run-on suggestion.
05-05-2018T14:41:18,Twokinds,"Yes, that's fine."
05-05-2018T14:41:29,BadFoMo,Cool!
05-05-2018T14:41:31,Twokinds,"Well, it's a lot of characters."
05-05-2018T14:41:39,qwe304,"would ""noras first prank"" be a spoiler?"
05-05-2018T14:41:51,BluePhantom90,So would that ( short comic) with )King Adelaid's Mid life crisis be alright?
05-05-2018T14:42:10,FenceEqualizer,Might get some people upset at the call out...though someone spoiling a movie with it sucks big time
05-05-2018T14:42:16,Twokinds,"No. I can do it, but it'd have to be simplified. I can't make a comic."
05-05-2018T14:42:27,Twokinds,"It'd take too long on stream, it'd eat other suggestion's time."
05-05-2018T14:42:53,BluePhantom90,yeah I said maybe three panels at most
05-05-2018T14:42:54,qwe304,"I had infinity war spoiled before it even released in the US, dang australians"
05-05-2018T14:43:17,BadFoMo,Changed.
05-05-2018T14:43:18,Twokinds,"Nora's first prank... well, I don't know what that would be."
05-05-2018T14:43:29,Twokinds,I can draw something if someone tells me what the prank is.
05-05-2018T14:43:35,Twokinds,But suggestions have to be specific.
05-05-2018T14:43:40,qwe304,somthing hilarious hopefully
05-05-2018T14:43:50,BluePhantom90,wait didn't you already do one like that. When Nora gave a human girl Bunny ears?
05-05-2018T14:44:05,qwe304,that sounds familiar actually
05-05-2018T14:44:09,FenceEqualizer,Knowing Nora it'd probably involve changing going wrong heh
05-05-2018T14:44:09,qwe304,one sec
05-05-2018T14:44:10,Twokinds,"Yeah, it'd also be pretty similiar to thatone."
05-05-2018T14:44:22,Mippy,Cling wrap on the toilette.... IDK
05-05-2018T14:44:45,Xexanoth,Nora first prank would probably just be an accident...
05-05-2018T14:45:00,qwe304,tbh the point of my idea was just to get more young nora
05-05-2018T14:45:00,Xexanoth,and then she developed the taste for it
05-05-2018T14:45:03,Twokinds,I'm going to delay the sketch stream until Monday. I need to message some suggestors and give time to change things.
05-05-2018T14:45:06,BluePhantom90,Is this guy just trolling wanting You to do the same old ones but slightly altered? Because that Nat nuzzling Keith with a scarf was the same one just with the slight differance
05-05-2018T14:45:43,MarvTheHugPharaoh,Stream tomorrow then?
05-05-2018T14:45:52,Xexanoth,"Bleu Phantom, the suggestion didn't even have ""nuzzling"" in it"
05-05-2018T14:45:54,SiliconCarbide,awwwww
05-05-2018T14:45:58,Bgrmystr2,:thinking: okay tom
05-05-2018T14:46:14,Xexanoth,"it was something alonh the lines of ""keith gets a reward for giving Natani a scarf"""
05-05-2018T14:46:18,MarvTheHugPharaoh,If thats true the nighty night ya'll going back to bed &lt;3
05-05-2018T14:46:19,qwe304,"i'd say just message them and let them fix it for next time, there have always been suggestions that arent acceptable"
05-05-2018T14:46:42,qwe304,youve never delayed a stream for that before
05-05-2018T14:47:10,Mippy,"Some people just don't quite grasp the consept of ""Keep it simple, stupid"""
05-05-2018T14:47:15,BluePhantom90,same pic just a scarf added
05-05-2018T14:47:21,FenceEqualizer,Well that must be a lot of funky suggestions to delay a stream
05-05-2018T14:47:41,Xexanoth,"also you probably should put more guidelines for suggestion in, since the suggestion apparently become worse and worse...."
05-05-2018T14:48:14,FenceEqualizer,Is it worse and worse or just one week that was an explosion
05-05-2018T14:48:26,BadFoMo,Should I make a list of all my request that have been snubbed and invite others to add to the list so we know what NOT to request?
05-05-2018T14:48:48,FenceEqualizer,Errr...
05-05-2018T14:49:27,BadFoMo,...It might help. ...maybe.
05-05-2018T14:49:34,FenceEqualizer,Not sure if that'll help Tom might have to just make a new guideline
05-05-2018T14:50:00,FenceEqualizer,Or have it more in your face since chances are people just didn't read it
05-05-2018T14:50:06,Dadrobit,"Hmmmm, Tom. Have you seen Akira?"
05-05-2018T14:50:08,qwe304,&gt;4 characters should be made an official rule
05-05-2018T14:50:13,qwe304,*&lt;4
05-05-2018T14:50:18,Twokinds,I have no
05-05-2018T14:50:25,Twokinds,t
05-05-2018T14:50:37,MarvTheHugPharaoh,"its really good, would recommend"
05-05-2018T14:50:41,gone46,t time?
05-05-2018T14:50:43,FenceEqualizer,But..Akita is a classic!
05-05-2018T14:50:49,FenceEqualizer,Akira*
05-05-2018T14:51:02,NickTheName,t toast?
05-05-2018T14:51:13,MarvTheHugPharaoh,it will also help with dad suggestion
05-05-2018T14:51:17,Mippy,No opinion on Akira. I was ...like 13 when I saw it and haven't seen it since. Can't remember what happend
05-05-2018T14:51:29,TorqueEmUp,"It's good, I wouldn't say it's nearly as amazing as people let on, but still damn good."
05-05-2018T14:51:42,BadFoMo,"Trolls saying ""You have no tail?! You poor thing!""."
05-05-2018T14:51:45,Mippy,I remember being confused
05-05-2018T14:51:47,TorqueEmUp,Bought the Bluray recently and rewatched it with friends.
05-05-2018T14:51:48,FenceEqualizer,That's good enough
05-05-2018T14:52:10,FenceEqualizer,I remember man faced children
05-05-2018T14:52:19,TorqueEmUp,"But yeah, a good portion of the movie you are just like ""What the fuck is going on?!"""
05-05-2018T14:52:21,Dadrobit,"Yeah, it's actually amazing. Just re-watched it last month, absolutely classic."
05-05-2018T14:52:36,MarvTheHugPharaoh,and that slide
05-05-2018T14:52:39,Dadrobit,Hngggg
05-05-2018T14:52:40,MarvTheHugPharaoh,so good
05-05-2018T14:53:17,Dadrobit,"The slide is only about 7 minutes in, so it doesn't spoil too much lol."
05-05-2018T14:53:19,qwe304,I most likely wont be able to watch a monday stream :ctwokinds-LauraCry:
05-05-2018T14:53:27,TerraTheWizard,boop
05-05-2018T14:53:28,Vatruvius,"@BluePhantom90, the scarf sketch was mine. I did not specify nuzzling or anything, just ""Keith gets some unexpected feminine affection."" Tom did the rest."
05-05-2018T14:53:33,Dadrobit,Same. I got finals on Monday.
05-05-2018T14:53:34,TerraTheWizard,"oh, no stream today?"
05-05-2018T14:53:50,Twokinds,"Alright, I'll try."
05-05-2018T14:54:03,FenceEqualizer,No stream till tomorrow
05-05-2018T14:54:04,Dadrobit,We're throwing a party in the studio to watch everyone's projects with.
05-05-2018T14:54:04,iliar,"About Nora. I want know more about Trace and Nora relationship, but I don't know how to suggest it."
05-05-2018T14:54:13,iliar,"I mean, we almost do not know anything about the Trace and Nora relationship. I do not want to invent my own story. I want know canon story. Maybe you can get little spoilers, which could be used as a basis for sketch idias."
05-05-2018T14:54:30,Mippy,"I don't have to work Monday, so I'm one of those peopple who would be good"
05-05-2018T14:54:43,Dadrobit,"Professors are bringing the pizza, someone else's got the cookies, I'm bringing a home made pie."
05-05-2018T14:54:45,Vatruvius,I have no classes Monday so I am all good here!
05-05-2018T14:55:06,Mippy,"Dad,"
05-05-2018T14:55:09,Bgrmystr2,Doin jack diddly on monday so I'm fine as usual.
05-05-2018T14:55:13,FenceEqualizer,Dad stop! I don't want to think about delicious food now &gt;&lt;
05-05-2018T14:55:15,Mippy,That sounds pretty good
05-05-2018T14:55:16,BluePhantom90,I have to work money. e-e
05-05-2018T14:55:22,BluePhantom90,*Monday
05-05-2018T14:55:23,Dadrobit,Yes. Yes it does.
05-05-2018T14:55:32,Dadrobit,Easiest final exam ever.
05-05-2018T14:56:09,Dadrobit,"Professor already told me I got an A, so it's all cruise control for that class now."
05-05-2018T14:56:28,Dadrobit,Just one more written final on Tuesday and the semester is done.
05-05-2018T14:56:45,Mippy,Cool
05-05-2018T14:57:10,Mippy,I got mostly B's this sememester...
05-05-2018T14:57:30,Twokinds,Stream starts at 4:30
05-05-2018T14:57:32,Dadrobit,And it's whatever about the stream time either tomorrow or today. Gonna miss most/all of it anyway. Heading over to the grandma's house in an hour or so to hang out with her for a while.
05-05-2018T14:57:37,MarvTheHugPharaoh,oki dok Tom
05-05-2018T14:57:39,FenceEqualizer,"Illar, maybe short suggestions like the moment Nora realize she like Trace"" or something to that effect of course could be spoiler stuff but just keep things lite"
05-05-2018T14:57:42,Dadrobit,Ah well.
05-05-2018T14:57:42,Bgrmystr2,:ptv-wondering:
05-05-2018T14:57:51,Channelfiction,4:30 tomorrow?
05-05-2018T14:57:54,Mippy,@Twokinds Alright
05-05-2018T14:57:57,Twokinds,TODAY
05-05-2018T14:58:00,Channelfiction,Awesome!
05-05-2018T14:58:06,Bgrmystr2,:ptv-excited:
05-05-2018T14:58:08,Dadrobit,Lol.
05-05-2018T14:58:12,Twokinds,"Hopefully, my stomach problems go away before it starts."
05-05-2018T14:58:14,FenceEqualizer,I'll be here with my busted back stuck in bed
05-05-2018T14:58:26,Vatruvius,"Stomach problems, have you eaten yet?"
05-05-2018T14:58:26,Zakuru,ginger ale tom
05-05-2018T14:58:35,Mippy,That sounds horrible Fence
05-05-2018T14:58:42,MarvTheHugPharaoh,"Tom, do you have anything with peppermint, that helps sooth stomachs"
05-05-2018T14:58:43,Dadrobit,"Nah man, don't do it if you're not feeling well. S'only gonna make it worse on yourself."
05-05-2018T14:59:03,Twokinds,Don't have either of those things.
05-05-2018T14:59:05,TorqueEmUp,"Ooof, sorry to hear about stomach issues. Those are the worst."
05-05-2018T14:59:09,FenceEqualizer,"It is Mippy, also if you feel bad Tom don't force it"
05-05-2018T14:59:10,Twokinds,And it won't help.
05-05-2018T14:59:22,PhilTheIdle,You could try to ignore the pain.
05-05-2018T14:59:37,MarvTheHugPharaoh,"peppermint oil, I forgot to put oil -_-"
05-05-2018T14:59:59,iliar,@FenceEqualizer Well... It's not sounds like good suggestion. But it's better then nothing. Thank you.
05-05-2018T15:00:04,FenceEqualizer,So just peppermint?
05-05-2018T15:00:14,BluePhantom90,don't have a store near by to get some tums or pepto?
05-05-2018T15:00:14,TerraTheWizard,never even heard of peppermint oil before...
05-05-2018T15:00:25,PhilTheIdle,Me neither
05-05-2018T15:00:31,BadFoMo,Same.
05-05-2018T15:00:33,FenceEqualizer,It was an example don't have to use that just a way to keep things small
05-05-2018T15:00:36,Dadrobit,":/ That stuff never worked on me tbh. Always just Tums/Pepto Bismo, or purge it..."
05-05-2018T15:00:40,MarvTheHugPharaoh,well things like Altoids have it. and those help me out when ever I have stomach issues
05-05-2018T15:00:43,Vatruvius,Would any of you be interested in a sketch with Saria? Something to do with her relationship with Trace pre-comic or currently?
05-05-2018T15:00:46,TorqueEmUp,"or just any antacid really, I find Tums does jackshit."
05-05-2018T15:00:48,Mippy,I'm gonna be that person and say I have
05-05-2018T15:01:06,PhilTheIdle,@Vatruvius I liked Saria.
05-05-2018T15:01:13,qwe304,same phil
05-05-2018T15:01:13,Bgrmystr2,"tums is heartburn, Torque"
05-05-2018T15:01:14,Dadrobit,"That sounds maybe very spoiler heavy, vat."
05-05-2018T15:01:21,qwe304,saria is best girl tbh
05-05-2018T15:01:22,Bgrmystr2,not the same as pain in your stomache
05-05-2018T15:01:24,ItsActuallyKopyKat,Hello all! I see we are talking about the indigestion that bgr so easily causes whenever he speaks! &gt;:D
05-05-2018T15:01:25,TorqueEmUp,Never helped my heartburn either
05-05-2018T15:01:32,MarvTheHugPharaoh,HI KopyKat
05-05-2018T15:01:40,Dadrobit,Tums is a Godsend for my heartburn.
05-05-2018T15:01:52,Vatruvius,Saria sounds spoiler heavy Dadro?
05-05-2018T15:01:57,Mippy,I prefer Eno for Heart burn
05-05-2018T15:01:59,FenceEqualizer,Dang kopykat with the sucker punch
05-05-2018T15:02:00,Dadrobit,"Shit goes from ""heart attack"" to relief in seconds."
05-05-2018T15:02:11,Bgrmystr2,"Same, Dadro. I take it and the pain literally disappears in a few seconds. Permanantly."
05-05-2018T15:02:23,Bgrmystr2,"Fuck the ""disappears in minutes"" shit, who wants that?"
05-05-2018T15:02:31,Dadrobit,"Yeah, I have a sneaking suspicion a lot of that old stuff is gonna show it's head again in the mansion."
05-05-2018T15:02:32,PhilTheIdle,Isn't alcohol said to be a painkiller?
05-05-2018T15:02:36,FenceEqualizer,I would right now
05-05-2018T15:02:43,TorqueEmUp,Actually best stuff i've used are just acid reducers. Antacids just make things come back worse.
05-05-2018T15:02:47,Mippy,Tums will due in a pinch but are not as good
05-05-2018T15:02:59,ItsActuallyKopyKat,"I'll be back in a bit, cooking potatoes and eating lunch."
05-05-2018T15:03:08,ItsActuallyKopyKat,probs in time for the stream start
05-05-2018T15:03:15,FenceEqualizer,Cept less heart burn more back help
05-05-2018T15:03:20,PhilTheIdle,I'm eatin easter bunnies from lindt.
05-05-2018T15:03:21,Vatruvius,"Maybe Dadro, but I would like to see if people would be interested in such a sketch suggestion before I really think on it."
05-05-2018T15:03:21,Bgrmystr2,"lol Kopy, still hasn't realized my face makes people's lives miserable"
05-05-2018T15:03:30,Bgrmystr2,:u
05-05-2018T15:03:37,PhilTheIdle,I'd be interested.
05-05-2018T15:03:44,Vatruvius,After I thought of it I will ask Tom if it could be a spoiler later.
05-05-2018T15:04:07,TorqueEmUp,"Tom should tell you whether it is or not, because then it is spoiled."
05-05-2018T15:04:09,Dadrobit,But what about the Jazz Bar?
05-05-2018T15:04:11,TorqueEmUp,shouldn't*
05-05-2018T15:04:17,SielSinn,when does it start?
05-05-2018T15:04:24,Dadrobit,4:30
05-05-2018T15:04:48,FenceEqualizer,^
05-05-2018T15:04:59,Mippy,What Dad said
05-05-2018T15:05:05,NeonMitsumi,"Jazz Bar, you say? :cneonmitsumi-nibsax:"
05-05-2018T15:05:10,SielSinn,ooooh!! 30 minutes
05-05-2018T15:05:11,Vatruvius,"Still have it, this week I submitted a Maren/Trace date thing pre-comic. Seemed very popular and I really liked it. Depending on how popular it is in the polls in the stream will determine if I keep suggesting it or go to the Jazz Bar."
05-05-2018T15:05:13,MarvTheHugPharaoh,Hi Nyyom
