date,user,comment
06-08-2018T23:17:26,TorqueEmUp,I've never even heard of them until now.
06-08-2018T23:18:51,TheGamePlayer,"XD I'm dying there's this guy on YouTube that does all these voices from ""Family Guy"" to Pennywise it's so hilarious lmao"
06-08-2018T23:22:20,TheGamePlayer,His name is Azerrz
06-08-2018T23:25:35,SpazztasticKiwi,"They’re thicc n rich German chocolate with caramel, walnuts, and a little fudge"
06-08-2018T23:25:45,SpazztasticKiwi,Basically diabetes in a pan
06-08-2018T23:26:40,SpazztasticKiwi,Oh and you sprinkle powdered sugar on top when they cool
06-08-2018T23:29:55,TheGamePlayer,So I nd yummy
06-08-2018T23:31:28,TheGamePlayer,"I made a diabetes cake, it was a giant 🍪 with sprinkles, m&m, whipped cream, and marshmallows."
06-08-2018T23:32:11,TheGamePlayer,Oh and of course chocolate chips
