date,user,comment
10-12-2018T18:13:46,SpazztasticKiwi,How’s the headache Tom
10-12-2018T18:22:34,TerraTheWizard,:ctwokinds-RainezZz:
10-12-2018T18:57:10,Twokinds,Better now actually
10-12-2018T18:57:20,Twokinds,Just gotta work through the pain
10-12-2018T19:04:58,Twokinds,I can't believe how much sugar there is in everything
10-12-2018T19:05:06,SpazztasticKiwi,*claps loudly*
10-12-2018T19:05:15,SpazztasticKiwi,Welcome to America
10-12-2018T19:05:41,Twokinds,I must have been consuming 3x the recommended amount daily
10-12-2018T19:05:45,SpazztasticKiwi,It’s either deep fried or drowned in sugar
10-12-2018T19:06:06,SpazztasticKiwi,"And if it’s a funnel cake, it’s both"
10-12-2018T19:06:25,SpazztasticKiwi,How much sugar do you put in your coffee?!
10-12-2018T19:07:13,Bgrmystr2,lol.. probably just as much as everyone else.
10-12-2018T19:07:15,Twokinds,Uh... I get that coffee creamer that already sweetened
10-12-2018T19:07:38,SpazztasticKiwi,And what - dump it in?
10-12-2018T19:07:43,Twokinds,It's like liquid sugar
10-12-2018T19:07:56,Twokinds,"And yeah, my coffee is like... 1/5 that creamer"
10-12-2018T19:08:40,SpazztasticKiwi,Tell me if you start shaking from withdrawal cause I’m not entirely sure that’s just sugar
10-12-2018T19:08:48,Twokinds,I have a very bad sweet tooth! I can't help it!
10-12-2018T19:08:59,Twokinds,I wasn't lying in that video that I really do like all kinds of sweets.
10-12-2018T19:09:19,SpazztasticKiwi,Well at least someone liked them
10-12-2018T19:09:30,SpazztasticKiwi,Those fruity chew things are what I wanted to try
10-12-2018T19:10:00,Bgrmystr2,"My dad went through severe caffine withdrawals when I was a kid, like really really fucking bad, so beware that."
10-12-2018T19:10:04,Bgrmystr2,cuz it may not just be the sugar.
10-12-2018T19:10:28,SpazztasticKiwi,Yeah. Keep in mind caffeine is still a drug
10-12-2018T19:10:42,Bgrmystr2,and it's just as addicting as some of the drugs banned
10-12-2018T19:10:45,Bgrmystr2,"cocanie, etc"
10-12-2018T19:13:49,SpazztasticKiwi,You think you could go two weeks without added sugar?
10-12-2018T19:14:29,SpazztasticKiwi,Cause that’s how long it takes to break the habit. Also be about the time all of it should be out of you
10-12-2018T19:14:48,SpazztasticKiwi,Might make for an aggravated Christmas though
10-12-2018T19:16:35,Twokinds,I'm sure I'll be fine
10-12-2018T19:20:13,Twokinds,I've quit drinking coffee forever several times.
10-12-2018T19:20:47,Bgrmystr2,not a very long forever huh..
10-12-2018T19:20:59,Bgrmystr2,I guess you really have been living for way longer than any of us.. xD
10-12-2018T19:25:41,SpazztasticKiwi,“Quitting isn’t hard. I’ve done it five times!”
10-12-2018T19:25:53,CommanderTrace,Xd
10-12-2018T19:26:01,CommanderTrace,xD
10-12-2018T19:28:49,SpazztasticKiwi,How will you survive dessert after dinner though
10-12-2018T19:29:00,Bgrmystr2,dessert is fine
10-12-2018T19:29:20,SpazztasticKiwi,Gonna be at the table like 🤤
10-12-2018T19:29:24,Bgrmystr2,"with all the sugar taken away from coffee, he can still eat the same sugar from dessert."
10-12-2018T19:29:31,Bgrmystr2,no big deal :v
10-12-2018T19:30:45,SpazztasticKiwi,By the way - I went to the dentist
10-12-2018T19:31:02,SpazztasticKiwi,I’ve managed to cut my gums
10-12-2018T19:31:33,Bgrmystr2,D:
10-12-2018T19:31:50,SpazztasticKiwi,He says I brushed too hard
10-12-2018T19:33:35,Bgrmystr2,that'll do it
10-12-2018T19:34:17,SpazztasticKiwi,But I also taught Bagheera a new trick
10-12-2018T19:40:04,MrMongMong,Is it to Praise the Sun?
10-12-2018T19:45:33,SpazztasticKiwi,Nah. He gets in the crate on his own
10-12-2018T19:53:14,tehbear,"there are, or there used to be toothbrushes that would ""click"" backwards to indicate brushing too hard"
10-12-2018T21:08:59,SpazztasticKiwi,Bagheera is laying on me and smushing his fluff against my face
10-12-2018T23:12:30,Ordithus,:ctwokinds-daydreamingkat:
10-12-2018T23:23:53,SpazztasticKiwi,Kitty snuggle
