date,user,comment
13-06-2018T00:09:30,SpazztasticKiwi,Bagheera’s being insistent he get attention
13-06-2018T02:13:20,SpazztasticKiwi,gnite folks 💤
13-06-2018T02:25:47,TheBeckoner,Nigggggght
13-06-2018T14:11:59,SpazztasticKiwi,Anyone seen Vat in awhile?
13-06-2018T15:04:58,Bgrmystr2,"hmm, vat was at the last stream I think"
13-06-2018T15:05:17,Bgrmystr2,"on tues, for the page"
13-06-2018T15:05:24,Bgrmystr2,"that super early strea,"
13-06-2018T15:05:27,Bgrmystr2,stream* even
13-06-2018T15:05:40,Bgrmystr2,dunno if they were there during or was one of the ppl who made it in after it ended but
13-06-2018T15:05:48,Bgrmystr2,I somewhat recall vatru being there.
13-06-2018T15:09:34,SpazztasticKiwi,I thought so
13-06-2018T21:15:34,CrRAR,"Wow, shorrrrt userlist tonight. G'night streambros~"
