date,user,comment
18-03-2018T18:08:15,TheBeckoner,Oh yeah
18-03-2018T18:08:25,TheBeckoner,just got one of those for a right on red
18-03-2018T18:08:30,TheBeckoner,forgot to stop
18-03-2018T18:08:34,TheBeckoner,well
18-03-2018T18:08:49,TheBeckoner,I more so thought I was gonna get hit if I hesitated.
18-03-2018T18:08:57,TheBeckoner,So i didnt stop
18-03-2018T18:09:05,Dadrobit,"""Rolling right on red"""
18-03-2018T18:09:29,Dadrobit,What's the fine for that?
18-03-2018T18:09:42,Dadrobit,Is it considered running a red light?
18-03-2018T18:09:43,TheBeckoner,"I have it right here. It says ""Failure to stop at red light"""
18-03-2018T18:09:51,Dadrobit,Oof.
18-03-2018T18:09:59,TheBeckoner,it was $75
18-03-2018T18:10:06,Dadrobit,That's not terrible.
18-03-2018T18:10:12,Dadrobit,Taking a class?
18-03-2018T18:10:23,TheBeckoner,"Nope, just paid it."
18-03-2018T18:10:34,Dadrobit,Fair 'nuff
18-03-2018T18:10:38,Twokinds,The thought of being pulled over scares me a lot.
18-03-2018T18:10:41,TheBeckoner,Not money I wanted to spend but eh it was easier
18-03-2018T18:11:25,TheBeckoner,I was fairly nervous first time. Dude could see that I guess and was pretty laid back.
18-03-2018T18:11:42,Dadrobit,"Yeah, I'm a pretty confident dude, but getting pulled over sucks no matter what."
18-03-2018T18:11:43,TheBeckoner,Hopefully you don't get an ass for a cop
18-03-2018T18:11:58,unsteddyphoenix,Are there cops racist to asians? :thinking:
18-03-2018T18:12:10,Bgrmystr2,do you really have to ask XD
18-03-2018T18:12:15,TheBeckoner,There is probably some racist to anyone lol
18-03-2018T18:12:18,Twokinds,Not that I know of. I just don't deal with unexpected human contact well.
18-03-2018T18:12:20,TheBeckoner,someone*
18-03-2018T18:12:34,unsteddyphoenix,Fair enough. One of the worst kinds of human contact
18-03-2018T18:12:39,Twokinds,I live right next to the police/fire department actually.
18-03-2018T18:12:50,unsteddyphoenix,Extra safe
18-03-2018T18:12:53,Bgrmystr2,:o
18-03-2018T18:12:58,TheBeckoner,Make them cookies as a non monetary bribe
18-03-2018T18:13:02,Twokinds,"Like, it's literally right across from our neighborhood. And it's a pretty chill community."
18-03-2018T18:13:26,unsteddyphoenix,Do you go to like. Neighbourhood BBQs or whatever?
18-03-2018T18:13:55,Twokinds,Nah
18-03-2018T18:14:06,Twokinds,Do I seem like the type that would? XD
18-03-2018T18:14:09,TheBeckoner,I would. Cant pass up free food
18-03-2018T18:14:23,Dadrobit,"Same, have a fire station at the end of my thru street"
18-03-2018T18:14:32,Twokinds,"But it's a very safe area. It should be, our local taxes are extremely high."
18-03-2018T18:15:09,Dadrobit,"Neighborhood BBQ's aren't a thing, but my neighbors and I share food every once in a while."
18-03-2018T18:15:11,unsteddyphoenix,Free food is free food~
18-03-2018T18:15:16,unsteddyphoenix,Oh thats cute
18-03-2018T18:16:01,Dadrobit,"I'm renting from my folks, and they own and rent out the adjacent houses as well, so we all kinda know each other."
18-03-2018T18:16:49,unsteddyphoenix,Thats pretty sweet. Dunno my neighbours at all. Kiiind of feel like I should meet them properly at some point but...TALKING to people urgh
18-03-2018T18:17:37,Twokinds,I'm considering just ubering full-time. It probably wouldn't be that much more expensive.
18-03-2018T18:17:56,Dadrobit,"I don't mind conversations when people approach me, but I almost never initiate anything myself."
18-03-2018T18:18:48,unsteddyphoenix,Probably not. Isnt Uber like...morally ambiguous though.
18-03-2018T18:18:58,Bgrmystr2,not imo phoenix
18-03-2018T18:19:05,Bgrmystr2,it's just another cab service
18-03-2018T18:19:11,unsteddyphoenix,Theyre so cheap 'cause they dont have to pay work-taxes like taxis do or something
18-03-2018T18:19:13,Bgrmystr2,"but people do it as a ""side job"" through an app"
18-03-2018T18:19:28,unsteddyphoenix,"So theyre like, abusing a loophole or whatever."
18-03-2018T18:19:32,Bgrmystr2,basically
18-03-2018T18:19:36,unsteddyphoenix,Which is why it's banned some places
18-03-2018T18:19:50,Bgrmystr2,that's cuz some places taxis want a monopoly
18-03-2018T18:20:02,Dadrobit,"Met a ton of Uber folks as access security. It's a mixed bag. Some are nice, plenty of cunts as well though."
18-03-2018T18:20:15,Twokinds,"Well yeah, that's humanity."
18-03-2018T18:20:17,Bgrmystr2,that's cuz Uber is made out of the populous
18-03-2018T18:21:16,Dadrobit,"I just recall hearing about a horror story form last year. Dude was using Uber to cover his tracks as a drive by shooter. Take a job on one side of the city as an alibi, shoot up the other side of the city between gigs."
18-03-2018T18:21:31,TheBeckoner,woa
18-03-2018T18:21:52,Bgrmystr2,:thinking:
18-03-2018T18:21:52,unsteddyphoenix,Huh. Clearly it didnt work but it seems smart
18-03-2018T18:22:11,TheBeckoner,Yeah I watch youtube videos on uber trouble sometimes. Some  of the passengers are just ridiculous.
18-03-2018T18:22:23,Bgrmystr2,..it's just people meeting ppl
18-03-2018T18:22:29,Bgrmystr2,you're gonna have bad interactions eventually
18-03-2018T18:22:34,TheBeckoner,Yup
18-03-2018T18:22:40,TheBeckoner,pretty entertaining.
18-03-2018T18:22:46,unsteddyphoenix,Ive seen streamers who stream themselves doing uber work
18-03-2018T18:22:46,Bgrmystr2,it happens with Taxis too
18-03-2018T18:23:02,Dadrobit,"Yeah, a survivor saw the Uber sticker on is windshield and then they just went through all of them with his vehicle before he was eventually caught."
18-03-2018T18:23:04,unsteddyphoenix,and they have text-to-speech on so the chat donates to say things to the passengers out loud
18-03-2018T18:23:07,Dadrobit,his*
18-03-2018T18:23:21,Bgrmystr2,xD Phoenix
18-03-2018T18:23:23,Bgrmystr2,that sounds fun
18-03-2018T18:23:29,TheBeckoner,wow lol
18-03-2018T18:23:35,Dadrobit,Sounds like a good way to get harrassment charges.\
18-03-2018T18:23:39,TheBeckoner,^
18-03-2018T18:23:57,Bgrmystr2,"not if you inform the passenger about the stream, Dadro"
18-03-2018T18:24:02,unsteddyphoenix,"Yeah, some of the stuff they said was...as bad as they could make it."
18-03-2018T18:24:03,Bgrmystr2,seems kind of dumb not to
18-03-2018T18:24:13,TheBeckoner,Last thing I want as a passenger is something like that.
18-03-2018T18:24:30,Twokinds,"Yes, I'd like to request one uber, extra no talking."
18-03-2018T18:24:37,Bgrmystr2,xD ^
18-03-2018T18:24:38,TheBeckoner,I give you money you let me be.
18-03-2018T18:24:43,Dadrobit,lol
18-03-2018T18:24:52,unsteddyphoenix,"""no talking costs extra"""
18-03-2018T18:24:57,Twokinds,They should have that as an option in the app.
18-03-2018T18:25:04,TheBeckoner,Do they not?
18-03-2018T18:25:06,unsteddyphoenix,They really should.
18-03-2018T18:25:10,Bgrmystr2,"probably not, beck"
18-03-2018T18:25:17,Bgrmystr2,because it's really a human-interaction thing
18-03-2018T18:25:19,TheBeckoner,Seems pretty basic...idk
18-03-2018T18:25:26,Bgrmystr2,that's not something the app would really matter
18-03-2018T18:25:30,Twokinds,Just   :ballot_box_with_check:Silence
18-03-2018T18:25:40,Bgrmystr2,xD I don't see it happening
18-03-2018T18:25:46,TheBeckoner,I mean if I were a driver I would respect that.
18-03-2018T18:25:54,unsteddyphoenix,I would rather stare out the window doing nothing than talk to the driver
18-03-2018T18:26:21,Dadrobit,Regular cabbies are talkative people.
18-03-2018T18:26:23,unsteddyphoenix,"Man, one time I had this taxi driver try hire me to sell like, soaps and shit"
18-03-2018T18:26:34,TheBeckoner,lol wut
18-03-2018T18:26:35,Bgrmystr2,lolo
18-03-2018T18:26:38,Dadrobit,Was it through Amway?
18-03-2018T18:26:44,Dadrobit,Sounds like Amway
18-03-2018T18:26:49,Bgrmystr2,"my stepbrother does something like that, online"
18-03-2018T18:27:00,Dadrobit,Same.
18-03-2018T18:27:03,unsteddyphoenix,"Dunno, went on and on about some genius business plan and how he needed ""people he could trust"""
18-03-2018T18:27:05,Bgrmystr2,or.. ex.. stepbrother? I Don't know
18-03-2018T18:27:11,Dadrobit,Little bro is in deep with them now
18-03-2018T18:27:14,unsteddyphoenix,Like some dude you picked up at 1am in the city
18-03-2018T18:27:19,unsteddyphoenix,Apparently
18-03-2018T18:27:30,Dadrobit,Seems legit
18-03-2018T18:27:44,unsteddyphoenix,I just nodded along and gave him a fake contact number at the end.
18-03-2018T18:28:17,unsteddyphoenix,Would not recommend
18-03-2018T18:28:21,Bgrmystr2,lolo
18-03-2018T18:28:43,Twokinds,mmm mystery food delivery
18-03-2018T18:28:52,Bgrmystr2,:thinking:
18-03-2018T18:28:54,TheBeckoner,?
18-03-2018T18:28:56,Dadrobit,Is it watermenlon?
18-03-2018T18:29:03,TheBeckoner,Is it people?
18-03-2018T18:29:05,Dadrobit,Watermelon*
18-03-2018T18:29:08,Twokinds,The food of the day is Indian spicy chicken curry.
18-03-2018T18:29:15,Dadrobit,So close
18-03-2018T18:29:19,unsteddyphoenix,Oo that sounds good~
18-03-2018T18:29:23,TheBeckoner,Could be people.
18-03-2018T18:29:25,Dadrobit,Literally my third guess
18-03-2018T18:29:49,unsteddyphoenix,"Curry is so good, shame im so white do I dont get to eat it much. :/"
18-03-2018T18:29:53,TheBeckoner,I could go for some chinese food right now.
18-03-2018T18:30:16,unsteddyphoenix,Very jealous of mystery food
18-03-2018T18:30:26,Bgrmystr2,"then make it, phoenix"
18-03-2018T18:30:48,Twokinds,"Mmm, it's good"
18-03-2018T18:31:17,Twokinds,"Indian curry is quite different from the Korean or Japanese curries I usually have, but I like it."
18-03-2018T18:33:30,unsteddyphoenix,Whats a korean curry like? Not sure ive had that...
18-03-2018T18:33:40,unsteddyphoenix,"Ive had thai-curry a decent amount, but"
18-03-2018T18:33:56,unsteddyphoenix,Most korean food I see is KBBQ
18-03-2018T18:34:15,Twokinds,"Oh, it's very hard to explain. It's more... savory? Thicker, with like, carrots and potatoes. More like a curry stew, put on rice. At least the type my mother makes."
18-03-2018T18:34:21,Twokinds,I'm sure there's other types.
18-03-2018T18:35:41,unsteddyphoenix,Man that sounds good...im so hungry now
18-03-2018T18:36:14,unsteddyphoenix,"Woah apparently ""curry-stew"" is a thing"
18-03-2018T18:37:12,unsteddyphoenix,def gonna try make this sometime
18-03-2018T18:37:57,Dadrobit,"Never made a curry myself, should do that eventually. All my meals tend to be Mexican food based."
18-03-2018T18:38:39,unsteddyphoenix,When in Rome...
18-03-2018T18:38:45,unsteddyphoenix,Or in your case a desert
18-03-2018T18:38:49,Dadrobit,Pretty much.
18-03-2018T18:39:12,Twokinds,"It's pretty easy. You can just get it in a box, it's called Golden Curry"
18-03-2018T18:39:26,Dadrobit,"If I have Carolina's Tortillas on hand, it's pretty much going to be tortilla based foods until I run out."
18-03-2018T18:39:39,Twokinds,That's what my mother uses. You just melt it and start mixing in your stuff.
18-03-2018T18:39:51,Dadrobit,"Hm, sounds ~Too~ easy"
18-03-2018T18:40:21,Twokinds,"Curry is meant to be pretty easy by design. It's just stuff, put on rice."
18-03-2018T18:40:39,unsteddyphoenix,"Oh, I know the ones."
18-03-2018T18:40:42,unsteddyphoenix,Different brand but
18-03-2018T18:41:06,CrRAR,Cut to next scene
18-03-2018T18:41:15,CrRAR,Phoenx's hous eon fire
18-03-2018T18:41:35,unsteddyphoenix,INflammable means FLAMMABLE?
18-03-2018T18:41:46,CrRAR,haha
18-03-2018T18:41:54,Twokinds,"One thing I really like about Indian food is they're not afraid to get spicy. In a good way. Hot, but still tastes good."
18-03-2018T18:42:13,Dadrobit,'s mouth is watering.
18-03-2018T18:42:24,CrRAR,"oh yeah, mild, regular, hot and nuclear"
18-03-2018T18:42:26,unsteddyphoenix,Yeah I got up and put food on lol
18-03-2018T18:42:49,Dadrobit,"I need to hit up the local wing joint. They have some baller ghost pepper sauce that I'm out of, but is amazing for cooking."
18-03-2018T18:42:49,unsteddyphoenix,"Mild, mild again, somewhat hot, absolute destruction"
18-03-2018T18:42:53,CrRAR,You unlock nuclear by reaching at least hot without shedding a tear
18-03-2018T18:43:08,CrRAR,lol
18-03-2018T18:43:17,Twokinds,lol sorry for all the food talk XD
18-03-2018T18:43:23,SpazztasticKiwi,Y’all making me hungry
18-03-2018T18:43:27,unsteddyphoenix,Spicy food is kind of a leveling system. Up your tolerance points.
18-03-2018T18:43:28,Twokinds,"Can't help it, I love curry."
18-03-2018T18:43:45,unsteddyphoenix,Relate
18-03-2018T18:44:10,NightMeaty22,hello
18-03-2018T18:44:11,unsteddyphoenix,Surely all you really need for curry is the spices right?
18-03-2018T18:44:13,SpazztasticKiwi,I’ve never had curry. I’d like to try it though
18-03-2018T18:44:22,Dadrobit,"All good, I know I've annoyed the chat with my food talk plenty of times lol"
18-03-2018T18:44:32,CrRAR,Get you some tikka marsala boi
18-03-2018T18:44:45,NightMeaty22,🍖
18-03-2018T18:45:03,SpazztasticKiwi,Y’all need my 7 layer chocolate cake
18-03-2018T18:45:09,NightMeaty22,🎂
18-03-2018T18:45:16,NightMeaty22,🍫
18-03-2018T18:45:35,Dadrobit,Made a seven layer taco cake once if that counts.
18-03-2018T18:45:41,CrRAR,Is your 7 layer chocolate cake practically Jesus?
18-03-2018T18:45:52,NightMeaty22,🌮🌮🌮🌮🌮🌮🌮
18-03-2018T18:46:00,CrRAR,Cus I thought that's where that sentence was going.
18-03-2018T18:46:02,NightMeaty22,🍫🍫🍫🍫🍫🍫🍫🎂
18-03-2018T18:46:46,unsteddyphoenix,NEVER had curry?
18-03-2018T18:46:50,Dadrobit,Pro Tools just updated and needs a reboot. BRB.
18-03-2018T18:47:01,CrRAR,:o
18-03-2018T18:47:07,CrRAR,Godspeed
18-03-2018T18:47:27,SpazztasticKiwi,So I’m thinking of walking more
18-03-2018T18:47:35,SpazztasticKiwi,But I live on a hill
18-03-2018T18:47:58,Dadrobit,"Back, nice and quick reboot."
18-03-2018T18:48:20,unsteddyphoenix,SSD?
18-03-2018T18:48:27,unsteddyphoenix,"Roll down hill, walk ip"
18-03-2018T18:49:09,Dadrobit,"Good question, I don't think so?"
18-03-2018T18:49:25,SpazztasticKiwi,I’m out walking now. Something just jumped in the creek by the road
18-03-2018T18:49:32,CrRAR,frog!
18-03-2018T18:49:37,unsteddyphoenix,Doggy!
18-03-2018T18:49:49,CrRAR,dark lord agnew!
18-03-2018T18:50:02,CrRAR,the pope?
18-03-2018T18:50:05,Dadrobit,I use an external SSD for all my storage though. On my workstation laptop and the only thing I keep on here is work related programs.
18-03-2018T18:50:10,SpazztasticKiwi,Probably a frog
18-03-2018T18:50:13,SpazztasticKiwi,Hopefully
18-03-2018T18:50:24,CrRAR,aww
18-03-2018T18:50:47,SpazztasticKiwi,I’m also not going to investigate. We have cotton mouth snakes
18-03-2018T18:50:53,unsteddyphoenix,"External SSD, how decadent"
18-03-2018T18:50:56,CrRAR,yyyyeeeeahh
18-03-2018T18:51:06,CrRAR,best to leave that mystery unsolved
18-03-2018T18:51:22,SpazztasticKiwi,That’s a nope
18-03-2018T18:51:42,Dadrobit,Snakes sounds like a winner.
18-03-2018T18:51:50,SpazztasticKiwi,I’ve faced off with a copperhead. No need to test a Cotten mouth
18-03-2018T18:52:03,unsteddyphoenix,Did you survive?
18-03-2018T18:52:16,SpazztasticKiwi,Tragically I died
18-03-2018T18:52:26,SpazztasticKiwi,But then I lived
18-03-2018T18:52:27,Dadrobit,F
18-03-2018T18:53:45,unsteddyphoenix,Dramatic
18-03-2018T18:53:52,unsteddyphoenix,I died but then I got better
18-03-2018T18:53:56,Dadrobit,"Lotsa snakes round here, most are harmless though."
18-03-2018T18:54:14,SpazztasticKiwi,We only have two that are venomous
18-03-2018T18:54:18,TheBeckoner,ugh gotta write a 9 paragraph essay on the duel between Aaron Burr and Alexander hamilton...
18-03-2018T18:54:30,SpazztasticKiwi,Though the rat snakes have a bad attitude sometimes too
18-03-2018T18:54:34,TheBeckoner,And use footnotes for some reason
18-03-2018T18:54:43,Dadrobit,"Arizona Kingsnakes are pretty rad. Super tame even in the wild, you can just pick those suckers up and they just chill"
18-03-2018T18:54:51,TheBeckoner,I like the non bad snakes
18-03-2018T18:55:07,Dadrobit,"Rattlesnakes however, those you do not fuck with"
18-03-2018T18:55:22,TheBeckoner,We got a big ol snapping turtle when the hurricane stuff happened not to long ago
18-03-2018T18:55:29,SpazztasticKiwi,"I wanted a kingsnake, but ended up getting a garter snake"
18-03-2018T18:55:31,TheBeckoner,Very angry he was
18-03-2018T18:55:32,Dadrobit,"And they're protected, so no killing them either"
18-03-2018T18:55:51,unsteddyphoenix,:snake:
18-03-2018T18:55:51,TheBeckoner,My mom had a pet python at one point
18-03-2018T18:56:03,TheBeckoner,one of them yellow ones iirc
18-03-2018T18:56:30,CrRAR,I had a garter snake when I was younger.
18-03-2018T18:56:46,CrRAR,Fed him little gold fish.
18-03-2018T18:56:52,TheBeckoner,Which one imitate cobras?
18-03-2018T18:56:56,TheBeckoner,ones*
18-03-2018T18:57:00,SpazztasticKiwi,Gold fish don’t offer a good diet for garters
18-03-2018T18:57:09,TheBeckoner,little mice do heh
18-03-2018T18:57:10,CrRAR,really?
18-03-2018T18:57:18,CrRAR,He lived a hell of a long time.
18-03-2018T18:57:25,CrRAR,I also fed him crickets
18-03-2018T18:57:30,CrRAR,powery ones
18-03-2018T18:57:38,unsteddyphoenix,power crickets :O
18-03-2018T18:57:54,CrRAR,He like hunting the little fish in his bowl it's kinda sad thinking back
18-03-2018T18:58:18,TheBeckoner,"oh, hognose are neat."
18-03-2018T18:58:30,TheBeckoner,pretty docile from what I see
18-03-2018T18:58:35,CrRAR,he was a cool snake though
18-03-2018T18:58:41,TheBeckoner,How big was he?
18-03-2018T18:58:51,unsteddyphoenix,I cant participate in this convo I dont think we have snakes :thinking:
18-03-2018T18:59:05,SpazztasticKiwi,King was pretty cool. Liked watching YouTube with me
18-03-2018T18:59:21,CrRAR,"Maybe like a foot long, or maybe a little more."
18-03-2018T18:59:26,SpazztasticKiwi,I saw a tiny salamander
18-03-2018T18:59:39,CrRAR,:ctwokinds-maddiessparkles:
18-03-2018T18:59:58,Dadrobit,Big snakes are fun tho
18-03-2018T19:00:00,Dadrobit,https://i.imgur.com/QRwA7Mz.jpg
18-03-2018T19:00:08,TheBeckoner,"Salamanders are super neat, so are those mud dog things"
18-03-2018T19:00:08,Dadrobit,Brother is over 6 ft
18-03-2018T19:00:30,TheBeckoner,big ol boi
18-03-2018T19:00:31,CrRAR,wow
18-03-2018T19:00:38,CrRAR,chill snek
18-03-2018T19:00:52,SpazztasticKiwi,King was just under 3 feet
18-03-2018T19:00:59,Dadrobit,She's very very tame
18-03-2018T19:01:21,Dadrobit,Never seen her mad in my life
18-03-2018T19:01:50,CrRAR,I am curious how one would judge a snake as mad.
18-03-2018T19:01:58,SpazztasticKiwi,King got hyper when he saw you with his mice
18-03-2018T19:02:13,Dadrobit,Is it coiled and hissing at you tring to avoid contact? It's pissed
18-03-2018T19:02:25,CrRAR,"oh right, right"
18-03-2018T19:02:44,SpazztasticKiwi,I rescued a baby grey rat snake and it did that to me
18-03-2018T19:02:53,SpazztasticKiwi,I tried so hard not to laugh
18-03-2018T19:03:17,Dadrobit,"He has another one that's more tempermental, strikes at you if he isn't in the mood to leave his enclosure."
18-03-2018T19:03:34,CrRAR,grump snek
18-03-2018T19:04:33,CrRAR,I'd be pretty ornery if I had no appendages.
18-03-2018T19:04:40,SpazztasticKiwi,Baby rat snek uses intimidate. It is ineffective
18-03-2018T19:04:46,Dadrobit,"Alright, procrastination time is over, gotta go read something real quick. Have a good one, be back in an hou or so."
18-03-2018T19:04:52,Dadrobit,hour*
18-03-2018T19:04:58,CrRAR,enjoy your productivity~
18-03-2018T19:05:03,Dadrobit,\o/
18-03-2018T19:05:05,CrRAR,till next time~
18-03-2018T19:05:12,Dadrobit,Makin' fat stacks yo'
18-03-2018T19:05:13,unsteddyphoenix,goodluck
18-03-2018T19:05:17,SpazztasticKiwi,Try not to have too much fun
18-03-2018T19:05:33,CrRAR,come back when you're feeling right procrastinatory again.
18-03-2018T19:05:54,TheBeckoner,I also gotta go...history paper to be written.
18-03-2018T19:06:10,SpazztasticKiwi,You may have the most fun
18-03-2018T19:06:15,CrRAR,okay
18-03-2018T19:06:33,CrRAR,May the word flow to you like the swallows of Capistrano
18-03-2018T19:06:34,SpazztasticKiwi,🍀
18-03-2018T19:06:40,CrRAR,*words
18-03-2018T19:06:59,TheBeckoner,lol thanks
18-03-2018T19:07:36,Dadrobit,Here have a baby sand snake as I leave http://i.imgur.com/4d3CwDi.jpg
18-03-2018T19:07:54,unsteddyphoenix,thats not a cat!
18-03-2018T19:07:59,Vatruvius,I clearly missed something...ended up napping and I come back to a conversation about snakes and words and books and what? I can't even go back in chat to see why! I need some clarification here!?!
18-03-2018T19:08:01,Bgrmystr2,lil baby nope
18-03-2018T19:08:02,Bgrmystr2,it's cute
18-03-2018T19:08:07,CrRAR,haha I just googled when they return and no shit today is the celebration of the Swallows returning.
18-03-2018T19:08:07,SpazztasticKiwi,Baby danger noodle
18-03-2018T19:08:13,CrRAR,XD
18-03-2018T19:08:16,Bgrmystr2,yes kiwi exactly
18-03-2018T19:08:21,CrRAR,aww
18-03-2018T19:08:24,CrRAR,lil snek
18-03-2018T19:08:38,Bgrmystr2,"also, I am happy now"
18-03-2018T19:08:45,Bgrmystr2,I had waffles with chocolate chips :v
18-03-2018T19:09:00,SpazztasticKiwi,Ooo waffles sound good rn
18-03-2018T19:09:04,Twokinds,I don't like sand snakes.
18-03-2018T19:09:04,CrRAR,woo
18-03-2018T19:09:14,SpazztasticKiwi,Not a snake fan?
18-03-2018T19:09:38,Twokinds,They're coarse and rough and irritating and they get everywhere.
18-03-2018T19:09:47,SpazztasticKiwi,Ha ha
18-03-2018T19:10:08,SpazztasticKiwi,We got a joker here guys. There’s water snakes too
18-03-2018T19:10:23,CrRAR,Beetlejuice hates 'em too
18-03-2018T19:10:28,SpazztasticKiwi,Been bit by one
18-03-2018T19:10:37,Vatruvius,:ptv-unimpressed:
18-03-2018T19:10:45,SpazztasticKiwi,"It was a graze though, and they’re not venomous"
18-03-2018T19:13:10,SpazztasticKiwi,Ever seen a snake bury themselves? They do the chimichanga till they’re covered. Pretty funny
18-03-2018T19:18:51,unsteddyphoenix,https://www.youtube.com/watch?v=rr0UxM84AII
18-03-2018T19:18:56,unsteddyphoenix,ok thats pretty great
18-03-2018T19:18:59,unsteddyphoenix,and weirdly cute
18-03-2018T19:19:12,unsteddyphoenix,I like how he goes butt first
18-03-2018T19:21:19,SpazztasticKiwi,"Shimmy, shimmy, shimmy, some"
18-03-2018T19:21:28,SpazztasticKiwi,And done
18-03-2018T19:23:10,Twokinds,"I legit came back and just read ""I like how he goes butt first"" and was really confused."
18-03-2018T19:23:36,Bgrmystr2,xDD
18-03-2018T19:23:41,SpazztasticKiwi,That’s what you get for popping in mid-conversation
18-03-2018T19:23:44,CrRAR,hahaaa
18-03-2018T19:23:54,SpazztasticKiwi,Happens to me often
18-03-2018T19:24:25,CrRAR,wiggle wiggle wigglewigglewiggle
18-03-2018T19:24:37,SpazztasticKiwi,Yeah
18-03-2018T19:25:16,unsteddyphoenix,:ctwokinds-KatDance:
18-03-2018T19:25:48,CrRAR,^ watch out predator behavior ahoy
18-03-2018T19:26:36,Twokinds,lol
18-03-2018T19:26:43,Twokinds,"Very apt, yes."
18-03-2018T19:26:51,unsteddyphoenix,danger danger~
18-03-2018T19:27:08,Bgrmystr2,Am I the only one that would be willing to be prey just to see what Kat would do..?
18-03-2018T19:27:33,SpazztasticKiwi,Turn you into hamburger meat
18-03-2018T19:27:41,unsteddyphoenix,Eh worth it
18-03-2018T19:27:46,SpazztasticKiwi,Likely on accident
18-03-2018T19:27:48,Bgrmystr2,"I'm a curious bastard, and that curiosity is gonna be the end of me lol"
18-03-2018T19:28:10,unsteddyphoenix,cutest hunting attempt ever~
18-03-2018T19:28:10,Bgrmystr2,"I'll be that cat, one day"
18-03-2018T19:28:21,Bgrmystr2,:/
18-03-2018T19:30:04,SpazztasticKiwi,"Now, we’ve discussed who’s had a snake. Anyone just held one?"
18-03-2018T19:30:21,unsteddyphoenix,I held a massive one in thailand before
18-03-2018T19:30:29,unsteddyphoenix,Wrapped all around me
18-03-2018T19:30:48,Bgrmystr2,nope
18-03-2018T19:30:50,CrRAR,that sounds like a risky statement... for Thailand.
18-03-2018T19:30:54,Bgrmystr2,no snakes for me
18-03-2018T19:30:57,unsteddyphoenix,I was a young wuss back then so I was absolutely terrified
18-03-2018T19:31:06,unsteddyphoenix,Lol
18-03-2018T19:31:55,CrRAR,haha
18-03-2018T19:32:40,SpazztasticKiwi,I’ll only handle a large python or such with someone els in the room
18-03-2018T19:32:48,Vatruvius,I caught a few garden snakes that leave near me when I was little along with a lot of lizards of different variety.
18-03-2018T19:33:01,Vatruvius,live*
18-03-2018T19:33:24,unsteddyphoenix,All I know about snakes is that the tunnel ones rule
18-03-2018T19:33:52,Bgrmystr2,xD
18-03-2018T19:33:59,Bgrmystr2,didn't they all die tho
18-03-2018T19:34:04,Bgrmystr2,or is that spoilers
18-03-2018T19:34:20,unsteddyphoenix,details
18-03-2018T19:34:27,Bgrmystr2,:thinking:
18-03-2018T19:34:30,Bgrmystr2,okay
18-03-2018T19:36:40,SpazztasticKiwi,I now have waffles
18-03-2018T19:36:49,CrRAR,o7
18-03-2018T19:38:00,Bgrmystr2,do they have chocolate chips on them?
18-03-2018T19:38:00,unsteddyphoenix,:ctwokinds-flat:
18-03-2018T19:38:10,SpazztasticKiwi,Nah
18-03-2018T19:38:20,Bgrmystr2,inferior.
18-03-2018T19:38:25,Bgrmystr2,:ptv-unimpressed:
18-03-2018T19:38:27,SpazztasticKiwi,Greek yogurt chips
18-03-2018T19:38:37,Bgrmystr2,wtf is that
18-03-2018T19:38:41,Bgrmystr2,"also, it's not chocolate"
18-03-2018T19:39:35,SpazztasticKiwi,"Greek yogurt in little chips, like chocolate chips"
18-03-2018T19:40:08,Bgrmystr2,but is it like.. just normal yogurt?
18-03-2018T19:40:11,Bgrmystr2,cuz that's kinda boring
18-03-2018T19:40:16,Bgrmystr2,and not really  a solid
18-03-2018T19:40:54,SpazztasticKiwi,Tastes kinda like white chocolate
18-03-2018T19:41:10,Bgrmystr2,:ptv-wondering:
18-03-2018T19:41:59,SpazztasticKiwi,But it’s technically healthier
18-03-2018T19:42:06,Bgrmystr2,meh
18-03-2018T19:42:58,SpazztasticKiwi,I don’t need the sugar this late
18-03-2018T19:44:55,Twokinds,I love white chocolate!
18-03-2018T19:45:03,Bgrmystr2,yeah white chocolate is great
18-03-2018T19:45:31,CrRAR,very indulgent
18-03-2018T19:46:00,SpazztasticKiwi,Greek yogurt chips: white chocolate without all the sugar and fat
