date,user,comment
18-03-2018T00:01:19,TheBeckoner,Came from a computing device more than likely.
18-03-2018T00:02:00,Dadrobit,It came form 4chan
18-03-2018T00:02:16,TheBeckoner,Hullo Dadro
18-03-2018T00:02:35,Dadrobit,o/ Beck
18-03-2018T00:03:08,TheBeckoner,How was your spring break? idk when yours is
18-03-2018T00:04:21,Dadrobit,"It was pretty solid, went back t working. Feels good."
18-03-2018T00:04:51,Dadrobit,Also finally beat Morrowind today on the end of it
18-03-2018T00:05:29,Dadrobit,Yourself?
18-03-2018T00:15:24,SpazztasticKiwi,"Bagheera’s growling in his sleep. If I laugh any harder, I’ll wake him up"
18-03-2018T00:15:31,TheBeckoner,Sounds good. Mostly worked. Fleet vehicle maintenance and helping a friend with his car.
18-03-2018T00:15:55,SpazztasticKiwi,I woke him up
18-03-2018T00:15:56,TheBeckoner,"Ooh I also made a sub box for my truck with my dad, that was nice"
18-03-2018T00:16:04,unsteddyphoenix,:ctwokinds-daydreamingkat::ctwokinds-daydreamingkat::ctwokinds-daydreamingkat: cute~
18-03-2018T00:16:12,TheBeckoner,Bad dream?
18-03-2018T00:16:44,SpazztasticKiwi,I don’t know. But it was the tiniest non threatening growls I’ve heard from him
18-03-2018T00:17:00,TheBeckoner,smol upsets
18-03-2018T00:17:50,SpazztasticKiwi,He is a character
18-03-2018T00:18:12,SpazztasticKiwi,I’m happy the shelter didn’t take him
18-03-2018T00:19:25,unsteddyphoenix,Me too. :D
18-03-2018T00:19:36,SpazztasticKiwi,"Where’d you get Holly, by the way Tom?"
18-03-2018T00:20:42,TheBeckoner,spawned from an egg I here.
18-03-2018T00:20:47,TheBeckoner,hear*
18-03-2018T00:20:53,SpazztasticKiwi,Seems legit
18-03-2018T00:23:38,SpazztasticKiwi,“My cat just laid a clutch of kitten eggs - want one?” “Your what did a what now?”
18-03-2018T00:25:32,Twokinds,My mother just brought her home randomly
18-03-2018T00:25:50,SpazztasticKiwi,“Here. Have a cat”
18-03-2018T00:26:05,Twokinds,Yeah precisely.
18-03-2018T00:26:06,unsteddyphoenix,For like...a gift?
18-03-2018T00:26:06,Vatruvius,"Goodnight people, watching an interest documentory so I will get off the chat before I have an hour of messages to read."
18-03-2018T00:26:19,unsteddyphoenix,seeya
18-03-2018T00:26:25,SpazztasticKiwi,👌🏻👋🏻
18-03-2018T00:26:28,TheBeckoner,My mom does that but with dogs.
18-03-2018T00:26:38,TheBeckoner,Gn Vat
18-03-2018T00:26:39,Twokinds,My mother is the type of person who just likes to buy stuff
18-03-2018T00:26:43,Twokinds,"And at the time, it was pets"
18-03-2018T00:26:52,SpazztasticKiwi,I’ve gotten hints that’s the case
18-03-2018T00:26:53,Twokinds,She also bought me a fish and two hamsters
18-03-2018T00:27:07,SpazztasticKiwi,"She feeds the dogs home cooked meals, right?"
18-03-2018T00:27:07,unsteddyphoenix,Lmao what
18-03-2018T00:27:11,TheBeckoner,Yeah. Mine is the type that feels bad for everything and has to have it.
18-03-2018T00:27:13,Dadrobit,cya vat
18-03-2018T00:27:14,Twokinds,And a puppy
18-03-2018T00:27:16,unsteddyphoenix,Neve rheard of an impulse shopper who buy pets
18-03-2018T00:27:22,Twokinds,And four other puppies
18-03-2018T00:27:23,unsteddyphoenix,Dear lord.
18-03-2018T00:27:26,SpazztasticKiwi,And a partridge in a pear tree
18-03-2018T00:27:26,TheBeckoner,o woa
18-03-2018T00:27:29,unsteddyphoenix,ok youre making this up
18-03-2018T00:27:43,Dadrobit,"Unfortunately, people like that do exist."
18-03-2018T00:27:45,Twokinds,Nope. We still have most of the dogs.
18-03-2018T00:28:02,Twokinds,She has four dogs now.
18-03-2018T00:28:07,TheBeckoner,puppies are like babies. Good til large
18-03-2018T00:28:10,unsteddyphoenix,I...wow.
18-03-2018T00:28:12,SpazztasticKiwi,"Lucy, Maggie, Bubble, Bell..am I missing anyone?"
18-03-2018T00:28:19,unsteddyphoenix,I cant even picture anyone doing that.
18-03-2018T00:28:26,Dadrobit,S'why animal shelters are so packed. Everyone wants puppies and kittens and buy them on impulse forgetting that they turn into dogs and cats.
18-03-2018T00:28:35,TheBeckoner,yup
18-03-2018T00:28:43,SpazztasticKiwi,Mothering instinct maybe?
18-03-2018T00:28:48,Twokinds,"One passed away last year of old age, and the one she bought me I convinced her to rehome with a friend of hers"
18-03-2018T00:28:54,Twokinds,because I just couldn't take care of a dog.
18-03-2018T00:28:55,SpazztasticKiwi,Buddi
18-03-2018T00:29:02,Dadrobit,RIP
18-03-2018T00:29:30,unsteddyphoenix,buying pets as gifts is just...not a good idea.
18-03-2018T00:29:34,Twokinds,Yeah
18-03-2018T00:29:37,SpazztasticKiwi,She has a good heart
18-03-2018T00:29:39,Dadrobit,Hard agree
18-03-2018T00:30:06,SpazztasticKiwi,There’s other ways of helping though...
18-03-2018T00:30:14,TheBeckoner,"We should make disposable pets that ""expire"" after a few days"
18-03-2018T00:30:15,Twokinds,Thankfully she's sworn off pets now
18-03-2018T00:30:18,Dadrobit,"Dogs are the best people and deserve the best treatment, otherwise don't get one"
18-03-2018T00:30:23,TheBeckoner,^
18-03-2018T00:30:25,unsteddyphoenix,Does she have a new impulse thing?
18-03-2018T00:30:35,Dadrobit,Chia Pets?
18-03-2018T00:30:36,Twokinds,Yes. She's a thrifter now.
18-03-2018T00:30:46,unsteddyphoenix,Amazing.
18-03-2018T00:30:54,Dadrobit,"Ohhhh, little knick knacks everywhere now?"
18-03-2018T00:30:56,Twokinds,She buys and sells junk she finds at flea markets hoping she'll find that million dollar painting.
18-03-2018T00:31:06,TheBeckoner,Chia pets. or like freeze dried hamsters. Kinda like sea monkeys.
18-03-2018T00:31:18,Twokinds,She brought in a fax machine the other day asking me if it was valuable.
18-03-2018T00:31:21,unsteddyphoenix,gotta make it to pawn stars
18-03-2018T00:31:26,unsteddyphoenix,Hahaha
18-03-2018T00:31:30,SpazztasticKiwi,Does she not have another hobby
18-03-2018T00:31:31,TheBeckoner,Valuable 10 years ago maybe.
18-03-2018T00:31:41,unsteddyphoenix,Or in another 10 years
18-03-2018T00:31:42,Dadrobit,"""Give it a few years to appreciate in value"""
18-03-2018T00:31:44,unsteddyphoenix,ANTIQUE
18-03-2018T00:32:12,Twokinds,She's the type of person that spends anything she gets.
18-03-2018T00:32:21,Dadrobit,Oof
18-03-2018T00:32:24,SpazztasticKiwi,What happened to the manicure expert thing from last year
18-03-2018T00:32:34,SpazztasticKiwi,Forgot what that’s called
18-03-2018T00:32:35,Twokinds,I'm thankful I ended up the opposite of that.
18-03-2018T00:32:37,unsteddyphoenix,"And so, youve developed the opposite way."
18-03-2018T00:32:42,unsteddyphoenix,Classic mother-son thing
18-03-2018T00:32:55,Dadrobit,My sister is the same way.
18-03-2018T00:33:08,Bgrmystr2,"Out of sheer curiosity, tom.. do you still draw stuff after you finish streaming? Or do you take a break from drawing and do other stuff? :o"
18-03-2018T00:33:11,Dadrobit,Spends everything on her art stuffs that makes it past her kids.
18-03-2018T00:33:19,SpazztasticKiwi,My mother and sister are copies of each other
18-03-2018T00:33:35,SpazztasticKiwi,"I’m like my dad, and my mom doesn’t entirely like it sometimes"
18-03-2018T00:33:57,Twokinds,I'm playing Infinifactory
18-03-2018T00:34:04,Twokinds,Puzzle games help me unwind.
18-03-2018T00:34:25,Bgrmystr2,okay
18-03-2018T00:34:26,Dadrobit,"Exact opposite, puzzles stress me out"
18-03-2018T00:34:30,TheBeckoner,same
18-03-2018T00:34:31,unsteddyphoenix,Hm.
18-03-2018T00:34:34,Bgrmystr2,that's cool to know
18-03-2018T00:34:56,SpazztasticKiwi,I like swap-around puzzles and Bejeweled stuff
18-03-2018T00:35:01,unsteddyphoenix,Anyone played Into The Breach?
18-03-2018T00:35:05,Dadrobit,My mental dexterity is just not good enough
18-03-2018T00:35:08,TheBeckoner,"I'm more of a ""blow stuff up after work"" sorta guy"
18-03-2018T00:35:09,Twokinds,Yes
18-03-2018T00:35:25,Dadrobit,wasn't that a movie?
18-03-2018T00:35:40,SpazztasticKiwi,I like to blow stuff up too. But I’m afraid I’ll blow myself up one day
18-03-2018T00:35:59,TheBeckoner,Always a fun possibility.
18-03-2018T00:36:02,unsteddyphoenix,Does that count as an unwindy puzzle game?
18-03-2018T00:36:11,unsteddyphoenix,Im really liking it so far
18-03-2018T00:36:15,Twokinds,Into The Breach is pretty puzzle-y yes.
18-03-2018T00:37:09,SpazztasticKiwi,"I also like cooking. I kind of cook when I’m stressed, though I don’t always eat any of what I cook"
18-03-2018T00:37:31,SpazztasticKiwi,I’m a walking pressure cooker
18-03-2018T00:37:51,unsteddyphoenix,You sound like a convenient roomate
18-03-2018T00:37:53,TheBeckoner,Hmm I play alot of Besiege. Sort of puzzle like? More building I suppose
18-03-2018T00:38:23,TheBeckoner,"""Put this egg in your mouth...I need it hard boiled"""
18-03-2018T00:38:43,Bgrmystr2,besiege is similar to a puzzle game
18-03-2018T00:38:51,Twokinds,"I just like quick, no commitment games to unwind"
18-03-2018T00:38:53,Bgrmystr2,you need to use your brain and build stuff that works in a way
18-03-2018T00:39:16,Twokinds,"Puzzle games, tower defense games."
18-03-2018T00:39:20,SpazztasticKiwi,I don’t think anyone uses pressure cookers to boil eggs
18-03-2018T00:39:32,TheBeckoner,Yea. Idk I guess its an exception. After so many hours its very easy to play now.
18-03-2018T00:39:34,Dadrobit,Tower Defense I can get behind
18-03-2018T00:39:35,Bgrmystr2,"it's not a puzzle of solving a map, it's a puzzle of building a structure, or in that game's case, a weapon of scary flamethrows and buzzsaws"
18-03-2018T00:39:43,SpazztasticKiwi,Ever play resource management games
18-03-2018T00:40:04,Twokinds,Like what?
18-03-2018T00:40:06,TheBeckoner,I try more for cars and suspension Bgr. Sorta my goal with that game
18-03-2018T00:40:20,Dadrobit,"But I'm taking a gaming break after Morrowind, gotta do something else so I don't get lazy..."
18-03-2018T00:40:21,TheBeckoner,And I like TD games alot.
18-03-2018T00:40:39,Bgrmystr2,"lol, tower defense games are okay, I played a few"
18-03-2018T00:40:49,SpazztasticKiwi,You ask and now my brain has blanked
18-03-2018T00:40:53,Dadrobit,Like Cities Skylines?
18-03-2018T00:40:54,Bgrmystr2,"but once you learn how to deal with the wave, it's just kinda boring :/"
18-03-2018T00:41:00,TheBeckoner,There was one called fieldrunners I believe? Very fun imo
18-03-2018T00:41:02,Bgrmystr2,I know tom was a fan of SimCity 3000
18-03-2018T00:41:18,SpazztasticKiwi,Monster Legends is the only thing that comes to mind
18-03-2018T00:41:19,Dadrobit,Been a while since that ost came into the mix
18-03-2018T00:41:25,Bgrmystr2,yeh
18-03-2018T00:41:31,SpazztasticKiwi,But I’m not entirely sure that counts
18-03-2018T00:41:32,Bgrmystr2,It's tom's fault I had to go and find it
18-03-2018T00:41:40,Twokinds,I'm not familiar with Monster Legends.
18-03-2018T00:41:47,Bgrmystr2,SC3k is still managing resources
18-03-2018T00:41:55,Twokinds,Does Factorio count as resource management? I like that game a lot.
18-03-2018T00:42:06,Bgrmystr2,probably
18-03-2018T00:42:08,SpazztasticKiwi,It’s like virtual pet/ pvp game
18-03-2018T00:42:20,unsteddyphoenix,Heard a lot about that game
18-03-2018T00:42:28,SpazztasticKiwi,My favorite monster is Tempest
18-03-2018T00:43:08,SpazztasticKiwi,He’s an electric legendary monster
18-03-2018T00:43:42,TheBeckoner,There was a mobile  game a long while ago called Roboapocalypse. Super fun game but it's gone now...Basically like starcraft I guess
18-03-2018T00:44:22,SpazztasticKiwi,"It’s more of a mobile app to spend a car ride on, but I play it because my sister’s on it too and we’re on the same team"
18-03-2018T00:45:03,Bgrmystr2,I'm less of a fan of games like starcraft
18-03-2018T00:45:10,Bgrmystr2,gotta babysit every single unit
18-03-2018T00:45:16,Bgrmystr2,no thanks
18-03-2018T00:45:30,SpazztasticKiwi,I’m not a fan of that kind of thing either
18-03-2018T00:45:33,Bgrmystr2,"give me a real rts, large theatres of war"
18-03-2018T00:45:45,Bgrmystr2,I'll focus on the actual important stuff
18-03-2018T00:45:46,TheBeckoner,"Im not sure if I liked the way it played, the storyline or the aesthetic tbh"
18-03-2018T00:45:52,SpazztasticKiwi,But ML is on the App Store or you can play it through Facebook
18-03-2018T00:48:13,SpazztasticKiwi,"And I don’t know if it’s because I’m about to move or if I’m just now noticing, but FB has been showing me the listing of local houses for sale"
18-03-2018T00:48:27,TheBeckoner,Creepin on yah
18-03-2018T00:48:38,TheBeckoner,Mister zuckerberg
18-03-2018T00:49:01,SpazztasticKiwi,"But the problem is, they’re mainly 3 and 2 bedroom houses. Too big for just me and two cats and a frog"
18-03-2018T00:49:28,TheBeckoner,I just saw a shooting star!
18-03-2018T00:49:29,unsteddyphoenix,you seen those videos where a dude  purposely has a phone convo about catfood with a friend while not owning a cat
18-03-2018T00:49:35,TheBeckoner,For like a solid 2 seconds!
18-03-2018T00:49:35,Twokinds,3 bedrooms - one for each cat and the frog
18-03-2018T00:49:39,Twokinds,You can sleep on the couch
18-03-2018T00:49:41,unsteddyphoenix,And then the next day has ads about catfood?
18-03-2018T00:49:46,SpazztasticKiwi,Smartass
18-03-2018T00:49:56,unsteddyphoenix,makes sense
18-03-2018T00:50:17,unsteddyphoenix,Im surprised Holly lets you into her room so much Tom :thinking:
18-03-2018T00:50:22,Twokinds,lol
18-03-2018T00:50:30,unsteddyphoenix,Must like you
18-03-2018T00:50:48,SpazztasticKiwi,Peeks just needs a ten gallon tank. Pax Man frogs don’t move except to lunge at food and mate
18-03-2018T00:50:58,Twokinds,I'm looking for a house that's at least 2000 sq ft
18-03-2018T00:51:09,SpazztasticKiwi,And some of them don’t bother to move to mate
18-03-2018T00:51:29,SpazztasticKiwi,"If the grounds are too far away, they stay at “home”"
18-03-2018T00:51:31,unsteddyphoenix,Would you take your cat with you when you move?
18-03-2018T00:51:40,Twokinds,Yeah
18-03-2018T00:51:57,Twokinds,She won't like that. She doesn't like change any more than I do.
18-03-2018T00:52:12,SpazztasticKiwi,"Some of these houses are that big, and I saw one nestled in a woodsy area too"
18-03-2018T00:52:17,unsteddyphoenix,But she likes you and you like her~ :ctwokinds-daydreamingkat:
18-03-2018T00:52:39,SpazztasticKiwi,"Very tempting, but still a bit big"
18-03-2018T00:52:54,Twokinds,All the houses near the city are all boxes
18-03-2018T00:53:11,TheBeckoner,Make ur own box
18-03-2018T00:53:12,Twokinds,Eugh. I don't like that square shaped city house style
18-03-2018T00:53:20,SpazztasticKiwi,Another reason to stay out on the country
18-03-2018T00:53:26,Twokinds,"I don't know what it's called, so I dunno if you know what I mean"
18-03-2018T00:53:42,TheBeckoner,Country is nice. Lose a bit of convenience...but much quieter.
18-03-2018T00:53:43,SpazztasticKiwi,Claustrophobia?
18-03-2018T00:53:52,SpazztasticKiwi,Not a fan of neighbors?
18-03-2018T00:54:01,TheBeckoner,Me?
18-03-2018T00:54:05,Twokinds,It's just... really packed houses that are narrow from the front
18-03-2018T00:54:18,Twokinds,Every house is like that near Cincinnati
18-03-2018T00:54:28,unsteddyphoenix,Those houses that all look the same and are really close to each other?
18-03-2018T00:54:30,Dadrobit,"Yeah, I do, I wanna get one of the houses on the outer edge of the city, one of the nice pueblo lookin' ones with a decent ranch."
18-03-2018T00:54:31,SpazztasticKiwi,"Come on down to The Woods, where you can do pretty much whatever the hell you please"
18-03-2018T00:55:05,Bgrmystr2,"Shotgun house, Tom?"
18-03-2018T00:55:13,Dadrobit,Or like Spazz up in the wooded areas. Like Greer or Flag.
18-03-2018T00:55:26,Bgrmystr2,"Shotgun houses are the ones that are not wide at all, but they're long from front to backl"
18-03-2018T00:55:47,TheBeckoner,I live in a barn house thing
18-03-2018T00:55:58,Bgrmystr2,"prolly the width of a 2 car garage or so, I guess, on average"
18-03-2018T00:56:03,Bgrmystr2,there's a lot of houses like that around here
18-03-2018T00:56:06,Bgrmystr2,not a fan of them either
18-03-2018T00:56:31,TheBeckoner,Barn houses?
18-03-2018T00:56:57,Twokinds,I'll just pick one to show you
18-03-2018T00:57:16,Bgrmystr2,lol beck
18-03-2018T00:57:40,SpazztasticKiwi,The type of house you want/get also depends on how far you’re willing to move your stuff
18-03-2018T00:57:55,Twokinds,https://www.realtor.com/realestateandhomes-detail/3426-Trimble-Ave_Cincinnati_OH_45207_M44490-03577
18-03-2018T00:58:07,Twokinds,"Like that. That's just one example, but there are tons of them."
18-03-2018T00:58:16,Twokinds,They all look like that. Square. Close together.
18-03-2018T00:58:17,SpazztasticKiwi,Ew
18-03-2018T00:58:21,TheBeckoner,I am slight confuse but o well
18-03-2018T00:58:33,Bgrmystr2,ooooooooh
18-03-2018T00:58:37,TheBeckoner,Nope dont like that
18-03-2018T00:58:39,Bgrmystr2,yeah okay I know what you men
18-03-2018T00:58:42,Bgrmystr2,mean*
18-03-2018T00:58:45,unsteddyphoenix,Didnt look that bad until I saw the back lol
18-03-2018T00:58:54,Dadrobit,Omg that bathroom
18-03-2018T00:59:15,Twokinds,Well it was built 100 years ago
18-03-2018T00:59:20,unsteddyphoenix,oof yeah
18-03-2018T00:59:20,Bgrmystr2,it's basically a box
18-03-2018T00:59:29,TheBeckoner,Super narrow
18-03-2018T00:59:30,Dadrobit,I lived in a trailer for a year with a bigger bathroom.
18-03-2018T00:59:31,Twokinds,That's how all the houses are near the city. Pretty much.
18-03-2018T00:59:34,Bgrmystr2,aww
18-03-2018T00:59:37,Bgrmystr2,that sucks
18-03-2018T00:59:49,TheBeckoner,Buy land make a house?
18-03-2018T00:59:51,Twokinds,"When I move, it'll be outside Cinci."
18-03-2018T00:59:54,unsteddyphoenix,"You dont really need to be near the city though, do you"
18-03-2018T00:59:57,unsteddyphoenix,yeah
18-03-2018T01:00:18,Twokinds,I only need to be close enough to get good internet.
18-03-2018T01:00:29,unsteddyphoenix,Priority #1 agreed
18-03-2018T01:00:32,Twokinds,And Amazon Prime Now would be a plus. But I doubt it.
18-03-2018T01:01:06,Bgrmystr2,"if anything, tom, you can buy two lots and build a house close to the city"
18-03-2018T01:01:07,TheBeckoner,Mmm my internet suck here
18-03-2018T01:01:10,TheBeckoner,sucks*
18-03-2018T01:01:19,Bgrmystr2,so you get your house the way you want but close enough to have the net and stuff you want too
18-03-2018T01:01:38,Dadrobit,Pinching pennies for a place like this myself. https://www.realtor.com/realestateandhomes-detail/663-E-Saddle-Butte-St_Apache-Junction_AZ_85119_M25042-93762
18-03-2018T01:02:05,Bgrmystr2,desert house lool
18-03-2018T01:02:07,unsteddyphoenix,yo that desert motif
18-03-2018T01:02:21,unsteddyphoenix,Man houses are so cheap compared to here &gt;&lt;
18-03-2018T01:02:24,SpazztasticKiwi,https://www.realtor.com/realestateandhomes-detail/250-Meadowlark-Rd_Winfield_AL_35594_M79547-89372#photo18
18-03-2018T01:02:32,SpazztasticKiwi,That’s the kind of mess we got
18-03-2018T01:02:59,unsteddyphoenix,Yo 70k though. Damn.
18-03-2018T01:03:10,Bgrmystr2,the leaves tho
18-03-2018T01:03:10,Dadrobit,"Spazz, that's a lot of what we have here as well."
18-03-2018T01:03:53,Bgrmystr2,You know what I grew up in?
18-03-2018T01:04:02,Dadrobit,"Those desert houses are real popular on the city outskirts, but they're getting more and more crowded."
18-03-2018T01:04:10,Bgrmystr2,https://www.realtor.com/realestateandhomes-detail/103-Longwood-Rd_Saint-Marys_GA_31558_M62349-91322 :ptv-uneasy: I miss this house
18-03-2018T01:04:29,Bgrmystr2,whoever bought it fucking ruined it
18-03-2018T01:04:34,Bgrmystr2,on the inside
18-03-2018T01:04:45,Dadrobit,"Grandma owns one, used to have a clear sightline to the mountains, now they're totally surrounded by other houses"
18-03-2018T01:04:56,SpazztasticKiwi,Pretty on the outside
18-03-2018T01:05:02,Bgrmystr2,my parents built that house.
18-03-2018T01:05:15,Bgrmystr2,I wanna get another like it.
18-03-2018T01:05:34,TheBeckoner,I'd like a 40-50's style house
18-03-2018T01:05:44,TheBeckoner,with a nice old car in the driveway...
18-03-2018T01:05:59,SpazztasticKiwi,My grandma owns land that was wooded when she bought it and it’s still wooded. She ain’t selling to anyone who’s going to tear it up
18-03-2018T01:08:13,SpazztasticKiwi,"She did sell an old plot to a distant cousin, but he kept it as a pasture for horses. Unfortunately, he plans to build a new house over the old one and make a ranch for the public"
18-03-2018T01:08:17,TheBeckoner,The guy next to us has 80 acres. Would be great to have.
18-03-2018T01:08:47,TheBeckoner,Would have direct access to the main road that way...
18-03-2018T01:09:26,unsteddyphoenix,Declare war for his land
18-03-2018T01:09:55,SpazztasticKiwi,"I’m sure if someone reasonable asked, she’d sell some more property off. We’re out in the country but still get lovely internet"
18-03-2018T01:10:09,TheBeckoner,If that was acceptable it would be loads of fun...
18-03-2018T01:11:03,TheBeckoner,"But nah, he wants waaaaaayyyy too much money right now. However his kids dont really care about it. He does and we do but they dont, which means they would probably sell for cheaper."
18-03-2018T01:11:53,SpazztasticKiwi,"I used to think of moving out of state, but I’m not sure about the stress that’d put on Kiwi"
18-03-2018T01:13:41,Dadrobit,"There we go, found a mostly non incriminating photo. Grandparents ended up erecting a wall to block the houses, but when I was a kid, it was just straight desert right up to the mountains."
18-03-2018T01:13:42,Dadrobit,https://i.imgur.com/hYN4lvA.jpg
18-03-2018T01:13:49,unsteddyphoenix,cats can adapt pretty well
18-03-2018T01:14:00,unsteddyphoenix,We dragged our old cat across like 4 houses
18-03-2018T01:14:11,unsteddyphoenix,Wow that is a nice view
18-03-2018T01:14:17,SpazztasticKiwi,Kiwi’s a skittish cat
18-03-2018T01:14:42,TheBeckoner,That is pretty nice.
18-03-2018T01:14:43,Dadrobit,And the mountain is a super fun climb
18-03-2018T01:14:55,SpazztasticKiwi,"When I dyed my hair red, she didn’t want anything to do with me until I said something"
18-03-2018T01:14:57,TheBeckoner,I was gonna say. I would be all over that thing.
18-03-2018T01:15:10,SpazztasticKiwi,That’s a pretty view
18-03-2018T01:16:24,Dadrobit,You have a really nice starting area on the left edge of the range. http://i.imgur.com/vMEJCzB.jpg
18-03-2018T01:17:24,unsteddyphoenix,That just straight looks like a movie set
18-03-2018T01:17:40,TheBeckoner,Are those building functional?
18-03-2018T01:17:44,Dadrobit,http://i.imgur.com/54P5KOT.jpg
18-03-2018T01:17:44,Dadrobit,Probably my favorite picture I've taken from hiking it.
18-03-2018T01:17:46,SpazztasticKiwi,“Desert Massacre”
18-03-2018T01:17:48,unsteddyphoenix,Do people wear cowboy hats where you live
18-03-2018T01:17:57,TheBeckoner,Woa
18-03-2018T01:17:59,unsteddyphoenix,Oooo~
18-03-2018T01:18:02,TheBeckoner,Nice pic Dadro
18-03-2018T01:18:21,SpazztasticKiwi,"I want to climb that, but I have no coordination"
18-03-2018T01:18:38,Dadrobit,Those buildings are functional tourist traps.
18-03-2018T01:18:50,unsteddyphoenix,"lol, they look it"
18-03-2018T01:19:12,Dadrobit,"But yes, some people do wear cowboy hats unironically"
18-03-2018T01:19:22,unsteddyphoenix,Yesssss~
18-03-2018T01:19:24,SpazztasticKiwi,“Here’s a tub of genuine mountain soil. $5”
18-03-2018T01:19:25,unsteddyphoenix,This pleases me
18-03-2018T01:19:41,Dadrobit,There are a good amount of horse ranches out here for trail riding
18-03-2018T01:19:55,unsteddyphoenix,"Tell me people saw ""howdy"""
18-03-2018T01:20:04,TheBeckoner,Horses=too big no thank
18-03-2018T01:20:05,Dadrobit,I say howdy
18-03-2018T01:20:10,SpazztasticKiwi,I don’t ride horses unless there’s someone to hold on to
18-03-2018T01:20:18,unsteddyphoenix,Absolutely fantastic :ctwokinds-evalswink_sparkl:
18-03-2018T01:20:26,TheBeckoner,I say hey y'all mostly
18-03-2018T01:20:39,Dadrobit,And donkeys and ponies and miniature horses.
18-03-2018T01:20:49,TheBeckoner,Small is better
18-03-2018T01:21:05,SpazztasticKiwi,A lot of people say howdy down here. It’s the south
18-03-2018T01:21:46,unsteddyphoenix,Thats so fun~
18-03-2018T01:22:01,Dadrobit,"It's Arizona yo, Wild Wild West and all that"
18-03-2018T01:22:13,unsteddyphoenix,"But you dont have, like, the accent though. Do you?"
18-03-2018T01:22:13,Dadrobit,"Yuma, Tombstone, Billy the Kid..."
18-03-2018T01:22:20,SpazztasticKiwi,Good luck understanding some of our accents though. We either don’t enunciate well or talk so fast it’s a blur
18-03-2018T01:22:25,TheBeckoner,I dont think I have ever heard howsy said in a normal setting tbh. And im in South Texas..
18-03-2018T01:22:42,TheBeckoner,howdy*
18-03-2018T01:22:42,unsteddyphoenix,Eh I do the same and dont even have the excuse of an accent
18-03-2018T01:22:50,Dadrobit,"Only when I say ""Howdy"". Otherwise Arizonans speak perfect English."
18-03-2018T01:23:04,unsteddyphoenix,:T
18-03-2018T01:23:09,SpazztasticKiwi,"I have an accent, but it’s from mummy Northern-born dad and his family mixing with my Southern-born mother and her family"
18-03-2018T01:23:11,TheBeckoner,No accent here. unless Im trying to be funny
18-03-2018T01:23:27,SpazztasticKiwi,*my Northern-born
18-03-2018T01:24:25,Bgrmystr2,fuckin window closed rip literally everything that happened in the chat
18-03-2018T01:24:30,Dadrobit,GG
18-03-2018T01:24:44,SpazztasticKiwi,I also have influence from the YouTubers I watch. A good bit are UK (or Irish)
18-03-2018T01:24:56,Bgrmystr2,"sigh, didn't wanna see what was said anyway &gt;.&gt;"
18-03-2018T01:25:44,TheBeckoner,"We said ""Wow isnt Bg a loser?"" ""yeah"""
18-03-2018T01:25:49,unsteddyphoenix,You did not get an accent from youtubers
18-03-2018T01:26:07,SpazztasticKiwi,I’ve adapted a lot of Seán’s mannerisms
18-03-2018T01:26:42,unsteddyphoenix,Oh
18-03-2018T01:26:50,unsteddyphoenix,Yeah I do that
18-03-2018T01:27:24,TheBeckoner,I like to imitate pewdiepie's voice with some stuff. Can be very fun
