date,user,comment
18-03-2018T02:41:23,Vatruvius,Quite*
18-03-2018T02:41:59,SpazztasticKiwi,I don’t remember Aang having murderous tendencies
18-03-2018T02:42:30,Vatruvius,"It is a kid movie, but how many died vecause he ran away?"
18-03-2018T02:42:39,Dadrobit,"I'm tempted to haiku some ""water bending"", but that would be too lewd, even for me."
18-03-2018T02:42:44,Vatruvius,because*
18-03-2018T02:44:56,SpazztasticKiwi,Imma try going to bed
18-03-2018T02:45:10,SpazztasticKiwi,I’ll see y’all tomorrow
18-03-2018T02:45:15,unsteddyphoenix,later
18-03-2018T02:45:19,Vatruvius,"I need to go to bed...getting up in 5 hourse...agh! I hate you life! Why can't I just relax, play games, and be a part of the Twokinds community? Why do I have to be productive! :ptv-angry::ptv-whiny:"
18-03-2018T02:45:26,Dadrobit,"Good night, I should probably do the same before I piss off unsteddy too too much."
18-03-2018T02:45:48,unsteddyphoenix,Imma get you
18-03-2018T02:45:57,Dadrobit,Please do.
18-03-2018T02:46:04,Vatruvius,Goodnight everyone!
18-03-2018T02:46:09,Twokinds,I'm gunna go to bed too soon
18-03-2018T02:46:12,unsteddyphoenix,The only reason I havent return-haiku'd yet is because I havent got one scathing enough
18-03-2018T02:46:24,unsteddyphoenix,Current blanket status?
18-03-2018T02:46:26,Twokinds,As soon as my bed heater heats up.
18-03-2018T02:46:36,unsteddyphoenix,Haha
18-03-2018T02:46:44,unsteddyphoenix,"Alright, gnight sleepy americans~"
18-03-2018T02:47:11,Vatruvius,"Bed hester? Is it that cold Tom? Here, take this Vegas heat from me, I don't want it."
18-03-2018T02:47:22,Vatruvius,heater?
18-03-2018T02:47:28,Vatruvius,*
18-03-2018T02:47:36,Bgrmystr2,only 2:47am pffff
18-03-2018T02:48:53,Twokinds,lol
18-03-2018T02:49:00,Twokinds,I just hate getting into a cold bed
18-03-2018T02:49:26,Vatruvius,"I got fleese sheets, bedt thing for cold winter nights."
18-03-2018T02:49:36,Vatruvius,Best*
18-03-2018T02:49:44,Dadrobit,"With thoughts of his Kat. Bird's dreams are fertile, shameless. Something burns inside."
18-03-2018T02:49:53,Twokinds,"It used to be, I had a bed in an attic and it got REALLY cold. It was misery. Now, I don't put up with that."
18-03-2018T02:49:58,Twokinds,"Warm bed, all the time."
18-03-2018T02:50:15,unsteddyphoenix,FERTILE.
18-03-2018T02:50:44,unsteddyphoenix,Why were you in an attic?
18-03-2018T02:51:06,Vatruvius,My doh is my bed heater. :ptv-hearts:
18-03-2018T02:51:17,Vatruvius,Dog*
18-03-2018T02:51:20,Dadrobit,Fight the weather!
18-03-2018T02:51:36,Vatruvius,"Stupid phone keyboard, agh!"
18-03-2018T02:51:36,Bgrmystr2,xD Dadro
18-03-2018T02:51:57,Twokinds,"Well, there were some hard times back then."
18-03-2018T02:52:15,unsteddyphoenix,Apparently.
18-03-2018T02:52:36,unsteddyphoenix,What a contrast between that and buying 15 animals on a whim
18-03-2018T02:52:58,Twokinds,"It's complicated, but we had to put up with a lot of moving around for a while."
18-03-2018T02:53:14,Twokinds,Lotta downsizing.
18-03-2018T02:53:18,SpazztasticKiwi,"Pets normally keep your bed warm for you. Granted, Kiwi and Bagheera don’t cover much"
18-03-2018T02:53:32,Vatruvius,"I mean, first world problems type stuff...I had no bed heater, I slept under a roof..."
18-03-2018T02:53:33,unsteddyphoenix,Been there. Had to jump around like 4 houses in as many years.
18-03-2018T02:53:55,SpazztasticKiwi,"I used to have a heating blanket. Washed it, and it’s not been found since"
18-03-2018T02:53:55,Twokinds,My cat hasn't slept in my bed since her first year
18-03-2018T02:54:09,Twokinds,I think I kicked her in my sleep once and it's scared her off ever since.
18-03-2018T02:54:09,Vatruvius,:ptv-tease:
18-03-2018T02:54:13,SpazztasticKiwi,That’s probably a good thing for you
18-03-2018T02:54:25,unsteddyphoenix,Aww. :ctwokinds-zenshocked:
18-03-2018T02:54:26,SpazztasticKiwi,I kicked Kiwi off the bed once
18-03-2018T02:54:38,Twokinds,lol
18-03-2018T02:54:53,Dadrobit,"Yeah, kitty doesn't sleep with me unless it's on the couch. The bed just isn't safe."
18-03-2018T02:54:56,SpazztasticKiwi,"I stretched, heard a thump, and there she was on the floor “What the hell was that for?”"
18-03-2018T02:55:02,unsteddyphoenix,Dont kick cats guys~
18-03-2018T02:55:13,SpazztasticKiwi,It was an accident
18-03-2018T02:55:24,Vatruvius,"Alright, goodnight everyone! For real this time!"
18-03-2018T02:55:27,unsteddyphoenix,Your cats sleep at the foot of the bed?
18-03-2018T02:55:31,SpazztasticKiwi,Yep
18-03-2018T02:55:39,unsteddyphoenix,Mine just pet herself in the middle taking up as most space as possible
18-03-2018T02:55:42,Bgrmystr2,I'd prolly smother a pet in my sleep by hugging the stuffing out of it lol
18-03-2018T02:55:53,SpazztasticKiwi,"Bagheera sleeps next to me, on my hip, or in the covers mainly"
18-03-2018T02:56:25,unsteddyphoenix,Awh~ he gets snuggled up?
18-03-2018T02:56:44,SpazztasticKiwi,I once woke up wondering why there was a furry mass right up against my back
18-03-2018T02:57:05,unsteddyphoenix,:ctwokinds-daydreamingkat:
18-03-2018T02:57:20,SpazztasticKiwi,"When he’s unhappy with me, he sleeps at the foot of the bed on the other pillow"
18-03-2018T02:58:04,Dadrobit,"It is easier, To forsake myself with her. Sleep in living room."
18-03-2018T02:58:07,unsteddyphoenix,'cause you keep kicking him?
18-03-2018T02:58:32,SpazztasticKiwi,"No. If I clean his eye boogs or clip his nails, he pouts"
18-03-2018T02:58:43,SpazztasticKiwi,Like a toddler
18-03-2018T02:58:48,unsteddyphoenix,they do get those eyeboogs
18-03-2018T02:59:20,SpazztasticKiwi,"“I’ll ignore you, but down here so you know I’m ignoring you”"
18-03-2018T03:00:04,Dadrobit,Clean the eyeboogs. She will not be too happy. But now she is clean.
18-03-2018T03:00:28,unsteddyphoenix,i have mixed feelings about your haikus
18-03-2018T03:01:03,SpazztasticKiwi,He’ll back talk you too.
18-03-2018T03:01:05,Dadrobit,That was terrible. I should've quit while ahead. Now I cannot stop.
18-03-2018T03:01:36,SpazztasticKiwi,"“Don’t touch that, Bagheera.” *meow of protest*"
18-03-2018T03:01:43,unsteddyphoenix,:ctwokinds-eyeroll::ctwokinds-clovischuckle:
18-03-2018T03:02:03,unsteddyphoenix,*displeased meow*
18-03-2018T03:02:53,SpazztasticKiwi,"And if you pick him up when he doesn’t want to be picked up, he screams. And I’m not kidding - the meow he’ll let out is loud and piercing"
18-03-2018T03:03:39,unsteddyphoenix,:ctwokinds-floAAA:
18-03-2018T03:03:42,Twokinds,"Maren x Clovis, that's an interesting ship"
18-03-2018T03:04:05,Bgrmystr2,:thinking:
18-03-2018T03:04:10,Dadrobit,In talk of protest. Cat is vile debater. Poop all over floor.
18-03-2018T03:04:13,unsteddyphoenix,Hmm...
18-03-2018T03:04:16,Bgrmystr2,that is an interesting ship
18-03-2018T03:04:29,Bgrmystr2,I don't expect it to work
18-03-2018T03:04:31,Bgrmystr2,because clovis
18-03-2018T03:04:33,unsteddyphoenix,I feel like Maren could be coerced into being evil.
18-03-2018T03:04:34,Bgrmystr2,but
18-03-2018T03:04:37,SpazztasticKiwi,They’d kill each other
18-03-2018T03:04:37,Bgrmystr2,ehh
18-03-2018T03:04:41,Bgrmystr2,"I don't think so, phoenix"
18-03-2018T03:04:57,Bgrmystr2,"I don't think she's evil, she's just.. she doesn't really care about things"
18-03-2018T03:05:07,unsteddyphoenix,But then it could be...all dramatic. Sister vs sister~
18-03-2018T03:05:08,Dadrobit,"I mean, she dated evil Trace"
18-03-2018T03:05:10,SpazztasticKiwi,Maren seems like someone who’d do something because someone else said she couldn’t
18-03-2018T03:05:28,unsteddyphoenix,She likes her a bad boy
18-03-2018T03:05:39,unsteddyphoenix,Though Clovis's sexist views would have to go real quick
18-03-2018T03:05:51,Bgrmystr2,not seeing that go away anytime soon
18-03-2018T03:05:52,Bgrmystr2,if ever
18-03-2018T03:05:58,Dadrobit,Maybe she's into that?
18-03-2018T03:06:12,unsteddyphoenix,Maybe
18-03-2018T03:06:25,Dadrobit,Dating literally Hitler does not bode well for a healthy personality.
18-03-2018T03:07:31,SpazztasticKiwi,Clovis reminds me of a Venus flytrap
18-03-2018T03:08:36,SpazztasticKiwi,But I seriously need to try to do the sleeping
18-03-2018T03:08:49,SpazztasticKiwi,I get up in a few hours
18-03-2018T03:09:00,Dadrobit,Sticky mouth of plant. Such is the Wolf's likeness. He catches his prey.
18-03-2018T03:10:06,unsteddyphoenix,Good luck
18-03-2018T03:10:16,unsteddyphoenix,Also lol
18-03-2018T03:10:25,Dadrobit,"Have a good one, Spazz."
18-03-2018T03:10:38,unsteddyphoenix,That conjures some interesting images
18-03-2018T03:11:38,Dadrobit,"Tom, can you do Spazz, unsteddy, and me a solid and sketch Clovis with a venus flytrap as a mouth real quick?"
18-03-2018T03:12:32,unsteddyphoenix,Im pretty sure he's gonna go to bed in like 41seconds
18-03-2018T03:12:55,Dadrobit,Was worth a shot.
18-03-2018T03:13:30,unsteddyphoenix,Shoot for the sun~
18-03-2018T03:13:44,Bgrmystr2,xD
18-03-2018T03:14:40,SpazztasticKiwi,Slow your roll. I’m sure Tom’s more tired than me. He did all that drawing after all
18-03-2018T03:15:11,Dadrobit,He shoots for the sun. Days and weeks for sketch it takes. They call him Daddy.
18-03-2018T03:15:24,unsteddyphoenix,:ctwokinds-NataniHAHA: god damnit.
18-03-2018T03:15:34,SpazztasticKiwi,You’re not my dad
18-03-2018T03:15:56,unsteddyphoenix,are you sure?
18-03-2018T03:16:15,SpazztasticKiwi,My dad’s been dead for nine years. So yes
18-03-2018T03:16:48,unsteddyphoenix,Damnit.
18-03-2018T03:16:52,Dadrobit,"There's a very short list of people who could have had my child, and I don't think any of them would have Spazz's eloquence just yet, so probably not."
18-03-2018T03:17:04,unsteddyphoenix,Well I suppose that was going to happen inevitably. Sorry kiwi~
18-03-2018T03:18:05,SpazztasticKiwi,"I don’t remember him too much, don’t worry about it"
18-03-2018T03:18:20,SpazztasticKiwi,I’m too old for you to be my dad anyway
18-03-2018T03:18:36,Dadrobit,"Yeah, I didn't start That youn."
18-03-2018T03:18:38,Dadrobit,young*
18-03-2018T03:18:47,unsteddyphoenix,allegedly
18-03-2018T03:19:19,Twokinds,g'night
18-03-2018T03:19:28,SpazztasticKiwi,Night Tom
18-03-2018T03:19:33,Bgrmystr2,gnight tom
18-03-2018T03:19:36,unsteddyphoenix,"gnight Tom, seeya later."
18-03-2018T03:19:48,Dadrobit,"Night, Tom. Have a good one."
18-03-2018T03:20:02,SpazztasticKiwi,✌🏻
18-03-2018T03:32:10,Dadrobit,"Alright, I'm doin' the same, drifting off in my seat as it is. Have a good one y'all."
18-03-2018T03:32:32,unsteddyphoenix,'night daddy~
18-03-2018T05:01:33,Barabashe4ka,Hello everybody
18-03-2018T08:16:36,Vatruvius,...:ptv-sleepy:...
18-03-2018T08:55:53,Barabashe4ka,I'm again at a wrong time
18-03-2018T09:49:36,Vatruvius,Agh...I hate airports...and waiting...I hate them both equally the most.
18-03-2018T12:16:07,Vatruvius,:ptv-unimpressed:
18-03-2018T13:19:15,Barabashe4ka,Good night everybody
18-03-2018T13:28:23,Vatruvius,Goodnight!?!
18-03-2018T13:29:24,Barabashe4ka,"I'm in Russia, we have a night"
18-03-2018T13:32:56,Vatruvius,Well goodnight! Don't freeze to death! :D
18-03-2018T13:34:35,Barabashe4ka,xD
18-03-2018T13:34:37,Barabashe4ka,Thank you
18-03-2018T15:13:42,Twokinds,:ptv-sneakysmirk:
18-03-2018T15:19:29,iliar,"Good morning, Tom."
18-03-2018T15:19:47,iliar,"Fun fact. People liked the text on the ""Nórage à trois"" sketch so much, that I was forced to ""translate"" the color version too."
18-03-2018T15:24:51,Twokinds,"Ah, I forgot there was text on it"
18-03-2018T15:51:36,NightMeaty22,i am in a cardbord box in a pickup truck yay
18-03-2018T16:15:33,Vatruvius,Hey Tom!
18-03-2018T16:20:45,Twokinds,Hello!
18-03-2018T16:52:55,SpazztasticKiwi,"Morning folks. I just took a nap, and I believe I feel worse"
18-03-2018T16:53:56,Vatruvius,How can that be?
18-03-2018T16:54:22,SpazztasticKiwi,I still feel tired
18-03-2018T16:54:41,SpazztasticKiwi,But now I’m also kinda sore
18-03-2018T16:55:36,TheBeckoner,Also took a nap. Also feel bad lol
18-03-2018T16:55:44,TheBeckoner,more energy i suppose.
18-03-2018T16:55:53,SpazztasticKiwi,Naps are a gamble
18-03-2018T17:01:36,Twokinds,I never nap
18-03-2018T17:01:44,Twokinds,Naps are always bad for me.
18-03-2018T17:08:25,unsteddyphoenix,Yeah me too. Idk how people do it.
18-03-2018T17:08:31,unsteddyphoenix,I feel like I never hear about good naps
18-03-2018T17:08:46,unsteddyphoenix,"Only ""I napped for 3 hours and now I feel awful"" stories"
18-03-2018T17:12:25,Twokinds,That's always been my experience
18-03-2018T17:12:38,Twokinds,Naps just throw everything off. I think it's something you have to make a habit of
18-03-2018T17:12:52,Twokinds,"Like, if you nap at the same time for a week or two, you get used to it."
18-03-2018T17:13:11,Twokinds,But I don't want to end up dependant on naps.
18-03-2018T17:13:28,Twokinds,Cause then you'd just feel awful when you have to disrupt that cycle.
18-03-2018T17:14:19,unsteddyphoenix,"I have heard that like, you can reduce your sleep time by taking multiple naps in the day"
18-03-2018T17:14:29,unsteddyphoenix,And still feel good.
18-03-2018T17:14:48,unsteddyphoenix,But yeah if it's disrupted you'd probably have to start all over again
18-03-2018T17:18:05,Bgrmystr2,that's unlikely to be beneficial to your health though
18-03-2018T17:18:19,Bgrmystr2,cuz the body benefits from a longer and concentrated sleep
18-03-2018T17:18:46,Bgrmystr2,rather than a bunch of shorter sleeps where it can't calculate all the information it took in
18-03-2018T17:19:03,unsteddyphoenix,Calculate information...
18-03-2018T17:19:11,Vatruvius,"I nap sometimes, they have always been good but just really do not happen all that often. Guess I am unique...yay?"
18-03-2018T17:19:16,Bgrmystr2,Rem sleep and such lol
18-03-2018T17:19:37,unsteddyphoenix,So you have mostly bad naps? Seems standard.
18-03-2018T17:19:54,Vatruvius,"Yeah, long sleeps are needed, you have to get that deep sleep in."
18-03-2018T17:20:11,Bgrmystr2,"it's better to have all your sleep at once, far as I've read"
18-03-2018T17:20:14,unsteddyphoenix,I dont think going into rem is a perquisite of feeling well-rested
18-03-2018T17:20:27,Vatruvius,"Every nap I have is goos, I just do not nap all that often."
18-03-2018T17:20:30,Bgrmystr2,"rem kind of the whole point of sleeping, far as I recall"
18-03-2018T17:20:37,Vatruvius,Good*
18-03-2018T17:21:16,unsteddyphoenix,Shrug. I never looked into it that much since...im not gonna do naps.
18-03-2018T17:22:02,Vatruvius,"Yeah, if you get shorter and shorter periods of sleep your body will skip the other stages of sleep and just pass into rem. It is the most important stage for the body and brain."
18-03-2018T17:22:28,Bgrmystr2,:point_up_2:
18-03-2018T17:23:05,Bgrmystr2,"I'm sure people can function with naps or whatever, but I just don't see it as efficient at all"
18-03-2018T17:23:13,Bgrmystr2,because you don't benefit from it really
18-03-2018T17:23:36,Bgrmystr2,"it's just resting the physical body, which you don't really need to sleep for"
18-03-2018T17:25:29,Vatruvius,"I really only nap when low on sleep...like making it through finals I will nap on the weekend, regain the sleep I lost."
18-03-2018T17:25:59,Bgrmystr2,"I don't nap at all, myself. don't consider it worth doing. Just sleep till my body wakes up each night"
18-03-2018T17:26:07,Bgrmystr2,and I can function all day.
18-03-2018T17:26:10,Bgrmystr2,no coffee needed
18-03-2018T17:26:48,Vatruvius,I don't drink coffee either.
18-03-2018T17:27:15,Bgrmystr2,"only time I don't function is when I don't get enough sleep, which is par-for-the-course for anyone"
18-03-2018T17:28:03,Vatruvius,Which was your favorite sketch yesterday Tom?
18-03-2018T17:29:33,unsteddyphoenix,Thats my secret...I never function. :ptv-dealwithit:
18-03-2018T17:30:07,Bgrmystr2,xD
18-03-2018T17:31:33,unsteddyphoenix,"I'd love to sleep less, but it's hard to plan out sleep cycles 'cause I can never fall asleep straight away"
18-03-2018T17:31:38,unsteddyphoenix,Which messes it all up
18-03-2018T17:32:08,Bgrmystr2,"yup, that's a lack of sleep cycle that your body can't sleep straight away xD"
18-03-2018T17:32:16,Bgrmystr2,"vicious cycle, that is"
18-03-2018T17:32:53,unsteddyphoenix,Very upsettinh
18-03-2018T17:32:58,Bgrmystr2,I fall asleep pretty quick If I didn't get enough sleep the previous night.. kinda like yesterday
18-03-2018T17:33:23,Bgrmystr2,"but if It's not time to sleep yet, my body won't just sleep"
18-03-2018T17:33:28,Bgrmystr2,doesn't sleep on command..
18-03-2018T17:33:47,Bgrmystr2,such a rebellious body :ptv-unimpressed:
18-03-2018T17:34:32,unsteddyphoenix,Also the thing when youre super tired during most of the day then super awake when you actually want to go to bed ugh
18-03-2018T17:34:44,Vatruvius,"My dad passes out in 5 minutes flat, no matter what...:ptv-angry:"
18-03-2018T17:35:42,Bgrmystr2,"because he probably doesn't get enough sleep every single night, Vatru"
18-03-2018T17:35:45,unsteddyphoenix,impressive
18-03-2018T17:35:47,Bgrmystr2,it's a VERY common thing
18-03-2018T17:36:47,Vatruvius,Yeah...pretty sure he has sleep apnea.
18-03-2018T17:37:16,Vatruvius,Still pisses me off though...wish I could fall asleep that fast.
18-03-2018T17:38:19,Bgrmystr2,I don't think you do though
18-03-2018T17:39:07,Vatruvius,"Meh...fine...just a comfy, non-springy matress then."
18-03-2018T17:39:12,Bgrmystr2,xDD
18-03-2018T17:39:15,Bgrmystr2,probably better
18-03-2018T17:41:04,TheBeckoner,I have read that adheres to a napping schedule works well for getting more awake hours during the day. And pre-industrial revolution most people took two main naps everyday vs the one large one we have now. Although missing a nap totally screws you over.
18-03-2018T17:41:29,TheBeckoner,"mono sleep is the easiest because there is o risk, maybe not the most effective though."
18-03-2018T17:41:34,TheBeckoner,no*
18-03-2018T17:41:47,TheBeckoner,adhering*
18-03-2018T17:42:39,Bgrmystr2,Seems like it would take longer
18-03-2018T17:42:45,Bgrmystr2,take more time out of the day
18-03-2018T17:42:49,Bgrmystr2,to sleep twice
18-03-2018T17:43:10,TheBeckoner,In total it doesn't. Sleep twice but not for as long as you would once.
18-03-2018T17:43:38,TheBeckoner,From what I gather anything past a 3 nap a day schedule is very very hard to stick to
18-03-2018T17:43:58,Bgrmystr2,how would you function at all
18-03-2018T17:44:00,TheBeckoner,"The naps are usually spread out evenly, or based on time"
18-03-2018T17:44:03,Bgrmystr2,would you even get rem sleep?
18-03-2018T17:44:06,Bgrmystr2,at all?
18-03-2018T17:44:08,TheBeckoner,Yes
18-03-2018T17:44:23,Bgrmystr2,"I mean, you're looking at less than 3 hours per sleep"
18-03-2018T17:44:26,TheBeckoner,"Your body will adapt to getting into REM fater than normal, but the transition sucks"
18-03-2018T17:44:30,Bgrmystr2,that's hardly enough for Rem
18-03-2018T17:44:43,TheBeckoner,For a normal person yeah.
18-03-2018T17:44:49,Bgrmystr2,for most people yeah
18-03-2018T17:45:02,Bgrmystr2,that transition being lacking is what makes it not as good
18-03-2018T17:45:26,Bgrmystr2,tis probably why we largely transferred to a single long sleep from multiple shorter sleeps
18-03-2018T17:45:30,Bgrmystr2,rather than the other way around
18-03-2018T17:45:39,TheBeckoner,"People have diffrent approaches to that. Some will start taking scheduled naps, others go til exhaustion them start."
18-03-2018T17:45:51,Bgrmystr2,humanity naturally gravitates towards better and more efficient ways of sleeping.
18-03-2018T17:46:28,Bgrmystr2,a large part of people who don't sleep all at once only take naps because they don't plan to have all their sleep at once
18-03-2018T17:46:32,Bgrmystr2,it's basically bad blanning
18-03-2018T17:46:36,Bgrmystr2,planning* even
18-03-2018T17:46:42,Twokinds,I just go to bed at night and fall asleep and then wake up the next day.
18-03-2018T17:46:44,Bgrmystr2,bad planning.. blanning &gt;;c
18-03-2018T17:46:53,Bgrmystr2,"same, tom xD"
18-03-2018T17:47:02,Twokinds,"More like... bed planning, am I right?"
18-03-2018T17:47:30,Bgrmystr2,:ptv-pouty: mthrfkr take my +1 and getouttahere with yer puns! xD
18-03-2018T17:47:42,Bgrmystr2,"or don't, I ain't yer parent lol"
18-03-2018T17:47:50,TheBeckoner,I was trying a two nap deal. Once when back from school then going to bed around 2 am and waking up at 8. I felt fine but it was weird to nap mid day when everyone was about...made me feel lazy
18-03-2018T17:47:56,unsteddyphoenix,Ayyy~
18-03-2018T17:48:36,unsteddyphoenix,You mean you dont calculate the sleep-coefficients and derive the ideal sleep formula?
18-03-2018T17:48:57,TheBeckoner,I go night night in soft place
18-03-2018T17:49:02,TheBeckoner,simpleboi
18-03-2018T17:54:36,TheBeckoner,I do hear older people sleep often. I assume that is because the have less energy total after sleeping.
18-03-2018T17:56:06,SpazztasticKiwi,I took a nap because I didn’t get to sleep until late and had to wake up early this morning
18-03-2018T17:56:45,SpazztasticKiwi,That’s normally the only time I do naps
18-03-2018T17:56:50,unsteddyphoenix,"Less a nap and more ""didnt get much sleep"""
18-03-2018T17:57:09,Dadrobit,"Holy crap, people were flying on the freeway coming home today. Was doing 78 in the right lane and was getting passed like it was nothing."
18-03-2018T17:57:37,Dadrobit,feelsgoodman
18-03-2018T17:57:45,Twokinds,"If I planned my sleeps, I wouldn't be going to bed at 4am most nights."
18-03-2018T17:57:49,TheBeckoner,I got 5 hours last night and I have work to do so i needed something
18-03-2018T17:57:52,Twokinds,Dadrobit: Dats fast
18-03-2018T17:58:29,Twokinds,I'm the loser on the highway going exactly the speed limit on cruise.
18-03-2018T17:58:35,Dadrobit,"Was shadowing a cop, he just didn't care I guess. Too much paperwork."
18-03-2018T17:58:37,TheBeckoner,I try and only lose so much sleep that a 20 minute non rem sleep nap can take up for it
18-03-2018T17:59:08,Bgrmystr2,"lol Dadro, the legal thing to do is to go with the flow of traffic"
18-03-2018T17:59:08,TheBeckoner,I usually do 80 back and forth from school...just no one around
18-03-2018T17:59:18,Bgrmystr2,"if the flow of traffic is above the speed limit, you follow the flow"
18-03-2018T17:59:26,Dadrobit,I generally put it at around 9+ the limit and hit cruise control unless the flow is that much faster.
18-03-2018T17:59:32,unsteddyphoenix,Just find a streamer and plan your sleep their stream times~
18-03-2018T17:59:43,Bgrmystr2,"xD Phoenix, story of my life"
18-03-2018T17:59:49,Bgrmystr2,"cept I do it w/ two streamers, generally"
18-03-2018T17:59:52,Bgrmystr2,and still make it work
18-03-2018T17:59:56,TheBeckoner,My truck tops out at 115 and then shuts the motor off till 85 lol
18-03-2018T18:00:23,TheBeckoner,"Probably some ""stop running from the cops feature"""
18-03-2018T18:00:29,Dadrobit,"Still haven't hit the limiter on my car, dunno where it's at. At least 118...."
18-03-2018T18:00:46,Dadrobit,"Yeah, it's called a limiter."
18-03-2018T18:00:50,TheBeckoner,Yeah
18-03-2018T18:01:06,unsteddyphoenix,thats a thing?
18-03-2018T18:01:08,TheBeckoner,My dads tops out at 95. First time he figured that out he was pissed lol
18-03-2018T18:01:09,unsteddyphoenix,"Huh, clever."
18-03-2018T18:01:27,Bgrmystr2,most cars have limiters far as I'm aware
18-03-2018T18:01:29,unsteddyphoenix,It'd be cool if it auto-adjusted to the speed limit of the road youre on
18-03-2018T18:01:43,Bgrmystr2,"if you buy a car from a dealership, it most likely has a limiter"
18-03-2018T18:01:47,TheBeckoner,most sporty cars dont
18-03-2018T18:01:53,TheBeckoner,and some SUV's dont
18-03-2018T18:02:06,TheBeckoner,Most trucks and sedans do however
18-03-2018T18:02:08,Bgrmystr2,"yeah sporty cars don't, because they're not made to be bought by everyday consumers"
18-03-2018T18:02:29,Dadrobit,"The cops out here can be finicky. Haven't been pulled over in years and years, but I've gotten hit for going 5 over and 5 under."
18-03-2018T18:02:48,unsteddyphoenix,sometimes cops gotta fill a quota
18-03-2018T18:02:57,TheBeckoner,My first ticket was 60 in a 40 but the dude was nice and way reduced the ticket.
18-03-2018T18:03:03,Dadrobit,Didn't ive me tickets tho
18-03-2018T18:03:06,Dadrobit,give*
18-03-2018T18:03:12,TheBeckoner,"""civilian interactions"""
18-03-2018T18:03:18,Bgrmystr2,something something 200 tickets... BEFORE NOON
18-03-2018T18:03:25,Dadrobit,"""201"""
18-03-2018T18:03:37,Bgrmystr2,200 was only the requirement tho :P
18-03-2018T18:04:01,TheBeckoner,Over achievers
18-03-2018T18:04:45,Dadrobit,"They can be super cool as well. I remember getting pulled over w/ my brother when we were young and he was cruising at 122. Cop pulled us over and was like, ""You know how fast you were going?"" ""..... No?"" ""Y'all were doing 85."""
18-03-2018T18:04:48,TheBeckoner,I heard of a cop that needed 6 interaction but only got 5 and got reprimanded. One of the interactions was solving a rape.
18-03-2018T18:05:11,Dadrobit,Didn't even give him a ticket.
18-03-2018T18:05:13,TheBeckoner,interactions*
18-03-2018T18:05:43,Dadrobit,"""But we knew that he knew because he mentioned how he saw him cross over the Gore area when we first merged onto the freeway."
18-03-2018T18:05:58,TheBeckoner,"I hope for that whenever I think Im getting pulled over...""please just give me a warning"""
18-03-2018T18:06:45,Dadrobit,"Put your hands at 10 and 2, smile and say please and thank you officer."
18-03-2018T18:06:50,TheBeckoner,yup
18-03-2018T18:07:11,TheBeckoner,If the mood is right get a ultra tasteful joke in and hope for the best.
18-03-2018T18:07:22,TheBeckoner,usually works
18-03-2018T18:07:23,Dadrobit,"Been pulled over plenty, never gotten a ticket from a cop in my life"
18-03-2018T18:07:55,Dadrobit,(Did get two for trying to beat a red light when I was 17 though)
18-03-2018T18:08:03,Dadrobit,(Friggin cameras)
