date,user,comment
19-04-2018T00:00:04,Dadrobit,"So earlier when I left, I got a call from my pops."
19-04-2018T00:00:12,MarvTheHugPharaoh,"Hmm If I can dodge the bullets and Raine get with either Eric, sythe or maren, this I think I can stomach the Kat"
19-04-2018T00:00:15,unsteddyphoenix,did you tell him hey from me
19-04-2018T00:00:30,Dadrobit,"Evidently, the city is completely fed up with the lack of support to teachers."
19-04-2018T00:00:35,Bgrmystr2,haha marv
19-04-2018T00:00:47,unsteddyphoenix,Ayy Eric x Raine pls happen this chapter
19-04-2018T00:01:01,Dadrobit,"The city schools held a vote, almost 80% voted for a strike."
19-04-2018T00:01:03,unsteddyphoenix,just the city? Should be the world
19-04-2018T00:01:04,MarvTheHugPharaoh,Red being sad will make me happy enough for anything really
19-04-2018T00:01:10,unsteddyphoenix,Lol
19-04-2018T00:01:22,Dadrobit,So they're starting the strike next Thursday.
19-04-2018T00:01:26,unsteddyphoenix,"I can accept the ship if it's...you know...not just ""oh i'll settle for worse zen"""
19-04-2018T00:01:33,unsteddyphoenix,*worse natani
19-04-2018T00:01:34,unsteddyphoenix,Rather
19-04-2018T00:01:55,MarvTheHugPharaoh,"to be honest here, I just don't think its best for the story"
19-04-2018T00:02:33,unsteddyphoenix,Yeah in all seriousness I feel like Kats not ready for a relationship right now.
19-04-2018T00:02:50,MarvTheHugPharaoh,"its just like, ok they are together, then what"
19-04-2018T00:03:00,Dadrobit,Kat needs to hook up with Keiren.
19-04-2018T00:03:05,Bgrmystr2,What if Kat honestly likes Zen as a person? And not just because Zen's another Natani
19-04-2018T00:03:13,Bgrmystr2,what happens then
19-04-2018T00:03:23,Bgrmystr2,:thinking:
19-04-2018T00:03:26,MarvTheHugPharaoh,"ok, whats after that?"
19-04-2018T00:03:53,Dadrobit,Obviously not kids.
19-04-2018T00:03:56,unsteddyphoenix,"Theyd get written out, I guess"
19-04-2018T00:04:00,Bgrmystr2,xD dadro
19-04-2018T00:04:16,MarvTheHugPharaoh,but Zen is needed for the clovis ark
19-04-2018T00:04:27,Dadrobit,"God, I almost feel bad about ragging on Kat sometimes."
19-04-2018T00:04:42,Vatruvius,Alright...I am going to get off for now. Good night everyone! :ptv-greetings:
19-04-2018T00:04:45,unsteddyphoenix,She really doesnt deserve it D:
19-04-2018T00:04:47,Dadrobit,o/ Vat
19-04-2018T00:04:51,MarvTheHugPharaoh,Nighty night Vat
19-04-2018T00:04:56,Bgrmystr2,not like she's a bad person or anything
19-04-2018T00:05:01,unsteddyphoenix,Dad finally feels bad for beating on slaves
19-04-2018T00:05:04,Bgrmystr2,gnight Vatru
19-04-2018T00:05:29,Dadrobit,"But much like her sexual proclivities, it's just so easy."
19-04-2018T00:05:41,MarvTheHugPharaoh,lol
19-04-2018T00:05:48,unsteddyphoenix,literally been with one person
19-04-2018T00:05:59,unsteddyphoenix,youre a slut by comparison
19-04-2018T00:06:04,Dadrobit,And whoever comes over to Eric's house recall.
19-04-2018T00:06:26,MarvTheHugPharaoh,like Mihari if you go by that one painting
19-04-2018T00:06:39,Dadrobit,"""Servicing"" the guest was her household duty."
19-04-2018T00:06:58,Dadrobit,:)
19-04-2018T00:07:14,unsteddyphoenix,I doubt eric would let that happen
19-04-2018T00:07:25,unsteddyphoenix,"Unless he really whored out his ""sister"""
19-04-2018T00:07:28,Bgrmystr2,I don't think it's that kind of service
19-04-2018T00:07:28,unsteddyphoenix,Which is...super dark
19-04-2018T00:07:43,Bgrmystr2,"Eric's not a gentleman, but he's not that bad of a person"
19-04-2018T00:07:44,Dadrobit,"Well, he set her to service Trace full well knowing who he was."
19-04-2018T00:07:48,Dadrobit,sent*
19-04-2018T00:08:15,Bgrmystr2,"Eric literally saved her from his brother from doing exactly what you're suggesting eric did, Dadro"
19-04-2018T00:08:42,unsteddyphoenix,stupidity isnt always malicious
19-04-2018T00:09:09,MarvTheHugPharaoh,yeah but his brother was a poopy head meanie
19-04-2018T00:09:18,Dadrobit,She tells them that she was ordered to service him in the baths when they first meet though. Not suggesting at all.
19-04-2018T00:10:00,unsteddyphoenix,If keidran dont care about nudity why would they consider that weird
19-04-2018T00:10:23,MarvTheHugPharaoh,"they consider human nudity, keidran have fun"
19-04-2018T00:10:40,MarvTheHugPharaoh,remember the showing proof side page
19-04-2018T00:10:52,Bgrmystr2,:thinking:
19-04-2018T00:10:57,unsteddyphoenix,Are you talking in code?
19-04-2018T00:11:45,Dadrobit,Me or Marv?
19-04-2018T00:11:57,unsteddyphoenix,Marv I have no idea what he said
19-04-2018T00:12:17,Dadrobit,I think he's talking about 37 in one of the suggestion sketches?
19-04-2018T00:12:29,MarvTheHugPharaoh,"keidran see human nudity like we do, icky pooy.  keidran have fur covering most of their bits"
19-04-2018T00:12:54,Dadrobit,Speak for yourself. Nudity can be awesome.
19-04-2018T00:13:05,unsteddyphoenix,Doesnt the fact that 37 thought it was ok to sneak up on daniels in the shower more prove my point? :thinking:
19-04-2018T00:13:10,SpazztasticKiwi,I’m still salty about MomoCon
19-04-2018T00:13:21,Dadrobit,Sodium levels are high tonight
19-04-2018T00:13:30,BadFoMo,What happened?
19-04-2018T00:13:31,unsteddyphoenix,woah that got uploaded instantly
19-04-2018T00:14:56,SpazztasticKiwi,Tom go fast 💨
19-04-2018T00:16:01,Twokinds,"Well there's like, no text"
19-04-2018T00:16:15,Twokinds,That's what usually delayed the upload by like 12 hours
19-04-2018T00:16:30,MarvTheHugPharaoh,the transcript?
19-04-2018T00:16:31,BadFoMo,"Like, wow."
19-04-2018T00:16:38,unsteddyphoenix,Huh.
19-04-2018T00:16:42,unsteddyphoenix,So thats what it was
19-04-2018T00:16:42,SpazztasticKiwi,Ah website work. Fun
19-04-2018T00:16:56,TheBeckoner,Why would the transcript do that?
19-04-2018T00:16:58,TheBeckoner,jw
19-04-2018T00:17:08,iliar,It would always be so ... Very easy to translate)
19-04-2018T00:17:27,Twokinds,"Creating all the dialogue, deciding someone wouldn't  say it like that. Changing it 100 times before deciding it was better the first way."
19-04-2018T00:17:38,Dadrobit,"Marv's joking, he's talking about the dialogue"
19-04-2018T00:17:45,SpazztasticKiwi,Writing in a nutshell
19-04-2018T00:17:54,MarvTheHugPharaoh,dialogue me daddy
19-04-2018T00:18:02,SpazztasticKiwi,No™️
19-04-2018T00:18:03,unsteddyphoenix,Hahaha
19-04-2018T00:18:15,TheBeckoner,Same thing I thought Dadro?
19-04-2018T00:18:26,unsteddyphoenix,The pedanticness is a blessing and a curse
19-04-2018T00:18:31,MarvTheHugPharaoh,also I got about anthor 3 hours before neon wakes up and I get hunted down. so gonna make it all count
19-04-2018T00:19:01,Dadrobit,"You know, I usually charge for dialoging people."
19-04-2018T00:19:06,SpazztasticKiwi,I have to go in to work early tomorrow
19-04-2018T00:19:35,SpazztasticKiwi,And my sleep seems to be stuck on “procrastinate”
19-04-2018T00:19:52,TheBeckoner,set sleep to sleep
19-04-2018T00:20:38,SpazztasticKiwi,Though one of the best/worst things I saw was a headline of a guy who supposedly got drunk with his buddies and decided it was a great idea to run into a cactus
19-04-2018T00:20:40,SpazztasticKiwi,Naked
19-04-2018T00:21:00,MarvTheHugPharaoh,be one with nature
19-04-2018T00:21:07,Dadrobit,pls tell me it was a jumping cactus
19-04-2018T00:21:12,Dadrobit,that would make my night
19-04-2018T00:22:21,SpazztasticKiwi,"I want to say they were exaggerating, like maybe he wasn’t completely naked, but at the same time it didn’t sound too off"
19-04-2018T00:22:25,unsteddyphoenix,:cactus::ctwokinds-florajiggle:
19-04-2018T00:22:56,MarvTheHugPharaoh,:cactus::squid:
19-04-2018T00:23:13,SpazztasticKiwi,I saw that tweet
19-04-2018T00:23:40,MarvTheHugPharaoh,the tweet it lives
19-04-2018T00:24:20,unsteddyphoenix,Time for more twokinds...
19-04-2018T00:24:24,unsteddyphoenix,That's what I wanted!
19-04-2018T00:24:27,unsteddyphoenix,Nnnnneat
19-04-2018T00:24:30,BadFoMo,@SpazztasticKiwi I'm reminded of this https://youtu.be/PHSJCMkUa9Y?t=18s
19-04-2018T00:24:43,SpazztasticKiwi,"Tom, this is a really weird question, but have you ever braided your hair?"
19-04-2018T00:24:48,MarvTheHugPharaoh,Now what to comment
19-04-2018T00:25:03,Twokinds,Nope
19-04-2018T00:25:15,Twokinds,Braiding hair sounds terrifying.
19-04-2018T00:25:31,Twokinds,I'd fear I'd never get it undone.
19-04-2018T00:25:33,MarvTheHugPharaoh,its all right actually and it helps keep in place
19-04-2018T00:26:14,SpazztasticKiwi,"Unless you’re hairs really curly or it’s done with a lot of gel or really tight, it’ll come out"
19-04-2018T00:26:23,Dadrobit,That dude sounded like a hog for a bit there.
19-04-2018T00:26:36,SpazztasticKiwi,As for my reaction to that video: OW
19-04-2018T00:27:08,BadFoMo,It almost hurts to watch.
19-04-2018T00:27:10,TheBeckoner,Curly hair has like two styles on dudes. As it is and pony tail
19-04-2018T00:27:29,TheBeckoner,I need a hair cut...
19-04-2018T00:27:32,TheBeckoner,just one...
19-04-2018T00:27:38,unsteddyphoenix,sssame
19-04-2018T00:27:47,unsteddyphoenix,Bi yearly haircut coming soon
19-04-2018T00:27:53,TheBeckoner,lol yup
19-04-2018T00:28:06,SpazztasticKiwi,"I don’t have em myself, but that is no way comfortable for the twig and berries. Those shorts aren’t gonna protect well against cactus spines"
19-04-2018T00:28:07,TheBeckoner,Im just too lazy to do them on a schedule
19-04-2018T00:28:57,SpazztasticKiwi,"Also, how does braiding hair sound terrifying?"
19-04-2018T00:29:38,Dadrobit,"Yeah, wasn't a jumping cactus, but still looked like it sucked."
19-04-2018T00:29:57,SpazztasticKiwi,Amateur acupuncture
19-04-2018T00:31:26,Dadrobit,"Nasty part about the jumping cholla are the barbs. They're microscopic at the tip, and when they puncture the skin, the moisture of the body makes them grow inside of you so that they don't come out without some serious pulling."
19-04-2018T00:31:29,SpazztasticKiwi,"Also, one of my aunts asked me if the picture I posted from PAX East was my boyfriend"
19-04-2018T00:31:46,Dadrobit,Gotta use pliers if you leave em in for any length of time.
19-04-2018T00:31:53,Dadrobit,It suuuuuuucks
19-04-2018T00:32:44,unsteddyphoenix,:cactus::ctwokinds-floAAA::cactus:
19-04-2018T00:32:57,SpazztasticKiwi,"The one with me hugging Jack. Had to tell her he was a YouTuber, and very taken"
19-04-2018T00:32:59,TheBeckoner,Do y'all ever forget there is  a word for something and make one for the thing then realize there is s a word for the thing? if that makes sense...
19-04-2018T00:33:30,SpazztasticKiwi,She the proceeded to tell me what my type was
19-04-2018T00:33:41,TheBeckoner,"Like earlier today I was like ""If you killed yourself that would be Autocide or something...wait that's just suicide"""
19-04-2018T00:35:02,SpazztasticKiwi,"I told her “Single, for starters” Once the age is past 25, though, I figure the guy is likely looking for someone more his age rather than mine"
19-04-2018T00:36:15,SpazztasticKiwi,Despite my age range being up to 10 years older than me
19-04-2018T00:36:47,TheBeckoner,I try for same age but older is fine
19-04-2018T00:37:57,Dadrobit,"""Perils in the Providence"""
19-04-2018T00:38:22,Twokinds,I RETURN WITH FOOD
19-04-2018T00:38:31,MarvTheHugPharaoh,is it well done?
19-04-2018T00:38:31,Dadrobit,wb
19-04-2018T00:38:34,unsteddyphoenix,WHAT
19-04-2018T00:38:35,unsteddyphoenix,KIIIIIND
19-04-2018T00:38:37,Dadrobit,Anything interesting?
19-04-2018T00:38:43,SpazztasticKiwi,You don’t have to yell
19-04-2018T00:38:54,SpazztasticKiwi,We ain’t deaf
19-04-2018T00:39:43,SpazztasticKiwi,....what’d you make?
19-04-2018T00:39:44,Bgrmystr2,whatchu talkin bout willis? I don't hear anythin' :ptv-unimpressed:
19-04-2018T00:40:01,Twokinds,"A salad, pulled pork, a chocolate cake, giant burrito, and a bowl of vanilla ice cream with caramel."
19-04-2018T00:40:09,SpazztasticKiwi,“Diet”
19-04-2018T00:40:14,Dadrobit,"""Diet"""
19-04-2018T00:40:49,unsteddyphoenix,"""""""""""diet"""""""""""
19-04-2018T00:40:55,SpazztasticKiwi,"That lasted what, a week?"
19-04-2018T00:40:59,TheBeckoner,Sounds like my sorta diet
19-04-2018T00:41:10,unsteddyphoenix,"Then again, isnt that an average american serving size?"
19-04-2018T00:41:21,Dadrobit,Well... Did he ever specify that it was a healthy diet?
19-04-2018T00:41:28,SpazztasticKiwi,Unless it’s the only thing you’ve had today
19-04-2018T00:41:41,Twokinds,"I'm joking of course, it was just the first two."
19-04-2018T00:41:47,Twokinds,The other things were what I wish I had.
19-04-2018T00:41:55,Dadrobit,"Nah unsteddy, or else ho would've had a giant side dish of FREEDOM."
19-04-2018T00:41:58,SpazztasticKiwi,He did specify at one point that it was an “eating less” diet
19-04-2018T00:42:08,Twokinds,"You know, less is relative."
19-04-2018T00:42:11,unsteddyphoenix,ooo when youre right youre RIGHT
19-04-2018T00:42:21,SpazztasticKiwi,"Good news guys, diets back on"
19-04-2018T00:42:42,SpazztasticKiwi,Though that means you missed my question
19-04-2018T00:42:42,BadFoMo,"Sorry to keep hounding you about this, Tom, but about the Papercraft idea; do you have any ideas about what to make?"
19-04-2018T00:42:44,unsteddyphoenix,But what was in the imaginary burrito?
19-04-2018T00:42:56,Dadrobit,fish sticks
19-04-2018T00:43:10,Twokinds,NO
19-04-2018T00:43:16,Dadrobit,LOL
19-04-2018T00:43:18,SpazztasticKiwi,Get their questions first though. I’m in no hurry
19-04-2018T00:43:19,BadFoMo,Ok.
19-04-2018T00:43:49,Twokinds,I just like a traditional burrito
19-04-2018T00:44:02,SpazztasticKiwi,Which tradition?
19-04-2018T00:44:06,Twokinds,Usually chicken
19-04-2018T00:44:09,unsteddyphoenix,no daddy's patented new age burritos
19-04-2018T00:44:28,Twokinds,"rice, black beans, salsa, you know, the usual"
19-04-2018T00:44:46,SpazztasticKiwi,My question was what you found terrifying about braiding
19-04-2018T00:45:33,Dadrobit,All I'm sayin' is. Any food is finger food when you put it in a tortilla and call it a burrito.
19-04-2018T00:45:50,SpazztasticKiwi,Any food is finger food if you’re brave enough
19-04-2018T00:45:56,Dadrobit,Not that fish sticks aren't already.
19-04-2018T00:46:07,unsteddyphoenix,are burritos finger food? :thinking:
19-04-2018T00:46:20,BadFoMo,Some times.
19-04-2018T00:46:23,unsteddyphoenix,"I always thought of finger food as like, lil' nibbles"
19-04-2018T00:46:39,Dadrobit,I'd consider anything that doesn't require utensils to be finger food.
19-04-2018T00:46:56,TheBeckoner,All food?
19-04-2018T00:47:05,Twokinds,"Someone replied to my tweet with ""Well, see yall in ‘20, When it concludes."""
19-04-2018T00:47:14,Dadrobit,Because you're using your fingers in place of the utensils.
19-04-2018T00:47:19,Twokinds,"And my first thought was, ""that's pretty optimistic."""
19-04-2018T00:47:23,TheBeckoner,"Yeah, so all food."
19-04-2018T00:47:39,unsteddyphoenix,lmao
19-04-2018T00:47:45,Dadrobit,There are certain expectations with certain foods Beck.
19-04-2018T00:48:00,Dadrobit,Spaghetti for example.
19-04-2018T00:48:25,Dadrobit,Unless you're 123 IQ like me and stick it in a taco shell.
19-04-2018T00:48:50,SpazztasticKiwi,An elementary school IQ. It fits
19-04-2018T00:49:02,Dadrobit,Ohhhhhh~
19-04-2018T00:49:14,unsteddyphoenix,:ctwokinds-karenOOO:
19-04-2018T00:49:29,unsteddyphoenix,easy as abc!
19-04-2018T00:49:35,SpazztasticKiwi,I’m not mean irl. But I am this sassy
19-04-2018T00:50:34,unsteddyphoenix,This chapter confirmed to have Kat in it it can be as long as it wants :ctwokinds-katdryer:
19-04-2018T00:51:26,MarvTheHugPharaoh,Its also got Zenny so happy days and sun shine ahead
19-04-2018T00:51:46,unsteddyphoenix,Yaay¬ He might even be conscious for some of it!
19-04-2018T00:51:58,TheBeckoner,I'll eat spaghetti with my bare hands if I feel like it...
19-04-2018T00:52:07,MarvTheHugPharaoh,he was badass before Raine drugged him
19-04-2018T00:52:39,unsteddyphoenix,True. Remember that time he almost did his job?
19-04-2018T00:52:44,unsteddyphoenix,Wew!
19-04-2018T00:52:57,MarvTheHugPharaoh,remember the time he broke carvers barrier
19-04-2018T00:53:31,MarvTheHugPharaoh,Carver who I might add might have been the only one who could have made my ship reality so........ damn it Zen
19-04-2018T00:55:49,TheBeckoner,Im tired...Gonna go to bed peeps. See y'all in the stream tomorrow
19-04-2018T00:56:00,MarvTheHugPharaoh,Nighty night Becku
19-04-2018T00:57:23,Dadrobit,o/ Beck
19-04-2018T01:09:30,SpazztasticKiwi,"Tom, you got the chapter storyline written out already right?"
19-04-2018T01:09:39,Dadrobit,"Blah, only got a 90% on my test tonight. Missed a question on tax law influencing donations to non-profits."
19-04-2018T01:09:48,Twokinds,ya
19-04-2018T01:09:55,SpazztasticKiwi,Cool
19-04-2018T01:10:08,SpazztasticKiwi,At least it’s an A
19-04-2018T01:10:34,Dadrobit,I think it's outdated info though.
19-04-2018T01:10:46,SpazztasticKiwi,Very likely
19-04-2018T01:11:13,SpazztasticKiwi,There’s some textbooks I’ve come across that still how old thinking in them too
19-04-2018T01:11:16,Dadrobit,Because a few years back some stuff changed and donations are reported to have quadrupled.
19-04-2018T01:11:21,SpazztasticKiwi,*have
19-04-2018T01:11:38,Dadrobit,But all my lectures are from around 2006.
19-04-2018T01:11:44,Dadrobit,to 2009
19-04-2018T01:12:06,SpazztasticKiwi,"My CPR class taught most of the more modern stuff though, so that was notable"
19-04-2018T01:12:14,Dadrobit,Gonna have to send an email to the professor about it.
19-04-2018T01:12:32,SpazztasticKiwi,Hopefully I’m never in the situation that I have to help deliver an emergency baby though
19-04-2018T01:14:03,Dadrobit,My CPR certification through Red Cross is about to expire actually now that I look at it.
19-04-2018T01:14:54,Dadrobit,Got a few months left. 9/15/18
19-04-2018T01:15:16,SpazztasticKiwi,"I was offered certification, but decided I would rather have all the knowledge and ability without the card saying I’m legally obligated/responsible in an emergency situation"
19-04-2018T01:16:41,Dadrobit,First got taught in the Boy Scouts. Then it was mandatory to be certified and carry the license at all times back when I was a Security Professional.
19-04-2018T01:17:37,Twokinds,"I used to be a certified first responder, but it's certainly expired by now."
19-04-2018T01:18:04,SpazztasticKiwi,I feel the weird part of the emergency birth situation was what the said to do with the father if he was present
19-04-2018T01:18:26,SpazztasticKiwi,"Get recertified, maybe ?"
19-04-2018T01:18:35,Twokinds,But that's woooork
19-04-2018T01:18:44,SpazztasticKiwi,Good point
19-04-2018T01:19:10,Twokinds,I only got certified in the first place because it was part of medical school
19-04-2018T01:19:40,SpazztasticKiwi,Makes sense. Gotta know the little stuff with the big stuff
19-04-2018T01:19:55,SpazztasticKiwi,I was interested in being a doctor for a short while
19-04-2018T01:20:30,SpazztasticKiwi,"Blood and gore did nothing to me, but I just decided it wasn’t a big interest for me"
19-04-2018T01:21:18,SpazztasticKiwi,"Plus, I’d have to deal with people"
19-04-2018T01:24:31,SpazztasticKiwi,"By the way, I learned today that one of my cousins is expecting her fifth child and another is engaged....to one of my former classmates"
19-04-2018T01:30:48,Twokinds,Thas a lot of babies
19-04-2018T01:32:23,SpazztasticKiwi,She has four boys. She reeeealy wants a girl
19-04-2018T01:33:36,Dadrobit,"Reminds me of that old parody energy drink commercial Powerthirst. ""Too many babies!"""
19-04-2018T01:33:59,SpazztasticKiwi,"My thing is, the oldest is like 10 or something"
19-04-2018T01:34:01,unsteddyphoenix,400 babies!
19-04-2018T01:34:17,Twokinds,Babies everywhere!
19-04-2018T01:34:19,SpazztasticKiwi,And she doesn’t believe in spanking as far as I’ve seen
19-04-2018T01:34:19,w0lfmare,As many as it takes
19-04-2018T01:34:36,Dadrobit,"""Give Shocklate to your babies and they'll be good at SPORTS!"""
19-04-2018T01:34:47,SpazztasticKiwi,They are curious tornadoes or “pick up everything”
19-04-2018T01:34:53,MarvTheHugPharaoh,a sport baby
19-04-2018T01:34:56,SpazztasticKiwi,"*of, not or"
19-04-2018T01:35:17,Dadrobit,"""It'll make your babies run ABNORMALLY fast!"""
19-04-2018T01:35:44,unsteddyphoenix,It was POWERTHIRST
19-04-2018T01:35:57,MarvTheHugPharaoh,power glove the baby
19-04-2018T01:36:00,SpazztasticKiwi,I have another cousin who’s young boy I’m surprised isn’t dead
19-04-2018T01:36:26,Twokinds,I always think of the nutrigrain ad
19-04-2018T01:36:31,unsteddyphoenix,Yoo
19-04-2018T01:36:38,unsteddyphoenix,"THe like, iconic roar"
19-04-2018T01:37:18,SpazztasticKiwi,"We went to visit while he was just old enough to walk, and he scaled a dresser and got into my mom’s medication that she’d hidden up there"
19-04-2018T01:37:21,unsteddyphoenix,https://youtu.be/6dUsqZXEms8?t=26.
19-04-2018T01:37:24,unsteddyphoenix,https://youtu.be/6dUsqZXEms8?t=26
19-04-2018T01:37:28,Dadrobit,"""You'll feel like a fighter jet made out of biceps!"""
19-04-2018T01:37:39,MarvTheHugPharaoh,He's going super
19-04-2018T01:38:12,Twokinds,Nope
19-04-2018T01:38:14,Twokinds,https://www.youtube.com/watch?v=Y6rE0EakhG8
19-04-2018T01:38:14,Dadrobit,"Oh man, that yell."
19-04-2018T01:38:18,Twokinds,BABIES
19-04-2018T01:38:43,SpazztasticKiwi,"He did that at least twice. Thank all that is holy for child proof caps, though he never tried opening them as far as we could tell"
19-04-2018T01:38:50,MarvTheHugPharaoh,500 of them?
19-04-2018T01:38:52,unsteddyphoenix,Oh I know this one too lol
19-04-2018T01:40:05,Dadrobit,"Oh man, I have never seen that."
19-04-2018T01:40:36,SpazztasticKiwi,:ptv-kippi: kids
19-04-2018T01:40:38,unsteddyphoenix,didnt actually know it was for neutrigrain
19-04-2018T01:40:47,Twokinds,Me either.
19-04-2018T01:41:01,Twokinds,That's how I am with a lot of ads. Remember then but not the product.
19-04-2018T01:41:09,Twokinds,Probably not very effective. XD
19-04-2018T01:41:33,SpazztasticKiwi,Not on their part if that’s their effect on you
19-04-2018T01:42:17,Dadrobit,Old Spice does it right though.
19-04-2018T01:43:42,SpazztasticKiwi,They use the same logic as the people who make covers for math books
19-04-2018T01:44:48,SpazztasticKiwi,“What would best convey this product?”
19-04-2018T01:45:00,SpazztasticKiwi,“Airplane Stunts”
19-04-2018T01:45:05,SpazztasticKiwi,“Brilliant”
19-04-2018T01:45:11,Dadrobit,Found it! The Howie Scream!
19-04-2018T01:45:35,Dadrobit,"Kept thinking Wilhelm, but I knew that was wrong."
19-04-2018T01:46:28,Dadrobit,https://www.youtube.com/watch?v=wzdF0bVH6e8
19-04-2018T01:47:44,SpazztasticKiwi,What’s y’all’s favorite vine?
19-04-2018T01:49:00,Dadrobit,"Never got into Vines, sorry...."
19-04-2018T01:49:47,SpazztasticKiwi,This one gives me life: https://youtu.be/cMzddpU904U
19-04-2018T01:54:05,Dadrobit,There ya go https://www.youtube.com/watch?v=NJvEL85Mq0s
19-04-2018T01:55:30,SpazztasticKiwi,Thomas!
19-04-2018T01:55:38,SpazztasticKiwi,Sanders
19-04-2018T01:58:41,Twokinds,That last one was good
19-04-2018T01:58:58,Twokinds,"""no"" he lied"
19-04-2018T01:59:02,unsteddyphoenix,Ah I love these ones
19-04-2018T01:59:31,MarvTheHugPharaoh,are we lost?
19-04-2018T01:59:39,MarvTheHugPharaoh,Nighty night Nerds
19-04-2018T01:59:47,Dadrobit,Kid probably makes more money off of 20 seconds than I do in a month...
19-04-2018T01:59:56,Dadrobit,"Night, Marv."
19-04-2018T02:00:03,unsteddyphoenix,gnight
19-04-2018T02:00:27,unsteddyphoenix,Isnt he like 30
19-04-2018T02:00:42,unsteddyphoenix,unsure about kid
19-04-2018T02:00:48,Dadrobit,Looked like he was in a high school class.
19-04-2018T02:01:14,unsteddyphoenix,it did actually
19-04-2018T02:01:20,unsteddyphoenix,I assumed it was uni
19-04-2018T02:01:32,SpazztasticKiwi,The first one in this: https://youtu.be/0gi57fY9T9Y
19-04-2018T02:02:03,Dadrobit,"Oh shit, he's 28?"
19-04-2018T02:02:11,Dadrobit,(According to wiki)
19-04-2018T02:02:37,SpazztasticKiwi,29 on April 24
19-04-2018T02:04:28,SpazztasticKiwi,"It’s like the older they are, the hotter they get"
19-04-2018T02:04:52,Dadrobit,"""This was the moment the lad was going to propose to the girl."""
19-04-2018T02:05:06,Dadrobit,"Jeez, I sincerely hope that one was staged."
19-04-2018T02:05:08,SpazztasticKiwi,That ones a little painful
19-04-2018T02:05:36,SpazztasticKiwi,"Not staged, unfortunately. Thomas ended up having to backpedal the situation"
19-04-2018T02:06:15,SpazztasticKiwi,He revealed later that it was a little too far
19-04-2018T02:07:06,Dadrobit,"Oh man, and the ""It was time for the two to come together for a tender kiss."""
19-04-2018T02:10:03,SpazztasticKiwi,Same thing happened there
19-04-2018T02:11:44,SpazztasticKiwi,I need to head on to bed
19-04-2018T02:12:27,SpazztasticKiwi,Mr. “I’m trying to go to bed earlier” may want to join that movement
19-04-2018T02:14:38,SpazztasticKiwi,😁 nite folks 🌕
19-04-2018T02:15:15,Twokinds,night!
19-04-2018T02:16:10,unsteddyphoenix,gnight
19-04-2018T02:16:14,Dadrobit,"Night, spazz"
19-04-2018T02:31:11,DarthRexKing,I am going too. No point in wasting sleep when stream is done over simple chitchat.
19-04-2018T02:31:51,Twokinds,You're right! Time to stream again!
19-04-2018T02:32:40,unsteddyphoenix,:ctwokinds-natsducky:
19-04-2018T02:33:49,Twokinds,:ctwokinds-natanisleep: Right after a 16 hour nap
19-04-2018T02:34:44,unsteddyphoenix,"What a tiny nap, just skip it and go for a cheeky 24 hour stream~"
19-04-2018T02:37:08,Dadrobit,I can't even imagine the level of hand cramps from gripping a stylus for that amount of time.
19-04-2018T02:38:21,unsteddyphoenix,That just means he get to take that many more drugs! :ctwokinds-keith8D:
19-04-2018T02:38:22,Dadrobit,"Mine gives out after only about 3 hours of just writing, but my penmanship's not exactly ""fine detail""."
