date,user,comment
21-04-2018T00:28:59,UnknownEnd,...
21-04-2018T02:07:58,SilliconeCarbide,so anybody else suprised that zen can see youngtani? i kinda figured she was like natanis subconscious
21-04-2018T02:08:16,SilliconeCarbide,guess headspace just got a new resident
21-04-2018T02:27:58,Bgrmystr2,I'm not. They're literally connected mentally
21-04-2018T02:28:03,Bgrmystr2,why would he not see her? lol
21-04-2018T02:28:37,SilliconeCarbide,kinda had the impression she was just natanis imagination playing tricks
21-04-2018T02:28:51,SilliconeCarbide,was wrong obviously though
21-04-2018T02:29:10,SilliconeCarbide,but does this mean that youngtani has her own will?
21-04-2018T02:29:13,Bgrmystr2,"natani would have to actively attempt to block Zen from meeting the young version of her, and I don't know if she could, considering that's what's left of natani pre-mind fusion from what it seems like"
21-04-2018T02:29:35,SilliconeCarbide,"like if she wants to chat with zen, can oldtani just block that?"
21-04-2018T02:29:41,Bgrmystr2,I dunno about her own will
21-04-2018T02:29:55,Bgrmystr2,"I mean, it's just part of Natani."
21-04-2018T02:30:21,Bgrmystr2,it just depends on how the spell works
21-04-2018T02:30:28,Bgrmystr2,which we don't have many details on
21-04-2018T02:30:31,Bgrmystr2,so :u
21-04-2018T02:30:32,SilliconeCarbide,true
21-04-2018T02:30:51,SilliconeCarbide,guess if youngtani has her own will and can do things without oldtanis interference
21-04-2018T02:31:02,SilliconeCarbide,this would be like living with a really noisy upstairs neighbour
21-04-2018T02:38:28,Vatruvius,What you are suggesting Sillicone would mean youngNatani could make effective decisions which she cannot. YoungNatani and oldNatani are basically two parts of the currentNatani. So in this head space both should appear because they are the two parts that
21-04-2018T02:38:37,Vatruvius,form currentNatani.
21-04-2018T02:39:18,Vatruvius,"It may be that in the future these two parts will merge into one, as of right now Natani is still getting use to discovering her pre-fusion fragment."
21-04-2018T02:41:32,Bgrmystr2,the reason they're separate is because natani closed off any and all ideas of being female
21-04-2018T02:41:36,Bgrmystr2,into this shell
21-04-2018T02:42:06,Bgrmystr2,and then hid from it for her entire life since the mind fusion thing
21-04-2018T02:43:00,Bgrmystr2,"so until natani actually accepts that she still has a female side, there's gonna be two Natani"
21-04-2018T02:43:11,Bgrmystr2,interesting it took this long for youngtani to actually appear
21-04-2018T02:43:20,Bgrmystr2,"probably Keith, if I had to guess."
21-04-2018T02:43:34,Vatruvius,It will be interesting to see how these two parts will interact and influence Natani's decisions and personality. Clearly after discovering her younger fragment she has embraced a more feminine outlook to certain relationships like with Keith. Though not
21-04-2018T02:43:47,Vatruvius,"entirely, it is there a little bit."
21-04-2018T02:44:19,Bgrmystr2,yeh I think keith really helped allow natani to feel more comfortable being herself and not having to hide behind that male shell
21-04-2018T02:44:37,Bgrmystr2,which I guess helped youngtani come out :v
21-04-2018T02:45:02,Vatruvius,It will be a huge change though if Natani was to adopt a female outlook from young Natani.
21-04-2018T02:45:20,Bgrmystr2,I dunno if it'd be a huge change
21-04-2018T02:45:43,Bgrmystr2,youngtani doesn't have a 100% female outlook either. She is a tomboy
21-04-2018T02:46:09,Vatruvius,What really triggered yountNatani to come out was the separation of the mind link with Zen from that anklet thing.
21-04-2018T02:46:32,Bgrmystr2,"that was the last straw, I think, but not the direct cause of it"
21-04-2018T02:46:53,Vatruvius,"This is true, but youngNatani does recognize herself as female but liking being seen as male."
21-04-2018T02:47:23,Bgrmystr2,"if natani wasn't actually feeling more comfortable being herself around keith, I don't think youngtani would have been there when she was disconnected from Zen"
21-04-2018T02:47:32,Bgrmystr2,"I mean, maybe but"
21-04-2018T02:47:45,Bgrmystr2,I don't know if it would have been the same story
21-04-2018T02:48:36,Bgrmystr2,Natani wouldn't have been conflicted enough for youngtani to appear without Keith being a love interest
21-04-2018T02:48:45,Vatruvius,"Maybe not, youngNatani did influence currentNatani's personality to rely less on Zen's personality and be her own person."
21-04-2018T02:49:20,Vatruvius,Perhaps.
21-04-2018T02:50:51,Bgrmystr2,"I mean, I don't really know how Natani's mind works or how much of a shell she put up, but obviously She was conflicted about being male and female at the same time, keith being there to help Natani relax without the stress of hiding, and suddenly"
21-04-2018T02:51:03,Vatruvius,Augh...I am just listening to some instrumental/mood music while also rereading the comic for the eighth time and now I really want to go back to working on my D&D world filling it out. Probably would be a better way to spend my time than gaming.
21-04-2018T02:51:05,Bgrmystr2,"being unconscious, can't talk to keith, and can't talk to zen either"
21-04-2018T02:51:41,Bgrmystr2,being disconnected from zen was a proper right hook out of nowhere
21-04-2018T02:51:45,Vatruvius,"Yeah, definitely multiple factors played into Natani's current situation."
21-04-2018T02:52:45,SilliconeCarbide,so basically every action natani takes is a consensus between youngtani and oldtani?
21-04-2018T02:52:48,SilliconeCarbide,something like that?
21-04-2018T02:52:55,Vatruvius,Not at all.
21-04-2018T02:53:33,Vatruvius,More like the two parts have an influence. One part tends to have more control of influence than the other.
21-04-2018T02:53:43,SilliconeCarbide,mh
21-04-2018T02:53:48,Vatruvius,Think of it as it was described in the comic.
21-04-2018T02:54:08,Vatruvius,When Natani's soul was shattered Zen gave part of his to fill the cracks.
21-04-2018T02:54:57,Vatruvius,This new version did away with youngNatain and became a person on their own with internal conflicts.
21-04-2018T02:56:10,Vatruvius,"Now, youngNatani is back so those two parts, what was left of youngNatani and everything else manifested into two parts basically. So each really only has control or influence what part of Natani's character they replaced."
21-04-2018T02:56:33,SilliconeCarbide,oof
21-04-2018T02:58:06,Vatruvius,"As an example, youngNatani has a feminine outlook to romantic relationships which shows through with currentNatani with Keith, that was something Zen's soul did not replace or fill."
21-04-2018T02:58:38,SilliconeCarbide,and it bled into natanis character as a whole in that mansion scene i guess
21-04-2018T03:00:00,Vatruvius,"Basically, view youngNatani as a light that was turned on after she came back from that whole mind separation thing at the ship. Now both parts are active where as before it was just maleNatani."
21-04-2018T03:00:31,SilliconeCarbide,i wonder how zen would interact with youngtani
21-04-2018T03:00:39,Vatruvius,Deep down youngNatani was always there just never really present due to current circumstances.
21-04-2018T03:00:40,SilliconeCarbide,obviously they were close
21-04-2018T03:01:12,Vatruvius,"That  will be a serious blow because now he has to deal with two siblings, a sister and brother, that are the same yet different."
21-04-2018T03:01:41,SilliconeCarbide,youngtani seemed less defensive tho
21-04-2018T03:01:56,SilliconeCarbide,"paired with zens easy attitude, i could see them get along great"
21-04-2018T03:01:58,Vatruvius,"No doubt, having thought he lost his young sister made him hurt inside seeing that the soul sharing forever changed Natani. In essence, he did lose is sister forever."
21-04-2018T03:03:18,Vatruvius,"For right now, Natani is fragmented into these two parts, but it is likely that these two parts will merge into the final character/personality that will be Natani given time."
21-04-2018T03:03:33,SilliconeCarbide,looking forward to that
21-04-2018T03:06:15,SilliconeCarbide,most of the audience here is american yes?
21-04-2018T03:06:25,Twokinds,Except me
21-04-2018T03:06:34,SilliconeCarbide,you are? :&gt;
21-04-2018T03:06:37,SilliconeCarbide,i mean
21-04-2018T03:06:39,SilliconeCarbide,where are you from
21-04-2018T03:06:56,Twokinds,Twokindia
21-04-2018T03:07:02,SilliconeCarbide,of course
21-04-2018T03:07:05,Bgrmystr2,:ptv-laugh:
21-04-2018T03:07:18,Vatruvius,"He is 100% American, I think Tom was saying he is not looking forward to the Natani character merge? No comment?"
21-04-2018T03:07:44,Vatruvius,"And what are you doing up at this time Tom, it is late for you!"
21-04-2018T03:08:10,Bgrmystr2,tom does tend to stay up a few hours after he stops streaming late in the morning so
21-04-2018T03:08:16,Bgrmystr2,it's not out of the ordinary for him to be up at this time
21-04-2018T03:08:52,Bgrmystr2,4am is pretty well into the night though
21-04-2018T03:08:53,Vatruvius,"But, this is not a stream day Bgr. Well, technically it is now but he was not streaming today so he is just up because?"
21-04-2018T03:08:59,Bgrmystr2,Would it really matter tho?
21-04-2018T03:09:26,SilliconeCarbide,changing sleeping habits is hard
21-04-2018T03:09:40,Bgrmystr2,It's not like he changes his sleep schedule like 3 or 4 hours just cuz he streamed one or two days of the week lol
21-04-2018T03:09:42,Vatruvius,"I guess not, but he should get to bed if he plans to stream at 4 which is in 12 hours. He still has to edit and type in all the suggestions."
21-04-2018T03:09:42,Bgrmystr2,xD
21-04-2018T03:10:18,Bgrmystr2,He'll prolly be goin to bed in.. :thinking: 1 or 2 hrs if I would hazard a guess.
21-04-2018T03:10:22,Vatruvius,"Unless that is what he is doing right now, though that would be an early time to enter them in?"
21-04-2018T03:10:25,Bgrmystr2,based on what I've seen
21-04-2018T03:10:51,Bgrmystr2,naw he does it before the sunday stream starts
21-04-2018T03:11:01,Bgrmystr2,so ppl can vote all through the night and through sun morning
21-04-2018T03:11:09,SilliconeCarbide,he would prolly miss lots of suggestions  were he to type them in now
21-04-2018T03:11:10,Bgrmystr2,right up till the stream begins people can vote
21-04-2018T03:11:12,Vatruvius,"I cannot live like that, it would be too hard on me. But I have school and stuff so, I do not have a hobby that I love that pays for everything. Maybe one day..."
21-04-2018T03:12:01,Bgrmystr2,Sleepin at 4-5am and waking up at like noon?
21-04-2018T03:12:03,Bgrmystr2,that's hard?
21-04-2018T03:12:12,Bgrmystr2,:thinking:
21-04-2018T03:12:31,Bgrmystr2,pretty standard amount of sleep time imo
21-04-2018T03:12:34,Vatruvius,That sleeping pattern would be hard on me for a few reasons and I did use to have a sleep schedule like that.
21-04-2018T03:12:51,SilliconeCarbide,"depends i guess, feeling tired is stressfull"
21-04-2018T03:12:59,Bgrmystr2,"I mean, if you didn't have to wake up in the morning for anything, it wouldn't matter"
21-04-2018T03:13:06,Bgrmystr2,tis why I sort of have the same schedule tom does.
21-04-2018T03:13:43,Vatruvius,"With school and stuff I would be sleep deprived because I cannot sleep into noon on school days. Second, I am a sunshine person. If a significant portion of my up time was at night I would not do well."
21-04-2018T03:14:21,Bgrmystr2,school makes the schedule moot xD
21-04-2018T03:14:25,Bgrmystr2,cuz it's in the morning
21-04-2018T03:15:06,Bgrmystr2,"I do pretty easily morning or night, whatever. Doesn't matter to me. I've slept literally every time zone on the planet lol"
21-04-2018T03:15:09,Vatruvius,Like right now it is 1:15AM which is pushing it for me. I can only really do this on weekends when I have absolutely nothing going on the next day.
21-04-2018T03:15:55,Vatruvius,"I have yet to pull an all nighter, for some reason that is a source of pride for me."
21-04-2018T03:16:16,Bgrmystr2,"atm the only things that I gotta worry about happen after 2pm for me, so I don't need to wake up in the morning.. usually I only need to wake up for 3pm on sunday.."
21-04-2018T03:16:31,Bgrmystr2,rest of the week is prettymuch whatever time my body rolls outta bed
21-04-2018T03:16:58,Bgrmystr2,"unless someone streams early, but I hear the notifier on my browser"
21-04-2018T03:17:40,SilliconeCarbide,"last year when i was at a conference in austria, i stayed awake for almost 48h due to business reasons"
21-04-2018T03:17:41,SilliconeCarbide,that was hell
21-04-2018T03:17:51,SilliconeCarbide,i never felt that exhausted in my life
21-04-2018T03:19:02,Vatruvius,I am looking forward to getting my laptop repaired. I have decided to ship it off Monday no exceptions. I want to be able to play the other 95% of the games I own not to mention some of them are getting really cool updates right now.
21-04-2018T03:19:50,Vatruvius,"Pair that with typing in this chat, there are a surprising number of words/names I use that have the letters ""x"" and ""z"" in them."
21-04-2018T03:21:03,Vatruvius,Spellcheck does not seem to understand what I am trying to say without these letters in most words.
21-04-2018T03:21:28,SilliconeCarbide,your x and z are broken?
21-04-2018T03:22:21,Vatruvius,"Yup, had to pull up the virtual keyboard to type those. That and my CTRL key is broken as well. Completely unresponsive, have been for three or four weeks now."
21-04-2018T03:22:34,SilliconeCarbide,well that sucks
21-04-2018T03:23:35,Vatruvius,"Yeah, it is weird that those keys went out because compared to other keys I use in games these should be more mid-life while my ""w"" or ""r"" key should be out."
21-04-2018T03:24:12,Vatruvius,"I mean, I even wore the paint out on my ""s"" key and that works just fine."
21-04-2018T03:24:35,SilliconeCarbide,ha my s key's paint is worn out as well
21-04-2018T03:24:42,SilliconeCarbide,but all my keys are fine
21-04-2018T03:24:53,SilliconeCarbide,"kinda weird, i never had a key break through wear and tear"
21-04-2018T03:25:13,SilliconeCarbide,:X
21-04-2018T03:25:13,SilliconeCarbide,"i did break keyboards the old fashioned way though, using cola or some other beverage"
21-04-2018T03:25:17,Vatruvius,"That is what I am saying though, the keys that are broken are really not that worn compared to many others."
21-04-2018T03:25:46,SilliconeCarbide,yeah thats weird
21-04-2018T03:25:46,Vatruvius,I have never spilled any beverage on my computer.
21-04-2018T03:27:19,Vatruvius,"I should be getting to bed, good night everyone! Good night Tom!"
21-04-2018T03:27:24,SilliconeCarbide,byebye
21-04-2018T03:27:29,Vatruvius,:ptv-greetings:
21-04-2018T03:32:00,Twokinds,G'night!
21-04-2018T03:32:08,Twokinds,I should get to bed too if I want to be awake in time for the Sunday Stream
21-04-2018T03:33:20,SilliconeCarbide,yeah we wouldnt want you too miss that :&gt;
21-04-2018T03:33:24,SilliconeCarbide,byebye
21-04-2018T03:33:57,Bgrmystr2,gnight vatru
21-04-2018T03:34:14,Bgrmystr2,I'll be awake for the stream on sun even if I end up sleeping at 6am..
21-04-2018T03:34:40,Bgrmystr2,"90% of the time, I catch the sunday stream on time, every time :v"
21-04-2018T03:34:47,SilliconeCarbide,so its in the middle of the night for you?
21-04-2018T03:35:13,Bgrmystr2,"it's 3:35am for me, Central Time here"
21-04-2018T03:35:21,SilliconeCarbide,"10:35, germany"
21-04-2018T03:35:28,Bgrmystr2,"Tom's Eastern, so it's 4:35am for him"
21-04-2018T03:35:30,SilliconeCarbide,ah
21-04-2018T03:35:57,SilliconeCarbide,"for me stream starts late in the evening, 23:00"
21-04-2018T03:36:11,SilliconeCarbide,i usually catch the beginning and watch the rest from vods
21-04-2018T03:37:56,Bgrmystr2,ah 23? that's like 11pm. Not too late. The friday streams start at 9pm so it's not too different for us on that one
21-04-2018T03:38:48,SilliconeCarbide,"yeah its alright, besides i dont have to get up early on saturday"
21-04-2018T03:39:40,SilliconeCarbide,sometimes i just  kim through the sketch vod from sunday on monday morning
21-04-2018T03:39:50,SilliconeCarbide,last week was the first time i submitted a sketch suggestion
21-04-2018T03:40:00,SilliconeCarbide,went into the poll on the first round
21-04-2018T03:40:04,SilliconeCarbide,but got in seconds place
21-04-2018T03:40:41,SilliconeCarbide,monday morning i see that tom picked that suggestion
21-04-2018T03:40:45,SilliconeCarbide,made my day ^^
21-04-2018T12:16:41,Walphin,hello
21-04-2018T12:21:54,Barabashe4ka,Hello
21-04-2018T12:24:37,Darkewulf,howdy
21-04-2018T12:44:51,Foxpie,or8
21-04-2018T13:08:37,MarvTheHugPharaoh,Ello o/
21-04-2018T13:10:30,Darkewulf,"The stream starts in... what, almost an hour?"
21-04-2018T13:12:10,MarvTheHugPharaoh,"I'm gonna miss the stream, Its my dads brithday so just hoping in to say Ya'll enjoy your selves and to only vote for the good one :ptv-tease:"
21-04-2018T13:13:11,BadFoMo,"4:00 PM EST. abour 1 hour, 47 minutes."
21-04-2018T13:13:19,BadFoMo,*about
21-04-2018T13:13:30,BadFoMo,*About
21-04-2018T13:16:39,Combak,2 hours.
21-04-2018T13:21:19,Darkewulf,I hope Tom mighfudget be able to help me with a
21-04-2018T13:21:25,Darkewulf,whoops
21-04-2018T13:22:09,Darkewulf,"don't you just love it when your sentence fails to delete properly, and you don't notice it until AFTER you've already typed and sent another message?"
21-04-2018T13:23:33,Darkewulf,"I meant to say, I hope Tom might be able to help me with a question I had about The Dragon Masquerade (relax, no spoilers in the question)"
21-04-2018T13:24:30,Combak,We might be able to answer if you ask.
21-04-2018T13:30:41,WereKeidran,begins lurking
21-04-2018T13:31:47,Darkewulf,"It's something only he would be able to answer, sadly."
21-04-2018T13:32:19,Darkewulf,and I don't have any other means of contacting him
21-04-2018T13:35:06,Combak,Just ask.
21-04-2018T13:35:36,Combak,Especially since now it sounds like a spoiler he definitely won't answer.
21-04-2018T13:35:53,Darkewulf,Fine... do YOU know the pattern he used on Zen's coat?
21-04-2018T13:36:18,Combak,The... pattern?
21-04-2018T13:36:24,Combak,"Like, brush pattern or...?"
21-04-2018T13:36:55,Darkewulf,"no, the very subtle intricate design pattern on the fabric. It's neither Damask nor paisley"
21-04-2018T13:37:00,Darkewulf,but similar to both
21-04-2018T13:37:19,Combak,That's probably just the brush.
21-04-2018T13:37:26,Combak,"But yeah, you'll have to ask Tom."
21-04-2018T13:37:38,Darkewulf,"if you zoom in on the picture of Zen on the back cover, and in the comic itself, you can see there is a faint, seamless texture"
21-04-2018T13:38:39,Darkewulf,"the background in that image is a royalty-free Damask variant I'm rather fond of using myself, but the pattern on the coat is eluding me."
21-04-2018T13:39:51,ProsePro7,..And here I thought I would be the only one on here
21-04-2018T13:40:12,Darkewulf,"That's where you're wrong, kiddo"
21-04-2018T13:40:19,Darkewulf,makes finger funs
21-04-2018T13:40:21,Darkewulf,guns*
21-04-2018T13:44:57,Combak,You
21-04-2018T13:45:06,Combak,You're never the only one on here.
21-04-2018T13:45:21,Combak,"Seriously, there's like 10 people that keep this open in a tab."
21-04-2018T13:45:29,WereKeidran,you are never alone
21-04-2018T13:53:28,SilliconeCarbide,but most people are just idling
21-04-2018T13:53:33,Combak,Doodoododo doodoododo...
21-04-2018T13:54:29,Combak,Quiet SiC &gt;.&gt;
21-04-2018T13:54:57,Darkewulf,I'm texturing a 3D model and it's driving me up the wall
21-04-2018T14:00:16,Combak,"Well, at least you don't have to pay for gas."
21-04-2018T14:14:30,Bgrmystr2,:thinking:
21-04-2018T14:21:35,Dadrobit,"Oof, just woke up. feelsbadman"
21-04-2018T14:22:10,Bgrmystr2,"feels good for me, but okay"
21-04-2018T14:22:16,Bgrmystr2,didn't get enough sleep?
21-04-2018T14:24:02,Bgrmystr2,"I got up like.. 20 mins ago, got bout 8 hr sleep"
21-04-2018T14:25:59,Dadrobit,"Like, close to 11 hours."
21-04-2018T14:26:07,Dadrobit,Got home around midnight last night.
21-04-2018T14:26:37,Bgrmystr2,"jeez, and you still feel bad? you must have had a long day"
21-04-2018T14:28:43,WereKeidran,sometimes too much sleep makes me feel worse than too little
21-04-2018T14:28:46,Dadrobit,Slept too much.
21-04-2018T14:29:10,Dadrobit,"But I was at a con all day yesterday as well, so that was a thing."
21-04-2018T14:29:51,Bgrmystr2,"I dunno if that's a slept too much thing, and more of a body recovering from the convention and it just smacking you later, IE after waking up the next day"
21-04-2018T14:30:37,Bgrmystr2,yer body just kinda.. stops sleeping when it's well rested
21-04-2018T14:31:35,Dadrobit,"It's not like it was a hardcore run around convention or anything lol, I was just playing piball."
21-04-2018T14:31:43,Dadrobit,https://i.imgur.com/2pTTnHf.jpg
21-04-2018T14:32:02,Dadrobit,Pinball for days
21-04-2018T14:32:24,Vatruvius,Hello everyone! :ptv-greetings:
21-04-2018T14:32:36,Dadrobit,o/
21-04-2018T14:33:24,Bgrmystr2,:thinking: hmm
21-04-2018T14:33:26,Bgrmystr2,hey vatru
21-04-2018T14:33:53,SilliconeCarbide,heyo
21-04-2018T14:34:10,Dadrobit,"Pinball, mini bar, and food trucks. Day well spent."
21-04-2018T14:34:29,TerraTheWizard,hellooooooooooo~
21-04-2018T14:34:34,Vatruvius,That is a lot of pinball machines.
21-04-2018T14:34:44,Vatruvius,Hello Terra!
21-04-2018T14:34:56,Dadrobit,o/
21-04-2018T14:34:58,Dadrobit,Terra
21-04-2018T14:36:09,Dadrobit,And that was just one room. There were other rooms with various themes like Nintendo consoles or Fighting game arcade machines.
21-04-2018T14:36:22,TerraTheWizard,"i see my pfp is still broken, neat"
21-04-2018T14:37:03,Bgrmystr2,heya terra. And why do you say it's broken?
21-04-2018T14:37:47,TerraTheWizard,"i updated it last week, and picarto was a stupid with transparency,"
21-04-2018T14:37:58,TerraTheWizard,"so instead of replacing it, it pasted it over the old one"
21-04-2018T14:38:31,NightMeaty22,has returned
21-04-2018T14:38:42,Dadrobit,o/ Meaty.
21-04-2018T14:38:43,BadFoMo,Yo.
21-04-2018T14:38:47,Bgrmystr2,heya meaty
21-04-2018T14:38:51,Mippy,Hello Hello
21-04-2018T14:38:56,Dadrobit,Gonna head out for some breakfast/lunch
21-04-2018T14:39:03,TerraTheWizard,actually it might only be broken for me :thinking:
21-04-2018T14:39:05,Dadrobit,Brunch one might even say
21-04-2018T14:39:07,Bgrmystr2,"so you can see the old image behind the new one where the transparency should be, Terra?"
21-04-2018T14:39:17,TerraTheWizard,does my pfp have a white smudge on the right side?
21-04-2018T14:39:37,Bgrmystr2,lemmy jump on your channel to get a better look at it
21-04-2018T14:39:53,Combak,Yes
21-04-2018T14:39:53,Bgrmystr2,yeah around her whole head
21-04-2018T14:39:54,NightMeaty22,got my phone back yay
21-04-2018T14:40:05,Bgrmystr2,"left top and right, it wraps all around"
21-04-2018T14:40:31,TerraTheWizard,"yeah, it had my lucario one under it so i uploaded it a second time"
21-04-2018T14:40:31,Combak,Can you use an uncropped version?
21-04-2018T14:40:35,Wyvern088,afternoon all
21-04-2018T14:40:36,TerraTheWizard,that caused the halo effect
21-04-2018T14:40:45,goldgardian,"So, Question."
21-04-2018T14:40:59,Bgrmystr2,"what you can do, Terra, is to make an image of JUST the background color of the chat"
21-04-2018T14:41:03,Mippy,Shoot Gold
21-04-2018T14:41:05,TerraTheWizard,i guess i could just make a version with the chat colo_
21-04-2018T14:41:09,Bgrmystr2,and update your image to that first
21-04-2018T14:41:09,TerraTheWizard,"oh, ya beat me to it"
21-04-2018T14:41:10,TerraTheWizard,lol
21-04-2018T14:41:19,Bgrmystr2,then upload the one w/ the transparent background
21-04-2018T14:41:20,goldgardian,what guild did ze nand Natani first join?
21-04-2018T14:41:27,goldgardian,was it clovis's?
21-04-2018T14:41:50,Bgrmystr2,I would figure making the outside of the image w/ the chat color would be kinda messy
21-04-2018T14:42:05,Vatruvius,They joined the assassin's guild gold.
21-04-2018T14:42:20,Vatruvius,Clovis came in when Natani got hit with that black magic.
21-04-2018T14:43:07,Mippy,"Dang, I'm pretty sure they just joind and unnamed assassin's guild and Clovis just hired them. It's been a while since Ive read Dragon Masquarde"
21-04-2018T14:43:24,goldgardian,"Cool, right then"
21-04-2018T14:44:07,TerraTheWizard,"ok, so i got rid of the picture that was behind, but it still made the halo effect"
21-04-2018T14:44:08,TerraTheWizard,lol
21-04-2018T14:44:18,Vatruvius,"Clovis was the one that performed or had the means to fuse their souls. From that side comic, Clovis put in a back door and knew Natani was a she so he leveraged that info to get the two to do his bidding."
21-04-2018T14:44:56,Combak,"Terra, I can look at the source image of your avatar and see the halo around it from cropping."
21-04-2018T14:45:05,goldgardian,"ah, so he wasn't related to the Assassin guild they joined?"
21-04-2018T14:45:51,Twokinds,He's the underground moneyman
21-04-2018T14:46:20,Mippy,"Hi Tom, thanks for the confirm"
21-04-2018T14:46:30,TerraTheWizard,i fixededed it
21-04-2018T14:46:42,TerraTheWizard,added the grey to the source
21-04-2018T14:46:44,TerraTheWizard,lol
21-04-2018T14:46:46,goldgardian,"Yeah, thanks for that"
21-04-2018T14:47:08,Twokinds,A financeer with deep pockets who funds shady dealings. His guide has close ties to things like the assassin guilds.
21-04-2018T14:47:11,Vatruvius,Basically: Clovis = Bad Guy
21-04-2018T14:48:28,Mippy,Makes sence.
21-04-2018T14:48:59,qwe304,:ctwokinds-clovisgirl_shake:
21-04-2018T14:49:02,goldgardian,A second question... Why did Zen and Natani become assassins in the first place? that doesn't seem like the best way to keep your sister safe
21-04-2018T14:49:18,goldgardian,just saying...
21-04-2018T14:49:37,Vatruvius,It was the only way Zen could provide some sort of living.
21-04-2018T14:49:44,Vatruvius,Natani wanted to be with him.
