date,user,comment
23-11-2018T00:00:01,Bgrmystr2,etc etc
23-11-2018T00:00:16,RimaDraws,also how to read sage's comic? website anyone?
23-11-2018T00:00:17,SageSaga,Qwe- yes but you didnt provide an example
23-11-2018T00:00:27,SageSaga,http://ai.katbox.net/
23-11-2018T00:00:37,Bgrmystr2,"damn, sage is fast"
23-11-2018T00:00:47,SageSaga,well its right there-
23-11-2018T00:00:50,Mihari,I wanted to troll mod and delete that link XD
23-11-2018T00:00:52,RimaDraws,thank you sage ~
23-11-2018T00:00:52,SageSaga,under my stream
23-11-2018T00:00:55,Tharkis,"pfft, i do read the comic Bgrmystr! =P"
23-11-2018T00:00:55,qwe304,lemme get the vid back up to get ya an example
23-11-2018T00:00:56,Bgrmystr2,I went to paste it and it was already in the chat
23-11-2018T00:00:59,Tharkis,lol Mihari
23-11-2018T00:01:02,SageSaga,Mihari!
23-11-2018T00:01:06,Mihari,What?
23-11-2018T00:01:07,Bgrmystr2,hey Mihari
23-11-2018T00:01:09,SageSaga,Explain to Qwe why hes wrong
23-11-2018T00:01:11,Combak,Hi Mihari!
23-11-2018T00:01:13,SageSaga,and needs to shut up
23-11-2018T00:01:14,SageSaga,XD
23-11-2018T00:01:31,SpazztasticKiwi,Qwe is wrong cuz Sage says so...?
23-11-2018T00:01:36,SpazztasticKiwi,That work?
23-11-2018T00:01:42,RimaDraws,i also seriously wonder how to get my own website.do you pay for a domain?
23-11-2018T00:01:52,SageSaga,yes
23-11-2018T00:02:12,RimaDraws,i think i need to do research
23-11-2018T00:02:19,qwe304,"@SageSaga one example for you: @4:05, why would you spend $419 when a $229 cpu does the job 90% as well?"
23-11-2018T00:02:21,Mihari,Google domains!
23-11-2018T00:02:49,Mihari,Cause I want that extra 10%? :P
23-11-2018T00:03:05,SageSaga,also maybe the Mobo cost more?
23-11-2018T00:03:08,Bgrmystr2,and you can host your own domain
23-11-2018T00:03:13,Bgrmystr2,but you need a good connection for that
23-11-2018T00:03:24,Bgrmystr2,easier to buy one :u
23-11-2018T00:03:30,RimaDraws,@Mihari google domains?
23-11-2018T00:03:40,KiTA,Nearlyfreespeech.net
23-11-2018T00:03:48,KiTA,So I have a GTX 970
23-11-2018T00:03:51,Mihari,"Yes, for buying a domain they are a good place to do it"
23-11-2018T00:03:52,SageSaga,google domains is where i buy all my URLs currently
23-11-2018T00:03:59,Tharkis,ooh speaking of that
23-11-2018T00:03:59,RimaDraws,how much?
23-11-2018T00:04:01,Mihari,Hosting a site is another matter
23-11-2018T00:04:01,KiTA,"er, to explain, nearlyfreespeech is where I get all my domains and hosting"
23-11-2018T00:04:06,KiTA,But anyway
23-11-2018T00:04:09,Tharkis,i think i'm in the last year of my 20 year upfront payment for my domain
23-11-2018T00:04:16,Tharkis,so i really need to remember to re-up my domain
23-11-2018T00:04:17,KiTA,"I have a GTX 970, and I paid $250 for it years back"
23-11-2018T00:04:22,KiTA,"and I was thinking of upgrading, but..."
23-11-2018T00:04:27,Tharkis,especially now that Network Solutions isnt the ONLY registrar you can use
23-11-2018T00:04:29,KiTA,The GTX 970 is still one of the best cards out there
23-11-2018T00:04:39,Tharkis,because after 20 years i really dont like network solutions...
23-11-2018T00:04:41,MarvTheHugPharaoh,"I got a 970 too, great card"
23-11-2018T00:04:45,qwe304,@SageSaga a b450 mobo is cheaper than a z370 mobo
23-11-2018T00:04:49,SageSaga,Zro you there?
23-11-2018T00:04:55,KiTA,I keep crashing when trying to play Warhammer 40k Mechanicus
23-11-2018T00:05:04,KiTA,"I have a new PSU coming, it might be that, but I doubt it"
23-11-2018T00:05:13,ZRO4825,I am. Happy Birthday. :3
23-11-2018T00:05:22,KiTA,But if I wanted to get something better than a 970
23-11-2018T00:05:24,SageSaga,happy Birthday Zro
23-11-2018T00:05:30,SpazztasticKiwi,Me hitting my suddenly tripping stream: “Stop” *smack* “Lagging” *smack smack* “I’m trying to be entertained” *smacksmacksmack*
23-11-2018T00:05:30,KiTA,it's like $400 and I'd only gain like 5-10% bonus
23-11-2018T00:05:34,Bgrmystr2,I will wait for an hour cuz it's not tomorrow yet
23-11-2018T00:05:38,SageSaga,how is a 970 still one of the best?
23-11-2018T00:05:39,Bgrmystr2,>:U
23-11-2018T00:05:42,Tharkis,"hrm, does google host as well? i've been with godaddy for 15 years, but if i move my domain i might want ot consolidate to a single bill for my hosting + domain name"
23-11-2018T00:05:54,KiTA,Sage:  Bitcoin.
23-11-2018T00:05:59,KiTA,Bitcoin completely destroyed the GPU market
23-11-2018T00:06:02,MarvTheHugPharaoh,"its not one of the best, but still a good card"
23-11-2018T00:06:03,KiTA,stalled it outright for years.
23-11-2018T00:06:05,ZRO4825,970 is outperformed by roughly 13% by a 1060 6GB. 55% by a 1070.
23-11-2018T00:06:19,RimaDraws,you can register a domain as low as 12$ a year?
23-11-2018T00:06:26,Tharkis,"prior to that I just hosted my own apache server, but letting someone else do all the patches and maintnence and whatnot"
23-11-2018T00:06:30,KiTA,GPU Hierarchy
23-11-2018T00:06:33,Tharkis,"yes rima, youc an get them way cheaper than that even"
23-11-2018T00:06:35,Mihari,And in some cases it's even cheaper for the first Rima
23-11-2018T00:06:38,KiTA,GTX 970 is in the 5th bracket down
23-11-2018T00:06:42,qwe304,you can get an rx 480 on ebay for like $100
23-11-2018T00:06:43,KiTA,alongside the 1060
23-11-2018T00:06:43,RimaDraws,wow i never knew.
23-11-2018T00:06:48,ZRO4825,"That being said, unless you're going to a 1070 or better, it's not worth the money to upgrade from a 970 currently."
23-11-2018T00:06:50,Tharkis,i think i paid 150$ for 20 year registration on my domain name
23-11-2018T00:07:00,qwe304,an rx480 is just shy of a gtx 1060
23-11-2018T00:07:02,RimaDraws,they said ten years for $120
23-11-2018T00:07:03,KiTA,"above it is the 980 ($400), the 1070 is above that ($500), above that you get the 1080 ($900), and above that, the brand new 2080 ($1700)"
23-11-2018T00:07:06,RimaDraws,at most
23-11-2018T00:07:21,BobbyCorwinTruePotoo,never go full 2080
23-11-2018T00:07:23,Tharkis,all depends on the registrar
23-11-2018T00:07:24,KiTA,I can link the GPU hierarchy
23-11-2018T00:07:25,RimaDraws,i may be considering buying a domain
23-11-2018T00:07:30,KiTA,but IIRC sage doesn't like links?
23-11-2018T00:07:39,qwe304,no links kek
23-11-2018T00:07:41,ZRO4825,Honestly? A 2080 has roughly the same performance as a 1080ti and costs less atm. :joy:
23-11-2018T00:07:46,Mihari,"He's indifferent to them, people just usually don't ask first."
23-11-2018T00:07:53,qwe304,but muh raytracing
23-11-2018T00:08:05,BobbyCorwinTruePotoo,"wait, really? would have figured it would be more expensive"
23-11-2018T00:08:16,Tharkis,"if you ask, and you explain what you're linking and it's relevant to conversation nto just some random ""look at this !"" then sage is usually fine with links, but you gotta ask"
23-11-2018T00:08:22,Tharkis,it's in the rules *points below*
23-11-2018T00:08:29,BobbyCorwinTruePotoo,"don't get me wrong, a LOT of interesting tech in it, just dont' think anything would be using it game wise for a long while"
23-11-2018T00:08:34,KiTA,But yeah
23-11-2018T00:08:49,KiTA,"I mean, there's the 1070, the 980...  I haven't looked at AMD but I used to be ONLY an AMD / ATI guy"
23-11-2018T00:09:00,Bgrmystr2,"it's not 100% RTX cores, Bobby FYI"
23-11-2018T00:09:01,KiTA,I bought my PC like 6 years ago and there's not really any reason to upgrade yet
23-11-2018T00:09:19,Bgrmystr2,so yeah you can use a 2080 the same as you would a 1080ti
23-11-2018T00:09:28,Bgrmystr2,without RTX at all
23-11-2018T00:09:28,Zakuru,HI EVERYONE
23-11-2018T00:09:32,BobbyCorwinTruePotoo,hello
23-11-2018T00:09:33,Zakuru,now that my bf is gone lol im here
23-11-2018T00:09:33,Bgrmystr2,heya Zak
23-11-2018T00:09:36,MarvTheHugPharaoh,HI Zaky
23-11-2018T00:09:44,BobbyCorwinTruePotoo,Im happy with my 1070
23-11-2018T00:09:47,BobbyCorwinTruePotoo,at 4k
23-11-2018T00:09:49,Zakuru,hows everyone?
23-11-2018T00:09:53,SpazztasticKiwi,Lost
23-11-2018T00:10:09,MarvTheHugPharaoh,In a Christmasy mood
23-11-2018T00:10:17,Zakuru,awesome! i just finished decorating the house
23-11-2018T00:10:24,SpazztasticKiwi,That’s all they’re playing at work on the radio
23-11-2018T00:10:26,totallynotTrace,yeah it looks like to 1060ti is the same as the 2060 exept the 2060 has 6 gb vram
23-11-2018T00:10:35,Tharkis,"hell, honestly for the most part i'm still happy with my dual 660ti which are 6 year old cards"
23-11-2018T00:10:36,MarvTheHugPharaoh,"Sweet, Zak"
23-11-2018T00:10:38,SpazztasticKiwi,Christmas is already worn out with me
23-11-2018T00:10:43,MarvTheHugPharaoh,I still need to get started
23-11-2018T00:10:54,Tharkis,but they support 4k (on DP only) and support 3Dvision and 144hz monitors
23-11-2018T00:11:06,BobbyCorwinTruePotoo,games really haven't advanced to the point you really need state of the art cards
23-11-2018T00:11:07,SageSaga,but cant game at 4k
23-11-2018T00:11:16,SpazztasticKiwi,I at least have an idea for some Christmas gifts
23-11-2018T00:11:22,KiTA,I am looking ath the RX580
23-11-2018T00:11:23,BobbyCorwinTruePotoo,I only got the 1070 becase my old computer pooped
23-11-2018T00:11:24,Tharkis,i can play EverQuest in 4k just fine on those cards =D
23-11-2018T00:11:24,KiTA,it's only $200
23-11-2018T00:11:25,Tharkis,ducks
23-11-2018T00:11:28,RimaDraws,i need to get my tree up this weekend
23-11-2018T00:11:36,KiTA,but I don't htink it's worth it if I have a 970
23-11-2018T00:11:44,SageSaga,the 1070 is great
23-11-2018T00:11:46,KiTA,"I'm hoping my issues are power related, as I did just buy a EVGA Supernova G3"
23-11-2018T00:11:53,Tharkis,most of the games iv'e been playing as of late arent very graphics intensive
23-11-2018T00:12:09,SpazztasticKiwi,Mark will be doing a stream the 1st. And I have a friend whose sister thinks he hangs the moon so I’m considering gonna get a shirt or something for her
23-11-2018T00:12:12,BobbyCorwinTruePotoo,1070 is a beast.  I suggest skipping a few gens unless you're doing it for bragging
23-11-2018T00:12:16,SpazztasticKiwi,getting
23-11-2018T00:12:18,Tharkis,I was going to have to upgrade for FO76 but since that game looks like an unmitigated disaster i'll just skip for now
23-11-2018T00:12:25,totallynotTrace,"unless you absolutely want the best, a 970 is more than enough for pretty much all games atm"
23-11-2018T00:12:25,Mihari,"Thanks Tharkis, now I'm flooded with horror memories of Time raids."
23-11-2018T00:12:41,SpazztasticKiwi,I hope they gift wrap
23-11-2018T00:12:59,BobbyCorwinTruePotoo,"god, I've been watching 76 review videos for over an hour.  so bad ;w;"
23-11-2018T00:13:09,Mihari,"hehehehe, charm kiting giants hehehe"
23-11-2018T00:13:12,Tharkis,@Mihari would you believe that i STILL have never seen Saryn drop @#%@% time's antithisis?  I must be the only shaman int he game without one !
23-11-2018T00:13:19,ZRO4825,"That makes me sad. I kinda wanted to play this Fallout just cuz it's set in WV, lol"
23-11-2018T00:13:45,Mihari,That's kinda surprising
23-11-2018T00:13:45,Tharkis,"not that you need it anymore, but man, for the longest time i felt like half a shaman because i didnt have that one item lol"
23-11-2018T00:14:05,qwe304,fallout 76 looks like shit
23-11-2018T00:14:08,BobbyCorwinTruePotoo,"like, if they made it 5-10/month and said it would be a long developemnt cycle (w/o 60 up front) I'd jump on and give feedback"
23-11-2018T00:14:12,Tharkis,i still play EQ :ctharkis-uneasy:
23-11-2018T00:14:12,qwe304,literally and figuratively
23-11-2018T00:14:17,BobbyCorwinTruePotoo,that because it is shit
23-11-2018T00:14:43,Mihari,I wonder if Sage and I would still be on speaking terms if I still played WoW XD
23-11-2018T00:14:50,ZRO4825,"Tharkis, don't feel bad, I still play FFXI, though nowhere NEAR like I used to, lol"
23-11-2018T00:15:05,SageSaga,of course we would - i would just be waiting a lot more
23-11-2018T00:15:11,Mihari,LOL
23-11-2018T00:15:17,Mihari,I dunno some of those days...
23-11-2018T00:15:22,BobbyCorwinTruePotoo,I could go back to EvEonline :thinking:
23-11-2018T00:15:35,Tharkis,EverQuests' 25th expansion comes out in 2 weeks >_<
23-11-2018T00:15:40,Mihari,What?
23-11-2018T00:15:43,Mihari,Seriously?
23-11-2018T00:15:45,KiTA,EQ was good back in the day
23-11-2018T00:15:46,Tharkis,yup
23-11-2018T00:15:49,KiTA,I think they're still making expansions
23-11-2018T00:15:50,Mihari,That's nuts.
23-11-2018T00:16:10,BobbyCorwinTruePotoo,"damn, they really sticking to that ever thin"
23-11-2018T00:16:17,Mihari,I wish City of Heroes didn't get canned...
23-11-2018T00:16:20,KiTA,I never got very far into EQ
23-11-2018T00:16:22,Mihari,I loved that game.
23-11-2018T00:16:23,KiTA,I liked to solo
23-11-2018T00:16:26,KiTA,best I ever got was uh
23-11-2018T00:16:27,KiTA,Bard
23-11-2018T00:16:29,KiTA,I got pretty far as a bard
23-11-2018T00:16:30,SageSaga,I actually really didnt like city of heroes...
23-11-2018T00:16:40,Tharkis,"CoH was fun, it had a great character creator"
23-11-2018T00:16:41,KiTA,"I don't remember where, but there was some area that was literally an ocean of poo"
23-11-2018T00:16:43,Mihari,"Yah well, you're hyper critical about any super hero game XD"
23-11-2018T00:16:49,Tharkis,the content got really repetitive though
23-11-2018T00:16:52,KiTA,when I quit I was kiting flies in that area
23-11-2018T00:16:55,SageSaga,it was also over hyped for me
23-11-2018T00:16:58,Tharkis,DCUO has done a great job for the superhero MMO
23-11-2018T00:17:06,Mihari,No...
23-11-2018T00:17:11,Mihari,It really hasn't.
23-11-2018T00:17:14,Tharkis,I still poke my head into DCUO occasionally
23-11-2018T00:17:15,SageSaga,"people were like ""you can do anything!"" and i was like ""So im stuck in a wall- huh- guess you can do anything"""
23-11-2018T00:17:24,KiTA,I play WOW and FF14 alternating
23-11-2018T00:17:29,KiTA,WOW's latest expansion is horrible
23-11-2018T00:17:33,KiTA,"well, at least"
23-11-2018T00:17:34,KiTA,it's boring
23-11-2018T00:17:37,SageSaga,i dont know how people can play FF14
23-11-2018T00:17:39,KiTA,I got to level 113 and quit
23-11-2018T00:17:41,RimaDraws,good lord buying a domain is so easy
23-11-2018T00:17:47,Mihari,I really tried to love DCUO
23-11-2018T00:17:52,RimaDraws,all you do is type in a  domain you want to buy and boom
23-11-2018T00:17:58,SageSaga,me Too Mihari
23-11-2018T00:17:58,KiTA,FF14 just announced blue mage
23-11-2018T00:18:01,KiTA,so everyone's freaking excited
23-11-2018T00:18:21,Mihari,And to this day it bugs me that apparently the helicopters in DCUO go faster than super sonic speed.
23-11-2018T00:18:31,Mihari,Cause I could never catch them :P
23-11-2018T00:18:37,Tharkis,for a while i was leading the #1 villain league on USPC
23-11-2018T00:18:38,HeresyArtStream,I'm playing vanilla WoW right now. Never played WoW before but I am enjoying it.
23-11-2018T00:19:04,Tharkis,"worldwide firsts in a lot of the hardests feats and stuff, was a good time, but most of my friends stopped playing"
23-11-2018T00:19:06,Tharkis,now i'm a filthy casual
23-11-2018T00:19:10,SageSaga,i had this great plan to make a group of people in DCUO to make a Super Sentai squad
23-11-2018T00:19:18,SageSaga,and only i ever made the character
23-11-2018T00:19:19,RimaDraws,i need to play more DCUO
23-11-2018T00:19:22,RimaDraws,and WoW
23-11-2018T00:19:56,Tharkis,"DCUO style collection system is fantastic, i miss it in every other game i play hehe"
23-11-2018T00:20:07,RimaDraws,i loved it. but my computer is so slow to run it.
23-11-2018T00:20:22,Tharkis,DCUO will play on a PS3... a potato can run DCUO =D
23-11-2018T00:20:26,Mihari,I think I prefer champion's online for character creation customization.
23-11-2018T00:20:38,RimaDraws,not anymore tharkis
23-11-2018T00:20:41,SageSaga,omg Mihari! Remember when we found like 4 Power Girls?
23-11-2018T00:20:45,totallynotTrace,oi dont trash the ps3
23-11-2018T00:20:50,SageSaga,there was a bug and she just kept getting spawned
23-11-2018T00:20:56,Mihari,XD
23-11-2018T00:20:58,RimaDraws,i tried to play it last night and it won't play unless you transfer the data to a ps4
23-11-2018T00:21:48,Tharkis,"oh god, i should find my 1000000 superman bug screenshot it was hilarious"
23-11-2018T00:22:04,SageSaga,I did like Champions
23-11-2018T00:22:06,Tharkis,it crashed USPC completey =P
23-11-2018T00:22:14,SageSaga,it got old - but i did enjoy it for a while
23-11-2018T00:22:18,Tharkis,I couldnt get anyone i knew to play champions
23-11-2018T00:22:26,Tharkis,so i didnt really give it a fair shot
23-11-2018T00:22:41,Mihari,I made so many characters there... XD
23-11-2018T00:22:56,SageSaga,me too!
23-11-2018T00:23:02,RimaDraws,i need more gaming buddies
23-11-2018T00:23:06,SageSaga,My first was Lien though
23-11-2018T00:23:17,Tharkis,"my problem is i'm always a completionist with my characters, i dont like to make alts / extra characters i like to make one and stick with it and try to 'do everything'"
23-11-2018T00:23:26,SageSaga,"""What is your super power?"" ""Guns"" ""Huh"""
23-11-2018T00:23:40,Mihari,One thing I do love about Cryptic's games was that there was no 'unique names'
23-11-2018T00:24:02,Combak,Except for some sort of user ID?
23-11-2018T00:24:10,Mihari,"Nope, nothing"
23-11-2018T00:24:18,Mihari,I uses a handle system so you can have any character name
23-11-2018T00:24:28,Tharkis,yeah i always liked that with cryptic
23-11-2018T00:24:29,Combak,"I mean, was there a way to share? Become marked as friends?"
23-11-2018T00:24:30,Mihari,Like Character@Accountname
23-11-2018T00:24:45,Combak,"So, you couldn't impersonate someone?"
23-11-2018T00:24:48,HeresyArtStream,Kinda like Second Life's system?
23-11-2018T00:24:53,Tharkis,Diablo 3 kinda adopted that
23-11-2018T00:24:55,Mihari,Well you could try.
23-11-2018T00:25:04,Tharkis,you can name all your characters the same thing
23-11-2018T00:25:08,Mihari,But you'd need to match the account name
23-11-2018T00:25:32,Mihari,Yah Diablo is similar
23-11-2018T00:25:35,BobbyCorwinTruePotoo,this looks fantastic!
23-11-2018T00:25:52,Tharkis,"what's SL use now? when i was on SL when it first came out, you picked a first name, and then it gave you a last name based upon when you created it, then the last name would change after a set time and 'never be available again'"
23-11-2018T00:26:04,Tharkis,I had a whole bunch of angry furries yelling at me in SL
23-11-2018T00:26:09,Tharkis,because my name in SL was Tharkis Fox
23-11-2018T00:26:16,Tharkis,and they were jealous as hell that i had fox as a last name lol
23-11-2018T00:26:29,ZRO4825,lol
23-11-2018T00:26:30,Mihari,Furries... bah.
23-11-2018T00:26:36,Tharkis,"i'm like ""dude i didnt even get to pick it, dont get mad at ME!"""
23-11-2018T00:26:56,LannAF,SAGE!
23-11-2018T00:27:01,LannAF,HAAAAAAAPPY BIRTHDAY!
23-11-2018T00:27:02,SageSaga,Lann!
23-11-2018T00:27:05,SageSaga,Thanks!
23-11-2018T00:27:08,LannAF,<3
23-11-2018T00:27:16,LannAF,I'd sing you happy bday but I know you don't like it
23-11-2018T00:27:26,LannAF,So I'll just give you my imaginary blessings
23-11-2018T00:27:30,LannAF,and your gift tomorrow.
23-11-2018T00:27:48,Tharkis,"I dont think of myself as a furry, i dont have a furry character, just a kemonomimi character, but i guess i am going to MFF next week and hanging out with some katbox people"
23-11-2018T00:27:50,SageSaga,but tomorrow will be the 25th
23-11-2018T00:27:55,RimaDraws,wait sage is it your bday
23-11-2018T00:27:56,LannAF,My tomorrow
23-11-2018T00:27:58,LannAF,Not your tomorrow
23-11-2018T00:27:58,Tharkis,so i guess that kinda makes me one doesnt it? lol
23-11-2018T00:28:04,LannAF,It is Sage's birthday <3
23-11-2018T00:28:05,SageSaga,yes- it is my birthday
23-11-2018T00:28:08,ZRO4825,"Tharkis is one of us, one of us, one of us :3"
23-11-2018T00:28:09,RimaDraws,aw happy birthday
23-11-2018T00:28:13,Tharkis,:ctharkis-ewok:
23-11-2018T00:28:14,SageSaga,see that picture Tom is drawing that looks sooooo cool?
23-11-2018T00:28:15,Mihari,Hanging out with people doesn't make you a furry
23-11-2018T00:28:15,LannAF,I got reminders and everything set up
23-11-2018T00:28:22,RimaDraws,i think its badass
23-11-2018T00:28:23,SageSaga,Thats my character! and my birthday present
23-11-2018T00:28:25,InTheLionsDen,:saxophone::ctwokinds-nibsbounce:
23-11-2018T00:28:27,MarvTheHugPharaoh,Happy Birthday Sage <3
23-11-2018T00:28:30,LannAF,Yeah I hang out with a ton of furries and I'm not one.
23-11-2018T00:28:32,RimaDraws,now i need to do something for you shoot
23-11-2018T00:28:33,LannAF,I think.
23-11-2018T00:28:35,Bgrmystr2,:saxophone: :ptv-excited:
23-11-2018T00:28:39,Mihari,"Lann is a furry, totally."
23-11-2018T00:28:43,LannAF,no I'm not
23-11-2018T00:28:44,Tharkis,"Nekonny convinced me to fly out to chicago and hang out, i had extra vacation days and the plane tickets were cheap so i said sure ! =P"
23-11-2018T00:28:46,SageSaga,he likes foxes
23-11-2018T00:28:51,LannAF,That doesn't make me a furry
23-11-2018T00:28:59,BadFoMo,"Happy Early Birthday, Sage!"
23-11-2018T00:29:00,SageSaga,im not a furry and i sleep with 2 of them
23-11-2018T00:29:02,Mihari,He's a badger who is infatuated with foxes.
23-11-2018T00:29:20,SageSaga,its not early now Bad- its 12:30am 11/24
23-11-2018T00:29:34,RimaDraws,well happy birthday. you share a bday with my nana
23-11-2018T00:29:41,LannAF,I. am not. A badger.
23-11-2018T00:29:46,LannAF,And I love foxes yes
23-11-2018T00:29:47,BadFoMo,I thought You said it was on the 25th.
23-11-2018T00:29:48,LannAF,They're cute as fuck
23-11-2018T00:29:52,Tharkis,that sounds like something a badger would say !
23-11-2018T00:29:53,BadFoMo,*you
23-11-2018T00:29:59,SageSaga,it is also Zro's birthday folks
23-11-2018T00:30:06,LannAF,ZRO
23-11-2018T00:30:09,ZRO4825,:3
23-11-2018T00:30:10,LannAF,HAPPY BIRTHDAY
23-11-2018T00:30:11,RimaDraws,i know its zro's
23-11-2018T00:30:13,LannAF,Do you like being sung happy bday?
23-11-2018T00:30:17,FluffKevlar,happy birthday man
23-11-2018T00:30:20,FluffKevlar,:cfluffkevlar-c6:
23-11-2018T00:30:21,MarvTheHugPharaoh,Happy Birthday Zro
23-11-2018T00:30:21,Bgrmystr2,aaaaa floof
23-11-2018T00:30:23,ZRO4825,ty ^^;
23-11-2018T00:30:23,RimaDraws,snep is 20?
23-11-2018T00:30:24,RimaDraws,lol
23-11-2018T00:30:26,Tharkis,happy birfdays to the birfday people
23-11-2018T00:30:28,SageSaga,Ty fluff!
23-11-2018T00:30:33,ZRO4825,LOL. Snep wishes he was still 20. ;_;
23-11-2018T00:30:38,RimaDraws,i wish too
23-11-2018T00:30:42,RimaDraws,next year ill be 32
23-11-2018T00:30:43,RimaDraws,omg
23-11-2018T00:30:47,SageSaga,i wish i was 20
23-11-2018T00:30:49,Bgrmystr2,eh
23-11-2018T00:30:50,SageSaga,then i could have cake
23-11-2018T00:30:53,Tharkis,shakes cane at everyone
23-11-2018T00:30:56,Tharkis,"""get off mah lawn"""
23-11-2018T00:30:58,LannAF,Sage
23-11-2018T00:31:02,Bgrmystr2,lool
23-11-2018T00:31:03,LannAF,Do you want me to buy you cake?
23-11-2018T00:31:04,BadFoMo,"Happy Birthday, Sage and ZRO4825! ...I guess?"
23-11-2018T00:31:12,Bgrmystr2,lol you guess?
23-11-2018T00:31:14,Bgrmystr2,are you not sure?
23-11-2018T00:31:15,Combak,Hi Fluff!
23-11-2018T00:31:18,Tharkis,"though sage might be same age or older than me, not sure"
23-11-2018T00:31:19,FluffKevlar,hiya
23-11-2018T00:31:20,SageSaga,I CANT EAT CAKE LANN
23-11-2018T00:31:22,BadFoMo,Yo.
23-11-2018T00:31:24,RimaDraws,hi fluff
23-11-2018T00:31:25,LannAF,SHIET
23-11-2018T00:31:26,LannAF,OKAY
23-11-2018T00:31:29,SageSaga,buy me like- bacon
23-11-2018T00:31:30,LannAF,What -can- you eat
23-11-2018T00:31:33,LannAF,bacon cake
23-11-2018T00:31:34,LannAF,got it
23-11-2018T00:31:34,Combak,"Oh, and happy birthday ZRO!"
23-11-2018T00:31:37,Bgrmystr2,"eat cake anyway, sage"
23-11-2018T00:31:38,Tharkis,"but i seem to recall Sage is younger than me, while nekonny is older"
23-11-2018T00:31:42,Bgrmystr2,"you only live once, after all"
23-11-2018T00:31:42,ZRO4825,ty ^^;
23-11-2018T00:31:48,SageSaga,im 34
23-11-2018T00:31:49,LannAF,what if I buy you another burger?
23-11-2018T00:31:50,SageSaga,today
23-11-2018T00:32:00,Tharkis,"ok yeah, i'll be 37 in jan"
23-11-2018T00:32:01,SageSaga,i cant have bread
23-11-2018T00:32:04,RimaDraws,we in the old farts club lol
23-11-2018T00:32:05,ZRO4825,And I have Sage beat by 2 years~
23-11-2018T00:32:06,RimaDraws,jk jk
23-11-2018T00:32:08,Combak,... Should we call you old then?
23-11-2018T00:32:18,SageSaga,"i cant have ketchup, i cant have tomato, I cant have carbs, i cant have sugar"
23-11-2018T00:32:20,LannAF,You ate some at the boutique tho
23-11-2018T00:32:24,Bgrmystr2,"lol Rima please, save that for those above us."
23-11-2018T00:32:27,RimaDraws,sage im with you there
23-11-2018T00:32:35,RimaDraws,hey i can use it
23-11-2018T00:32:40,SageSaga,wow lann do you not remember what i had? XD
23-11-2018T00:32:59,LannAF,....
23-11-2018T00:33:01,LannAF,I don't.
23-11-2018T00:33:01,Combak,What's the name for your problem Sage?
23-11-2018T00:33:06,LannAF,The food was too good
23-11-2018T00:33:07,LannAF,Just
23-11-2018T00:33:10,LannAF,Tell me what I can buy for you
23-11-2018T00:33:13,SageSaga,GERD
23-11-2018T00:33:16,Bgrmystr2,I wouldn't consider anyone in that club till in their 40s
23-11-2018T00:33:33,SageSaga,"and also ""At High Risk if DIABETES"""
23-11-2018T00:33:38,SageSaga,of*
23-11-2018T00:33:48,RimaDraws,i am just trying to lose weight and keep off certain things
23-11-2018T00:33:54,RimaDraws,so you're borderline diabetic?
23-11-2018T00:34:06,SageSaga,im at risk
23-11-2018T00:34:13,SageSaga,but i have no symptoms
23-11-2018T00:34:22,SageSaga,but if i dont fix my body i probably will
23-11-2018T00:34:24,RimaDraws,yea my uncle is borderline. i dont know if there is a difference but he can't have certain things
23-11-2018T00:35:58,Tharkis,thankfully OTC heartburn stuff is sufficeint to fix the esophogeal erosion from frequent heartburn  Dr said i've got 'controlable' GERD
