date,user,comment
23-11-2018T15:09:42,SageSaga,it means certain things trigger acid from my stomach to jump out of my stomach and into places where you dont have natural protections from the acid- like your throat
23-11-2018T15:09:56,CrimsonQuill,OUCH.
23-11-2018T15:10:03,sunblaze,its not the stomach that burns.
23-11-2018T15:10:08,sunblaze,but the whole throat
23-11-2018T15:10:33,SageSaga,the stomach is built to hold acid safely- the throat is not
23-11-2018T15:10:42,CrimsonQuill,I know that.
23-11-2018T15:10:48,CrimsonQuill,"But still, OUCH."
23-11-2018T15:11:04,Bgrmystr2,that's literally heartburn yeah
23-11-2018T15:11:07,Bgrmystr2,hurts like a bitch
23-11-2018T15:16:19,Twokinds,Gotta tell the stomach to get it's act together.
23-11-2018T15:17:02,Twokinds,Stop having acid where it doesn't belong.
23-11-2018T15:17:33,SageSaga,"it's not just stomach's fault, it's also Throat to Stomach Sphincter's fault"
23-11-2018T15:17:40,CrimsonQuill,True that Tom
23-11-2018T15:17:51,Bgrmystr2,yeah.. it's all just.. not doing it's job
23-11-2018T15:17:56,Bgrmystr2,and it should stop not doing that thing.
23-11-2018T15:23:17,SageSaga,there is no cure
23-11-2018T15:24:50,SageSaga,there is a procedure but it only a temporary solution 40% of the time
23-11-2018T15:24:53,MrMongMong,"I heard that if you beat your stomach with a stick, it will obey."
23-11-2018T15:25:18,MrMongMong,:ptv-sneakysmirk:
23-11-2018T15:25:18,SageSaga,im just gonna let you know whoever told you that is a liar
23-11-2018T15:25:35,MrMongMong,But the internet told me so... :P
23-11-2018T15:25:48,sunblaze,^clearly a sign if credibility
23-11-2018T15:26:07,SageSaga,i dont know how to tell you- oh wait no i do- the internet is not a person- it cannot tell you things itself.
23-11-2018T15:26:34,SageSaga,*Yet
23-11-2018T15:26:47,Bgrmystr2,do we fear that day?
23-11-2018T15:26:51,MrMongMong,But it told me that it is my friend! I can trust it! It was there during my daughter's wedding! It would never betray me!
23-11-2018T15:27:02,Bgrmystr2,or wait for our internet overloads with anticipation?
23-11-2018T15:28:11,sunblaze,wait? we probably would not even notice it!
23-11-2018T15:28:25,sunblaze,spinns web-thread
23-11-2018T15:28:34,Twokinds,"Darn it, I like having my window blinds open, but every time I do, it's like... Sun: Here I am!"
23-11-2018T15:28:43,Twokinds,Sun blazes
23-11-2018T15:28:50,sunblaze,yeah I do that :ptv-condescending:
23-11-2018T15:29:01,Bgrmystr2,xD
23-11-2018T15:29:07,FoxxTrotter,No sun here today. Been raining all day.
23-11-2018T15:29:07,SageSaga,Sunblaze has accepted the blame
23-11-2018T15:29:20,Bgrmystr2,:fire::fire::fire_engine:
23-11-2018T15:29:32,SageSaga,a friend of mine sent me the coolest picture of a birthday cake
23-11-2018T15:29:44,Bgrmystr2,what is it
23-11-2018T15:30:02,BadFoMo,My Skybox is light gray right now.
23-11-2018T15:30:10,BadFoMo,"Also, Hi."
23-11-2018T15:30:18,Bgrmystr2,hello
23-11-2018T15:30:34,MarvTheHugPharaoh,Ello :wave::ptv-sleepy:
23-11-2018T15:30:40,BadFoMo,"...And Happy Birthday, Sage and Zor!"
23-11-2018T15:30:52,SageSaga,My favorite super hero XD
23-11-2018T15:30:58,sunblaze,zor too? happy b-day then!
23-11-2018T15:31:01,SageSaga,BOOSTER GOLD!
23-11-2018T15:31:10,MarvTheHugPharaoh,BOOSTER \o/
23-11-2018T15:31:42,Twokinds,It's green lantern!
23-11-2018T15:31:48,SageSaga,That is the joke
23-11-2018T15:32:02,Bgrmystr2,Zro* sunblaze xD
23-11-2018T15:32:09,Bgrmystr2,not sure if he's here
23-11-2018T15:32:43,SageSaga,hes on the list but i havent heard from him
23-11-2018T15:33:11,ZRO4825,o.o;
23-11-2018T15:33:15,CrimsonQuill,I'm playing undertale.
23-11-2018T15:33:20,SageSaga,yo other Birthday guy
23-11-2018T15:33:23,CrimsonQuill,With Hot Dogs
23-11-2018T15:33:25,CatzArt,What have i missed?
23-11-2018T15:33:30,Bgrmystr2,I summoned the other fluffy birthday guy
23-11-2018T15:33:31,ZRO4825,Heyyo Birthday fella ^^/
23-11-2018T15:33:33,CrimsonQuill,My sister's beaten it
23-11-2018T15:34:01,sunblaze,"you don't ""beat"" undertale. you experience it!"
23-11-2018T15:34:20,Bgrmystr2,or... you could beat it and GET experience! :ptv-excited:
23-11-2018T15:34:24,ZRO4825,and ty for the Bday wishes from those of you who gave them ^^
23-11-2018T15:34:27,MarvTheHugPharaoh,undertale speed run
23-11-2018T15:34:28,sunblaze,still unconvinced deltarune is a worthy AU
23-11-2018T15:34:29,Bgrmystr2,+3 exp
23-11-2018T15:34:39,FoxxTrotter,"Happy Birthday, ZRO."
23-11-2018T15:35:07,CrimsonQuill,I'm still in Hotland
23-11-2018T15:35:57,sunblaze,hugs a temmie
23-11-2018T15:36:09,sunblaze,ohhh new idea for next month scetch
23-11-2018T15:36:12,sunblaze,mehehe
23-11-2018T15:37:25,SageSaga,?
23-11-2018T15:37:46,sunblaze,^in time :D
23-11-2018T15:38:05,SageSaga,it'll be here before ya know it
23-11-2018T15:42:17,CrimsonQuill,"Why do I always miss the chatting? Every time I head off, I miss stuff."
23-11-2018T15:42:38,sunblaze,glue yourself to the chair
23-11-2018T15:42:44,sunblaze,makes running off a lot harder
23-11-2018T15:42:48,Bgrmystr2,live here like the rest of us who do.
23-11-2018T15:42:49,Bgrmystr2,easy.
23-11-2018T15:42:50,Tharkis,:ctharkis-earwiggle:
23-11-2018T15:42:59,MarvTheHugPharaoh,Hi Tharkis
23-11-2018T15:43:11,Bgrmystr2,hey tharkis
23-11-2018T15:43:24,sunblaze,headpats random catgirlmaid-witch
23-11-2018T15:44:19,sunblaze,and hi tharkis :D
23-11-2018T15:44:29,CrimsonQuill,Tired.
23-11-2018T15:45:44,SageSaga,my father forgot my birthday
23-11-2018T15:45:57,Tharkis,:ctharkis-headpat:
23-11-2018T15:46:02,MarvTheHugPharaoh,He owes you food now
23-11-2018T15:46:07,sunblaze,^fact!
23-11-2018T15:48:05,SageSaga,uhhh- he cant cook
23-11-2018T15:48:11,FoxxTrotter,"Hi, Tharkis."
23-11-2018T15:48:22,SageSaga,he also cant shop
23-11-2018T15:49:13,sunblaze,send him to get chocolate! I am sure he can manage that
23-11-2018T15:49:38,SageSaga,first off- i cant eat chocolate- second- yes he can screw that up- he couldnt even buy cheese
23-11-2018T15:49:53,sunblaze,wow.....
23-11-2018T15:50:18,Bgrmystr2,..how?
23-11-2018T15:50:38,Bgrmystr2,I'm beyond the point of disbelief. How the hell
23-11-2018T15:50:40,SageSaga,"we sent him over to the store once - he came back with nothing and said ""They didnt have any"""
23-11-2018T15:50:41,Bgrmystr2,I need to know
23-11-2018T15:50:53,sunblaze,you are joking right?
23-11-2018T15:50:58,SageSaga,im not kidding
23-11-2018T15:51:00,Bgrmystr2,eeeh
23-11-2018T15:51:49,Bgrmystr2,how.. do you go to a store for cheese.. and the store doesn't.. have any?
23-11-2018T15:51:59,Bgrmystr2,did you guys go back to the store and find cheese?
23-11-2018T15:52:19,SageSaga,he said he went up and down every aisle and there were none with cheese
23-11-2018T15:52:47,ZRO4825,:eyes:
23-11-2018T15:52:53,SageSaga,"i was like ""The refrigerated section-"" ""Didn't have any- they just had frozen food"" ""-IN THE BACK"""
23-11-2018T15:53:22,sunblaze,okaaay thats probably byond help then :P
23-11-2018T15:53:30,CrimsonQuill,Cheese and crackers make everything better.
23-11-2018T15:53:35,SageSaga,so he went back- and came back with the one kinda cheese we told him NOT TO BUY- Freakn Crystal Farms
23-11-2018T15:54:21,SageSaga,"""It was the cheapest"" ""BECAUSE IT TASTE LIKE CRAP!"""
23-11-2018T15:54:22,CrimsonQuill,What's that?
23-11-2018T15:54:31,CrimsonQuill,Crystal Farms?
23-11-2018T15:54:37,SageSaga,it's plastic shavings molded to look like cheese
23-11-2018T15:54:41,CrimsonQuill,Bleugh
23-11-2018T15:54:53,CrimsonQuill,:ptv-pouty:
23-11-2018T15:54:58,Bgrmystr2,lolol
23-11-2018T15:55:00,Bgrmystr2,Idunno em
23-11-2018T15:55:16,CrimsonQuill,"Sage, have you ever tried Shropshire Blue?"
23-11-2018T15:55:38,SageSaga,"you have your brand names, your second tier brand names, your local stores brand, and then you have FREAKN CRYSTAL FARMS"
23-11-2018T15:56:24,CrimsonQuill,"That bad, huh?"
23-11-2018T15:56:27,SageSaga,or Gwaltney for hot dogs
23-11-2018T15:56:47,SageSaga,have you ever had a gwaltney hot dog?
23-11-2018T15:56:56,CrimsonQuill,Nope.
23-11-2018T15:57:01,CrimsonQuill,I don't live in the US.
23-11-2018T15:57:02,SageSaga,keep it that way
23-11-2018T15:57:07,CrimsonQuill,Will do.
23-11-2018T15:57:16,CrimsonQuill,I prefer Crott's Sausage Rolls.
23-11-2018T15:57:23,CrimsonQuill,THOSE are worth having.
23-11-2018T15:57:41,SageSaga,there's a reason they sell em for like a dollar for a package of 8 hotdogs
23-11-2018T15:58:14,CrimsonQuill,Crotty's Sausage rolls are just lots of Sausage meat wrapped in pastry.
23-11-2018T15:58:40,CrimsonQuill,I think you pay about 10 euro for five of them.
23-11-2018T15:58:43,CrimsonQuill,or four.
23-11-2018T15:58:51,CrimsonQuill,But they're worth it.
23-11-2018T15:59:23,FoxxTrotter,Gwaltney is one of those generic frank brands. We have them here.
23-11-2018T15:59:25,SageSaga,sounds good but i cant eat bread
23-11-2018T15:59:48,CrimsonQuill,Like a Keidran then. They can't eat bread either.
23-11-2018T15:59:56,FoxxTrotter,Carolina Packers is one of the better local ones here.
23-11-2018T16:00:23,CrimsonQuill,I don't really know that stuff.
23-11-2018T16:00:41,CrimsonQuill,The fact that i don't live in he US is the reason i can't head to Comic con yet.
23-11-2018T16:00:51,SageSaga,Nathan's hot dogs are some of the best
23-11-2018T16:01:00,FoxxTrotter,"I like Zweigle's, too, but they don't have those down here."
23-11-2018T16:01:04,Bgrmystr2,"there's good news for you, Quill"
23-11-2018T16:01:11,Bgrmystr2,there's this invention that's been around for a little while
23-11-2018T16:01:13,CrimsonQuill,I'm praying that you (SageSaga and Tom) will still be at SDCC when I finally go there.
23-11-2018T16:01:16,Bgrmystr2,it's called the airplane.
23-11-2018T16:01:23,CrimsonQuill,And flights are VERY expensive.
23-11-2018T16:01:24,Bgrmystr2,and you can fly to other places in the world.
23-11-2018T16:01:29,SageSaga,ive never been to SDCC
23-11-2018T16:01:30,CrimsonQuill,I'm on a budget.
23-11-2018T16:01:35,CrimsonQuill,Oh?
23-11-2018T16:01:37,CrimsonQuill,Ok
23-11-2018T16:01:41,Bgrmystr2,not really? you can get some really cheap flights
23-11-2018T16:01:57,Bgrmystr2,they're not all like $1000+
23-11-2018T16:02:05,CrimsonQuill,"Cheapest flight from where I am in the SDCC season, return is 800 euro."
23-11-2018T16:02:31,CrimsonQuill,"And that's not including tickets,"
23-11-2018T16:02:44,CrimsonQuill,I'd only be there to see the Keenspot Booth anyhow.
23-11-2018T16:02:53,CrimsonQuill,But I really want to go!
23-11-2018T16:02:59,Bgrmystr2,"gotta check the right flights. they have some where you literally just bring you and that's it. no luggage, but it's super cheap"
23-11-2018T16:03:04,Bgrmystr2,last I checked less than $150
23-11-2018T16:03:20,SageSaga,from another country?
23-11-2018T16:03:48,Bgrmystr2,"when I read about it, it was a worldwide thing"
23-11-2018T16:04:06,Bgrmystr2,but it's been years since then so I don't recall what it was called
23-11-2018T16:04:35,CrimsonQuill,"I'll simply say that, being in Europe, flights are not cheap to the US."
23-11-2018T16:05:21,CrimsonQuill,I really want to go to Keenspot though.
23-11-2018T16:05:27,SageSaga,why?
23-11-2018T16:05:52,CrimsonQuill,"Basically to meet Tom Fischbach and Jon Joesco, and to just see what it's like."
23-11-2018T16:06:07,CrimsonQuill,"And you, if you're there"
23-11-2018T16:06:19,SageSaga,well it's easier to meet Tom at another con than Comicon
23-11-2018T16:06:28,CrimsonQuill,What cons?
23-11-2018T16:06:57,SageSaga,well next year we are going to Anthrocon
23-11-2018T16:07:16,CrimsonQuill,Not sure I can go to that either
23-11-2018T16:07:28,CrimsonQuill,That's the problem with udgets
23-11-2018T16:07:30,CrimsonQuill,budgets
23-11-2018T16:07:32,SageSaga,it's in a much cheaper area
23-11-2018T16:07:46,CrimsonQuill,hmmmm....
23-11-2018T16:07:49,SageSaga,Tom doesnt generally like SDCC all that much
23-11-2018T16:07:58,CrimsonQuill,Crowded?
23-11-2018T16:08:11,FoxxTrotter,"Yeah, it's on the east coast instead of the west coast. Less length to travel from Europe."
23-11-2018T16:08:24,CrimsonQuill,huh.
23-11-2018T16:08:24,SageSaga,no one goes to SDCC for smaller comic artists
23-11-2018T16:08:31,SageSaga,heck they barely go for comics at all anymore
23-11-2018T16:08:34,CrimsonQuill,I'd be the exception.
23-11-2018T16:08:45,CrimsonQuill,But maybe I might give Anthro con a go...
23-11-2018T16:08:48,CrimsonQuill,some day...
23-11-2018T16:09:05,CrimsonQuill,It'd just be a day trip and back either way.
23-11-2018T16:09:14,CrimsonQuill,My course has a lot of wprk.
23-11-2018T16:09:17,CrimsonQuill,work
23-11-2018T16:09:57,FoxxTrotter,"ACE is coming up here in January, which is 45 minutes from me, and I probably won't be able to go to that. XP"
23-11-2018T16:10:08,FoxxTrotter,"I'm only working one job now, so less money."
23-11-2018T16:10:27,CrimsonQuill,I'm doing a four year course in Surveying.
23-11-2018T16:16:16,CrimsonQuill,"Well, i'm heading to bed. Goodnight all! :ptv-greetings::ptv-greetings:"
23-11-2018T16:16:23,FoxxTrotter,"G'night, Crimson."
23-11-2018T16:22:25,SageSaga,gnight
23-11-2018T16:29:25,Bgrmystr2,And here I thought Tom would be streaming the comic today. :ptv-wondering:
23-11-2018T16:29:37,Twokinds,"I'm working on it right now, but there hasn't been enough time"
23-11-2018T16:29:43,Bgrmystr2,aah
23-11-2018T16:30:07,Twokinds,"I keep trying to wake up earlier, but I always end up getting up around noon no matter what"
23-11-2018T16:30:20,Twokinds,There's never enough time
23-11-2018T16:30:59,Bgrmystr2,:(
23-11-2018T16:31:08,Bgrmystr2,"well at least you're workin on the page, that's good"
23-11-2018T16:31:56,Bgrmystr2,this song is so star-wars like sage
23-11-2018T16:32:04,Bgrmystr2,every time I hear it
23-11-2018T16:32:07,Twokinds,It's especially hard during winter because there's just no sun
23-11-2018T16:32:13,Twokinds,Except when I don't want it
23-11-2018T16:32:24,Twokinds,It's always dark
23-11-2018T16:33:26,Bgrmystr2,"lol, I just close my blinds and keep them closed. then turn on my room light."
23-11-2018T16:33:31,SageSaga,i have blackout curtains
23-11-2018T16:33:51,SageSaga,so i never have any sun - i bask in the glow of my many LED daylight bulbs
23-11-2018T16:33:53,MarvTheHugPharaoh,love blackout curtains
23-11-2018T16:34:07,Bgrmystr2,I need some lol
23-11-2018T16:34:29,Bgrmystr2,"but someone who was gonna get them for me didn't get them yet after they said they would, so"
23-11-2018T16:34:31,Bgrmystr2,:u
23-11-2018T16:35:00,iliar,There are lamps that are turned on by timer. It helps to wake up. I use lamp like this and it really works. Waking up when the room is bright is much easier.
23-11-2018T16:36:40,ZRO4825,"Doesn't work for me, I have enough blankets I can completely bury myself from nearly any light source. :P"
23-11-2018T16:37:00,Twokinds,Yeah I'm looking at lamps now
23-11-2018T16:37:06,Dadrobit,Howdy y'all.
23-11-2018T16:37:10,Twokinds,My floor lamp broke months ago and I haven't replace it
23-11-2018T16:37:15,FoxxTrotter,"Hi, Dadrobit."
23-11-2018T16:37:19,Dadrobit,Happy B-Day Sage and Zro.
23-11-2018T16:37:45,SageSaga,ty
23-11-2018T16:38:42,SageSaga,and Tom - Amazon? Black Friday? do they sell good lamps? XD
23-11-2018T16:38:53,ZRO4825,ty Dadro ^^
23-11-2018T16:39:06,Twokinds,I don't know?
23-11-2018T16:41:04,Bgrmystr2,heya dadro
23-11-2018T16:43:41,SageSaga,we need a lamp reviewer
23-11-2018T16:44:04,Dadrobit,Work laptop took a catastrophic shit on me. Just got back from leaving it at a shop. Hoping it won't be overly expensive.
23-11-2018T16:44:28,SageSaga,should have asked us first
23-11-2018T16:44:55,Dadrobit,I did what I could. 98% certain the SSD failed.
23-11-2018T16:45:10,Dadrobit,Backed up what I could and eventually resorted to a factory reset.
23-11-2018T16:45:18,SageSaga,i assume you went into the bios then?
23-11-2018T16:45:28,Dadrobit,Still wasn't working properly.
23-11-2018T16:45:50,SageSaga,SSD wouldnt affect the bios
23-11-2018T16:46:23,Dadrobit,"Nah, didn't really touch the bios aside from getting to the factory reset option."
23-11-2018T16:47:03,SageSaga,plus side- SSDs are really cheap right now
23-11-2018T16:47:35,SageSaga,and i dont mean for black friday- i mean production ramped up a few months back and their price overall has dropped a lot
23-11-2018T16:47:50,Dadrobit,"Oh, I was saying that the factory reset didn't fix the computer's issues. Not that it wasn't fixing the bios. That was working fine enough."
23-11-2018T16:49:03,Dadrobit,"And yeah, they're way less expensive than what they were even 5-6 years ago."
23-11-2018T16:49:37,Dadrobit,Like waaaaay cheaper lol. Shit was almost prohibitively expensive.
23-11-2018T16:50:17,SageSaga,yeah- even the newer nvme SSDs are cheap
23-11-2018T16:50:25,SageSaga,and those things are awesome
23-11-2018T16:51:02,ZRO4825,Caught a WD Black M.2 NVMe for $99. Steeeaaaal <3
23-11-2018T16:51:17,SageSaga,size?
23-11-2018T16:51:18,ZRO4825,:thinking: I think it was NVMe
23-11-2018T16:51:20,ZRO4825,500GB
23-11-2018T16:51:36,ZRO4825,"Yeah, NVMe"
23-11-2018T16:51:41,SageSaga,nice
23-11-2018T16:52:38,SageSaga,not too long ago those were 340 bucks
23-11-2018T16:52:55,ZRO4825,"Yeah, I was looking at a Blue for like $130 and was like ""Oh, not a bad deal."""
23-11-2018T16:53:25,ZRO4825,"Then I was looking around randomly checking stats comparisons and prices and stumbled on that Black. Was half the space by comparison, but ye gods the speed difference was worth."
23-11-2018T16:53:37,Bgrmystr2,xD yeah
23-11-2018T16:53:49,SageSaga,WD Black Drives are their performance drives
23-11-2018T16:54:17,Bgrmystr2,"it was WD blue ssd to a black M.2 drive though, wasn't it?"
23-11-2018T16:54:37,Bgrmystr2,just ssd to m.2 is crazy in performance
23-11-2018T16:54:59,Twokinds,I really need a new pc one day
23-11-2018T16:55:00,Bgrmystr2,nevermind the blue to black difference
23-11-2018T16:55:17,Twokinds,That can support stuff like that.
23-11-2018T16:55:37,SageSaga,ya know Mihari will build you a PC
23-11-2018T16:57:12,SageSaga,video cards are a bit of an issue atm though
23-11-2018T16:57:57,SageSaga,"the best video card for ""Consumers"" atm is way overpriced and the second best has stopped being produced"
23-11-2018T16:59:45,SageSaga,currently the best videocard still available and for its price is probably the GTX 1070ti
23-11-2018T17:00:22,SageSaga,the 1080ti is the one they stopped making so its harder to get now and its price is going up
23-11-2018T17:00:51,SageSaga,because the replacement -the 2080 is not really good and super expensive - and the 2080ti is amazing - but crazy expensive
23-11-2018T17:01:55,Bgrmystr2,Zro was finding 2080s for cheaper than 2080tis yesterday or whatnot
23-11-2018T17:02:19,Dadrobit,Still chugging along on my old RX 480. I don't particularly do a ton of hardcore PC gaming honestly. Mostly just stick to my PS4.
23-11-2018T17:02:24,SageSaga,all 2080s are cheaper than 2080tis
23-11-2018T17:02:38,Bgrmystr2,..1080ti*
23-11-2018T17:02:41,Bgrmystr2,not 2080ti
23-11-2018T17:02:47,Bgrmystr2,fingers are being stupid
23-11-2018T17:03:13,SageSaga,and of course 2080's are being sold cheaper than 1080ti's- 1080ti's are better and arent being made anymore
23-11-2018T17:03:25,SageSaga,no one wants 2080's atm
23-11-2018T17:04:34,RimaDraws,back from the movies. having a good bday sage?
23-11-2018T17:04:36,SageSaga,the 2070's seem ok but they havent been heavily tested yet
23-11-2018T17:04:53,SageSaga,its been ok- my father forgot it was my birthday though
23-11-2018T17:04:58,RimaDraws,ouch
23-11-2018T17:05:05,Dadrobit,:/
23-11-2018T17:05:23,RimaDraws,maybe he was busy he forgot...
23-11-2018T17:05:25,RimaDraws,my mom did that
23-11-2018T17:05:43,SageSaga,XD my father isnt busy
23-11-2018T17:05:54,RimaDraws,well you think as parents they'd remember
23-11-2018T17:06:00,MarvTheHugPharaoh,"gotta run, happy birthday Sage and Zro <3"
23-11-2018T17:06:04,SageSaga,he's retired- he does nothing
23-11-2018T17:06:10,RimaDraws,ah i see
23-11-2018T17:06:12,SageSaga,take care Marv
23-11-2018T17:06:13,Bgrmystr2,"mine remember, so yeah rima"
23-11-2018T17:06:15,FoxxTrotter,"C-ya, Marv."
23-11-2018T17:06:17,Bgrmystr2,seeya marv
23-11-2018T17:06:24,RimaDraws,well my mom did it once. im just saying sorry...
23-11-2018T17:06:57,Dadrobit,Cya Marv
23-11-2018T17:07:15,RimaDraws,i didn't mean to strike a nerve..
23-11-2018T17:08:03,SageSaga,you didnt
23-11-2018T17:08:12,ZRO4825,Don't feel bad. My mom has to ask me constantly how old I am again. :P
23-11-2018T17:08:29,RimaDraws,sorry just upset at my grandparents for treating me like a damn child...
23-11-2018T17:08:35,Bgrmystr2,rofl wow zro
23-11-2018T17:08:36,RimaDraws,im 31 years old for gods sake...
23-11-2018T17:12:09,RimaDraws,anyway...this is looking good sage
23-11-2018T17:12:37,Dadrobit,>.> I'm going to see Wreck it Ralph 2 tomorrow with my grandparents...
23-11-2018T17:12:46,RimaDraws,i just went to see it with my niece
23-11-2018T17:12:48,RimaDraws,its great
23-11-2018T17:13:09,RimaDraws,you'll like it dadro
23-11-2018T17:13:24,Dadrobit,"Yeah, we're bringing a lot of the little ones in the family as well. Gonna be a mini-party."
23-11-2018T17:13:45,Dadrobit,"I hope so, I'm actually quite looking forward to it!"
23-11-2018T17:13:50,RimaDraws,i promised my niece a while back id take her to see the incredibles 2 but i didn't get to so this was my outing with her today
23-11-2018T17:13:52,RimaDraws,she's ten
23-11-2018T17:14:26,Dadrobit,Oldest niece is... 13? 14? Ish?
23-11-2018T17:14:34,RimaDraws,yea this is the oldest for me
23-11-2018T17:14:44,RimaDraws,next two are 4 and almost 2
23-11-2018T17:14:59,RimaDraws,my little cousins are 5 and almost 1 the nephew is almost 3
23-11-2018T17:15:13,RimaDraws,and my oldest little cousin is 16
23-11-2018T17:15:19,Dadrobit,I have about a dozen or so nieces/nephews. I honestly get them mixed up...
23-11-2018T17:15:21,RimaDraws,god they grow up too quick
23-11-2018T17:16:31,Dadrobit,For sure. One cousin out in NY is like 24 now and getting married. I still recall her waddling into my room with her stuffed bear crying about nightmares so long ago.
23-11-2018T17:16:31,SageSaga,"my mother just came in and wished me a happy birthday and then said ""Good lord that girl is bouncing again!"""
23-11-2018T17:16:45,RimaDraws,LOL
23-11-2018T17:17:00,Twokinds,lool
23-11-2018T17:17:23,CrRAR,always. bouncing.
23-11-2018T17:17:24,Dadrobit,Is there ever a time that there isn't bouncing?
23-11-2018T17:17:29,RimaDraws,i remember how little my oldest niece was and it seemed like it wasn't but yesterday she was born
23-11-2018T17:17:52,SageSaga,I told her it's an animated gif- it never stops bouncing
23-11-2018T17:18:10,RimaDraws,lol silly mama
23-11-2018T17:18:17,Dadrobit,"""This is how it be"""
23-11-2018T17:18:31,sunblaze,she has a point :D
23-11-2018T17:18:49,sunblaze,eternal bouncing!
23-11-2018T17:19:02,RimaDraws,you make some nice landscapes sage
23-11-2018T17:19:14,SageSaga,thanks
23-11-2018T17:19:42,RimaDraws,i started to read your comic and so far great
23-11-2018T17:19:55,SageSaga,glad you enjoy it
23-11-2018T17:19:56,sunblaze,^which one?
23-11-2018T17:20:03,RimaDraws,AI
23-11-2018T17:20:41,sunblaze,yeah blorious elf/neko ballad :D
23-11-2018T17:20:56,RimaDraws,im sure ill love it
23-11-2018T17:23:24,SpazztasticKiwi,:ctwokinds-nibsbounce:
23-11-2018T17:24:04,CrRAR,:ctwokinds-nibsdance:
23-11-2018T17:31:52,ZRO4825,:csagesaga-bounce:
23-11-2018T17:33:33,RimaDraws,bouncy
23-11-2018T17:42:35,SpazztasticKiwi,":ctwokinds-florajiggle: “bouncy”, you say? :ctwokinds-florajiggle:"
23-11-2018T17:42:50,ZRO4825,"Ya'll have a good rest of the stream. I'm gonna actually get out of the house for a bit for once, lol. =D"
23-11-2018T17:42:59,SageSaga,take care man!
23-11-2018T17:43:00,RimaDraws,ok zro
23-11-2018T17:43:01,CrRAR,see ya zro
23-11-2018T17:43:02,FoxxTrotter,"C-ya, ZRO."
23-11-2018T17:43:50,Dadrobit,o/ZRO
23-11-2018T17:44:39,RimaDraws,ill brb soon
23-11-2018T17:46:11,CrRAR,kk
23-11-2018T18:07:17,RimaDraws,I’m playing some borderlands 2 back now
23-11-2018T18:09:26,SageSaga,im almost done
23-11-2018T18:10:59,RimaDraws,It’s looking great
23-11-2018T18:16:51,SageSaga,all done
23-11-2018T18:17:22,RimaDraws,Wooo
23-11-2018T18:17:49,Twokinds,Congrats!!
23-11-2018T18:17:57,SageSaga,ty!
23-11-2018T18:18:06,Twokinds,I just got back from getting food to see the end
23-11-2018T18:18:22,FoxxTrotter,Looks great. :0)
23-11-2018T18:18:26,RimaDraws,Woop
23-11-2018T18:18:53,Bgrmystr2,looks great :ok_hand:
23-11-2018T18:19:03,SageSaga,and thus ends the working on my own birthday stream
23-11-2018T18:19:41,Twokinds,You should tell your boss to ease up
23-11-2018T18:19:46,RimaDraws,Hope it goes well the rest of the day
23-11-2018T18:20:10,Tharkis,"happy birthday again  sage, btw =)"
23-11-2018T18:20:23,Bgrmystr2,enjoy the rest of your bday sage :D
23-11-2018T18:20:30,Twokinds,Good luck being slightly older!
23-11-2018T18:20:35,SpazztasticKiwi,🎂
23-11-2018T18:20:37,FoxxTrotter,"Thanks for the stream, Sage."
23-11-2018T18:20:51,RimaDraws,Ty
23-11-2018T18:20:51,SpazztasticKiwi,How many candles do you need?
23-11-2018T18:21:37,SageSaga,honestly its not really different from any other Saturday- gotta run DnD soon
23-11-2018T18:21:44,Bgrmystr2,"Don't worry kiwi, just keep adding more cakes with the same amount of candles. eventually you'll have enough. :birthday::birthday::birthday::birthday:"
23-11-2018T18:21:50,FoxxTrotter,"C-ya, Sage."
23-11-2018T18:22:03,SageSaga,im 34 today
23-11-2018T18:22:13,sunblaze,bye
23-11-2018T18:22:21,SageSaga,take care Sunblaze
23-11-2018T18:25:05,SpazztasticKiwi,..I’d post 34 candles but that’s a bit much
23-11-2018T18:25:25,SpazztasticKiwi,How about just one big bonfire? 🔥
