date,user,comment
25-03-2018T02:41:33,Bgrmystr2,or stuff like that
25-03-2018T02:41:41,Bgrmystr2,I'm not super big on the coding side
25-03-2018T02:41:49,Bgrmystr2,more on hardware and stuff :u
25-03-2018T02:42:03,Bgrmystr2,sec brb again
25-03-2018T02:42:25,DarthRexKing,Those who humiliate me have to die! XD
25-03-2018T02:42:52,Bgrmystr2,back
25-03-2018T02:42:56,DarthRexKing,Ello.
25-03-2018T02:43:24,Vatruvius,I am not someone who has jokes in a bag and can just pull from them whenever. I am more of a in the moment type of jokester. Like that string joke. I wrote that comment with no strings attached and then it hit me right after I posted it.
25-03-2018T02:44:05,DarthRexKing,Though my humor is not too bad. I got some good ones. Where can you commonly find ground beef other than a super market?
25-03-2018T02:44:27,Vatruvius,Hmm...
25-03-2018T02:44:42,Vatruvius,At a farm?
25-03-2018T02:44:47,DarthRexKing,At a car accident. XD
25-03-2018T02:45:35,Vatruvius,That seems dark...that or now I am the one who does not get it. I was think of ground beef as in cows on the ground so at a farm.
25-03-2018T02:45:59,DarthRexKing,I like dark humor.
25-03-2018T02:46:01,DarthRexKing,Xd
25-03-2018T02:46:03,DarthRexKing,X3
25-03-2018T02:46:39,DarthRexKing,"Some accidents are so bad well, let's just say the ground gets painted red."
25-03-2018T02:47:13,Vatruvius,Yup...definitely dark. I liked my connection a farm better. I like witty jokes.
25-03-2018T02:47:37,Vatruvius,Do you get what I meant when I said a farm?
25-03-2018T02:48:11,DarthRexKing,"Yeah, because you were trying to figure out my ground beef joke. I got another. Zombies do exist in real life, but not the way you think. How?"
25-03-2018T02:48:35,DarthRexKing,Go find a lobotomized person. XD
25-03-2018T02:49:39,Vatruvius,Okay okay okay...enough of that.
25-03-2018T02:49:50,DarthRexKing,Also puns. I like puns. If you saw my puns made off of some of the streamers names here. I make puns.
25-03-2018T02:49:53,DarthRexKing,Enough of what?
25-03-2018T02:50:43,Vatruvius,Enough of the dark jokes.
25-03-2018T02:51:38,DarthRexKing,"Okay? Anyway, I really must go. I have college at 11 in the morning. I want to be at my best, since fools in my class are either failing or not showing up. More education for me."
25-03-2018T02:51:39,Vatruvius,I like puns too...that is my specialty. But again...they are in the moment and limited to what I know.
25-03-2018T02:51:49,DarthRexKing,Of course.
25-03-2018T02:52:00,Vatruvius,Goodnight Drax!
25-03-2018T02:52:03,Vatruvius,:D
25-03-2018T02:52:20,DarthRexKing,Have a good night Vatruvius. May the nightmares haunt your dreams tonight!
25-03-2018T02:52:32,Vatruvius,Noooooo!
25-03-2018T02:52:38,Vatruvius,:P
25-03-2018T02:52:44,DarthRexKing,"Seriously, I hope they do. XD Also I it is Rex, not Drax."
25-03-2018T02:52:50,DarthRexKing,Later!
25-03-2018T02:52:59,Vatruvius,May the bedbugs feast on your flesh tonight.
25-03-2018T02:53:22,DarthRexKing,That will happen when we die and become corpses.
25-03-2018T02:53:42,Vatruvius,"No, bedbugs like their victims alive."
25-03-2018T02:54:05,Bgrmystr2,gnight Drax :v
25-03-2018T02:54:09,Vatruvius,The suck your blood then hide in your mattress during the day.
25-03-2018T02:54:15,Vatruvius,"Yes, Bgr gets it!"
25-03-2018T02:54:35,DarthRexKing,"I was making a comparison to when people are buried in a coffin, the bugs feast on your rotting flesh until you are bone."
25-03-2018T02:54:37,Bgrmystr2,well of course I do. I'm the one that brought it up lol
25-03-2018T02:54:51,DarthRexKing,Brought what up?
25-03-2018T02:55:01,Bgrmystr2,you being like Drax
25-03-2018T02:55:06,Vatruvius,"Besides, we really are just rearranging the letters in your name to something simpler like Drax...but only Drax."
25-03-2018T02:55:06,DarthRexKing,How?
25-03-2018T02:55:28,Bgrmystr2,"because you don't always get jokes and puns, and they fly over your head"
25-03-2018T02:55:36,Vatruvius,There is a D an A an R and an x in your name.
25-03-2018T02:55:38,Bgrmystr2,"or they would, if your reflexes weren't fast enough to catch them :v"
25-03-2018T02:55:39,DarthRexKing,"That is not rearranging, you took out some letters to shorten it to Drax."
25-03-2018T02:55:54,DarthRexKing,"That is a common trait in everyone, Bgr."
25-03-2018T02:55:54,Vatruvius,Yup!
25-03-2018T02:56:02,DarthRexKing,Not just me.
25-03-2018T02:56:05,Bgrmystr2,"not SUPER common, though"
25-03-2018T02:56:12,Bgrmystr2,not to that degree lol
25-03-2018T02:56:42,Vatruvius,Alright...alright...we do not mean anything by it Darth...just having fun. But it would really make me happy if you let us call you Drax.
25-03-2018T02:56:45,Bgrmystr2,though not getting jokes and stuff is fairly common by itself yeah
25-03-2018T02:57:02,DarthRexKing,"You people must not get out much. Later. Seriously though, I hope someone gets a nightmare and has a heart attack. That would be so silly, it would be righteous! XD"
25-03-2018T02:57:05,Bgrmystr2,I'll prolly do it tonight then completely forget by tomorrow
25-03-2018T02:57:38,Bgrmystr2,At this point.. maybe  we should just call him Drex? xD
25-03-2018T02:57:48,Bgrmystr2,cuz that was a Draxism if I ever heard one.
25-03-2018T02:57:52,Vatruvius,I have not had a nightmare in a very long time. I guess I have outgrown them.
25-03-2018T02:58:01,DarthRexKing,"Can you explain what your sentence means, Vatruvious?"
25-03-2018T02:58:04,Bgrmystr2,you never outgrow nightmares
25-03-2018T02:58:19,Bgrmystr2,they're likely based on stress
25-03-2018T02:58:21,DarthRexKing,"The one that said not meaning anything by it, and having fun, and being happy about me being called Drax?"
25-03-2018T02:58:23,Bgrmystr2,and things that bother you
25-03-2018T02:59:35,Vatruvius,It just seems like you really do not want us to call you Drax so I will respect that...but we really are just having fun and do not mean to hurt your feelings. It just is fun and will forever remind me of this conversation/jokes that happened today.
25-03-2018T03:00:13,Vatruvius,That is where all nicknames come from...funny events that those involved will only know.
25-03-2018T03:00:13,DarthRexKing,My name is Darth Rex King. I do not know how you are confusing it with Drax. Just read. Simple as that.
25-03-2018T03:00:20,DarthRexKing,Also when did I say my feelings were hurt?
25-03-2018T03:00:29,Vatruvius,Definitely Drax.
25-03-2018T03:00:33,DarthRexKing,You are having fun with what? You are not making sense.
25-03-2018T03:00:37,DarthRexKing,"No, it is rex."
25-03-2018T03:00:38,Bgrmystr2,XD right? Vatru
25-03-2018T03:00:58,Vatruvius,Don't worry...if it is not hurting your feeling do not worry.
25-03-2018T03:01:14,DarthRexKing,I was worried about what?
25-03-2018T03:01:19,DarthRexKing,Now I am lost.
25-03-2018T03:01:25,Bgrmystr2,lost and confused..
25-03-2018T03:01:31,Bgrmystr2,terrible way to live life
25-03-2018T03:01:32,DarthRexKing,"Start from the beginning, what are you talking about?"
25-03-2018T03:01:33,Vatruvius,Shit...that gave me a really good sketch idea.
25-03-2018T03:01:38,Bgrmystr2,nice
25-03-2018T03:01:40,Bgrmystr2,don't tell me
25-03-2018T03:01:42,Bgrmystr2,write it down
25-03-2018T03:01:49,Bgrmystr2,or something
25-03-2018T03:01:54,Vatruvius,"I won't, it will be in the next vote."
25-03-2018T03:01:58,Bgrmystr2,make a note of it and suggest it later
25-03-2018T03:02:05,Bgrmystr2,I hope I know it when I see it
25-03-2018T03:02:10,Bgrmystr2,but I don't wanna be spoiled
25-03-2018T03:02:12,Vatruvius,I just have to think about characters and stuff...but it will be very good.
25-03-2018T03:02:34,Vatruvius,You will know it for sure...no other reason this idea will be suggested when you see it.
25-03-2018T03:02:36,Bgrmystr2,:ok_hand:
25-03-2018T03:03:00,DarthRexKing,"Anyway, I do not believe in worrying or having hurt feelings anymore. Though it is amusing to see other people's feelings hurt now that I realize how trivial it is. XD"
25-03-2018T03:03:41,Bgrmystr2,"pretty sure that makes you a bully, Rex :P"
25-03-2018T03:03:49,DarthRexKing,"And do not bother remembering this chat, vat. There will be so many more, it is simpler to forget them."
25-03-2018T03:03:50,Vatruvius,Yea...I look at my past and just think why. I think innocent people get hurt the most...they grew up the fastest and tend to avoid people at first until the grow older.
25-03-2018T03:04:02,Twokinds,:ctwokinds-natanisleep:
25-03-2018T03:04:14,Bgrmystr2,you goin to sleep already tom?
25-03-2018T03:04:17,Vatruvius,Bgr gets what I mean about remembering this specific chat.
25-03-2018T03:04:19,Twokinds,yup
25-03-2018T03:04:24,Bgrmystr2,s'only 4am for you tho
25-03-2018T03:04:24,Twokinds,night
25-03-2018T03:04:27,Vatruvius,Hey Tom...bed warm yet?
25-03-2018T03:04:28,Bgrmystr2,alright
25-03-2018T03:04:34,Bgrmystr2,goodnight then :)
25-03-2018T03:04:36,Vatruvius,lol...only 4am
25-03-2018T03:04:42,Bgrmystr2,yeah only 4
25-03-2018T03:04:42,DarthRexKing,Put a pillow over his mouth and that will stop him from snoring. Also stop him from breathing. XD
25-03-2018T03:04:46,Vatruvius,Yeah...Goodnight Tom!
25-03-2018T03:05:06,Bgrmystr2,"prolly not breathing, Rex"
25-03-2018T03:05:17,Bgrmystr2,unless you've got bad pillows
25-03-2018T03:05:30,DarthRexKing,Why did the boyfriend not respond to his girlfriend after she put a pillow over him to stop from snoring?
25-03-2018T03:05:36,DarthRexKing,Because he was dead! XD
25-03-2018T03:05:48,Vatruvius,Yeah...hahahahaha?!?
25-03-2018T03:06:08,DarthRexKing,"I was looking for a way to make a dead joke......well one can dream, Bgr!"
25-03-2018T03:06:21,DarthRexKing,"Anyway, night!"
25-03-2018T03:07:56,Vatruvius,Go to 1:20 in this video...if you do not laugh...you are heartless. https://www.youtube.com/watch?v=EMI03_veyxw
25-03-2018T03:15:49,SpazztasticKiwi,Wonder how pale Tom is since he apparently doesn’t go out
25-03-2018T03:16:05,SpazztasticKiwi,Probably as pale as the rest of us
25-03-2018T03:16:26,SpazztasticKiwi,Night Tom
25-03-2018T03:17:21,Vatruvius,Goodnight Tom! I though I said that already but apparently not.
25-03-2018T03:18:04,Vatruvius,"I am not that pale, but I do go out. Partially because I have to but also because I could not stay inside forever. Even Tom likes nature so I am sure if he lived in the middle of it he would go out quite a bit."
25-03-2018T03:19:27,SpazztasticKiwi,Sometimes I think I’m tan. Then I socialize and I’m like “no I’m not”
25-03-2018T03:20:49,Vatruvius,"I get what you mean. I have seen people in Tempe when I use to go to college there that I was like, ""this is embarrassing I am so white."" Then the net day I see someone more pale then I and my mine is blown..."
25-03-2018T03:21:18,Vatruvius,next*
25-03-2018T03:22:38,Vatruvius,I never really thought about it...but Kat is too attractive in some of the colors/pages/sketches. Why Tom...why you do dis? :ptv-uneasy:
25-03-2018T03:24:56,Twokinds,:ptv-snicker:
25-03-2018T03:25:42,Vatruvius,Don't act all innocent...cause you're not Tom!
25-03-2018T03:26:43,Vatruvius,:P
25-03-2018T03:36:11,SpazztasticKiwi,You know you’re a fan when you get a crush on a character
25-03-2018T03:36:22,Bgrmystr2,hold the fucking phone
25-03-2018T03:36:22,Vatruvius,"Well...looks like everyone is getting off. Goodnight everyone, I will check back tomor...later today."
25-03-2018T03:36:28,Bgrmystr2,why is tom STILL UP
25-03-2018T03:36:31,Vatruvius,Welp...spoke to soon.
25-03-2018T03:36:37,Bgrmystr2,INSTERT VIBRATING FLORA HERE
25-03-2018T03:36:47,Bgrmystr2,supposed to go to bed xD
25-03-2018T03:37:01,Bgrmystr2,I'm gonna be up for another several hours
25-03-2018T03:37:08,SpazztasticKiwi,I have to get up in like four hours
25-03-2018T03:37:10,Vatruvius,I think he is warming his bed still.
25-03-2018T03:37:14,Bgrmystr2,for 20 mins?
25-03-2018T03:37:15,SpazztasticKiwi,And I’m still up
25-03-2018T03:37:48,Vatruvius,I am on spring break so...home made baked goods from breakfast whenever I wake up and no responsibilities for the most part. Yay!
25-03-2018T03:37:56,SpazztasticKiwi,My bed heater’s going too. Main issue is I can’t get comfortable
25-03-2018T03:38:17,Vatruvius,Maybe Tom likes his bed to be really warm?
25-03-2018T03:38:31,Bgrmystr2,maybe
25-03-2018T03:38:42,SpazztasticKiwi,Not warm enough until it’s like being in a toaster
25-03-2018T03:38:53,Bgrmystr2,I don't have normal bedsheets myself
25-03-2018T03:38:59,Bgrmystr2,I have some fuzzy blankets
25-03-2018T03:39:10,Vatruvius,I like toasty beds...they are the best beds. Especially when it is cold in your room.
25-03-2018T03:39:24,SpazztasticKiwi,I have a rainbow shag comforter
25-03-2018T03:39:39,Bgrmystr2,"when I was younger, my mother gave me a red blanket, not exactly velvet but"
25-03-2018T03:39:43,Vatruvius,I have fleece sheets...winter and all. But during the summer and fall I have to change them out.
25-03-2018T03:39:47,Bgrmystr2,it's the same kinda small furry style
25-03-2018T03:40:14,Bgrmystr2,and several years back she got me a new one cuz the old one was kinda not great anymore
25-03-2018T03:40:22,Bgrmystr2,but what I didn't know is that she got me FOUR of them
25-03-2018T03:40:23,Vatruvius,I assume you are a fan Kiwi...so who is your character crush?
25-03-2018T03:40:32,Bgrmystr2,and stitched them together into one monster blanket
25-03-2018T03:40:45,SpazztasticKiwi,None of them are terribly attractive to me
25-03-2018T03:40:45,Vatruvius,Nice Bgr
25-03-2018T03:40:57,Bgrmystr2,"the thing is so fucking big it can cover a California King bed end to end, floor to floor"
25-03-2018T03:41:07,Bgrmystr2,from the head all the way down to the end
25-03-2018T03:41:08,Bgrmystr2,both sides.
25-03-2018T03:41:13,Bgrmystr2,the blanket is huge
25-03-2018T03:41:14,Vatruvius,Okay...any side characters/sketches/colors that are not in the comic?
25-03-2018T03:41:19,SpazztasticKiwi,Then again I haven’t really looked close enough to judge attraction
25-03-2018T03:41:38,Bgrmystr2,"and I sleep with that every night, multi-layer fuzzy"
25-03-2018T03:41:39,SpazztasticKiwi,I like Trace’s attitude and personal
25-03-2018T03:41:40,Vatruvius,Why not?
25-03-2018T03:41:51,SpazztasticKiwi,personality pretty well
25-03-2018T03:41:52,Bgrmystr2,it's the warmest thing ever within like.. 30 seconds
25-03-2018T03:42:03,Bgrmystr2,not even heated
25-03-2018T03:42:11,Bgrmystr2,&lt;3 it so much
25-03-2018T03:42:20,SpazztasticKiwi,"but since he’s considered taken, I’m not terribly interested"
25-03-2018T03:42:21,Vatruvius,I know Bgr's crush.
25-03-2018T03:42:38,Bgrmystr2,do you though?
25-03-2018T03:42:42,Bgrmystr2,do you really?
25-03-2018T03:42:52,Bgrmystr2,Try me then
25-03-2018T03:42:55,Vatruvius,It is your blanket Bgr
25-03-2018T03:43:05,Vatruvius,You just stated it
25-03-2018T03:43:09,Bgrmystr2,:ptv-wondering:
25-03-2018T03:43:12,Bgrmystr2,oh no
25-03-2018T03:43:14,Bgrmystr2,you got me
25-03-2018T03:43:23,Bgrmystr2,:thinking:
25-03-2018T03:43:31,Vatruvius,:heart: and all
25-03-2018T03:43:37,Bgrmystr2,I love lots of things though
25-03-2018T03:43:42,SpazztasticKiwi,"Eric’s pretty cool too, but he’d be someone I’d prefer to get to know better before saying I like them"
25-03-2018T03:43:43,Bgrmystr2,I love ppl too
25-03-2018T03:44:52,Vatruvius,I would agree with you there Kiwi...I do like Natani in her own way. But I think I like Kat the most for the fact that she is intelligent/like to read and innocent to a lot.
25-03-2018T03:45:01,SpazztasticKiwi,"Now that you’ve really asked, I haven’t paid a lot of attention to characters’ attractiveness, let alone having a crush"
25-03-2018T03:45:23,SpazztasticKiwi,Other people are on my mind
25-03-2018T03:45:41,Vatruvius,I would not say I have a crush per say but I guess you could call it that. I am most attracted to Ket physically and phsychologically.
25-03-2018T03:45:54,Vatruvius,Kat*
25-03-2018T03:46:00,SpazztasticKiwi,She’s definitely a sweetheart
25-03-2018T03:46:08,Bgrmystr2,Honestly..  I dunno who I like the most
25-03-2018T03:46:18,SpazztasticKiwi,Definitely someone I’d get along with
25-03-2018T03:46:27,Vatruvius,And her heart is broken...and I am a sap so that just makes me want to make her feel better.
25-03-2018T03:46:32,SpazztasticKiwi,Then again so’s Flora
25-03-2018T03:46:46,Bgrmystr2,"Kat's got a lot of sex appeal, but we don't know a whole lot about her personality, though I do think she's decent at standing up for herself, and that's something I can respect"
25-03-2018T03:46:59,Vatruvius,Flora pounces her way out of anything...which would work on me.
25-03-2018T03:47:02,Bgrmystr2,but I think Flora is really the one I'd hug all day erry day cuz she's just adorable
25-03-2018T03:47:20,SpazztasticKiwi,It’s a terrible thing when you fall in love but the other person just doesn’t feel it
25-03-2018T03:47:35,SpazztasticKiwi,Bonus points if it’s been a long crush
25-03-2018T03:48:00,Bgrmystr2,"though Nat's awesome, she's tomboyish as hell and for good reason"
25-03-2018T03:48:02,Vatruvius,I know that feeling...it really sucks. Hurts the most when they don't just tell it to you and play hard to get because they do not want to hurt your feelings.
25-03-2018T03:48:14,Bgrmystr2,"though she has a lot of insecurities, also completely understandable"
25-03-2018T03:48:18,SpazztasticKiwi,I’ll fall in love with a smile and a laugh faster than a person’s appearance
25-03-2018T03:48:40,Vatruvius,Someone who is genuine...absolutely.
25-03-2018T03:48:42,Bgrmystr2,"also, Kiwi, I can best you on that terrible thing"
25-03-2018T03:49:11,Bgrmystr2,"not personally, but as a 3rd party and being in the middle of t"
25-03-2018T03:49:12,Bgrmystr2,it*
25-03-2018T03:49:52,Vatruvius,"I would say I am attracted to Natani, Kat, and Flora for all different reasons. But if I took the part that I liked in each and put it in one person I could not do it. They only work on their own."
25-03-2018T03:49:58,Bgrmystr2,"cuz loving someone and them not loving you back, whether or not they tell you, both are bad"
25-03-2018T03:50:33,SpazztasticKiwi,And then there’s the liking someone and them not even knowing you exist...
25-03-2018T03:50:37,Bgrmystr2,"but that's not nearly as bad as having fell in love with someone, then down the years fall OUT of love with them.. and watch the connection between the two slowly and utterly destroyed.."
25-03-2018T03:50:49,SpazztasticKiwi,Deep
25-03-2018T03:51:07,Bgrmystr2,and the worst place to be in is when they were your parents :ptv-sad:
25-03-2018T03:51:08,SpazztasticKiwi,Hopefully that didn’t sound sarcastic
25-03-2018T03:51:14,Vatruvius,Wow...that was my grandparents. For my mom that was hard. They divorced when she was in her early teens.
25-03-2018T03:51:31,SpazztasticKiwi,Eh. My parents were on the way to a divorce before my dad died
25-03-2018T03:51:40,Vatruvius,She had to choose which parent to go with.
25-03-2018T03:51:42,SpazztasticKiwi,I feel
25-03-2018T03:51:58,Vatruvius,At the time...she had to do it in front of the other parent in court.
25-03-2018T03:52:30,Vatruvius,I can only imagine as a parent how much that would hurt.
25-03-2018T03:52:37,Vatruvius,Not being picked.
25-03-2018T03:53:08,Vatruvius,Basically...choose your partner wisely and don't rush it. It is not fair for the kids.
25-03-2018T03:53:32,Bgrmystr2,I consider your mother lucky
25-03-2018T03:53:32,SpazztasticKiwi,I’d hate to fall out of love so much it forces a divorce
25-03-2018T03:53:35,Bgrmystr2,I didn't get to choose
25-03-2018T03:53:59,Vatruvius,Luckily...Kat and I won't have kids so...hooray! :ptv-victory:
25-03-2018T03:54:03,Bgrmystr2,I had to literally walk out of my mother's house
25-03-2018T03:54:19,Vatruvius,Sorry to hear that Bgr...that really sucks.
25-03-2018T03:54:21,Bgrmystr2,in order to finally make them see what they were doin
25-03-2018T03:54:33,Bgrmystr2,they were fighting over me without bothering to see what I wanted
25-03-2018T03:54:44,Bgrmystr2,that was back in.. 03 or or 04..?
25-03-2018T03:54:46,Bgrmystr2,ish
25-03-2018T03:54:48,Bgrmystr2,around there
25-03-2018T03:54:58,SpazztasticKiwi,"My last bf put up with a lot with me. Cliche as it is, I have mood swings"
25-03-2018T03:55:10,SpazztasticKiwi,He was so patient
25-03-2018T03:55:23,Vatruvius,My uncle is getting divorced...the worst thing is he now ex-wife wants custody of all three kids and is turning the kids against him saying he cheated and bullshit like that. Never involve the kids like that...it is just wrong.
25-03-2018T03:56:38,SpazztasticKiwi,Reason number 104 I’m not dating anyone: few people seem to have the patience for me
25-03-2018T03:57:12,SpazztasticKiwi,I used to joke that anyone dating me didn’t have to worry about impressing a father
25-03-2018T03:57:28,Vatruvius,Patience is over rated...clearly it is your fault the relationship did not work out Kiwi! :ptv-hearts:
25-03-2018T03:57:43,Bgrmystr2,":thinking: I'm single still after all the shit I saw from my parents, their family, my friends and their relationships.. and the drama that unfolded online that I was witness to"
25-03-2018T03:57:46,SpazztasticKiwi,My mom didn’t like him
25-03-2018T03:57:47,Bgrmystr2,I just..
25-03-2018T03:57:53,Bgrmystr2,ehhhhhh relationships.
25-03-2018T03:58:01,Bgrmystr2,:ptv-uneasy:
25-03-2018T03:58:01,SpazztasticKiwi,And his family was a little overprotective of him
25-03-2018T03:58:06,Vatruvius,Relationships are complicated.
25-03-2018T03:58:23,Bgrmystr2,"I need to find someone that'll accept me for me, faults and all"
25-03-2018T03:58:39,Bgrmystr2,"and I also need to find someone I can accept, faults and all"
25-03-2018T03:58:47,Bgrmystr2,somewhere out there in the sea
25-03-2018T03:58:48,SpazztasticKiwi,I had a few people ask me why I was with him when I could “get someone better”
25-03-2018T03:59:00,Vatruvius,Ohh well...takes time I think. It is good that he was patient though. I would be patient...because I know she would have to be patient for me on a couple of things as well.
25-03-2018T03:59:09,SpazztasticKiwi,I just...”excuse me?”
25-03-2018T03:59:29,Vatruvius,"Wow...how to be defriended 101, do that"
25-03-2018T04:00:09,SpazztasticKiwi,I might like the personality you shallow prick
25-03-2018T04:00:49,Vatruvius,For second I though you were attacking me and it hurt...
25-03-2018T04:01:11,SpazztasticKiwi,No :ptv-wondering:
25-03-2018T04:01:18,Bgrmystr2,"can I poke you and make it feel better, Vatru? :v"
25-03-2018T04:01:26,SpazztasticKiwi,People here too precious to be mean
25-03-2018T04:01:32,SpazztasticKiwi,People here friend
25-03-2018T04:01:47,Vatruvius,You can try...no guarantee that you will keep your finger. :P
25-03-2018T04:01:54,Bgrmystr2,:ptv-left: I'm gonna do it anyway. Boop
25-03-2018T04:02:04,Vatruvius,*snap*
25-03-2018T04:02:26,Bgrmystr2,booped you tho
25-03-2018T04:02:28,Bgrmystr2,success.
25-03-2018T04:02:40,SpazztasticKiwi,"Trust me, I get mad, you’ll know it. I’m not easily offended or annoyed though"
25-03-2018T04:02:44,Vatruvius,*summon Dr. Strange to revert time and un-break finger.
25-03-2018T04:02:59,Bgrmystr2,"Bah, tis but a scratch!"
25-03-2018T04:03:48,Vatruvius,I know...just for a second though I read that as it being pointed at me and it felt bad because it came out of nowhere and I was being nice and...:ptv-sad::ptv-whiny:...but I figured out it was not at me pretty quickly. I had to reread it though.
25-03-2018T04:04:39,SpazztasticKiwi,I knew a nice guy in school years ago that’d jump on you if you were mean to someone because of their looks
25-03-2018T04:05:59,Vatruvius,A bit aggressive...though over the years I would definitely stand up for someone if I saw it. At least if I could...
25-03-2018T04:06:48,SpazztasticKiwi,"I never asked for sure, but based on what he looked like, he was half Korean or something similar"
25-03-2018T04:06:56,Vatruvius,"""Eric you piece of shit...Kat loves you...can't you see that you good for nothing pervert!"""
25-03-2018T04:07:10,SpazztasticKiwi,People tried bullying him for it. Didn’t end well for them
25-03-2018T04:07:49,SpazztasticKiwi,I and a few others took a liking to him because he wasn’t afraid to push back on another person’s behalf
25-03-2018T04:08:44,Vatruvius,"Yeah...I am not a violent person so when I was bullied I took it hard. Middle school was hell, none of the teachers would help me, the school admins thought I had ""anger issues"" and it was just bad."
25-03-2018T04:08:57,Vatruvius,It all got better after I left but not before I reached the tipping point.
25-03-2018T04:09:27,Vatruvius,Took a long time for me to get over it...but to this day the defenses I created after all of that are still there.
25-03-2018T04:09:50,Vatruvius,Just a part of my subconscious.
25-03-2018T04:10:06,SpazztasticKiwi,He did ask me out at one point. I said no because at the time it seemed just a little too good to be true
25-03-2018T04:10:31,Bgrmystr2,"not an easy thing, unlearning the defenses you created to fight children who were probably just as socially awkward as you were"
25-03-2018T04:10:39,Bgrmystr2,know that shit the hard way personally
25-03-2018T04:10:40,SpazztasticKiwi,I didn’t think it was a prank though - more that he could find someone better
25-03-2018T04:11:13,SpazztasticKiwi,He later did. And has a daughter now - though I don’t think he’s still with the mother
25-03-2018T04:12:23,Vatruvius,Yeah...I tell ya...getting the guts to ask someone you really have a crush on. Hardest thing to do. If it is fake then no but if there are real feelings it is so hard.
25-03-2018T04:12:41,SpazztasticKiwi,"People did wonder if I’d said no because he was mixed. If it wasn’t assault, I’d slap a lot more people"
25-03-2018T04:13:24,Vatruvius,Wow...people get too involved with ethnicity/race. I can care less...THEY ARE STILL HUMAN YOU PIECE OF SHIT!
