date,user,comment
25-03-2018T04:13:45,SpazztasticKiwi,"To be honest, he was really hot"
25-03-2018T04:14:08,SpazztasticKiwi,Hence the “thought he could find someone better”
25-03-2018T04:15:07,SpazztasticKiwi,"We are still friends though. Haven’t seen him in years, but that’s because he moved, so..."
25-03-2018T04:15:15,Vatruvius,I had a crush in middle school while all the bullying was going on...really the only thing that kept me there. I asked her out to play tether-ball and we did...but eventually she was always busy at recess so something happened.
25-03-2018T04:15:54,Vatruvius,Then I came back for a vaccine and she was in line like everyone else...first time she approached me. I moved on by then.
25-03-2018T04:17:22,SpazztasticKiwi,Had a guy I kind of was interested in at one point
25-03-2018T04:17:34,SpazztasticKiwi,He got kind of flirty...
25-03-2018T04:17:52,SpazztasticKiwi,And then I found out he was married
25-03-2018T04:18:05,Vatruvius,Wow...
25-03-2018T04:18:06,SpazztasticKiwi,"Separated, but not officially divorced"
25-03-2018T04:18:17,SpazztasticKiwi,I noted out of there quick
25-03-2018T04:18:23,SpazztasticKiwi,*noped
25-03-2018T04:18:38,Vatruvius,Hold up...one sec.
25-03-2018T04:19:15,SpazztasticKiwi,He was a little flirty with my friend too as I was told and had a bit of a temper
25-03-2018T04:19:26,Vatruvius,https://www.youtube.com/watch?v=umDr0mPuyQc
25-03-2018T04:19:46,Vatruvius,Hence the divorce/break up. Too flirty with others all the time and has a temper.
25-03-2018T04:20:28,SpazztasticKiwi,"He implied that it was because they just grew apart. Now, I’m just like “are you sure about that?”"
25-03-2018T04:20:50,Vatruvius,Yeah...that is just wrong.
25-03-2018T04:21:47,SpazztasticKiwi,"Tom, got any horror stories, or you already gone to bed"
25-03-2018T04:22:14,Vatruvius,I really do not care about race/ethnicity or a person's quarks but online is really hard. You get to know people and really become friends with name...but seeing them in person has only ended badly for me. It ruins the relationship what it was.
25-03-2018T04:22:45,Vatruvius,You form this idea of who they or what they look like and I hate that what they look like shatters who I thought they were.
25-03-2018T04:23:04,SpazztasticKiwi,"Thing with that guy years ago, I’m not sure about the ethnicity. I never asked cause it seemed rude"
25-03-2018T04:23:04,Vatruvius,I hope he has gone to bed...been a long time now.
25-03-2018T04:24:40,Vatruvius,How about this...because it would certainly ease my conscious if I know...what ethnicity do you identify as?
25-03-2018T04:25:34,Bgrmystr2,you can't.. identify as an ethnicity tho
25-03-2018T04:25:38,SpazztasticKiwi,"I’ve been told I’m primarily German, with Native American (Cherokee) close behind and Scottish in last place"
25-03-2018T04:25:39,Bgrmystr2,it's literally based on your body
25-03-2018T04:25:54,Bgrmystr2,"I'm white, I can't say I'm anything other than white"
25-03-2018T04:26:03,Bgrmystr2,it would literally be lying
25-03-2018T04:26:05,Bgrmystr2,:/
25-03-2018T04:26:38,SpazztasticKiwi,"But I don’t see features per say of any of those. Unless I have a DNA test telling me what’s in my blood,"
25-03-2018T04:26:39,Vatruvius,I guess that is what I meant...color of your skin/race. Heritage is something different.
25-03-2018T04:26:53,Bgrmystr2,yeah heratage Idunno
25-03-2018T04:27:13,SpazztasticKiwi,"I don’t feel like saying I’m “this, this, and this” is very accurate"
25-03-2018T04:27:18,Bgrmystr2,"I'm like.. german, canadian french, and a little spanish"
25-03-2018T04:27:26,Bgrmystr2,but I have no idea the percentages
25-03-2018T04:27:29,Bgrmystr2,or whatnot
25-03-2018T04:27:54,Vatruvius,I would say about 35-45% of my heritage comes from axis-power country.
25-03-2018T04:27:56,Bgrmystr2,"I dunno, I never got super into it"
25-03-2018T04:28:26,Bgrmystr2,I know my dad's family is german
25-03-2018T04:28:31,SpazztasticKiwi,"All I really know is I have what some people say is high cheekbones, and red and black in my hair. There’s even a silver hair now and then"
25-03-2018T04:28:34,Bgrmystr2,I believe
25-03-2018T04:28:37,Bgrmystr2,at least for the most part
25-03-2018T04:28:45,Vatruvius,"I am white though, with french and cech thrown in to those axis countries."
25-03-2018T04:28:45,Bgrmystr2,and my mother's side is definitely canadian french
25-03-2018T04:29:07,Bgrmystr2,but I don't know much beyond that
25-03-2018T04:30:04,Vatruvius,My mom's side of the family is actually royalty in Germany I believe. A few times removed and no longer carrying the name but still there. That is kinda cool.
25-03-2018T04:30:25,Vatruvius,Bow before Duke Vatruvius!
25-03-2018T04:30:33,Vatruvius,That sounds pretty good actually.
25-03-2018T04:30:35,SpazztasticKiwi,My Cherokee heritage is supposed to be from a Cherokee chief
25-03-2018T04:31:03,Vatruvius,"*""Neat"" gif here*"
25-03-2018T04:31:42,SpazztasticKiwi,"And if I was told right, or if any of it’s true, he married the German part of the heritage"
25-03-2018T04:31:50,Vatruvius,So then what color is your skin? I would assume white at this point but just saying that makes me feel like an ass.
25-03-2018T04:32:00,Vatruvius,Interesting.
25-03-2018T04:32:03,SpazztasticKiwi,Definitely white
25-03-2018T04:33:36,Bgrmystr2,"If I'm any kind of royalty, I've no idea"
25-03-2018T04:33:43,SpazztasticKiwi,"It’s also been hinted that there’s Chinese in me, but when someone says so, I’m like “where? Look at me - do I look like I have a bit of anything remotely Chinese?”"
25-03-2018T04:33:53,Vatruvius,I think it would be cool to take one of those DNA tests...but what if my German sides shows I am a descendant of one of Hitler's cousins or something. That would make me feel horrible!
25-03-2018T04:34:17,SpazztasticKiwi,Hitler’s sons agreed to never have children
25-03-2018T04:35:00,Bgrmystr2,"Keep in mind, Vatru, that Hitler, while a tyrant, was still extremely smart"
25-03-2018T04:35:09,SpazztasticKiwi,"So there’s that possibility down. But if you dig far enough in anyone’s history, you’ll find someone like that in it"
25-03-2018T04:35:13,Vatruvius,He son's lived? I thought they were all killed along with Hitler's suicide as to not allow any capture.
25-03-2018T04:35:14,Bgrmystr2,"genious in mental capacity, even"
25-03-2018T04:35:31,Bgrmystr2,but he was unfortunately not a good person when it came down to it
25-03-2018T04:35:46,SpazztasticKiwi,I believe he had a daughter too
25-03-2018T04:35:52,Vatruvius,He was an excellent speech giver.
25-03-2018T04:37:00,Vatruvius,Though...having him be some of the first TV broadcasts out to space for aliens to see sets a bad example if they decode the German language at all.
25-03-2018T04:37:51,SpazztasticKiwi,Stupid and crazy never die - they just reform
25-03-2018T04:38:29,Bgrmystr2,"unlikely, Vatru"
25-03-2018T04:38:32,Bgrmystr2,they have no reference point
25-03-2018T04:38:51,SpazztasticKiwi,I need to go on to bed. I have little more than two hours before alarm
25-03-2018T04:39:02,Vatruvius,Maybe...unless they are super advanced and German is a very primitive language that is easy for their technology to decode.
25-03-2018T04:39:04,Bgrmystr2,there'd be so little sent to them that they wouldn't have enough to decipher the language
25-03-2018T04:39:14,SpazztasticKiwi,And then a 9 hour shift
25-03-2018T04:39:29,Vatruvius,Yikes...go to bed! I will not allow to stay up any longer! Goodnight ma'am!
25-03-2018T04:40:05,Bgrmystr2,"I doubt it would decode at all.. it's like trying to read a few bubbles of japanese or russian or something and you have no reference, nothing it points at, no nothing"
25-03-2018T04:40:17,Bgrmystr2,they could literally mean anything.
25-03-2018T04:40:22,Vatruvius,"It would be more proper to say ""goodnight to you ma'am,"" but it is too late. It has been said."
25-03-2018T04:40:31,Bgrmystr2,"also, gnight kiwi"
25-03-2018T04:40:35,Bgrmystr2,late but whatever
25-03-2018T04:41:06,SpazztasticKiwi,Not to mention the quality of those messages that were sent out. They may not be terribly legible
25-03-2018T04:41:14,Vatruvius,Hopefully...because that would be a really bad first impression.
25-03-2018T04:41:18,SpazztasticKiwi,But nity nite 💤
25-03-2018T04:41:26,Vatruvius,Goodnight!
25-03-2018T04:41:27,Bgrmystr2,xD right kiwi
25-03-2018T04:41:28,Bgrmystr2,gnight :v
25-03-2018T04:42:22,Vatruvius,"I am getting really tired to. I am still in my chair so I am going to climb into bed, bring the laptop, fiddle around then pass out. Goodnight Bgr!"
25-03-2018T04:44:00,Bgrmystr2,gnight Vatru
25-03-2018T04:44:15,Bgrmystr2,and with you leaving. I am the sole surviver of the night :ptv-victory:
25-03-2018T04:44:32,Bgrmystr2,anyone else lurking shuttup and let me have this one :(
25-03-2018T04:44:36,Bgrmystr2,I know you're there.
25-03-2018T04:44:46,Bgrmystr2,you can have next time
25-03-2018T04:45:17,Vatruvius,Lol...bye!
25-03-2018T04:45:31,Bgrmystr2,:ptv-laugh:
25-03-2018T06:46:18,CheeseRS,Ninja
25-03-2018T06:46:31,CheeseRS,Out
25-03-2018T12:11:07,Vatruvius,Goodmorning everyone! :ptv-greetings: Looks like Cheese got the final say last night Bgr.
25-03-2018T13:48:15,Bigboi182,yo!
25-03-2018T13:48:22,Bigboi182,Anyone here?
25-03-2018T13:48:25,Bigboi182,At all?
25-03-2018T13:48:36,Bigboi182,TOOOM!
25-03-2018T13:50:25,Twokinds,I'm always here.
25-03-2018T13:51:58,Vatruvius,lio
25-03-2018T13:52:20,Vatruvius,lol...seriously phone? Why lio?
25-03-2018T13:54:00,Vatruvius,Anyone get a good breakfast today? I made blueberry scones which were great!
25-03-2018T13:55:40,Bigboi182,"Ok, I honestly didn't expect Tom to say anything."
25-03-2018T13:56:01,Bigboi182,"Seriously, have you become a ninja recently?"
25-03-2018T13:56:17,TheBeckoner,"I just made chicken, eggs and rice with some soy sauce. pretty good."
25-03-2018T13:57:56,Bigboi182,I had oats. Very sugary oats.
25-03-2018T13:58:19,Vatruvius,Of course you did Bigboi
25-03-2018T14:00:33,Bigboi182,What can I say? I'm a sucker for sugar.
25-03-2018T14:00:42,Bigboi182,"What did you have, Tom?"
25-03-2018T14:01:03,Vatruvius,Hmm...do you do anything else but lurk during the day Tom? I mean no offense of course.
25-03-2018T14:01:18,Bigboi182,"Yeah, I'm with Vat on this."
25-03-2018T14:01:38,Vatruvius,2 on 1...you have to answer us now.
25-03-2018T14:01:46,Vatruvius,:ptv-hearts:
25-03-2018T14:04:29,Bigboi182,Agreed. Explain yourself!
25-03-2018T14:05:15,Bigboi182,"Sorry man, the silent treatment isn't working here."
25-03-2018T14:06:49,Vatruvius,I can stay at this for hours Tom...I am on spring break...I will do it!
25-03-2018T14:07:18,Bigboi182,Hang on Vat... I got this.
25-03-2018T14:07:23,Bigboi182,I
25-03-2018T14:07:26,Bigboi182,HATE
25-03-2018T14:07:29,Bigboi182,WHITE
25-03-2018T14:07:31,TheBeckoner,I feel there are much more fulfilling activities then waiting for Tom to say what he had for breakfast lol.
25-03-2018T14:07:32,Vatruvius,:ptv-tease:
25-03-2018T14:07:35,Bigboi182,CHOCOLATE
25-03-2018T14:08:01,Vatruvius,Nah...I live in this chat. I am with Bgr here...he is just sleeping.
25-03-2018T14:08:16,Bigboi182,Blast! It really is dead.
25-03-2018T14:08:29,Bigboi182,"Vat, give me something to work with."
25-03-2018T14:08:33,Vatruvius,I do not want to wake him...the bunks in the chat are uncomfortable and really hard to get a good sleep on.
25-03-2018T14:08:44,Vatruvius,I got nothing...just time.
25-03-2018T14:09:38,Bigboi182,"Honestly, I really need Bgr to help us out on this case."
25-03-2018T14:09:59,Vatruvius,Yeah...but he will hurt me if I wake him... :P
25-03-2018T14:11:04,Bigboi182,*sigh* Fine. We won't wake him.
25-03-2018T14:11:08,Bigboi182,Yet.
25-03-2018T14:12:29,Bigboi182,"So, how do we find out Tom's purpose."
25-03-2018T14:13:58,Vatruvius,Google :D
25-03-2018T14:15:18,Bigboi182,"Google can answer anything, but not EVERYthing."
25-03-2018T14:16:25,Vatruvius,Hmm...I am assuming that because Tom is not in a panic from me saying that that there is nothing Google can tells us that has him worried.
25-03-2018T14:16:59,Vatruvius,Well...time to bring out my coding/hacking skills. *cracks knuckles and gets to work*
25-03-2018T14:17:13,Bigboi182,Cue the montage music!
25-03-2018T14:18:27,Vatruvius,Done...the results are in!
25-03-2018T14:18:45,Vatruvius,And...I need level 500 or higher in hacking to do that.
25-03-2018T14:19:01,Vatruvius,Sorry...got nothing else. *shrug*
25-03-2018T14:20:01,Bigboi182,I was so deep in my montage that I just noticed what you said.
25-03-2018T14:20:21,Bigboi182,Probably cause I put on the Rocky theme.
25-03-2018T14:21:11,Bigboi182,"Well, there is ONE thing we can do..."
25-03-2018T14:22:01,Vatruvius,"We all just need to chant ""White Chocolate is the Worst"" over and over. He has to respond to our demands then."
25-03-2018T14:24:12,Bigboi182,Ready?
25-03-2018T14:25:12,Vatruvius,On 3...
25-03-2018T14:25:14,Vatruvius,1...
25-03-2018T14:25:21,Bigboi182,2...
25-03-2018T14:25:22,Vatruvius,2...
25-03-2018T14:25:25,Vatruvius,3...
25-03-2018T14:25:29,Vatruvius,White Chocolate is the Worst
25-03-2018T14:25:52,Bigboi182,"Welp, that sucks."
25-03-2018T14:26:12,Bigboi182,Guess we'll never know...
25-03-2018T14:26:19,Bigboi182,Sorry Vat...
25-03-2018T14:26:20,Vatruvius,Yeah...guess not.
25-03-2018T14:26:42,Bigboi182,"Wait, I thought you got kicked?"
25-03-2018T14:26:59,TheBeckoner,White chocolate is gud.
25-03-2018T14:27:03,Vatruvius,Just a simple refresh...or he trolling me. No matter...I will not go up against a ban hammer.
25-03-2018T14:27:21,Vatruvius,Not worth it.
25-03-2018T14:27:25,Bigboi182,You know what Beck? I'm not even gonna bother anymore.
25-03-2018T14:27:45,Bigboi182,"If he says white chocolate is cool, let him be."
25-03-2018T14:27:53,Vatruvius,I need to transfer these oldrim mods to SSE anyway.
25-03-2018T14:28:38,Bigboi182,"And if we say white chocolate is the worst thing to happen in years, that's our opinion."
25-03-2018T14:29:08,Bigboi182,Sorry 'bout that Tom.
25-03-2018T14:29:19,Bigboi182,We were just curious.
25-03-2018T14:31:48,Bigboi182,"In other news, are you ready for a comic stream today, or is it later on?"
25-03-2018T14:31:56,Bigboi182,This is for Tom.
25-03-2018T14:33:23,Vatruvius,Doubt it would be today...he just finished the sketch color stream yesterday. I am guessing Thursday probably...maybe Wednesday...but that is shooting high for today Bigboi.
25-03-2018T14:38:18,Bigboi182,Yeah
25-03-2018T14:38:40,Bigboi182,"Besides, I don't expect him to say anything to us."
25-03-2018T14:38:50,Bigboi182,Especially after that.
25-03-2018T14:39:10,Bigboi182,"I mean, I already apologized, but..."
25-03-2018T14:40:11,Vatruvius,He responds sometimes but I doubt he will as the whole point of removing the page stream from the schedule is because it will happen when it happens.
25-03-2018T14:40:38,Bigboi182,Agreed.
25-03-2018T14:41:30,Vatruvius,I am sad now though...:ptv-sad:...he kicked me...:ptv-whiny:
25-03-2018T14:45:56,Bigboi182,At least you didn't get the 'b' word...
25-03-2018T14:46:06,Bigboi182,you know...
25-03-2018T14:46:50,Bigboi182,"Just settle it down, and we'll get around this."
25-03-2018T14:47:30,Vatruvius,Meh...
25-03-2018T14:48:26,Bigboi182,"'Cause I've had it happen before, and I don't want the same to happen to you..."
25-03-2018T14:49:38,Bigboi182,Don't ask how... It's pretty pathetic...
25-03-2018T14:51:30,Vatruvius,Alright...I won't...moving on.
25-03-2018T14:52:01,Bgrmystr2,even though white chocolate is good? lol
25-03-2018T14:52:31,Bgrmystr2,also hi :ptv-greetings:
25-03-2018T14:54:35,Vatruvius,Hey Bgr...cheese took your fame of being the last to speak last night. Literally...time stamped 2 minutes after you last message.
25-03-2018T14:54:49,Bgrmystr2,it was not 2 minutes
25-03-2018T14:54:52,Bgrmystr2,it was 2 hours +
25-03-2018T14:55:09,Vatruvius,Was it?
25-03-2018T14:55:14,Bgrmystr2,I can still see it.
25-03-2018T14:55:15,Bgrmystr2,so yes
25-03-2018T14:55:19,Bgrmystr2,2 hours and 1 min
25-03-2018T14:55:22,Vatruvius,Hmm...
25-03-2018T14:58:52,Bigboi182,"Yeah, I saw cheese make that text this morning..."
25-03-2018T14:59:10,Bigboi182,"Bgr, We were trying to call you earlier..."
25-03-2018T15:02:25,Bgrmystr2,"I was dead to the world, don't bother lol"
25-03-2018T15:02:40,Bgrmystr2,you could ram a semi through my bedroom wall and I'd roll over
25-03-2018T15:02:57,Bgrmystr2,probably.
25-03-2018T15:03:16,Bigboi182,I don't think that your presence would've helped...
25-03-2018T15:03:38,Bigboi182,"We tried to find out Tom's ""Secret"""
25-03-2018T15:03:55,Bigboi182,And it resulted in Vat getting kicked...
25-03-2018T15:04:12,Bigboi182,So Idk how you would've helped...
25-03-2018T15:05:52,Bgrmystr2,Tom's secret is that he has no secret
25-03-2018T15:05:58,Bgrmystr2,"or at least, that's what he wants us to think"
25-03-2018T15:06:11,Bgrmystr2,You can think on that one if you like
25-03-2018T15:07:45,Vatruvius,Is it not true that one's secret is not having a secret is a paradox?
25-03-2018T15:08:13,Bgrmystr2,aaaand there lies the problem
25-03-2018T15:08:21,Bgrmystr2,Tom IS the paradox :v
25-03-2018T15:08:25,Bgrmystr2,the one that resided in the box
25-03-2018T15:12:04,Bigboi182,And the key was another paradox?
25-03-2018T15:21:16,Bigboi182,I guess so...
25-03-2018T15:21:57,Bgrmystr2,you assume there was a key
25-03-2018T15:22:01,Bgrmystr2,why lol
25-03-2018T15:22:12,Bgrmystr2,the box was always open
25-03-2018T15:28:43,Bigboi182,I blame FNAF 4...
25-03-2018T15:30:20,Bigboi182,"Anyway, I'll be back in a bit..."
25-03-2018T15:30:32,Bigboi182,Gotta finish off some things...
25-03-2018T15:40:44,Vatruvius,I will be back later as well. Really need to put all my attention into this one thing.
25-03-2018T16:02:46,SpazztasticKiwi,Seems like a lot happened while I was gone
25-03-2018T16:08:31,PalmettoPathfinder1,You know I wonder if it would be cool if I requested some of the TK cast dressed as characters from StarCraft.  What do y'all think and who should each TK character be dressed up like?
25-03-2018T16:09:30,Bgrmystr2,"not really a super big starcraft person, so I dunno"
25-03-2018T16:09:48,PalmettoPathfinder1,"For example, maybe Natani as the Queen of Blades (yeah Infested Kerrigan)."
25-03-2018T16:10:00,PalmettoPathfinder1,So....Infested Natani?
25-03-2018T16:11:17,PalmettoPathfinder1,"And I think Keith dressed up as James Raynor and Trace as Zeratul.  I want to dress Flora, Sythe, and Keidran Raine as Protoss!"
25-03-2018T16:13:41,PalmettoPathfinder1,I think Raine would look cool dressed up as a High Templar.  And maybe Zen as a Dark Templar.  And hm....Redheaded guy dressed up as a Firebat.  or would female Clovis looked good as the Queen of Blades?
25-03-2018T16:13:59,Vatruvius,I do not know anything about Starcraft...so go for it if it is your sketch suggestion.
25-03-2018T16:14:12,Vatruvius,Hey Kiwi...how is the 9 hour shift with the 2 hours of sleep?
25-03-2018T16:14:34,PalmettoPathfinder1,"Well, the thing is: making sure I don't dressed up a TK character as the wrong Starcraft character."
25-03-2018T16:14:34,Bgrmystr2,"I'm sure if Kiwi were able to answer, they'd say it was terrible :u"
25-03-2018T16:15:55,PalmettoPathfinder1,"Still surprised that Hot Tub pic didn't win in the color poll.  Oh well, Fem Clovis with Keith did win so I'm happy.  :)"
25-03-2018T16:16:30,Vatruvius,I feel like the majority of people like to vote for the weird shit...or is that just me?
25-03-2018T16:16:51,PalmettoPathfinder1,No it's not just you.  I sometimes feel the same way too.
25-03-2018T16:17:49,PalmettoPathfinder1,I've been trying to get some crossover requests done (despite the fact that most crossover requests don't do so well in the polls).  Not giving up though!
25-03-2018T16:22:50,PalmettoPathfinder1,One day the crossovers will take over!   MUHAHAHAHA!!
25-03-2018T16:23:18,PalmettoPathfinder1,"Cough cough cough.  Man, I really need to lay off the evil laughter.  It's not good for my health!"
25-03-2018T16:23:28,Bgrmystr2,"First you need to be good at it, Palm"
25-03-2018T16:24:39,PalmettoPathfinder1,"Yeah I know.  Depends on the crossover I guess.  I mean Starcraft is very popular, and so is Star Wars and World of Warcraft.  As well as Metroid.  Hm....Natani dressed up as Samus.... Evil grin."
25-03-2018T16:25:17,Bgrmystr2,"you're not good at the evil villain type deal, man"
25-03-2018T16:25:27,Bgrmystr2,"I mean, keep trying, you'll get better"
25-03-2018T16:25:35,Bgrmystr2,but atm nope :c
25-03-2018T16:26:20,PalmettoPathfinder1,"Nah. I'm more of the hero type actually.  Heck, I can't play as the bad guy in video games.  One reason why I refuse to play any of the Grand Theft Auto games."
25-03-2018T16:28:04,PalmettoPathfinder1,But back to the discussion.  If any of y'all wanted to see the TK cast in a crossover what would it be?
25-03-2018T16:28:06,Bgrmystr2,you don't have to be a bad guy in GTA. Not really. A lot of the games have a campaign on it
25-03-2018T16:28:11,PalmettoPathfinder1,I see.
25-03-2018T16:28:20,Bgrmystr2,and you can just drive around if you like and ignore the campaign
25-03-2018T16:28:45,Bgrmystr2,"but the whole Idea of the game is to become the bad guy, live that fantasy"
25-03-2018T16:29:10,PalmettoPathfinder1,"If I wanted to play the bad guy, I'll find a game where I can play Darth Vader."
25-03-2018T16:29:20,Bgrmystr2,I don't really have any crossover ideas that I wouldn't suggest myself
25-03-2018T16:29:23,Bgrmystr2,"also, why star wars"
25-03-2018T16:29:27,Bgrmystr2,what makes that any better xD
25-03-2018T16:29:39,PalmettoPathfinder1,Oh?  What's wrong with that crossover?
25-03-2018T16:30:19,Bgrmystr2,:ptv-unimpressed:
25-03-2018T16:30:40,PalmettoPathfinder1,You mad that Disney controls Star Wars now?
25-03-2018T16:30:47,Bgrmystr2,are you an idiot xD
25-03-2018T16:31:07,PalmettoPathfinder1,Nope.  I just like driving you crazy that's all.
25-03-2018T16:31:12,Bgrmystr2,confirmed
25-03-2018T16:31:27,Bgrmystr2,"Playing a game as a bad guy, and picking Vader as the choice"
25-03-2018T16:31:32,Bgrmystr2,has nothing to do with crossovers
25-03-2018T16:31:34,PalmettoPathfinder1,"Shows that I care about you.  Plus, it's fun to drive you crazy."
25-03-2018T16:31:40,PalmettoPathfinder1,:D
25-03-2018T16:31:41,Bgrmystr2,cuz there is no crossover to begin with
25-03-2018T16:32:21,Bgrmystr2,and I just don't understand why picking vader as a bad guy makes you any better than picking the guys from GTA
25-03-2018T16:32:26,Bgrmystr2,"if anything, Vader is worse"
25-03-2018T16:32:43,Bgrmystr2,that's prettymuch textbook hypocracy
25-03-2018T16:32:52,PalmettoPathfinder1,Well....Because I love Star Wars that's all.
25-03-2018T16:33:32,PalmettoPathfinder1,"GTA you shoot cops.  I have relatives who are cops.  So, there's that too."
25-03-2018T16:34:41,PalmettoPathfinder1,"Anyhow, something about the TwoKinds world has me confused about something."
25-03-2018T16:35:38,PalmettoPathfinder1,"Are there demons in this world?  There has to be as people have sometimes called Trace a demon, and when he summoned that dark dragon construct he said my demon, so there has to be demons in the TK universe.  But my question also asks, are these demons"
25-03-2018T16:35:53,PalmettoPathfinder1,aligned with the Masks or are they opposed to the Masks' rule?
25-03-2018T16:36:41,PalmettoPathfinder1,And what about angels?  Do they also exist in the TK universe?
25-03-2018T16:37:29,PalmettoPathfinder1,"And furthermore, are there laws against slaying a dragon?  I mean, the dragons seem to want the Templar-Keidran War to end, so it makes sense for the Templars to either:"
25-03-2018T16:37:54,PalmettoPathfinder1,"1) abolish anti-dragonslaying laws, and call open season on all dragons or"
25-03-2018T16:38:25,PalmettoPathfinder1,2) trick the dragons into allying with the Templars by framing the Keidran for assassinating a high-ranking dragon.
25-03-2018T16:38:55,PalmettoPathfinder1,"And also, why am I the only person here right now who's asking these questions?"
25-03-2018T16:40:19,PalmettoPathfinder1,"Okay, think we need an ask the author feature on Tom's Patreon."
25-03-2018T16:42:07,Bgrmystr2,Why would there be laws against or for killing dragons
25-03-2018T16:43:21,PalmettoPathfinder1,"Well, we never heard about there being any dragonslayers up to this point, and pretty much humans seem to hold dragons in high regard especially in the Templar Empire.  So it might mean there are anti-dragonslaying laws in effect."
25-03-2018T16:43:30,Bgrmystr2,and I'm fairly sure most of the angels and demons stuff is not really applicable to the TK world
25-03-2018T16:43:36,Bgrmystr2,and no it doesn't
25-03-2018T16:43:56,Bgrmystr2,"dragons are powerful as hell, you don't NEED a law to tell ppl not to fight them"
25-03-2018T16:43:58,Bgrmystr2,that's stupid
25-03-2018T16:44:52,Bgrmystr2,"Nora's already said that humans flee in terror at the sight of her, generally speaking"
25-03-2018T16:44:54,PalmettoPathfinder1,Hm....Surely there are weaknesses that dragons possess.
25-03-2018T16:45:11,Bgrmystr2,and yeah we've already seen it
25-03-2018T16:45:28,PalmettoPathfinder1,"Well, we know of one so far: drain their mana/magical energy and they're pretty much weaklings."
25-03-2018T16:45:57,PalmettoPathfinder1,"So, don't you think that Evil Trace might have come up with a plan to annihilate the dragons?"
25-03-2018T16:47:29,PalmettoPathfinder1,"I mean he had come up with a plan to wipe out the Basitins and there's still his plan for the Keidran with towers.  So, the only people who could stop him are the dragons, so it makes sense that he would have a plan to take them down as well."
25-03-2018T16:47:32,PalmettoPathfinder1,Right?
25-03-2018T16:48:11,Bgrmystr2,Why would he need to?
