date,user,comment
25-03-2018T00:04:29,Vatruvius,Taking a shower...see you guys in a few.
25-03-2018T00:20:35,Vatruvius,And...I am back! Don't all of you praise at once...sheesh!
25-03-2018T00:21:23,Bigboi182,"Yeah, not gonna bathe you in praise bro."
25-03-2018T00:21:35,DarthRexKing,&gt;w&gt;
25-03-2018T00:21:39,Bigboi182,Especially since you already had a shower.
25-03-2018T00:21:54,Bigboi182,"Hey, DRK."
25-03-2018T00:22:04,Bigboi182,Glad to see you're still here.
25-03-2018T00:22:22,Bigboi182,"Wait, Vat, what time is it where you are."
25-03-2018T00:22:24,Bigboi182,?
25-03-2018T00:22:37,Terramaster20209,helli o/
25-03-2018T00:23:00,Bigboi182,Sup terra.
25-03-2018T00:23:23,Terramaster20209,nothing im just about to go to school
25-03-2018T00:23:55,Bigboi182,Wait it's morning over there?
25-03-2018T00:23:55,Vatruvius,:ptv-sad:...:ptv-whiny:
25-03-2018T00:24:00,Terramaster20209,yep
25-03-2018T00:24:04,Vatruvius,10:23pm
25-03-2018T00:24:11,Terramaster20209,7:24 AM
25-03-2018T00:25:02,Terramaster20209,it kinda suck for me cuz i can't watch most of the streams
25-03-2018T00:25:04,Vatruvius,Are you in Copenhagen @Terramaster20209?
25-03-2018T00:25:17,Terramaster20209,Żywiec in poland
25-03-2018T00:25:20,Bigboi182,"damn, pretty early for you Terra..."
25-03-2018T00:25:28,Terramaster20209,near bielsko biala
25-03-2018T00:25:32,Bigboi182,Plus you don't have Easter break...
25-03-2018T00:25:47,Vatruvius,"Curse you Google, you failed me! :ptv-angry:"
25-03-2018T00:25:54,Terramaster20209,XD
25-03-2018T00:26:15,Bigboi182,I guess vat's in Cali or something...
25-03-2018T00:26:25,Vatruvius,Yup! :ptv-excited:
25-03-2018T00:26:26,Terramaster20209,ugh coffee without milk is horrible
25-03-2018T00:26:52,Vatruvius,I don't drink coffee...because I am AWESOME!
25-03-2018T00:26:53,Bigboi182,It's 1:26 AM here...
25-03-2018T00:27:09,Bigboi182,I just had sugary cornflakes...
25-03-2018T00:27:10,Vatruvius,You in the east Bigboi
25-03-2018T00:27:16,Bigboi182,yep
25-03-2018T00:27:26,Terramaster20209,im in i think it's 8tg grade in america ?
25-03-2018T00:27:26,Bigboi182,in the Caribbean.
25-03-2018T00:27:35,Terramaster20209,8th
25-03-2018T00:27:46,Bigboi182,And I'm fighting off sleep.
25-03-2018T00:27:48,Vatruvius,I rather like living here in the west...Tom's streams never go super late for me. :D
25-03-2018T00:27:55,Terramaster20209,"oh nice Bigboy, how is it there ?"
25-03-2018T00:28:04,Bigboi182,Hot.
25-03-2018T00:28:06,Bigboi182,Hot.
25-03-2018T00:28:11,Bigboi182,and Still hot.
25-03-2018T00:28:18,Bigboi182,So Fine.
25-03-2018T00:29:00,Bigboi182,Basically everything's fine here
25-03-2018T00:29:41,Terramaster20209,"well in poland there pollution in winter, not that cold but it tends to be hot in the summer"
25-03-2018T00:29:56,Bigboi182,We're just hoping to god the US doesn't do anything stupid...
25-03-2018T00:30:05,Bigboi182,cause we're RIGHT THERE.
25-03-2018T00:30:35,Vatruvius,"Speak for yourself @Bigboi182, I am in the US!"
25-03-2018T00:30:39,Terramaster20209,my town has the biggest air pollution in europe :ptv-angry:
25-03-2018T00:30:44,Vatruvius,I am hoping we don't do anything stupid!
25-03-2018T00:31:09,Terramaster20209,well gotta go cya o/
25-03-2018T00:31:15,Vatruvius,I bet there are a fair amount of cities here in the US that beat you Terra
25-03-2018T00:31:17,Bigboi182,"I know Vat, but you're not in the part where all the crazy sh*t happens..."
25-03-2018T00:31:37,Terramaster20209,"trust me vat, no"
25-03-2018T00:32:05,Bigboi182,"Besides, If a nuclear warhead happens, It'll be worse for us than you (as it stands...)"
25-03-2018T00:32:20,Vatruvius,Yeah...but that does not make me feel better. At least here in Cali even Trump hates how nice we are! :D
25-03-2018T00:32:22,Terramaster20209,depends if russia will attack us
25-03-2018T00:32:29,Bigboi182,Damn.
25-03-2018T00:32:49,Vatruvius,Nay...North Korea will fire first.
25-03-2018T00:32:51,Terramaster20209,"vat, you know the pollution scale, right ?"
25-03-2018T00:33:11,Vatruvius,Not really...that or it has been too long for me to recall.
25-03-2018T00:33:28,Terramaster20209,above 100 is polluted
25-03-2018T00:33:39,Terramaster20209,well we had 1600 something
25-03-2018T00:34:22,Bigboi182,My internet's on the frince again..
25-03-2018T00:34:39,Bigboi182,And Idk why...
25-03-2018T00:34:49,Terramaster20209,well the cya o/ have a nice day
25-03-2018T00:35:19,Vatruvius,Bye...I do not know how that is possible Terra...you should be growing a third limb or something.
25-03-2018T00:37:02,Vatruvius,Still...the US is #2 most polluted country in the world so. Pollution sucks but I don't see why we have to be 2nd...just stop you multi-trillion dollar gas corps!
25-03-2018T00:39:47,Bgrmystr2,"probably polluted physically, with trash"
25-03-2018T00:39:51,Bgrmystr2,but not by air
25-03-2018T00:40:11,Bgrmystr2,"If China doesn't have us beat for the #1 spot, I'd be severely disappoint"
25-03-2018T00:40:25,Bgrmystr2,cuz that study has no fucking idea
25-03-2018T00:40:56,Bigboi182,"Well gee, Bgr came back..."
25-03-2018T00:41:07,Bgrmystr2,I never left? :thinking:
25-03-2018T00:41:17,TheBeckoner,I however have come back.
25-03-2018T00:41:25,Bgrmystr2,welcome beck :v
25-03-2018T00:41:38,TheBeckoner,Hullo beejee
25-03-2018T00:41:49,TorqueEmUp,#2 most polluted? I don't even think we are even close to #2 tbh
25-03-2018T00:41:52,Bgrmystr2,are you glad to be beck? :P
25-03-2018T00:41:58,Bgrmystr2,yeah would agree w/ you on that Torque
25-03-2018T00:42:14,Bgrmystr2,there's some seriously polluted countries out there
25-03-2018T00:42:15,TheBeckoner,bean beck is gud
25-03-2018T00:42:17,TorqueEmUp,Definitely not saying we are anywhere near the cleanest either
25-03-2018T00:42:23,Bgrmystr2,well course not
25-03-2018T00:42:29,Bigboi182,So everyone decides to show up at 1:42 AM?
25-03-2018T00:42:31,Bgrmystr2,some of our cities are terribl
25-03-2018T00:42:32,Bgrmystr2,e
25-03-2018T00:42:38,Bigboi182,Or whatever time...
25-03-2018T00:42:44,Bgrmystr2,not really everyone just showing up now
25-03-2018T00:42:52,Bgrmystr2,it's just ppl showing up cuz there's conversation
25-03-2018T00:43:10,Bgrmystr2,"the people you see at this time, for the most part, are the people that live here."
25-03-2018T00:43:12,Bgrmystr2,People like me.
25-03-2018T00:43:17,Bigboi182,So you were just lurking in the shadows?
25-03-2018T00:43:32,Bigboi182,Like I did a couple hours back?
25-03-2018T00:43:34,TorqueEmUp,Even Tom is still lurking lol
25-03-2018T00:43:40,Bgrmystr2,That's my not-secret. I'm always lurking. :ptv-condescending:
25-03-2018T00:43:45,Twokinds,:ctwokinds-NoraEyebrows:
25-03-2018T00:43:51,Bgrmystr2,ayy
25-03-2018T00:44:02,Bigboi182,God dammnit I knew he was here.
25-03-2018T00:44:10,Bgrmystr2,He is always there.
25-03-2018T00:44:25,Bigboi182,Not Always.
25-03-2018T00:44:35,Bgrmystr2,"always watching, Wazowski..."
25-03-2018T00:45:30,Vatruvius,"The US is the 2nd largest greenhouse gas emitter in the world. That is what I meant by polluted, we were talking about air quality. China takes #1 in this category."
25-03-2018T00:46:03,Bigboi182,But quite often.
25-03-2018T00:46:06,Vatruvius,"As for trash, chemicals, physical pollutants, etc. I am sure we are much lower."
25-03-2018T00:46:23,Bigboi182,China?
25-03-2018T00:46:37,Bigboi182,I didn't know that...
25-03-2018T00:46:43,Bgrmystr2,oooh yeah okay Vatru yeah that makes sense
25-03-2018T00:46:44,TorqueEmUp,I still wonder how people measure this crap
25-03-2018T00:46:56,Bigboi182,"Then again, I don't take Ecology so..."
25-03-2018T00:47:24,Bgrmystr2,"air quality is measured by particles of contaminates in the atmosphere, far as I recall"
25-03-2018T00:47:46,Bgrmystr2,"the denser it is, the more likely that life will die :c"
25-03-2018T00:48:10,Bgrmystr2,or at least severely suffer
25-03-2018T00:50:16,Bigboi182,The more you know.
25-03-2018T00:50:26,TorqueEmUp,"Still don't buy it, for all we know they could have taken those readings near a coal burning powerplant for all we know. :P"
25-03-2018T00:50:43,Bigboi182,https://www.youtube.com/watch?v=GD6qtc2_AQA
25-03-2018T00:50:57,TorqueEmUp,Country is more than just a few spots to pull data from
25-03-2018T00:51:14,Bgrmystr2,"naw, it's pretty obvious what cities are polluted just by being there"
25-03-2018T00:51:57,TorqueEmUp,City =/= Country
25-03-2018T00:52:13,Vatruvius,This is true...unfiltered contaminates from activities like coal burning has severe effects on living organisms.
25-03-2018T00:52:28,TorqueEmUp,"Yes there are polluted cities in the states, I don't deny that"
25-03-2018T00:52:50,TorqueEmUp,But you can't say India by scale doesn't pollute more than we do.
25-03-2018T00:52:55,Bgrmystr2,"you have to survey many cities, Torque.. many of them. And compare them on an average to cities of other countries"
25-03-2018T00:53:03,Bgrmystr2,the US is absolutely huge
25-03-2018T00:53:03,TorqueEmUp,We are a massive country
25-03-2018T00:53:07,Bgrmystr2,so yeah
25-03-2018T00:53:33,Vatruvius,"The data I am talking about takes the average of the entire country including production sites, coal burning, cities, everything. This information is provided to the UN to make decisions that is best for everyone."
25-03-2018T00:54:11,Bgrmystr2,'best for everyone' in b4 they just kill everyone but themselves in nuclear war
25-03-2018T00:54:18,Bgrmystr2,and then all problems are solved.
25-03-2018T00:54:19,TorqueEmUp,"Yet all our best efforts with advancing pollution control on cars, it hasn't done a damn thing"
25-03-2018T00:54:48,Bgrmystr2,"electric cars do not pollute the atmosphere from combustion engines, Torque"
25-03-2018T00:54:57,Vatruvius,It is sad really that we one of if not the world power and still produce almost as much pollution as China which is just now ramping up its production like we did during the industrial revolution.
25-03-2018T00:54:58,Bgrmystr2,I'd consider that pretty successful
25-03-2018T00:55:23,Bgrmystr2,Electric cars are expanding rapidly too
25-03-2018T00:55:29,TorqueEmUp,Mining needed to create the batteries in turn make electric cars more harmful to the enviroment.
25-03-2018T00:55:37,Vatruvius,We still burn too much coal to get power...
25-03-2018T00:55:44,TorqueEmUp,plus the added strain on coal power plants
25-03-2018T00:55:57,Bgrmystr2,That's questionable at best Torque
25-03-2018T00:56:18,Bgrmystr2,"the batteries are not nuclear, man"
25-03-2018T00:56:49,TorqueEmUp,Also look at those unregulated barges used to ship around all that material to different countries before the batteries are all put together
25-03-2018T00:57:17,Bgrmystr2,"and you can recycle batteries by taking their components, melting them down, and making new batteries with them"
25-03-2018T00:57:24,Bgrmystr2,instead of needing to mine more resources
25-03-2018T00:57:26,Vatruvius,I do not think the process of mining the materials necessary to make the batteries and actually make them is equal to that of combustion vehicles. It is a net loss in air pollution per vehical.
25-03-2018T00:57:33,Vatruvius,vehicle*
25-03-2018T00:58:27,TorqueEmUp,We'll see
25-03-2018T00:59:03,Vatruvius,"In the US, there is a huge push for companies to get the materials from good/clean sources. Meaning...not from child labor places, from more restricted countries, etc."
25-03-2018T00:59:18,TorqueEmUp,"I am not saying don't try, I am just saying atm, our best efforts are barely scratching the surface."
25-03-2018T00:59:26,Vatruvius,Countries with more restrictions I should say...
25-03-2018T00:59:54,Vatruvius,I will admit our best effects are way below sub-par. We can do so much better.
25-03-2018T01:00:13,TorqueEmUp,"I am not just saying us, the whole world"
25-03-2018T01:00:21,Vatruvius,We can do so much more.* What has happened to my grammer?
25-03-2018T01:00:29,Vatruvius,Yup...I agree.
25-03-2018T01:01:12,TorqueEmUp,We've already set us up for something that we will be never able to reverse.
25-03-2018T01:01:18,TorqueEmUp,it's only going to get worse and worse
25-03-2018T01:01:26,TorqueEmUp,all we can do is slow it down a little
25-03-2018T01:01:32,Vatruvius,"This is why I am upset Trump pulled us out of the Paris thing. ""America First,"" because that is not at all selfish."
25-03-2018T01:02:57,Vatruvius,"We have not yet reached that threshold of no return, but we are close. We have a good 10-20 years before the world gets caught up in resolving disaster after disaster."
25-03-2018T01:03:29,Vatruvius,At that point we are lost...each economy will fall and the world will be in a very low place.
25-03-2018T01:03:50,TorqueEmUp,There will be a tipping point where shit will eventually get done.
25-03-2018T01:03:55,Bgrmystr2,"from what I saw of that paris deal thing, we'd get shit on by that anyway"
25-03-2018T01:04:01,Vatruvius,But I prefer to be optimistic and hope that there is still time to do something and make it right.
25-03-2018T01:04:04,Bgrmystr2,so it wasn't even remotely good for u
25-03-2018T01:04:08,Bgrmystr2,us*
25-03-2018T01:05:16,Vatruvius,"All the Paris deal did was motivate each country to meet goals of reducing air pollution. There were no requirements, no punishments, nothing. Just a unified motivator saying that we will all work together to reducing air pollution."
25-03-2018T01:05:32,Bgrmystr2,definitely not what I've read about it
25-03-2018T01:05:51,Vatruvius,Depends...what were your sources/where did you read about it?
25-03-2018T01:06:25,Bgrmystr2,"It was way back, when it was really big, drudge report had it all up big text and shit"
25-03-2018T01:07:02,Bgrmystr2,"lotta sites were throwing shit back and forth, both good and bad, lotta legal mumbo jumbo"
25-03-2018T01:07:23,TorqueEmUp,"Basically can't believe anything any news agency has to say, someone is always going to twist it in their favor."
25-03-2018T01:07:29,Bgrmystr2,unfortunately I don't have the links for that since it was so long ago
25-03-2018T01:07:31,Bigboi182,Ok.. Remember when I said I was Fighting sleep Vat?
25-03-2018T01:07:58,Bigboi182,I'm thiiis close to giving up...
25-03-2018T01:08:09,Bgrmystr2,"normal humans do that too, Torque. Does that mean we shouldn't trust anyone? There's gotta be a line somewhere lol"
25-03-2018T01:08:27,Bigboi182,"I just neesd one more comment from Tom, and I'll be good."
25-03-2018T01:08:32,Vatruvius,"Drudge Report's description of itself is that it is a right wing, conservative news website. In other words, heavy bias. I prefer the New York Times and the Washington Post. Both provide good information and tend to keep most biases out."
25-03-2018T01:08:47,Bigboi182,TOOOOOM! Where you at?
25-03-2018T01:08:48,Vatruvius,"If not, they do not leave out the other side in their posts/articles."
25-03-2018T01:09:39,Bigboi182,"Also, Pollution sucks, We've tried to fix it, nothing's working,  and we're somehow back to the same place."
25-03-2018T01:09:48,Bigboi182,That's my contribution.
25-03-2018T01:10:01,Bigboi182,In other news...
25-03-2018T01:10:15,Bigboi182,"TOOOOM! seriously, where is he?"
25-03-2018T01:10:19,Bgrmystr2,He's hiding
25-03-2018T01:10:21,Vatruvius,It does work...we just did a shit job of trying. Another plus to living in California...the air is the best here even in our huge cities. I still like the forest without the SMOG though.
25-03-2018T01:10:24,Bigboi182,I know what to do.
25-03-2018T01:10:32,Bgrmystr2,"when people need him most, he vanished"
25-03-2018T01:10:35,TheBeckoner,blah blah blah politics. lol. I'm tired. Night y'all.
25-03-2018T01:10:52,Vatruvius,Goodnight Beckoner!
25-03-2018T01:10:55,Bigboi182,"Yo Tom, I still hate White Chocolate!"
25-03-2018T01:11:00,Twokinds,:ctwokinds-nataniAAAAshake:
25-03-2018T01:11:04,Vatruvius,LoL
25-03-2018T01:11:05,Bgrmystr2,"NYT and Washington post couldn't be more bias if you tried, Vatru."
25-03-2018T01:11:10,Bgrmystr2,just sayin xD
25-03-2018T01:11:17,Bgrmystr2,at least Drudge is honest about it
25-03-2018T01:11:21,Bgrmystr2,give em that
25-03-2018T01:11:30,Bigboi182,That was foolproof.
25-03-2018T01:11:31,Vatruvius,"I could debate you on that Bgr, but I won't right now."
25-03-2018T01:11:44,Bigboi182,It still is foolproof.
25-03-2018T01:11:51,Bgrmystr2,xD Big that was undeniably impressive.
25-03-2018T01:12:02,Bigboi182,"I'mma end on that, that was golden."
25-03-2018T01:12:16,TorqueEmUp,Did your news come from a news agency? Then there is bias
25-03-2018T01:12:33,Vatruvius,"So...if we say ""I hate white chocolate"" in every sentence we are guaranteed a response?"
25-03-2018T01:12:38,Twokinds,I get all my news first hand.
25-03-2018T01:12:48,Bgrmystr2,prolly not vatru
25-03-2018T01:12:53,Twokinds,"If I didn't see it, it doesn't exist."
25-03-2018T01:13:04,Bgrmystr2,:thinking:
25-03-2018T01:13:06,Bgrmystr2,Ideal logic
25-03-2018T01:13:14,TorqueEmUp,Good logic to live by
25-03-2018T01:13:16,Bgrmystr2,"sounds legit, I'll buy it"
25-03-2018T01:13:20,Bigboi182,When is the next stream? this week or the coming week?
25-03-2018T01:13:37,Bgrmystr2,"Streams are Fri and sunday, like it says on the chat banner"
25-03-2018T01:13:41,Bgrmystr2,at the top of the chat
25-03-2018T01:13:48,TorqueEmUp,^
25-03-2018T01:13:53,Bigboi182,In terms of the comic stream.
25-03-2018T01:14:01,Bgrmystr2,the comic stream has no scheduled date
25-03-2018T01:14:04,Bigboi182,Actually all of them.
25-03-2018T01:14:06,Bgrmystr2,xD
25-03-2018T01:14:15,Bgrmystr2,"not anymore, anyway"
25-03-2018T01:14:15,TorqueEmUp,Those will be whenever Tom feels like it now. No set date
25-03-2018T01:14:16,Bigboi182,Because this is Holy Week.
25-03-2018T01:14:23,Vatruvius,I have been meaning to ask...iliar account says he is a bot but he is a person because he donates and response some times? Can anyone clarify what a bot account here on Picarto is like in iliar's case?
25-03-2018T01:14:34,Bigboi182,"And you know, Christianism and stuff..."
25-03-2018T01:14:58,Bgrmystr2,"a bot account is an account that picarto recognises that does code shenaniganry, I believe"
25-03-2018T01:15:13,Bgrmystr2,since he automatically gets the streams when they go into recording
25-03-2018T01:15:17,Bgrmystr2,so he can upload them to youtube
25-03-2018T01:15:22,Bigboi182,"So I ask again, Any streams?"
25-03-2018T01:15:39,Bgrmystr2,"that question was already answered, Big"
25-03-2018T01:15:44,Bgrmystr2,"literally, just above"
25-03-2018T01:15:54,Bigboi182,Because it's holy week
25-03-2018T01:16:02,Vatruvius,I see...that makes sense. A bot account Picarto says is okay...that is a good way of handling it.
25-03-2018T01:16:17,Bgrmystr2,"well, it's not saying ok or not ok"
25-03-2018T01:16:20,Bgrmystr2,it's just identifying one
25-03-2018T01:16:21,Bigboi182,Friday and sunday is both Good Friday and Easter Sunday/
25-03-2018T01:16:26,Bigboi182,So...
25-03-2018T01:16:37,Bgrmystr2,Tom's streamed on christmas day before
25-03-2018T01:16:45,Bgrmystr2,so I mean..
25-03-2018T01:16:54,Vatruvius,Not everyone is christian or minds the holy dates. They do what they do.
25-03-2018T01:16:58,Bigboi182,Well that killed all my explanations...
25-03-2018T01:17:08,Bgrmystr2,I don't see why either of those days make any significance
25-03-2018T01:17:32,Bigboi182,"Anyway, I'm tired, I have practice at 9, I'm out."
25-03-2018T01:17:35,Bgrmystr2,"neither of those days say ""Thou shalt not stream"" so I mean"
25-03-2018T01:17:37,Bgrmystr2,xD
25-03-2018T01:17:49,Bigboi182,Bye Tom and Co!
25-03-2018T01:17:57,Bgrmystr2,seeya big :v
25-03-2018T01:18:03,Vatruvius,Bye Bigboi!
25-03-2018T01:18:08,Bigboi182,I STILL hate White Chocolate.
25-03-2018T01:18:15,Bgrmystr2,You're STILL not human
25-03-2018T01:18:32,Bigboi182,Damn. Thought it would work.
25-03-2018T01:18:34,unsteddyphoenix,"And the lord said ""thou shall not drawn cute catgirls on this day, for they are the lords days."""
25-03-2018T01:18:42,Bigboi182,Bye anyway.
25-03-2018T01:18:45,Vatruvius,"I am not much of a white chocolate fan either. I neither love nor hate it, I just prefer milk chocolate."
25-03-2018T01:18:49,Bgrmystr2,"If the lord didn't like them, phoenix, they wouldn't exist."
25-03-2018T01:19:13,unsteddyphoenix,"""but Flora is mai waifu"" claimed st. Peter"
25-03-2018T01:19:20,unsteddyphoenix,Then he went to hell the end
25-03-2018T01:19:21,Vatruvius,lol
25-03-2018T01:19:42,TorqueEmUp,"Still got a while but I should start looking into a cheap hotel for Anthrocon, obviously one not on their Hotel listings on the site. :P"
25-03-2018T01:19:52,TorqueEmUp,Since those will be overpriced regardless
25-03-2018T01:20:49,Vatruvius,I have never been to any major event like ComicCon or PAX.
25-03-2018T01:21:10,Vatruvius,If I were to go to one I would want to see Acquisitions Incorporate live.
25-03-2018T01:21:11,TorqueEmUp,"I've been to one con, and that was IndyPopCon"
25-03-2018T01:21:44,Vatruvius,An AI fans here?
25-03-2018T01:21:45,TorqueEmUp,"and the hotel we stay in only had probably 1 other group that was attending the con, and they were vendors. lol"
25-03-2018T01:21:54,Bgrmystr2,:ptv-greetings: @Vatro Yo
25-03-2018T01:22:19,Vatruvius,Nice...I will disregard your comment about NYT and WP being biased... :D
25-03-2018T01:22:40,Bgrmystr2,Good. I will also disregard your disregardance.
25-03-2018T01:22:44,TorqueEmUp,^
25-03-2018T01:23:41,Vatruvius,I had a friend  in Hawaii I met online. He went to some sort of ComicCon there years ago...with he's girlfriend he failed to mention that he got one. How rude of him...he has to tell me these things.
25-03-2018T01:23:58,TorqueEmUp,Can't imagine hotels will be anymore costly in Pittsburgh compared to Indianapolis.
25-03-2018T01:24:23,Vatruvius,Anyway...we were playing online together and he and his girlfriend were playing side by side taking turns. He was young...but she told me that night she would make him a man. Never heard from him since...
25-03-2018T01:24:36,TorqueEmUp,The hotel we stayed in wasn't too far from the Indianapolis Motor Speedway
25-03-2018T01:25:07,Vatruvius,I am talking here Torque...shut up! :P
25-03-2018T01:25:23,Bgrmystr2,I WANNA YELL TOO
25-03-2018T01:25:27,Bgrmystr2,I mean
25-03-2018T01:25:28,Bgrmystr2,what
25-03-2018T01:25:29,TorqueEmUp,Sorry don't care about your friends girlfriend.
25-03-2018T01:25:31,TorqueEmUp,:P
25-03-2018T01:25:46,TorqueEmUp,So I am not sorry
25-03-2018T01:26:20,Bgrmystr2,then why u say sorry in the first place
25-03-2018T01:26:26,TorqueEmUp,*shrug*
25-03-2018T01:26:30,Bgrmystr2,don't apologize and then take it back
25-03-2018T01:26:36,Vatruvius,Lol...we were just typing together so he later read that comment and freaked out. Total nerd...he was lucky she thought that was cute otherwise he would have no one.
25-03-2018T01:26:41,TorqueEmUp,It makes it sting more
25-03-2018T01:26:58,Bgrmystr2,"if anything, I'd rather someone not be sorry"
25-03-2018T01:27:10,Bgrmystr2,cuz it just looks bad on them to do that
25-03-2018T01:27:17,Bgrmystr2,"to say sorry, but not mean it"
25-03-2018T01:27:24,Bgrmystr2,that's just lies
25-03-2018T01:27:28,Bgrmystr2,&gt;:v
25-03-2018T01:27:37,TorqueEmUp,People do it all the time
25-03-2018T01:27:44,Bgrmystr2,and those people are lies.
25-03-2018T01:27:46,Bgrmystr2,all of them
25-03-2018T01:27:48,Bgrmystr2,every single one.
25-03-2018T01:27:56,Bgrmystr2,and they're all terrible.
25-03-2018T01:28:09,Vatruvius,I get what you mean Bgr...but I have been burned by people on the internet that I though were close friends so many times that I just do not care about small things like that anymore. To each their own.
25-03-2018T01:28:30,Bgrmystr2,nah vatru. it's the little things that do matter
25-03-2018T01:28:34,Bgrmystr2,they're the only things that do matter
25-03-2018T01:28:44,Vatruvius,In real life though is something entirely different.
25-03-2018T01:28:47,Bgrmystr2,because that's how you find out what kind of person they are
25-03-2018T01:28:54,Bgrmystr2,"and no, it's true there too"
25-03-2018T01:29:06,Bgrmystr2,it just requires a different approach
25-03-2018T01:29:45,Vatruvius,I do care here on the internet too...but I do not know Torque at all beside this little conversation we just had and whatever conversation we had during a stream that I already forgot about.
25-03-2018T01:30:25,Vatruvius,It is the people that I really start to know and like that I take notice. That is how I avoid getting burned again.
25-03-2018T01:30:43,Bgrmystr2,it still happens vatru
25-03-2018T01:30:47,Bgrmystr2,I'm living proof of that.
25-03-2018T01:30:59,Vatruvius,Do you fall into the sincere friend category or the shitty friend category?
25-03-2018T01:31:11,Vatruvius,That is my assessment.
25-03-2018T01:31:20,Bgrmystr2,"I'd like to say I fall in my sincere friend category, but"
25-03-2018T01:31:37,TorqueEmUp,anyone can say anything about themselves
25-03-2018T01:31:39,Bgrmystr2,"I'm also the asshole friend category, cuz I don't mince words"
25-03-2018T01:31:46,Bgrmystr2,I don't play nice :u
25-03-2018T01:31:59,Bgrmystr2,"I tell people what they need to hear, even if they don't like it"
25-03-2018T01:32:05,Bgrmystr2,and prefer they do the same to me
25-03-2018T01:32:15,Bgrmystr2,"some ppl don't like it, and I totally respect that"
25-03-2018T01:32:22,Bgrmystr2,I just let them go and find other people
25-03-2018T01:32:27,Bgrmystr2,don't get in their hair.
25-03-2018T01:32:57,Bgrmystr2,"I ain't worried about it, I don't lose any sleep over it"
25-03-2018T01:33:04,Vatruvius,The latest group of friends I left could not respect my wishes. I just did not want them to a certain thing to me the rest of them were enjoying with each other and they did it anyway. I called them out on it and they were all assholes so I left.
25-03-2018T01:33:14,Vatruvius,"Not worth my time, energy, or emotions."
