date,user,comment
25-03-2018T16:48:32,Bgrmystr2,"We already know that Nora is regarded as one of the most powerful dragons in existance, if not the most"
25-03-2018T16:48:42,Bgrmystr2,and her and trace were very close
25-03-2018T16:48:53,Bgrmystr2,so there's no need for him to even look at any of the other dragons
25-03-2018T16:49:14,Bgrmystr2,"cuz they wouldn't be willing to go toe-to-toe with Nora, nevermind Trace"
25-03-2018T16:49:19,Bgrmystr2,who even Nora respected the power of
25-03-2018T16:49:29,Bgrmystr2,which is telling by itself
25-03-2018T16:49:43,PalmettoPathfinder1,"Yes, but don't you think that eventually his shattered mind would cause him to become paranoid enough to betray his friendship with Nora to destroy the dragons?"
25-03-2018T16:50:01,TheGamePlayer,XD im using the rift core 2.0 to type im messing with the oculus rift its so cool.
25-03-2018T16:50:34,PalmettoPathfinder1,@TheGamePlayer don't mess with the rift!  You'll alter the space time continuum!
25-03-2018T16:50:45,Bgrmystr2,"and no, Palm, I don't,"
25-03-2018T16:50:57,TheGamePlayer,too bad
25-03-2018T16:51:12,PalmettoPathfinder1,Lol!
25-03-2018T16:51:36,Twokinds,Targeting dragons would be a bad idea.
25-03-2018T16:51:44,PalmettoPathfinder1,"Anyhow, @Bgrmystr2, you have to admit that Trace prior to his memory loss was going all Dark Lord."
25-03-2018T16:51:51,TheGamePlayer,im typing via the touch controller so its slow
25-03-2018T16:52:08,TheGamePlayer,HI TOM!
25-03-2018T16:52:16,Twokinds,"Most don't care or even know about human politics. So, all you'd be doing is getting the attention of a bunch of really powerful beings that otherwise had no interest in you before."
25-03-2018T16:52:17,PalmettoPathfinder1,And why is that Tom?  Wouldn't Trace be crazy and evil enough (sooner or later) to attack the dragons?
25-03-2018T16:52:35,PalmettoPathfinder1,Okay that answers my question.
25-03-2018T16:52:45,TheGamePlayer,OH
25-03-2018T16:52:58,TheGamePlayer,caps
25-03-2018T16:53:08,PalmettoPathfinder1,"Still, wouldn't Trace become so twisted and evil that he would betray Nora?"
25-03-2018T16:53:23,TheGamePlayer,wow i touch flora now XD
25-03-2018T16:53:38,TheGamePlayer,aww
25-03-2018T16:54:06,PalmettoPathfinder1,Crud.  Library is closing.  See y'all later!  Keep up the great work Tom!
25-03-2018T16:54:22,TheGamePlayer,bye
25-03-2018T16:55:26,Twokinds,Byebye
25-03-2018T16:55:55,TheGamePlayer,Tom I have a question
25-03-2018T16:55:57,Twokinds,Not even at his most paranoid would Trace turn against Nora. That's just a really bad idea.
25-03-2018T16:56:17,Bgrmystr2,yeh obviously tom
25-03-2018T16:56:23,Bgrmystr2,Nora's super powerful
25-03-2018T16:56:52,TheGamePlayer,pfff ill take her on.. LETS GO!
25-03-2018T16:56:53,Twokinds,She also can't die. So... yeah. Good luck.
25-03-2018T16:56:59,TheGamePlayer,OH
25-03-2018T16:56:59,Bgrmystr2,xD RIP
25-03-2018T16:57:04,TheGamePlayer,nvm
25-03-2018T16:57:11,BadFoMo,She can't die?
25-03-2018T17:00:01,TheGamePlayer,"XD i just booped Flora's nose, it looks way better in vr"
25-03-2018T17:01:48,TheGamePlayer,well bye everyone have a great night:ptv-hearts::ptv-greetings:
25-03-2018T17:01:55,Twokinds,You didn't ask your question
25-03-2018T17:02:00,TheGamePlayer,oh
25-03-2018T17:02:26,Bgrmystr2,hahaha
25-03-2018T17:02:56,TheGamePlayer,ya what tablet do you use?
25-03-2018T17:03:33,Twokinds,27QHD right now
25-03-2018T17:03:38,Twokinds,Citniq
25-03-2018T17:03:46,TheGamePlayer,ah ok
25-03-2018T17:04:15,TheGamePlayer,bye
25-03-2018T17:04:32,Bgrmystr2,I mean.. I could have answered that xD
25-03-2018T17:05:10,Bgrmystr2,now I double-know
25-03-2018T17:05:13,Bgrmystr2,or whatever
25-03-2018T17:07:11,Twokinds,I'm considering a 24 Pro
25-03-2018T17:07:33,Bgrmystr2,not liking the 27 eh? :o
25-03-2018T17:08:07,Twokinds,It has problems
25-03-2018T17:08:25,Bgrmystr2,"yeh, seems like from what you've said on the streams"
25-03-2018T17:08:35,Twokinds,"I honestly miss my old 24HD. If it weren't for the resolution, and how outdated it is now, I'd just get another one."
25-03-2018T17:09:16,Bgrmystr2,is the one you're using considered a newer model of the one you had before?
25-03-2018T17:10:28,Twokinds,It just came out this year
25-03-2018T17:10:35,Twokinds,It's a 4k tablet
25-03-2018T17:10:50,Twokinds,The old 24HD was 1080
25-03-2018T17:11:16,Bgrmystr2,"I dunno exactly how tablets work, but I figure it's kinda like how GPUs went from the 200 series up to like the 400 and 500 series and stuff.. the newer ones being more powerful but there's always differences"
25-03-2018T17:11:52,Bgrmystr2,"4k is super nice, from what I'm told"
25-03-2018T17:11:59,Bgrmystr2,xD haven't played with it myself
25-03-2018T17:12:12,TheDixieNutjob,I just so happened to pop in here...trying to pick out a new drawing tablet?
25-03-2018T17:12:37,Twokinds,Thinking on it
25-03-2018T17:13:17,Twokinds,Honestly the new tablets are pretty lackluster too
25-03-2018T17:13:29,Twokinds,Other than resolution they don't have anything I want.
25-03-2018T17:14:11,TheDixieNutjob,"I'm personally thinking the opposite approach, I'm thinking of going back to inking things traditionally, I thought of how I can scan 11X17 bristol and I seem to ink better that way...scaling up is going to be weird..."
25-03-2018T17:15:23,TheDixieNutjob,"*better and probably faster, we'll see"
25-03-2018T17:15:29,TheBeckoner,I just got my lil wacom intuos lol. Of course Im not creating  a whole comic and life off of it though.
25-03-2018T17:15:47,Bgrmystr2,scaling traditional art is pretty difficult. They're not drawn in vectors
25-03-2018T17:16:04,Bgrmystr2,cuz it's like.. real life
25-03-2018T17:16:06,Bgrmystr2,yknow
25-03-2018T17:16:34,TheDixieNutjob,I found a method from re-watching Mark Crilley
25-03-2018T17:17:15,TheDixieNutjob,"extremely hi-res, black and white color mode, and a TIFF file before bringing it into photoshop"
25-03-2018T17:24:19,TheDixieNutjob,oh no my plan scared everyone away D:
25-03-2018T17:26:19,Vatruvius,Hey everyone!
25-03-2018T17:26:21,JaydenMozingo,"Heya guys. Has the ""Clovis seducing Keith"" sketch been released on patreon yet? I gotta save it for.... a friend."
25-03-2018T17:26:40,Vatruvius,Sure you do Jayden...I know what you mean.
25-03-2018T17:27:33,JaydenMozingo,"Yeah, definitely not for me or anything... heh."
25-03-2018T17:30:36,Vatruvius,Hey Tom...I would just like to apologize for earlier. I did not mean to push you or anything...seemed like we were all just having fun goofing off.
25-03-2018T17:33:01,Bgrmystr2,"Nuh I'm still lurking, Dixie"
25-03-2018T17:33:47,TheDixieNutjob,"oh good, I was beginning to think I might have to commit Seppoku for jump scaring everyone somehow"
25-03-2018T17:34:28,TheGamePlayer,woah that thing makes you feel sick ima take a break and chat here for a bit
25-03-2018T17:34:29,JaydenMozingo,"Was the ""Flora and Kat in black tights"" ever drawn? Once again, it's for... a friend"
25-03-2018T17:34:33,Bgrmystr2,"if you commit sudoku, you can stimulate your mind as well"
25-03-2018T17:34:41,Bgrmystr2,mhm jay sure
25-03-2018T17:34:46,Bgrmystr2,and no it was not
25-03-2018T17:34:49,Bgrmystr2,it never won
25-03-2018T17:34:53,JaydenMozingo,Aww...
25-03-2018T17:34:53,Bgrmystr2,so it's still up for vote
25-03-2018T17:35:16,JaydenMozingo,"Oh yay! I mean, ok. thats cool"
25-03-2018T17:35:20,Bgrmystr2,needs to be resubmit as always
25-03-2018T17:35:25,Vatruvius,lol
25-03-2018T17:35:30,TheGamePlayer,XD
25-03-2018T17:35:37,Bgrmystr2,"you know if the suggestor doesn't suggest it again, then it's not up for vote"
25-03-2018T17:35:44,Bgrmystr2,"cuz yknow, they didn't suggest it"
25-03-2018T17:35:56,TheDixieNutjob,I do enough dice rolling on Thursdays as a play tester for a mecha tabletop skirmish RPG
25-03-2018T17:35:57,JaydenMozingo,yea...
25-03-2018T17:36:50,TheGamePlayer,oh ya Tom you have the HTCvive right because I saw fallout 4 vr on your wishlist and was ganna get it for you but I wasnt sure
25-03-2018T17:37:12,TheGamePlayer,that was my other question
25-03-2018T17:37:37,Twokinds,lol yeah I've got a vive
25-03-2018T17:37:43,TheGamePlayer,ah ok
25-03-2018T17:37:45,Twokinds,But you don't have to buy it for me XD
25-03-2018T17:37:50,TheGamePlayer,ok
25-03-2018T17:37:54,Twokinds,That's kind of you though
25-03-2018T17:38:01,TheGamePlayer,ya np
25-03-2018T17:38:52,unsteddyphoenix,You have a wishlist?
25-03-2018T17:39:11,Twokinds,It's just my steam wishlist he's talking about.
25-03-2018T17:39:34,iliar,@unsteddyphoenix https://store.steampowered.com/wishlist/id/twokinds/#sort=order
25-03-2018T17:39:34,Twokinds,I use it to keep track of when things go on sale.
25-03-2018T17:39:57,TheGamePlayer,do you ever feel sick when using it?
25-03-2018T17:40:06,Twokinds,"No, not really."
25-03-2018T17:40:08,unsteddyphoenix,AHh right eight
25-03-2018T17:40:10,unsteddyphoenix,I do the same thing
25-03-2018T17:40:17,Twokinds,I don't get motion sickness typically.
25-03-2018T17:40:38,Twokinds,"The thing is uncomfortable, though."
25-03-2018T17:40:52,TheGamePlayer,i had that yestarday it was the first time using the rift and today isnt so bad
25-03-2018T17:40:57,Twokinds,I find myself reluctant to play for long periods of time simply because it's not comfortable to wear.
25-03-2018T17:41:12,Twokinds,I feel like making it lighter and easier to wear is  the #1 they need to work on.
25-03-2018T17:41:45,TheGamePlayer,I find the rift is lighter but still is a litte haeavy after a bit
25-03-2018T17:41:50,TheGamePlayer,bla words
25-03-2018T17:41:58,TheGamePlayer,Mondays am I right?
25-03-2018T17:42:24,Twokinds,"I am in an unfortunate situation right now where, due to only having one hdmi port, I can't have my vive and tablet plugged in at the same time."
25-03-2018T17:42:36,Twokinds,And since the tablet is more important... Vive has to go.
25-03-2018T17:42:45,TheGamePlayer,wait]
25-03-2018T17:42:48,JaydenMozingo,Aw
25-03-2018T17:42:55,TheGamePlayer,do you have a DVI port?
25-03-2018T17:43:00,Twokinds,Yes
25-03-2018T17:43:11,TheGamePlayer,ok you can get a DVI to HDMI
25-03-2018T17:43:14,TheGamePlayer,adapter
25-03-2018T17:43:25,Twokinds,For the vive?
25-03-2018T17:43:34,TheGamePlayer,its like 10-14 dollars
25-03-2018T17:43:38,TheGamePlayer,on your pc
25-03-2018T17:43:43,unsteddyphoenix,No VR drawing? Damn
25-03-2018T17:43:47,Twokinds,I'm not sure if DVI would have the specs necessary
25-03-2018T17:43:54,Twokinds,I don't know a lot about the ports
25-03-2018T17:44:26,TheGamePlayer,use the tablet on the dvi or just unplug the tablet when wanting to play htcv
25-03-2018T17:44:50,TheGamePlayer,the DVI is almost the same to a hdmi port
25-03-2018T17:45:49,Twokinds,I can't do the tablet on the dvi
25-03-2018T17:45:53,Bgrmystr2,DVI can push 1080p just like HDMI can
25-03-2018T17:46:00,Bgrmystr2,but keep in mind DVI does not push 4k
25-03-2018T17:46:15,Bgrmystr2,but HDMI has resolutions higher than 1080p
25-03-2018T17:46:16,Twokinds,"The tablet has dvi cables, but it outputs only HD resolution"
25-03-2018T17:46:18,TheGamePlayer,https://www.walmart.com/ip/DVI-D-24-1-Pin-Male-to-HDMI-Female-M-F-Adapter-Converter-for-HDTV-LCD-Monitor/344584681?wmlspartner=wlpa&selectedSellerId=7098&adid=22222222227068295997&wmlspartner=wmtlabs&wl0=&wl1=g&wl2=c&wl3=173689173757&wl4=aud-310687321802:
25-03-2018T17:46:32,Twokinds,The tablet requires hdmi to output 2k
25-03-2018T17:46:49,Bgrmystr2,"yeah, cuz 2k is a bigger res than 1080p"
25-03-2018T17:46:52,Bgrmystr2,"slightly, but still"
25-03-2018T17:46:55,unsteddyphoenix,What DOESNT walmart sell.
25-03-2018T17:47:02,Bgrmystr2,"your face, phoenix :v"
25-03-2018T17:47:07,unsteddyphoenix,:ctwokinds-zenshocked:
25-03-2018T17:47:08,TheGamePlayer,htcv might be slower but you could use it
25-03-2018T17:47:24,TheGamePlayer,XD
25-03-2018T17:47:56,Vatruvius,I can recommend Everspace Tom...just be prepared to die/lose progress semi-often/on the regular depending on the difficulty.
25-03-2018T17:48:01,TheGamePlayer,waiting for Robo-Recall to download
25-03-2018T17:48:45,Bgrmystr2,"Tom, if your GPU has a display port connection, you can convert that to HDMI"
25-03-2018T17:49:04,TheDixieNutjob,"Walmart does not sell model trains, that's what"
25-03-2018T17:49:08,TheGamePlayer,oh yay
25-03-2018T17:49:14,Bgrmystr2,"yeah they do, Dixie."
25-03-2018T17:49:19,TheGamePlayer,XD
25-03-2018T17:49:20,Bgrmystr2,I'ves seen em
25-03-2018T17:49:26,TheDixieNutjob,I haven't
25-03-2018T17:49:27,TheGamePlayer,they do
25-03-2018T17:49:37,Bgrmystr2,they don't always sell the same thing everywhere
25-03-2018T17:49:53,TheDixieNutjob,I'd believe that
25-03-2018T17:50:02,Bgrmystr2,it's common for most stores
25-03-2018T17:50:08,TheGamePlayer,i wonder if the rift will work with fo4vr
25-03-2018T17:50:21,TheGamePlayer,i know its only for htcv
25-03-2018T17:50:24,TheGamePlayer,but still
25-03-2018T17:50:26,Bgrmystr2,the game will say if it works
25-03-2018T17:50:32,Bgrmystr2,"if it doesn't say, then it likely won't"
25-03-2018T17:50:45,JaydenMozingo,They don't sell life-sized action figures... nevermind just saw a stormtrooper.
25-03-2018T17:50:53,TheGamePlayer,XD
25-03-2018T17:50:56,JaydenMozingo,And Vader
25-03-2018T17:51:15,JaydenMozingo,Damn Wallmart. You really DO have everything
25-03-2018T17:51:40,Bgrmystr2,not quite everything
25-03-2018T17:51:52,Bgrmystr2,but a lot of items you need for day-to-day life
25-03-2018T17:51:57,Bgrmystr2,they'll have most of that
25-03-2018T17:52:02,unsteddyphoenix,like model train sets
25-03-2018T17:52:03,Bgrmystr2,tis kind of the point
25-03-2018T17:52:08,Bgrmystr2,yes
25-03-2018T17:52:10,Bgrmystr2,like those
25-03-2018T17:52:12,Bgrmystr2,xD
25-03-2018T17:52:18,unsteddyphoenix,for model-related emergencies
25-03-2018T17:52:18,TheGamePlayer,ya like life size stormtroopers thats a day-to-day item...
25-03-2018T17:52:32,Bgrmystr2,not everything in life is emergencies :v
25-03-2018T17:52:55,TheGamePlayer,74%
25-03-2018T17:53:06,unsteddyphoenix,Depends what kind of life you live
25-03-2018T17:53:19,Bgrmystr2,I mean.. I guess
25-03-2018T17:53:23,TheGamePlayer,ya ever think of the Bgr?
25-03-2018T17:53:32,Bgrmystr2,"think of what, game?"
25-03-2018T17:53:37,Bgrmystr2,74%?
25-03-2018T17:53:44,TheGamePlayer,stahp typing faster then me
25-03-2018T17:53:46,Bgrmystr2,cuz it's just a number
25-03-2018T17:53:48,Bgrmystr2,:V
25-03-2018T17:53:48,Bgrmystr2,NO
25-03-2018T17:53:58,Bigboi182,I'm back!
25-03-2018T17:54:00,Bgrmystr2,:ptv-pouty: I WILL TYPE SUPER FAST
25-03-2018T17:54:01,TheGamePlayer,no what steddy said
25-03-2018T17:54:05,Bgrmystr2,wb big
25-03-2018T17:54:09,Bigboi182,How's everybody?
25-03-2018T17:54:10,TheGamePlayer,:ptv-angry:NOOO
25-03-2018T17:54:15,TheGamePlayer,good
25-03-2018T17:54:17,Bgrmystr2,doin good
25-03-2018T17:54:22,TheGamePlayer,XD\
25-03-2018T17:54:58,Bigboi182,"For once, I'm NOT going to ask about where Tom is."
25-03-2018T17:54:58,Bgrmystr2,phoenix is being a face. Most people won't live their life in 100% emergency
25-03-2018T17:55:07,Bgrmystr2,"good, big"
25-03-2018T17:55:24,Bgrmystr2,that means you've accepted the fact that tom is always here
25-03-2018T17:55:26,unsteddyphoenix,All emergency all the time
25-03-2018T17:55:27,Bgrmystr2,even if he doesn't look it
25-03-2018T17:55:36,TheDixieNutjob,I just realized I'm going to be late with my webcomic again due to having to redraw something and finish the rest of the linework...*sigh*
25-03-2018T17:55:39,Bgrmystr2,"not everyone is you, birb"
25-03-2018T17:55:44,Bigboi182,But I WILL ask what you guys are talking about...
25-03-2018T17:55:52,Bgrmystr2,nothing and everything
25-03-2018T17:55:56,Bgrmystr2,as usual
25-03-2018T17:56:07,Bigboi182,Great! Nothing new then...
25-03-2018T17:56:15,Bgrmystr2,or maybe everything new
25-03-2018T17:56:17,Bgrmystr2,who knows?
25-03-2018T17:56:31,Bgrmystr2,"'sides tom, but he's a cheating elder god or whatever"
25-03-2018T17:56:47,Bgrmystr2,he knows everything
25-03-2018T17:57:01,TheDixieNutjob,so he's ...The Entity...
25-03-2018T17:57:07,unsteddyphoenix,Nora loosely based on reality
25-03-2018T17:57:13,TheDixieNutjob,internet cookies to whoever gets that joke
25-03-2018T17:57:16,Bgrmystr2,xD
25-03-2018T17:58:07,TheGamePlayer,COOKIES
25-03-2018T17:58:27,TheDixieNutjob,hupbupbup you gotta get the joke first
25-03-2018T17:58:45,JaydenMozingo,"Hey I'm trying to paste a link into the chatbar of something I drew but it won't let me copy link, just picture. How can I get the link of it?"
25-03-2018T17:58:50,TheGamePlayer,:cookie::cookie::cookie::cookie:
25-03-2018T17:59:04,TheGamePlayer,nope is took them
25-03-2018T17:59:56,TheGamePlayer,GASP rain its finaly  here no more snow!!!!!
25-03-2018T18:00:09,Bgrmystr2,"that's not really enough information to go on, Jay lol"
25-03-2018T18:00:22,Bgrmystr2,there's too many things that you could be doing wrong
25-03-2018T18:00:26,Bgrmystr2,xD
25-03-2018T18:01:05,TheGamePlayer,like eating pizza with a fork
25-03-2018T18:01:16,Bgrmystr2,uh.. no
25-03-2018T18:01:19,Bgrmystr2,but
25-03-2018T18:01:21,TheGamePlayer,awe
25-03-2018T18:01:23,JaydenMozingo,"Well do You have any ideas? It doesn't just say ""copy link"" on it like with images from a website"
25-03-2018T18:01:24,Vatruvius,Don't dis it...some times it is necessary.
25-03-2018T18:01:26,Bgrmystr2,"I mean... if he wants to do that, why not"
25-03-2018T18:01:39,TheDixieNutjob,you only do that when the pizza's piping hot
25-03-2018T18:01:55,TheGamePlayer,no you let it sit for a bit
25-03-2018T18:02:14,TheGamePlayer,then and rach dressing
25-03-2018T18:02:21,TheGamePlayer,*ranch
25-03-2018T18:02:52,Bgrmystr2,"I literally do not have enough information to suggest anything to you Jay. xD I don't know if you're on a phone or computer, nor do I know what program you're looking at to copy said link, nor do I know how you're trying to copy it and paste it"
25-03-2018T18:03:10,Bgrmystr2,can't read yer mind
25-03-2018T18:03:40,Bgrmystr2,"I never eat pizza with a fork, Dixie. I just let it cool and eat it warm like a normal person"
25-03-2018T18:04:07,Bgrmystr2,"or hot enough to eat, but not hot enough to burn your mouth"
25-03-2018T18:04:19,Bgrmystr2,somewhere between the two
25-03-2018T18:04:28,TheGamePlayer,ever eat it with ranch?
25-03-2018T18:04:33,Bgrmystr2,I don't like ranch
25-03-2018T18:04:37,TheGamePlayer,oh
25-03-2018T18:04:43,Bgrmystr2,unless it's the lays chips
25-03-2018T18:04:48,Bgrmystr2,then those are fine
25-03-2018T18:04:54,Bgrmystr2,"but everything else, no"
25-03-2018T18:04:56,TheGamePlayer,ok
25-03-2018T18:05:07,Bgrmystr2,more ranch for you :u
25-03-2018T18:05:12,TheGamePlayer,YAY
25-03-2018T18:05:18,Vatruvius,"I had on a few occasions pizza at a restaurant where the pizza was too hot, the crust to limb to hold, and too much toppings/sauce to warrant eating it the normal way."
25-03-2018T18:05:51,Bgrmystr2,sounds pretty garbage :/
25-03-2018T18:06:09,Vatruvius,It was some of the best pizza I ever had.
25-03-2018T18:06:12,Bgrmystr2,I'd be very unhappy if a pizza I ordered came to me like that.
25-03-2018T18:06:27,Bgrmystr2,"tasting good, and being properly cooked are two different things"
25-03-2018T18:06:32,Bgrmystr2,they missed the latter.
25-03-2018T18:06:41,Bgrmystr2,cookie dough tastes good too
25-03-2018T18:06:51,Bgrmystr2,doesn't mean we don't wait till it's cooked to eat it
25-03-2018T18:06:52,Bgrmystr2,:U
25-03-2018T18:07:00,Bgrmystr2,well.. some of us :ptv-uneasy:
25-03-2018T18:07:21,TheDixieNutjob,they don't take long to bake man
25-03-2018T18:07:58,Bgrmystr2,"Oh I know, I make pizza all the time"
25-03-2018T18:08:04,Bgrmystr2,"if you want a soft crust, fine"
25-03-2018T18:08:06,Vatruvius,No...there was just so many toppings that they could not cook the middle of the crust to be crisp and hold-able without burning everything else. I rather liked it...I do not judge a pizza on weather or not I can eat if by holding it.
25-03-2018T18:08:08,Bgrmystr2,"but otherwise, crispy crust"
25-03-2018T18:08:10,TheDixieNutjob,I was talking about the cookies
25-03-2018T18:08:35,Bgrmystr2,"that's a problem with knowing how to bake it, vatru"
25-03-2018T18:08:40,Vatruvius,Soft cookies...
25-03-2018T18:08:52,Bgrmystr2,cook it at a lower temperature for longer rather than a higher temperature for shorter
25-03-2018T18:09:04,Bgrmystr2,higher temps will burn stuff that cooks faster
25-03-2018T18:09:18,Vatruvius,This is entirely subjective Bgr...I will make a note that all pizza that you cannot hold is not pizza according to you.
25-03-2018T18:09:37,Bgrmystr2,not true.
25-03-2018T18:09:47,Bgrmystr2,I did mention soft crust
25-03-2018T18:09:50,Bgrmystr2,did I not?
25-03-2018T18:10:15,Bgrmystr2,Making something bad does not make it cease to be that thing
25-03-2018T18:10:29,Bgrmystr2,"you can make a pizza badly, and it's still a pizza"
25-03-2018T18:10:30,Bgrmystr2,it's just bad
25-03-2018T18:10:36,Bgrmystr2,you can do that with any food
25-03-2018T18:11:08,Vatruvius,I disagree with the pizza i described earlier as being poorly made.
25-03-2018T18:11:42,Bgrmystr2,"If it's a cripy crust, it should be able to hold the weight of the toppings on it imo"
25-03-2018T18:11:52,Bgrmystr2,"if it's soft, it will not"
25-03-2018T18:13:15,Bgrmystr2,"like I said, things that are not fully cooked can still taste good"
25-03-2018T18:13:27,Bgrmystr2,taste isn't really a factor in that
25-03-2018T18:13:33,TheGamePlayer,all this talk about pizza made me start the oven to make a stuffed crust dizzornos
25-03-2018T18:13:39,Bgrmystr2,xD
25-03-2018T18:13:47,Bgrmystr2,enjoy it
25-03-2018T18:13:50,TheGamePlayer,thx
25-03-2018T18:13:56,Bgrmystr2,I dunno what I wanna eat atm
25-03-2018T18:14:09,TheGamePlayer,thats my late birthday pizza
25-03-2018T18:14:21,TheGamePlayer,still didnt eat the cake yet
25-03-2018T18:14:30,Bgrmystr2,:ptv-angry: what
25-03-2018T18:14:41,Bgrmystr2,birthday cake is breakfast lunch and supper
25-03-2018T18:14:47,Bgrmystr2,always
25-03-2018T18:14:51,TheGamePlayer,i wasnt hungry
25-03-2018T18:15:05,Bgrmystr2,yet you're making pizza :U
25-03-2018T18:15:14,TheDixieNutjob,well it's a good thing I have already eaten
25-03-2018T18:15:17,TheGamePlayer,i thought pizza and made that
25-03-2018T18:15:21,Bgrmystr2,xD
25-03-2018T18:15:26,Bgrmystr2,pizza cake
25-03-2018T18:15:31,TheGamePlayer,YES!!!!!!
25-03-2018T18:15:36,TheGamePlayer,HEHEHE
25-03-2018T18:15:46,Bgrmystr2,cake that looks like a pizza
25-03-2018T18:15:48,Bgrmystr2,that'd be cool
25-03-2018T18:15:57,TheGamePlayer,cake on pizza
25-03-2018T18:16:00,Bgrmystr2,ew no
25-03-2018T18:16:07,TheGamePlayer,ima try it
25-03-2018T18:16:08,Bgrmystr2,don't go rogue on us
25-03-2018T18:16:19,Bgrmystr2,stahp
25-03-2018T18:16:26,Vatruvius,Grasshopper pie is one of my favorites.
25-03-2018T18:16:29,TheGamePlayer,TOO LATE!!!!!!!!
25-03-2018T18:16:35,Bigboi182,NOOOO!
25-03-2018T18:16:36,TheGamePlayer,EWWW
25-03-2018T18:16:46,Bigboi182,He's gone.
25-03-2018T18:16:48,Bgrmystr2,:ptv-sad::pray: may gameplayer rest in peace
25-03-2018T18:16:53,Bigboi182,We've lost him.
25-03-2018T18:17:03,Bigboi182,RIP GamePlayer...
25-03-2018T18:17:05,TheGamePlayer,AH DEATH CLAW
25-03-2018T18:17:19,TheGamePlayer,ima stay here
25-03-2018T18:17:23,TheGamePlayer,were its safe
25-03-2018T18:17:35,Vatruvius,http://www.worthwhisking.com/wp-content/uploads/2014/12/IMG_1015.jpg
25-03-2018T18:18:00,JaydenMozingo,"Yay I'm back. Ok, so if this counts a plagarism I'm deeply sorry but I ran out of ideas and decided to use a Flora template model to re-make a different character. My new profile pic on here is it."
25-03-2018T18:18:07,TheGamePlayer,HOW DARE you show me good food and not give it to me!!!!!
25-03-2018T18:18:37,Vatruvius,That is grasshopper pie...one of the best desserts.
25-03-2018T18:18:49,Vatruvius,Your pic has not updated Jayden.
25-03-2018T18:18:55,TheDixieNutjob,made from actual grasshoppers
25-03-2018T18:18:55,Bgrmystr2,it's still Kat
25-03-2018T18:19:01,Vatruvius,It will take some time for us to see it.
25-03-2018T18:19:32,Bgrmystr2,"you should probably not use art that tom has made for that, Jay"
25-03-2018T18:19:38,Bigboi182,Simply Glorious Vat.
25-03-2018T18:19:55,SpazztasticKiwi,My grandma‘s dog caught a squirrel
25-03-2018T18:20:08,TheGamePlayer,just do ctrl 5
25-03-2018T18:20:09,Bgrmystr2,"lol, I don't even know what that'd be made of, Vatru"
25-03-2018T18:20:14,JaydenMozingo,Yeah but I ran out of ideas. Just about everything has been drawn at some point so... yeah. sorry for that
25-03-2018T18:20:16,Bigboi182,It still isn't better than TFC (Tom's fried chicken)
25-03-2018T18:20:18,TheGamePlayer,wait what is it
25-03-2018T18:20:33,TheGamePlayer,ctrl f5
25-03-2018T18:20:44,Bgrmystr2,"could be shift F5, game"
25-03-2018T18:20:49,Bgrmystr2,depends on browser
25-03-2018T18:20:51,TheGamePlayer,no ctrl
25-03-2018T18:20:57,TheGamePlayer,aw its cute
25-03-2018T18:21:01,Bgrmystr2,-&gt; Depends on browser
25-03-2018T18:21:15,TheGamePlayer,shut it
25-03-2018T18:21:17,Bgrmystr2,no
25-03-2018T18:21:26,Bgrmystr2,stop saying things that are wrong :v
25-03-2018T18:21:26,TheGamePlayer,no techno talk idc
25-03-2018T18:21:30,TheDixieNutjob,usually it's just F5
25-03-2018T18:21:39,Bgrmystr2,"F5 doesn't reload the cache, Dixie"
25-03-2018T18:21:52,TheDixieNutjob,oh that you have to do that one manually
25-03-2018T18:21:53,TheGamePlayer,ctrl or shift f5
25-03-2018T18:22:15,Bgrmystr2,"Hotkeys are amazing, lol"
25-03-2018T18:22:44,Bigboi182,TFC features the famous Tom's Special.
25-03-2018T18:22:46,TheGamePlayer,pizza befor rift not such a good idea... too greesy
25-03-2018T18:23:01,Bgrmystr2,wash hands maybe? o.O
25-03-2018T18:23:02,Bigboi182,The Artistic Grilled Chicken.
25-03-2018T18:23:16,TheGamePlayer,91%'
25-03-2018T18:23:27,Bigboi182,"Instead of being fried in oil, the Chicken is fried in Paint."
