date,user,comment
26-04-2018T00:19:14,NightMeaty22,Hello
26-04-2018T00:20:11,NightMeaty22,lost his mind 7 years ago
26-04-2018T00:30:30,NightMeaty22,goes back to the dark corner and sits in his box
26-04-2018T00:37:15,Vatruvius,"Hey Meaty, not in the mood to talk but thought I should say hello back."
26-04-2018T03:30:44,TheAvalon,Hello?
26-04-2018T03:31:14,TheAvalon,Enyone here?
26-04-2018T03:32:39,TheAvalon,I'm from Russia.
26-04-2018T12:08:27,ZergsHive,Im too
26-04-2018T12:10:21,ZergsHive,from Russia
26-04-2018T15:03:02,ShAdOw9,Im from Germany :3
26-04-2018T15:18:13,SilliconCarbide,well hello there fellow german soul
26-04-2018T15:46:01,JaydenMozingo,"Tom, rather you're there or not, you need to know that you made my day when I got home and saw Bikini Clovis"
26-04-2018T15:52:48,CrimsonFall,same
26-04-2018T16:40:16,DRAGONTANOPUG,And.... Im back.
26-04-2018T16:40:31,DRAGONTANOPUG,Short week.
26-04-2018T16:46:45,DRAGONTANOPUG,Which sketch hot colored for April?
26-04-2018T16:46:54,DRAGONTANOPUG,Got*
26-04-2018T17:22:36,UnknownEnd,...
26-04-2018T17:22:42,UnknownEnd,YES
26-04-2018T17:25:11,CrRAR,YES?
26-04-2018T17:29:17,DRAGONTANOPUG,?
26-04-2018T17:30:49,CrRAR,¿
26-04-2018T17:32:16,Bgrmystr2,SƎ⅄
26-04-2018T17:35:02,DRAGONTANOPUG,Which sketch got colored for april?
26-04-2018T17:44:59,Bgrmystr2,check the patreon to see if he posted any nora cards :u
26-04-2018T17:55:04,DRAGONTANOPUG,"Again, im not a patreon. If i ask my mom for her credit card shes going too ask ""to buy what"" two weeks ago she said ""Im not going to spend any money on Twokinds, cause why would YOU support somthing like that"" and after explaining so much too her dout"
26-04-2018T17:55:10,DRAGONTANOPUG,She will any way
26-04-2018T18:01:44,NightMeaty22,Hello
26-04-2018T18:01:47,totallynotTrace,you can view a majority of his work on patreon for free
26-04-2018T18:02:01,Bgrmystr2,"Again, irrelevant. Noone has to pay for artwork on the patreon besides the side comic."
26-04-2018T18:02:13,Bgrmystr2,and the side comics are not what you're asking about
26-04-2018T18:02:20,DRAGONTANOPUG,Hello nightmeaty
26-04-2018T18:02:21,totallynotTrace,exactly
26-04-2018T18:02:30,DRAGONTANOPUG,Ok then
26-04-2018T18:02:59,totallynotTrace,I forget if you have to login to view but either way a patreon account is free
26-04-2018T18:03:05,Bgrmystr2,you don't have to
26-04-2018T18:03:14,Bgrmystr2,I can see it and I don't have a patreon account
26-04-2018T18:03:19,DRAGONTANOPUG,Oh an account
26-04-2018T18:07:33,DRAGONTANOPUG,Still habe to pay the 10 bucks tho
26-04-2018T18:07:38,DRAGONTANOPUG,Have*
26-04-2018T18:07:53,totallynotTrace,$10 for what?
26-04-2018T18:08:44,DRAGONTANOPUG,To veiw the april color poll
26-04-2018T18:09:07,totallynotTrace,"also from what I can tell the last Nora card was ""Tail Nap"" posted april 2"
26-04-2018T18:09:24,totallynotTrace,i didnt even know of the april poll
26-04-2018T18:13:52,DRAGONTANOPUG,If I pledge to Tom while I also have access to side comics like the dragon masquerade?
26-04-2018T18:14:31,DRAGONTANOPUG,Will not while
26-04-2018T18:15:29,DRAGONTANOPUG,Oh wait if i buy it now in three days it will renew....... NVM
26-04-2018T18:19:48,totallynotTrace,I think so but not sure exactly what amoount unlocks it
26-04-2018T18:20:08,totallynotTrace,oh
26-04-2018T18:20:11,totallynotTrace,found it
26-04-2018T18:20:43,totallynotTrace,$5 and up unlocks side comics
26-04-2018T18:21:09,totallynotTrace,or thats what it looks like
26-04-2018T18:21:39,Bgrmystr2,the poll is only for people voting on the color images
26-04-2018T18:21:44,Bgrmystr2,and it's only for patrons
26-04-2018T18:21:50,Bgrmystr2,it hasn't finished yet
26-04-2018T18:21:56,Bgrmystr2,that's this sunday
26-04-2018T18:22:30,Bgrmystr2,"he hasn't done any coloring of the stream sketches, cuz that stream hasn't happened yet lol"
26-04-2018T18:22:34,DRAGONTANOPUG,Oh yaaaaaaaaaaaaaa
26-04-2018T18:22:39,Bgrmystr2,"always the last sunday in the month, bro"
26-04-2018T18:22:51,Bgrmystr2,pay attention to the calandar
26-04-2018T18:23:19,Bgrmystr2,"when he finishes the colors, he's gonna post em to patreon and anyone can see the posts anyway"
26-04-2018T18:23:34,Bgrmystr2,so it's pretty irrelevant unless you specifically want to be able to vote for the color
26-04-2018T18:24:04,DRAGONTANOPUG,Now i feel dumb
26-04-2018T18:24:37,Bgrmystr2,seems like a common thing :thinking:
26-04-2018T18:25:33,totallynotTrace,ive only been here for about a month so i dont know how everything works. good to know
26-04-2018T18:26:05,Vatruvius,How are things going pre-stream?
26-04-2018T18:26:26,Vatruvius,"Also, hello people! :ptv-greetings:"
26-04-2018T18:26:30,DRAGONTANOPUG,Hi
26-04-2018T18:29:32,totallynotTrace,hey
26-04-2018T18:29:49,totallynotTrace,seems to be goin well
26-04-2018T18:35:18,DRAGONTANOPUG,You know what's funny two weeks ago I was made fun of for the 10th anniversary chapter cover page as my home screen cuz I had furries on it and that guy who made fun of me read the comic in a week.
26-04-2018T18:35:27,DRAGONTANOPUG,So i made fun of him
26-04-2018T18:35:54,totallynotTrace,pffffft amature
26-04-2018T18:36:00,totallynotTrace,4 days
26-04-2018T18:36:16,DRAGONTANOPUG,6 hours
26-04-2018T18:36:26,totallynotTrace,how tho?
26-04-2018T18:36:35,DRAGONTANOPUG,Car ride
26-04-2018T18:36:45,totallynotTrace,you read fast
26-04-2018T18:37:06,DRAGONTANOPUG,About 500 or 600 wpm
26-04-2018T18:38:25,totallynotTrace,do you even have time to look at the art at that point? thats what took up about half the time for me was just looking
26-04-2018T18:39:26,Bgrmystr2,probably not
26-04-2018T18:39:42,DRAGONTANOPUG,The first time i read it was about 3 days but then i tried yo speed read it.
26-04-2018T18:42:59,totallynotTrace,http://twokinds.keenspot.com/comic/765/ was this you wallpaper Tan?
26-04-2018T18:43:10,totallynotTrace,*your
26-04-2018T18:44:07,Vatruvius,Took me 8 hours to read the comic the first time. I binged it in one night.
26-04-2018T18:44:25,DRAGONTANOPUG,Yea but i change after he screamed he watchs henti on his tablet!!!
26-04-2018T18:44:56,totallynotTrace,ah
26-04-2018T18:45:35,totallynotTrace,im gunna guess you're younger than college age?
26-04-2018T18:45:54,Bgrmystr2,"lol very much so, he is"
26-04-2018T18:46:08,DRAGONTANOPUG,13
26-04-2018T18:46:24,Vatruvius,lol...far from college age.
26-04-2018T18:46:34,totallynotTrace,funny thing actually
26-04-2018T18:46:46,DRAGONTANOPUG,Sorta
26-04-2018T18:46:59,totallynotTrace,I had an 11 year old in my freshman grade class
26-04-2018T18:47:07,totallynotTrace,thats what was funny
26-04-2018T18:47:14,totallynotTrace,not Tans age
26-04-2018T18:47:21,Vatruvius,Hmm...that brilliant huh?
26-04-2018T18:47:52,totallynotTrace,basically I go to community college
26-04-2018T18:48:07,totallynotTrace,so we get a lot of homeschoolers
26-04-2018T18:48:18,totallynotTrace,actually he was in 2 of my classes
26-04-2018T18:48:32,Vatruvius,Hmm...
26-04-2018T18:49:49,Vatruvius,Expecting another page stream today yes?
26-04-2018T18:50:04,totallynotTrace,but anyway what I was originally going to say is Ive seen some much more embarasing things in college. like... just saying someone watches hentia makes it sound like conventional
26-04-2018T18:50:49,totallynotTrace,i hope its a page stream
26-04-2018T18:51:53,totallynotTrace,also people dont really make fun of you for commic related stuff from my experience after highschool
26-04-2018T18:52:31,Vatruvius,"Yeah, it is not that bad compared to what happens in college. Still, not tge healthiest pastime."
26-04-2018T18:52:45,Vatruvius,the*
26-04-2018T18:53:22,DRAGONTANOPUG,I redid my math
26-04-2018T18:53:31,DRAGONTANOPUG,The comic will end in 2024
26-04-2018T18:53:46,totallynotTrace,or will it end?
26-04-2018T18:54:12,DRAGONTANOPUG,"Around 2024, before it was 2951"
26-04-2018T18:54:15,CrimsonFall,"every time I went to the student lounge, people be playing uno"
26-04-2018T18:54:41,totallynotTrace,mean hentai is not the healthiest past time or commics?
26-04-2018T18:54:53,Vatruvius,Trying to determine will it will end makes no sense as we do not know how much more of tge story Tom is still has planned.
26-04-2018T18:54:59,totallynotTrace,we have a D&D club
26-04-2018T18:55:12,CrimsonFall,oh
26-04-2018T18:55:25,CrimsonFall,new season came out
26-04-2018T18:55:27,DRAGONTANOPUG,We have magic the gathering club
26-04-2018T18:55:37,Vatruvius,I mean any type of pornography is not a healthy pastime.
26-04-2018T18:55:58,Bgrmystr2,"Would disagree, Vatru."
26-04-2018T18:56:05,Bgrmystr2,Plenty of artists make a living creating adult art.
26-04-2018T18:56:05,DRAGONTANOPUG,I wouldent count tk as porn
26-04-2018T18:56:23,Bgrmystr2,"also, there's nothing unhealthy about it."
26-04-2018T18:56:55,Vatruvius,"Well, we jnow what you do with your pastime Bgr."
26-04-2018T18:57:03,DRAGONTANOPUG,Lol
26-04-2018T18:57:13,Vatruvius,TK is definitely not porn.
26-04-2018T18:57:15,totallynotTrace,"we also have a general gaming club (covers everything from cards, boards, casual d&d, and video games. then we have a more serious d&d club"
26-04-2018T18:57:22,Bgrmystr2,"Lol vatru, confirmed prude?"
26-04-2018T18:57:24,Bgrmystr2,:V
26-04-2018T18:57:34,totallynotTrace,I would not consider TK porn at all
26-04-2018T18:57:48,Bgrmystr2,attacking me personally for making a statement based on humanity as a whole is tactless.
26-04-2018T18:57:57,DRAGONTANOPUG,I brought my fuckin Atari to school today for no reason...
26-04-2018T18:58:11,Vatruvius,I was not attacking you...
26-04-2018T18:58:52,DRAGONTANOPUG,Im a very attackable person.
26-04-2018T18:58:57,Bgrmystr2,":thinking: Oh, okay. I'll just ignore the very blatant statement you made earlier then?"
26-04-2018T18:59:11,Bgrmystr2,:thumbsup:
26-04-2018T18:59:53,totallynotTrace,ill just drop this here as the definition of pornography
26-04-2018T19:00:02,totallynotTrace,provided by google
26-04-2018T19:00:04,totallynotTrace,"printed or visual material containing the explicit description or display of sexual organs or activity, intended to stimulate erotic rather than aesthetic or emotional feelings."
26-04-2018T19:00:05,Vatruvius,"Well, I certainly was not making a blantant statement about humanity and your opinion on the matter clears indicates some personal experience."
26-04-2018T19:00:30,Vatruvius,clearly*
26-04-2018T19:00:41,DRAGONTANOPUG,I was reading the comic earlier this week and I realize that raine had a cross necklace so does that mean there is a religion called Christianity
26-04-2018T19:01:09,Vatruvius,I doubt it Tano
26-04-2018T19:01:41,Vatruvius,And can you link the page where you saw this necklace?
26-04-2018T19:01:53,Bgrmystr2,"I don't think you understand the context of what you implied, vatru. Unfortunate that you cannot differenciate science from societal pressure."
26-04-2018T19:02:36,Bgrmystr2,Would recommend looking up the science of why adult things are normal and healthy for human society as a whole.
26-04-2018T19:03:19,Xexanoth,when you just come into chat to post a cool tiger vid but people are fighting about porn :ptv-unimpressed:
26-04-2018T19:03:26,Bgrmystr2,xD hey Xex
26-04-2018T19:03:38,Bgrmystr2,it's not a fight
26-04-2018T19:03:44,Xexanoth,"also,  here's a nice short vid you might enjoy https://www.reddit.com/r/NatureIsFuckingLit/comments/8f5u07/slow_motion_tiger_jump_from_animal_planet/"
26-04-2018T19:04:08,DRAGONTANOPUG,Ummmm.. url lookin sketchy
26-04-2018T19:04:08,totallynotTrace,have we seen male genitalia? no. Nipples? no. Does it have steamy moments? sure. However it emphasizes aesthetic and has a very important emotional story (if you need an example just look to the bridge scene on the basatin island)
26-04-2018T19:04:10,Vatruvius,Unfortunate? I was stated my opinion in the matter Bgr. I most certainly understand how life is and tge desire for such content. But from both personal experience and seeing what pornography has done to friends of mine I have formed the opinion that it is
26-04-2018T19:04:23,Vatruvius,an unhealthy pastime.
26-04-2018T19:04:35,Xexanoth,"how is ""reddit"" looking sketchy?"
26-04-2018T19:05:03,Xexanoth,it's one of the biggest sites on the net
26-04-2018T19:05:11,Bgrmystr2,"Yup. Unfortunate. I am not stating opinions. If you would like me to state my opinion, I can, but I did not, because it has no relevance. Putting forth yours is just bad taste."
26-04-2018T19:05:11,Vatruvius,Reddit is not a sketchy site Tano.
26-04-2018T19:05:13,DRAGONTANOPUG,Ders a bad werd in it
26-04-2018T19:05:39,CrimsonFall,"oh i see, this jumping technic is what flora use on trace all the time"
26-04-2018T19:06:04,totallynotTrace,I cant stop laughing at the end of the toes jigling
26-04-2018T19:06:08,Bgrmystr2,"Also, less floof than I thought, xex"
26-04-2018T19:06:24,Vatruvius,How was saying pornography being healthy not your opinion Bgr?
26-04-2018T19:06:49,Bgrmystr2,"because it's not? It's a science, vatru."
26-04-2018T19:07:01,CrimsonFall,he could have known it to be a fact
26-04-2018T19:07:12,DRAGONTANOPUG,An hour left....yawn
26-04-2018T19:07:29,Vatruvius,So you are an expert in the effects of pornagraphy on society Bgr?
26-04-2018T19:07:35,Bgrmystr2,Facts are not the same as opinions. They are different.
26-04-2018T19:07:39,totallynotTrace,general consensus in the scientific community on porn is a mixed bag
26-04-2018T19:07:46,Xexanoth,^
26-04-2018T19:08:15,Xexanoth,"like all things, it depends on how much you use it"
26-04-2018T19:08:21,Bgrmystr2,"I never said that, so no. But it's good as a whole. If you removed it completely, it would be problematic."
26-04-2018T19:08:26,Vatruvius,I would agree with you there notTrace.
26-04-2018T19:08:28,totallynotTrace,absolutely agree with xex
26-04-2018T19:08:30,Xexanoth,it's the difference between enjoying alcohol and being and alcoholic
26-04-2018T19:08:43,Bgrmystr2,"exactly, xex."
26-04-2018T19:09:10,Xexanoth,"so basicially, both side are right....yay?"
26-04-2018T19:09:13,Bgrmystr2,"The difference being that humans are sexual in nature, it's a fact of our genetic code. It makes up a part of who we are as an animal."
26-04-2018T19:09:23,totallynotTrace,generaly jerking it 3+ times a week is evidence of an addiction
26-04-2018T19:09:27,Bgrmystr2,Alchohol is not quite the same
26-04-2018T19:10:18,Vatruvius,I did not say porn is a terrible thing if mamaged. But if porn is your pastime there is something wrong.
26-04-2018T19:10:30,Vatruvius,managed*
26-04-2018T19:10:31,totallynotTrace,bgr: the addiction can have a severe impact on life for both
26-04-2018T19:10:39,Bgrmystr2,"I would say that is just a judgemental view, vatru."
26-04-2018T19:10:53,Bgrmystr2,"Addiction to anything is bad, yes"
26-04-2018T19:11:30,Bgrmystr2,"I think that tiger needs more floof, xex."
26-04-2018T19:11:37,Vatruvius,"I am not judging anyone Bgr, I am speaking from personal experience and ftom what I have seen porn do to friends."
26-04-2018T19:11:55,Vatruvius,I am not some staut Christian holding up a cross.
26-04-2018T19:11:58,Xexanoth,then go to the tiger and use a Dryer to make him more floofy
26-04-2018T19:12:24,Xexanoth,*Man brakes into Tiger exhibit to blow dry tigers...mauled to death* XD
26-04-2018T19:12:25,Bgrmystr2,"&gt;""If you X, then something is wrong with you""&gt;""Not judging anyone"""
26-04-2018T19:12:29,Bgrmystr2,"okay, vatru"
26-04-2018T19:12:39,totallynotTrace,give the tiger some balloons. Staticy
26-04-2018T19:12:51,Bgrmystr2,literal definition of judging people xD
26-04-2018T19:13:12,Bgrmystr2,"yess, baloons :balloon::balloon:"
26-04-2018T19:13:36,Bgrmystr2,they are the best
26-04-2018T19:15:11,Vatruvius,"You are taking my comment out of context. If we are slinging judgemental statements then saying I am tacteless because of X is not judgemental? From my experience in this chat Bgr, if someone foes not agree with you they are always tactless or misinformed"
26-04-2018T19:15:38,Vatruvius,does*
26-04-2018T19:16:56,Vatruvius,"No matter, I am not interested in ruining my mood for the evening arguing with you again. Bye guys."
26-04-2018T19:17:05,Bgrmystr2,"I'm taking it literally in context, but you can't seem to handle being called out for what you're doing. Judging someone simply based on their preferences is being judgemental. That's not the same as judging someone based on their actions."
26-04-2018T19:17:34,Bgrmystr2,Actions speak louder than words. Always.
26-04-2018T19:18:00,DRAGONTANOPUG,Not
26-04-2018T19:18:10,Vatruvius,"If anyone shows sogns of being judgemental from their actions, it would be you Bgr."
26-04-2018T19:18:21,Vatruvius,signs*
26-04-2018T19:18:29,DRAGONTANOPUG,Sogns
26-04-2018T19:18:52,totallynotTrace,"generaly in males porn is at best, minorly unhealth as it reduces testosterone and thus reduces daily confidence, general motivation, overall happiness. but if this is only once a month, its not bad. However studies show that 3+ times a week tends to"
26-04-2018T19:19:09,DRAGONTANOPUG,Good gravy
26-04-2018T19:19:30,Bgrmystr2,"haha, yeah vatru, okay. Ignore everything that happened. :v"
26-04-2018T19:20:20,totallynotTrace,"cause depression, lower self esteem consideralby, sometimes impair sexual judgement and control"
26-04-2018T19:20:48,Bgrmystr2,:thinking: Where you finding this from?
26-04-2018T19:20:51,totallynotTrace,also considerably lowers daily life motivation
26-04-2018T19:21:03,totallynotTrace,one sec
26-04-2018T19:21:50,Bgrmystr2,Seems like it's not taking into account the rest of the user's life
26-04-2018T19:22:00,totallynotTrace,in highschool I had a lot of homework one day so I combined a research paper for wellness class and a assignment from writting
26-04-2018T19:22:11,totallynotTrace,one sec
26-04-2018T19:22:17,totallynotTrace,ill find some links
26-04-2018T19:23:02,totallynotTrace,heres one
26-04-2018T19:23:04,totallynotTrace,https://en.wikipedia.org/wiki/Pornography_addiction
26-04-2018T19:23:13,totallynotTrace,yes i know its wikipedia
26-04-2018T19:23:26,CrimsonFall,wut
26-04-2018T19:23:38,CrimsonFall,they let you use wiki
26-04-2018T19:23:59,Bgrmystr2,yeah that's addiction though
26-04-2018T19:24:09,PalmettoPathfinder1,"As long as you don't use wiki as your primary source, a lot of professors and teachers are okay with it."
26-04-2018T19:24:26,Bgrmystr2,"hence ""compulsive"""
26-04-2018T19:24:31,Bgrmystr2,"Wiki is a fair source, though"
26-04-2018T19:24:40,Bgrmystr2,it has sources for everything it says at the bottom of the page
26-04-2018T19:24:51,Bgrmystr2,so you can check yourself if you're using wiki as a resource for somethiing you're doing
26-04-2018T19:25:00,totallynotTrace,this goes over more the behavioral side of it. https://www.projectknow.com/research/porn-addiction/?utm_term=p_addiction
26-04-2018T19:25:26,Bgrmystr2,also addiction ^
26-04-2018T19:25:34,PalmettoPathfinder1,It's just that the fact that anyone can edit it is what makes teachers and professors wary of letting students use it as a source.
26-04-2018T19:25:34,Zakuru,yo
26-04-2018T19:25:39,DRAGONTANOPUG,Yo
26-04-2018T19:25:45,Bgrmystr2,"the discussion was the benefits of it in general, not actually addiction"
26-04-2018T19:25:56,Bgrmystr2,the latter of which is obviously bad
26-04-2018T19:25:59,Bgrmystr2,hey zak
26-04-2018T19:26:23,Bgrmystr2,"yeah palm, tis why you can use the pages they link as a source"
26-04-2018T19:27:18,CrRAR,what are these links!? ya'll need some JEEEEEESUSSSS.
26-04-2018T19:27:21,CrRAR,hallelujah hallelujah
26-04-2018T19:27:27,CrRAR,jk XD
26-04-2018T19:27:34,Bgrmystr2,Cr pls
26-04-2018T19:27:38,Zakuru,squints
26-04-2018T19:27:53,Zakuru,did i come at a bad time?
26-04-2018T19:28:52,CrRAR,"remember, bgr, something something christian chat"
26-04-2018T19:29:01,Zakuru,"&gt;,&gt;"
26-04-2018T19:29:26,Bgrmystr2,None of that Cr. None of that in my furry chat &gt;:U
26-04-2018T19:29:34,Bgrmystr2,or however it goes
26-04-2018T19:29:39,CrRAR,hahaha
26-04-2018T19:29:45,Zakuru,i need to draw more furs
26-04-2018T19:29:45,Bgrmystr2,I don't recall what the response was
26-04-2018T19:29:49,Zakuru,i need the dirty money
26-04-2018T19:29:52,totallynotTrace,Hey Jesus can you come to the chat?
26-04-2018T19:30:04,Bgrmystr2,"I'm told he's always with us, so....."
26-04-2018T19:30:12,Bgrmystr2,:thinking:
26-04-2018T19:30:17,totallynotTrace,Whats that? you cant type? Damn
26-04-2018T19:30:34,Xexanoth,"The Pope said Dogs go to heaven, so furries should be good."
26-04-2018T19:30:42,CrimsonFall,XD
26-04-2018T19:30:53,Zakuru,spoilers
26-04-2018T19:31:17,totallynotTrace,yay the pope XD
26-04-2018T19:31:49,totallynotTrace,brb
26-04-2018T19:32:04,RH0DE,well im early
26-04-2018T19:32:18,RH0DE,and so are you guys
26-04-2018T19:32:48,PalmettoPathfinder1,Hey y'all!  Gundam has furries now!
26-04-2018T19:32:50,PalmettoPathfinder1,https://youtu.be/p0whKXYKvoQ?t=8m49s
26-04-2018T19:33:11,Zakuru,but thats more directed towards children
26-04-2018T19:33:13,Zakuru,so it makes sense
26-04-2018T19:33:28,Zakuru,...what am i saying
26-04-2018T19:33:29,Zakuru,its anime
26-04-2018T19:33:33,Zakuru,furries are everywhere
26-04-2018T19:33:42,RH0DE,yep
26-04-2018T19:33:57,MarvTheHugPharaoh,There is a furry anime thats for adults
26-04-2018T19:34:04,Zakuru,hi marv
26-04-2018T19:34:09,MarvTheHugPharaoh,Ello p/
26-04-2018T19:34:11,RH0DE,oh no
26-04-2018T19:34:11,Xexanoth,"Always Remember, Anime gave us Renamon"
26-04-2018T19:34:17,Bgrmystr2,heya Marv
26-04-2018T19:34:39,MarvTheHugPharaoh,:yum:
26-04-2018T19:34:41,RH0DE,I recently got a steam controller and its pretty neat
26-04-2018T19:34:52,totallynotTrace,oh hi people arived
26-04-2018T19:35:29,totallynotTrace,dont look tthrough chat history. Youll need Holy Water
26-04-2018T19:35:35,totallynotTrace,for your eyes
26-04-2018T19:35:37,RH0DE,lol
26-04-2018T19:35:42,Bgrmystr2,eh
26-04-2018T19:35:43,Bgrmystr2,I didn't
26-04-2018T19:35:49,Bgrmystr2,maybe I'm immune?
26-04-2018T19:35:58,totallynotTrace,bgr you need it for your soul
26-04-2018T19:36:23,Zakuru,bgr's soul is questionable
26-04-2018T19:36:24,totallynotTrace,i might too
26-04-2018T19:36:49,Bgrmystr2,"I killed myself back in high school, or whatever, I have no soul."
26-04-2018T19:36:50,DRAGONTANOPUG,Damn first game this week just went 5 kills to 17 deaths
26-04-2018T19:36:59,Bgrmystr2,I did it so my friend ed wouldn't steal my soul
26-04-2018T19:37:20,Bgrmystr2,:thinking:
26-04-2018T19:38:23,totallynotTrace,so your goth and your friend is ginger?
26-04-2018T19:38:49,Bgrmystr2,uh..
26-04-2018T19:38:50,Bgrmystr2,no
26-04-2018T19:38:54,Bgrmystr2,just a coincidence.
26-04-2018T19:39:18,totallynotTrace,wait
26-04-2018T19:39:35,RH0DE,"hahaha, I get it"
26-04-2018T19:39:54,totallynotTrace,gears are turning
26-04-2018T19:39:59,totallynotTrace,i think i get it
26-04-2018T19:40:31,totallynotTrace,assuming you answered my joke with a joke
26-04-2018T19:40:43,totallynotTrace,yeah i get it
26-04-2018T19:41:39,Bgrmystr2,"To be fair, I don't know what you were referencing at all, so.. :V"
26-04-2018T19:41:46,Bgrmystr2,not sure if that makes it better or worse lol
26-04-2018T19:42:54,totallynotTrace,you killed yourself so you must be goth. im just referencing highschool stereotypes. And gingers steal souls
26-04-2018T19:43:39,CrimsonFall,since when gingers steal souls?
26-04-2018T19:43:50,Bgrmystr2,cuz they have none of their own :vvvvvvvvvvvvvvv
26-04-2018T19:44:16,Bgrmystr2,also naw he had black hair I think
26-04-2018T19:44:17,Bgrmystr2,or dark brown
26-04-2018T19:44:24,Bgrmystr2,I dunno
26-04-2018T19:44:31,Bgrmystr2,definitely not goth though
26-04-2018T19:44:37,Bgrmystr2,in any way shape or form
26-04-2018T19:44:46,Keeeef,hi guys
26-04-2018T19:44:49,totallynotTrace,hi
26-04-2018T19:45:10,totallynotTrace,welcome to the strange chat Keeeef
26-04-2018T19:45:50,MarvTheHugPharaoh,"meh, its been weirder"
26-04-2018T19:45:58,totallynotTrace,k
26-04-2018T19:46:07,totallynotTrace,good to know
26-04-2018T19:46:29,CrimsonFall,it can always get weirder
26-04-2018T19:46:29,Bgrmystr2,it has
26-04-2018T19:46:41,CrimsonFall,but lets not go there :)
26-04-2018T19:46:47,Keeeef,tatos
26-04-2018T19:46:54,MarvTheHugPharaoh,"Bgr, I feel like we're the old boys that are all ""Back in my day"""
26-04-2018T19:47:04,totallynotTrace,when it gets to weired ill just stop respondign and start lurking
26-04-2018T19:47:20,Keeeef,y lurk
26-04-2018T19:47:30,Keeeef,y not jus join the chaos
26-04-2018T19:48:03,Keeeef,say how do i make my own gif emotes
26-04-2018T19:48:06,totallynotTrace,so i dont get banned accidentally :/
26-04-2018T19:48:32,MarvTheHugPharaoh,"As long as you are nice to others, you can be as weird as you want"
26-04-2018T19:48:57,totallynotTrace,I only consider it weird if MULTIPLE people are at risk of being banned
26-04-2018T19:49:35,DRAGONTANOPUG,I cant take marv seriously with that profilepic
26-04-2018T19:49:48,totallynotTrace,same
26-04-2018T19:49:52,Keeeef,its amazing
26-04-2018T19:50:00,MarvTheHugPharaoh,"spamming and rudeness, are usually what get you banned, being weird just get eyes rolled at you"
26-04-2018T19:50:14,DRAGONTANOPUG,Natani on steroids
26-04-2018T19:51:17,Keeeef,Natani on crystal meth you mean
26-04-2018T19:51:24,Keeeef,those drugs zen took got to her
26-04-2018T19:51:31,DRAGONTANOPUG,Oof
26-04-2018T19:51:32,totallynotTrace,in comepletely random note I just discovered you can wisper to yourself
26-04-2018T19:51:38,Keeeef,wait
26-04-2018T19:51:46,Keeeef,wow
26-04-2018T19:51:53,DRAGONTANOPUG,Me tooo
26-04-2018T19:51:55,DRAGONTANOPUG,Last week
26-04-2018T19:52:02,DRAGONTANOPUG,No one cared
26-04-2018T19:52:06,MarvTheHugPharaoh,the drugs Raine forced fed Zen?
26-04-2018T19:52:09,Keeeef,yes
26-04-2018T19:52:18,DRAGONTANOPUG,Damn
26-04-2018T19:52:25,DRAGONTANOPUG,Brb
