date,user,comment
28-03-2018T00:17:24,Twokinds,:ptv-greetings:
28-03-2018T00:22:02,unsteddyphoenix,"Oh hey, how's it goin'"
28-03-2018T00:23:24,SpazztasticKiwi,:ptv-excited:
28-03-2018T00:24:21,SpazztasticKiwi,Guys I almost died today
28-03-2018T00:24:32,TheBeckoner,How'd that go?
28-03-2018T00:24:42,SpazztasticKiwi,I got in my car to go to work and heard The Buzz of a red wasp
28-03-2018T00:24:55,SpazztasticKiwi,It was inches from my elbow
28-03-2018T00:25:08,SpazztasticKiwi,I think I felt my soul leave my body
28-03-2018T00:25:50,unsteddyphoenix,Are you seeing a therapist for your ptsd?
28-03-2018T00:26:29,SpazztasticKiwi,I have something better- cats to pet
28-03-2018T00:26:43,TheBeckoner,Even better than a therapist
28-03-2018T00:26:46,unsteddyphoenix,!! true!
28-03-2018T00:27:07,SpazztasticKiwi,Then later at work I was loading chickens on the rotisserie oven and there was a little stringy thing on one
28-03-2018T00:27:19,SpazztasticKiwi,I pulled it out of the chicken neck
28-03-2018T00:27:30,SpazztasticKiwi,It was the esophagus
28-03-2018T00:27:57,unsteddyphoenix,Yeah that's about where i'd expect that to be.
28-03-2018T00:28:17,TheBeckoner,yuuuup
28-03-2018T00:28:26,SpazztasticKiwi,They’re supposed to be de-gutted and de-feathered already
28-03-2018T00:28:31,TheBeckoner,stringy stuff freaks me out way too much
28-03-2018T00:28:41,SpazztasticKiwi,Not as bad as the wasp thing though
28-03-2018T00:28:49,TheBeckoner,Extra meat for free
28-03-2018T00:28:52,TheBeckoner,:ok_hand:
28-03-2018T00:29:12,unsteddyphoenix,Throw in a lil' extra how nice of them
28-03-2018T00:29:57,unsteddyphoenix,https://www.instagram.com/p/Bg4YJJIjcT4/
28-03-2018T00:30:01,unsteddyphoenix,New writing prompt
28-03-2018T00:30:40,TheBeckoner,Hah
28-03-2018T00:31:08,SpazztasticKiwi,Btw my friend should be joining us soon
28-03-2018T00:31:14,TheBeckoner,Maybe sythe decided not to kill  a rando squirrel one day and Nibs is showin up for somethin important.
28-03-2018T00:31:25,TheBeckoner,New pepple?
28-03-2018T00:31:54,unsteddyphoenix,The more I think about it the more it makes sense
28-03-2018T00:32:19,SpazztasticKiwi,"Told em about the streams - sent the link. Evidently, they’re already a supporter"
28-03-2018T00:32:34,TheBeckoner,Moar comrades!
28-03-2018T00:32:52,TheBeckoner,Nibs aint a squirrel best I cant tell
28-03-2018T00:32:56,TheBeckoner,not a normal one...
28-03-2018T00:33:18,SpazztasticKiwi,She has the ear length of a red squirrel
28-03-2018T00:33:34,SpazztasticKiwi,Though the length is actually fuzz tufts
28-03-2018T00:33:41,unsteddyphoenix,Someone pointed out something so obvious in hindsight to me
28-03-2018T00:33:51,unsteddyphoenix,Nibbly was afraid of Reni 'cause Reni can read minds
28-03-2018T00:34:31,SpazztasticKiwi,That makes me interested and cautious of what goes on in Nibs mind
28-03-2018T00:35:12,TheBeckoner,I dunno. Even if Nibs does have plans I doubt Nora cares unless it directly affects Trace in particular
28-03-2018T00:35:42,unsteddyphoenix,:ctwokinds-reniderp: &lt;- not nora
28-03-2018T00:35:57,SpazztasticKiwi,“I will rule you all one day. Mark my words...”
28-03-2018T00:35:58,TheBeckoner,ha
28-03-2018T00:36:00,TheBeckoner,oops
28-03-2018T00:36:09,TheBeckoner,I totally replaced those word in myt head
28-03-2018T00:36:12,TheBeckoner,my*
28-03-2018T00:37:07,TheBeckoner,Then yeah seems like Reni would probably give away any crazy plans Nibs had since she is a bit more human-concerned than Nora
28-03-2018T00:37:07,unsteddyphoenix,I am super suspicious of Nibbly yet I also support her 100% :ctwokinds-nibsbounce:
28-03-2018T00:37:11,Bgrmystr2,what exactly would Nibbly have planned in her mind that she'd be scared of Reni?
28-03-2018T00:37:13,Bgrmystr2,like..
28-03-2018T00:37:15,Bgrmystr2,really?
28-03-2018T00:37:16,SpazztasticKiwi,"Tom how’s the day gone for you - do anything wild, like laundry?"
28-03-2018T00:37:23,Bgrmystr2,she's gonna collect nuts probably.
28-03-2018T00:37:27,Twokinds,Nibbly is actually secretly...
28-03-2018T00:37:32,Twokinds,A :chipmunk: !
28-03-2018T00:37:37,TheBeckoner,w o a
28-03-2018T00:37:37,unsteddyphoenix,!!!
28-03-2018T00:37:39,SpazztasticKiwi,A chipmunk?
28-03-2018T00:37:40,Bgrmystr2,:ptv-shock: I KNEW IT
28-03-2018T00:37:41,unsteddyphoenix,AN EMOJI
28-03-2018T00:38:00,TheBeckoner,A digital representation of a land mammal!?!
28-03-2018T00:38:05,unsteddyphoenix,Consider this Bgr
28-03-2018T00:38:15,unsteddyphoenix,How can Nibbly be a red herring if she's a brown squirrel?
28-03-2018T00:38:28,SpazztasticKiwi,She’s red on the inside
28-03-2018T00:38:44,Bgrmystr2,":thinking: cuz a red herring is a concept, not a real animal. :P"
28-03-2018T00:39:13,Vatruvius,I am at a loss for words right now...
28-03-2018T00:39:29,unsteddyphoenix,thats good.
28-03-2018T00:39:35,SpazztasticKiwi,You clearly found some just now
28-03-2018T00:40:10,Bgrmystr2,gotta agree w/ kiwi on this one
28-03-2018T00:40:19,Vatruvius,Watch it Kiwi...we established earlier that making me angry is not a good thing. :ptv-tease:
28-03-2018T00:40:28,Bgrmystr2,meh
28-03-2018T00:40:28,Vatruvius,You too Bgr!
28-03-2018T00:40:41,Bgrmystr2,Pff. what's the worst that could happen. :ptv-condescending:
28-03-2018T00:40:52,Bgrmystr2,ain't worried about it
28-03-2018T00:41:01,SpazztasticKiwi,Shakin in ma boots
28-03-2018T00:41:10,TheBeckoner,so many scurd
28-03-2018T00:41:16,SpazztasticKiwi,You can’t scare me I work in retail
28-03-2018T00:41:21,Vatruvius,:ptv-unimpressed:
28-03-2018T00:42:05,Bgrmystr2,:ptv-laugh: &lt;3
28-03-2018T00:50:16,SpazztasticKiwi,"For example, a lady came in today: “Is that fish?”"
28-03-2018T00:50:36,SpazztasticKiwi,“Yes it is.”
28-03-2018T00:50:46,SpazztasticKiwi,"“Oh, I don’t like fish.”"
28-03-2018T00:50:50,SpazztasticKiwi,???
28-03-2018T00:51:05,TheBeckoner,"""Thanks for letting me know????"""
28-03-2018T00:51:15,TheBeckoner,weird
28-03-2018T00:51:38,TheBeckoner,people come to me and do that with there cars
28-03-2018T00:51:39,unsteddyphoenix,:tropical_fish:
28-03-2018T00:51:44,unsteddyphoenix,"""Is this a car?"""
28-03-2018T00:51:46,TheBeckoner,"""Is it broken"""
28-03-2018T00:51:50,TheBeckoner,"""yes"""
28-03-2018T00:51:55,TheBeckoner,"""cool, thanks"""
28-03-2018T00:51:59,SpazztasticKiwi,And we have bells in case someone needs service and we’re in the back
28-03-2018T00:52:03,TheBeckoner,"""You dont wanna fix it?"""
28-03-2018T00:52:08,TheBeckoner,"""Lol nah"""
28-03-2018T00:52:15,TheBeckoner,like wot
28-03-2018T00:52:19,SpazztasticKiwi,3 of us were up at the front - me and two bakery people
28-03-2018T00:52:42,TheBeckoner,And if you find one big enough it could be a car Phoenix
28-03-2018T00:52:49,TheBeckoner,A water car
28-03-2018T00:53:00,unsteddyphoenix,neat
28-03-2018T00:53:24,SpazztasticKiwi,"Dude came in while I was having a conversation with a coworker and with us watching, he began dinging the bell repeatedly"
28-03-2018T00:53:45,unsteddyphoenix,oh gross
28-03-2018T00:53:51,SpazztasticKiwi,This was a grown man
28-03-2018T00:54:06,unsteddyphoenix,Absolutely disgoosting
28-03-2018T00:54:11,SpazztasticKiwi,Rapidfire ringing a bell with all three of us watching
28-03-2018T00:55:10,unsteddyphoenix,My friend just got a job at a supermarket.
28-03-2018T00:55:21,TheBeckoner,Maybe he liked the sound?
28-03-2018T00:55:23,unsteddyphoenix,First day he got home and passed out on the couch within 10 minutes
28-03-2018T00:55:25,TheBeckoner,Low IQ possibly?
28-03-2018T00:55:27,unsteddyphoenix,It does not seem fun
28-03-2018T00:55:35,unsteddyphoenix,True could have OCD
28-03-2018T00:55:38,SpazztasticKiwi,He had a look on his face that said he was impatient
28-03-2018T00:55:41,TheBeckoner,People are exhausting
28-03-2018T00:56:07,SpazztasticKiwi,Like he was mad that I wasn’t right there to help instantaneously
28-03-2018T00:57:47,SpazztasticKiwi,After work I was on my way out buying some gum and there was a couple with a small kid
28-03-2018T00:58:08,unsteddyphoenix,God. Hopefully I can find a job that lets me work from home.
28-03-2018T00:58:18,unsteddyphoenix,Not sure I have the patience for that long term
28-03-2018T00:58:49,TheBeckoner,All the jobs I just applied for are retail. But based on stuff I like so hopefully it aint too bad
28-03-2018T00:59:31,SpazztasticKiwi,"This kid was grabbing things out of the cart and trying to go ahead and have a snack. When he was denied he started running around the checkout area, and even began moving around and pushing another couple’s cart into their legs as they checked out"
28-03-2018T01:02:16,unsteddyphoenix,Kids are scary Kids are scary Kids are scary ...
28-03-2018T01:02:23,SpazztasticKiwi,Retails subjective there’s always going to be some people that just make even the job you like to do awful
28-03-2018T01:04:08,TheBeckoner,Yeah...Hopefully I can resist too much sarcasm. I hear it can get yah fired...
28-03-2018T01:04:32,SpazztasticKiwi,Had a guy lose his mind one time on me because I dropped his nickel
28-03-2018T01:06:59,Vatruvius,A nickel?
28-03-2018T01:07:11,SpazztasticKiwi,A grown ass man. Yelling at a 19 year old girl. Over a nickel
28-03-2018T01:07:33,Vatruvius,It was hes lucky nickel Kiwi!
28-03-2018T01:07:43,Vatruvius,:ptv-tease:
28-03-2018T01:08:20,SpazztasticKiwi,Can’t be too lucky if it dropped
28-03-2018T01:08:39,unsteddyphoenix,It's trying to escape
28-03-2018T01:08:46,TheBeckoner,yah ruined his nickel!
28-03-2018T01:09:11,Vatruvius,He felt it...it was the one that would have won him the lottery...and you dropped it Kiwi!
28-03-2018T01:09:16,TheBeckoner,Irrational people in retail is very good entertainment tho
28-03-2018T01:09:30,SpazztasticKiwi,Seen a few of those
28-03-2018T01:09:40,SpazztasticKiwi,Like the lady that came in and wanted a cake
28-03-2018T01:10:00,SpazztasticKiwi,Then came back complaining that there were “too many sprinkles”
28-03-2018T01:10:09,Vatruvius,What?
28-03-2018T01:10:25,SpazztasticKiwi,You read that right
28-03-2018T01:10:29,Vatruvius,I am so glad I decided to stay and school to get a skilled job.
28-03-2018T01:10:42,Vatruvius,I would not survive.
28-03-2018T01:10:46,SpazztasticKiwi,I’m not kidding. I really don’t think there’s anybody in our store that like that lady
28-03-2018T01:10:59,SpazztasticKiwi,*likes
28-03-2018T01:11:04,Vatruvius,I would eventually lose my shit.
28-03-2018T01:11:59,Vatruvius,"""If you don't like the number of sprinkles then remove some. Or if you really want to apply for the baker position and bake them with just the right amount of sprinkles!"""
28-03-2018T01:12:18,Bgrmystr2,maybe ask for no sprinkles?
28-03-2018T01:12:23,Bgrmystr2,and then add sprinkles yourself?
28-03-2018T01:12:23,TheBeckoner,"A lady walked into burger king once and proclaimed that ""Ya'll alwyas burnin mah shit every since I quit. Dumbass mfs"""
28-03-2018T01:12:27,SpazztasticKiwi,The cake came premade - all we did was right on it
28-03-2018T01:12:27,TheBeckoner,super loud and nuts
28-03-2018T01:12:47,TheBeckoner,Kept it goin til they called the cops
28-03-2018T01:12:51,Bgrmystr2,"maybe someone is doing it on purpose, beck? :o"
28-03-2018T01:12:56,Bgrmystr2,it's possible
28-03-2018T01:13:01,Bgrmystr2,I've heard people actually do that
28-03-2018T01:13:04,SpazztasticKiwi,She pick the cake out seeing them on sprinkles it already had and decided it was the one she wanted
28-03-2018T01:13:04,TheBeckoner,tried to fight the lady behind the counter too lol
28-03-2018T01:13:07,TheBeckoner,ANd yeah
28-03-2018T01:13:18,Bgrmystr2,"fastfood places fuck with ppl, spit in food, burn food, etc"
28-03-2018T01:13:22,TheBeckoner,It was alleged she left a large tip afterward but i never saw it
28-03-2018T01:13:23,Bgrmystr2,on purpose
28-03-2018T01:13:24,SpazztasticKiwi,Some people throw fits like that get free stuff and discounts
28-03-2018T01:13:25,Vatruvius,You are all brave souls.
28-03-2018T01:13:45,SpazztasticKiwi,I have a silent anger
28-03-2018T01:13:52,TheBeckoner,The only free stuff I get is when taco bell fucks up my order
28-03-2018T01:13:57,TheBeckoner,(Happens alot)
28-03-2018T01:13:57,unsteddyphoenix,All it costs is their dignity
28-03-2018T01:14:08,SpazztasticKiwi,And human decency
28-03-2018T01:14:22,TheBeckoner,And respect...or is that part of dignity?
28-03-2018T01:14:47,SpazztasticKiwi,It’s a part of it
28-03-2018T01:15:09,TheBeckoner,"Damn...gotta finish this paper, may lose power"
28-03-2018T01:15:11,TheBeckoner,see ya'll
28-03-2018T01:15:21,SpazztasticKiwi,😕
28-03-2018T01:15:28,unsteddyphoenix,goodluck~
28-03-2018T01:15:38,Bgrmystr2,"taco bell tends to fuck up my order sometimes. It's about 50/50. I go there, order hardshell tacos, beans and cheese, that's it. no meat or anything else.. and they fuck it up."
28-03-2018T01:16:23,Bgrmystr2,"I can understand like once or twice, but it's a constant battle with every single taco bell I ever go to"
28-03-2018T01:16:24,SpazztasticKiwi,"While I do understand mess ups, they should not be consistent"
28-03-2018T01:26:03,Vatruvius,Well I am fairly tired so I will see you guys later. Goodnight!
28-03-2018T01:30:49,SpazztasticKiwi,🌝
28-03-2018T01:39:51,SpazztasticKiwi,Anybody else do something crazy today
28-03-2018T01:43:34,Vatruvius,Why is it so hard to sleep!?
28-03-2018T01:44:21,Vatruvius,Agh...I filled up some propane tanks and bought ice cream. Does that count as crazy?
28-03-2018T01:44:51,unsteddyphoenix,I ate some sausages...WITHOUT any ketchup
28-03-2018T01:45:27,unsteddyphoenix,https://cdn.discordapp.com/attachments/166699842926542848/428472787863076875/7fGxNjAh9E45GexjmigFlbuovan9LkQFAR4xVInUSAs.png
28-03-2018T01:45:29,unsteddyphoenix,some loafs
28-03-2018T01:45:34,Vatruvius,I eat sausage without ketchup.
28-03-2018T01:46:11,Vatruvius,No health concerns?
28-03-2018T01:46:37,SpazztasticKiwi,Best loaf
28-03-2018T01:48:04,SpazztasticKiwi,I watch YouTube when I can’t sleep
28-03-2018T01:48:25,Vatruvius,I have been watching youtube for the past 4 hours
28-03-2018T01:48:37,SpazztasticKiwi,I’m jumping on and off
28-03-2018T01:49:12,SpazztasticKiwi,Was watching Mark. Now I’m watching Philip DeFranco
28-03-2018T01:49:14,Vatruvius,I just need something interesting to do while in bed.
28-03-2018T01:49:37,Vatruvius,Did you see Mark's 3 Rage Games video?
28-03-2018T01:49:41,SpazztasticKiwi,Yes
28-03-2018T01:49:52,Vatruvius,Highest of Recomendations
28-03-2018T01:49:59,SpazztasticKiwi,Dudes gonna have high blood pressure one day
28-03-2018T01:50:10,Vatruvius,If he doesn't already.
28-03-2018T01:50:57,SpazztasticKiwi,I’d like to see a webcam on that watch of his while he plays those games. Watch his heart rate and blood pressure do the chimichanga
28-03-2018T01:51:18,Vatruvius,Just think Kiwi...take Mark's face from his webcam during one of his rage fits and put it on top of a store clerk dealing with annoying customers.
28-03-2018T01:51:30,SpazztasticKiwi,Telling him to stop sure as hell doesn’t work
28-03-2018T01:51:56,SpazztasticKiwi,"I don’t like to see Mark mad, that’s the thing"
28-03-2018T01:52:40,Vatruvius,I don't like him being mad either but it is just to damn funny. Plus...I know that pain personally on a regular basis.
28-03-2018T01:52:53,SpazztasticKiwi,He jinxed himself at Christmas when he said he hadn’t been in the hospital but year
28-03-2018T01:52:59,SpazztasticKiwi,And then he got hit in the eye with a pickle
28-03-2018T01:53:20,Vatruvius,How he handles it is what is funny. Like throwing his chair and mouse in Getting Over It.
28-03-2018T01:54:14,Vatruvius,Who the hell gets hit in the eye with a pickle. He has to know how stupid that sounds. He said we would know what was going on when that ad was released but I have not seen it.
28-03-2018T01:54:38,SpazztasticKiwi,Meanwhile Chica’s just like “what on earth is wrong with you?”
28-03-2018T01:54:57,SpazztasticKiwi,At this point I’m not surprised by anything he does
28-03-2018T01:55:43,Vatruvius,"Person: ""What did you do yesterday?"" Other Person: ""I got hit in the eye with a pickle."" Person: ""*snicker*"""
28-03-2018T01:56:18,SpazztasticKiwi,You don’t know weird and unpredictability until you watch Markiplier
28-03-2018T01:56:35,Vatruvius,That is so true. I have been watching him for years.
28-03-2018T01:57:08,Vatruvius,Does it result in years taken of my life...yes. Are those years taken off worth it...yes.
28-03-2018T01:57:33,SpazztasticKiwi,"He’s taking a few years off a few of us, yes"
28-03-2018T01:58:17,SpazztasticKiwi,He was in the hospital back in I think it was “15?
28-03-2018T01:58:34,Vatruvius,There should be a fan game called the Crazed Pickle where you control a pickle flying in the air and you have to guide it to Mark's eye. The more points you get the more upgrades.
28-03-2018T01:58:43,SpazztasticKiwi,Subscriber base had a collective stroke
28-03-2018T01:58:47,Vatruvius,He was in the hospital a lot.
28-03-2018T01:59:00,Vatruvius,Oh yeah.
28-03-2018T02:03:09,SpazztasticKiwi,And then there was the one time he decided to go outside and run around the yard 24 hours after being in the hospital
28-03-2018T02:03:50,Vatruvius,That was so long ago...I vaguely remember him doing that.
28-03-2018T02:03:55,SpazztasticKiwi,“I’ll get rest”
28-03-2018T02:04:04,SpazztasticKiwi,Lier
28-03-2018T02:04:28,Vatruvius,Remember his King of the Squirrels thing?
28-03-2018T02:04:57,SpazztasticKiwi,I’m - ow - king of the - ow - squirrels - ow-
28-03-2018T02:05:15,Vatruvius,Yes...why...why Mark?
28-03-2018T02:05:29,SpazztasticKiwi,Somebody duck tape him to a bed
28-03-2018T02:05:45,SpazztasticKiwi,For the sake of everyone’s sanity
28-03-2018T02:05:57,Vatruvius,Tom...we are looking at you. :D
28-03-2018T02:06:25,Vatruvius,Just some duck tape...a face cam...and he will be set.
28-03-2018T02:06:29,SpazztasticKiwi,Tom probably knows how stubborn Mark is better than we do
28-03-2018T02:07:14,Vatruvius,Yeah...we fans have to duck tape him. We will travel under the disguise of protecting him from the Butt Stabber that was set loose.
28-03-2018T02:07:25,SpazztasticKiwi,At this point I resigned myself to excepting that he’s a grown man and I’m not his mama
28-03-2018T02:07:35,SpazztasticKiwi,*accepting
28-03-2018T02:08:00,Vatruvius,Even though he is like 7 years older than you?
28-03-2018T02:08:24,SpazztasticKiwi,I’ll grow gray hairs too early otherwise
28-03-2018T02:08:41,Vatruvius,I will grow gray hairs from watching Mark.
28-03-2018T02:08:47,unsteddyphoenix,I always thought Toms fans would obviously be the weird ones but after reading this im a bit unsure...
28-03-2018T02:08:57,Vatruvius,lol
28-03-2018T02:09:09,Vatruvius,Must run in the family.
28-03-2018T02:09:30,SpazztasticKiwi,I’m sure he’s perfectly capable of taking care of himself. He’s lived up there alone for years so far
28-03-2018T02:10:04,SpazztasticKiwi,And if he does need help Ethan and Tyler are there at least
28-03-2018T02:11:09,Vatruvius,yup
28-03-2018T02:11:52,Vatruvius,Embrace the weird unsteddy!
28-03-2018T02:12:15,unsteddyphoenix,No I am
28-03-2018T02:12:17,unsteddyphoenix,Too cool
28-03-2018T02:12:18,SpazztasticKiwi,Are you trying to tell me that you don’t think Marks fans are weird
28-03-2018T02:12:19,unsteddyphoenix,And hip
28-03-2018T02:12:39,SpazztasticKiwi,You’re not hip; you’re an ass
28-03-2018T02:12:48,unsteddyphoenix,You can be both those things
28-03-2018T02:13:27,Vatruvius,No...one excludes the other.
28-03-2018T02:13:46,SpazztasticKiwi,I don’t know Mark seems like a pretty good example of a walking contradiction
28-03-2018T02:14:10,Vatruvius,Mark is...Mark
28-03-2018T02:14:25,Vatruvius,He has his own definition.
28-03-2018T02:14:54,SpazztasticKiwi,“Species Unknown”
28-03-2018T02:15:04,Vatruvius,Look up Mark in a dictionary: a walking contradiction...do not ask.
28-03-2018T02:15:42,Vatruvius,"The living embodiment of ""What?"""
28-03-2018T02:16:06,SpazztasticKiwi,I have found that Mark wasn’t born with his wittiness; I’m pretty sure he learned it
28-03-2018T02:17:05,TheBeckoner,Good news - didnt lose power
28-03-2018T02:17:06,Vatruvius,Remember his Unnecessary Censorship videos?
28-03-2018T02:17:14,Vatruvius,Good to hear.
28-03-2018T02:17:26,SpazztasticKiwi,Vaguely
28-03-2018T02:17:38,TheBeckoner,also good news - paper isnt due for another week and a half...
28-03-2018T02:17:51,SpazztasticKiwi,Time to celebrate
28-03-2018T02:17:51,TheBeckoner,Those were funny AVt
28-03-2018T02:17:54,TheBeckoner,Vat*
28-03-2018T02:17:56,Vatruvius,Really Spotify...at this time of night?
28-03-2018T02:18:23,TheBeckoner,I would be happier had I not spent the last 4 hours hardcore procrastinating...
28-03-2018T02:18:29,Vatruvius,I am just listening to some music and they interrupt it with an ad about condoms.
28-03-2018T02:18:40,TheBeckoner,Tryin tell yah somethin
28-03-2018T02:18:50,TheBeckoner,Gotta go get some my dude
28-03-2018T02:18:55,TheBeckoner,forsure
28-03-2018T02:18:56,Vatruvius,But...I already go some.
28-03-2018T02:19:01,Vatruvius,got*
28-03-2018T02:19:03,SpazztasticKiwi,That’s happened to me a few times
28-03-2018T02:19:23,TheBeckoner,"Hmm unclear on my part but by ""some"" I ment sex"
28-03-2018T02:19:24,SpazztasticKiwi,I’m just like “ barking up the wrong tree buddy”
28-03-2018T02:19:41,TheBeckoner,meant*(?)
28-03-2018T02:19:43,Vatruvius,What?
28-03-2018T02:19:49,TheBeckoner,nvm
28-03-2018T02:20:01,TheBeckoner,poorly executed tired joke thing
28-03-2018T02:20:40,SpazztasticKiwi,Tomorrow I’m going to be preparing to go see Seán. I’m so excited
28-03-2018T02:21:04,TheBeckoner,Have fun
28-03-2018T02:21:08,Vatruvius,"""Want a sex buddy...call a porn star!"""
28-03-2018T02:21:17,Vatruvius,Who?
28-03-2018T02:21:26,SpazztasticKiwi,I’m going to post all the pictures when I get there
28-03-2018T02:21:38,SpazztasticKiwi,Seánn is Jacksepticeye
28-03-2018T02:21:41,TheBeckoner,Hmm
28-03-2018T02:21:44,SpazztasticKiwi,*Seán
28-03-2018T02:21:51,TheBeckoner,I dont think I followed your twitter...
28-03-2018T02:21:52,Vatruvius,I figured...was about to double check on google.
28-03-2018T02:22:41,SpazztasticKiwi,I remember when I went to Mark show I tweeted some pictures when I went to it
28-03-2018T02:23:01,TheBeckoner,Yah gonna do that again?
28-03-2018T02:23:05,SpazztasticKiwi,He ended up saying it and liking it. At the time I didn’t know what to do with such information
28-03-2018T02:23:13,SpazztasticKiwi,*seeing it
28-03-2018T02:23:17,TheBeckoner,Gather more of it
28-03-2018T02:23:21,Vatruvius,Lol
28-03-2018T02:23:40,Vatruvius,Someone you love to watch on youtube liking your post.
28-03-2018T02:24:20,Vatruvius,Life complete...
28-03-2018T02:24:56,SpazztasticKiwi,Well that’s the thing. He’s a cool guy but he said that he’s no hero; he hates hero worship
28-03-2018T02:25:23,SpazztasticKiwi,And sing him in person. He doesn’t glitter anything so he’s just a guy
28-03-2018T02:25:37,SpazztasticKiwi,*seeing him
28-03-2018T02:25:58,Vatruvius,Yeah...he does not like that stuff. I remember a video he posted about winning some award for helping support those in need. I think it was from the Make a Wish Foundation or something.
28-03-2018T02:26:10,Vatruvius,He really did not feel like he deserved it.
28-03-2018T02:27:10,TheBeckoner,Seeing Tom in chat is good enough for me. Sorta cool to see the guy that makes the comic you've been reading for years is a real dude
28-03-2018T02:27:16,Vatruvius,Who else would he be? Some people I think idolize others too much. In the end...they are just another person.
28-03-2018T02:27:26,TheBeckoner,We all peoples
28-03-2018T02:27:29,TheBeckoner,we all die
28-03-2018T02:27:36,TheBeckoner,cool right?
28-03-2018T02:27:54,TheBeckoner,That's what it all ultimately boils down to
28-03-2018T02:27:57,TheBeckoner,ded
28-03-2018T02:28:12,SpazztasticKiwi,That’s how I am. I’m probably going to shake a whole bunch talking to him at PAX but I don’t think I’m going to freak out
28-03-2018T02:28:34,SpazztasticKiwi,I hope
28-03-2018T02:29:07,TheBeckoner,Takes a lot of my brain power to stay not anxious in situations like that. Idk about you
28-03-2018T02:29:08,Vatruvius,I love Mark's enthusiasm to do good and help others. It is very good to see. His fundraisers and stuff are awesome. I only hope I can make a difference like that to others.
28-03-2018T02:29:44,SpazztasticKiwi,I sometimes imagine him with a wagging tail
28-03-2018T02:29:51,Vatruvius,lol
28-03-2018T02:30:02,Vatruvius,What race is he Kiwi?
28-03-2018T02:30:09,TheBeckoner,Meeting internet people irl for the first time has always been strange to me...
28-03-2018T02:30:22,SpazztasticKiwi,Haven’t his rice been covered before
28-03-2018T02:30:39,SpazztasticKiwi,*Hasn’t his race been covered before?
28-03-2018T02:30:50,TheBeckoner,I think he meant Keidran or what not
28-03-2018T02:30:52,unsteddyphoenix,I love rice.
28-03-2018T02:30:52,Vatruvius,I mean...when he has a tail?
28-03-2018T02:30:58,TheBeckoner,or however you say it
28-03-2018T02:31:40,SpazztasticKiwi,I can see him as a golden retriever or labrador
28-03-2018T02:31:40,TheBeckoner,U love rice instead of cat?? Only room for one love unit!
28-03-2018T02:31:55,TheBeckoner,Fitting as he has one
28-03-2018T02:32:03,TheBeckoner,right?
28-03-2018T02:32:08,TheBeckoner,Chica is one of those?
28-03-2018T02:32:09,unsteddyphoenix,:ctwokinds-KatDance:
28-03-2018T02:32:34,SpazztasticKiwi,Chica is a golden retriever yeah
28-03-2018T02:33:33,SpazztasticKiwi,Wonder if Tom’s zoned out the conversation yet
28-03-2018T02:33:41,Vatruvius,Not sure why...but after I get through this one bands album Spotify gives me a lot of German songs...I don't know what they are saying Spotify!
