date,user,comment
28-03-2018T20:22:28,Ordithus,"I return, with chow mein and beer"
28-03-2018T20:22:54,TheBeckoner,Hullo Ord
28-03-2018T20:22:59,TheBeckoner,Hows the Audi?
28-03-2018T20:23:29,Ordithus,Hi Beck!  It's fantastic.  How are you?
28-03-2018T20:24:32,WIPKING,Any clues to a possible stream tonight
28-03-2018T20:24:36,TheBeckoner,I'm doin great. I thinking Im gonna trade my 99 Tacoma for  70 C10 tomorrow if all goes well.
28-03-2018T20:24:44,TheBeckoner,Stream already happened lol
28-03-2018T20:25:08,TheBeckoner,@iliar probably recorded it though.
28-03-2018T20:25:20,Ordithus,Picarto has the recording too
28-03-2018T20:25:25,qwe304,it was a comic page
28-03-2018T20:25:42,WIPKING,i mssed it
28-03-2018T20:25:49,TheBeckoner,YEah but iliar has those neat x20 ones that dont take forever
28-03-2018T20:25:53,TheBeckoner,smol e
28-03-2018T20:26:10,Ordithus,"Cool, Beck!  Like me, you're going older.  Just a bit more extreme lol"
28-03-2018T20:26:13,qwe304,https://imgur.com/a/KEDud thats it
28-03-2018T20:26:20,WIPKING,i KNOW im subed to teh twokinds streams channel on youtube
28-03-2018T20:26:34,WIPKING,that makes me pissed
28-03-2018T20:26:42,WIPKING,when was it
28-03-2018T20:27:05,TheBeckoner,Haha yeah. My dd is an 05 Taco. I want a track truck and this is the first duded in like a month in half to offer up the body style I wanted
28-03-2018T20:27:12,Ordithus,"It started about 4 hours ago, and finished an hour ago or so"
28-03-2018T20:27:14,TheBeckoner,dude*
28-03-2018T20:27:47,WIPKING,:tired_face: i missed it damn it
28-03-2018T20:28:15,Ordithus,"I missed the whole thing, too."
28-03-2018T20:29:11,WIPKING,when is the one tomarrow
28-03-2018T20:29:21,Ordithus,9 pm EDT
28-03-2018T20:29:31,WIPKING,EDT stands for
28-03-2018T20:29:36,qwe304,@WIPKING the youtube channel is just @illiar uploading the stream once its done
28-03-2018T20:29:38,Ordithus,Eastern Daylight Time
28-03-2018T20:29:45,WIPKING,i knoe
28-03-2018T20:30:03,WIPKING,what about pacific
28-03-2018T20:30:12,Ordithus,"Three hours ""earlier"""
28-03-2018T20:30:19,Bgrmystr2,Pacific is 3 hours behind Eastern
28-03-2018T20:30:21,TheBeckoner,What about Night time? :open_mouth:
28-03-2018T20:30:28,Ordithus,Why is it night time
28-03-2018T20:30:30,Bgrmystr2,so 3 hrs earlier lol
28-03-2018T20:30:39,TheBeckoner,Bcuz mr sun is sleepy Ord
28-03-2018T20:30:52,WIPKING,so 6 pm tomarrow
28-03-2018T20:31:13,Ordithus,Give or take.  Sage and Nekonny are usually on time
28-03-2018T20:31:36,Bgrmystr2,"why you not come by earlier, WIP?"
28-03-2018T20:31:41,unsteddyphoenix,nekonnys not really lol
28-03-2018T20:31:52,WIPKING,i wa sflying my grandfathers droen at a park
28-03-2018T20:31:58,Bgrmystr2,yeh Ron's usually not on time
28-03-2018T20:32:12,Bgrmystr2,sometimes he is though
28-03-2018T20:32:20,Ordithus,He isn't?  I figured he was at least usually closer than Tom :P
28-03-2018T20:32:24,Bgrmystr2,"hell, sometimes he streams all friday"
28-03-2018T20:32:26,WIPKING,plus im pretenting to do homwork
28-03-2018T20:32:50,Bgrmystr2,"Tom is usually around 5-10 mins late, he's usually setting up for the stream"
28-03-2018T20:33:01,unsteddyphoenix,it varies
28-03-2018T20:33:12,Bgrmystr2,"if it's later than that, he may be busy dealing with something"
28-03-2018T20:33:15,Ordithus,"Someimes, he's on time."
28-03-2018T20:33:33,Ordithus,"I hear rumor, he's even been early once."
28-03-2018T20:33:53,unsteddyphoenix,madness
28-03-2018T20:34:17,Bgrmystr2,"given all the friday streams I've seen, I'd give tom from 9pm to 10mins after for when he generally starts"
28-03-2018T20:34:39,Bgrmystr2,"anytime in that window, usually"
28-03-2018T20:34:39,qwe304,press the follow button and youll get an email when he streams
28-03-2018T20:35:16,WIPKING,"i did the math guys if 1 month in the comic is 7 years in real life than 1 year in the comci is 84 years in real life thus, if flora only lives for 10 more years the comic will end in 840 years in 2858 B.C"
28-03-2018T20:35:24,Bgrmystr2,Wip no
28-03-2018T20:35:30,WIPKING,BGr yes
28-03-2018T20:35:33,Ordithus,2858 BC?!
28-03-2018T20:35:37,WIPKING,yep
28-03-2018T20:35:45,Ordithus,Impossibru
28-03-2018T20:35:47,Bgrmystr2,Literally.. Tom already emptied the chat earlier
28-03-2018T20:35:56,WIPKING,lol
28-03-2018T20:35:58,Bgrmystr2,"because of that, I think;"
28-03-2018T20:36:00,unsteddyphoenix,BC lol
28-03-2018T20:36:01,WIPKING,ill do  it again
28-03-2018T20:36:10,WIPKING,what is it D.C
28-03-2018T20:36:16,WIPKING,i have them mixed up
28-03-2018T20:36:18,Ordithus,District of Columbia
28-03-2018T20:36:19,Twokinds,:ctwokinds-flomad:
28-03-2018T20:36:20,TheBeckoner,Nooooo
28-03-2018T20:36:23,Bgrmystr2,are you trying to get banned WIP xDD
28-03-2018T20:36:23,unsteddyphoenix,"Dude, cmon."
28-03-2018T20:36:32,WIPKING,no
28-03-2018T20:36:37,TheBeckoner,Well your gonna
28-03-2018T20:36:38,unsteddyphoenix,Instead of trying to do maths maybe get some basic leans
28-03-2018T20:36:39,Bellhead,"Yeah, why'd ya have to make Tom mad?"
28-03-2018T20:36:41,Bgrmystr2,well you're doin a pretty good job so far
28-03-2018T20:36:47,Bgrmystr2,for not trying to do so
28-03-2018T20:36:54,unsteddyphoenix,I know youre like 12 but jeez
28-03-2018T20:37:04,TheBeckoner,and gay* of course
28-03-2018T20:37:13,Bgrmystr2,xD^
28-03-2018T20:37:16,Bgrmystr2,where is that guy anyway
28-03-2018T20:37:22,WIPKING,well at the rate he is going it will taek 840 years for it to end and if tom cant die then our grand children will see the end
28-03-2018T20:37:22,Bgrmystr2,haven't seen him around
28-03-2018T20:37:28,BadFoMo,"Also, BC? Don't you mean AD?"
28-03-2018T20:37:28,TheBeckoner,Not sure. Sad hes gone tbh
28-03-2018T20:37:39,WIPKING,AD
28-03-2018T20:37:43,unsteddyphoenix,I am definitely not sad he's gone lol
28-03-2018T20:37:44,WIPKING,yes AD
28-03-2018T20:37:47,Bgrmystr2,"no, he definitely means BC lol"
28-03-2018T20:37:54,TheBeckoner,He was fun to mess with
28-03-2018T20:37:57,TheBeckoner,atleast to me
28-03-2018T20:37:59,WIPKING,"i did the math guys if 1 month in the comic is 7 years in real life than 1 year in the comci is 84 years in real life thus, if flora only lives for 10 more years the comic will end in 840 years in 2858 A.D"
28-03-2018T20:38:01,unsteddyphoenix,Comics going to take so long we're going to reset reality
28-03-2018T20:38:06,unsteddyphoenix,"Please, stop doing the maths."
28-03-2018T20:38:10,Ordithus,:ptv-unimpressed:
28-03-2018T20:38:12,TheBeckoner,I like that plan
28-03-2018T20:38:17,unsteddyphoenix,I could not describe how little I care
28-03-2018T20:38:17,Bellhead,The comic will end in 840 years. 4 milleniums ago.
28-03-2018T20:38:21,WIPKING,im glad tom saw it tho
28-03-2018T20:38:26,Bellhead,"Sorry, FIVE milleniums ago."
28-03-2018T20:38:29,qwe304,its even less if you dont count the ~month and a half worth of skips on the boat rides
28-03-2018T20:38:32,Bgrmystr2,I mean BC is probably more accurate than anything else in the statement.
28-03-2018T20:38:38,WIPKING,btw im 13 not 12
28-03-2018T20:38:43,TheBeckoner,w o a
28-03-2018T20:38:45,Twokinds,We're going into a 3 month time skip
28-03-2018T20:38:46,TheBeckoner,the diffrence
28-03-2018T20:38:51,qwe304,:cqwe304-parrotdad:
28-03-2018T20:38:54,BadFoMo,Cool.
28-03-2018T20:38:54,WIPKING,no where no
28-03-2018T20:38:57,TheBeckoner,at 20?
28-03-2018T20:39:00,Bellhead,THREE MONTHS?!
28-03-2018T20:39:05,WIPKING,please no tom
28-03-2018T20:39:06,unsteddyphoenix,I wouldnt be surprised if there was a timeskip at some point
28-03-2018T20:39:11,Bgrmystr2,:thinking:
28-03-2018T20:39:25,WIPKING,it takes tom 2 stupid long ass years for him to make a chapter
28-03-2018T20:39:27,Ordithus,"It's been a long two days, in comic"
28-03-2018T20:39:40,Ordithus,*2 amazing years
28-03-2018T20:39:46,Bgrmystr2,if the 3 month timeskip jumps to the end of the comic from where we are now.. and the rest of the comic ends up being flashback
28-03-2018T20:39:47,qwe304,"i mean after the conflict with euchre is resolbed, a timeskip could make sense"
28-03-2018T20:39:49,Bgrmystr2,I'm gonna flip a table
28-03-2018T20:40:04,Twokinds,"Sorry, typo, 3 year*"
28-03-2018T20:40:12,unsteddyphoenix,Dont think that conflict is gonna get resolved soon
28-03-2018T20:40:15,Bgrmystr2,Flip SEVEN tables
28-03-2018T20:40:15,Bellhead,...
28-03-2018T20:40:20,WIPKING,its been a long 2 mins in the comic for four days
28-03-2018T20:40:24,Bgrmystr2,:ptv-laugh:
28-03-2018T20:40:24,BadFoMo,...Ok.
28-03-2018T20:40:26,WIPKING,he joking
28-03-2018T20:40:28,unsteddyphoenix,"What naw, we need 30 years"
28-03-2018T20:40:38,TheBeckoner,567 years
28-03-2018T20:40:39,unsteddyphoenix,Floras child has taken over the world
28-03-2018T20:40:41,Bgrmystr2,haha
28-03-2018T20:40:44,MarvTheHugPharaoh,lol
28-03-2018T20:40:50,Bgrmystr2,"Okay, that I wanna see, phoenix"
28-03-2018T20:40:50,qwe304,tom cant draw babies so just timeskips the childs  baby stage
28-03-2018T20:40:56,TheBeckoner,^
28-03-2018T20:40:57,WIPKING,TOM when will the twokindss merch store open
28-03-2018T20:41:01,unsteddyphoenix,Trace is a retired hermit living alone being called in for ONE LAST JOB
28-03-2018T20:41:04,Bgrmystr2,"it already exists, WIP"
28-03-2018T20:41:08,WIPKING,no
28-03-2018T20:41:08,Ordithus,"3 millenium, and then we are into Sam and Colin"
28-03-2018T20:41:13,Bgrmystr2,yes
28-03-2018T20:41:16,Bgrmystr2,you can buy the books and artbook
28-03-2018T20:41:16,unsteddyphoenix,Yoooo
28-03-2018T20:41:18,WIPKING,it coming soon on the home page
28-03-2018T20:41:23,unsteddyphoenix,Timeskip to Sam and Colin lmao
28-03-2018T20:41:31,WIPKING,THE MEARCH STORE
28-03-2018T20:41:32,TheBeckoner,That'd be neat
28-03-2018T20:41:32,Bgrmystr2,"that'd be great, Ord xD"
28-03-2018T20:41:33,unsteddyphoenix,Thatd be hilarious
28-03-2018T20:41:36,Bellhead,That's on the site? It sens me to the keenspot shop.
28-03-2018T20:41:38,BadFoMo,...Will any of the other ladies be sporting a bump by then?
28-03-2018T20:41:44,TheBeckoner,Is there magic taht far ahead still?
28-03-2018T20:41:47,WIPKING,shirts hats and more coming in 845 years
28-03-2018T20:41:50,TheBeckoner,that*
28-03-2018T20:41:56,BadFoMo,"A little late, I know."
28-03-2018T20:42:07,unsteddyphoenix,"Considering how advanced the tech is, probably not"
28-03-2018T20:42:20,unsteddyphoenix,Magic hinders all technological advancement
28-03-2018T20:42:43,WIPKING,we will be way past mars in 2858 A.d
28-03-2018T20:42:59,WIPKING,"i did the math guys if 1 month in the comic is 7 years in real life than 1 year in the comci is 84 years in real life thus, if flora only lives for 10 more years the comic will end in 840 years in 2858 a.d"
28-03-2018T20:43:01,Ordithus,"Magic usually supplants technology, in most high magic settings"
28-03-2018T20:43:10,Bgrmystr2,"Wip, your math is already wrong to begin with"
28-03-2018T20:43:13,WIPKING,"1 month in the comic is 7 years in real life than 1 year in the comci is 84 years in real life thus, if flora only lives for 10 more years the comic will end in 840 years in 2858 a.d"
28-03-2018T20:43:15,Bgrmystr2,so stop
28-03-2018T20:43:16,unsteddyphoenix,Yeah
28-03-2018T20:43:20,qwe304,the comic's time fluctuates
28-03-2018T20:43:34,WIPKING,by minutes
28-03-2018T20:43:39,BadFoMo,Tom busted the math. Sorry.
28-03-2018T20:43:46,WIPKING,no he did not
28-03-2018T20:43:49,Bellhead,"Welp, if BGR is still here, I can safely say to you that the cause was only partially shoddy WIFI, as I am home and the chat is no longer lagging as badly, but there is still a bit of lag anytime anyone posts."
28-03-2018T20:44:12,unsteddyphoenix,Bgr lets just ignore him
28-03-2018T20:44:16,Bgrmystr2,lol bell
28-03-2018T20:44:48,Bellhead,Gotta get the Dimension out of the closet and throw some coal in it. See if XP still fires up.
28-03-2018T20:45:01,Bgrmystr2,xD gl
28-03-2018T20:45:20,Ordithus,Dimension?  Is this some old Dell or HP model?
28-03-2018T20:45:22,WIPKING,"srry tom but you and your ""side writers"" are slow"
28-03-2018T20:45:40,Bgrmystr2,"The Dell Dimension is a series, Ord"
28-03-2018T20:45:48,Bellhead,"Dell Dimension 8250, pentium D @ 2.4 Ghz."
28-03-2018T20:46:00,TheBeckoner,Overclock to 6ghz
28-03-2018T20:46:00,Ordithus,"OK, thanks.  Now I know~"
28-03-2018T20:46:01,Bgrmystr2,it's a series of prebuilt towers
28-03-2018T20:46:02,TheBeckoner,best idea
28-03-2018T20:46:02,Bellhead,"Light speed, yo."
28-03-2018T20:46:14,Ordithus,"Pentium D, oh my."
28-03-2018T20:46:14,Bgrmystr2,"none of them any good, of course"
28-03-2018T20:46:19,Bgrmystr2,but yknow
28-03-2018T20:46:28,qwe304,ive got one of those
28-03-2018T20:46:47,Bellhead,"Yeah. GREAT for old programs, crap for new ones."
28-03-2018T20:47:05,Ordithus,I would think so
28-03-2018T20:47:09,Bgrmystr2,I had a dell Vista tower.. it was trash till I got rid of all the garbage vista ran with
28-03-2018T20:47:15,Bgrmystr2,"then it was STILL garbage, but not as bad"
28-03-2018T20:47:23,Bellhead,"And judging by my newer computer's performance, it's more the fault of the programs than the processor."
28-03-2018T20:47:46,WIPKING,k well you guys are too old to uderstand anyways BYE!
28-03-2018T20:47:58,Bgrmystr2,:ptv-laugh:
28-03-2018T20:48:11,Bellhead,"""Too old""?! Dude, I still use casettes!"
28-03-2018T20:48:17,Ordithus,"There's a corrollary to Moore's law, Bell.  Software will bloat to take all of the performance improvements"
28-03-2018T20:48:19,TheBeckoner,I am not old...
28-03-2018T20:48:23,Bgrmystr2,He's right. I'm too old to understand young people's stupidity
28-03-2018T20:48:31,WIPKING,im 13 what are casettes
28-03-2018T20:48:38,Bgrmystr2,"I never will understand, even though I was a kid too at one point"
28-03-2018T20:48:39,TheBeckoner,myguyplz
28-03-2018T20:48:42,Bigboi182,Oh no...
28-03-2018T20:48:43,Bellhead,Hah. Kids.
28-03-2018T20:48:53,Bigboi182,The storm's a brewin...
28-03-2018T20:48:54,unsteddyphoenix,Bgr stop being baited by a kid lol
28-03-2018T20:49:01,Ordithus,"To think, I was young and dumb once.  Now I'm just old and dumb."
28-03-2018T20:49:12,Bigboi182,Everyone! Don't tell him.
28-03-2018T20:49:13,Bgrmystr2,"I'm not being baited, I'm doing this if my own free will phoenix. :i"
28-03-2018T20:49:26,MarvTheHugPharaoh,are you sure about that?
28-03-2018T20:49:31,Bgrmystr2,"yeah, I am"
28-03-2018T20:49:36,WIPKING,i have all the fuking harry potter movies on casette
28-03-2018T20:49:37,MarvTheHugPharaoh,really?
28-03-2018T20:49:41,Bgrmystr2,100%
28-03-2018T20:49:49,WIPKING,im not stupid and gay
28-03-2018T20:49:57,unsteddyphoenix,Youve been successfully provoked
28-03-2018T20:49:58,TheBeckoner,well the second one is debatable
28-03-2018T20:50:05,TheBeckoner,oops
28-03-2018T20:50:10,WIPKING,please respect kids who are much younger than you
28-03-2018T20:50:11,Bigboi182,Bgr. did you tell him?
28-03-2018T20:50:20,Bgrmystr2,":ptv-wondering: ""provoked"""
28-03-2018T20:50:25,Bellhead,"True that software will bloat to fit available performace, but using a newer computer designed to fit old programs will run lightning fast. That 8250 runs NFS III at BLISTERING speed."
28-03-2018T20:50:28,MarvTheHugPharaoh,respect your elders boyo
28-03-2018T20:50:30,Bigboi182,Please tell me you didn't...
28-03-2018T20:50:30,Bgrmystr2,wouldn't that require me to be mad or something
28-03-2018T20:50:37,unsteddyphoenix,No?
28-03-2018T20:50:42,Bgrmystr2,"Did I tell him what, Big"
28-03-2018T20:50:58,Bigboi182,"You know what I mean, Bgr..."
28-03-2018T20:51:07,WIPKING,Bgr called me gay first didn't mind it but then he said i wasa stupid kid
28-03-2018T20:51:10,Ordithus,"Quite so, Bell!"
28-03-2018T20:51:15,Bgrmystr2,I haven't told anyone anything.
28-03-2018T20:51:23,Bgrmystr2,What I said is what you see here.
28-03-2018T20:51:28,Bigboi182,Good. Keep it that way.
28-03-2018T20:51:31,WIPKING,M8 imma 360 no scope u if u dont shut up
28-03-2018T20:51:38,Bigboi182,Cool.
28-03-2018T20:51:41,Bigboi182,Do that.
28-03-2018T20:51:45,Bigboi182,Idc.
28-03-2018T20:51:51,MarvTheHugPharaoh,"wow, the good ol 360 days"
28-03-2018T20:51:57,Bellhead,Newb. NOBODY 360 no scopes to make a statement.
28-03-2018T20:52:00,WIPKING,i have a 3.5 KD i worke dhard for
28-03-2018T20:52:04,TheBeckoner,Ah Combak was right. Chat has now gone to shit.
28-03-2018T20:52:18,WIPKING,jk it 0.23
28-03-2018T20:52:25,Bigboi182,You just noticed Beck?
28-03-2018T20:52:27,unsteddyphoenix,"Hadnt happened when he said it, to be fair."
28-03-2018T20:52:28,Bellhead,Hah. My record was 432-1.
28-03-2018T20:52:30,Bgrmystr2,"Provoke - to anger, enrage, exasperate, or vex"
28-03-2018T20:52:31,MarvTheHugPharaoh,"Thats why I watched a Jurassic world evolution vid, Becku"
28-03-2018T20:52:32,unsteddyphoenix,Just all the youths
28-03-2018T20:52:34,Bgrmystr2,Pretty sure I am none of those.
28-03-2018T20:52:37,Bgrmystr2,so..
28-03-2018T20:52:43,unsteddyphoenix,Try looking at the other definitions fam
28-03-2018T20:52:47,WIPKING,hitlers kd is 6 millon to 1
28-03-2018T20:52:55,unsteddyphoenix,Sometimes words mean more than one thing
28-03-2018T20:52:56,Bigboi182,"Wait, how do i start a whisper chat?"
28-03-2018T20:52:57,TheBeckoner,Yeah but its happening now lol
28-03-2018T20:53:06,unsteddyphoenix,Yeah I justed muted him
28-03-2018T20:53:17,WIPKING,its called blocking
28-03-2018T20:53:25,TheBeckoner,Im watching Deep Space 69 atm Marv.
28-03-2018T20:53:27,unsteddyphoenix,Would recommend
28-03-2018T20:53:30,TheBeckoner,pretty good shit
28-03-2018T20:53:40,Bellhead,How mute?
28-03-2018T20:53:51,TheBeckoner,Ah good idea Phoenix.
28-03-2018T20:53:53,MarvTheHugPharaoh,🦖
28-03-2018T20:53:56,Bgrmystr2,"No, I guess you're right phoenix. I clearly have no free will of my own and do not make my own decisions to do something despite whether others are trying to bait or not."
28-03-2018T20:53:57,Ordithus,"""/ignore"" and then the name"
28-03-2018T20:53:57,SpazztasticKiwi,Tap the name you want to whisper. “/w” should show in your text box
28-03-2018T20:54:03,Bigboi182,So nobody knows how to start a whisper chat?
28-03-2018T20:54:13,WIPKING,no
28-03-2018T20:54:15,SpazztasticKiwi,That’s how I do it anyway
28-03-2018T20:54:17,Bigboi182,never mind.
28-03-2018T20:54:25,Bgrmystr2,"click their name, big"
28-03-2018T20:54:29,WIPKING,but imma make a new account so bye
28-03-2018T20:54:42,WIPKING,i was anly here for the stream that i missed
28-03-2018T20:54:54,Bellhead,Dang. I ignored him just barely too late.
28-03-2018T20:55:24,WIPKING,this is like a roblox server
28-03-2018T20:56:12,qwe304,"you can aslo chick their pfp and itl show some options, including ignoring"
28-03-2018T20:56:35,Bellhead,"Anyway, as I was saying before I forgot to... Running old programs on a machine built for new ones will run slower than an old machine, but will run new ones just fine. An old machine will naturally run new programs slower than a new machine."
28-03-2018T20:57:03,Bgrmystr2,That's.. not always the case
28-03-2018T20:57:07,Bgrmystr2,the former is not accurate
28-03-2018T20:57:09,Ordithus,"It really depends on the software, for the old program on the new machine."
28-03-2018T20:57:12,Bgrmystr2,"the latter is, generally"
28-03-2018T20:57:15,Ordithus,Usually it runs faster.
28-03-2018T20:57:18,Bgrmystr2,but depends a lot
28-03-2018T20:57:22,Twokinds,I just realized I forgot to note that Euchre and Rose are speaking Keidran on the previous page.
28-03-2018T20:57:28,SpazztasticKiwi,Uh oh
28-03-2018T20:57:32,Bellhead,"But, a new machine designed for old programs, ie single core processor, will run old programs dumb well."
28-03-2018T20:57:41,Twokinds,Ah well
28-03-2018T20:57:46,Ordithus,"But Flight Simulator X was made late in the single-cpu era, expecting higher clock rates"
28-03-2018T20:57:47,SpazztasticKiwi,Tiny issue. Easy fix
28-03-2018T20:57:49,Twokinds,It doesn't really matter
28-03-2018T20:57:52,Ordithus,It's still garbage on a new computer
28-03-2018T20:58:04,Bgrmystr2,Welll... you /should/ prolly go and fix that xD
28-03-2018T20:58:05,unsteddyphoenix,No my language brackets!
28-03-2018T20:58:18,SpazztasticKiwi,Nobody knows you made a mistake unless you mention it
28-03-2018T20:58:32,SpazztasticKiwi,😄
28-03-2018T20:58:43,Ordithus,"They are both fluent in human anyways, right?"
28-03-2018T20:58:45,unsteddyphoenix,If only mistakes worked like that...
28-03-2018T20:58:47,Bellhead,"Yeah, because it was designed for higher single-core processing speeds, whereas newer ones multitask better. It's a trade-off."
28-03-2018T20:59:04,Bgrmystr2,"Cores are more complicated than that, Bell"
28-03-2018T20:59:05,Bigboi182,"Honestly, what does keidran sound like to humans?"
28-03-2018T20:59:21,unsteddyphoenix,Chinese
28-03-2018T20:59:25,Ordithus,Latin but growly
28-03-2018T20:59:25,Twokinds,Yeah they both speak human of course
28-03-2018T20:59:35,Twokinds,French
28-03-2018T20:59:48,TheBeckoner,I was gonna say french lol
28-03-2018T20:59:49,WIPKING,you guys are mean.
28-03-2018T20:59:51,Ordithus,Keidran just got sexier
28-03-2018T20:59:51,SpazztasticKiwi,Pretty language. How are ya today Tom?
28-03-2018T20:59:52,Bigboi182,"Cool, I can communicate with them!"
28-03-2018T21:00:01,Bigboi182,And Basitin speak?
28-03-2018T21:00:04,Bellhead,"Are they? In all honesty, my Pentium D outperforms my Centrino in ALL my old programs, and is on par with the I3 I had for a while."
28-03-2018T21:00:10,Bigboi182,It's probably dutch.
28-03-2018T21:00:10,Twokinds,Except Raine who's Canadian.
28-03-2018T21:00:16,unsteddyphoenix,Well obviously.
28-03-2018T21:00:17,Ordithus,lol
28-03-2018T21:00:19,WIPKING,im just sitting here
28-03-2018T21:00:19,unsteddyphoenix,Goes without saying
28-03-2018T21:00:23,WIPKING,being ignored
28-03-2018T21:00:24,SpazztasticKiwi,So she’s super nice?
28-03-2018T21:00:26,TheGamePlayer,so Tom ever have your Vive lose video but still have audio?
28-03-2018T21:00:27,Bigboi182,True Tom
28-03-2018T21:00:37,WIPKING,because im 20 years younger
28-03-2018T21:00:37,Twokinds,I already answered that!
28-03-2018T21:00:44,Twokinds,You asked during the stream
28-03-2018T21:00:49,TheGamePlayer,oh
28-03-2018T21:00:58,TheGamePlayer,i didnt see that
28-03-2018T21:00:59,Twokinds,The answer was ytes.
28-03-2018T21:01:00,WIPKING,:ptv-angry:
28-03-2018T21:01:16,TheGamePlayer,ah ok any way to fix it?
28-03-2018T21:01:16,unsteddyphoenix,Id think youd be very used to answering repeat questions
28-03-2018T21:01:22,MarvTheHugPharaoh,ytes? you people and your gamer speak
28-03-2018T21:01:24,Twokinds,"Oh and also Rose, who's country"
28-03-2018T21:01:28,Twokinds,Although she tries to hide it
28-03-2018T21:01:33,unsteddyphoenix,She speaks bumpkin?
28-03-2018T21:01:43,MarshallMelon,"How tall is Rose then, if Euchre's 6'7?"
28-03-2018T21:01:47,SpazztasticKiwi,That’s not nice 😜
28-03-2018T21:01:51,WIPKING,who can hear me
28-03-2018T21:01:57,Twokinds,Yo Mashall
28-03-2018T21:02:03,Bigboi182,So basitins speak Dutch then?
28-03-2018T21:02:04,unsteddyphoenix,Is he? Big lad...
28-03-2018T21:02:05,MarshallMelon,Hey Tom
28-03-2018T21:02:05,Twokinds,I don't have an official Rose height
28-03-2018T21:02:09,SpazztasticKiwi,I can see you WIP
28-03-2018T21:02:10,Bigboi182,Or something...
28-03-2018T21:02:11,WIPKING,:ptv-angry:
28-03-2018T21:02:17,Bgrmystr2,She's about one Rose tall.
28-03-2018T21:02:19,Bgrmystr2,likely.
28-03-2018T21:02:23,MarshallMelon,"She looks to be around 6'1, assuming Euchre's accurate"
28-03-2018T21:02:28,MarvTheHugPharaoh,"is Euchre really tall, or is Rose really short?"
28-03-2018T21:02:31,MarshallMelon,Eyeballing was never my strength
28-03-2018T21:02:33,Ordithus,Yes
28-03-2018T21:02:40,WIPKING,can you tell all the people who blocked me that they are mean
28-03-2018T21:02:41,SpazztasticKiwi,But I’ll block you too if you keep up that attitude
28-03-2018T21:02:43,Twokinds,"Probably around Raine's height? I usually just give characters general, relative heights"
28-03-2018T21:02:54,Twokinds,Medium height women are people like Raine and Rose
28-03-2018T21:02:59,MarshallMelon,Literally relative in this case
28-03-2018T21:03:03,Bigboi182,Ah. Makes sense.
28-03-2018T21:03:09,SpazztasticKiwi,"I will tell them no such thing, WIP"
28-03-2018T21:03:11,unsteddyphoenix,\o/ hooray we're medium~
28-03-2018T21:03:11,WIPKING,im just going to mak e a new account :ptv-unimpressed:
28-03-2018T21:03:12,Bgrmystr2,"Brutal, kiwi xD"
28-03-2018T21:03:15,Twokinds,Short is Flora height (Maddie is even shorter)
28-03-2018T21:03:25,MarvTheHugPharaoh,"Ok, the most important question of all, Is Euchre the biggest wolf?"
28-03-2018T21:03:27,WIPKING,"flora is 5, 4"
28-03-2018T21:03:29,Bigboi182,"Yeah, like that'll work WIP..."
28-03-2018T21:03:31,WIPKING,btw
28-03-2018T21:03:33,unsteddyphoenix,But average heights differ on race though?
28-03-2018T21:03:36,MarshallMelon,"And then you've got HUEG, which is reserved for Adelaide"
28-03-2018T21:03:46,Bigboi182,"Maddie is young though, so..."
28-03-2018T21:03:51,WIPKING,it will work
28-03-2018T21:03:51,Ordithus,Laura was kinda short too
28-03-2018T21:04:03,Bigboi182,"It won't,trust me."
28-03-2018T21:04:04,WIPKING,you guys will never know who i am
28-03-2018T21:04:06,Twokinds,"Well, obviously, but I mean outside the comic lore"
28-03-2018T21:04:16,Bigboi182,We streamers know who's who.
28-03-2018T21:04:27,unsteddyphoenix,I see.
28-03-2018T21:04:30,Bigboi182,no matter if you change your name or not.
28-03-2018T21:04:31,MarshallMelon,"Welp, so much for my Height Chart 3 idea"
28-03-2018T21:04:42,unsteddyphoenix,Lol
28-03-2018T21:04:43,MarshallMelon,Need to go more seasonal for this one anyway
28-03-2018T21:05:09,unsteddyphoenix,What are some race-average heights?
