date,user,comment
28-11-2018T00:04:20,RimaDraws,heyyy
28-11-2018T01:12:23,Twokinds,:ctwokinds-RainezZz:
28-11-2018T02:04:26,SpazztasticKiwi,Oh night Tom
28-11-2018T02:31:18,SpazztasticKiwi,:ctwokinds-nibsbounce:believe I’ll go be unconscious for a few hours too 🛌
28-11-2018T09:25:27,Twokinds,:ctwokinds-kingtea:
28-11-2018T10:03:37,THETOXICATOR,Hi
28-11-2018T10:15:57,TerraTheWizard,:ctwokinds-natsducky:
28-11-2018T11:14:47,CuTeWoLf,:3
28-11-2018T11:16:08,TerraTheWizard,:ctwokinds-awoo:
28-11-2018T11:24:59,Sifty,"Hey what are basitins based off, if anything?"
28-11-2018T11:25:14,Sifty,"i've been wondering, and I always thought they kind of look like goats without horns and those weird rectangle eyes"
28-11-2018T11:28:48,Twokinds,They aren't directly based on any real animal.
28-11-2018T11:29:15,Twokinds,But their designs were largely inspired by the Viera from Final Fantasy.
28-11-2018T11:29:31,Twokinds,(Specifically FF:Tactics Advanced)
28-11-2018T11:30:31,Twokinds,"Well, I shouldn't say 'largely' as they're not particularly similiar now. 'originally inspired' is more accurate."
28-11-2018T11:38:50,TerraTheWizard,:ctwokinds-natkeith:
28-11-2018T12:00:13,NibblyBot,New Patreon Post: Tail Trapped https://www.patreon.com/posts/tail-trapped-22985041
28-11-2018T12:27:56,TerraTheWizard,:ctwokinds-maddiessparkles:
28-11-2018T13:10:34,Twokinds,:ctwokinds-traceflohug:
28-11-2018T13:15:26,EggRollss,Tail trapped will be number 1 for Sketch
28-11-2018T13:16:01,TerraTheWizard,:ctwokinds-floraquestion:
28-11-2018T13:16:46,EggRollss,Do you agree or no
28-11-2018T13:17:49,TerraTheWizard,i don't understand what you mean
28-11-2018T13:19:14,EggRollss,The sketch that Tom drew scroll up a little and Nibbly bot posted it
28-11-2018T13:19:42,EggRollss,I think it will be #1 place on Sunday
28-11-2018T13:20:17,TerraTheWizard,"oh, for the colour vote"
28-11-2018T13:20:25,EggRollss,Ya
28-11-2018T13:20:50,TerraTheWizard,"ya confused me with ""number 1 for Sketch"""
28-11-2018T13:21:35,EggRollss,Sorry meant color still think it will be one
28-11-2018T13:32:05,Xexanoth,touch fluffy tal
28-11-2018T13:36:07,CrimsonQuill,He just wants something to snuggle with.
28-11-2018T13:37:34,CrimsonQuill,Tom-I need your opinion on this. Hot milk. Camomile tea. An evening reading. Would this qualify to you as a great way to spend time before bed?
28-11-2018T13:41:03,Twokinds,"Uh... I suppose so, yeah."
28-11-2018T13:41:20,CrimsonQuill,Thanks! :ptv-victory:
28-11-2018T13:42:13,CrimsonQuill,It's just that I'm doing something like that tonight... (and have been for the past three days). It really helps me relax...especially when i read manga or a history book.
28-11-2018T13:42:29,CrimsonQuill,"Actually, have you ever heard of RG Veda?"
28-11-2018T13:45:04,TerraTheWizard,:ctwokinds-floraquestion:
28-11-2018T13:45:17,CrimsonQuill,??
28-11-2018T13:59:39,Twokinds,No
28-11-2018T14:00:10,CrimsonQuill,It's really good.
28-11-2018T14:00:17,CrimsonQuill,My little brother introduced me to it.
28-11-2018T14:00:38,CrimsonQuill,I've only read the first two of the three volumes-we haven't got the third yet.
28-11-2018T14:00:59,CrimsonQuill,"It's basically based on the Hindu Text the Veda, and it is reallly well written."
28-11-2018T14:02:39,CrimsonQuill,And drwan.
28-11-2018T14:02:43,CrimsonQuill,Drawn.
28-11-2018T14:02:46,CrimsonQuill,It's a manga
28-11-2018T14:18:36,SpazztasticKiwi,Someone tell the headache to go away
28-11-2018T14:19:14,CrimsonQuill,"@SpazztasticKiwi A quick rinse in a hot shower, or a cup of tea, might help."
28-11-2018T14:35:51,Twokinds,"Go away, headache! Shoo!"
28-11-2018T14:35:56,Twokinds,You don't belong in this world!
28-11-2018T14:36:16,CrimsonQuill,Return to the black pit whence you came!
28-11-2018T14:38:28,SpazztasticKiwi,"Speaking of black pits, Bagheera has arrived to demand pets"
28-11-2018T14:38:51,CrimsonQuill,I'm thinking more about Moria from lord of the Rings.
28-11-2018T14:46:29,CrimsonQuill,"Well, i'm off to play Skyrim for a little bit. Then book and bed."
28-11-2018T14:46:37,CrimsonQuill,Pray I don't get hit by a giant.
28-11-2018T14:47:23,Twokinds,Good luck!
28-11-2018T15:00:14,NibblyBot,New Patreon Post: November Color Poll! https://www.patreon.com/posts/november-color-23003387
28-11-2018T15:05:28,Mippy,How to eat pudding without spoon? :ctwokinds-floraquestion:
28-11-2018T15:06:46,TerraTheWizard,"so many choices, can't pick which to vote on :ctwokinds-clovisgirl_shake:"
28-11-2018T15:08:14,Mippy,"I know righ, all I know is I definitely want sad Trace. Rose’s childhood is also a contender"
28-11-2018T15:09:21,TerraTheWizard,"like, i have to vote for my one, but then what other choices :ctwokinds-nataniAAAAshake:"
28-11-2018T15:09:50,SpazztasticKiwi,Got a good chance what all’s gonna be popular. Likely gonna be some ties
28-11-2018T15:12:29,TerraTheWizard,"ok, think i've decided on what to vote for...."
28-11-2018T15:13:57,Mippy,Fish and chips for lunch. Yum Yum
28-11-2018T15:14:00,CrimsonQuill,"Of course, I'm going with my suggestion-why not? But others too will be favoured."
28-11-2018T15:14:12,CrimsonQuill,Fish and chips...been a long time since I had that.
28-11-2018T15:15:07,Mippy,I’ve been waiting all week for fish and chips day at the school
28-11-2018T15:16:43,CrimsonQuill,"Anyone find it odd that not all these sketches are out yet, and that the Sunday Stream Sketches are only now coming out?"
28-11-2018T15:18:00,Mippy,"No, Tom explains why. He had extras."
28-11-2018T15:18:13,CrimsonQuill,I didn't see that.
28-11-2018T15:18:16,CrimsonQuill,Hmmm...
28-11-2018T15:19:44,Xexanoth,i just hope one of the sam&Colin ones gets colored
28-11-2018T15:20:13,SpazztasticKiwi,Colin is a good :ctwokinds-awoo:
28-11-2018T15:20:20,SpazztasticKiwi,So plush
28-11-2018T15:21:02,SpazztasticKiwi,I’ve been trying to convince myself to get up and make food for the past 10 minutes
28-11-2018T15:21:05,CrimsonQuill,"A living pillow, is Colin"
28-11-2018T15:21:26,CrimsonQuill,@SpazztasticKiwi that was me before I finally got myself curry for dinner.
28-11-2018T15:21:34,CrimsonQuill,"As in, the curry i cooked."
28-11-2018T15:23:09,Xexanoth,"the sam and colin watch TV one would be great, but alas i don't have a vote... curse you money"
28-11-2018T15:23:17,Xexanoth,"or rather, lack of money"
28-11-2018T15:32:47,Mippy,I always make sure I have money for Tom :ctwokinds-adiracoin:
28-11-2018T15:39:17,Mippy,"Yup, gotta pay that man $10 a month for the privilege of not having my suggestions drawn. :ctwokinds-NataniHAHA: Love ya Tom!"
28-11-2018T15:39:40,Twokinds,:ctwokinds-rainehappy:
28-11-2018T15:39:46,CrimsonQuill,"But, oh boy, is it worth it when they are!"
28-11-2018T15:40:08,CrimsonQuill,"Case in point-my favourite halfkind, encased in 500kg Mjolnir armour!"
28-11-2018T15:40:25,CrimsonQuill,As pictured by our resident Drawing God.
28-11-2018T15:40:54,SpazztasticKiwi,I got one and a half done
28-11-2018T15:40:55,TerraTheWizard,:ctwokinds-katdryer:
28-11-2018T15:41:05,SpazztasticKiwi,I want to figure that’s enough for me
28-11-2018T15:41:07,Xexanoth,step 1: get better suggestion /s
28-11-2018T15:41:33,Mippy,"Yeah, congrats on that Crimson. I’m still waiting for the day i get my first one. I’ll probably startle my house mates with my fangirling"
28-11-2018T15:41:33,CrimsonQuill,"Yeah, my next suggestion'll be something that isn't a crossover."
28-11-2018T15:41:45,CrimsonQuill,@Mippy You'll get there.
28-11-2018T15:42:14,Mippy,(Still waiting for my print though) (grumble)
28-11-2018T15:42:27,CrimsonQuill,"As for fan reacting, it was 2 in the morning when i realised that it was indeed Raine in Halo armor, and I had to stop myself from waking everyone up with thankyous."
28-11-2018T15:43:05,Mippy,I’m more of a sqeeeing at the top of my lungs type
28-11-2018T15:43:47,Xexanoth,"yeah, crossovers rarely works...(he says as if he doesn't have one in his suggestion pile)"
28-11-2018T15:44:55,SpazztasticKiwi,I’m either a “do nothing but stare” type or “accidental R2D2 noise” type
28-11-2018T15:45:03,Dadrobit,D: My Book Club sketch isn't an option!
28-11-2018T15:45:05,CrimsonQuill,"Well, my idea evolved from a whole Halo Fireteam with Twokinds characters (That's about 4-5 Spartans) to just Raine and AI Red."
28-11-2018T15:45:13,SpazztasticKiwi,Not much in between
28-11-2018T15:45:36,CrimsonQuill,I find it funny that TOm became a little 'creative' with AI Red's gender...
28-11-2018T15:45:54,CrimsonQuill,I already have a full backstory in my head for when the picture is posted.
28-11-2018T15:46:24,TerraTheWizard,was going to check my stats page to see how many of my suggestions have been drawn
28-11-2018T15:46:41,TerraTheWizard,but it;s on my external hdd & i can't be bothered to reach behind me & grab it
28-11-2018T15:46:45,Dadrobit,"And with my votes in, I'm off again!"
28-11-2018T15:46:54,CrimsonQuill,Cheerio Dadrobit!
28-11-2018T15:46:55,Xexanoth,i'm at 0/0 so technically Tom has drawn 100% of my suggestions XD
28-11-2018T15:47:27,Xexanoth,:ptv-sneakysmirk:
28-11-2018T15:47:38,Dadrobit,"Spent the last 4 hours scouring Phoenix for tools and materials to fetch for pops, and now I'm back out for more fetching."
28-11-2018T15:47:52,TerraTheWizard,"heck it, ima check the stats file"
28-11-2018T15:48:08,CrimsonQuill,I have a flask of Camomile Tea.
28-11-2018T15:48:12,Mippy,And what do you mean “better suggestions” . Who doesn’t wand Basitin butt?
28-11-2018T15:48:23,CrimsonQuill,Ummm...I don't really.
28-11-2018T15:48:33,Mippy,Ummm ....I just had a Diet Pepsi
28-11-2018T15:48:33,Xexanoth,apparently not enough people
28-11-2018T15:48:36,CrimsonQuill,I'd rather have a mage battle of some sort.
28-11-2018T15:48:39,SpazztasticKiwi,All y’all better be jealous
28-11-2018T15:48:42,Xexanoth,i go for cuteness
28-11-2018T15:48:44,Xexanoth,and cuddles
28-11-2018T15:48:44,SpazztasticKiwi,I got waffles
28-11-2018T15:48:50,CrimsonQuill,So? I had curry.
28-11-2018T15:48:51,Xexanoth,or bellyrubs
28-11-2018T15:48:54,CrimsonQuill,GREEN curry
28-11-2018T15:49:06,Mippy,Fish and Chips!
28-11-2018T15:49:11,CrimsonQuill,@Xenanoth Hot chocolate and Cosy scenes are my thing.
28-11-2018T15:49:30,TerraTheWizard,so according to my stats i'm up to 4.33 suggestions drawn
28-11-2018T15:49:37,CrimsonQuill,Ok
28-11-2018T15:49:41,TerraTheWizard,the .33 being from the 3 way share on the pirate zen sketch
28-11-2018T15:49:42,CrimsonQuill,WHat does that mean?
28-11-2018T15:49:46,CrimsonQuill,Oh
28-11-2018T15:50:17,Mippy,"Oh well, I’m going Holiday next month. Anyone want Keith posing nude in a Santa hat?"
28-11-2018T15:50:35,SpazztasticKiwi,Maybe the sugar will make the headache “shoo” as Tom put it
28-11-2018T15:50:57,CrimsonQuill,"@SpazztasticKiwi Careful you don't get a sugar rush, mate,"
28-11-2018T15:50:59,TerraTheWizard,"current most suggestions sketched winner is unsteddy, with 15.5"
28-11-2018T15:51:04,SpazztasticKiwi,..all I saw immediately was “nude in a Santa hat”
28-11-2018T15:51:23,Mippy,XD
28-11-2018T15:51:33,CrimsonQuill,How's about Flora as a racecar driver?
28-11-2018T15:51:34,SpazztasticKiwi,I mean
28-11-2018T15:51:36,CrimsonQuill,Or a sniper
28-11-2018T15:51:38,SpazztasticKiwi,I was all for it
28-11-2018T15:51:46,SpazztasticKiwi,But I needed other context too
28-11-2018T15:52:00,SpazztasticKiwi,Flora as a sniper...
28-11-2018T15:52:04,CrimsonQuill,Yeah.
28-11-2018T15:52:12,SpazztasticKiwi,“Is THIS how you point it?”
28-11-2018T15:52:13,CrimsonQuill,In full Royal Marines kit and everything
28-11-2018T15:52:16,SpazztasticKiwi,“NO”
28-11-2018T15:52:25,CrimsonQuill,Crosshair trained on a target.
28-11-2018T15:52:29,Mippy,"Naw, I’ve got a non nude suggestion for holidays"
28-11-2018T15:52:43,MrMongMong,Is it Basitans?
28-11-2018T15:52:55,CrimsonQuill,I'm typing this whilst listening to the Deja Vu song. Cue my endless headbanging.
28-11-2018T15:53:00,Mippy,Would it be anything else Mong?
28-11-2018T15:53:46,TerraTheWizard,kamaro12 is 2nd with 12.5 suggestions sketched
28-11-2018T15:53:51,CrimsonQuill,Good music always makes me move to the tune.
28-11-2018T15:53:52,TerraTheWizard,dadro is 3rd with 10
28-11-2018T15:53:58,CrimsonQuill,Wo's 4th?
28-11-2018T15:54:01,CrimsonQuill,who
28-11-2018T15:54:10,TerraTheWizard,"foxpie, i think"
28-11-2018T15:54:13,TerraTheWizard,9
28-11-2018T15:54:16,Mippy,I want to revisit the AU where Adelaide adopted Zen and Nat
28-11-2018T15:54:23,CrimsonQuill,"What place am I, given I have one sketch?"
28-11-2018T15:54:28,TerraTheWizard,"oh, werekeidran also has 9"
28-11-2018T15:54:39,TerraTheWizard,and menke
28-11-2018T15:55:25,TerraTheWizard,is your patreon name the same as your picarto name?
28-11-2018T15:55:30,CrimsonQuill,yep
28-11-2018T15:55:46,CrimsonQuill,"Actually, how do I look up stats?"
28-11-2018T15:56:16,TerraTheWizard,"ok, so because it's not been posted yet, 0"
28-11-2018T15:56:22,CrimsonQuill,ok
28-11-2018T15:56:33,SpazztasticKiwi,Can cats have waffles? Asking for a (very hungry) friend
28-11-2018T15:56:41,CrimsonQuill,No.
28-11-2018T15:57:12,CrimsonQuill,"Then again, technically they can't have my aunt's steak because that was for dinner. That didn't stop one from trying."
28-11-2018T15:57:25,TerraTheWizard,i should really convert this stats file to a spreadsheet
28-11-2018T15:57:47,TerraTheWizard,because currently it's an awkward .txt
28-11-2018T15:58:04,CrimsonQuill,"Well, I'm off. I've got a long chapter of TK to read, and a flask full of tea to drink."
28-11-2018T15:58:08,CrimsonQuill,Goodnight!
28-11-2018T15:58:13,CrimsonQuill,:ptv-greetings::ptv-greetings::ptv-greetings:
28-11-2018T15:58:14,TerraTheWizard,cya crimson
28-11-2018T15:59:19,Xexanoth,have fun
28-11-2018T16:02:12,TerraTheWizard,for anyone who wants to have a look through the stats https://pastebin.com/84XUb1CX
28-11-2018T16:03:16,Twokinds,Wow neat :D
28-11-2018T16:04:43,Xexanoth,:ptv-sneakysmirk: SCIENCE!
28-11-2018T16:05:05,Twokinds,Seems like a lot of work!
28-11-2018T16:05:14,Twokinds,That's so many sketches.
28-11-2018T16:05:42,TerraTheWizard,"this was how i found those 4 sketches that were missing the tags, lol"
28-11-2018T16:05:58,Twokinds,Aaaah makes sense
28-11-2018T16:06:13,TerraTheWizard,but man i really should convert this to a spreadsheet
28-11-2018T16:06:30,TerraTheWizard,so shared sketches get tallied better
28-11-2018T16:06:44,TerraTheWizard,"rather than just adding to a ""total wins"" sum"
28-11-2018T16:07:12,iliar,Hm I must have at least two color winners
28-11-2018T16:07:16,TerraTheWizard,because some of those people have had like 5 shared ones that have added up to full numbers
28-11-2018T16:09:07,SpazztasticKiwi,What about the .5 for me and that other guy with the Nibbly/Sythe sketch
28-11-2018T16:10:29,SpazztasticKiwi,"And how does the Nora cards factor into color vote tallies? Like if “A” carded “B’s” sketch to be colored, how would that be tallied?"
28-11-2018T16:10:52,TerraTheWizard,nora cards score for the sponsor only
28-11-2018T16:11:39,TerraTheWizard,"if/when i make the spreadsheet i'll make more stats for ""got carded"""
28-11-2018T16:12:14,SpazztasticKiwi,Sounds like a club bouncer’s favorite line
28-11-2018T16:12:19,SpazztasticKiwi,Bad joke
28-11-2018T16:12:21,SpazztasticKiwi,I know
28-11-2018T16:18:27,SpazztasticKiwi,Extensive work though. Nerd:ctwokinds-katdryer:
28-11-2018T16:18:48,TerraTheWizard,"hi yes, am nerd :ctwokinds-lynnsmile:"
28-11-2018T16:19:00,SpazztasticKiwi,A good nerd
28-11-2018T16:19:10,SpazztasticKiwi,A favorite nerd:ctwokinds-nibsbounce:
28-11-2018T16:19:51,TerraTheWizard,:ctwokinds-wink:
28-11-2018T16:25:23,Twokinds,"Pff, not me! I'm totally cool!"
28-11-2018T16:25:32,Twokinds,:ptv-dealwithit:
28-11-2018T16:30:52,TerraTheWizard,:ctwokinds-nibsbounce:
28-11-2018T16:30:58,SpazztasticKiwi,Neeeeeerrrrrrrd
28-11-2018T16:31:23,SpazztasticKiwi,:ctwokinds-nibsbounce:
28-11-2018T16:34:45,SpazztasticKiwi,Tom you’re probably the biggest nerd of them all. Don’t worry tho - there’s plenty people out there stay actually like nerds
28-11-2018T16:35:05,THETOXICATOR,Yup
28-11-2018T16:36:39,Xexanoth,nerds? pfff next thing you're gonna say we're furries
28-11-2018T16:36:56,TerraTheWizard,:ctwokinds-floraquestion:
28-11-2018T16:44:06,SpazztasticKiwi,How dare you Xex :ctwokinds-flomad:
28-11-2018T16:44:17,SpazztasticKiwi,I’d never
28-11-2018T16:45:06,Twokinds,Yeah! Ridiculous!
28-11-2018T16:45:49,Dadrobit,"Hm, I did my spreadsheet differently. I just gave out an extra point to both owners of sketches when they're shared."
28-11-2018T16:47:15,Dadrobit,"Unsteddy has 18 by my count, and I have 11. Third is a 4 way tie between myself, amenon, Foxpie, and Kamaro12."
28-11-2018T16:47:37,Dadrobit,Second is SomeOtherTom at 12.
28-11-2018T16:48:06,Dadrobit,"Also, I need to update my list, it hasn't been updated in maybe 2-3 weeks, so some names might change around."
28-11-2018T16:58:25,Bgrmystr2,"aw, Quill left already"
28-11-2018T16:58:29,Bgrmystr2,feelsbad
28-11-2018T16:58:44,Bgrmystr2,gmornin guys
28-11-2018T16:59:03,TerraTheWizard,hey bgr
28-11-2018T16:59:09,Bgrmystr2,"he called Raine a halfkind which isn't true, but eh, can't fix it now. he just ran off"
28-11-2018T16:59:15,SpazztasticKiwi,All this sketch tracking
28-11-2018T16:59:19,SpazztasticKiwi,So much math
28-11-2018T16:59:31,Bgrmystr2,an hour ago..
28-11-2018T16:59:41,Bgrmystr2,also yeah I rather prefer dadro's approach myself
28-11-2018T17:00:02,Bgrmystr2,cuz it makes more sense to add each person's name to the suggestion when it was shared
28-11-2018T17:00:23,Dadrobit,"Okay, updated. Second Place is now tied between Kam and SOT after SOT got The Assasin Sisters."
28-11-2018T17:00:24,Bgrmystr2,"cuz if you don't, that's not including every suggestor or every image"
28-11-2018T17:00:50,SpazztasticKiwi,Would these tallies include times if/when one of us did an in-person sketch
28-11-2018T17:00:53,Dadrobit,Unsteddy is still absurdly far ahead.
28-11-2018T17:01:13,Dadrobit,"No, I'm only counting sketches on Patreon"
28-11-2018T17:01:42,SpazztasticKiwi,Though not sure what impact that number would be
28-11-2018T17:02:03,Bgrmystr2,"what do you mean in-person sketch, kiwi?"
28-11-2018T17:02:29,SpazztasticKiwi,Like if Dadro met tom at a con and commissioned a sketch there
28-11-2018T17:02:52,SpazztasticKiwi,Why does autocorrect sometimes not decide to capitalize Tom?
28-11-2018T17:04:30,RimaDraws,hii
28-11-2018T17:04:37,Dadrobit,o/ Rima
28-11-2018T17:04:55,RimaDraws,sup
28-11-2018T17:05:33,Dadrobit,Going through tallying everyone and their erspective sketches.
28-11-2018T17:06:21,RimaDraws,oh fun
28-11-2018T17:06:27,RimaDraws,i dont feel well
28-11-2018T17:07:20,Bgrmystr2,"but those aren't sunday sketches, kiwi"
28-11-2018T17:07:35,Bgrmystr2,that only applies to people who can afford to go to the conventions
28-11-2018T17:07:47,Dadrobit,"I have access to around 70 con sketches, but almost none of them have names attatched."
28-11-2018T17:09:13,Dadrobit,"Like, I know Tamer has a few, and a couple are Mihari, but most all of them are just signed by Tom and dated."
28-11-2018T17:09:20,SpazztasticKiwi,And I thought I had an obsession to meet people
28-11-2018T17:10:10,Dadrobit,"Also, sorry to hear that Rima"
28-11-2018T17:22:55,ThingsAreMoving,:ctwokinds-nibsbounce: o/ everyone!
28-11-2018T17:23:15,TerraTheWizard,:ctwokinds-nibsbounce:
28-11-2018T17:23:43,Dadrobit,o/
28-11-2018T17:24:31,RimaDraws,now work is mad cause i left to go home when i didn't feel well so they said no more overtime for a while
28-11-2018T17:27:30,ThingsAreMoving,I mean... if your health is not good enough for normal work then it's logical to not let you overwork yourself.
28-11-2018T17:28:28,ThingsAreMoving,"what kind of work are you doing, anyway?"
28-11-2018T17:29:18,RimaDraws,i mean i literally felt i could puke because of my period or something i ate. and i work at jack daniels where we bottle the stuff
28-11-2018T17:29:41,RimaDraws,its prety much anything from packaging to bottling or doing pour up something
28-11-2018T17:31:41,ThingsAreMoving,"yeah, you don't want to puke in an environment like that"
28-11-2018T17:32:10,ThingsAreMoving,food/drink industry has looooots of safety rules about contamination
28-11-2018T17:32:31,RimaDraws,well its like they think i totally planned to be sick
28-11-2018T17:32:35,RimaDraws,which i didnt
28-11-2018T17:33:11,ThingsAreMoving,that's a shitty attitude and could be interpreted as mobbing
28-11-2018T17:34:01,RimaDraws,mhmm
28-11-2018T17:34:07,Bgrmystr2,mobbing...? Like.. everyone getting together and beating someone?
28-11-2018T17:34:07,ThingsAreMoving,"but like I said, I'd cut your overtime to let you get back to your 100%  too"
28-11-2018T17:34:12,Bgrmystr2,not sure that's the right term.
28-11-2018T17:34:23,ThingsAreMoving,it is
28-11-2018T17:34:45,Bgrmystr2,"well, I'd say it isn't, but okay. xD"
28-11-2018T17:34:52,RimaDraws,she was like well we dont want you to do anymore overtime for a while
28-11-2018T17:35:12,Bgrmystr2,"you're probably overworking, Rima"
28-11-2018T17:35:33,RimaDraws,well i need the money after my $200 was stolen but how can i work sick
28-11-2018T17:36:22,Bgrmystr2,"a lot of times, sickness is just stress"
28-11-2018T17:36:26,Bgrmystr2,physically and mentally.
28-11-2018T17:36:52,RimaDraws,yea ive been stressed out over getting my bills paid
28-11-2018T17:36:52,ThingsAreMoving,can confirm
28-11-2018T17:38:00,ThingsAreMoving,can you borrow the money from someone and pay it back in installments when you get back on your feet?
28-11-2018T17:38:16,RimaDraws,i dont like asking my grandparents or my dad even if they offered
28-11-2018T17:39:14,RimaDraws,this is why ive been taking commissions or working when i can
28-11-2018T17:39:20,ThingsAreMoving,"well it's up to you, but think if stressing over it is worth more than just letting other people help you"
28-11-2018T17:41:27,RimaDraws,i know thanks...
28-11-2018T17:58:18,SpazztasticKiwi,:ctwokinds-nibsdance:
28-11-2018T17:59:34,ThingsAreMoving,:ctwokinds-nibsbounce:
28-11-2018T18:01:31,Mippy,:ctwokinds-nibsdance:
28-11-2018T18:01:36,TerraTheWizard,:ctwokinds-nibsbounce:
28-11-2018T18:05:53,RimaDraws,well now i feel shitty
28-11-2018T18:24:01,SpazztasticKiwi,Cozy up. Grab a movie
28-11-2018T18:24:17,SpazztasticKiwi,I’m playing Thumbellina myself rn
28-11-2018T18:28:05,RimaDraws,i have that movie
28-11-2018T18:28:09,RimaDraws,i love it
28-11-2018T18:36:40,TerraTheWizard,:ctwokinds-RainezZz:
28-11-2018T18:38:07,SpazztasticKiwi,Watched treasure planet the other day
28-11-2018T18:38:24,SpazztasticKiwi,After thumbellina I might look for something else
28-11-2018T18:47:15,Xexanoth,watch megamind
28-11-2018T18:47:19,Xexanoth,it's awesome
28-11-2018T18:47:26,Bgrmystr2,2nded ^
28-11-2018T18:47:29,Bgrmystr2,it's a great movie
28-11-2018T18:47:39,Bgrmystr2,love megamind
28-11-2018T18:49:36,SpazztasticKiwi,Megamind was a treat
28-11-2018T18:50:18,SpazztasticKiwi,I need to pop in Deadpool 2
28-11-2018T18:55:29,ThingsAreMoving,I think the last animated movie that I genuinely enjoyed was The Emperor's New Groove
28-11-2018T18:58:37,SpazztasticKiwi,Squeaker squeak squeaken
28-11-2018T19:01:54,ThingsAreMoving,"Pull the lever, Kronk!"
28-11-2018T19:02:06,SpazztasticKiwi,Wrong levaaaaaaaaaaaaaaaaaaar
28-11-2018T19:02:28,ThingsAreMoving,:ctwokinds-clovisgirl_shake:
28-11-2018T19:02:51,SpazztasticKiwi,Do you remember the nostril flare of total rejection?
28-11-2018T19:02:53,Bgrmystr2,I don't even know why we have that lever. :u
28-11-2018T19:04:54,SpazztasticKiwi,"“Uh, this lever?” “Eh. I worked out the bugs.” “Just checkin”"
28-11-2018T19:06:39,RimaDraws,i also have all dogs go to heaven and balto
28-11-2018T19:07:13,SpazztasticKiwi,All dog go to heaven. I forgot that one till it popped in my recommended after thumbellina
28-11-2018T19:07:41,SpazztasticKiwi,Last voice actor for it passed this year I believe
28-11-2018T19:10:11,SpazztasticKiwi,Deadpool 2 is in
28-11-2018T19:51:55,RimaDraws,he did
28-11-2018T20:00:18,CrRAR,what he do
28-11-2018T21:05:45,SpazztasticKiwi,Deadpool is a mess
28-11-2018T21:10:20,SpazztasticKiwi,Yukio may be my favorite
28-11-2018T21:38:21,SpazztasticKiwi,🍲
28-11-2018T22:41:44,Twokinds,:ctwokinds-daydreamingkat:
28-11-2018T22:46:10,unsteddyphoenix,<3
28-11-2018T23:03:14,Ordithus,:ctwokinds-awoo:
28-11-2018T23:30:23,CrRAR,[Oh n-no...]*:ctwokinds-zenshocked:
28-11-2018T23:30:33,CrRAR,":ctwokinds-zenshocked:*[...I have no awoo, and I must screaaam]"
28-11-2018T23:30:40,CrRAR,:ctwokinds-clovisgirl_shake:
28-11-2018T23:30:58,Ordithus,:ctwokinds-smug:
28-11-2018T23:31:08,Bgrmystr2,:ptv-wondering:
28-11-2018T23:32:07,CrRAR,[AW-]*:ctwokinds-karenOOO:*[!]
28-11-2018T23:34:41,SpazztasticKiwi,:ctwokinds-daydreamingkat:yo Tom
28-11-2018T23:34:59,SpazztasticKiwi,And did someone say awoooooooo?:ctwokinds-awoo::ctwokinds-awoo::ctwokinds-awoo::ctwokinds-awoo:
28-11-2018T23:35:18,SpazztasticKiwi,I love how well they line up
28-11-2018T23:35:56,CrRAR,"dem 'ooo's, indeed~"
28-11-2018T23:36:19,SpazztasticKiwi,"Ord, we must know"
28-11-2018T23:36:28,Ordithus,"Careful, you're going to start a howl"
28-11-2018T23:36:39,SpazztasticKiwi,How is thou house situation going
28-11-2018T23:36:58,Ordithus,I've got estimates for fixing the problems
28-11-2018T23:37:33,SpazztasticKiwi,...and has the inspector been made aware of their failure
28-11-2018T23:37:47,Ordithus,Not yet
28-11-2018T23:37:57,Ordithus,So. Much. To do.
28-11-2018T23:38:18,SpazztasticKiwi,"Because honestly they should be held responsible for the fixing, if not just part of it"
28-11-2018T23:39:04,Ordithus,"Yeah, I'll give him a call tomorrow."
28-11-2018T23:39:21,Ordithus,I'll also be consulting with a lawyer about feasibility
